id,display_name,primary_location_display_name,cited_by_count,doi,crossref_call,publication_year,type,is_retracted,cited_by_percentile_year_min,primary_topic_display_name,primary_topic_domain_display_name,primary_topic_subfield_display_name,primary_location_source_host_organization_name,open_access_is_oa,language,primary_topic_field_display_name,update_nature
https://openalex.org/W2027799161,RETRACTED ARTICLE: Fabrication of Lotus-Type Porous Al-Si Alloys Using Thermal Decomposition Method Combined with Mold Casting and Continuous Casting Techniques,Metallurgical and Materials Transactions B-process Metallurgy and Materials Processing Science,0,https://doi.org/10.1007/s11663-013-9878-9,https://api.labs.crossref.org/works/https://doi.org/10.1007/s11663-013-9878-9?mailto=christian.hauschke@tib.eu,2013,article,True,0,Manufacture and Application of Cellular Materials,Physical Sciences,Mechanical Engineering,Springer Science+Business Media,True,en,Engineering,Retraction;Crossmark Retraction
https://openalex.org/W2027967247,Preanalytical Quality in Clinical Chemistry Laboratory,Clinical Laboratory,0,https://doi.org/10.7754/clin.lab.2012.121244,https://api.labs.crossref.org/works/https://doi.org/10.7754/clin.lab.2012.121244?mailto=christian.hauschke@tib.eu,2013,article,True,0,Laboratory Medicine and Testing Procedures,Health Sciences,Physiology,Clinical Laboratory Publications,False,en,Medicine,Retraction
https://openalex.org/W2028505249,RETRACTED: Nuclear Materials IV,Journal of Nuclear Materials,0,https://doi.org/10.1016/j.jnucmat.2011.07.022,https://api.labs.crossref.org/works/https://doi.org/10.1016/j.jnucmat.2011.07.022?mailto=christian.hauschke@tib.eu,2011,article,True,0,Chemistry of Actinide and Lanthanide Elements,Physical Sciences,Inorganic Chemistry,Elsevier BV,True,en,Chemistry,Retraction
https://openalex.org/W2028603158,Notice of Violation of IEEE Publication Principles: Automation of network management with artificial intelligence concepts,,0,https://doi.org/10.1109/icaict.2011.6111013,https://api.labs.crossref.org/works/https://doi.org/10.1109/icaict.2011.6111013?mailto=christian.hauschke@tib.eu,2011,article,True,0,Mobile Agent Technology in Network Management,Physical Sciences,Computer Networks and Communications,,False,en,Computer Science,Retraction
https://openalex.org/W2029798448,RETRACTED ARTICLE: The clinical and laboratory features in Turkish systemic sclerosis patients: a single-center experience,Rheumatology International,0,https://doi.org/10.1007/s00296-011-2305-0,https://api.labs.crossref.org/works/https://doi.org/10.1007/s00296-011-2305-0?mailto=christian.hauschke@tib.eu,2011,article,True,0,Pathogenesis and Treatment of Systemic Sclerosis,Health Sciences,Pathology and Forensic Medicine,Springer Science+Business Media,True,en,Medicine,Retraction
https://openalex.org/W2031807594,Notice of Retraction: The risk on foreign investment of China and cases study,,0,https://doi.org/10.1109/aimsec.2011.6011400,https://api.labs.crossref.org/works/https://doi.org/10.1109/aimsec.2011.6011400?mailto=christian.hauschke@tib.eu,2011,article,True,0,Comprehensive Assessment of Safety in Energy and Infrastructure,Physical Sciences,"Safety, Risk, Reliability and Quality",,False,en,Engineering,Retraction
https://openalex.org/W2032464336,RETRACTED: Treatment with 7-O-tetradecanoyl-genistein reduces IFN-γ and IL-17 levels in the brain and ameliorates clinical signs of experimental autoimmune encephalomyelitis,Biomedicine & Preventive Nutrition,0,https://doi.org/10.1016/j.bionut.2011.06.023,https://api.labs.crossref.org/works/https://doi.org/10.1016/j.bionut.2011.06.023?mailto=christian.hauschke@tib.eu,2013,article,True,0,Role of STAT3 in Cancer Inflammation and Immunity,Health Sciences,Oncology,Elsevier BV,False,en,Medicine,Retraction
https://openalex.org/W2032766946,RETRACTION: The Relationship Between Agents and Simulated Annealing Using BottsTrica,Advances in intelligent systems research,0,https://doi.org/10.2991/3ca-13.2013.70,https://api.labs.crossref.org/works/https://doi.org/10.2991/3ca-13.2013.70?mailto=christian.hauschke@tib.eu,2013,article,True,0,Characterization and Detection of Android Malware,Physical Sciences,Signal Processing,Atlantis Press,True,en,Computer Science,Retraction
https://openalex.org/W2033304667,RETRACTED ARTICLE: Some applications of BP-theorem in approximation theory,Analysis in Theory and Applications,0,https://doi.org/10.1007/s10496-011-0220-6,https://api.labs.crossref.org/works/https://doi.org/10.1007/s10496-011-0220-6?mailto=christian.hauschke@tib.eu,2011,article,True,0,Statistical Convergence in Approximation Theory and Functional Analysis,Physical Sciences,Statistics and Probability,Springer Science+Business Media,False,en,Mathematics,Retraction;Crossmark Retraction
https://openalex.org/W2033530673,RETRACTED ARTICLE: The effects of each beta-glucosidase gene deletion on cellulase gene regulation in Neurospora crassa (online publication: DOI 10.1007/s10482-013- 9972-7),Antonie van Leeuwenhoek,0,https://doi.org/10.1007/s10482-013-9972-7,https://api.labs.crossref.org/works/https://doi.org/10.1007/s10482-013-9972-7?mailto=christian.hauschke@tib.eu,2013,article,True,0,Technologies for Biofuel Production from Biomass,Physical Sciences,Biomedical Engineering,Springer Science+Business Media,True,en,Engineering,Retraction
https://openalex.org/W2034306562,ISSUES ASSOCIATED WITH DELIRIUM SEVERITY AMONG OLDER PATIENTS,BMJ Supportive & Palliative Care,0,https://doi.org/10.1136/bmjspcare-2013-000491.157,https://api.labs.crossref.org/works/https://doi.org/10.1136/bmjspcare-2013-000491.157?mailto=christian.hauschke@tib.eu,2013,article,True,0,Management of Hyperkalemia in Kidney Diseases,Health Sciences,Pulmonary and Respiratory Medicine,BMJ,True,de,Medicine,Retraction
https://openalex.org/W2035347210,Retracted:Effects of pro-inflammatory cytokines on mineralization potential of rat dental pulp stem cells,Journal of Tissue Engineering and Regenerative Medicine,0,https://doi.org/10.1002/term.444,https://api.labs.crossref.org/works/https://doi.org/10.1002/term.444?mailto=christian.hauschke@tib.eu,2011,article,True,0,Multipotent Mesenchymal Stem Cells,Health Sciences,Genetics,Wiley-Blackwell,False,en,Medicine,Retraction
https://openalex.org/W2036380237,RETRACTED ARTICLE: Willed from the bottom up: the postcolonial turned revolutionary,Journal of North African Studies,0,https://doi.org/10.1080/13629387.2012.752603,https://api.labs.crossref.org/works/https://doi.org/10.1080/13629387.2012.752603?mailto=christian.hauschke@tib.eu,2013,article,True,0,Colonialism and Post-Colonialism in Africa,Social Sciences,Anthropology,Taylor & Francis,False,en,Social Sciences,Expression of concern;Retraction
https://openalex.org/W2038423189,"Novel, Small Molecule induced GABA-hATSCs for Targeting of Neuropathic Pain",Human Gene Therapy,0,https://doi.org/10.1089/hum.2012.097,https://api.labs.crossref.org/works/https://doi.org/10.1089/hum.2012.097?mailto=christian.hauschke@tib.eu,2013,article,True,0,Mechanisms and Management of Neuropathic Pain,Health Sciences,Physiology,"Mary Ann Liebert, Inc.",False,en,Medicine,Retraction
https://openalex.org/W2038919266,RETRACTED ARTICLE: Ten-year survival rates of methylprednisolone plus cyclophosphamide followed by mycophenolate mophetyl of azathiopurine for progressive systemic sclerosis patients,Rheumatology International,0,https://doi.org/10.1007/s00296-011-2247-6,https://api.labs.crossref.org/works/https://doi.org/10.1007/s00296-011-2247-6?mailto=christian.hauschke@tib.eu,2011,article,True,0,Pathogenesis and Treatment of Systemic Sclerosis,Health Sciences,Pathology and Forensic Medicine,Springer Science+Business Media,True,en,Medicine,Retraction
https://openalex.org/W2039540526,Retracted article: Production of Monoclonal Antibody against Mercury (II) Ion and “Turn-on” Chemiluminescence for Mimic Sandwich ELISA Detection of Hg2+ Ions,Analyst,0,https://doi.org/10.1039/c2an35303b,https://api.labs.crossref.org/works/https://doi.org/10.1039/c2an35303b?mailto=christian.hauschke@tib.eu,2012,article,True,0,DNA Nanotechnology and Bioanalytical Applications,Life Sciences,Molecular Biology,Royal Society of Chemistry,False,en,"Biochemistry, Genetics and Molecular Biology",Retraction
https://openalex.org/W2039778428,RETRACTED: Thickness variation of the sedimentary cover in the south Western Desert of Egypt as deduced from Bouguer gravity and drill-hole data,Journal of African Earth Sciences,0,https://doi.org/10.1016/j.jafrearsci.2012.09.007,https://api.labs.crossref.org/works/https://doi.org/10.1016/j.jafrearsci.2012.09.007?mailto=christian.hauschke@tib.eu,2013,article,True,0,Geophysical Exploration and Monitoring Techniques,Physical Sciences,Geophysics,Elsevier BV,False,en,Earth and Planetary Sciences,Retraction
https://openalex.org/W2041118434,T-bet is overexpressed in the CD4+ T cells of HIV Controllers,AIDS,0,https://doi.org/10.1097/qad.0b013e32835e06e6,https://api.labs.crossref.org/works/https://doi.org/10.1097/qad.0b013e32835e06e6?mailto=christian.hauschke@tib.eu,2013,article,True,0,Natural Killer Cells in Immunity,Life Sciences,Immunology,Lippincott Williams & Wilkins,False,en,Immunology and Microbiology,Correction;Retraction
https://openalex.org/W2041504913,Jeux transgressifs,Revue Romane,0,https://doi.org/10.1075/rro.46.1.06bar,https://api.labs.crossref.org/works/https://doi.org/10.1075/rro.46.1.06bar?mailto=christian.hauschke@tib.eu,2011,article,True,0,Digital Communication and Information Studies,Physical Sciences,Computer Networks and Communications,John Benjamins Publishing Company,False,en,Computer Science,Retraction
https://openalex.org/W2041825815,Poétique de la rupture spectrale,Revue Romane,0,https://doi.org/10.1075/rro.48.1.06eti,https://api.labs.crossref.org/works/https://doi.org/10.1075/rro.48.1.06eti?mailto=christian.hauschke@tib.eu,2013,article,True,0,Anthropology and Cultural Studies,Social Sciences,Cultural Studies,John Benjamins Publishing Company,False,en,Social Sciences,Retraction
https://openalex.org/W2043067898,Stereotype Disconfirmation Affect: When Sweet Hooligans Make You Happy and Honest Salesmen Make You Sad,Basic and Applied Social Psychology,0,https://doi.org/10.1080/01973533.2010.540135,https://api.labs.crossref.org/works/https://doi.org/10.1080/01973533.2010.540135?mailto=christian.hauschke@tib.eu,2011,article,True,0,Intergroup Relations and Social Identity Theories,Social Sciences,Sociology and Political Science,Taylor & Francis,False,en,Social Sciences,Retraction
https://openalex.org/W2043733843,RETRACTED: An Inquiry into Intonational Pattern of the Complex and Compound Sentences in Persian [SBSPRO 28C (2011) 851–854],Procedia - Social and Behavioral Sciences,0,https://doi.org/10.1016/j.sbspro.2011.11.156,https://api.labs.crossref.org/works/https://doi.org/10.1016/j.sbspro.2011.11.156?mailto=christian.hauschke@tib.eu,2011,article,True,0,Theoretical Foundations of Linguistic Studies,Social Sciences,Language and Linguistics,Elsevier BV,True,en,Arts and Humanities,Retraction
https://openalex.org/W2043927325,"Correction to Copper-Mediated Coupling of 1,1-Dibromo-1-alkenes with Imidazoles: A General Method for the Synthesis of <i>N</i>-Alkynylimidazoles",The Journal of Organic Chemistry,0,https://doi.org/10.1021/jo2004346,https://api.labs.crossref.org/works/https://doi.org/10.1021/jo2004346?mailto=christian.hauschke@tib.eu,2011,article,True,0,Transition-Metal-Catalyzed C–H Bond Functionalization,Physical Sciences,Organic Chemistry,American Chemical Society,False,en,Chemistry,Retraction
https://openalex.org/W2045185789,RETRACTED ARTICLE: Low Dose Lidocaine for Refractory Seizures in Preterm Neonates,Indian Journal of Pediatrics,0,https://doi.org/10.1007/s12098-010-0331-7,https://api.labs.crossref.org/works/https://doi.org/10.1007/s12098-010-0331-7?mailto=christian.hauschke@tib.eu,2011,article,True,0,Neonatal Brain Injury and Developmental Consequences,Health Sciences,"Pediatrics, Perinatology and Child Health",Springer Science+Business Media,False,en,Medicine,Retraction
https://openalex.org/W2045379719,RETRACTED ARTICLE: Unicompartmental knee arthroplasty: a review of literature,European Journal of Orthopaedic Surgery and Traumatology,0,https://doi.org/10.1007/s00590-011-0839-1,https://api.labs.crossref.org/works/https://doi.org/10.1007/s00590-011-0839-1?mailto=christian.hauschke@tib.eu,2011,article,True,0,Projections and Outcomes of Arthroplasty Surgery in the US,Health Sciences,Surgery,Springer Science+Business Media,True,en,Medicine,Retraction
https://openalex.org/W2045627014,RETRACTED: 147 REDUCED SYNTAXIN-5 IN SKELETAL MUSCLE OF PATIENTS WITH TYPE 2 DIABETES. A LINK BETWEEN LIPID STORAGE AND INSULIN RESISTANCE,Atherosclerosis Supplements,0,https://doi.org/10.1016/s1567-5688(11)70148-9,https://api.labs.crossref.org/works/https://doi.org/10.1016/s1567-5688(11)70148-9?mailto=christian.hauschke@tib.eu,2011,article,True,0,"Diabetes, Oxidative Stress, and Antioxidants",Health Sciences,"Endocrinology, Diabetes and Metabolism",Elsevier BV,True,en,Medicine,Retraction
https://openalex.org/W2045846392,"Cyclobacterium qasimii sp. nov., a psychrotolerant bacterium isolated from a marine sediment of Kongsfjorden, Svalbard",International Journal of Systematic and Evolutionary Microbiology,0,https://doi.org/10.1099/ijs.0.024901-0,https://api.labs.crossref.org/works/https://doi.org/10.1099/ijs.0.024901-0?mailto=christian.hauschke@tib.eu,2011,article,True,0,Marine Microbial Diversity and Biogeography,Physical Sciences,Ecology,Microbiology Society,False,en,Environmental Science,Retraction
https://openalex.org/W2046002168,RETRACTED: Epidemiology &amp; preventive aspects of railway suicides and fatalities related to trespassing accidents,Journal of Forensic and Legal Medicine,0,https://doi.org/10.1016/j.jflm.2013.09.016,https://api.labs.crossref.org/works/https://doi.org/10.1016/j.jflm.2013.09.016?mailto=christian.hauschke@tib.eu,2013,article,True,0,Suicidal Behavior and Prevention Strategies,Social Sciences,Clinical Psychology,Elsevier BV,False,en,Psychology,Retraction;Crossmark Retraction
https://openalex.org/W2046197159,Notice of Violation of IEEE Publication Principles: Architecture of an intelligent system for information security management,,0,https://doi.org/10.1109/icaict.2013.6722721,https://api.labs.crossref.org/works/https://doi.org/10.1109/icaict.2013.6722721?mailto=christian.hauschke@tib.eu,2013,article,True,0,Information Security Policy Compliance and Awareness,Physical Sciences,Information Systems,,False,en,Computer Science,Retraction
https://openalex.org/W2046503222,"RETRACTED: Overexpression of αCP2, a translational repressor of GAP-43, inhibited axon outgrowth during development in Xenopus laevis",Biochemical and Biophysical Research Communications,0,https://doi.org/10.1016/j.bbrc.2012.02.006,https://api.labs.crossref.org/works/https://doi.org/10.1016/j.bbrc.2012.02.006?mailto=christian.hauschke@tib.eu,2012,article,True,0,Regulation of RNA Processing and Function,Life Sciences,Molecular Biology,Elsevier BV,True,en,"Biochemistry, Genetics and Molecular Biology",Retraction
https://openalex.org/W2047715033,PATIENTS WITH DYSPHASIA: ENCOUNTERS IN TAKING MEDICATION,BMJ Supportive & Palliative Care,0,https://doi.org/10.1136/bmjspcare-2013-000491.158,https://api.labs.crossref.org/works/https://doi.org/10.1136/bmjspcare-2013-000491.158?mailto=christian.hauschke@tib.eu,2013,article,True,0,Dysphagia and Swallowing Disorders,Health Sciences,Speech and Hearing,BMJ,True,en,Health Professions,Retraction
https://openalex.org/W2047763128,"Variation in chimpanzee ‘culture’ is predicted by local ecology, not geography",Biology Letters,0,https://doi.org/10.1098/rsbl.2011.0376,https://api.labs.crossref.org/works/https://doi.org/10.1098/rsbl.2011.0376?mailto=christian.hauschke@tib.eu,2011,article,True,0,Evolution of Social Behavior in Primates,Social Sciences,Social Psychology,Royal Society,True,en,Psychology,Retraction
https://openalex.org/W2048579026,RETRACTED: Key Factors for Metal Organic Chemical Vapor Deposition of InGaN Films with High InN Molar Fraction,Applied Mechanics and Materials,0,https://doi.org/10.4028/www.scientific.net/amm.341-342.204,https://api.labs.crossref.org/works/https://doi.org/10.4028/www.scientific.net/amm.341-342.204?mailto=christian.hauschke@tib.eu,2013,article,True,0,First-Principles Calculations for III-Nitride Semiconductors,Physical Sciences,Condensed Matter Physics,Trans Tech Publications,True,en,Physics and Astronomy,Retraction
https://openalex.org/W2049155700,WITHDRAWN: Dual targeting of glioma U251 cells and neovasculature with a nanoparticle encoding vasohibin and RGD peptides prevents tumor angiogenesis and inhibits tumor growth,International Immunopharmacology,0,https://doi.org/10.1016/j.intimp.2011.01.035,https://api.labs.crossref.org/works/https://doi.org/10.1016/j.intimp.2011.01.035?mailto=christian.hauschke@tib.eu,2011,article,True,0,Role of Transcription Factors in Cell Regulation,Life Sciences,Molecular Biology,Elsevier BV,False,en,"Biochemistry, Genetics and Molecular Biology",Retraction
https://openalex.org/W2050156751,Notice of Retraction Shore power grounding resistance calculation,,0,https://doi.org/10.1109/peam.2011.6134954,https://api.labs.crossref.org/works/https://doi.org/10.1109/peam.2011.6134954?mailto=christian.hauschke@tib.eu,2011,article,True,0,Interdisciplinary Research across Science and Technology,Social Sciences,Management Science and Operations Research,,False,en,Decision Sciences,Retraction
https://openalex.org/W2050515872,RETRACTED ARTICLE: Characterization of transgenic Arabidopsis and tomato plants antisensed for the ethylene receptor gene<i>CcEIN4</i>under NaCl stress,Journal of Plant Interactions,0,https://doi.org/10.1080/17429145.2013.865796,https://api.labs.crossref.org/works/https://doi.org/10.1080/17429145.2013.865796?mailto=christian.hauschke@tib.eu,2013,article,True,0,Molecular Responses to Abiotic Stress in Plants,Life Sciences,Plant Science,Taylor & Francis,False,en,Agricultural and Biological Sciences,Retraction;Crossmark Retraction
https://openalex.org/W2050823321,WITHDRAWN: Unsteady flows of an Oldroyd-B fluid in a cylindrical domain for a given shear stress,Applied Mathematics and Computation,0,https://doi.org/10.1016/j.amc.2011.02.038,https://api.labs.crossref.org/works/https://doi.org/10.1016/j.amc.2011.02.038?mailto=christian.hauschke@tib.eu,2011,article,True,0,Rheology of Complex Fluids and Polymers,Physical Sciences,Fluid Flow and Transfer Processes,Elsevier BV,True,en,Chemical Engineering,Retraction
https://openalex.org/W2050826777,"‘Preparation and characterization of high performance (Co, Cu)/Pt/γ‐Al<sub>2</sub>O<sub>3</sub> bimetallic catalysts for oxidation of 2‐ propanol: Experiments and ANN modelling’ by Darush Salari, Aligholi Niaei, Faezeh Aghazadeh, and Seyed Ali Hosseini",The Canadian Journal of Chemical Engineering,0,https://doi.org/10.1002/cjce.20388,https://api.labs.crossref.org/works/https://doi.org/10.1002/cjce.20388?mailto=christian.hauschke@tib.eu,2011,article,True,0,Catalytic Nanomaterials,Physical Sciences,Materials Chemistry,Wiley-Blackwell,False,en,Materials Science,Retraction
https://openalex.org/W2051079302,RETRACTED ARTICLE: Reanimeren in de tandartspraktijk,Standby,0,https://doi.org/10.1007/s12490-011-0040-8,https://api.labs.crossref.org/works/https://doi.org/10.1007/s12490-011-0040-8?mailto=christian.hauschke@tib.eu,2011,article,True,0,Effectiveness of Play Therapy Interventions with Children,Social Sciences,Clinical Psychology,Springer Nature,False,nl,Psychology,Retraction
https://openalex.org/W2051258141,On the origin of power-law distributions in systems with constrained phase space,Condensed Matter Physics,0,https://doi.org/10.5488/cmp.16.43802,https://api.labs.crossref.org/works/https://doi.org/10.5488/cmp.16.43802?mailto=christian.hauschke@tib.eu,2013,article,True,0,Statistical Mechanics with Long-Range Interactions and Nonextensivity,Physical Sciences,Statistical and Nonlinear Physics,Institute for Condensed Matter Physics of NAS of Ukraine,True,en,Physics and Astronomy,Retraction
https://openalex.org/W2051450164,"Response to Letter Regarding Article, “Human Cardiac Stem Cell Differentiation Is Regulated by a Mircrine Mechanism”",Circulation,0,https://doi.org/10.1161/circulationaha.111.051110,https://api.labs.crossref.org/works/https://doi.org/10.1161/circulationaha.111.051110?mailto=christian.hauschke@tib.eu,2011,article,True,0,Induction and Differentiation of Pluripotent Stem Cells,Life Sciences,Molecular Biology,Lippincott Williams & Wilkins,True,en,"Biochemistry, Genetics and Molecular Biology",Correction
https://openalex.org/W2053658115,RETRACTED ARTICLE: Reproductive toxicity and pathomorphological changes in rats after chronic oral exposure to low-dose depleted uranium,Radiation and Environmental Biophysics,0,https://doi.org/10.1007/s00411-011-0355-z,https://api.labs.crossref.org/works/https://doi.org/10.1007/s00411-011-0355-z?mailto=christian.hauschke@tib.eu,2011,article,True,0,Sources and Effects of Ionizing Radiation on Human Health,Health Sciences,Radiological and Ultrasound Technology,Springer Science+Business Media,True,en,Health Professions,Retraction
https://openalex.org/W2053942025,"Synthesis and Characterization of a New Ion Exchanger Tamarind 5‐Amino Salicylic Acid Hydroximate [TASAH] Resin and Its Application in Removal and Recovery of Toxic Metal Ions from Effluent of Karishma Textile, Jodhpur, India","Journal of Hazardous, Toxic, and Radioactive Waste",0,https://doi.org/10.1061/(asce)hz.2153-5515.0000120,https://api.labs.crossref.org/works/https://doi.org/10.1061/(asce)hz.2153-5515.0000120?mailto=christian.hauschke@tib.eu,2011,article,True,0,Chemistry and Applications of Tetrazoles,Physical Sciences,Organic Chemistry,American Society of Civil Engineers,True,en,Chemistry,Retraction
https://openalex.org/W2054088038,"WITHDRAWN: G.W. Kolodko, Truth, Errors, and Lies – Politics and Economics in a Volatile World, Columbia University Press, New York (2011), 460 pp., €34,99, ISBN-10: 0231150687, ISBN-13: 978-0231150682",Economic Systems,0,https://doi.org/10.1016/j.ecosys.2013.02.001,https://api.labs.crossref.org/works/https://doi.org/10.1016/j.ecosys.2013.02.001?mailto=christian.hauschke@tib.eu,2013,article,True,0,Transformation of Russian Economy and Society,Social Sciences,Political Science and International Relations,Elsevier BV,False,en,Social Sciences,Retraction
https://openalex.org/W2054360068,RETRACTED ARTICLE: Treatment of very severe osteoporotic vertebral compression fractures with balloon kyphoplasty,Neuroradiology,0,https://doi.org/10.1007/s00234-013-1162-9,https://api.labs.crossref.org/works/https://doi.org/10.1007/s00234-013-1162-9?mailto=christian.hauschke@tib.eu,2013,article,True,0,Spine Surgery Techniques and Technologies,Health Sciences,Surgery,Springer Science+Business Media,True,en,Medicine,Retraction
https://openalex.org/W2055998775,RETRACTED: The Realization of Communication between AB SLC500 and Profibus-DP Network,Advanced Materials Research,0,https://doi.org/10.4028/www.scientific.net/amr.734-737.3238,https://api.labs.crossref.org/works/https://doi.org/10.4028/www.scientific.net/amr.734-737.3238?mailto=christian.hauschke@tib.eu,2013,article,True,0,Applications of Programmable Logic Controllers (PLCs),Physical Sciences,Control and Systems Engineering,Trans Tech Publications,True,en,Engineering,Retraction
https://openalex.org/W2056529847,RETRACTED ARTICLE: Les épreuves du labyrinthe rochien,Neohelicon,0,https://doi.org/10.1007/s11059-011-0111-z,https://api.labs.crossref.org/works/https://doi.org/10.1007/s11059-011-0111-z?mailto=christian.hauschke@tib.eu,2011,article,True,0,Digital Communication and Information Studies,Physical Sciences,Computer Networks and Communications,Springer Science+Business Media,False,en,Computer Science,Retraction;Crossmark Retraction
https://openalex.org/W2056699545,RETRACTED ARTICLE: Molecular cloning and expression analysis of novel putative effector genes from Meloidogyne graminicola,Journal of Applied Genetics,0,https://doi.org/10.1007/s13353-013-0160-2,https://api.labs.crossref.org/works/https://doi.org/10.1007/s13353-013-0160-2?mailto=christian.hauschke@tib.eu,2013,article,True,0,Plant-Parasitic Nematodes in Molecular Plant Pathology,Life Sciences,Plant Science,Springer Nature,True,en,Agricultural and Biological Sciences,Retraction
https://openalex.org/W2056789008,"The Farceur as Modernist: Fernand Crommelynck, The Magnanimous Cuckold, and Twentieth-Century Western Drama",Journal of dramatic theory and criticism,0,https://doi.org/10.1353/dtc.2013.0033,https://api.labs.crossref.org/works/https://doi.org/10.1353/dtc.2013.0033?mailto=christian.hauschke@tib.eu,2013,article,True,0,"Interdisciplinary Studies across Arts, Sciences, and Humanities",Social Sciences,History and Philosophy of Science,,False,en,Arts and Humanities,Retraction
https://openalex.org/W2057035710,"RETRACTED ARTICLE: Adaptation strategies of farmers to drought in a changing climate in Dingcheng County, Hunan, southern China",Regional Environmental Change,0,https://doi.org/10.1007/s10113-013-0560-1,https://api.labs.crossref.org/works/https://doi.org/10.1007/s10113-013-0560-1?mailto=christian.hauschke@tib.eu,2013,article,True,0,Adaptation to Climate Change in Agriculture,Life Sciences,"Ecology, Evolution, Behavior and Systematics",Springer Science+Business Media,True,en,Agricultural and Biological Sciences,Retraction;Crossmark Retraction
