id,display_name,primary_location_display_name,cited_by_count,doi,crossref_call,publication_year,type,is_retracted,cited_by_percentile_year_min,primary_topic_display_name,primary_topic_domain_display_name,primary_topic_subfield_display_name,primary_location_source_host_organization_name,open_access_is_oa,language,primary_topic_field_display_name,update_nature
https://openalex.org/W2118260386,Is Analyst Forecast Accuracy Associated with Accounting Information Use? (Retracted),Accounting Horizons,45,https://doi.org/10.2308/acch.1999.13.1.1,https://api.labs.crossref.org/works/https://doi.org/10.2308/acch.1999.13.1.1?mailto=christian.hauschke@tib.eu,1999,article,True,92,Financial Reporting and Earnings Management,Social Sciences,Accounting,American Accounting Association,False,en,"Business, Management and Accounting",
https://openalex.org/W1970576960,RETRACTED: Preoperative microbiologic screening and antibiotic prophylaxis in pulmonary resection operations,The Annals of Thoracic Surgery,44,https://doi.org/10.1016/s0003-4975(99)00400-2,https://api.labs.crossref.org/works/https://doi.org/10.1016/s0003-4975(99)00400-2?mailto=christian.hauschke@tib.eu,1999,article,True,92,Prevention and Management of Surgical Site Infections,Health Sciences,Surgery,Elsevier BV,True,en,Medicine,
https://openalex.org/W1994898823,Retracted: An ∼400 kDa membrane‐associated complex that contains one molecule of the resistance protein Cf‐4,The Plant Journal,44,https://doi.org/10.1046/j.1365-313x.2002.01254.x,https://api.labs.crossref.org/works/https://doi.org/10.1046/j.1365-313x.2002.01254.x?mailto=christian.hauschke@tib.eu,2002,article,True,92,Mechanisms of Plant Immune Response,Life Sciences,Plant Science,Wiley-Blackwell,False,en,Agricultural and Biological Sciences,
https://openalex.org/W2081512480,RETRACTED: Requirement for DNA mismatch repair proteins in the transcription-coupled repair of thymine glycols in Saccharomyces cerevisiae,Mutation research,44,https://doi.org/10.1016/s0921-8777(98)00007-x,https://api.labs.crossref.org/works/https://doi.org/10.1016/s0921-8777(98)00007-x?mailto=christian.hauschke@tib.eu,1998,article,True,92,Molecular Characterization of Colorectal Cancer,Health Sciences,Pathology and Forensic Medicine,Elsevier BV,True,en,Medicine,
https://openalex.org/W2111857208,Effects of Environmental and Land Use Regulation in the Oil and Gas Industry Using the Wyoming Checkerboard as an Experimental Design,The American Economic Review,44,https://doi.org/10.1257/000282802762024656,https://api.labs.crossref.org/works/https://doi.org/10.1257/000282802762024656?mailto=christian.hauschke@tib.eu,2002,article,True,92,Consequences of Mortgage Credit Expansion and Housing Market Dynamics,Social Sciences,Economics and Econometrics,American Economic Association,False,en,"Economics, Econometrics and Finance",
https://openalex.org/W2139060480,"Cytoskeletal disrupting agents prevent calmodulin kinase, iq domain and voltage‐dependent facilitation of l‐type ca<sup>2+</sup> Channels",The Journal of Physiology,44,https://doi.org/10.1113/jphysiol.2002.021881,https://api.labs.crossref.org/works/https://doi.org/10.1113/jphysiol.2002.021881?mailto=christian.hauschke@tib.eu,2002,article,True,92,Molecular Mechanisms of Ion Channels Regulation,Life Sciences,Molecular Biology,Wiley-Blackwell,True,en,"Biochemistry, Genetics and Molecular Biology",
https://openalex.org/W2171923644,Prophylactic antibiotic therapy for chronic bronchitis,Cochrane Database of Systematic Reviews,44,https://doi.org/10.1002/14651858.cd004105,https://api.labs.crossref.org/works/https://doi.org/10.1002/14651858.cd004105?mailto=christian.hauschke@tib.eu,2001,reference-entry,True,92,Diagnosis and Management of Chronic Cough,Health Sciences,Pulmonary and Respiratory Medicine,Cochrane,False,en,Medicine,
https://openalex.org/W1975865405,Monarch butterflies ( <i>Danaus plexippus</i> L.) use a magnetic compass for navigation,Proceedings of the National Academy of Sciences of the United States of America,43,https://doi.org/10.1073/pnas.96.24.13845,https://api.labs.crossref.org/works/https://doi.org/10.1073/pnas.96.24.13845?mailto=christian.hauschke@tib.eu,1999,article,True,92,Biological Effects of Electromagnetic Fields,Life Sciences,Biophysics,National Academy of Sciences,True,en,"Biochemistry, Genetics and Molecular Biology",
https://openalex.org/W1976638769,RETRACTED: Solution processed CdS thin film transistors,Thin Solid Films,43,https://doi.org/10.1016/s0040-6090(00)01908-8,https://api.labs.crossref.org/works/https://doi.org/10.1016/s0040-6090(00)01908-8?mailto=christian.hauschke@tib.eu,2001,article,True,92,Failure Analysis of Integrated Circuits,Physical Sciences,Electrical and Electronic Engineering,Elsevier BV,True,en,Engineering,
https://openalex.org/W1991999121,RETRACTED ARTICLE: Point-of-care (POC) measurement of coagulation after cardiac surgery,Intensive Care Medicine,43,https://doi.org/10.1007/s001340050743,https://api.labs.crossref.org/works/https://doi.org/10.1007/s001340050743?mailto=christian.hauschke@tib.eu,1998,article,True,92,Epidemiology and Management of Sepsis and Septic Shock,Health Sciences,Epidemiology,Springer Science+Business Media,False,en,Medicine,
https://openalex.org/W2031266476,RETRACTED: Laparoscopic cholecystectomy and unsuspected gallbladder cancer,European Journal of Surgical Oncology,43,https://doi.org/10.1053/ejso.2000.1036,https://api.labs.crossref.org/works/https://doi.org/10.1053/ejso.2000.1036?mailto=christian.hauschke@tib.eu,2001,article,True,92,Cholangiocarcinoma,Health Sciences,Surgery,Elsevier BV,True,en,Medicine,
https://openalex.org/W2740504337,Granisetron reduces the incidence and severity of nausea and vomiting after laparoscopic cholecystectomy,Canadian Journal of Anesthesia/Journal canadien d'anesthésie,43,https://doi.org/10.1007/bf03014460,https://api.labs.crossref.org/works/https://doi.org/10.1007/bf03014460?mailto=christian.hauschke@tib.eu,1997,article,True,92,Prevention and Management of Postoperative Nausea and Vomiting,Health Sciences,Surgery,Springer Science+Business Media,True,en,Medicine,
https://openalex.org/W3195884261,Investigation of the Mechanisms of G Protein: Effector Coupling by the Human and Mouse Prostacyclin Receptors,Journal of Biological Chemistry,43,https://doi.org/10.1074/jbc.m203353200,https://api.labs.crossref.org/works/https://doi.org/10.1074/jbc.m203353200?mailto=christian.hauschke@tib.eu,2002,article,True,92,Molecular Mechanisms of Ras Signaling Pathways,Life Sciences,Molecular Biology,Elsevier BV,True,en,"Biochemistry, Genetics and Molecular Biology",
https://openalex.org/W4206483546,Immunotherapy for advanced renal cell cancer,The Cochrane Database of Systematic Reviews,43,https://doi.org/10.1002/14651858.cd001425,https://api.labs.crossref.org/works/https://doi.org/10.1002/14651858.cd001425?mailto=christian.hauschke@tib.eu,2000,reference-entry,True,92,Renal Cell Carcinoma,Health Sciences,Pulmonary and Respiratory Medicine,,False,en,Medicine,
https://openalex.org/W1493821732,RETRACTED ARTICLE: Binding to the transferrin receptor is required for endocytosis of HFE and regulation of iron homeostasis,Nature Cell Biology,42,https://doi.org/10.1038/35046611,https://api.labs.crossref.org/works/https://doi.org/10.1038/35046611?mailto=christian.hauschke@tib.eu,2000,article,True,92,Regulation of Iron Metabolism and Anemia,Health Sciences,Hematology,Nature Portfolio,False,en,Medicine,
https://openalex.org/W1976758542,"The Bacterial Condensin MukBEF Compacts DNA into a Repetitive, Stable Structure",Science,42,https://doi.org/10.1126/science.1098225,https://api.labs.crossref.org/works/https://doi.org/10.1126/science.1098225?mailto=christian.hauschke@tib.eu,2004,article,True,92,Ecology and Evolution of Viruses in Ecosystems,Physical Sciences,Ecology,American Association for the Advancement of Science,True,en,Environmental Science,
https://openalex.org/W1977032859,Economic Considerations of the Use of New Anesthetics,Anesthesia & Analgesia,42,https://doi.org/10.1097/00000539-199803000-00010,https://api.labs.crossref.org/works/https://doi.org/10.1097/00000539-199803000-00010?mailto=christian.hauschke@tib.eu,1998,article,True,92,Anesthesia and Sedation Management,Health Sciences,Anesthesiology and Pain Medicine,Lippincott Williams & Wilkins,True,en,Medicine,
https://openalex.org/W2009553579,"RETRACTED: Ziwi, the zebrafish homologue of the Drosophila piwi: co-localization with vasa at the embryonic genital ridge and gonad-specific expression in the adults",Gene Expression Patterns,42,https://doi.org/10.1016/s1567-133x(02)00052-2,https://api.labs.crossref.org/works/https://doi.org/10.1016/s1567-133x(02)00052-2?mailto=christian.hauschke@tib.eu,2002,article,True,92,Transgenic Animal Research,Life Sciences,Genetics,Elsevier BV,False,en,"Biochemistry, Genetics and Molecular Biology",
https://openalex.org/W2015497307,Mitochondrial Transcription Factor A and Its Downstream Targets Are Up-regulated in a Rat Hepatoma,Journal of Biological Chemistry,42,https://doi.org/10.1074/jbc.m206958200,https://api.labs.crossref.org/works/https://doi.org/10.1074/jbc.m206958200?mailto=christian.hauschke@tib.eu,2002,article,True,92,Mitochondrial Dynamics and Reactive Oxygen Species Regulation,Life Sciences,Molecular Biology,Elsevier BV,True,en,"Biochemistry, Genetics and Molecular Biology",
https://openalex.org/W2022779155,"Differential Expression, Regulation, and Induction of Smads, Transforming Growth Factor-β Signal Transduction Pathway in Leiomyoma, and Myometrial Smooth Muscle Cells and Alteration by Gonadotropin-Releasing Hormone Analog",The Journal of Clinical Endocrinology & Metabolism,42,https://doi.org/10.1210/jc.2002-021325,https://api.labs.crossref.org/works/https://doi.org/10.1210/jc.2002-021325?mailto=christian.hauschke@tib.eu,2003,article,True,92,Transforming Growth Factor Beta Signaling Pathway,Life Sciences,Molecular Biology,Oxford University Press,True,en,"Biochemistry, Genetics and Molecular Biology",
https://openalex.org/W2023587164,Inhibition of Rev-Mediated HIV-1 Expression by an RNA Binding Protein Encoded by the Interferon-Inducible 9-27 Gene,Science,42,https://doi.org/10.1126/science.7680491,https://api.labs.crossref.org/works/https://doi.org/10.1126/science.7680491?mailto=christian.hauschke@tib.eu,1993,article,True,92,Human Immunodeficiency Virus/Acquired Immunodeficiency Syndrome,Life Sciences,Virology,American Association for the Advancement of Science,False,en,Immunology and Microbiology,
https://openalex.org/W2035438415,RETRACTED: Cathodic electrodeposition of RuO2 thin films from Ru(III)Cl3 solution,Materials Chemistry and Physics,42,https://doi.org/10.1016/j.matchemphys.2004.04.023,https://api.labs.crossref.org/works/https://doi.org/10.1016/j.matchemphys.2004.04.023?mailto=christian.hauschke@tib.eu,2004,article,True,92,Materials for Electrochemical Supercapacitors,Physical Sciences,"Electronic, Optical and Magnetic Materials",Elsevier BV,True,en,Materials Science,
https://openalex.org/W2048640503,Developing customer oriented service: a case study,Managing service quality,42,https://doi.org/10.1108/09604520410558029,https://api.labs.crossref.org/works/https://doi.org/10.1108/09604520410558029?mailto=christian.hauschke@tib.eu,2004,article,True,92,"Customer Relationships, Behavior, and Loyalty",Social Sciences,Organizational Behavior and Human Resource Management,Emerald Publishing Limited,False,en,"Business, Management and Accounting",
https://openalex.org/W2066127421,RETRACTED: Abnormal bone and calcium metabolism in patients after stroke,Archives of Physical Medicine and Rehabilitation,42,https://doi.org/10.1016/s0003-9993(00)90231-4,https://api.labs.crossref.org/works/https://doi.org/10.1016/s0003-9993(00)90231-4?mailto=christian.hauschke@tib.eu,2000,article,True,92,Osteoporosis,Health Sciences,Orthopedics and Sports Medicine,Elsevier BV,True,en,Medicine,
https://openalex.org/W2076672390,When to retire after concussion?,British Journal of Sports Medicine,42,https://doi.org/10.1136/bjsm.35.6.380,https://api.labs.crossref.org/works/https://doi.org/10.1136/bjsm.35.6.380?mailto=christian.hauschke@tib.eu,2001,article,True,92,Epidemiology and Impact of Traumatic Brain Injury,Health Sciences,Epidemiology,BMJ,True,en,Medicine,
https://openalex.org/W2080287955,RETRACTED: Platelet Function in Critically Ill Patients,Chest,42,https://doi.org/10.1378/chest.106.3.899,https://api.labs.crossref.org/works/https://doi.org/10.1378/chest.106.3.899?mailto=christian.hauschke@tib.eu,1994,article,True,92,Optimization of Perioperative Fluid Therapy,Health Sciences,Surgery,Elsevier BV,True,en,Medicine,
https://openalex.org/W2100231570,Rehabilitation after surgery for flexor tendon injuries in the hand,Cochrane Database of Systematic Reviews,42,https://doi.org/10.1002/14651858.cd003979.pub2,https://api.labs.crossref.org/works/https://doi.org/10.1002/14651858.cd003979.pub2?mailto=christian.hauschke@tib.eu,2004,reference-entry,True,92,Treatment and Outcomes of Hand Injuries,Health Sciences,Surgery,Cochrane,False,en,Medicine,
https://openalex.org/W2109504262,Interaction of discoidin domain receptor 1 isoform b (DDR1b) with collagen activates p38 mitogen‐activated protein kinase and promotes differentiation of macrophages,The FASEB Journal,42,https://doi.org/10.1096/fj.02-0320fje,https://api.labs.crossref.org/works/https://doi.org/10.1096/fj.02-0320fje?mailto=christian.hauschke@tib.eu,2003,article,True,92,Integrin Signaling in Inflammation and Cancer,Health Sciences,Immunology and Allergy,Wiley,False,en,Medicine,
https://openalex.org/W2114846280,Treatment for amphetamine dependence and abuse,Cochrane Database of Systematic Reviews,42,https://doi.org/10.1002/14651858.cd003022,https://api.labs.crossref.org/works/https://doi.org/10.1002/14651858.cd003022?mailto=christian.hauschke@tib.eu,2001,reference-entry,True,92,Neurobiological Mechanisms of Drug Addiction and Depression,Life Sciences,Cellular and Molecular Neuroscience,Cochrane,False,en,Neuroscience,
https://openalex.org/W2144930923,"RETRACTED: Effect of immobilization upon renal synthesis of 1,25-dihydroxyvitamin D in disabled elderly stroke patients",Bone,42,https://doi.org/10.1016/s8756-3282(98)00185-9,https://api.labs.crossref.org/works/https://doi.org/10.1016/s8756-3282(98)00185-9?mailto=christian.hauschke@tib.eu,1999,article,True,92,Vitamin D and Health Outcomes,Health Sciences,Pathology and Forensic Medicine,Elsevier BV,False,en,Medicine,
https://openalex.org/W2160231856,Environmental mercury exposure in children: South China's experience,Pediatrics International,42,https://doi.org/10.1111/j.1442-200x.2004.01972.x,https://api.labs.crossref.org/works/https://doi.org/10.1111/j.1442-200x.2004.01972.x?mailto=christian.hauschke@tib.eu,2004,article,True,92,Toxicology and Environmental Impacts of Mercury Contamination,Physical Sciences,"Health, Toxicology and Mutagenesis",Wiley-Blackwell,False,en,Environmental Science,
https://openalex.org/W2343227098,Gene trap analysis of germ cell signaling to Sertoli cells: NGF-TrkA mediated induction of <i>Fra1</i> and <i>Fos</i> by post-meiotic germ cells,Journal of Cell Science,42,https://doi.org/10.1242/jcs.114.2.435,https://api.labs.crossref.org/works/https://doi.org/10.1242/jcs.114.2.435?mailto=christian.hauschke@tib.eu,2001,article,True,92,Fertility Preservation in Cancer Patients,Health Sciences,"Public Health, Environmental and Occupational Health",The Company of Biologists,False,en,Medicine,
https://openalex.org/W288331025,In vitro transfection of plasmid DNA by amine derivatives of gelatin accompanied with ultrasound irradiation.,Pharmaceutical Research,42,https://doi.org/10.1023/a:1020400514990,https://api.labs.crossref.org/works/https://doi.org/10.1023/a:1020400514990?mailto=christian.hauschke@tib.eu,2002,article,True,92,Mechanisms and Applications of RNA Interference,Life Sciences,Molecular Biology,Springer Science+Business Media,False,en,"Biochemistry, Genetics and Molecular Biology",
https://openalex.org/W4239440291,Ultrasound for fetal assessment in early pregnancy,Cochrane Database of Systematic Reviews,42,https://doi.org/10.1002/14651858.cd000182,https://api.labs.crossref.org/works/https://doi.org/10.1002/14651858.cd000182?mailto=christian.hauschke@tib.eu,1998,reference-entry,True,92,Impact of Assisted Reproductive Technology on Perinatal Outcomes,Health Sciences,"Pediatrics, Perinatology and Child Health",Cochrane,False,en,Medicine,
https://openalex.org/W4241305465,Extended versus limited lymph nodes dissection technique for adenocarcinoma of the stomach,Cochrane Database of Systematic Reviews,42,https://doi.org/10.1002/14651858.cd001964.pub2,https://api.labs.crossref.org/works/https://doi.org/10.1002/14651858.cd001964.pub2?mailto=christian.hauschke@tib.eu,2003,reference-entry,True,92,Gastric Cancer Research and Treatment,Health Sciences,Pulmonary and Respiratory Medicine,Cochrane,False,en,Medicine,
https://openalex.org/W2014699775,RETRACTED ARTICLE: Cardiovascular responses to tracheal extubation or LMA removal in normotensive and hypertensive patients,Canadian Journal of Anesthesia/Journal canadien d'anesthésie,41,https://doi.org/10.1007/bf03019230,https://api.labs.crossref.org/works/https://doi.org/10.1007/bf03019230?mailto=christian.hauschke@tib.eu,1997,article,True,92,Management of Difficult Airway in Anesthesia Practice,Health Sciences,Anesthesiology and Pain Medicine,Springer Science+Business Media,False,en,Medicine,
https://openalex.org/W2019945880,Effects of calcium channel blockers on circulatory response to tracheal intubation in hypertensive patients: nicardipine versus diltiazem,Canadian Journal of Anesthesia/Journal canadien d'anesthésie,41,https://doi.org/10.1007/bf03011177,https://api.labs.crossref.org/works/https://doi.org/10.1007/bf03011177?mailto=christian.hauschke@tib.eu,1995,article,True,92,Anesthesia and Sedation Management,Health Sciences,Anesthesiology and Pain Medicine,Springer Science+Business Media,True,en,Medicine,
https://openalex.org/W2031437469,RETRACTED ARTICLE: Genetic alterations of the NRP/B gene are associated with human brain tumors,Oncogene,41,https://doi.org/10.1038/sj.onc.1207776,https://api.labs.crossref.org/works/https://doi.org/10.1038/sj.onc.1207776?mailto=christian.hauschke@tib.eu,2004,article,True,92,Regulation and Function of Microtubules in Cell Division,Life Sciences,Cell Biology,Springer Nature,False,en,"Biochemistry, Genetics and Molecular Biology",
https://openalex.org/W2034180004,Bird-like fossil footprints from the Late Triassic,Nature,41,https://doi.org/10.1038/nature00818,https://api.labs.crossref.org/works/https://doi.org/10.1038/nature00818?mailto=christian.hauschke@tib.eu,2002,article,True,92,Evolutionary History and Diversity of Dinosaurs,Physical Sciences,Paleontology,Nature Portfolio,True,en,Earth and Planetary Sciences,
https://openalex.org/W2039627586,"RETRACTED: Gum and resin resources from some Acacia, Boswellia and Commiphora species and their economic contributions in Liban, Southeast Ethiopia",Journal of Arid Environments,41,https://doi.org/10.1016/s0140-1963(03)00003-x,https://api.labs.crossref.org/works/https://doi.org/10.1016/s0140-1963(03)00003-x?mailto=christian.hauschke@tib.eu,2004,article,True,92,Therapeutic Potential of Boswellic Acids and Related Compounds,Health Sciences,Pharmacology,Elsevier BV,True,en,Medicine,
https://openalex.org/W2055524637,The Glycoprotein Ib-IX-V Complex Mediates Localization of Factor XI to Lipid Rafts on the Platelet Membrane,Journal of Biological Chemistry,41,https://doi.org/10.1074/jbc.m212991200,https://api.labs.crossref.org/works/https://doi.org/10.1074/jbc.m212991200?mailto=christian.hauschke@tib.eu,2003,article,True,92,Blood Rheology and Coagulation Mechanisms,Health Sciences,Pulmonary and Respiratory Medicine,Elsevier BV,True,en,Medicine,
https://openalex.org/W2075641622,A Role for Ran-GTP and Crm1 in Blocking Re-Replication,Cell,41,https://doi.org/10.1016/s0092-8674(03)00200-9,https://api.labs.crossref.org/works/https://doi.org/10.1016/s0092-8674(03)00200-9?mailto=christian.hauschke@tib.eu,2003,article,True,92,Molecular Mechanisms of DNA Damage Response,Life Sciences,Molecular Biology,Cell Press,True,en,"Biochemistry, Genetics and Molecular Biology",
https://openalex.org/W2119559512,Constitutive Nuclear Factor-κB Activity Is Crucial for Human Retinoblastoma Cell Viability,The American Journal of Pathology,41,https://doi.org/10.1016/s0002-9440(10)64499-9,https://api.labs.crossref.org/works/https://doi.org/10.1016/s0002-9440(10)64499-9?mailto=christian.hauschke@tib.eu,2002,article,True,92,NF-?B Signaling in Inflammation and Cancer,Life Sciences,Cancer Research,Elsevier BV,True,en,"Biochemistry, Genetics and Molecular Biology",
https://openalex.org/W2147830699,Regulation of the Maintenance of Peripheral T-Cell Anergy by TAB1-Mediated p38α Activation,Molecular and Cellular Biology,41,https://doi.org/10.1128/mcb.24.16.6957-6966.2004,https://api.labs.crossref.org/works/https://doi.org/10.1128/mcb.24.16.6957-6966.2004?mailto=christian.hauschke@tib.eu,2004,article,True,92,Natural Killer Cells in Immunity,Life Sciences,Immunology,Taylor & Francis,True,en,Immunology and Microbiology,
https://openalex.org/W2158109071,Polymorphisms of the <b> <i>CYP1B1</i> </b> Gene as Risk Factors for Human Renal Cell Cancer,Clinical Cancer Research,41,https://doi.org/10.1158/1078-0432.ccr-03-0166,https://api.labs.crossref.org/works/https://doi.org/10.1158/1078-0432.ccr-03-0166?mailto=christian.hauschke@tib.eu,2004,article,True,92,Role of Glutathione in Oxidative Stress Response,Life Sciences,Molecular Biology,American Association for Cancer Research,True,en,"Biochemistry, Genetics and Molecular Biology",
https://openalex.org/W2174653509,Clinically Established Hemostatic Scaffold (Tissue Fleece) as Biomatrix in Tissue- and Organ-Engineering Research,Tissue Engineering,41,https://doi.org/10.1089/107632703322066697,https://api.labs.crossref.org/works/https://doi.org/10.1089/107632703322066697?mailto=christian.hauschke@tib.eu,2003,article,True,92,Electrospun Nanofibers in Biomedical Applications,Physical Sciences,Biomaterials,"Mary Ann Liebert, Inc.",False,en,Materials Science,
https://openalex.org/W2008332958,Retracted: Protein kinase CK2 phosphorylation regulates the interaction of Kaposi's sarcoma-associated herpesvirus regulatory protein ORF57 with its multifunctional partner hnRNP K,Nucleic Acids Research,40,https://doi.org/10.1093/nar/gkh876,https://api.labs.crossref.org/works/https://doi.org/10.1093/nar/gkh876?mailto=christian.hauschke@tib.eu,2004,article,True,92,Viral-Related Cancers in Immunocompromised Patients,Health Sciences,Oncology,Oxford University Press,True,en,Medicine,
https://openalex.org/W2008936283,Membrane permeabilization by Listeria monocytogenes phosphatidylinositol-specific phospholipase C is independent of phospholipid hydrolysis and cooperative with listeriolysin O.,Proceedings of the National Academy of Sciences of the United States of America,40,https://doi.org/10.1073/pnas.92.7.2979,https://api.labs.crossref.org/works/https://doi.org/10.1073/pnas.92.7.2979?mailto=christian.hauschke@tib.eu,1995,article,True,92,Listeria Monocytogenes Pathogenesis and Food Safety,Life Sciences,Biotechnology,National Academy of Sciences,True,en,"Biochemistry, Genetics and Molecular Biology",
https://openalex.org/W2052868422,Polo-like kinase confers MPF autoamplification competence to growing<i>Xenopus</i>oocytes,Development,40,https://doi.org/10.1242/dev.01050,https://api.labs.crossref.org/works/https://doi.org/10.1242/dev.01050?mailto=christian.hauschke@tib.eu,2004,article,True,92,Regulation and Function of Microtubules in Cell Division,Life Sciences,Cell Biology,The Company of Biologists,True,en,"Biochemistry, Genetics and Molecular Biology",
