id,display_name,primary_location_display_name,cited_by_count,doi,crossref_call,publication_year,type,is_retracted,cited_by_percentile_year_min,primary_topic_display_name,primary_topic_domain_display_name,primary_topic_subfield_display_name,primary_location_source_host_organization_name,open_access_is_oa,language,primary_topic_field_display_name,update_nature
https://openalex.org/W1506724151,<i>Retracted</i>: Magnetic resonance imaging of uterine abnormalities,The Obstetrician & Gynaecologist,0,https://doi.org/10.1111/j.1744-4667.2011.00077.x,https://api.labs.crossref.org/works/https://doi.org/10.1111/j.1744-4667.2011.00077.x?mailto=christian.hauschke@tib.eu,2012,article,True,0,Clinical Implications of Uterine Anomalies and Treatment,Health Sciences,Obstetrics and Gynecology,Wiley-Blackwell,False,en,Medicine,Retraction
https://openalex.org/W1506918832,Notice of Retraction: The relationship among transformational leadership team learning ability and team innovation,,0,https://doi.org/10.1109/icebeg.2011.5882732,https://api.labs.crossref.org/works/https://doi.org/10.1109/icebeg.2011.5882732?mailto=christian.hauschke@tib.eu,2011,article,True,0,Knowledge Sharing in Virtual Communities,Social Sciences,Communication,,False,en,Social Sciences,Retraction
https://openalex.org/W1507055018,Notice of Retraction: Rural-urban migrants' migration patterns and transformation in the process of urbanization,,0,https://doi.org/10.1109/icebeg.2011.5887163,https://api.labs.crossref.org/works/https://doi.org/10.1109/icebeg.2011.5887163?mailto=christian.hauschke@tib.eu,2011,article,True,0,Immigrant Entrepreneurship in Advanced Economies,Social Sciences,Sociology and Political Science,,False,en,Social Sciences,Retraction
https://openalex.org/W1507117652,Notice of Retraction: Brief analysis on pay system of private enterprises — Taking a certain house supplies enterprise of Shijiazhuang as example,,0,https://doi.org/10.1109/icebeg.2011.5881467,https://api.labs.crossref.org/works/https://doi.org/10.1109/icebeg.2011.5881467?mailto=christian.hauschke@tib.eu,2011,article,True,0,Collaborative Networks in Manufacturing and Organizations,Social Sciences,Management of Technology and Innovation,,False,en,"Business, Management and Accounting",Retraction
https://openalex.org/W1507161503,Notice of Retraction: Research on carbon emissions trading mechanism between urban industry and base agriculture,,0,https://doi.org/10.1109/icebeg.2011.5882638,https://api.labs.crossref.org/works/https://doi.org/10.1109/icebeg.2011.5882638?mailto=christian.hauschke@tib.eu,2011,article,True,0,Spatial Shift-Share Analysis in Economic Development,Social Sciences,Economics and Econometrics,,False,en,"Economics, Econometrics and Finance",Retraction
https://openalex.org/W1507279390,Notice of Retraction: Research of second degree price discrimination based on linear stochastic demand,,0,https://doi.org/10.1109/icebeg.2011.5886888,https://api.labs.crossref.org/works/https://doi.org/10.1109/icebeg.2011.5886888?mailto=christian.hauschke@tib.eu,2011,article,True,0,Coordination and Information Sharing in Supply Chains,Social Sciences,Management Information Systems,,False,en,"Business, Management and Accounting",Retraction
https://openalex.org/W1507339330,Notice of Retraction: Research on the application of position-points salary in enterprise salary management,,0,https://doi.org/10.1109/icbmei.2011.5916976,https://api.labs.crossref.org/works/https://doi.org/10.1109/icbmei.2011.5916976?mailto=christian.hauschke@tib.eu,2011,article,True,0,Optimization of Staff Scheduling and Rostering,Social Sciences,Management Science and Operations Research,,False,en,Decision Sciences,Retraction
https://openalex.org/W1507349710,Notice of Retraction: Financial performance evaluation of Chinese high-tech listed companies,,0,https://doi.org/10.1109/icebeg.2011.5884489,https://api.labs.crossref.org/works/https://doi.org/10.1109/icebeg.2011.5884489?mailto=christian.hauschke@tib.eu,2011,article,True,0,Value-based Management and Economic Performance Measurement,Social Sciences,Strategy and Management,,False,en,"Business, Management and Accounting",Retraction
https://openalex.org/W1507350257,"Notice of Retraction: A framework of Chinese handwriting learning, evaluating and research system based on real-time handwriting information collection",,0,https://doi.org/10.1109/aimsec.2011.6010441,https://api.labs.crossref.org/works/https://doi.org/10.1109/aimsec.2011.6010441?mailto=christian.hauschke@tib.eu,2011,article,True,0,Handwriting Recognition and Text Detection,Physical Sciences,Computer Vision and Pattern Recognition,,False,en,Computer Science,Retraction
https://openalex.org/W1507370856,Notice of Retraction: New thinking of western China small and medium-sized enterprises in commercial struggle,,0,https://doi.org/10.1109/icebeg.2011.5881546,https://api.labs.crossref.org/works/https://doi.org/10.1109/icebeg.2011.5881546?mailto=christian.hauschke@tib.eu,2011,article,True,0,International Business Strategy in Emerging Economies,Social Sciences,Strategy and Management,,False,en,"Business, Management and Accounting",Retraction
https://openalex.org/W1507410146,Notice of Retraction: Mutagenic Action of Milbemycin oxime,,0,https://doi.org/10.1109/icbbe.2011.5781525,https://api.labs.crossref.org/works/https://doi.org/10.1109/icbbe.2011.5781525?mailto=christian.hauschke@tib.eu,2011,article,True,0,Pesticide Pollution and Management,Physical Sciences,Pollution,,False,en,Environmental Science,Retraction
https://openalex.org/W1507451808,Notice of Retraction: Primary and secondary school-based on management of digital campus,,0,https://doi.org/10.1109/aimsec.2011.6010515,https://api.labs.crossref.org/works/https://doi.org/10.1109/aimsec.2011.6010515?mailto=christian.hauschke@tib.eu,2011,article,True,0,Impact of Technology on Education and Training,Physical Sciences,Information Systems,,False,en,Computer Science,Retraction
https://openalex.org/W1507456500,Notice of Retraction: Competitive analysis of price uncertainty inventory problem,,0,https://doi.org/10.1109/icsess.2011.5982284,https://api.labs.crossref.org/works/https://doi.org/10.1109/icsess.2011.5982284?mailto=christian.hauschke@tib.eu,2011,article,True,0,Distributed Coordination in Online Robotics Research,Physical Sciences,Computer Networks and Communications,,False,en,Computer Science,Retraction
https://openalex.org/W1507470475,Notice of Retraction: Empirical analysis of investment determining factors in China — Based on non-financial listed company's correlation data,,0,https://doi.org/10.1109/icebeg.2011.5881317,https://api.labs.crossref.org/works/https://doi.org/10.1109/icebeg.2011.5881317?mailto=christian.hauschke@tib.eu,2011,article,True,0,Fuzzy Class Membership Modeling in Environmental Sciences,Physical Sciences,Ecological Modeling,,False,en,Environmental Science,Retraction
https://openalex.org/W1507503897,Notice of Retraction Si multi-nanochannel FETs to improve device uniformity/stability and detection of 10 fM insulin in serum,,0,https://doi.org/10.1109/nano.2011.6144453,https://api.labs.crossref.org/works/https://doi.org/10.1109/nano.2011.6144453?mailto=christian.hauschke@tib.eu,2011,article,True,0,Nanowire Nanosensors for Biomedical and Energy Applications,Physical Sciences,Biomedical Engineering,,False,en,Engineering,Retraction
https://openalex.org/W1507584450,Notice of Retraction: Study on Guangdong competitiveness of service outsourcing industry based on value chain,,0,https://doi.org/10.1109/icebeg.2011.5886932,https://api.labs.crossref.org/works/https://doi.org/10.1109/icebeg.2011.5886932?mailto=christian.hauschke@tib.eu,2011,article,True,0,Information Systems Outsourcing and Offshoring,Social Sciences,Management Information Systems,,False,en,"Business, Management and Accounting",Retraction
https://openalex.org/W1507620202,Notice of Retraction: Testing the consumption function of Chinese rural household,,0,https://doi.org/10.1109/icebeg.2011.5882468,https://api.labs.crossref.org/works/https://doi.org/10.1109/icebeg.2011.5882468?mailto=christian.hauschke@tib.eu,2011,article,True,0,Impacts of Food Prices on Consumption and Poverty,Social Sciences,Economics and Econometrics,,False,en,"Economics, Econometrics and Finance",Retraction
https://openalex.org/W1507643871,Notice of Retraction: Research on the intensive-green-industry chain development mode for resource-based cities,,0,https://doi.org/10.1109/icpim.2011.5983662,https://api.labs.crossref.org/works/https://doi.org/10.1109/icpim.2011.5983662?mailto=christian.hauschke@tib.eu,2011,article,True,0,Emergency Management in Various Industries,Social Sciences,Organizational Behavior and Human Resource Management,,False,en,"Business, Management and Accounting",Retraction
https://openalex.org/W1507653030,Notice of Retraction: On the research of the domestic IPR pledge loan and appraisal,,0,https://doi.org/10.1109/icbmei.2011.5921010,https://api.labs.crossref.org/works/https://doi.org/10.1109/icbmei.2011.5921010?mailto=christian.hauschke@tib.eu,2011,article,True,0,Global Bankruptcy Law and Financial Distress,Social Sciences,Accounting,,False,en,"Business, Management and Accounting",Retraction
https://openalex.org/W1507675517,Notice of Retraction: Analysis of the clothing consumption under the profit preferences,,0,https://doi.org/10.1109/icebeg.2011.5881740,https://api.labs.crossref.org/works/https://doi.org/10.1109/icebeg.2011.5881740?mailto=christian.hauschke@tib.eu,2011,article,True,0,Understanding Consumer Behavior in Retail Environments,Social Sciences,Marketing,,False,en,"Business, Management and Accounting",Retraction
https://openalex.org/W1507742792,Notice of Retraction: Emergency region of instantaneous dispersion caused by leakage of natural gas highly containing carbon dioxide,,0,https://doi.org/10.1109/icemms.2011.6015637,https://api.labs.crossref.org/works/https://doi.org/10.1109/icemms.2011.6015637?mailto=christian.hauschke@tib.eu,2011,article,True,0,Challenges and Applications of Detonation Propulsion Technology,Physical Sciences,Aerospace Engineering,,False,en,Engineering,Retraction
https://openalex.org/W1507829025,Notice of Retraction: The analysis of current risk-management problems and the corresponding countermeasures in the process of large-scale development of Electrical Enterprise in China,,0,https://doi.org/10.1109/icebeg.2011.5882037,https://api.labs.crossref.org/works/https://doi.org/10.1109/icebeg.2011.5882037?mailto=christian.hauschke@tib.eu,2011,article,True,0,Comprehensive Assessment of Safety in Energy and Infrastructure,Physical Sciences,"Safety, Risk, Reliability and Quality",,False,en,Engineering,Retraction
https://openalex.org/W1507832681,Notice of Retraction: An evaluation model of R &amp; D personnel's innovation capability based on the AHP-Cloud model,,0,https://doi.org/10.1109/icpim.2011.5983669,https://api.labs.crossref.org/works/https://doi.org/10.1109/icpim.2011.5983669?mailto=christian.hauschke@tib.eu,2011,article,True,0,Spatial Data Mining and Cloud Model Applications,Physical Sciences,Information Systems,,False,en,Computer Science,Retraction
https://openalex.org/W1507875088,Notice of Retraction: The application of interval uncertain multi-attribute decision-making in customer satisfaction evaluation,,0,https://doi.org/10.1109/icebeg.2011.5881402,https://api.labs.crossref.org/works/https://doi.org/10.1109/icebeg.2011.5881402?mailto=christian.hauschke@tib.eu,2011,article,True,0,Comprehensive Assessment of Safety in Energy and Infrastructure,Physical Sciences,"Safety, Risk, Reliability and Quality",,False,en,Engineering,Retraction
https://openalex.org/W1507879816,Notice of Retraction: Research on the influencing factors for the urban residents low carbon energy consumption behavior,,0,https://doi.org/10.1109/icebeg.2011.5877071,https://api.labs.crossref.org/works/https://doi.org/10.1109/icebeg.2011.5877071?mailto=christian.hauschke@tib.eu,2011,article,True,0,Factors Influencing Pro-environmental Behavior,Physical Sciences,"Management, Monitoring, Policy and Law",,False,en,Environmental Science,Retraction
https://openalex.org/W1507880819,Notice of Retraction: Establishment of social order and performance budget reform under the rules of Constitutionalism,,0,https://doi.org/10.1109/icebeg.2011.5882355,https://api.labs.crossref.org/works/https://doi.org/10.1109/icebeg.2011.5882355?mailto=christian.hauschke@tib.eu,2011,article,True,0,Political and Economic Impacts of Fiscal Policy Cycles,Social Sciences,Economics and Econometrics,,False,en,"Economics, Econometrics and Finance",Retraction
https://openalex.org/W1508115435,Notice of Retraction Frameworks of process-based sampling inspection for ammunition products,,0,https://doi.org/10.1109/qr2mse.2013.6625792,https://api.labs.crossref.org/works/https://doi.org/10.1109/qr2mse.2013.6625792?mailto=christian.hauschke@tib.eu,2013,article,True,0,Statistical Process Control in Research and Healthcare Improvement,Social Sciences,"Statistics, Probability and Uncertainty",,False,en,Decision Sciences,Retraction
https://openalex.org/W1508230700,Notice of Retraction: The negative effect of seller's technology monopoly on buyer's countervailing power: Using China's PV industry as a case study,,0,https://doi.org/10.1109/icebeg.2011.5886985,https://api.labs.crossref.org/works/https://doi.org/10.1109/icebeg.2011.5886985?mailto=christian.hauschke@tib.eu,2011,article,True,0,Electricity Market Operation and Optimization,Physical Sciences,Electrical and Electronic Engineering,,False,en,Engineering,Retraction
https://openalex.org/W1508287193,Notice of Retraction: Photocatalytic Properties of Titanium Dioxide Loaded on ZSM-5 Zeolites Modified by NaOH and NH4Cl,,0,https://doi.org/10.1109/icbbe.2011.5781041,https://api.labs.crossref.org/works/https://doi.org/10.1109/icbbe.2011.5781041?mailto=christian.hauschke@tib.eu,2011,article,True,0,Photocatalysis and Solar Energy Conversion,Physical Sciences,"Renewable Energy, Sustainability and the Environment",,False,en,Energy,Retraction
https://openalex.org/W1508542729,Notice of Retraction: Analysis female entrepreneurship policy and support system A study based on Tianjin Women Entrepreneurship Centre,,0,https://doi.org/10.1109/aimsec.2011.6009700,https://api.labs.crossref.org/works/https://doi.org/10.1109/aimsec.2011.6009700?mailto=christian.hauschke@tib.eu,2011,article,True,0,Entrepreneurship and Business Innovation,Social Sciences,Management of Technology and Innovation,,False,en,"Business, Management and Accounting",Retraction
https://openalex.org/W1508558338,Notice of Retraction: Research on the Advanced Treatment of Coking Water with Iron-Carbon Substrate Constructed Wetland,,0,https://doi.org/10.1109/icbbe.2011.5781130,https://api.labs.crossref.org/works/https://doi.org/10.1109/icbbe.2011.5781130?mailto=christian.hauschke@tib.eu,2011,article,True,0,Application of Constructed Wetlands for Wastewater Treatment,Physical Sciences,Industrial and Manufacturing Engineering,,False,en,Environmental Science,Retraction
https://openalex.org/W1508593224,Notice of Retraction: The disconnect between theory and practice of management in China,,0,https://doi.org/10.1109/icebeg.2011.5881637,https://api.labs.crossref.org/works/https://doi.org/10.1109/icebeg.2011.5881637?mailto=christian.hauschke@tib.eu,2011,article,True,0,Evolution of Management Theories and Practices,Social Sciences,Organizational Behavior and Human Resource Management,,False,en,"Business, Management and Accounting",Retraction
https://openalex.org/W1508710336,Notice of Retraction: Influences of Three Plant Species on Fertility of Iron Mine Tailings Contained Vermicompost: Experiment in Greenhouse,,0,https://doi.org/10.1109/icbbe.2011.5781560,https://api.labs.crossref.org/works/https://doi.org/10.1109/icbbe.2011.5781560?mailto=christian.hauschke@tib.eu,2011,article,True,0,Management of Soil Fertility and Crop Productivity,Life Sciences,Soil Science,,False,en,Agricultural and Biological Sciences,Retraction
https://openalex.org/W1508868429,Notice of Retraction: Primary research on domestic fertilizer futures,,0,https://doi.org/10.1109/aimsec.2011.6009659,https://api.labs.crossref.org/works/https://doi.org/10.1109/aimsec.2011.6009659?mailto=christian.hauschke@tib.eu,2011,article,True,0,Hydrological Effects and Water Resource Management in China,Physical Sciences,Water Science and Technology,,False,en,Environmental Science,Retraction
https://openalex.org/W1508976748,Notice of Retraction: Research on distribution mechanism of supply chain risk based on cooperative games,,0,https://doi.org/10.1109/icsess.2011.5982439,https://api.labs.crossref.org/works/https://doi.org/10.1109/icsess.2011.5982439?mailto=christian.hauschke@tib.eu,2011,article,True,0,Coordination and Information Sharing in Supply Chains,Social Sciences,Management Information Systems,,False,en,"Business, Management and Accounting",Retraction
https://openalex.org/W1509116228,Notice of Retraction: Consideration and study on applying multimedia techniques in college mathematics courses,,0,https://doi.org/10.1109/icebeg.2011.5887054,https://api.labs.crossref.org/works/https://doi.org/10.1109/icebeg.2011.5887054?mailto=christian.hauschke@tib.eu,2011,article,True,0,Education and Leadership in Complex Systems,Social Sciences,Education,,False,en,Social Sciences,Retraction
https://openalex.org/W1509250515,Importance of spondin 1 and cellular retinoic acid binding protein 1 in the clinical diagnosis of ovarian cancer.,PubMed,0,,https://api.labs.crossref.org/works/null?mailto=christian.hauschke@tib.eu,2013,article,True,0,Role of Retinoic Acid in Biological Processes,Life Sciences,Molecular Biology,National Institutes of Health,False,en,"Biochemistry, Genetics and Molecular Biology",
https://openalex.org/W1509255193,Notice of Retraction The technology application for prevention of root rock loss for concrete hollow round platform,,0,https://doi.org/10.1109/iceceng.2011.6058259,https://api.labs.crossref.org/works/https://doi.org/10.1109/iceceng.2011.6058259?mailto=christian.hauschke@tib.eu,2011,article,True,0,Study on Rock Mechanics in Deep Mining Engineering,Physical Sciences,Mechanics of Materials,,False,en,Engineering,Retraction
https://openalex.org/W1509317039,"Notice of Retraction: Patent protection, agglomeration and economic growth",,0,https://doi.org/10.1109/aimsec.2011.6009707,https://api.labs.crossref.org/works/https://doi.org/10.1109/aimsec.2011.6009707?mailto=christian.hauschke@tib.eu,2011,article,True,0,Institutions and Economic Growth: Empirical Investigations and Theories,Social Sciences,Economics and Econometrics,,False,en,"Economics, Econometrics and Finance",Retraction
https://openalex.org/W1509670879,Notice of Retraction: The teaching repository's construction on the basis of subject essence,,0,https://doi.org/10.1109/aimsec.2011.6010232,https://api.labs.crossref.org/works/https://doi.org/10.1109/aimsec.2011.6010232?mailto=christian.hauschke@tib.eu,2011,article,True,0,Impact of Technology on Education and Training,Physical Sciences,Information Systems,,False,en,Computer Science,Retraction
https://openalex.org/W1509693841,Notice of Retraction: Research on individual performance of team: From the view of disagreement,,0,https://doi.org/10.1109/icebeg.2011.5882644,https://api.labs.crossref.org/works/https://doi.org/10.1109/icebeg.2011.5882644?mailto=christian.hauschke@tib.eu,2011,article,True,0,Knowledge Sharing in Virtual Communities,Social Sciences,Communication,,False,en,Social Sciences,Retraction
https://openalex.org/W1509796504,Notice of Retraction: Research on the way of the effect information disclosure quality does on the cost of equity capital considering the time element,,0,https://doi.org/10.1109/icebeg.2011.5881371,https://api.labs.crossref.org/works/https://doi.org/10.1109/icebeg.2011.5881371?mailto=christian.hauschke@tib.eu,2011,article,True,0,Financial Reporting and Earnings Management,Social Sciences,Accounting,,False,en,"Business, Management and Accounting",Retraction
https://openalex.org/W1509840732,"Notice of Retraction: Does pedestrian-oriented design influence public transit riderships in Chinese City, Taipei?",,0,https://doi.org/10.1109/icetce.2011.5776096,https://api.labs.crossref.org/works/https://doi.org/10.1109/icetce.2011.5776096?mailto=christian.hauschke@tib.eu,2011,article,True,0,Influence of Built Environment on Active Travel,Social Sciences,Transportation,,False,en,Social Sciences,Retraction
