id,display_name,primary_location_display_name,cited_by_count,doi,crossref_call,publication_year,type,is_retracted,cited_by_percentile_year_min,primary_topic_display_name,primary_topic_domain_display_name,primary_topic_subfield_display_name,primary_location_source_host_organization_name,open_access_is_oa,language,primary_topic_field_display_name,update_nature
https://openalex.org/W1966776660,"PHARMACOLOGICAL STUDIES ON THE STIMULATION OF THE PHOSPHOLIPASE A2‐ACYLATION SYSTEM OF SYNAPTIC MEMBRANES OF BRAIN, BY NEUROTRANSMITTERS AND OTHER AGONISTS",Journal of Neurochemistry,4,https://doi.org/10.1111/j.1471-4159.1976.tb07010.x,https://api.labs.crossref.org/works/https://doi.org/10.1111/j.1471-4159.1976.tb07010.x?mailto=christian.hauschke@tib.eu,1976,article,True,76,Molecular Mechanisms of Synaptic Plasticity and Neurological Disorders,Life Sciences,Cellular and Molecular Neuroscience,Wiley-Blackwell,False,en,Neuroscience,
https://openalex.org/W143587371,Age-Related Differences in Metoclopramide Requirement for Pain??on Injection of Propofol,Clinical Drug Investigation,3,https://doi.org/10.2165/00044011-200626110-00003,https://api.labs.crossref.org/works/https://doi.org/10.2165/00044011-200626110-00003?mailto=christian.hauschke@tib.eu,2006,article,True,76,Prevention and Management of Postoperative Nausea and Vomiting,Health Sciences,Surgery,"Adis, Springer Healthcare",False,en,Medicine,
https://openalex.org/W1488296936,Case management for substance use disorders,Cochrane Database of Systematic Reviews,3,https://doi.org/10.1002/14651858.cd006265,https://api.labs.crossref.org/works/https://doi.org/10.1002/14651858.cd006265?mailto=christian.hauschke@tib.eu,2006,reference-entry,True,76,Epidemiology and Interventions for Substance Use Disorders,Health Sciences,Epidemiology,Cochrane,False,en,Medicine,
https://openalex.org/W1571844963,A new inducible adenoviral expression system that responds to inflammatory stimuli <i>in vivo</i>,The Journal of Gene Medicine,3,https://doi.org/10.1002/jgm.983,https://api.labs.crossref.org/works/https://doi.org/10.1002/jgm.983?mailto=christian.hauschke@tib.eu,2006,article,True,76,Gene Therapy Techniques and Applications,Life Sciences,Genetics,Wiley-Blackwell,False,en,"Biochemistry, Genetics and Molecular Biology",
https://openalex.org/W1614726357,RETRACTED ARTICLE: Precipitation behavior of B2-ordered aluminide,Metals and Materials International,3,https://doi.org/10.1007/bf03027746,https://api.labs.crossref.org/works/https://doi.org/10.1007/bf03027746?mailto=christian.hauschke@tib.eu,2006,article,True,76,Design and Applications of Intermetallic Alloys,Physical Sciences,Mechanical Engineering,Springer Science+Business Media,False,en,Engineering,
https://openalex.org/W1619597373,Techniques and strategies for long-term bladder management by intermittent catheterisation in adults and children,Cochrane Database of Systematic Reviews,3,https://doi.org/10.1002/14651858.cd006008,https://api.labs.crossref.org/works/https://doi.org/10.1002/14651858.cd006008?mailto=christian.hauschke@tib.eu,2006,reference-entry,True,76,Standardisation of Lower Urinary Tract Function,Health Sciences,Urology,Cochrane,False,en,Medicine,
https://openalex.org/W1622027317,Influence of dissolved oxygen concentration on intracellular pH for regulation of Aspergillus niger growth rate during citric acid fermentation in a stirred tank bioreactor.,PubMed,3,,https://api.labs.crossref.org/works/null?mailto=christian.hauschke@tib.eu,2005,article,True,76,Metabolic Engineering and Synthetic Biology,Life Sciences,Molecular Biology,National Institutes of Health,False,en,"Biochemistry, Genetics and Molecular Biology",
https://openalex.org/W1709416435,On the Hardness of Embeddings Between Two Finite Metrics,Lecture Notes in Computer Science,3,https://doi.org/10.1007/11523468_114,https://api.labs.crossref.org/works/https://doi.org/10.1007/11523468_114?mailto=christian.hauschke@tib.eu,2005,book-chapter,True,76,Combinatorial Optimization and Complexity Theory,Physical Sciences,Computational Theory and Mathematics,Springer Science+Business Media,False,en,Computer Science,
https://openalex.org/W1881849220,"THIS ARTICLE HAS BEEN RETRACTED Tn<i>5530</i> from <i>Burkholderia cepacia</i> strain 2a encodes a chloride channel protein essential for the catabolism of 2,4‐dichlorophenoxyacetic acid",Environmental Microbiology,3,https://doi.org/10.1111/j.1462-2920.2006.01136.x,https://api.labs.crossref.org/works/https://doi.org/10.1111/j.1462-2920.2006.01136.x?mailto=christian.hauschke@tib.eu,2006,article,True,76,Molecular Mechanisms of Ion Channels Regulation,Life Sciences,Molecular Biology,Wiley-Blackwell,False,en,"Biochemistry, Genetics and Molecular Biology",
https://openalex.org/W193303270,Retracted: Shared Ontology for Pervasive Computing,Lecture Notes in Computer Science,3,https://doi.org/10.1007/11596370_7,https://api.labs.crossref.org/works/https://doi.org/10.1007/11596370_7?mailto=christian.hauschke@tib.eu,2005,book-chapter,True,76,Activity Recognition in Pervasive Computing Environments,Physical Sciences,Computer Vision and Pattern Recognition,Springer Science+Business Media,False,en,Computer Science,
https://openalex.org/W1969732384,Detecting Normal Cell Radiosensitivity via Assay of DNA Damage in Lymphocytes for Individualizing Radiotherapy in Head and Neck Cancer Patients,Oncology,3,https://doi.org/10.1159/000088332,https://api.labs.crossref.org/works/https://doi.org/10.1159/000088332?mailto=christian.hauschke@tib.eu,2005,article,True,76,Biological and Clinical Effects of Ionizing Radiation,Health Sciences,"Radiology, Nuclear Medicine and Imaging",Karger Publishers,False,en,Medicine,
https://openalex.org/W1970302354,RETRACTED ARTICLE: Comparative study on the environmental impact assessment of golf course development between Korea and China,Landscape and Ecological Engineering,3,https://doi.org/10.1007/s11355-006-0034-4,https://api.labs.crossref.org/works/https://doi.org/10.1007/s11355-006-0034-4?mailto=christian.hauschke@tib.eu,2006,article,True,76,Trends in Health Care Research and Practice,Health Sciences,"Public Health, Environmental and Occupational Health",Springer Science+Business Media,False,en,Medicine,
https://openalex.org/W1980052750,"Simultaneous, Phenotypic Knockout of VEGF-R2 and Tie-2 with an Intradiabody Enhances Antiangiogenic Effects In Vivo",Klinische Padiatrie,3,https://doi.org/10.1055/s-2006-933415,https://api.labs.crossref.org/works/https://doi.org/10.1055/s-2006-933415?mailto=christian.hauschke@tib.eu,2006,article,True,76,"Therapeutic Antibodies: Development, Engineering, and Applications",Health Sciences,"Radiology, Nuclear Medicine and Imaging",Thieme Medical Publishers (Germany),False,en,Medicine,
https://openalex.org/W1982775636,RETRACTED: Recent advance in hepatic insulin gene therapy,Diabetes Research and Clinical Practice,3,https://doi.org/10.1016/j.diabres.2003.10.029,https://api.labs.crossref.org/works/https://doi.org/10.1016/j.diabres.2003.10.029?mailto=christian.hauschke@tib.eu,2004,article,True,76,Pancreatic Islet Dysfunction and Regeneration,Health Sciences,Surgery,Elsevier BV,True,en,Medicine,
https://openalex.org/W1985057918,Notice of Violation of IEEE Publication Principles<BR>A -86dBc reference spurs 1-5GHz 0.13&#x003BC;m CMOS PLL using a dual-path sampled loop filter architecture,,3,https://doi.org/10.1109/vlsic.2005.1469378,https://api.labs.crossref.org/works/https://doi.org/10.1109/vlsic.2005.1469378?mailto=christian.hauschke@tib.eu,2005,article,True,76,Phase-Locked Loops in High-Speed Circuits,Physical Sciences,Electrical and Electronic Engineering,,False,en,Engineering,
https://openalex.org/W1989001688,RETRACTED ARTICLE: Period of vibrations of framed structures,Materials and Structures,3,https://doi.org/10.1617/s11527-005-9008-5,https://api.labs.crossref.org/works/https://doi.org/10.1617/s11527-005-9008-5?mailto=christian.hauschke@tib.eu,2006,article,True,76,Topology Optimization in Structural Engineering,Physical Sciences,Civil and Structural Engineering,Springer Science+Business Media,False,en,Engineering,
https://openalex.org/W1992597316,Inaccurate Description of Collaborating Hospitals in a Study of the Effect of Folate and Mecobalamin on Hip Fractures After Stroke,JAMA,3,https://doi.org/10.1001/jama.296.4.396-a,https://api.labs.crossref.org/works/https://doi.org/10.1001/jama.296.4.396-a?mailto=christian.hauschke@tib.eu,2006,article,True,76,Incidence and Management of Hip Fractures,Health Sciences,Surgery,American Medical Association,False,en,Medicine,
https://openalex.org/W1996577645,Notice of Violation of IEEE Publication Principles - A 10GHz SiGe OC192 frequency synthesizer using a passive feed-forward loop filter and a half rate oscillator,,3,https://doi.org/10.1109/esscir.2004.1356693,https://api.labs.crossref.org/works/https://doi.org/10.1109/esscir.2004.1356693?mailto=christian.hauschke@tib.eu,2004,article,True,76,Phase-Locked Loops in High-Speed Circuits,Physical Sciences,Electrical and Electronic Engineering,,False,en,Engineering,
https://openalex.org/W1999501791,RETRACTED: Toward a greater understanding of health system nursing organizations and the role of the CNO,Nurse Leader,3,https://doi.org/10.1016/j.mnl.2006.05.004,https://api.labs.crossref.org/works/https://doi.org/10.1016/j.mnl.2006.05.004?mailto=christian.hauschke@tib.eu,2006,article,True,76,Nursing Advocacy and Health Policy Development,Health Sciences,"Issues, ethics and legal aspects",Elsevier BV,False,en,Nursing,
https://openalex.org/W2005924062,WITHDRAWN: Exploring permeability of Escherichia coli competence using quantum dots as fluorescent probes,Journal of Biochemical and Biophysical Methods,3,https://doi.org/10.1016/j.jbbm.2003.10.005,https://api.labs.crossref.org/works/https://doi.org/10.1016/j.jbbm.2003.10.005?mailto=christian.hauschke@tib.eu,2004,article,True,76,Diversity and Function of Gut Microbiome,Life Sciences,Molecular Biology,Elsevier BV,False,en,"Biochemistry, Genetics and Molecular Biology",
https://openalex.org/W2007074813,RETRACTED: A photochromic dye activation method for measuring the thickness of liquid films,Measurement,3,https://doi.org/10.1016/j.measurement.2005.12.013,https://api.labs.crossref.org/works/https://doi.org/10.1016/j.measurement.2005.12.013?mailto=christian.hauschke@tib.eu,2006,article,True,76,Photochromic Materials and Molecular Switches,Physical Sciences,Materials Chemistry,Elsevier BV,False,en,Materials Science,Retraction
https://openalex.org/W2007454179,"RETRACTED: Treatment of postoperative emetic symptoms with granisetron in women undergoing abdominal hysterectomy: a randomized, double-blind, placebo-controlled, dose-ranging study",Current Therapeutic Research,3,https://doi.org/10.1016/j.curtheres.2004.06.002,https://api.labs.crossref.org/works/https://doi.org/10.1016/j.curtheres.2004.06.002?mailto=christian.hauschke@tib.eu,2004,article,True,76,Prevention and Management of Postoperative Nausea and Vomiting,Health Sciences,Surgery,Elsevier BV,True,en,Medicine,Retraction
https://openalex.org/W2009829534,Effect of Four Crystalloid Cardioplegias on Immature Rabbit Hearts During Global Ischaemia,Asian Journal of Surgery,3,https://doi.org/10.1016/s1015-9584(09)60112-3,https://api.labs.crossref.org/works/https://doi.org/10.1016/s1015-9584(09)60112-3?mailto=christian.hauschke@tib.eu,2006,article,True,76,Pathophysiology of Myocardial Reperfusion Injury,Health Sciences,Pathology and Forensic Medicine,Elsevier BV,True,en,Medicine,Retraction
https://openalex.org/W2017736317,THIS ARTICLE HAS BEEN RETRACTED Cytokine typing: SNP allele frequencies in the Iranian population,International Journal of Immunogenetics,3,https://doi.org/10.1111/j.1744-313x.2006.00595.x,https://api.labs.crossref.org/works/https://doi.org/10.1111/j.1744-313x.2006.00595.x?mailto=christian.hauschke@tib.eu,2006,article,True,76,Regulatory T Cell Development and Function,Life Sciences,Immunology,Wiley-Blackwell,False,en,Immunology and Microbiology,Retraction
https://openalex.org/W2026870256,FACTOR STRUCTURE OF POSTTRAUMATIC STRESS DISORDER IN CHILDREN EXPERIENCED NATURAL DISASTER,Psychologia,3,https://doi.org/10.2117/psysoc.2004.158,https://api.labs.crossref.org/works/https://doi.org/10.2117/psysoc.2004.158?mailto=christian.hauschke@tib.eu,2004,article,True,76,Psychological Resilience and Well-being,Social Sciences,Clinical Psychology,,False,de,Psychology,Retraction
https://openalex.org/W2027906299,RETRACTED: Passivation properties of OLEDs with aluminum cathodes prepared by ion-beam-assisted deposition process,Applied Surface Science,3,https://doi.org/10.1016/j.apsusc.2004.07.048,https://api.labs.crossref.org/works/https://doi.org/10.1016/j.apsusc.2004.07.048?mailto=christian.hauschke@tib.eu,2005,article,True,76,Atomic Layer Deposition Technology,Physical Sciences,Electrical and Electronic Engineering,Elsevier BV,False,en,Engineering,Retraction
https://openalex.org/W2036304405,RETRACTED: Improving cooling devices for the hot face of Peltier pellets based on phase change fluids,Applied Thermal Engineering,3,https://doi.org/10.1016/j.applthermaleng.2005.10.026,https://api.labs.crossref.org/works/https://doi.org/10.1016/j.applthermaleng.2005.10.026?mailto=christian.hauschke@tib.eu,2006,article,True,76,Microchannel Heat Transfer and Cooling Technology,Physical Sciences,Mechanical Engineering,Elsevier BV,False,en,Engineering,Retraction
https://openalex.org/W2040687425,RETRACTED: Calcium ions: its role in cyanide neurotoxicity,Food and Chemical Toxicology,3,https://doi.org/10.1016/j.fct.2003.09.009,https://api.labs.crossref.org/works/https://doi.org/10.1016/j.fct.2003.09.009?mailto=christian.hauschke@tib.eu,2004,article,True,76,Cyanogenic Glycosides in Plants and Industrial Wastewaters,Life Sciences,Plant Science,Elsevier BV,True,en,Agricultural and Biological Sciences,Retraction
https://openalex.org/W2051889428,"[<i>N</i>,<i>N</i>′-Bis(2-hydroxynaphthylmethylene)-1,2-ethanediaminato]zinc(II)",Acta Crystallographica Section E-structure Reports Online,3,https://doi.org/10.1107/s1600536805026796,https://api.labs.crossref.org/works/https://doi.org/10.1107/s1600536805026796?mailto=christian.hauschke@tib.eu,2005,article,True,76,Platinum-Based Cancer Chemotherapy,Health Sciences,Oncology,International Union of Crystallography,False,en,Medicine,
https://openalex.org/W2057023426,RETRACTED: The effect of intraoperative valdecoxib administration on PGE2 levels in the CSF,The Journal of Pain,3,https://doi.org/10.1016/j.jpain.2005.01.079,https://api.labs.crossref.org/works/https://doi.org/10.1016/j.jpain.2005.01.079?mailto=christian.hauschke@tib.eu,2005,article,True,76,Metabolism and Function of Arachidonic Acid Derivatives,Life Sciences,Biochemistry,Elsevier BV,True,en,"Biochemistry, Genetics and Molecular Biology",Retraction;Crossmark Retraction
https://openalex.org/W2064722112,Beneficial Effect of Pretreatment and Treatment Continuation with Risedronate and Vitamin K&lt;sub&gt;2&lt;/sub&gt; on Cancellous Bone Loss after Ovariectomy in Rats: A Bone Histomorphometry Study,Journal of Nutritional Science and Vitaminology,3,https://doi.org/10.3177/jnsv.52.307,https://api.labs.crossref.org/works/https://doi.org/10.3177/jnsv.52.307?mailto=christian.hauschke@tib.eu,2006,article,True,76,Role of Vitamin K in Health,Health Sciences,Nutrition and Dietetics,Center for Academic Publications Japan,True,en,Nursing,Retraction
https://openalex.org/W2094279682,Notice of Violation of IEEE Publication Principles - A Low Power 12.5Gb/s SiGe Limiting Amplifier Using a Feed-forward Adjustable Threshold Loss-Of-Signal Detector,,3,https://doi.org/10.1109/bipol.2006.311164,https://api.labs.crossref.org/works/https://doi.org/10.1109/bipol.2006.311164?mailto=christian.hauschke@tib.eu,2006,article,True,76,Radio Frequency Integrated Circuit Design,Physical Sciences,Electrical and Electronic Engineering,,False,en,Engineering,Retraction
https://openalex.org/W2098209066,[NEt4][AuCl2][AuCl3]: Solid-State Evidence of Essentially Y-Shaped Jahn–Teller-Distorted AuCl3,Angewandte Chemie International Edition,3,https://doi.org/10.1002/anie.200602092,https://api.labs.crossref.org/works/https://doi.org/10.1002/anie.200602092?mailto=christian.hauschke@tib.eu,2006,article,True,76,Synthesis and Properties of Inorganic Cluster Compounds,Physical Sciences,Inorganic Chemistry,Wiley,False,en,Chemistry,Retraction
https://openalex.org/W2100096300,New antimicrobial peptide active against Gram-positive pathogens.,PubMed,3,,https://api.labs.crossref.org/works/null?mailto=christian.hauschke@tib.eu,2004,article,True,76,Antimicrobial Peptides in Host Defense and Therapy,Life Sciences,Microbiology,National Institutes of Health,False,en,Immunology and Microbiology,
https://openalex.org/W2112084755,<i>Retracted:</i> Blow‐up results for evolution problems on ℝ<sup><i>n</i></sup>,Mathematische Nachrichten,3,https://doi.org/10.1002/mana.200310289,https://api.labs.crossref.org/works/https://doi.org/10.1002/mana.200310289?mailto=christian.hauschke@tib.eu,2005,article,True,76,Multiscale Methods for Heterogeneous Systems,Physical Sciences,Computational Theory and Mathematics,Wiley,False,en,Computer Science,Retraction
https://openalex.org/W2115581867,Notice of Violation of IEEE Publication Principles - A 3.3V 10Gb/s SiGe limiting transimpedance amplifier using a pseudo-differential input and a limiting Cherry-Hooper stage,,3,https://doi.org/10.1109/rfic.2005.1489795,https://api.labs.crossref.org/works/https://doi.org/10.1109/rfic.2005.1489795?mailto=christian.hauschke@tib.eu,2005,article,True,76,Radio Frequency Integrated Circuit Design,Physical Sciences,Electrical and Electronic Engineering,,False,en,Engineering,Retraction
https://openalex.org/W2115883365,Focusing properties of a photonic crystal slab with multiple mechanisms in addition to negative refraction,Journal of the Optical Society of America,3,https://doi.org/10.1364/josaa.23.002283,https://api.labs.crossref.org/works/https://doi.org/10.1364/josaa.23.002283?mailto=christian.hauschke@tib.eu,2006,article,True,76,Photonic Crystals,Physical Sciences,"Atomic and Molecular Physics, and Optics",Optica Publishing Group,False,en,Physics and Astronomy,Retraction
https://openalex.org/W2131357636,RETRACTED: Induction of a TC1‐Mediated Experimental Autoimmune Thyroiditis by Deglycosylated Porcine Thyroglobulin,Immunopharmacology and Immunotoxicology,3,https://doi.org/10.1081/iph-200026872,https://api.labs.crossref.org/works/https://doi.org/10.1081/iph-200026872?mailto=christian.hauschke@tib.eu,2004,article,True,76,Genetics and Pathogenesis of Type 1 Diabetes,Life Sciences,Genetics,Taylor & Francis,False,en,"Biochemistry, Genetics and Molecular Biology",Retraction
https://openalex.org/W2134307776,Notice of Violation of IEEE Publication Principles - A Varactor-Less 10GHz CMOS LC-VCO for Optical Communications Transceiver SOCs Using Caged Inductors,,3,https://doi.org/10.1109/cicc.2006.320876,https://api.labs.crossref.org/works/https://doi.org/10.1109/cicc.2006.320876?mailto=christian.hauschke@tib.eu,2006,article,True,76,Radio Frequency Integrated Circuit Design,Physical Sciences,Electrical and Electronic Engineering,,False,en,Engineering,Retraction
https://openalex.org/W2136763892,Effect of breast-feeding on the development of atopic dermatitis.,PubMed,3,,https://api.labs.crossref.org/works/null?mailto=christian.hauschke@tib.eu,2005,article,True,76,Infant Crying and Colic Studies,Health Sciences,Pharmacy,National Institutes of Health,False,en,Health Professions,
https://openalex.org/W2141112915,Oxygen therapy for dyspnoea,Cochrane Database of Systematic Reviews,3,https://doi.org/10.1002/14651858.cd004769,https://api.labs.crossref.org/works/https://doi.org/10.1002/14651858.cd004769?mailto=christian.hauschke@tib.eu,2004,reference-entry,True,76,Mechanical Ventilation in Respiratory Failure and ARDS,Health Sciences,Pulmonary and Respiratory Medicine,Cochrane,False,en,Medicine,Retraction
https://openalex.org/W2141224855,"RETRACTED ARTICLE: Study on the expression specifications of geometrical products for function, design, manufacture and verification based on the improved GPS language",The International Journal of Advanced Manufacturing Technology,3,https://doi.org/10.1007/s00170-005-0395-0,https://api.labs.crossref.org/works/https://doi.org/10.1007/s00170-005-0395-0?mailto=christian.hauschke@tib.eu,2006,article,True,76,Design for Manufacture and Assembly in Manufacturing,Physical Sciences,Industrial and Manufacturing Engineering,Springer Science+Business Media,False,en,Engineering,Retraction
https://openalex.org/W2149020435,Notice of Violation of IEEE Publication Principles - A 12.5GHz SiGe BICMOS limiting amplifier using a dual offset cancellation loop,,3,https://doi.org/10.1109/esscir.2005.1541567,https://api.labs.crossref.org/works/https://doi.org/10.1109/esscir.2005.1541567?mailto=christian.hauschke@tib.eu,2005,article,True,76,Radio Frequency Integrated Circuit Design,Physical Sciences,Electrical and Electronic Engineering,,False,en,Engineering,Retraction
https://openalex.org/W2154803593,Retracted article: In-cell protein dynamics,Molecular BioSystems,3,https://doi.org/10.1039/b604684c,https://api.labs.crossref.org/works/https://doi.org/10.1039/b604684c?mailto=christian.hauschke@tib.eu,2006,article,True,76,Protein Structure Prediction and Analysis,Life Sciences,Molecular Biology,Royal Society of Chemistry,False,en,"Biochemistry, Genetics and Molecular Biology",Retraction
