id,display_name,primary_location_display_name,cited_by_count,doi,crossref_call,publication_year,type,is_retracted,cited_by_percentile_year_min,primary_topic_display_name,primary_topic_domain_display_name,primary_topic_subfield_display_name,primary_location_source_host_organization_name,open_access_is_oa,language,primary_topic_field_display_name,update_nature
https://openalex.org/W1670747923,Notice of Retraction Particle swarm optimization and application to valve dynamic characteristics optimization,,0,https://doi.org/10.1109/qr2mse.2013.6625624,https://api.labs.crossref.org/works/https://doi.org/10.1109/qr2mse.2013.6625624?mailto=christian.hauschke@tib.eu,2013,article,True,0,Design and Application of Intelligent Monitoring Systems,Physical Sciences,Control and Systems Engineering,,False,en,Engineering,
https://openalex.org/W1671064521,Notice of Retraction: Study on the Best Incentive Strength,,0,https://doi.org/10.1109/appeec.2011.5748705,https://api.labs.crossref.org/works/https://doi.org/10.1109/appeec.2011.5748705?mailto=christian.hauschke@tib.eu,2011,article,True,0,Consequences of Mortgage Credit Expansion and Housing Market Dynamics,Social Sciences,Economics and Econometrics,,False,en,"Economics, Econometrics and Finance",
https://openalex.org/W1671160737,Notice of Retraction A new method of ascertaining optimal detection period of machine equipment's condition maintenance,,0,https://doi.org/10.1109/qr2mse.2013.6625833,https://api.labs.crossref.org/works/https://doi.org/10.1109/qr2mse.2013.6625833?mailto=christian.hauschke@tib.eu,2013,article,True,0,Optoelectronic Systems for Measurement and Detection,Physical Sciences,Electrical and Electronic Engineering,,False,en,Engineering,
https://openalex.org/W1671236559,Notice of Retraction: Using Hydraulic Vulnerability Analysis to Set Hydraulic Security Monitoring Point in Water Supply Network,,0,https://doi.org/10.1109/icbbe.2011.5781632,https://api.labs.crossref.org/works/https://doi.org/10.1109/icbbe.2011.5781632?mailto=christian.hauschke@tib.eu,2011,article,True,0,Smart Grid Technology and Applications,Physical Sciences,Electrical and Electronic Engineering,,False,en,Engineering,
https://openalex.org/W1671361513,Notice of Retraction: Application of Response Surface Methodology for the Optimization of Partition Conditions of Emodin in Aqueous Two-Phase System,,0,https://doi.org/10.1109/icbbe.2011.5780691,https://api.labs.crossref.org/works/https://doi.org/10.1109/icbbe.2011.5780691?mailto=christian.hauschke@tib.eu,2011,article,True,0,Crystallization Processes and Control,Physical Sciences,Materials Chemistry,,False,en,Materials Science,
https://openalex.org/W1671726851,"Notice of Retraction: Heavy Metal Pollution in Agricultural Soils of Changzhou, China",,0,https://doi.org/10.1109/icbbe.2011.5781347,https://api.labs.crossref.org/works/https://doi.org/10.1109/icbbe.2011.5781347?mailto=christian.hauschke@tib.eu,2011,article,True,0,Environmental Impact of Heavy Metal Contamination,Physical Sciences,Pollution,,False,en,Environmental Science,
https://openalex.org/W1672106313,Notice of Retraction: An empirical study on the CLT reform on EFL at Wuhan University of Technology in China,,0,https://doi.org/10.1109/icpim.2011.5983687,https://api.labs.crossref.org/works/https://doi.org/10.1109/icpim.2011.5983687?mailto=christian.hauschke@tib.eu,2011,article,True,0,English-Medium Instruction in Higher Education,Social Sciences,Literature and Literary Theory,,False,en,Arts and Humanities,
https://openalex.org/W1672278513,Notice of Retraction: Ubiquitous Formaldehyde Exposure and Public Health Concerns in China,,0,https://doi.org/10.1109/icbbe.2011.5781279,https://api.labs.crossref.org/works/https://doi.org/10.1109/icbbe.2011.5781279?mailto=christian.hauschke@tib.eu,2011,article,True,0,Indoor Air Quality and Health Effects,Physical Sciences,"Health, Toxicology and Mutagenesis",,False,en,Environmental Science,
https://openalex.org/W1673113491,Notice of Retraction A critical analysis of outsourcers' behaviorization of moral hazards,,0,https://doi.org/10.1109/qr2mse.2013.6625994,https://api.labs.crossref.org/works/https://doi.org/10.1109/qr2mse.2013.6625994?mailto=christian.hauschke@tib.eu,2013,article,True,0,Information Security Policy Compliance and Awareness,Physical Sciences,Information Systems,,False,en,Computer Science,
https://openalex.org/W1673637455,Notice of Retraction: The VP1 Encoding Gene Sequencing and Analysis of an Enterovirus 71 Strain Isolated in Hubei Province,,0,https://doi.org/10.1109/icbbe.2011.5781311,https://api.labs.crossref.org/works/https://doi.org/10.1109/icbbe.2011.5781311?mailto=christian.hauschke@tib.eu,2011,article,True,0,"Aetiology, Diagnosis, and Management of Myocarditis",Health Sciences,Cardiology and Cardiovascular Medicine,,False,en,Medicine,
https://openalex.org/W1674104265,Notice of Retraction: Analysis of structure — Conduct — Performance in the Dongjian industry of Zizhong County,,0,https://doi.org/10.1109/icebeg.2011.5882314,https://api.labs.crossref.org/works/https://doi.org/10.1109/icebeg.2011.5882314?mailto=christian.hauschke@tib.eu,2011,article,True,0,Vibration Serviceability of Footbridges,Physical Sciences,Civil and Structural Engineering,,False,en,Engineering,
https://openalex.org/W1674142952,Notice of Retraction: Research on product innovation design based on knowledge,,0,https://doi.org/10.1109/icpim.2011.5983671,https://api.labs.crossref.org/works/https://doi.org/10.1109/icpim.2011.5983671?mailto=christian.hauschke@tib.eu,2011,article,True,0,Knowledge Mapping and Information Architecture,Physical Sciences,Information Systems,,False,en,Computer Science,
https://openalex.org/W1674444021,Notice of Retraction: China's forest products foreign trade policy: Overview and analysis,,0,https://doi.org/10.1109/icebeg.2011.5882104,https://api.labs.crossref.org/works/https://doi.org/10.1109/icebeg.2011.5882104?mailto=christian.hauschke@tib.eu,2011,article,True,0,Climate Change Impacts on Forest Carbon Sequestration,Physical Sciences,Global and Planetary Change,,False,en,Environmental Science,
https://openalex.org/W1674704292,Notice of Retraction: Analysis of the Properties of Transdermal Drug Delivery with Constant Surface Drug Concentration,,0,https://doi.org/10.1109/icbbe.2011.5780438,https://api.labs.crossref.org/works/https://doi.org/10.1109/icbbe.2011.5780438?mailto=christian.hauschke@tib.eu,2011,article,True,0,Innovations in Transdermal Drug Delivery Systems,Life Sciences,Pharmaceutical Science,,False,en,"Pharmacology, Toxicology and Pharmaceutics",
https://openalex.org/W1675071000,Notice of Retraction: Preliminary Purification of Salsolinol Synthase from Rat Brain,,0,https://doi.org/10.1109/icbbe.2011.5780133,https://api.labs.crossref.org/works/https://doi.org/10.1109/icbbe.2011.5780133?mailto=christian.hauschke@tib.eu,2011,article,True,0,Pharmacological Effects of Licorice Roots,Life Sciences,Pharmacology,,False,en,"Pharmacology, Toxicology and Pharmaceutics",
https://openalex.org/W1676582478,Notice of Retraction: Determination of Permethrin Residues in Vegetables by Photochemical Fluorescence Spectrometry,,0,https://doi.org/10.1109/icbbe.2011.5781642,https://api.labs.crossref.org/works/https://doi.org/10.1109/icbbe.2011.5781642?mailto=christian.hauschke@tib.eu,2011,article,True,0,Animal Nutrition and Gut Health,Life Sciences,Animal Science and Zoology,,True,en,Agricultural and Biological Sciences,
https://openalex.org/W1676656643,Notice of Retraction Invulnerability of colored networks: A survey,,0,https://doi.org/10.1109/qr2mse.2013.6625537,https://api.labs.crossref.org/works/https://doi.org/10.1109/qr2mse.2013.6625537?mailto=christian.hauschke@tib.eu,2013,article,True,0,Graph Labeling and Dimension Problems,Physical Sciences,Computational Theory and Mathematics,,False,en,Computer Science,
https://openalex.org/W1676698862,Notice of Retraction: Establishment of an Ecotilling Protocol with M13 Primers for SNP Discovery in Barley,,0,https://doi.org/10.1109/icbbe.2011.5780036,https://api.labs.crossref.org/works/https://doi.org/10.1109/icbbe.2011.5780036?mailto=christian.hauschke@tib.eu,2011,article,True,0,Mutation Breeding for Crop Improvement,Life Sciences,Plant Science,,False,en,Agricultural and Biological Sciences,
https://openalex.org/W1676804934,Notice of Retraction: China's e-commerce becomes reality,,0,https://doi.org/10.1109/icebeg.2011.5882102,https://api.labs.crossref.org/works/https://doi.org/10.1109/icebeg.2011.5882102?mailto=christian.hauschke@tib.eu,2011,article,True,0,Drivers and Impediments for Cross-Border E-Commerce,Social Sciences,Business and International Management,,False,en,"Business, Management and Accounting",
https://openalex.org/W1677112898,Notice of Retraction: The analysis of the formation mechanism of the financial risk specificity arisen from operating fictitious capital in financial holding groups,,0,https://doi.org/10.1109/icebeg.2011.5886958,https://api.labs.crossref.org/works/https://doi.org/10.1109/icebeg.2011.5886958?mailto=christian.hauschke@tib.eu,2011,article,True,0,Venture Capital and Start-Up Financing,Social Sciences,Accounting,,False,en,"Business, Management and Accounting",
https://openalex.org/W1677356626,Notice of Retraction: The Influence of Aeration on the Determination of Critical Flux in a Membrane Bioreactor (MBR),,0,https://doi.org/10.1109/icbbe.2011.5781180,https://api.labs.crossref.org/works/https://doi.org/10.1109/icbbe.2011.5781180?mailto=christian.hauschke@tib.eu,2011,article,True,0,Advancements in Water Purification Technologies,Physical Sciences,Water Science and Technology,,False,en,Environmental Science,
https://openalex.org/W1677920947,Notice of Retraction: Rapid Determination of Volatile Chlorinated Hydrocarbons Using PID Combined with RAE-SEP Tube,,0,https://doi.org/10.1109/icbbe.2011.5780918,https://api.labs.crossref.org/works/https://doi.org/10.1109/icbbe.2011.5780918?mailto=christian.hauschke@tib.eu,2011,article,True,0,Chiral Separation in Chromatography,Physical Sciences,Spectroscopy,,False,en,Chemistry,
https://openalex.org/W1678845210,Notice of Retraction: A comparative analysis of modern electricity regulatory system: From the viewpoint of regulatory economics,,0,https://doi.org/10.1109/icebeg.2011.5882279,https://api.labs.crossref.org/works/https://doi.org/10.1109/icebeg.2011.5882279?mailto=christian.hauschke@tib.eu,2011,article,True,0,Smart Grid Technology and Applications,Physical Sciences,Electrical and Electronic Engineering,,False,en,Engineering,
https://openalex.org/W1679045227,Notice of Retraction: Research on composite strength of listed companies based on factor analysis,,0,https://doi.org/10.1109/icebeg.2011.5886891,https://api.labs.crossref.org/works/https://doi.org/10.1109/icebeg.2011.5886891?mailto=christian.hauschke@tib.eu,2011,article,True,0,Fuzzy Class Membership Modeling in Environmental Sciences,Physical Sciences,Ecological Modeling,,False,en,Environmental Science,
https://openalex.org/W1679328045,Notice of Retraction: Cyber-Deviant Behavior in the workplace: Review and prospect,,0,https://doi.org/10.1109/icebeg.2011.5882338,https://api.labs.crossref.org/works/https://doi.org/10.1109/icebeg.2011.5882338?mailto=christian.hauschke@tib.eu,2011,article,True,0,Cyberloafing in the Workplace,Social Sciences,Demography,,False,en,Social Sciences,
https://openalex.org/W1679451805,Notice of Retraction: A new prediction method for heavy oil production wells flashing by steam flooding,,0,https://doi.org/10.1109/icebeg.2011.5881907,https://api.labs.crossref.org/works/https://doi.org/10.1109/icebeg.2011.5881907?mailto=christian.hauschke@tib.eu,2011,article,True,0,Application of Diagnostic Techniques in Oil Wells,Physical Sciences,Ocean Engineering,,False,en,Engineering,
https://openalex.org/W1679661484,Notice of Retraction: Cultivated land protection: Peasant households' willingness to participate: Evidence from Qingxu county of Taiyuan city,,0,https://doi.org/10.1109/icebeg.2011.5887062,https://api.labs.crossref.org/works/https://doi.org/10.1109/icebeg.2011.5887062?mailto=christian.hauschke@tib.eu,2011,article,True,0,Land Use Change and Environmental Impact in China,Physical Sciences,Global and Planetary Change,,False,en,Environmental Science,
https://openalex.org/W1680156438,Notice of Retraction: Urban form reshaping in post-industrial society: Symbolic economy and consumer space,,0,https://doi.org/10.1109/icetce.2011.5774648,https://api.labs.crossref.org/works/https://doi.org/10.1109/icetce.2011.5774648?mailto=christian.hauschke@tib.eu,2011,article,True,0,Global Interconnected Urban System,Social Sciences,Urban Studies,,False,en,Social Sciences,
https://openalex.org/W1680329157,Notice of Retraction: Ethics about personal information security in information age,,0,https://doi.org/10.1109/icebeg.2011.5881781,https://api.labs.crossref.org/works/https://doi.org/10.1109/icebeg.2011.5881781?mailto=christian.hauschke@tib.eu,2011,article,True,0,Internet Users' Information Privacy Concerns,Social Sciences,Sociology and Political Science,,False,en,Social Sciences,
https://openalex.org/W1680386540,Retraction notice,Journal of Vibration and Control,0,https://doi.org/10.1177/1077546312473321,https://api.labs.crossref.org/works/https://doi.org/10.1177/1077546312473321?mailto=christian.hauschke@tib.eu,2013,article,True,0,Artificial Intelligence and Expert Systems,Physical Sciences,Artificial Intelligence,SAGE Publishing,True,en,Computer Science,
https://openalex.org/W1680445037,Notice of Retraction: Evaluation of Phosphorus Removal from Wastewater by Chemical Precipitation Agent - A Case Study of Jingzhou City Moat,,0,https://doi.org/10.1109/icbbe.2011.5780989,https://api.labs.crossref.org/works/https://doi.org/10.1109/icbbe.2011.5780989?mailto=christian.hauschke@tib.eu,2011,article,True,0,Phosphorus Recovery and Sustainable Management,Physical Sciences,Industrial and Manufacturing Engineering,,False,en,Environmental Science,
https://openalex.org/W1680641633,Notice of Retraction Reliability-based integrity assessment of pipeline girth weld defects,,0,https://doi.org/10.1109/qr2mse.2013.6625727,https://api.labs.crossref.org/works/https://doi.org/10.1109/qr2mse.2013.6625727?mailto=christian.hauschke@tib.eu,2013,article,True,0,Modeling and Assessment of Pipeline Corrosion Damage,Physical Sciences,Mechanical Engineering,,False,en,Engineering,
https://openalex.org/W1681139409,Notice of Retraction: Research on the mechanism of sustainable growth based on dynamic core competence,,0,https://doi.org/10.1109/mace.2011.5987495,https://api.labs.crossref.org/works/https://doi.org/10.1109/mace.2011.5987495?mailto=christian.hauschke@tib.eu,2011,article,True,0,Knowledge Management and Organizational Innovation,Social Sciences,Strategy and Management,,False,en,"Business, Management and Accounting",
https://openalex.org/W1681443737,Notice of Retraction: From site conservation to the emergence of site park mode — As an example of Xi'an Qu Jiang site park,,0,https://doi.org/10.1109/icetce.2011.5776100,https://api.labs.crossref.org/works/https://doi.org/10.1109/icetce.2011.5776100?mailto=christian.hauschke@tib.eu,2011,article,True,0,Management and Conservation of Biosphere Reserves,Physical Sciences,Nature and Landscape Conservation,,False,en,Environmental Science,
https://openalex.org/W1681455691,Notice of Retraction: The research on cooperative relationship between higher vocational employment and regional economy: Based on cluster analysis with a specialty's panel data,,0,https://doi.org/10.1109/icebeg.2011.5887222,https://api.labs.crossref.org/works/https://doi.org/10.1109/icebeg.2011.5887222?mailto=christian.hauschke@tib.eu,2011,article,True,0,Spatial Shift-Share Analysis in Economic Development,Social Sciences,Economics and Econometrics,,False,en,"Economics, Econometrics and Finance",
https://openalex.org/W1682124240,Notice of Retraction Study about the computer virus dissemination model based on complex network,,0,https://doi.org/10.1109/icnc.2011.6022350,https://api.labs.crossref.org/works/https://doi.org/10.1109/icnc.2011.6022350?mailto=christian.hauschke@tib.eu,2011,article,True,0,Statistical Mechanics of Complex Networks,Physical Sciences,Statistical and Nonlinear Physics,,False,en,Physics and Astronomy,
https://openalex.org/W1683218337,The Integrated Self: A Holistic Approach to Spirituality and Mental Health Practice,Europe’s Journal of Psychology,0,https://doi.org/10.5964/ejop.v9i1.425,https://api.labs.crossref.org/works/https://doi.org/10.5964/ejop.v9i1.425?mailto=christian.hauschke@tib.eu,2013,article,True,0,Impact of Religion and Spirituality on Health Outcomes,Social Sciences,Health,PsychOpen,True,en,Social Sciences,
https://openalex.org/W1684242522,Notice of Retraction: A study of informationalization and social security management service,,0,https://doi.org/10.1109/icebeg.2011.5881267,https://api.labs.crossref.org/works/https://doi.org/10.1109/icebeg.2011.5881267?mailto=christian.hauschke@tib.eu,2011,article,True,0,Human Resource Analytics and Big Data,Social Sciences,Organizational Behavior and Human Resource Management,,False,en,"Business, Management and Accounting",
https://openalex.org/W1684676128,Notice of Retraction: Research on the application of 4Ps marketing theory based on Chinese Consumer Psychology,,0,https://doi.org/10.1109/icbmei.2011.5916956,https://api.labs.crossref.org/works/https://doi.org/10.1109/icbmei.2011.5916956?mailto=christian.hauschke@tib.eu,2011,article,True,0,Consumer Behavior in Brand Consumption and Identification,Social Sciences,Marketing,,False,en,"Business, Management and Accounting",
https://openalex.org/W1686337944,Notice of Retraction: Motion Prediction of Hybrid-Monohull Based on Viscous Hydrodynamic Calculation,,0,https://doi.org/10.1109/paccs.2011.5990234,https://api.labs.crossref.org/works/https://doi.org/10.1109/paccs.2011.5990234?mailto=christian.hauschke@tib.eu,2011,article,True,0,Smoothed Particle Hydrodynamics in Fluid Dynamics,Physical Sciences,Computational Mechanics,,False,en,Engineering,
https://openalex.org/W1689808256,Notice of Retraction: The Research of Universities Accounting Fraud Model Based on Game Theory,,0,https://doi.org/10.1109/paccs.2011.5990213,https://api.labs.crossref.org/works/https://doi.org/10.1109/paccs.2011.5990213?mailto=christian.hauschke@tib.eu,2011,article,True,0,Causes and Effects of Corruption,Social Sciences,Sociology and Political Science,,False,en,Social Sciences,
https://openalex.org/W1691362203,Notice of Retraction: Protective properties of the supporting column in a subway station subjected to blast loading,,0,https://doi.org/10.1109/icetce.2011.5775179,https://api.labs.crossref.org/works/https://doi.org/10.1109/icetce.2011.5775179?mailto=christian.hauschke@tib.eu,2011,article,True,0,Progressive Collapse of Structures,Physical Sciences,Civil and Structural Engineering,,False,en,Engineering,
https://openalex.org/W1691476234,Notice of Retraction: The comprehensive analysis and research and countermeasures of Hebei's propeling in cooperating with pharmaceutical industry,,0,https://doi.org/10.1109/icebeg.2011.5881632,https://api.labs.crossref.org/works/https://doi.org/10.1109/icebeg.2011.5881632?mailto=christian.hauschke@tib.eu,2011,article,True,0,Coopetition in Business Networks and Innovation,Social Sciences,Strategy and Management,,False,en,"Business, Management and Accounting",
https://openalex.org/W1694452656,Notice of Retraction: Landscape as a medium for urbanism: Review on “Landscape urbanism”,,0,https://doi.org/10.1109/icetce.2011.5776452,https://api.labs.crossref.org/works/https://doi.org/10.1109/icetce.2011.5776452?mailto=christian.hauschke@tib.eu,2011,article,True,0,Ecological Wisdom in Urban Planning and Design,Physical Sciences,"Management, Monitoring, Policy and Law",,False,en,Environmental Science,
https://openalex.org/W1694637761,Notice of Retraction: Research on application of combined model for GPS leveling,,0,https://doi.org/10.1109/iceice.2011.5777750,https://api.labs.crossref.org/works/https://doi.org/10.1109/iceice.2011.5777750?mailto=christian.hauschke@tib.eu,2011,article,True,0,Global Navigation Satellite Systems (GNSS),Physical Sciences,Aerospace Engineering,,False,en,Engineering,
https://openalex.org/W1695875644,Notice of Retraction: The analysis of deed tax elasticity in China,,0,https://doi.org/10.1109/icebeg.2011.5885315,https://api.labs.crossref.org/works/https://doi.org/10.1109/icebeg.2011.5885315?mailto=christian.hauschke@tib.eu,2011,article,True,0,Impact of Infrastructure and Taxation on Economic Growth,Social Sciences,Economics and Econometrics,,False,en,"Economics, Econometrics and Finance",
https://openalex.org/W1696111987,Notice of Retraction: Research on development problems of China's rural finance based on Huaian City,,0,https://doi.org/10.1109/icebeg.2011.5886894,https://api.labs.crossref.org/works/https://doi.org/10.1109/icebeg.2011.5886894?mailto=christian.hauschke@tib.eu,2011,article,True,0,Spatial Shift-Share Analysis in Economic Development,Social Sciences,Economics and Econometrics,,False,en,"Economics, Econometrics and Finance",
https://openalex.org/W1696721973,Notice of Retraction: Research on the construction of Service-oriented government in administrative mechanism perspective,,0,https://doi.org/10.1109/icebeg.2011.5884539,https://api.labs.crossref.org/works/https://doi.org/10.1109/icebeg.2011.5884539?mailto=christian.hauschke@tib.eu,2011,article,True,0,Evolution and Impact of E-Government Initiatives,Social Sciences,Political Science and International Relations,,False,en,Social Sciences,
https://openalex.org/W1697487666,Notice of Retraction: Paper empirical study on the impact of RMB exchange rate on Chinese textile import and export,,0,https://doi.org/10.1109/icebeg.2011.5881348,https://api.labs.crossref.org/works/https://doi.org/10.1109/icebeg.2011.5881348?mailto=christian.hauschke@tib.eu,2011,article,True,0,Concept and Measurement of Regional Competitiveness,Social Sciences,Strategy and Management,,False,en,"Business, Management and Accounting",
https://openalex.org/W1697610748,Notice of Retraction: The study about teenage consuming and lifestyle in internet age of China,,0,https://doi.org/10.1109/icebeg.2011.5886994,https://api.labs.crossref.org/works/https://doi.org/10.1109/icebeg.2011.5886994?mailto=christian.hauschke@tib.eu,2011,article,True,0,Impact of Social Media on Consumer Behavior,Social Sciences,Sociology and Political Science,,False,en,Social Sciences,
https://openalex.org/W1697901648,Notice of Retraction: Pattern of Malformations in Xenopus tropicalis Embryos Induced by Retinoic Acids and Phenotype-Based Teratogenic Index,,0,https://doi.org/10.1109/icbbe.2011.5781426,https://api.labs.crossref.org/works/https://doi.org/10.1109/icbbe.2011.5781426?mailto=christian.hauschke@tib.eu,2011,article,True,0,Role of Retinoic Acid in Biological Processes,Life Sciences,Molecular Biology,,False,en,"Biochemistry, Genetics and Molecular Biology",
https://openalex.org/W1698727200,Notice of Retraction: Analysis and countermeasures of project cost control in construction enterprises,,0,https://doi.org/10.1109/icebeg.2011.5881964,https://api.labs.crossref.org/works/https://doi.org/10.1109/icebeg.2011.5881964?mailto=christian.hauschke@tib.eu,2011,article,True,0,Comprehensive Assessment of Safety in Energy and Infrastructure,Physical Sciences,"Safety, Risk, Reliability and Quality",,False,en,Engineering,
https://openalex.org/W1699489151,Notice of Retraction: A discussion on the Higher Education quality: Historical change characteristics of the times and system construction,,0,https://doi.org/10.1109/icebeg.2011.5882755,https://api.labs.crossref.org/works/https://doi.org/10.1109/icebeg.2011.5882755?mailto=christian.hauschke@tib.eu,2011,article,True,0,Evolution of Management Theories and Practices,Social Sciences,Organizational Behavior and Human Resource Management,,False,en,"Business, Management and Accounting",
https://openalex.org/W1699700382,Notice of Retraction: Prioritize urban e-strategy based on the group evidential reasoning approach,,0,https://doi.org/10.1109/icebeg.2011.5881351,https://api.labs.crossref.org/works/https://doi.org/10.1109/icebeg.2011.5881351?mailto=christian.hauschke@tib.eu,2011,article,True,0,Utilization of SWOT Analysis in Strategic Planning,Social Sciences,Strategy and Management,,False,en,"Business, Management and Accounting",
https://openalex.org/W1702097487,Notice of Retraction: Research on the setting of vertical clearance under the overpass bridge,,0,https://doi.org/10.1109/mace.2011.5987496,https://api.labs.crossref.org/works/https://doi.org/10.1109/mace.2011.5987496?mailto=christian.hauschke@tib.eu,2011,article,True,0,Vibration Serviceability of Footbridges,Physical Sciences,Civil and Structural Engineering,,False,en,Engineering,
https://openalex.org/W1702119004,Notice of Retraction: Preparation of Protein Loaded Core-Shell PEO/PLGA Ultrafine Fibers by Coaxial Electrospinning,,0,https://doi.org/10.1109/icbbe.2011.5780237,https://api.labs.crossref.org/works/https://doi.org/10.1109/icbbe.2011.5780237?mailto=christian.hauschke@tib.eu,2011,article,True,0,Electrospun Nanofibers in Biomedical Applications,Physical Sciences,Biomaterials,,False,en,Materials Science,
https://openalex.org/W1702927218,Notice of Retraction: Government intervention and the governance of farmer cooperative economy organization,,0,https://doi.org/10.1109/icbmei.2011.5917871,https://api.labs.crossref.org/works/https://doi.org/10.1109/icbmei.2011.5917871?mailto=christian.hauschke@tib.eu,2011,article,True,0,Governance of Cooperatives and Mutual Associations,Social Sciences,Strategy and Management,,False,en,"Business, Management and Accounting",
