id,display_name,primary_location_display_name,cited_by_count,doi,crossref_call,publication_year,type,is_retracted,cited_by_percentile_year_min,primary_topic_display_name,primary_topic_domain_display_name,primary_topic_subfield_display_name,primary_location_source_host_organization_name,open_access_is_oa,language,primary_topic_field_display_name,update_nature
https://openalex.org/W2300245847,Mechanism of action of novel piperazine containing compound toxicant against human liver cancer cells,PeerJ,5,https://doi.org/10.7717/peerj.1588,https://api.labs.crossref.org/works/https://doi.org/10.7717/peerj.1588?mailto=christian.hauschke@tib.eu,2016,article,True,84,Role of Quinones in Toxicology and Pharmacology,Life Sciences,Toxicology,"PeerJ, Inc.",True,en,"Pharmacology, Toxicology and Pharmaceutics",
https://openalex.org/W2300339460,RETRACTED ARTICLE: Exponential Relationship Based Approach for Predictions of Defect Density Using Optimal Module Sizes,"Proceedings of the National Academy of Sciences, India Section A: Physical Sciences",5,https://doi.org/10.1007/s40010-015-0261-x,https://api.labs.crossref.org/works/https://doi.org/10.1007/s40010-015-0261-x?mailto=christian.hauschke@tib.eu,2016,article,True,84,Empirical Studies in Software Engineering,Physical Sciences,Information Systems,Springer Science+Business Media,False,en,Computer Science,
https://openalex.org/W2313264820,RETRACTED ARTICLE: Prediction of economic growth by extreme learning approach based on science and technology transfer,Quality & Quantity,5,https://doi.org/10.1007/s11135-016-0337-y,https://api.labs.crossref.org/works/https://doi.org/10.1007/s11135-016-0337-y?mailto=christian.hauschke@tib.eu,2016,article,True,84,Theory and Applications of Extreme Learning Machines,Physical Sciences,Artificial Intelligence,Springer Science+Business Media,False,en,Computer Science,
https://openalex.org/W2315791528,"Expression of PER, CRY, and TIM genes for the pathological features of colorectal cancer patients",OncoTargets and Therapy,5,https://doi.org/10.2147/ott.s96925,https://api.labs.crossref.org/works/https://doi.org/10.2147/ott.s96925?mailto=christian.hauschke@tib.eu,2016,article,True,84,Mammalian Circadian Rhythms and Physiology,Life Sciences,Endocrine and Autonomic Systems,Dove Medical Press,True,en,Neuroscience,
https://openalex.org/W2315885951,Curriculum: debates actuales. Trazos desde América Latina (retractado),Pedagogía y Saberes,5,https://doi.org/10.17227/01212494.40pys35.45,https://api.labs.crossref.org/works/https://doi.org/10.17227/01212494.40pys35.45?mailto=christian.hauschke@tib.eu,2014,article,True,84,Impact of Information and Communication Technology in Education,Physical Sciences,Information Systems,National Pedagogic University,True,es,Computer Science,
https://openalex.org/W2324151872,RETRACTED ARTICLE: LCK: a new biomarker candidate for the early diagnosis of acute myocardial infarction,Molecular Biology Reports,5,https://doi.org/10.1007/s11033-014-3702-8,https://api.labs.crossref.org/works/https://doi.org/10.1007/s11033-014-3702-8?mailto=christian.hauschke@tib.eu,2014,article,True,84,Immunological Mechanisms in Atherosclerosis Development,Life Sciences,Immunology,Springer Nature,False,en,Immunology and Microbiology,
https://openalex.org/W2324731951,RETRACTED ARTICLE: Adipose stromal-vascular fraction-derived paracrine factors regulate adipogenesis,Molecular and Cellular Biochemistry,5,https://doi.org/10.1007/s11010-013-1820-6,https://api.labs.crossref.org/works/https://doi.org/10.1007/s11010-013-1820-6?mailto=christian.hauschke@tib.eu,2013,article,True,83,Inflammation and Obesity-Related Metabolic Disorders,Health Sciences,Epidemiology,Springer Science+Business Media,False,en,Medicine,
https://openalex.org/W2325808925,Clinical characteristics of OGTT-derived hepatic- and muscle insulin resistance in healthy young men,Journal of exercise nutrition & biochemistry,5,https://doi.org/10.5717/jenb.2014.18.4.385,https://api.labs.crossref.org/works/https://doi.org/10.5717/jenb.2014.18.4.385?mailto=christian.hauschke@tib.eu,2014,article,True,84,"Sarcopenia: Definition, Diagnosis, and Implications",Health Sciences,Physiology,,True,en,Medicine,
https://openalex.org/W2332240302,Retracted: Dental hard tissue ablation using mid-infrared tunable nanosecond pulsed Cr:CdSe laser,Lasers in Surgery and Medicine,5,https://doi.org/10.1002/lsm.22508,https://api.labs.crossref.org/works/https://doi.org/10.1002/lsm.22508?mailto=christian.hauschke@tib.eu,2016,article,True,84,Low-Level Laser Therapy in Biomedical Applications,Health Sciences,"Radiology, Nuclear Medicine and Imaging",Wiley-Blackwell,False,en,Medicine,
https://openalex.org/W2333074157,RETRACTED: Enalapril/lercanidipine combination on markers of cardiovascular risk: a randomized study,Journal of The American Society of Hypertension,5,https://doi.org/10.1016/j.jash.2014.03.329,https://api.labs.crossref.org/works/https://doi.org/10.1016/j.jash.2014.03.329?mailto=christian.hauschke@tib.eu,2014,article,True,84,Metabolic Syndrome and Cardiovascular Disease,Health Sciences,"Endocrinology, Diabetes and Metabolism",Elsevier BV,True,en,Medicine,
https://openalex.org/W2336834406,Synergistic enhancement of the antitumor activity of 5-fluorouracil by bornyl acetate in SGC-7901 human gastric cancer cells and the determination of the underlying mechanism of action.,PubMed,5,,https://api.labs.crossref.org/works/null?mailto=christian.hauschke@tib.eu,2016,article,True,84,Engineering Bacteria for Cancer Treatment,Life Sciences,Biotechnology,National Institutes of Health,False,en,"Biochemistry, Genetics and Molecular Biology",
https://openalex.org/W2339495748,RETRACTED: Association between the <i>ACE</i> I/D gene polymorphism and T2DN susceptibility: The risk of T2DM developing into T2DN in the Asian population,Journal of the Renin-Angiotensin-Aldosterone System,5,https://doi.org/10.1177/1470320314566019,https://api.labs.crossref.org/works/https://doi.org/10.1177/1470320314566019?mailto=christian.hauschke@tib.eu,2015,article,True,84,Renin-Angiotensin System in Cardiovascular Physiology and Pathology,Health Sciences,Cardiology and Cardiovascular Medicine,SAGE Publishing,True,en,Medicine,
https://openalex.org/W2340784177,RETRACTED: Pectoral nerves block for a contraction of the latissimus dorsi muscle,Journal of Clinical Anesthesia,5,https://doi.org/10.1016/j.jclinane.2016.02.005,https://api.labs.crossref.org/works/https://doi.org/10.1016/j.jclinane.2016.02.005?mailto=christian.hauschke@tib.eu,2016,article,True,84,Management of Postoperative Pain and Complications,Health Sciences,Surgery,Elsevier BV,False,en,Medicine,
https://openalex.org/W2340980219,RETRACTED: Potential improvement in helmet blast-protection via the use of a polyurea external coating: Combined experimental/computational analyses,"Proceedings of the Institution of Mechanical Engineers, Part L: Journal of Materials: Design and Applications",5,https://doi.org/10.1177/1464420716644472,https://api.labs.crossref.org/works/https://doi.org/10.1177/1464420716644472?mailto=christian.hauschke@tib.eu,2016,article,True,84,Progressive Collapse of Structures,Physical Sciences,Civil and Structural Engineering,SAGE Publishing,False,en,Engineering,
https://openalex.org/W2341117728,RETRACTED: Antecedents to Customer Dependency in Buyer–Seller Relationship: A BOP Retailer Investigation,Global Business Review,5,https://doi.org/10.1177/0972150916630472,https://api.labs.crossref.org/works/https://doi.org/10.1177/0972150916630472?mailto=christian.hauschke@tib.eu,2016,article,True,84,Understanding Consumer Behavior in Retail Environments,Social Sciences,Marketing,SAGE Publishing,True,en,"Business, Management and Accounting",
https://openalex.org/W2341593948,"RETRACTED ARTICLE: Suitability evaluation for land reclamation in mining areas: Gol-e-Gohar Iron Ore Mine of Sirjan, Kerman, Iran","International Journal of Mining, Reclamation and Environment",5,https://doi.org/10.1080/17480930.2015.1105650,https://api.labs.crossref.org/works/https://doi.org/10.1080/17480930.2015.1105650?mailto=christian.hauschke@tib.eu,2016,article,True,84,Land-Use Suitability Assessment Using GIS,Physical Sciences,"Management, Monitoring, Policy and Law",Taylor & Francis,False,en,Environmental Science,
https://openalex.org/W2344750506,Synthesis and characterization of graphene oxide composite with Fe<sub>3</sub>O<sub>4</sub>,Materials Science Poland,5,https://doi.org/10.1515/msp-2015-0068,https://api.labs.crossref.org/works/https://doi.org/10.1515/msp-2015-0068?mailto=christian.hauschke@tib.eu,2015,article,True,84,Biomedical Applications of Graphene Nanomaterials,Physical Sciences,Biomedical Engineering,De Gruyter Open,True,en,Engineering,
https://openalex.org/W2345667682,RETRACTED ARTICLE: Surface-functionalized gold nanoparticles mediate bacterial transformation: a nanobiotechnological approach,Biotechnology Letters,5,https://doi.org/10.1007/s10529-013-1360-x,https://api.labs.crossref.org/works/https://doi.org/10.1007/s10529-013-1360-x?mailto=christian.hauschke@tib.eu,2013,article,True,83,Applications of Quantum Dots in Nanotechnology,Physical Sciences,Materials Chemistry,Springer Science+Business Media,False,en,Materials Science,
https://openalex.org/W2345680149,Prediction of Mortality Based on Facial Characteristics,Frontiers in Human Neuroscience,5,https://doi.org/10.3389/fnhum.2016.00173,https://api.labs.crossref.org/works/https://doi.org/10.3389/fnhum.2016.00173?mailto=christian.hauschke@tib.eu,2016,article,True,84,Neural Mechanisms of Face Perception and Recognition,Life Sciences,Cognitive Neuroscience,Frontiers Media,True,en,Neuroscience,
https://openalex.org/W2352213446,RETRACTED ARTICLE: The ‘citizens’ in citizen science projects: Educational and conceptual issues,International Journal of Science Education,5,https://doi.org/10.1080/21548455.2014.953228,https://api.labs.crossref.org/works/https://doi.org/10.1080/21548455.2014.953228?mailto=christian.hauschke@tib.eu,2014,article,True,84,Species Distribution Modeling and Climate Change Impacts,Physical Sciences,Ecological Modeling,Taylor & Francis,False,en,Environmental Science,
https://openalex.org/W2399696882,RETRACTED: The biosorption of Sr(II) on Bacillus subtilis: A combined batch and modeling study,Journal of Molecular Liquids,5,https://doi.org/10.1016/j.molliq.2016.05.040,https://api.labs.crossref.org/works/https://doi.org/10.1016/j.molliq.2016.05.040?mailto=christian.hauschke@tib.eu,2016,article,True,84,Adsorption of Water Contaminants,Physical Sciences,Water Science and Technology,Elsevier BV,False,en,Environmental Science,
https://openalex.org/W2399727203,Thermodynamic Self-Limiting Growth of Heteroepitaxial Islands Induced by Nonlinear Elastic Effect,Nano Letters,5,https://doi.org/10.1021/acs.nanolett.6b01525,https://api.labs.crossref.org/works/https://doi.org/10.1021/acs.nanolett.6b01525?mailto=christian.hauschke@tib.eu,2016,article,True,84,Quantum Dot Devices and Semiconductors,Physical Sciences,"Atomic and Molecular Physics, and Optics",American Chemical Society,False,en,Physics and Astronomy,
https://openalex.org/W2404171798,Assessment of intracranial metastases from neuroendocrine tumors/carcinoma,Journal of Neurosciences in Rural Practice,5,https://doi.org/10.4103/0976-3147.182779,https://api.labs.crossref.org/works/https://doi.org/10.4103/0976-3147.182779?mailto=christian.hauschke@tib.eu,2016,article,True,84,Epidemiology and Management of Neuroendocrine Tumors,Health Sciences,Epidemiology,Medknow,True,en,Medicine,
https://openalex.org/W2409003943,Assessment of Parasympathetic Activity in Athletes,Medicine and Science in Sports and Exercise,5,https://doi.org/10.1249/mss.0000000000000769,https://api.labs.crossref.org/works/https://doi.org/10.1249/mss.0000000000000769?mailto=christian.hauschke@tib.eu,2016,article,True,84,Standardisation and Management of COPD,Health Sciences,Pulmonary and Respiratory Medicine,Lippincott Williams & Wilkins,False,en,Medicine,
https://openalex.org/W2411370286,"REMOVED: Experimental investigation of impacts of engine hardware, operating parameters and combustion performance on particulate emissions in a DISI engine",Applied Energy,5,https://doi.org/10.1016/j.apenergy.2016.05.147,https://api.labs.crossref.org/works/https://doi.org/10.1016/j.apenergy.2016.05.147?mailto=christian.hauschke@tib.eu,2016,article,True,84,Estimating Vehicle Fuel Consumption and Emissions,Physical Sciences,Automotive Engineering,Elsevier BV,False,en,Engineering,
https://openalex.org/W2412867247,RETRACTED: Timing Matters: When High-Performance Work Practices Enable New Venture Growth and Productivity,Journal of Management,5,https://doi.org/10.1177/0149206316652481,https://api.labs.crossref.org/works/https://doi.org/10.1177/0149206316652481?mailto=christian.hauschke@tib.eu,2016,article,True,84,Entrepreneurship and Business Innovation,Social Sciences,Management of Technology and Innovation,SAGE Publishing,True,en,"Business, Management and Accounting",
https://openalex.org/W2413064218,Olanzapine inhibits the proliferation and induces the differentiation of glioma stem-like cells through modulating the Wnt signaling pathway in vitro.,PubMed,5,,https://api.labs.crossref.org/works/null?mailto=christian.hauschke@tib.eu,2015,article,True,84,Adult Neurogenesis and Brain Development,Life Sciences,Developmental Neuroscience,National Institutes of Health,False,en,Neuroscience,
https://openalex.org/W2463412447,Global and Site-Specific Changes in 5-Methylcytosine and 5-Hydroxymethylcytosine after Extended Post-mortem Interval,Frontiers in Genetics,5,https://doi.org/10.3389/fgene.2016.00120,https://api.labs.crossref.org/works/https://doi.org/10.3389/fgene.2016.00120?mailto=christian.hauschke@tib.eu,2016,article,True,84,Epigenetic Modifications and Their Functional Implications,Life Sciences,Molecular Biology,Frontiers Media,True,en,"Biochemistry, Genetics and Molecular Biology",
https://openalex.org/W2466536779,RETRACTED: Policy Influence of Social Organizations in China,Nonprofit and Voluntary Sector Quarterly,5,https://doi.org/10.1177/0899764016655889,https://api.labs.crossref.org/works/https://doi.org/10.1177/0899764016655889?mailto=christian.hauschke@tib.eu,2016,article,True,84,Social Activity and Health Research,Social Sciences,Health,SAGE Publishing,True,en,Social Sciences,
https://openalex.org/W2472002982,RETRACTED: Evaluation of behavioral problems after prenatal dexamethasone treatment in Swedish adolescents at risk of CAH,Hormones and Behavior,5,https://doi.org/10.1016/j.yhbeh.2016.06.011,https://api.labs.crossref.org/works/https://doi.org/10.1016/j.yhbeh.2016.06.011?mailto=christian.hauschke@tib.eu,2016,article,True,84,Developmental Origins of Adult Health and Disease,Health Sciences,"Pediatrics, Perinatology and Child Health",Elsevier BV,False,en,Medicine,
https://openalex.org/W2480677749,Notice of Violation of IEEE Publication Principles: Pareto optimal reconfiguration of power distribution systems with load uncertainty and recloser placement simultaneously using a genetic algorithm based on NSGA-II,,5,https://doi.org/10.1109/epdc.2016.7514781,https://api.labs.crossref.org/works/https://doi.org/10.1109/epdc.2016.7514781?mailto=christian.hauschke@tib.eu,2016,article,True,84,Integration of Distributed Generation in Power Systems,Physical Sciences,Electrical and Electronic Engineering,,False,en,Engineering,
https://openalex.org/W2481239287,Retracted article: Football and physical health: what do we know?,Sport in Society,5,https://doi.org/10.1080/17430437.2016.1207787,https://api.labs.crossref.org/works/https://doi.org/10.1080/17430437.2016.1207787?mailto=christian.hauschke@tib.eu,2016,article,True,84,Diagnosis and Management of Arrhythmogenic Right Ventricular Cardiomyopathy,Health Sciences,Cardiology and Cardiovascular Medicine,Taylor & Francis,True,en,Medicine,
https://openalex.org/W2500397026,Lentivirus-mediated <i>angiopoietin-2</i> gene silencing decreases TNF-α induced apoptosis of alveolar epithelium cells,Biochemistry and Cell Biology,5,https://doi.org/10.1139/bcb-2016-0045,https://api.labs.crossref.org/works/https://doi.org/10.1139/bcb-2016-0045?mailto=christian.hauschke@tib.eu,2016,article,True,84,Role of Long Noncoding RNAs in Cancer and Development,Life Sciences,Cancer Research,NRC Research Press,False,en,"Biochemistry, Genetics and Molecular Biology",
https://openalex.org/W2502098495,"RETRACTED ARTICLE: Method development, validation, and stability studies of teneligliptin by RP-HPLC and identification of degradation products by UPLC tandem mass spectroscopy",Journal of Analytical Science and Technology,5,https://doi.org/10.1186/s40543-016-0099-0,https://api.labs.crossref.org/works/https://doi.org/10.1186/s40543-016-0099-0?mailto=christian.hauschke@tib.eu,2016,article,True,84,Green Analytical Chemistry in Pharmaceutical Analysis,Physical Sciences,Analytical Chemistry,Springer Nature,True,en,Chemistry,
https://openalex.org/W2504193543,RETRACTED ARTICLE: Research on tool change time and the dynamic reliability of the machining process based on sensitivity analysis,The International Journal of Advanced Manufacturing Technology,5,https://doi.org/10.1007/s00170-016-9177-0,https://api.labs.crossref.org/works/https://doi.org/10.1007/s00170-016-9177-0?mailto=christian.hauschke@tib.eu,2016,article,True,84,Uncertainty Quantification and Sensitivity Analysis,Social Sciences,"Statistics, Probability and Uncertainty",Springer Science+Business Media,False,en,Decision Sciences,
https://openalex.org/W2508057413,RETRACTED ARTICLE: A new antifungal labdane diterpene from the leaves of <i>Saraca indica</i>,Natural Product Research,5,https://doi.org/10.1080/14786419.2013.855931,https://api.labs.crossref.org/works/https://doi.org/10.1080/14786419.2013.855931?mailto=christian.hauschke@tib.eu,2013,article,True,83,Medicinal Plants: Chemical Constituents and Biological Activities,Life Sciences,Plant Science,Taylor & Francis,True,en,Agricultural and Biological Sciences,
https://openalex.org/W2509847688,Pseudopyronine B: A Potent Antimicrobial and Anticancer Molecule Isolated from a Pseudomonas mosselii,Frontiers in Microbiology,5,https://doi.org/10.3389/fmicb.2016.01307,https://api.labs.crossref.org/works/https://doi.org/10.3389/fmicb.2016.01307?mailto=christian.hauschke@tib.eu,2016,article,True,84,Elicitor Signal Transduction for Metabolite Production,Life Sciences,Molecular Biology,Frontiers Media,True,en,"Biochemistry, Genetics and Molecular Biology",
https://openalex.org/W2510653257,"RETRACTED ARTICLE: PPP1, a plant-specific regulator of transcription controls Arabidopsis development and PIN expression",Scientific Reports,5,https://doi.org/10.1038/srep32196,https://api.labs.crossref.org/works/https://doi.org/10.1038/srep32196?mailto=christian.hauschke@tib.eu,2016,article,True,84,Molecular Mechanisms of Plant Development and Regulation,Life Sciences,Plant Science,Nature Portfolio,True,en,Agricultural and Biological Sciences,
https://openalex.org/W2512381976,Tailoring of Mechanical Properties of Indirect Hot Stamping Steel Tubes by Laser Assisted Local Rapid Heating,Journal of Iron and Steel Research International,5,https://doi.org/10.1016/s1006-706x(16)30143-1,https://api.labs.crossref.org/works/https://doi.org/10.1016/s1006-706x(16)30143-1?mailto=christian.hauschke@tib.eu,2016,article,True,84,Modeling and Analysis of Laser Forming Process,Physical Sciences,Computational Mechanics,Springer Nature,False,en,Engineering,
https://openalex.org/W2514967806,Retracted: Generating Energy from Air: Solid State Planar Concentration Cell Based on Graphene Oxide,Advanced Materials Technologies,5,https://doi.org/10.1002/admt.201600145,https://api.labs.crossref.org/works/https://doi.org/10.1002/admt.201600145?mailto=christian.hauschke@tib.eu,2016,article,True,84,Materials for Electrochemical Supercapacitors,Physical Sciences,"Electronic, Optical and Magnetic Materials",Wiley,False,en,Materials Science,
https://openalex.org/W2515085358,RETRACTED: Tracer transport in naturally fractured reservoirs: Analytical solutions for a system of parallel fractures,International Journal of Heat and Mass Transfer,5,https://doi.org/10.1016/j.ijheatmasstransfer.2016.07.078,https://api.labs.crossref.org/works/https://doi.org/10.1016/j.ijheatmasstransfer.2016.07.078?mailto=christian.hauschke@tib.eu,2016,article,True,84,Groundwater Flow and Transport Modeling,Physical Sciences,Environmental Engineering,Elsevier BV,False,en,Environmental Science,
https://openalex.org/W2516626020,Historical Perspective on Public Support for the Draft: War Costs and Military Service,Journal of Global Security Studies,5,https://doi.org/10.1093/jogss/ogw014,https://api.labs.crossref.org/works/https://doi.org/10.1093/jogss/ogw014?mailto=christian.hauschke@tib.eu,2016,article,True,84,Economics of Military Expenditure and Growth,Social Sciences,Economics and Econometrics,Oxford University Press,False,en,"Economics, Econometrics and Finance",
https://openalex.org/W2522960478,RETRACTED: PS 124 - Efficacy and Safety of Induction Dosing of Vedolizumab for Reducing Biliary Inflammation in Primary Sclerosing Cholangitis (Psc) in Individuals with Inflammatory Bowel Disease,Journal of Hepatology,5,https://doi.org/10.1016/s0168-8278(16)01707-4,https://api.labs.crossref.org/works/https://doi.org/10.1016/s0168-8278(16)01707-4?mailto=christian.hauschke@tib.eu,2016,article,True,84,Diagnosis and Management of Liver Diseases,Health Sciences,Hepatology,Elsevier BV,True,en,Medicine,
https://openalex.org/W2527447086,"RETRACTED: Thermodynamic Stability of ABX Heavy Elements of TaIrGe, TiIrSb, TaIrSn and ZrIrSb TCOs Using the Half-Heusler Technique",Energy Procedia,5,https://doi.org/10.1016/j.egypro.2016.07.169,https://api.labs.crossref.org/works/https://doi.org/10.1016/j.egypro.2016.07.169?mailto=christian.hauschke@tib.eu,2016,article,True,84,Nuclear Fuel Development,Physical Sciences,Materials Chemistry,Elsevier BV,True,en,Materials Science,
https://openalex.org/W2537678808,Clinical study of Gene‐Eden‐VIR/Novirin in genital herpes: suppressive treatment safely decreases the duration of outbreaks in both severe and mild cases,Clinical and translational medicine,5,https://doi.org/10.1186/s40169-016-0121-6,https://api.labs.crossref.org/works/https://doi.org/10.1186/s40169-016-0121-6?mailto=christian.hauschke@tib.eu,2016,article,True,84,"Herpesviruses: Epidemiology, Pathogenesis, and Management",Health Sciences,Epidemiology,Springer Science+Business Media,True,en,Medicine,
https://openalex.org/W2538104774,"BSA Protein-Mediated Synthesis of Hollow Mesoporous Silica Nanotubes, and Their Carbohydrate Conjugates for Targeting Cancer Cells and Detecting Mycobacteria",ACS Applied Materials & Interfaces,5,https://doi.org/10.1021/acsami.6b10051,https://api.labs.crossref.org/works/https://doi.org/10.1021/acsami.6b10051?mailto=christian.hauschke@tib.eu,2016,article,True,84,DNA Nanotechnology and Bioanalytical Applications,Life Sciences,Molecular Biology,American Chemical Society,False,en,"Biochemistry, Genetics and Molecular Biology",
https://openalex.org/W2541712468,Notice of Violation of IEEE Publication Principles: Study of fault-tolerant routing algorithm of NoC based on 2D-Mesh topology,,5,https://doi.org/10.1109/asemd.2013.6780741,https://api.labs.crossref.org/works/https://doi.org/10.1109/asemd.2013.6780741?mailto=christian.hauschke@tib.eu,2013,article,True,83,Networks on Chip in System-on-Chip Design,Physical Sciences,Computer Networks and Communications,,False,en,Computer Science,
https://openalex.org/W2549012869,RETRACTED ARTICLE: The second version of the OCARS catalog of optical characteristics of astrometric radio sources,Astronomy Reports,5,https://doi.org/10.1134/s1063772916110032,https://api.labs.crossref.org/works/https://doi.org/10.1134/s1063772916110032?mailto=christian.hauschke@tib.eu,2016,article,True,84,Optical 3D Laser Measurement Systems Optimization,Physical Sciences,Computational Mechanics,Pleiades Publishing,False,en,Engineering,
https://openalex.org/W2549768769,"Portulacerebroside A inhibits adhesion, migration, and invasion of human leukemia HL60 cells and U937 cells through the regulation of p38/JNK signaling pathway",OncoTargets and Therapy,5,https://doi.org/10.2147/ott.s117523,https://api.labs.crossref.org/works/https://doi.org/10.2147/ott.s117523?mailto=christian.hauschke@tib.eu,2016,article,True,84,Effects of D-Galactose on Aging and Neurodegeneration,Life Sciences,Cellular and Molecular Neuroscience,Dove Medical Press,True,en,Neuroscience,
https://openalex.org/W2552332785,Carbon Emission Mitigation Potentials of Different Policy Scenarios and Their Effects on International Aviation in the Korean Context,Sustainability,5,https://doi.org/10.3390/su8111179,https://api.labs.crossref.org/works/https://doi.org/10.3390/su8111179?mailto=christian.hauschke@tib.eu,2016,article,True,84,Aviation's Impact on Global Climate Change,Physical Sciences,Global and Planetary Change,Multidisciplinary Digital Publishing Institute,True,en,Environmental Science,
https://openalex.org/W2555301314,RETRACTED ARTICLE: TWEAK-Fn14 Influences Neurogenesis Status via Modulating NF-κB in Mice with Spinal Cord Injury,Molecular Neurobiology,5,https://doi.org/10.1007/s12035-016-0248-x,https://api.labs.crossref.org/works/https://doi.org/10.1007/s12035-016-0248-x?mailto=christian.hauschke@tib.eu,2016,article,True,84,NF-?B Signaling in Inflammation and Cancer,Life Sciences,Cancer Research,Springer Science+Business Media,False,en,"Biochemistry, Genetics and Molecular Biology",
https://openalex.org/W2581202990,RETRACTED ARTICLE: Relationships of LDLR genetic polymorphisms with cerebral infarction: a meta-analysis,Molecular Biology Reports,5,https://doi.org/10.1007/s11033-014-3313-4,https://api.labs.crossref.org/works/https://doi.org/10.1007/s11033-014-3313-4?mailto=christian.hauschke@tib.eu,2014,article,True,84,Cholesterol-lowering Treatment,Health Sciences,Surgery,Springer Nature,False,en,Medicine,
