id,display_name,primary_location_display_name,cited_by_count,doi,crossref_call,publication_year,type,is_retracted,cited_by_percentile_year_min,primary_topic_display_name,primary_topic_domain_display_name,primary_topic_subfield_display_name,primary_location_source_host_organization_name,open_access_is_oa,language,primary_topic_field_display_name,update_nature
https://openalex.org/W2790989244,WITHDRAWN: Whole genome sequencing identifies novel NOTCH3 mutations for leukoaraiosis,Biochemical and Biophysical Research Communications,0,https://doi.org/10.1016/j.bbrc.2018.02.074,https://api.labs.crossref.org/works/https://doi.org/10.1016/j.bbrc.2018.02.074?mailto=christian.hauschke@tib.eu,2018,article,True,0,Cerebral Autosomal Dominant Arteriopathy with Subcortical Infarcts and Leukoencephalopathy,Health Sciences,Neurology,Elsevier BV,False,en,Medicine,Retraction
https://openalex.org/W2791044774,WITHDRAWN: After a motor vehicle accident is it neurogenic thoracic outlet syndrome or ulnar entrapment syndrome? How to make the correct diagnosis,The American Journal of Surgery,0,https://doi.org/10.1016/j.amjsurg.2018.03.019,https://api.labs.crossref.org/works/https://doi.org/10.1016/j.amjsurg.2018.03.019?mailto=christian.hauschke@tib.eu,2018,article,True,0,Diagnosis and Management of Carpal Tunnel Syndrome,Health Sciences,"Radiology, Nuclear Medicine and Imaging",Elsevier BV,True,en,Medicine,Retraction
https://openalex.org/W2791063390,WASP (Write a Scientific Paper): An existential metamotivational influence as to why teach and publish,Early Human Development,0,https://doi.org/10.1016/j.earlhumdev.2018.02.016,https://api.labs.crossref.org/works/https://doi.org/10.1016/j.earlhumdev.2018.02.016?mailto=christian.hauschke@tib.eu,2018,article,True,0,Scientific Writing and Publication Practices,Social Sciences,History and Philosophy of Science,Elsevier BV,False,en,Arts and Humanities,Expression of concern
https://openalex.org/W2791104935,RETRACTED: P444 Shared decision making for switching from oral mesalazine tablets to granules in low adherent inflammatory bowel disease patients,Journal of Crohn's and Colitis,0,https://doi.org/10.1093/ecco-jcc/jjx180.571,https://api.labs.crossref.org/works/https://doi.org/10.1093/ecco-jcc/jjx180.571?mailto=christian.hauschke@tib.eu,2018,article,True,0,Developmental Pharmacology in Pediatric Drug Use,Health Sciences,"Pediatrics, Perinatology and Child Health",Oxford University Press,False,en,Medicine,Retraction
https://openalex.org/W2791150302,"RETRACTED: Deficiency of a novel gene, <i>Yulink</i>, predisposes to heart failure and ventricular arrhythmia",The FASEB Journal,0,https://doi.org/10.1096/fj.201700932rr,https://api.labs.crossref.org/works/https://doi.org/10.1096/fj.201700932rr?mailto=christian.hauschke@tib.eu,2018,article,True,0,Molecular Mechanisms of Cardiac Arrhythmias,Health Sciences,Cardiology and Cardiovascular Medicine,Wiley,False,en,Medicine,Retraction
https://openalex.org/W2791302584,RETRACTED ARTICLE: Management of Frailty: Screening and Interventions,The Journal of Nutrition Health & Aging,0,https://doi.org/10.1007/s12603-018-1009-5,https://api.labs.crossref.org/works/https://doi.org/10.1007/s12603-018-1009-5?mailto=christian.hauschke@tib.eu,2018,article,True,0,Frailty in Older Adults and Geriatric Care,Health Sciences,Geriatrics and Gerontology,Springer Science+Business Media,False,en,Medicine,Retraction;Crossmark Retraction
https://openalex.org/W2791402161,RETRACTED: A solar cell endows the Surface-enhanced Raman scattering substrate with extra enhancement,Materials Letters,0,https://doi.org/10.1016/j.matlet.2018.01.129,https://api.labs.crossref.org/works/https://doi.org/10.1016/j.matlet.2018.01.129?mailto=christian.hauschke@tib.eu,2018,article,True,0,"Plasmonic Nanoparticles: Synthesis, Properties, and Applications",Physical Sciences,"Electronic, Optical and Magnetic Materials",Elsevier BV,False,en,Materials Science,Retraction;Crossmark Retraction
https://openalex.org/W2791594119,RETRACTED ARTICLE: Visualized image segmentation for multi-object tracking by weak clustering technique,Multimedia Tools and Applications,0,https://doi.org/10.1007/s11042-017-5392-4,https://api.labs.crossref.org/works/https://doi.org/10.1007/s11042-017-5392-4?mailto=christian.hauschke@tib.eu,2018,article,True,0,Image Feature Retrieval and Recognition Techniques,Physical Sciences,Computer Vision and Pattern Recognition,Springer Science+Business Media,True,en,Computer Science,Retraction;Crossmark Retraction
https://openalex.org/W2791599317,WITHDRAWN: Validez y fiabilidad de una versión en español del cuestionario Morisky Medication Adherence Scale (MMAS-8) en pacientes con diabetes mellitus tipo 2 en tratamiento con antidiabéticos orales,Atención Primaria,0,https://doi.org/10.1016/j.aprim.2017.10.010,https://api.labs.crossref.org/works/https://doi.org/10.1016/j.aprim.2017.10.010?mailto=christian.hauschke@tib.eu,2018,article,True,0,Improving Patient Adherence to Medication Regimens,Health Sciences,Family Practice,Elsevier BV,True,en,Medicine,Crossmark Retraction;Retraction
https://openalex.org/W2791809842,RETRACTED: Loss assessment of group residential buildings and information management system for wind catastrophe,Journal of Wind Engineering and Industrial Aerodynamics,0,https://doi.org/10.1016/j.jweia.2017.12.028,https://api.labs.crossref.org/works/https://doi.org/10.1016/j.jweia.2017.12.028?mailto=christian.hauschke@tib.eu,2018,article,True,0,Urban Wind Environment and Air Quality Modeling,Physical Sciences,Environmental Engineering,Elsevier BV,False,en,Environmental Science,Retraction;Crossmark Retraction
https://openalex.org/W2792051736,Inflamed bilateral linear atrophoderma of Moulin in an adult woman: a case report,"Acta dermatovenerologica Alpina, Pannonica et Adriatica (Tiskana izd.)",0,https://doi.org/10.15570/actaapa.2018.6,https://api.labs.crossref.org/works/https://doi.org/10.15570/actaapa.2018.6?mailto=christian.hauschke@tib.eu,2018,article,True,0,Genetic Disorders Causing Tissue Mineralization Abnormalities,Life Sciences,Genetics,,True,en,"Biochemistry, Genetics and Molecular Biology",Retraction
https://openalex.org/W2792076453,RETRACTED: Performance analysis of solar water distillation cum drying unit with the assessment of Flat Plate Solar Collector,Desalination,0,https://doi.org/10.1016/j.desal.2018.03.017,https://api.labs.crossref.org/works/https://doi.org/10.1016/j.desal.2018.03.017?mailto=christian.hauschke@tib.eu,2018,article,True,0,Solar Thermal Energy Technologies,Physical Sciences,"Renewable Energy, Sustainability and the Environment",Elsevier BV,False,en,Energy,Retraction;Crossmark Retraction
https://openalex.org/W2792112444,RETRACTED ARTICLE: Analysis of security operation and maintenance system using privacy utility in media environment,Multimedia Tools and Applications,0,https://doi.org/10.1007/s11042-017-5361-y,https://api.labs.crossref.org/works/https://doi.org/10.1007/s11042-017-5361-y?mailto=christian.hauschke@tib.eu,2018,article,True,0,Ontology-Based Healthcare Context Information Modeling,Health Sciences,Health Information Management,Springer Science+Business Media,True,en,Health Professions,Retraction;Crossmark Retraction
https://openalex.org/W2792287937,RETRACTED ARTICLE: Learning an video-based message sharing system for large-scale smart vehicles,Multimedia Tools and Applications,0,https://doi.org/10.1007/s11042-018-5760-8,https://api.labs.crossref.org/works/https://doi.org/10.1007/s11042-018-5760-8?mailto=christian.hauschke@tib.eu,2018,article,True,0,Wireless Energy Harvesting and Information Transfer,Physical Sciences,Electrical and Electronic Engineering,Springer Science+Business Media,True,en,Engineering,Retraction;Crossmark Retraction
https://openalex.org/W2792326986,Complete amenorrhea following NovaSure endometrial ablation for resistant menorrhagia: a case report,Mini-invasive surgery,0,https://doi.org/10.20517/2574-1225.2017.30,https://api.labs.crossref.org/works/https://doi.org/10.20517/2574-1225.2017.30?mailto=christian.hauschke@tib.eu,2018,article,True,0,Uterine Conditions and Treatments,Health Sciences,Obstetrics and Gynecology,,True,en,Medicine,Retraction;Crossmark Retraction
https://openalex.org/W2792367122,RETRACTED ARTICLE: Application effect analysis of the test system of track and field web course based on software programming method,Cluster Computing,0,https://doi.org/10.1007/s10586-018-2463-x,https://api.labs.crossref.org/works/https://doi.org/10.1007/s10586-018-2463-x?mailto=christian.hauschke@tib.eu,2018,article,True,0,Optimization of Big Data Processing and Analysis,Physical Sciences,Artificial Intelligence,Springer Science+Business Media,False,en,Computer Science,Retraction
https://openalex.org/W2792453633,RETRACTED ARTICLE: Research on computer technical assistance tools for special children for music therapy,Cluster Computing,0,https://doi.org/10.1007/s10586-018-2210-3,https://api.labs.crossref.org/works/https://doi.org/10.1007/s10586-018-2210-3?mailto=christian.hauschke@tib.eu,2018,article,True,0,Brain-Computer Interfaces in Neuroscience and Medicine,Life Sciences,Cognitive Neuroscience,Springer Science+Business Media,False,en,Neuroscience,Retraction
https://openalex.org/W2792650360,"WITHDRAWN: Sedimentary facies, sequence stratigraphy and diagenesis of mixed fluvial siliciclastic-marine carbonate deposits of the Lower Miocene Razak Formation at Sarkhun Gas Field, Zagros Basin, SE Iran: A linkage with reservoir quality",Marine and Petroleum Geology,0,https://doi.org/10.1016/j.marpetgeo.2018.02.018,https://api.labs.crossref.org/works/https://doi.org/10.1016/j.marpetgeo.2018.02.018?mailto=christian.hauschke@tib.eu,2018,article,True,0,Characterization of Shale Gas Pore Structure,Physical Sciences,Mechanics of Materials,Elsevier BV,False,en,Engineering,Retraction;Crossmark Retraction
https://openalex.org/W2792777921,"RETRACTED ARTICLE: Male Desire, Male Frustration … and Epiphany: Mamet’s Edmond as a Species of Supranaturalism","ANQ: A Quarterly Journal of Short Articles, Notes and Reviews",0,https://doi.org/10.1080/0895769x.2017.1422425,https://api.labs.crossref.org/works/https://doi.org/10.1080/0895769x.2017.1422425?mailto=christian.hauschke@tib.eu,2018,article,True,0,Cultural Studies and Interdisciplinary Research,Social Sciences,Philosophy,Routledge,False,en,Arts and Humanities,Retraction
https://openalex.org/W2792780780,RETRACTED ARTICLE: Biceps tendon interposition in two-part fracture of the humeral surgical neck,European Journal of Orthopaedic Surgery and Traumatology,0,https://doi.org/10.1007/s00590-018-2128-8,https://api.labs.crossref.org/works/https://doi.org/10.1007/s00590-018-2128-8?mailto=christian.hauschke@tib.eu,2018,article,True,0,Epidemiology and Treatment of Clavicle and Acromioclavicular Injuries,Health Sciences,Epidemiology,Springer Science+Business Media,True,en,Medicine,Retraction;Crossmark Retraction
https://openalex.org/W2792786764,"A simple and efficient inversion approach for estimation of primaries, surface-related multiples, and wavelets",Geophysics,0,https://doi.org/10.1190/geo2017-0578.1,https://api.labs.crossref.org/works/https://doi.org/10.1190/geo2017-0578.1?mailto=christian.hauschke@tib.eu,2018,article,True,0,Seismic Waveform Inversion in Geophysics,Physical Sciences,Geophysics,Society of Exploration Geophysicists,False,en,Earth and Planetary Sciences,Retraction
https://openalex.org/W2792907071,RETRACTED: Dynamic Modeling and Controller Design of DSTATCOM in a Microgrid Based on Combination of Fuzzy Set and Galaxy-based Search Algorithm,Distributed generation & alternative energy journal,0,https://doi.org/10.1080/21563306.2018.11969263,https://api.labs.crossref.org/works/https://doi.org/10.1080/21563306.2018.11969263?mailto=christian.hauschke@tib.eu,2018,article,True,0,Control and Synchronization in Microgrid Systems,Physical Sciences,Control and Systems Engineering,Taylor & Francis,False,en,Engineering,Retraction
https://openalex.org/W2792938695,RETRACTED ARTICLE: Analysis and study on the key factors of regional tourism development based on discrete differential algorithm,Cluster Computing,0,https://doi.org/10.1007/s10586-018-2460-0,https://api.labs.crossref.org/works/https://doi.org/10.1007/s10586-018-2460-0?mailto=christian.hauschke@tib.eu,2018,article,True,0,Drivers and Impediments for Cross-Border E-Commerce,Social Sciences,Business and International Management,Springer Science+Business Media,False,en,"Business, Management and Accounting",Retraction
https://openalex.org/W2792952167,RETRACTED CHAPTER: A Planning Tool for TV White Space Deployments,Springer eBooks,0,https://doi.org/10.1007/978-3-319-76207-4_13,https://api.labs.crossref.org/works/https://doi.org/10.1007/978-3-319-76207-4_13?mailto=christian.hauschke@tib.eu,2018,book-chapter,True,0,Next Generation 5G Wireless Networks,Physical Sciences,Electrical and Electronic Engineering,Springer Nature,False,en,Engineering,Retraction
https://openalex.org/W2793234710,Nucleophagy in Human Disease: Beyond the Physiological Role [Retraction],Tohoku Journal of Experimental Medicine,0,https://doi.org/10.1620/tjem.244.75,https://api.labs.crossref.org/works/https://doi.org/10.1620/tjem.244.75?mailto=christian.hauschke@tib.eu,2018,article,True,0,Role of Autophagy in Disease and Health,Health Sciences,Epidemiology,Tohoku University,True,en,Medicine,Retraction
https://openalex.org/W2793372463,RETRACTED ARTICLE: David Eduardo TAVAREZ (Ed.). Words and Worlds Turned Around: Indigenous Christianities in Colonial Latin America.,International Journal of Latin American Religions,0,https://doi.org/10.1007/s41603-018-0040-y,https://api.labs.crossref.org/works/https://doi.org/10.1007/s41603-018-0040-y?mailto=christian.hauschke@tib.eu,2018,article,True,0,Visual Culture in Colonial Spanish America,Social Sciences,Visual Arts and Performing Arts,Springer Science+Business Media,True,en,Arts and Humanities,Retraction;Crossmark Retraction
https://openalex.org/W2793397659,Erratum zu: RETRACTED ARTICLE: Immuntherapie des multiplen Myeloms,InFo Onkologie,0,https://doi.org/10.1007/s15004-018-5939-1,https://api.labs.crossref.org/works/https://doi.org/10.1007/s15004-018-5939-1?mailto=christian.hauschke@tib.eu,2018,erratum,True,0,Diagnosis and Treatment of Multiple Myeloma,Health Sciences,Hematology,Springer Nature,False,de,Medicine,Crossmark Retraction
https://openalex.org/W2793625878,RETRACTED ARTICLE: Differentiation analysis for estimating individual ancestry from the Tibetan Plateau by an archaic altitude adaptation EPAS1 haplotype among East Asian populations,International Journal of Legal Medicine,0,https://doi.org/10.1007/s00414-018-1789-5,https://api.labs.crossref.org/works/https://doi.org/10.1007/s00414-018-1789-5?mailto=christian.hauschke@tib.eu,2018,article,True,0,Genetic and Physiological Adaptations to High-Altitude Environments,Life Sciences,Genetics,Springer Science+Business Media,False,en,"Biochemistry, Genetics and Molecular Biology",Retraction;Expression of concern;Crossmark Retraction
https://openalex.org/W2793693972,<i>Retracted:</i> Techno-economic analysis of a novel hot-air recirculation process for exhaust heat recovery from a 600-MW hard coal-fired boiler,International Journal of Energy Research,0,https://doi.org/10.1002/er.4026,https://api.labs.crossref.org/works/https://doi.org/10.1002/er.4026?mailto=christian.hauschke@tib.eu,2018,article,True,0,Inverse Radiative Heat Transfer Analysis,Physical Sciences,Computational Mechanics,Wiley-Blackwell,True,en,Engineering,Retraction
https://openalex.org/W2793772551,WITHDRAWN: Phacomatosis pigmentovascularis associated with congenital chylous ascites,Journal of Pediatric Surgery Case Reports,0,https://doi.org/10.1016/j.epsc.2018.02.014,https://api.labs.crossref.org/works/https://doi.org/10.1016/j.epsc.2018.02.014?mailto=christian.hauschke@tib.eu,2018,article,True,0,Classification and Treatment of Vascular Anomalies,Health Sciences,Surgery,Elsevier BV,True,en,Medicine,Crossmark Retraction;Retraction
https://openalex.org/W2793782147,"EXPERIENCE OF LARGE SAPHENOUS VEIN HARVESTING BY METHOD OF ""SKIN BRIDGES"" IN AORTO-CORONARY ARTERY BYPASS SURGERY",Žurnal Grodnenskogo gosudarstvennogo medicinskogo universiteta,0,https://doi.org/10.25298/2221-8785-2018-16-1-106-110,https://api.labs.crossref.org/works/https://doi.org/10.25298/2221-8785-2018-16-1-106-110?mailto=christian.hauschke@tib.eu,2018,article,True,0,Cardiac Surgery and Bypass Grafting Outcomes,Health Sciences,Surgery,Grodno State Medical University,True,en,Medicine,Retraction
https://openalex.org/W2793912033,Formative assessment based course outcomes and instructions,Journal of Fundamental and Applied Sciences,0,https://doi.org/10.4314/jfas.v10i6s.14,https://api.labs.crossref.org/works/https://doi.org/10.4314/jfas.v10i6s.14?mailto=christian.hauschke@tib.eu,2018,article,True,0,Remote Laboratories in Engineering Education,Physical Sciences,Media Technology,University of El Oued,False,en,Engineering,
https://openalex.org/W2793996297,RETRACTED: Arsenic Trioxide Inhibits Proliferation and Induced apoptosis of Leukemia Stem Cells with Drug Resistance,Leukemia Research,0,https://doi.org/10.1016/j.leukres.2018.02.016,https://api.labs.crossref.org/works/https://doi.org/10.1016/j.leukres.2018.02.016?mailto=christian.hauschke@tib.eu,2018,article,True,0,Role of Retinoic Acid in Biological Processes,Life Sciences,Molecular Biology,Elsevier BV,False,en,"Biochemistry, Genetics and Molecular Biology",Retraction;Crossmark Retraction
https://openalex.org/W2794027763,STUDY OF THE INFLUENCE OF DIFFERENT TYPES OF HEAT TREATMENT ON THE STRUCTURE AND STRENGTH PROPERTIES OF HIGH-STRENGTH MARTENSITIC AGING STEELS,Trudy VIAM,0,https://doi.org/10.18577/2307-6046-2018-0-3-3-11,https://api.labs.crossref.org/works/https://doi.org/10.18577/2307-6046-2018-0-3-3-11?mailto=christian.hauschke@tib.eu,2018,article,True,0,Materials Science and Technology,Physical Sciences,General Materials Science,,False,en,Materials Science,Retraction
https://openalex.org/W2794233932,RETRACTED ARTICLE: Computer electromagnetic radiation carcinogenic doses based on Monte Carlo algorithm,Cluster Computing,0,https://doi.org/10.1007/s10586-018-2059-5,https://api.labs.crossref.org/works/https://doi.org/10.1007/s10586-018-2059-5?mailto=christian.hauschke@tib.eu,2018,article,True,0,Radiotherapy Physics and Technology,Physical Sciences,Radiation,Springer Science+Business Media,True,en,Physics and Astronomy,Retraction
https://openalex.org/W2794413558,INTEGRATION OF INTELLECTUAL CAPITAL AND INNOVATION IN SMEs’ PERFORMANCE: A CONCEPTUAL FRAMEWORK,Journal of Fundamental and Applied Sciences,0,https://doi.org/10.4314/jfas.v10i6s.1,https://api.labs.crossref.org/works/https://doi.org/10.4314/jfas.v10i6s.1?mailto=christian.hauschke@tib.eu,2018,article,True,0,Intellectual Capital and Business Performance,Social Sciences,Strategy and Management,University of El Oued,False,en,"Business, Management and Accounting",
https://openalex.org/W2794509604,RETRACTED: Implementation of an improved scheme for grid interactive photovoltaic system through 48 V DC appliances,Energy & Environment,0,https://doi.org/10.1177/0958305x18763403,https://api.labs.crossref.org/works/https://doi.org/10.1177/0958305x18763403?mailto=christian.hauschke@tib.eu,2018,article,True,0,Control and Synchronization in Microgrid Systems,Physical Sciences,Control and Systems Engineering,SAGE Publishing,False,en,Engineering,Retraction
https://openalex.org/W2794807326,A BALANCED SCORECARD FOR EVALUATION OF SUSTAINABLE PERFORMANCES IN MOROCCAN UNIVERSITIES,Journal of Fundamental and Applied Sciences,0,https://doi.org/10.4314/jfas.v10i4s.210,https://api.labs.crossref.org/works/https://doi.org/10.4314/jfas.v10i4s.210?mailto=christian.hauschke@tib.eu,2018,article,True,0,Sustainability Education in Higher Education Institutions,Social Sciences,Education,University of El Oued,False,en,Social Sciences,
https://openalex.org/W2794891086,RETRACTED ARTICLE: Research on fine grained software radio communication algorithm based on GPU parallel processing technology,Cluster Computing,0,https://doi.org/10.1007/s10586-018-2542-z,https://api.labs.crossref.org/works/https://doi.org/10.1007/s10586-018-2542-z?mailto=christian.hauschke@tib.eu,2018,article,True,0,Text Compression and Indexing Algorithms,Physical Sciences,Artificial Intelligence,Springer Science+Business Media,False,en,Computer Science,Retraction
https://openalex.org/W2794905954,RETRACTED: Applying case-based reasoning in social computing to transform colors into music,Engineering Applications of Artificial Intelligence,0,https://doi.org/10.1016/j.engappai.2018.03.007,https://api.labs.crossref.org/works/https://doi.org/10.1016/j.engappai.2018.03.007?mailto=christian.hauschke@tib.eu,2018,article,True,0,Automatic Keyword Extraction from Textual Data,Physical Sciences,Artificial Intelligence,Elsevier BV,False,en,Computer Science,Crossmark Retraction
https://openalex.org/W2795047438,RETRACTED ARTICLE: Solving algorithm for inverse problem of partial differential equation parameter identification based on IGEP,Cluster Computing,0,https://doi.org/10.1007/s10586-018-2543-y,https://api.labs.crossref.org/works/https://doi.org/10.1007/s10586-018-2543-y?mailto=christian.hauschke@tib.eu,2018,article,True,0,Swarm Intelligence Optimization Algorithms,Physical Sciences,Artificial Intelligence,Springer Science+Business Media,False,en,Computer Science,Retraction
https://openalex.org/W2795261852,RETRACTED: Corrigendum to “High performance polymeric flocculants based on modified polysaccharides—Microwave assisted synthesis” [Carbohydr. Polym. 87 (2012) 336–342],Carbohydrate Polymers,0,https://doi.org/10.1016/j.carbpol.2018.03.090,https://api.labs.crossref.org/works/https://doi.org/10.1016/j.carbpol.2018.03.090?mailto=christian.hauschke@tib.eu,2018,article,True,0,Microwave-Assisted Chemistry in Organic Synthesis,Physical Sciences,Organic Chemistry,Elsevier BV,False,en,Chemistry,Retraction;Crossmark Retraction
https://openalex.org/W2795265555,Reconstruction of Cyber and Physical Software Using Novel Spread Method,IOP Conference Series: Materials Science and Engineering,0,https://doi.org/10.1088/1757-899x/322/5/052010,https://api.labs.crossref.org/works/https://doi.org/10.1088/1757-899x/322/5/052010?mailto=christian.hauschke@tib.eu,2018,article,True,0,Characterization and Detection of Android Malware,Physical Sciences,Signal Processing,IOP Publishing,True,en,Computer Science,Retraction
https://openalex.org/W2795269865,An Novel Architecture of Large-scale Communication in IOT,IOP Conference Series: Materials Science and Engineering,0,https://doi.org/10.1088/1757-899x/322/5/052057,https://api.labs.crossref.org/works/https://doi.org/10.1088/1757-899x/322/5/052057?mailto=christian.hauschke@tib.eu,2018,article,True,0,Internet of Things and Edge Computing,Physical Sciences,Computer Networks and Communications,IOP Publishing,True,en,Computer Science,Retraction
https://openalex.org/W2795552293,Optimization of tissue anchoring performance and mechanical properties of barbed sutures for flexor tendons repair,Plastic and Aesthetic Research,0,https://doi.org/10.20517/2347-9264.2018.01,https://api.labs.crossref.org/works/https://doi.org/10.20517/2347-9264.2018.01?mailto=christian.hauschke@tib.eu,2018,article,True,0,Treatment and Outcomes of Hand Injuries,Health Sciences,Surgery,Medknow,True,en,Medicine,Retraction
https://openalex.org/W2795594392,RETRACTED ARTICLE: Understanding the social and community support networks of American Indian women cancer survivors,Ethnicity and Health,0,https://doi.org/10.1080/13557858.2018.1458075,https://api.labs.crossref.org/works/https://doi.org/10.1080/13557858.2018.1458075?mailto=christian.hauschke@tib.eu,2018,article,True,0,Challenges and Solutions in Rural Health Workforce,Health Sciences,Emergency Medical Services,Taylor & Francis,True,en,Health Professions,Retraction;Crossmark Retraction
https://openalex.org/W2795623789,RETRACTED: Anti-angiogenic effect of Interleukin-26 in oxygen-induced retinopathy mice via inhibiting NFATc1-VEGF pathway,Biochemical and Biophysical Research Communications,0,https://doi.org/10.1016/j.bbrc.2018.04.004,https://api.labs.crossref.org/works/https://doi.org/10.1016/j.bbrc.2018.04.004?mailto=christian.hauschke@tib.eu,2018,article,True,0,Role of STAT3 in Cancer Inflammation and Immunity,Health Sciences,Oncology,Elsevier BV,False,en,Medicine,Retraction;Crossmark Retraction
https://openalex.org/W2795688685,Notice of Retraction: Signal and Power Integrity SPICE Cosimulation Versus 3-D EM Co-Extraction for DDR Memory Interface Modules,IEEE Transactions on Electromagnetic Compatibility,0,https://doi.org/10.1109/temc.2018.2817259,https://api.labs.crossref.org/works/https://doi.org/10.1109/temc.2018.2817259?mailto=christian.hauschke@tib.eu,2018,article,True,0,Phase-Locked Loops in High-Speed Circuits,Physical Sciences,Electrical and Electronic Engineering,Institute of Electrical and Electronics Engineers,False,en,Engineering,Retraction
https://openalex.org/W2795760543,WITHDRAWN: A Randomized Controlled Trial Comparing Between Titanium Osteosynthesis and Biodegradable Osteosynthesis in Access Mandibulotomy for Oral Malignancy,Journal of Oral and Maxillofacial Surgery,0,https://doi.org/10.1016/j.joms.2018.03.043,https://api.labs.crossref.org/works/https://doi.org/10.1016/j.joms.2018.03.043?mailto=christian.hauschke@tib.eu,2018,article,True,0,Microsurgical Reconstruction Techniques,Health Sciences,Surgery,Elsevier BV,True,en,Medicine,Retraction
https://openalex.org/W2795792604,RETRACTED: Photophysics of artist’s pigments,Measurement,0,https://doi.org/10.1016/j.measurement.2018.03.082,https://api.labs.crossref.org/works/https://doi.org/10.1016/j.measurement.2018.03.082?mailto=christian.hauschke@tib.eu,2018,article,True,0,Color Psychology and Product Design,Social Sciences,Social Psychology,Elsevier BV,False,en,Psychology,Retraction;Crossmark Retraction
