id,display_name,primary_location_display_name,cited_by_count,doi,crossref_call,publication_year,type,is_retracted,cited_by_percentile_year_min,primary_topic_display_name,primary_topic_domain_display_name,primary_topic_subfield_display_name,primary_location_source_host_organization_name,open_access_is_oa,language,primary_topic_field_display_name,update_nature
https://openalex.org/W4282963507,Circular RNA circ-ABCB10 Promotes Proliferation and Inhibits Apoptosis of Laryngeal Carcinoma by Inhibiting KLF6,Computational and Mathematical Methods in Medicine,1,https://doi.org/10.1155/2022/7754931,https://api.labs.crossref.org/works/https://doi.org/10.1155/2022/7754931?mailto=christian.hauschke@tib.eu,2022,article,True,69,Biogenesis and Functions of Circular RNAs,Life Sciences,Molecular Biology,Hindawi Publishing Corporation,True,en,"Biochemistry, Genetics and Molecular Biology",Retraction
https://openalex.org/W4282963676,Probabilistic Statistics-Based Endurance Life Prediction of Bridge Structures,Computational Intelligence and Neuroscience,1,https://doi.org/10.1155/2022/8035028,https://api.labs.crossref.org/works/https://doi.org/10.1155/2022/8035028?mailto=christian.hauschke@tib.eu,2022,article,True,69,Automated Pavement Inspection and Maintenance,Physical Sciences,Civil and Structural Engineering,Hindawi Publishing Corporation,True,en,Engineering,Retraction
https://openalex.org/W4282968962,The Reversible Fourth-Generation EGFR Tyrosine Kinase Inhibitor OBX02–011 Overcomes C797S-Mediated Resistance in Lung Cancer,Cancer Research,1,https://doi.org/10.1158/0008-5472.can-22-0394,https://api.labs.crossref.org/works/https://doi.org/10.1158/0008-5472.can-22-0394?mailto=christian.hauschke@tib.eu,2022,article,True,69,Advancements in Lung Cancer Research,Health Sciences,Pulmonary and Respiratory Medicine,American Association for Cancer Research,True,en,Medicine,Retraction
https://openalex.org/W4282970182,Continual Digital Twin Technology Application on the Construction of English-Chinese Bilingual Teaching Mode,Computational Intelligence and Neuroscience,1,https://doi.org/10.1155/2022/6423550,https://api.labs.crossref.org/works/https://doi.org/10.1155/2022/6423550?mailto=christian.hauschke@tib.eu,2022,article,True,69,Artificial Intelligence in Education and Technology,Physical Sciences,Artificial Intelligence,Hindawi Publishing Corporation,True,en,Computer Science,Retraction
https://openalex.org/W4282973727,Contemporary Value Assessment of Marxist Ideology under the Context of Deep Learning,Computational and Mathematical Methods in Medicine,1,https://doi.org/10.1155/2022/4654153,https://api.labs.crossref.org/works/https://doi.org/10.1155/2022/4654153?mailto=christian.hauschke@tib.eu,2022,article,True,69,Innovation and Development of Ideological Education,Social Sciences,Education,Hindawi Publishing Corporation,True,en,Social Sciences,Retraction
https://openalex.org/W4282974894,Dioscorea nipponica Makino Relieves Ovalbumin-Induced Asthma in Mice through Regulating RKIP-Mediated Raf-1/MEK/MAPK/ERK Signaling Pathway,BioMed Research International,1,https://doi.org/10.1155/2022/8077058,https://api.labs.crossref.org/works/https://doi.org/10.1155/2022/8077058?mailto=christian.hauschke@tib.eu,2022,article,True,69,Computational Methods in Drug Discovery,Physical Sciences,Computational Theory and Mathematics,Hindawi Publishing Corporation,True,en,Computer Science,
https://openalex.org/W4282976884,Study of Neighborhood Degree-Based Topological Indices via Direct and NM-Polynomial of Starphene Graph,Journal of function spaces,1,https://doi.org/10.1155/2022/8661489,https://api.labs.crossref.org/works/https://doi.org/10.1155/2022/8661489?mailto=christian.hauschke@tib.eu,2022,article,True,69,Graph Spectra and Topological Indices,Physical Sciences,Geometry and Topology,Hindawi Publishing Corporation,True,en,Mathematics,
https://openalex.org/W4282978101,Effect of Tetracycline Antibiotics on Anaerobic Digestion of Chicken Manure Based on Data Mining,Computational Intelligence and Neuroscience,1,https://doi.org/10.1155/2022/6335146,https://api.labs.crossref.org/works/https://doi.org/10.1155/2022/6335146?mailto=christian.hauschke@tib.eu,2022,article,True,69,Anaerobic Digestion and Biogas Production,Physical Sciences,Building and Construction,Hindawi Publishing Corporation,True,en,Engineering,Retraction
https://openalex.org/W4282979601,Analysis of Digital Photography Technology in the Era of Big Data,Mobile Information Systems,1,https://doi.org/10.1155/2022/3880755,https://api.labs.crossref.org/works/https://doi.org/10.1155/2022/3880755?mailto=christian.hauschke@tib.eu,2022,article,True,69,Blockchain and Internet of Things Integration,Physical Sciences,Information Systems,IOS Press,True,en,Computer Science,Retraction
https://openalex.org/W4283008363,Effect of Nursing Intervention on Coronary CT Angiography in Elderly Patients,Scanning,1,https://doi.org/10.1155/2022/3663285,https://api.labs.crossref.org/works/https://doi.org/10.1155/2022/3663285?mailto=christian.hauschke@tib.eu,2022,article,True,69,Efficient Cooperative Image Transmission in Sensor Networks,Physical Sciences,Computer Networks and Communications,Wiley,True,en,Computer Science,Retraction
https://openalex.org/W4283011961,Analysis of Infertility Factors Caused by Gynecological Chronic Pelvic Inflammation Disease Based on Multivariate Regression Analysis of Logistic,Scanning,1,https://doi.org/10.1155/2022/7531190,https://api.labs.crossref.org/works/https://doi.org/10.1155/2022/7531190?mailto=christian.hauschke@tib.eu,2022,article,True,69,Diagnosis and Treatment of Diverticulitis,Health Sciences,Surgery,Wiley,True,en,Medicine,Retraction
https://openalex.org/W4283014271,Kinesin Family Member 2A Serves as a Potential Biomarker Reflecting More Frequent Lymph Node Metastasis and Tumor Recurrence Risk in Basal-Like Breast Cancer Patients,Frontiers in Surgery,1,https://doi.org/10.3389/fsurg.2022.889294,https://api.labs.crossref.org/works/https://doi.org/10.3389/fsurg.2022.889294?mailto=christian.hauschke@tib.eu,2022,article,True,69,Regulation and Function of Microtubules in Cell Division,Life Sciences,Cell Biology,Frontiers Media,True,en,"Biochemistry, Genetics and Molecular Biology",Retraction
https://openalex.org/W4283017264,WITHDRAWN: miR-150-5p inhibits nasopharyngeal cancer genesis by suppressing PYCR1,The American Journal of the Medical Sciences,1,https://doi.org/10.1016/j.amjms.2022.06.004,https://api.labs.crossref.org/works/https://doi.org/10.1016/j.amjms.2022.06.004?mailto=christian.hauschke@tib.eu,2022,article,True,69,Role of Long Noncoding RNAs in Cancer and Development,Life Sciences,Cancer Research,Elsevier BV,True,en,"Biochemistry, Genetics and Molecular Biology",Retraction;Crossmark Retraction
https://openalex.org/W4283019573,Magnetic Resonance Imaging Assessment of Fatigue Injury during Exercise,Scanning,1,https://doi.org/10.1155/2022/9971966,https://api.labs.crossref.org/works/https://doi.org/10.1155/2022/9971966?mailto=christian.hauschke@tib.eu,2022,article,True,69,Intelligent Manufacturing Technologies,Physical Sciences,Industrial and Manufacturing Engineering,Wiley,True,en,Engineering,Retraction
https://openalex.org/W4283022175,Antitumor Proliferation and Related Mechanism of Ultrasound Irradiation Combined with Safflower Yellow,Computational Intelligence and Neuroscience,1,https://doi.org/10.1155/2022/5168886,https://api.labs.crossref.org/works/https://doi.org/10.1155/2022/5168886?mailto=christian.hauschke@tib.eu,2022,article,True,69,Focused Ultrasound Technology and Applications,Physical Sciences,Biomedical Engineering,Hindawi Publishing Corporation,True,en,Engineering,Retraction
https://openalex.org/W4283022993,Application of Chain Nursing Process in the Nursing of Elderly Inpatients with Implantable Venous Infusion Port,Emergency Medicine International,1,https://doi.org/10.1155/2022/5496533,https://api.labs.crossref.org/works/https://doi.org/10.1155/2022/5496533?mailto=christian.hauschke@tib.eu,2022,article,True,69,,,,Hindawi Publishing Corporation,True,en,,Retraction
https://openalex.org/W4283023778,Design of a Multimedia-Assisted Distance English Teaching System for College Students,Computational Intelligence and Neuroscience,1,https://doi.org/10.1155/2022/2184600,https://api.labs.crossref.org/works/https://doi.org/10.1155/2022/2184600?mailto=christian.hauschke@tib.eu,2022,article,True,69,Efficient Cooperative Image Transmission in Sensor Networks,Physical Sciences,Computer Networks and Communications,Hindawi Publishing Corporation,True,en,Computer Science,Retraction
https://openalex.org/W4283024001,RETRACTED ARTICLE: Balanced scheduling method of network information resources for cloud storage,Journal of Control and Decision,1,https://doi.org/10.1080/23307706.2022.2078435,https://api.labs.crossref.org/works/https://doi.org/10.1080/23307706.2022.2078435?mailto=christian.hauschke@tib.eu,2022,article,True,69,Graph Matching and Analysis Techniques,Physical Sciences,Computer Vision and Pattern Recognition,Taylor & Francis,False,en,Computer Science,
https://openalex.org/W4283026649,Music Timbre Extracted from Audio Signal Features,Mobile Information Systems,1,https://doi.org/10.1155/2022/1349935,https://api.labs.crossref.org/works/https://doi.org/10.1155/2022/1349935?mailto=christian.hauschke@tib.eu,2022,article,True,69,Audio Signal Classification and Analysis,Physical Sciences,Signal Processing,IOS Press,True,en,Computer Science,Retraction
https://openalex.org/W4283031932,Sports Feedback System Based on Video Digital Processing,Computational and Mathematical Methods in Medicine,1,https://doi.org/10.1155/2022/2859567,https://api.labs.crossref.org/works/https://doi.org/10.1155/2022/2859567?mailto=christian.hauschke@tib.eu,2022,article,True,69,Knowledge Base Graph Embedding for Visual Question Answering,Physical Sciences,Artificial Intelligence,Hindawi Publishing Corporation,True,en,Computer Science,Retraction
https://openalex.org/W4283068800,Practice and Exploration of Teaching Mental Health Education for College Students Based on Data Mining Algorithm,Security and Communication Networks,1,https://doi.org/10.1155/2022/8936152,https://api.labs.crossref.org/works/https://doi.org/10.1155/2022/8936152?mailto=christian.hauschke@tib.eu,2022,article,True,69,Educational Data Mining and Learning Analytics,Physical Sciences,Computer Science Applications,Hindawi Publishing Corporation,True,en,Computer Science,Retraction
https://openalex.org/W4283069395,<i>Retracted:</i> Multifunctional <scp>LPxTG</scp>‐motif surface protein derived from <i>Limosilactobacillus reuteri</i><scp>SH</scp> 23 in <scp>DSS</scp>‐induced ulcerative colitis of mice,The FASEB Journal,1,https://doi.org/10.1096/fj.202200252,https://api.labs.crossref.org/works/https://doi.org/10.1096/fj.202200252?mailto=christian.hauschke@tib.eu,2022,article,True,69,Probiotics and Prebiotics,Life Sciences,Food Science,Wiley,False,en,Agricultural and Biological Sciences,Retraction
https://openalex.org/W4283072632,Clinical Effect of Butylphthalide Combined with Rt-PA Intravenous Thrombolysis in the Treatment of Acute Cerebral Infarction,Applied Bionics and Biomechanics,1,https://doi.org/10.1155/2022/9215685,https://api.labs.crossref.org/works/https://doi.org/10.1155/2022/9215685?mailto=christian.hauschke@tib.eu,2022,article,True,69,Chronic Cerebral Hypoperfusion-Related Neurodegenerative Diseases,Life Sciences,Neurology,Hindawi Publishing Corporation,True,en,Neuroscience,Retraction
https://openalex.org/W4283072963,Analysis of Legal Attributes and Rights Attributes of Personal Information from the Perspective of Big Data,Computational and Mathematical Methods in Medicine,1,https://doi.org/10.1155/2022/9731414,https://api.labs.crossref.org/works/https://doi.org/10.1155/2022/9731414?mailto=christian.hauschke@tib.eu,2022,article,True,69,Internet Users' Information Privacy Concerns,Social Sciences,Sociology and Political Science,Hindawi Publishing Corporation,True,en,Social Sciences,Retraction
https://openalex.org/W4283073165,Effects of Laparoscopic versus Open Surgery for Advanced Gastric Cancer after Neoadjuvant Chemotherapy: A Meta-Analysis,Journal of Healthcare Engineering,1,https://doi.org/10.1155/2022/3255403,https://api.labs.crossref.org/works/https://doi.org/10.1155/2022/3255403?mailto=christian.hauschke@tib.eu,2022,article,True,69,Gastric Cancer Research and Treatment,Health Sciences,Pulmonary and Respiratory Medicine,Hindawi Publishing Corporation,True,en,Medicine,Retraction
https://openalex.org/W4283074214,Study on AI Audit Mode in the Background of Machine Learning and Internet of Things,Security and Communication Networks,1,https://doi.org/10.1155/2022/5470669,https://api.labs.crossref.org/works/https://doi.org/10.1155/2022/5470669?mailto=christian.hauschke@tib.eu,2022,article,True,69,Impact of Big Data Analytics on Business Performance,Social Sciences,Management Information Systems,Hindawi Publishing Corporation,True,en,"Business, Management and Accounting",Retraction
https://openalex.org/W4283074799,Effects of Mind Mapping Combined with Microvideo Explanation on Disease Perception Control and Nursing Cooperation during Membrane Induction Therapy in Patients with Infectious Nonunion after Tibial Trauma,Emergency Medicine International,1,https://doi.org/10.1155/2022/4439595,https://api.labs.crossref.org/works/https://doi.org/10.1155/2022/4439595?mailto=christian.hauschke@tib.eu,2022,article,True,69,Epidemiology and Treatment of Bone Fractures,Health Sciences,Epidemiology,Hindawi Publishing Corporation,True,en,Medicine,Retraction
https://openalex.org/W4283117829,A Cluster Analysis Model for PhD Dissertation Quality Based on the Depth Algorithm,Security and Communication Networks,1,https://doi.org/10.1155/2022/9689903,https://api.labs.crossref.org/works/https://doi.org/10.1155/2022/9689903?mailto=christian.hauschke@tib.eu,2022,article,True,69,Knowledge Base Graph Embedding for Visual Question Answering,Physical Sciences,Artificial Intelligence,Hindawi Publishing Corporation,True,en,Computer Science,Retraction
https://openalex.org/W4283121049,Event Scene Method of Legal Domain Knowledge Map Based on Neural Network Hybrid Model,Applied Bionics and Biomechanics,1,https://doi.org/10.1155/2022/5880595,https://api.labs.crossref.org/works/https://doi.org/10.1155/2022/5880595?mailto=christian.hauschke@tib.eu,2022,article,True,69,Intelligent Manufacturing Technologies,Physical Sciences,Industrial and Manufacturing Engineering,Hindawi Publishing Corporation,True,en,Engineering,Retraction
https://openalex.org/W4283121418,Research on the Application of VR Technology in Oil and Gas Engineering Education: Taking the Well Control Emergency Rescue Robotic System as an Example,Mobile Information Systems,1,https://doi.org/10.1155/2022/8064131,https://api.labs.crossref.org/works/https://doi.org/10.1155/2022/8064131?mailto=christian.hauschke@tib.eu,2022,article,True,69,Cloud Robotics and Automation Research,Physical Sciences,Control and Systems Engineering,IOS Press,True,en,Engineering,Retraction
https://openalex.org/W4283123098,Optimization of Classroom Teaching Strategies for College English Listening and Speaking Based on Random Matrix Theory,Mathematical Problems in Engineering,1,https://doi.org/10.1155/2022/8563978,https://api.labs.crossref.org/works/https://doi.org/10.1155/2022/8563978?mailto=christian.hauschke@tib.eu,2022,article,True,69,Artificial Intelligence in Education and Technology,Physical Sciences,Artificial Intelligence,Hindawi Publishing Corporation,True,en,Computer Science,Retraction
https://openalex.org/W4283123661,"Investigation of the Disparities in Ultrasound Imaging Features of miR-323, miR-409-3p, and VEGF Expression Scales in Different Clinicopathological Features of Prostate Carcinoma and Their Correlation with Prognosis",BioMed Research International,1,https://doi.org/10.1155/2022/5053204,https://api.labs.crossref.org/works/https://doi.org/10.1155/2022/5053204?mailto=christian.hauschke@tib.eu,2022,article,True,69,Role of Long Noncoding RNAs in Cancer and Development,Life Sciences,Cancer Research,Hindawi Publishing Corporation,True,en,"Biochemistry, Genetics and Molecular Biology",Retraction
https://openalex.org/W4283163634,Posterior Lumbar Plexus Block Anesthesia for Elderly Patients with Lower Limb Fracture,Disease Markers,1,https://doi.org/10.1155/2022/8494796,https://api.labs.crossref.org/works/https://doi.org/10.1155/2022/8494796?mailto=christian.hauschke@tib.eu,2022,article,True,69,Management of Postoperative Pain and Complications,Health Sciences,Surgery,Hindawi Publishing Corporation,True,en,Medicine,Retraction
https://openalex.org/W4283210623,Analysis of Coagulation Abnormality in Patients with Multiple Myeloma and Its Clinical Significance,Evidence-based Complementary and Alternative Medicine,1,https://doi.org/10.1155/2022/5120967,https://api.labs.crossref.org/works/https://doi.org/10.1155/2022/5120967?mailto=christian.hauschke@tib.eu,2022,article,True,69,Diagnosis and Treatment of Multiple Myeloma,Health Sciences,Hematology,Hindawi Publishing Corporation,True,en,Medicine,Retraction
https://openalex.org/W4283211908,Ecological Efficiency Analysis of Ice and Snow Environmental Sports Industry Based on Input-Output Evaluation System,Mathematical Problems in Engineering,1,https://doi.org/10.1155/2022/5022761,https://api.labs.crossref.org/works/https://doi.org/10.1155/2022/5022761?mailto=christian.hauschke@tib.eu,2022,article,True,69,Injuries in Alpine Skiing and Snowboarding,Health Sciences,Pulmonary and Respiratory Medicine,Hindawi Publishing Corporation,True,en,Medicine,Retraction
https://openalex.org/W4283211984,Multimedia Technology Based on Cloud Computing in Aerobics Teaching,Mobile Information Systems,1,https://doi.org/10.1155/2022/4157042,https://api.labs.crossref.org/works/https://doi.org/10.1155/2022/4157042?mailto=christian.hauschke@tib.eu,2022,article,True,69,Physical Education and Sports Science Research,Health Sciences,"Physical Therapy, Sports Therapy and Rehabilitation",IOS Press,True,en,Health Professions,Retraction
https://openalex.org/W4283220178,The Combination Clinical Value of Plasma Brain Natriuretic Peptide and Serum HbAlc in the Diagnosis of Chronic Pulmonary Heart Disease,Computational and Mathematical Methods in Medicine,1,https://doi.org/10.1155/2022/6932179,https://api.labs.crossref.org/works/https://doi.org/10.1155/2022/6932179?mailto=christian.hauschke@tib.eu,2022,article,True,69,Machine Learning in Healthcare and Medicine,Health Sciences,Health Information Management,Hindawi Publishing Corporation,True,en,Health Professions,Retraction
https://openalex.org/W4283257647,Research on Sino Japanese Comparative Literature from the Perspective of Sustainable Ecological Environment,Journal of Environmental and Public Health,1,https://doi.org/10.1155/2022/5396135,https://api.labs.crossref.org/works/https://doi.org/10.1155/2022/5396135?mailto=christian.hauschke@tib.eu,2022,article,True,69,,,,Hindawi Publishing Corporation,True,en,,Retraction
https://openalex.org/W4283258650,Analysis of Obstetric Clinical Nursing Integrating Situational Teaching Simulation,Computational and Mathematical Methods in Medicine,1,https://doi.org/10.1155/2022/6843196,https://api.labs.crossref.org/works/https://doi.org/10.1155/2022/6843196?mailto=christian.hauschke@tib.eu,2022,article,True,69,Simulation-based Medical Education and Training Techniques,Health Sciences,Physiology,Hindawi Publishing Corporation,True,en,Medicine,Retraction
https://openalex.org/W4283262159,Clinical Efficacy and Safety of Tenofovir in the Treatment of Patients with Chronic Hepatitis B,Evidence-based Complementary and Alternative Medicine,1,https://doi.org/10.1155/2022/1673453,https://api.labs.crossref.org/works/https://doi.org/10.1155/2022/1673453?mailto=christian.hauschke@tib.eu,2022,article,True,69,Hepatitis B Infection and Treatment,Health Sciences,Epidemiology,Hindawi Publishing Corporation,True,en,Medicine,Retraction
https://openalex.org/W4283263864,Music Emotion Classification Method Based on Deep Learning and Explicit Sparse Attention Network,Computational Intelligence and Neuroscience,1,https://doi.org/10.1155/2022/3920663,https://api.labs.crossref.org/works/https://doi.org/10.1155/2022/3920663?mailto=christian.hauschke@tib.eu,2022,article,True,69,Audio Signal Classification and Analysis,Physical Sciences,Signal Processing,Hindawi Publishing Corporation,True,en,Computer Science,Retraction
https://openalex.org/W4283265124,Realization of a Noncontact IC Chip with Embedded Ferroelectric Memory in an Auxiliary Timing Device for Sports Games,Journal of Nanomaterials,1,https://doi.org/10.1155/2022/9933084,https://api.labs.crossref.org/works/https://doi.org/10.1155/2022/9933084?mailto=christian.hauschke@tib.eu,2022,article,True,69,Ferroelectric Devices for Low-Power Nanoscale Applications,Physical Sciences,Electrical and Electronic Engineering,Hindawi Publishing Corporation,True,en,Engineering,Retraction
https://openalex.org/W4283265477,Clinical Efficacy of Tuomin Zhiti Decoction in Allergic Rhinitis,Evidence-based Complementary and Alternative Medicine,1,https://doi.org/10.1155/2022/8616075,https://api.labs.crossref.org/works/https://doi.org/10.1155/2022/8616075?mailto=christian.hauschke@tib.eu,2022,article,True,69,Allergic Rhinitis and its Impact on Asthma,Health Sciences,Immunology and Allergy,Hindawi Publishing Corporation,True,en,Medicine,Retraction
https://openalex.org/W4283265592,Value of Intensive Nursing Detail Management in Intensive Care Unit Nursing,Evidence-based Complementary and Alternative Medicine,1,https://doi.org/10.1155/2022/9115639,https://api.labs.crossref.org/works/https://doi.org/10.1155/2022/9115639?mailto=christian.hauschke@tib.eu,2022,article,True,69,Family-Centered Care in Intensive Care Units,Health Sciences,Radiological and Ultrasound Technology,Hindawi Publishing Corporation,True,en,Health Professions,Retraction
https://openalex.org/W4283265895,Feature Extraction of Athlete’s Post-Match Psychological and Emotional Changes Based on Deep Learning,Computational Intelligence and Neuroscience,1,https://doi.org/10.1155/2022/2995205,https://api.labs.crossref.org/works/https://doi.org/10.1155/2022/2995205?mailto=christian.hauschke@tib.eu,2022,article,True,69,Integration of Traditional Medicine and Modern Science,Health Sciences,Complementary and alternative medicine,Hindawi Publishing Corporation,True,en,Medicine,Retraction
https://openalex.org/W4283267258,"Effectiveness of Multidisciplinary Nursing Based on Fever, Blood Sugar, and Swallowing Function Management in Patients with Acute Stroke",Evidence-based Complementary and Alternative Medicine,1,https://doi.org/10.1155/2022/5949760,https://api.labs.crossref.org/works/https://doi.org/10.1155/2022/5949760?mailto=christian.hauschke@tib.eu,2022,article,True,69,Chronic Cerebral Hypoperfusion-Related Neurodegenerative Diseases,Life Sciences,Neurology,Hindawi Publishing Corporation,True,en,Neuroscience,Retraction
https://openalex.org/W4283268667,A Study on Parents’ Attitudes towards Middle School Students’ Online Learning Based on Statistical Analysis,Journal of Environmental and Public Health,1,https://doi.org/10.1155/2022/4848738,https://api.labs.crossref.org/works/https://doi.org/10.1155/2022/4848738?mailto=christian.hauschke@tib.eu,2022,article,True,69,User Acceptance of Information Technology,Social Sciences,Information Systems and Management,Hindawi Publishing Corporation,True,en,Decision Sciences,Retraction
https://openalex.org/W4283268764,"Design and Research of College English Reading, Writing, and Translation Teaching Classroom Based on 5G Technology",Mobile Information Systems,1,https://doi.org/10.1155/2022/7342275,https://api.labs.crossref.org/works/https://doi.org/10.1155/2022/7342275?mailto=christian.hauschke@tib.eu,2022,article,True,69,Artificial Intelligence in Education and Technology,Physical Sciences,Artificial Intelligence,IOS Press,True,en,Computer Science,Retraction
https://openalex.org/W4283269621,"Effects of Enhanced Recovery Rehabilitation Surgery Concepts on the Surgical Process, Postoperative Pain, Complications, and Prognosis of Discectomy in Patients with Lumbar Disc Herniation: A Systematic Review and Meta-Analysis",Computational and Mathematical Methods in Medicine,1,https://doi.org/10.1155/2022/9736470,https://api.labs.crossref.org/works/https://doi.org/10.1155/2022/9736470?mailto=christian.hauschke@tib.eu,2022,article,True,69,Pathophysiology of Lumbar Disc Degeneration and Treatment,Health Sciences,Pathology and Forensic Medicine,Hindawi Publishing Corporation,True,en,Medicine,Retraction
https://openalex.org/W4283270446,Logistics Service Supply Chain Model Applying Artificial Intelligence and Big Data Analysis,Security and Communication Networks,1,https://doi.org/10.1155/2022/1575813,https://api.labs.crossref.org/works/https://doi.org/10.1155/2022/1575813?mailto=christian.hauschke@tib.eu,2022,article,True,69,Drivers and Impediments for Cross-Border E-Commerce,Social Sciences,Business and International Management,Hindawi Publishing Corporation,True,en,"Business, Management and Accounting",Retraction
https://openalex.org/W4283275490,Experimental Analysis of the Effect of Rehabilitation Intervention on Tennis Players by Joint Injury Treatment,BioMed Research International,1,https://doi.org/10.1155/2022/4625719,https://api.labs.crossref.org/works/https://doi.org/10.1155/2022/4625719?mailto=christian.hauschke@tib.eu,2022,article,True,69,Shoulder Pathology and Treatment Outcomes,Health Sciences,Surgery,Hindawi Publishing Corporation,True,en,Medicine,Retraction
