id,display_name,primary_location_display_name,cited_by_count,doi,crossref_call,publication_year,type,is_retracted,cited_by_percentile_year_min,primary_topic_display_name,primary_topic_domain_display_name,primary_topic_subfield_display_name,primary_location_source_host_organization_name,open_access_is_oa,language,primary_topic_field_display_name,update_nature
https://openalex.org/W2057810287,RETRACTED ARTICLE: Does Incisional Wound VAC after Major Hip Surgery in Obese Pediatric Patients Reduce Wound Infection and Scar Formation? A Pilot Study,Clinical Orthopaedics and Related Research,0,https://doi.org/10.1007/s11999-012-2677-9,https://api.labs.crossref.org/works/https://doi.org/10.1007/s11999-012-2677-9?mailto=christian.hauschke@tib.eu,2013,article,True,0,Femoroacetabular Impingement Syndrome and Hip Pathology,Health Sciences,Surgery,Lippincott Williams & Wilkins,True,en,Medicine,Retraction
https://openalex.org/W2058864179,The Relationship between the Internet and Replication with PIONY,Key Engineering Materials,0,https://doi.org/10.4028/www.scientific.net/kem.460-461.552,https://api.labs.crossref.org/works/https://doi.org/10.4028/www.scientific.net/kem.460-461.552?mailto=christian.hauschke@tib.eu,2011,article,True,0,Trust and Reputation Systems in Online Environments,Social Sciences,Sociology and Political Science,Trans Tech Publications,True,en,Social Sciences,Retraction
https://openalex.org/W2059028859,RETRACTED ARTICLE: Liquid filtration and particle concentration using a cross-flow filter for microfluidics applications,Microsystem Technologies,0,https://doi.org/10.1007/s00542-011-1255-5,https://api.labs.crossref.org/works/https://doi.org/10.1007/s00542-011-1255-5?mailto=christian.hauschke@tib.eu,2011,article,True,0,Microfluidic Techniques for Particle Manipulation and Separation,Physical Sciences,Biomedical Engineering,Springer Science+Business Media,True,en,Engineering,Retraction
https://openalex.org/W2059384724,"Conducting Polymer Matrix Poly(2,2′-bithiophene) Mercury Metal Incorporation",Analytical Letters,0,https://doi.org/10.1080/00032711003783143,https://api.labs.crossref.org/works/https://doi.org/10.1080/00032711003783143?mailto=christian.hauschke@tib.eu,2011,article,True,0,Memristive Devices for Neuromorphic Computing,Physical Sciences,Electrical and Electronic Engineering,Taylor & Francis,False,en,Engineering,Retraction
https://openalex.org/W2059583948,RETRACTED: Cardiac autonomie reaction to eccentric isokinetic strength training in healthy sexagenarian men,Journal of Men's Health,0,https://doi.org/10.1016/s1875-6867(11)60019-5,https://api.labs.crossref.org/works/https://doi.org/10.1016/s1875-6867(11)60019-5?mailto=christian.hauschke@tib.eu,2011,article,True,0,Analysis and Applications of Heart Rate Variability,Health Sciences,Cardiology and Cardiovascular Medicine,Codon Publications,True,en,Medicine,Retraction
https://openalex.org/W2060329576,TIC: A methodology for the construction of E-Commerce,,0,https://doi.org/10.1109/qr2mse.2013.6626010,https://api.labs.crossref.org/works/https://doi.org/10.1109/qr2mse.2013.6626010?mailto=christian.hauschke@tib.eu,2013,article,True,0,Scalable Peer-to-Peer Network Architectures,Physical Sciences,Computer Networks and Communications,,False,en,Computer Science,Retraction
https://openalex.org/W2061099018,"RETRACTED: Reply from Authors re: Declan G. Murphy, Anthony J. Costello. How Can the Autonomic Nervous System Contribute to Urinary Continence Following Radical Prostatectomy? A “Boson-like” Conundrum. Eur Urol 2013;63:445–7",European Urology,0,https://doi.org/10.1016/j.eururo.2012.09.021,https://api.labs.crossref.org/works/https://doi.org/10.1016/j.eururo.2012.09.021?mailto=christian.hauschke@tib.eu,2013,article,True,0,Prostate Cancer Research and Treatment,Health Sciences,Pulmonary and Respiratory Medicine,Elsevier BV,True,en,Medicine,Retraction
https://openalex.org/W2062248152,REMOVED: Points forts des communications scientifiques du congrès sur le psoriasis,Annales de Dermatologie et de Vénéréologie,0,https://doi.org/10.1016/s0151-9638(11)70055-2,https://api.labs.crossref.org/works/https://doi.org/10.1016/s0151-9638(11)70055-2?mailto=christian.hauschke@tib.eu,2011,article,True,0,Reciprocal Development of TH17 and Treg Cells,Life Sciences,Immunology,Elsevier BV,False,en,Immunology and Microbiology,Retraction
https://openalex.org/W2062352260,RETRACTED ARTICLE: Gender differences in the reading process of six-year-olds in Singapore,Early Child Development and Care,0,https://doi.org/10.1080/03004430.2013.788812,https://api.labs.crossref.org/works/https://doi.org/10.1080/03004430.2013.788812?mailto=christian.hauschke@tib.eu,2013,article,True,0,Impact and Implementation of Montessori Education,Social Sciences,Education,Taylor & Francis,False,en,Social Sciences,Retraction
https://openalex.org/W2062622381,RETRACTED: Evaluation of Product Wastage From Modern Human Growth Hormone Administration Devices,Journal of Pediatric Nursing,0,https://doi.org/10.1016/j.pedn.2013.02.017,https://api.labs.crossref.org/works/https://doi.org/10.1016/j.pedn.2013.02.017?mailto=christian.hauschke@tib.eu,2013,article,True,0,Endocrine Disruption by Chemical Exposure,Physical Sciences,"Health, Toxicology and Mutagenesis",Elsevier BV,False,en,Environmental Science,Retraction
https://openalex.org/W2063588659,RETRACTED: Early outcome of arthroscopic Bankart's repair for Recurrent traumatic anterior shoulder instability,Journal of Clinical Orthopaedics and Trauma,0,https://doi.org/10.1016/j.jcot.2013.05.001,https://api.labs.crossref.org/works/https://doi.org/10.1016/j.jcot.2013.05.001?mailto=christian.hauschke@tib.eu,2013,article,True,0,Shoulder Pathology and Treatment Outcomes,Health Sciences,Surgery,Elsevier BV,True,en,Medicine,Retraction;Crossmark Retraction
https://openalex.org/W2064030855,GMO debate: inconclusive,Frontiers in Genetics,0,https://doi.org/10.3389/fgene.2013.00123,https://api.labs.crossref.org/works/https://doi.org/10.3389/fgene.2013.00123?mailto=christian.hauschke@tib.eu,2013,article,True,0,Impact of Genetically Modified Crops in Agriculture,Life Sciences,Plant Science,Frontiers Media,True,en,Agricultural and Biological Sciences,Retraction
https://openalex.org/W2064462860,RETRACTED ARTICLE: Role of cucurbits in apical leaf curl disease of potato in Northern India,Archives of Phytopathology and Plant Protection,0,https://doi.org/10.1080/03235408.2012.752168,https://api.labs.crossref.org/works/https://doi.org/10.1080/03235408.2012.752168?mailto=christian.hauschke@tib.eu,2013,article,True,0,Viral RNA Silencing and Plant Immunity,Life Sciences,Plant Science,Taylor & Francis,True,en,Agricultural and Biological Sciences,
https://openalex.org/W2064904205,RETRACTED ARTICLE: A rare case of dichorionic diamniotic twins delivered after a single vitrified-warmed morula-stage embryo transfer during hormone replacement therapy,Reproductive Medicine and Biology,0,https://doi.org/10.1007/s12522-011-0074-9,https://api.labs.crossref.org/works/https://doi.org/10.1007/s12522-011-0074-9?mailto=christian.hauschke@tib.eu,2011,article,True,0,Impact of Assisted Reproductive Technology on Perinatal Outcomes,Health Sciences,"Pediatrics, Perinatology and Child Health",Wiley,True,en,Medicine,
https://openalex.org/W2066122775,RETRACTED: The effect of delexicalization of common verbs on the collocational competence of Iranian EFL students,Procedia - Social and Behavioral Sciences,0,https://doi.org/10.1016/j.sbspro.2011.04.398,https://api.labs.crossref.org/works/https://doi.org/10.1016/j.sbspro.2011.04.398?mailto=christian.hauschke@tib.eu,2011,article,True,0,Vocabulary Acquisition in Second Language Learning,Social Sciences,Developmental and Educational Psychology,Elsevier BV,True,en,Psychology,
https://openalex.org/W2067412052,"RETRACTED ARTICLE: Alternative pathways of erythrocyte invasion, parasite multiplication potential and severity of the clinical episode of P. falciparum malaria in the Peruvian Amazon",Parasitology Research,0,https://doi.org/10.1007/s00436-011-2663-2,https://api.labs.crossref.org/works/https://doi.org/10.1007/s00436-011-2663-2?mailto=christian.hauschke@tib.eu,2011,article,True,0,Malaria,Health Sciences,"Public Health, Environmental and Occupational Health",Springer Science+Business Media,True,en,Medicine,
https://openalex.org/W2067465304,RETRACTED: DOES INTRACORONARY ADENOSINE INJECTION DURING PRIMARY PCI REDUCE MICROVASCULAR OBSTRUCTION IN PATIENTS ADMITTED WITH STEMI?,Journal of the American College of Cardiology,0,https://doi.org/10.1016/s0735-1097(13)60135-7,https://api.labs.crossref.org/works/https://doi.org/10.1016/s0735-1097(13)60135-7?mailto=christian.hauschke@tib.eu,2013,article,True,0,Advanced Cardiac Imaging Techniques and Diagnostics,Health Sciences,"Radiology, Nuclear Medicine and Imaging",Elsevier BV,False,en,Medicine,
https://openalex.org/W2067648839,RETRACTED: Computational investigation of powder coating of nanoparticles in supersonic and hypersonic impactors,Particuology,0,https://doi.org/10.1016/j.partic.2012.05.011,https://api.labs.crossref.org/works/https://doi.org/10.1016/j.partic.2012.05.011?mailto=christian.hauschke@tib.eu,2013,article,True,0,Turbulent Interactions with Dispersed Particles and Droplets,Physical Sciences,Ocean Engineering,Elsevier BV,False,en,Engineering,
https://openalex.org/W2068120658,RETRACTED ARTICLE: Quasi-distributed fiber Bragg grating array sensor for furnace applications,Photonic Sensors,0,https://doi.org/10.1007/s13320-012-0046-7,https://api.labs.crossref.org/works/https://doi.org/10.1007/s13320-012-0046-7?mailto=christian.hauschke@tib.eu,2012,article,True,0,Fiber Optic Sensor Technology,Physical Sciences,Electrical and Electronic Engineering,Springer Nature,True,en,Engineering,
https://openalex.org/W2069729356,Retraction notice to “M-CSF deficiency leads to reduced metallothioneins I and II expression and increased tissue damage in the brain stem after 6-aminonicotinamide treatment” Exp Neurol 176 (2002) 308–321,Experimental Neurology,0,https://doi.org/10.1016/j.expneurol.2013.02.015,https://api.labs.crossref.org/works/https://doi.org/10.1016/j.expneurol.2013.02.015?mailto=christian.hauschke@tib.eu,2013,article,True,0,Copper and Zinc in Health and Disease,Health Sciences,Nutrition and Dietetics,Elsevier BV,True,en,Nursing,
https://openalex.org/W207253727,RETRACTED: Building on the Known: A QuintEssential Jitterbug,,0,,https://api.labs.crossref.org/works/null?mailto=christian.hauschke@tib.eu,2013,book-chapter,True,0,,,,,False,en,,
https://openalex.org/W2072719291,"REMOVED: Molecular mechanisms involved in resistance of CLL cells towards ABT-737, a specific BCL-2 inhibitor",Toxicology,0,https://doi.org/10.1016/j.tox.2011.09.020,https://api.labs.crossref.org/works/https://doi.org/10.1016/j.tox.2011.09.020?mailto=christian.hauschke@tib.eu,2011,article,True,0,Genomic Aberrations and Treatment of Chronic Lymphocytic Leukemia,Health Sciences,Genetics,Elsevier BV,False,en,Medicine,
https://openalex.org/W2072825798,RETRACTED: Effects of the pin off-set in friction stir welding for a new-type lap-butt joint of dissimilar Al alloys: a preliminary study,"Proceedings of the Institution of Mechanical Engineers, Part B: Journal of Engineering Manufacture",0,https://doi.org/10.1177/0954405411412866,https://api.labs.crossref.org/works/https://doi.org/10.1177/0954405411412866?mailto=christian.hauschke@tib.eu,2011,article,True,0,Advances in Friction Stir Welding and Processing,Physical Sciences,Mechanical Engineering,SAGE Publishing,True,en,Engineering,
https://openalex.org/W2073183164,RETRACTED ARTICLE: Application of nano-baskets in polymer inclusion membranes,Journal of Inclusion Phenomena and Macrocyclic Chemistry,0,https://doi.org/10.1007/s10847-013-0320-3,https://api.labs.crossref.org/works/https://doi.org/10.1007/s10847-013-0320-3?mailto=christian.hauschke@tib.eu,2013,article,True,0,Battery Recycling and Rare Earth Recovery,Physical Sciences,Mechanical Engineering,Springer Science+Business Media,True,en,Engineering,
https://openalex.org/W2073198256,WITHDRAWN: Facilitated Transport of Chromium through Polymer Inclusion Membranes bearing Calix[4]arene,Journal of Taibah University for Science,0,https://doi.org/10.1016/j.jtusci.2013.04.003,https://api.labs.crossref.org/works/https://doi.org/10.1016/j.jtusci.2013.04.003?mailto=christian.hauschke@tib.eu,2013,article,True,0,Battery Recycling and Rare Earth Recovery,Physical Sciences,Mechanical Engineering,Elsevier BV,True,en,Engineering,
https://openalex.org/W2073941654,RETRACTED ARTICLE: Total spectral assignments and 2D NMR study of PVAc-b-PMA and PVAc-b-PMMA block copolymers,Journal of Polymer Research,0,https://doi.org/10.1007/s10965-011-9598-2,https://api.labs.crossref.org/works/https://doi.org/10.1007/s10965-011-9598-2?mailto=christian.hauschke@tib.eu,2011,article,True,0,Self-Assembly of Block Copolymers in Nanotechnology,Physical Sciences,Materials Chemistry,Springer Science+Business Media,True,en,Materials Science,
https://openalex.org/W2074209641,A Novel Method for the Treatment of Wastewater Containing High Concentration of Copper and Arsenic,Advanced Materials Research,0,https://doi.org/10.4028/www.scientific.net/amr.396-398.631,https://api.labs.crossref.org/works/https://doi.org/10.4028/www.scientific.net/amr.396-398.631?mailto=christian.hauschke@tib.eu,2011,article,True,0,Arsenic Contamination in Natural Waters,Physical Sciences,Environmental Chemistry,Trans Tech Publications,True,en,Environmental Science,
https://openalex.org/W2074248725,Eosinophilic Enteritis with Eosinophilic Ascites without Eosinophilia,The Ewha medical journal,0,https://doi.org/10.12771/emj.2013.36.s.s14,https://api.labs.crossref.org/works/https://doi.org/10.12771/emj.2013.36.s.s14?mailto=christian.hauschke@tib.eu,2013,article,True,0,Diagnosis and Management of Eosinophilic Esophagitis,Health Sciences,Surgery,,True,en,Medicine,
https://openalex.org/W2074371025,RETRACTED ARTICLE: Reconstruction of acute closed traumatic extensor hallucis longus tendon rupture in adolescents with spastic cerebral palsy,Journal of Children's Orthopaedics,0,https://doi.org/10.1007/s11832-011-0325-7,https://api.labs.crossref.org/works/https://doi.org/10.1007/s11832-011-0325-7?mailto=christian.hauschke@tib.eu,2011,article,True,0,Treatment and Outcomes of Hand Injuries,Health Sciences,Surgery,SAGE Publishing,True,en,Medicine,
https://openalex.org/W2074651591,RETRACTED: Computer generated quadratic and higher order apertures and its application on numerical speckle images,Optics and Laser Technology,0,https://doi.org/10.1016/j.optlastec.2011.10.007,https://api.labs.crossref.org/works/https://doi.org/10.1016/j.optlastec.2011.10.007?mailto=christian.hauschke@tib.eu,2011,article,True,0,Digital Image Correlation Techniques,Physical Sciences,Computer Vision and Pattern Recognition,Elsevier BV,True,en,Computer Science,
https://openalex.org/W2074970828,Isolated eccentric lingual diphtheria: A relevance,Indian Journal of Pathology & Microbiology,0,https://doi.org/10.4103/0377-4929.125377,https://api.labs.crossref.org/works/https://doi.org/10.4103/0377-4929.125377?mailto=christian.hauschke@tib.eu,2013,article,True,0,Global Burden of Group A Streptococcal Diseases,Health Sciences,"Public Health, Environmental and Occupational Health",Medknow,True,it,Medicine,
https://openalex.org/W2075253801,RETRACTED ARTICLE: Quantum effects on translation and rotation of molecular chlorine in solid para-hydrogen,Molecular Physics,0,https://doi.org/10.1080/00268976.2013.868086,https://api.labs.crossref.org/works/https://doi.org/10.1080/00268976.2013.868086?mailto=christian.hauschke@tib.eu,2013,article,True,0,Quantum Effects in Helium Nanodroplets and Solids,Physical Sciences,"Atomic and Molecular Physics, and Optics",Taylor & Francis,True,en,Physics and Astronomy,
https://openalex.org/W2075430933,WITHDRAWN: Quercetin enhances the effect of hyperthermal intraperitoneal chemotherapy with cisplatin in mice,Mutation Research/Genetic Toxicology and Environmental Mutagenesis,0,https://doi.org/10.1016/j.mrgentox.2013.07.009,https://api.labs.crossref.org/works/https://doi.org/10.1016/j.mrgentox.2013.07.009?mailto=christian.hauschke@tib.eu,2013,article,True,0,Mechanisms and Renoprotective Strategies for Cisplatin Nephrotoxicity,Health Sciences,Pathology and Forensic Medicine,Elsevier BV,True,en,Medicine,
https://openalex.org/W2076775971,RETRACTED ARTICLE: Human recombinant α-crystallins: temperature dependence of diffusion coefficients,European Biophysics Journal,0,https://doi.org/10.1007/s00249-012-0882-9,https://api.labs.crossref.org/works/https://doi.org/10.1007/s00249-012-0882-9?mailto=christian.hauschke@tib.eu,2013,article,True,0,Structure and Function of Gap Junctions and Connexins,Life Sciences,Molecular Biology,Springer Science+Business Media,True,en,"Biochemistry, Genetics and Molecular Biology",
https://openalex.org/W2076867620,Notice of Retraction Analysis and design of the control strategy of double-roller rewinding,,0,https://doi.org/10.1109/peam.2011.6135062,https://api.labs.crossref.org/works/https://doi.org/10.1109/peam.2011.6135062?mailto=christian.hauschke@tib.eu,2011,article,True,0,Isogeometric Analysis in Computational Engineering,Physical Sciences,Computational Mechanics,,False,en,Engineering,
https://openalex.org/W2077435568,RETRACTED: Hemiarthroplasty for Proximal Humerus Fractures: Early and Late,Seminars in Arthroplasty: JSES,0,https://doi.org/10.1053/j.sart.2011.01.002,https://api.labs.crossref.org/works/https://doi.org/10.1053/j.sart.2011.01.002?mailto=christian.hauschke@tib.eu,2011,article,True,0,Shoulder Pathology and Treatment Outcomes,Health Sciences,Surgery,Elsevier BV,False,en,Medicine,
https://openalex.org/W2077569526,REMOVED: Non-catalytic mechanisms involved in glutathione S-transferase Pi mediated cytoprotection,Toxicology,0,https://doi.org/10.1016/j.tox.2011.09.052,https://api.labs.crossref.org/works/https://doi.org/10.1016/j.tox.2011.09.052?mailto=christian.hauschke@tib.eu,2011,article,True,0,Role of Glutathione in Oxidative Stress Response,Life Sciences,Molecular Biology,Elsevier BV,True,en,"Biochemistry, Genetics and Molecular Biology",
https://openalex.org/W2077813489,The “Right to Privacy” v. telecommunications interception and access: International regulations and implementation in the Arab Region,International Review of Law,0,https://doi.org/10.5339/irl.2013.10,https://api.labs.crossref.org/works/https://doi.org/10.5339/irl.2013.10?mailto=christian.hauschke@tib.eu,2013,article,True,0,Internet Users' Information Privacy Concerns,Social Sciences,Sociology and Political Science,HBKU Press,True,en,Social Sciences,
https://openalex.org/W2079173075,RETRACTED ARTICLE: An evidence-based review of the most current treatment options and trends for carpal tunnel syndrome (CTS),Rheumatology International,0,https://doi.org/10.1007/s00296-011-2202-6,https://api.labs.crossref.org/works/https://doi.org/10.1007/s00296-011-2202-6?mailto=christian.hauschke@tib.eu,2011,article,True,0,Diagnosis and Management of Carpal Tunnel Syndrome,Health Sciences,"Radiology, Nuclear Medicine and Imaging",Springer Science+Business Media,True,en,Medicine,
https://openalex.org/W2079452042,Exploring the value of installed base: Pricing information goods under value depreciation and consumer social learning,Journal of Systems Science and Systems Engineering,0,https://doi.org/10.1007/s11518-013-5224-7,https://api.labs.crossref.org/works/https://doi.org/10.1007/s11518-013-5224-7?mailto=christian.hauschke@tib.eu,2013,article,True,0,Competition in Two-Sided Markets,Social Sciences,Strategy and Management,Springer Science+Business Media,False,en,"Business, Management and Accounting",
https://openalex.org/W2079932159,RETRACTED: Quantum key distribution without sharing reference frame using single photon rotational-invariant subspace,Optics Communications,0,https://doi.org/10.1016/j.optcom.2013.07.046,https://api.labs.crossref.org/works/https://doi.org/10.1016/j.optcom.2013.07.046?mailto=christian.hauschke@tib.eu,2013,article,True,0,Quantum Information and Computation,Physical Sciences,Artificial Intelligence,Elsevier BV,False,en,Computer Science,
https://openalex.org/W2080416543,RETRACTED ARTICLE: Suspended animation: effects on short-term and long-term positive associative memory in Hypsibius dujardini,Invertebrate Neuroscience,0,https://doi.org/10.1007/s10158-013-0157-x,https://api.labs.crossref.org/works/https://doi.org/10.1007/s10158-013-0157-x?mailto=christian.hauschke@tib.eu,2013,article,True,0,Neuroscience and Genetics of Drosophila Melanogaster,Life Sciences,Cellular and Molecular Neuroscience,Springer Science+Business Media,True,en,Neuroscience,
https://openalex.org/W2080490465,RETRACTED ARTICLE: Managing and controlling HIV/AIDS talk among Ghanaians living with HIV/AIDS,Communicatio,0,https://doi.org/10.1080/02500167.2013.777352,https://api.labs.crossref.org/works/https://doi.org/10.1080/02500167.2013.777352?mailto=christian.hauschke@tib.eu,2013,article,True,0,Interactional Linguistic Analysis and Discourse Study,Social Sciences,Language and Linguistics,Routledge,False,en,Arts and Humanities,
https://openalex.org/W2080724847,RETRACTED: A 3’ UTR KRAS variant as a biomarker of poor outcome and chemotherapy resistance in ovarian cancer,Gynecologic Oncology,0,https://doi.org/10.1016/j.ygyno.2010.12.010,https://api.labs.crossref.org/works/https://doi.org/10.1016/j.ygyno.2010.12.010?mailto=christian.hauschke@tib.eu,2011,article,True,0,Genomic Studies and Treatment of Ovarian Carcinoma,Health Sciences,Reproductive Medicine,Elsevier BV,True,en,Medicine,
https://openalex.org/W2081134567,RETRACTED ARTICLE: Endocrine disruptors in dairy wastewater,Environmental Chemistry Letters,0,https://doi.org/10.1007/s10311-011-0319-1,https://api.labs.crossref.org/works/https://doi.org/10.1007/s10311-011-0319-1?mailto=christian.hauschke@tib.eu,2011,article,True,0,Endocrine Disruption by Chemical Exposure,Physical Sciences,"Health, Toxicology and Mutagenesis",Springer Science+Business Media,True,en,Environmental Science,
https://openalex.org/W2082096755,Retracted: Evaluation of a Modified QuEChERS Method for the Simultaneous Analysis of Zearalenone and its Metabolites α‐ and β‐Zearalenol in Medicinal Plants,Phytochemical Analysis,0,https://doi.org/10.1002/pca.1311,https://api.labs.crossref.org/works/https://doi.org/10.1002/pca.1311?mailto=christian.hauschke@tib.eu,2011,article,True,0,Mycotoxins and Their Impact,Life Sciences,Plant Science,Wiley,False,en,Agricultural and Biological Sciences,
https://openalex.org/W2082849727,Evaluation of the producer-consumer problem,,0,https://doi.org/10.1109/qr2mse.2013.6626013,https://api.labs.crossref.org/works/https://doi.org/10.1109/qr2mse.2013.6626013?mailto=christian.hauschke@tib.eu,2013,article,True,0,Text Compression and Indexing Algorithms,Physical Sciences,Artificial Intelligence,,False,en,Computer Science,
https://openalex.org/W2083224589,"<i>cyclo</i>-Tetrakis(μ<sub>2</sub>-3-sulfidopropyl-κ<sup>3</sup><i>C</i><sup>1</sup>,<i>S</i>:<i>S</i>)tetrakis[chloridocobalt(III)]",Acta Crystallographica Section E-structure Reports Online,0,https://doi.org/10.1107/s1600536811013067,https://api.labs.crossref.org/works/https://doi.org/10.1107/s1600536811013067?mailto=christian.hauschke@tib.eu,2011,article,True,0,Chemical Crystallography,Physical Sciences,Inorganic Chemistry,International Union of Crystallography,True,en,Chemistry,
https://openalex.org/W2084315627,"Hoop Conjecture, Minimal Length and Black Hole Formation in the Asymptotically Safe Scenario of Quantum Gravity",Journal of Physics: Conference Series,0,https://doi.org/10.1088/1742-6596/410/1/012135,https://api.labs.crossref.org/works/https://doi.org/10.1088/1742-6596/410/1/012135?mailto=christian.hauschke@tib.eu,2013,article,True,0,Quantum Gravity and Noncommutative Field Theories,Physical Sciences,Statistical and Nonlinear Physics,IOP Publishing,True,en,Physics and Astronomy,
https://openalex.org/W2084470927,Synthesizing the Partition Table Using Low-Energy Models,Advanced Materials Research,0,https://doi.org/10.4028/www.scientific.net/amr.753-755.3093,https://api.labs.crossref.org/works/https://doi.org/10.4028/www.scientific.net/amr.753-755.3093?mailto=christian.hauschke@tib.eu,2013,article,True,0,Distributed Storage Systems and Network Coding,Physical Sciences,Computer Networks and Communications,Trans Tech Publications,True,en,Computer Science,
