id,display_name,primary_location_display_name,cited_by_count,doi,crossref_call,publication_year,type,is_retracted,cited_by_percentile_year_min,primary_topic_display_name,primary_topic_domain_display_name,primary_topic_subfield_display_name,primary_location_source_host_organization_name,open_access_is_oa,language,primary_topic_field_display_name,update_nature
https://openalex.org/W2065636225,RETRACTED ARTICLE: Does laparoscopic ovarian diathermy change clomiphene-resistant PCOS into clomiphene-sensitive?,Archives of Gynecology and Obstetrics,12,https://doi.org/10.1007/s00404-011-1931-9,https://api.labs.crossref.org/works/https://doi.org/10.1007/s00404-011-1931-9?mailto=christian.hauschke@tib.eu,2011,article,True,88,Diagnosis and Management of Polycystic Ovary Syndrome,Health Sciences,Reproductive Medicine,Springer Science+Business Media,False,en,Medicine,Retraction
https://openalex.org/W2073396290,Late Complications of Clinical Clostridium Histolyticum Collagenase Use in Dupuytren's Disease,PLOS ONE,12,https://doi.org/10.1371/journal.pone.0043406,https://api.labs.crossref.org/works/https://doi.org/10.1371/journal.pone.0043406?mailto=christian.hauschke@tib.eu,2012,article,True,88,Treatment and Pathogenesis of Dupuytren's Disease,Health Sciences,Rheumatology,Public Library of Science,True,en,Medicine,Retraction
https://openalex.org/W2075462675,RETRACTED: Hepatoprotective effects on alcoholic liver disease of fermented silkworms with<i>Bacillus</i><i>subtilis</i>and<i>Aspergillus kawachii</i>,International Journal of Food Sciences and Nutrition,12,https://doi.org/10.3109/09637486.2011.607801,https://api.labs.crossref.org/works/https://doi.org/10.3109/09637486.2011.607801?mailto=christian.hauschke@tib.eu,2011,article,True,88,Potential of Edible Insects as Food and Feed,Life Sciences,Insect Science,Taylor & Francis,False,en,Agricultural and Biological Sciences,Retraction
https://openalex.org/W2077619212,RETRACTED: Effect of laser remelting on the mechanical behaviour of Inconel 625 cold-sprayed coatings,Procedia Engineering,12,https://doi.org/10.1016/j.proeng.2011.06.002,https://api.labs.crossref.org/works/https://doi.org/10.1016/j.proeng.2011.06.002?mailto=christian.hauschke@tib.eu,2011,article,True,88,Thermal Barrier Coatings for Gas Turbines,Physical Sciences,Aerospace Engineering,Elsevier BV,True,en,Engineering,Retraction
https://openalex.org/W2080360241,Immunopathology and Immunogenetics of Allergic Bronchopulmonary Aspergillosis,Journal of Allergy,12,https://doi.org/10.1155/2011/785983,https://api.labs.crossref.org/works/https://doi.org/10.1155/2011/785983?mailto=christian.hauschke@tib.eu,2011,article,True,88,Diagnosis and Management of Fungal Infections,Health Sciences,Infectious Diseases,Hindawi Publishing Corporation,True,en,Medicine,Retraction
https://openalex.org/W2082099219,RETRACTED: Usefulness of Monitoring Platelet Function by Multiple Electrode Aggregometry in Primary Coronary Artery Bypass Surgery,Journal of Cardiothoracic and Vascular Anesthesia,12,https://doi.org/10.1053/j.jvca.2010.02.008,https://api.labs.crossref.org/works/https://doi.org/10.1053/j.jvca.2010.02.008?mailto=christian.hauschke@tib.eu,2011,article,True,88,Antiplatelet Therapy in Cardiovascular Disease,Health Sciences,Cardiology and Cardiovascular Medicine,Elsevier BV,True,en,Medicine,Retraction;Crossmark Retraction
https://openalex.org/W2085005524,Corrosion Inhibition of Tubing Steel during Acidization of Oil and Gas Wells,Journal of Petroleum Engineering,12,https://doi.org/10.1155/2013/354630,https://api.labs.crossref.org/works/https://doi.org/10.1155/2013/354630?mailto=christian.hauschke@tib.eu,2013,article,True,88,Corrosion Inhibitors and Protection Mechanisms,Physical Sciences,Materials Chemistry,Hindawi Publishing Corporation,True,en,Materials Science,Retraction
https://openalex.org/W2085971220,General anesthesia versus segmental thoracic or conventional lumbar spinal anesthesia for patients undergoing laparoscopic cholecystectomy,Anesthesia: Essays and Researches,12,https://doi.org/10.4103/0259-1162.108302,https://api.labs.crossref.org/works/https://doi.org/10.4103/0259-1162.108302?mailto=christian.hauschke@tib.eu,2012,article,True,88,Management of Postoperative Pain and Complications,Health Sciences,Surgery,Medknow,True,en,Medicine,Retraction
https://openalex.org/W2095153176,In vitro osteoinduction of human mesenchymal stem cells in biomimetic surface modified titanium alloy implants,Dental Materials Journal,12,https://doi.org/10.4012/dmj.2012-015,https://api.labs.crossref.org/works/https://doi.org/10.4012/dmj.2012-015?mailto=christian.hauschke@tib.eu,2012,article,True,88,Bone Tissue Engineering and Biomaterials,Physical Sciences,Biomedical Engineering,Japanese Society for Dental Materials and Devices,True,en,Engineering,Retraction
https://openalex.org/W2103075417,Acidotoxicity and acid-sensing ion channels contribute to motoneuron degeneration,Cell Death & Differentiation,12,https://doi.org/10.1038/cdd.2012.158,https://api.labs.crossref.org/works/https://doi.org/10.1038/cdd.2012.158?mailto=christian.hauschke@tib.eu,2013,article,True,88,Amyotrophic Lateral Sclerosis and Frontotemporal Dementia,Health Sciences,Neurology,Springer Nature,True,en,Medicine,Retraction
https://openalex.org/W2104424042,Mechanism of MTA1 Protein Overexpression-linked Invasion,Journal of Biological Chemistry,12,https://doi.org/10.1074/jbc.m111.324632,https://api.labs.crossref.org/works/https://doi.org/10.1074/jbc.m111.324632?mailto=christian.hauschke@tib.eu,2012,article,True,88,Role of Chemokine Receptors in Cancer Metastasis,Health Sciences,Oncology,Elsevier BV,True,en,Medicine,Retraction
https://openalex.org/W2109815032,Notice of Retraction: Three-Player Entangled XOR Games Are NP-Hard to Approximate,,12,https://doi.org/10.1109/focs.2013.87,https://api.labs.crossref.org/works/https://doi.org/10.1109/focs.2013.87?mailto=christian.hauschke@tib.eu,2013,article,True,88,Game Artificial Intelligence Research,Physical Sciences,Artificial Intelligence,,True,en,Computer Science,Retraction
https://openalex.org/W2110582958,Assessment of vascular phenotype using a novel very high resolution ultrasound technique in adolescents after aortic coarctation repair and/or stent implantation: relationship to central haemodynamics and left ventricular mass,Heart,12,https://doi.org/10.1136/heartjnl-2011-300740,https://api.labs.crossref.org/works/https://doi.org/10.1136/heartjnl-2011-300740?mailto=christian.hauschke@tib.eu,2011,article,True,88,Epidemiology and Management of Congenital Heart Disease,Health Sciences,Epidemiology,BMJ,False,en,Medicine,Retraction
https://openalex.org/W2114754190,AKAP13 Rho-GEF and PKD-Binding Domain Deficient Mice Develop Normally but Have an Abnormal Response to β-Adrenergic-Induced Cardiac Hypertrophy,PLOS ONE,12,https://doi.org/10.1371/journal.pone.0062705,https://api.labs.crossref.org/works/https://doi.org/10.1371/journal.pone.0062705?mailto=christian.hauschke@tib.eu,2013,article,True,88,Structure and Function of G Protein-Coupled Receptors,Life Sciences,Molecular Biology,Public Library of Science,True,en,"Biochemistry, Genetics and Molecular Biology",
https://openalex.org/W2116754987,The Dark Side of Online Knowledge Sharing (Retracted),Journal of Information Systems,12,https://doi.org/10.2308/isys-50244,https://api.labs.crossref.org/works/https://doi.org/10.2308/isys-50244?mailto=christian.hauschke@tib.eu,2012,article,True,88,Knowledge Sharing in Virtual Communities,Social Sciences,Communication,American Accounting Association,True,en,Social Sciences,Retraction
https://openalex.org/W2121596961,"RETRACTED ARTICLE: Comparative value of clinical, cytological, and histopathological features in feline mammary gland tumors; an experimental model for the study of human breast cancer",Diagnostic Pathology,12,https://doi.org/10.1186/1746-1596-8-136,https://api.labs.crossref.org/works/https://doi.org/10.1186/1746-1596-8-136?mailto=christian.hauschke@tib.eu,2013,article,True,88,Translation of Canine Cancer Research to Humans,Health Sciences,Pulmonary and Respiratory Medicine,BioMed Central,True,en,Medicine,Retraction
https://openalex.org/W2132593095,Toxoplasmosis - An update,Tropical parasitology,12,https://doi.org/10.4103/2229-5070.72109,https://api.labs.crossref.org/works/https://doi.org/10.4103/2229-5070.72109?mailto=christian.hauschke@tib.eu,2011,article,True,88,Toxoplasmosis and Neosporosis Research,Life Sciences,Parasitology,Medknow,True,en,Immunology and Microbiology,Retraction
https://openalex.org/W2144095844,Eya1 protein phosphatase regulates tight junction formation in lung distal epithelium,Journal of Cell Science,12,https://doi.org/10.1242/jcs.102848,https://api.labs.crossref.org/works/https://doi.org/10.1242/jcs.102848?mailto=christian.hauschke@tib.eu,2012,article,True,88,Blood-Brain Barrier and Neurovascular Interactions,Life Sciences,Neurology,The Company of Biologists,True,en,Neuroscience,Retraction
https://openalex.org/W2144789312,Effects of coenzyme Q10 and ^|^alpha;-lipoic acid supplementation in fructose fed rats,Journal of Clinical Biochemistry and Nutrition,12,https://doi.org/10.3164/jcbn.11-47,https://api.labs.crossref.org/works/https://doi.org/10.3164/jcbn.11-47?mailto=christian.hauschke@tib.eu,2012,article,True,88,Role of Lipoic Acid in Metabolism and Health,Life Sciences,Biochemistry,Society for Free Radical Research Japan,True,en,"Biochemistry, Genetics and Molecular Biology",Retraction
https://openalex.org/W2153369635,"<i>Retracted:</i> α,β‐Unsaturated aldehyde pollutant acrolein suppresses cardiomyocyte contractile function: Role of TRPV1 and oxidative stress",Environmental Toxicology,12,https://doi.org/10.1002/tox.21941,https://api.labs.crossref.org/works/https://doi.org/10.1002/tox.21941?mailto=christian.hauschke@tib.eu,2013,article,True,88,Health Effects of Air Pollution,Physical Sciences,"Health, Toxicology and Mutagenesis",Wiley,False,en,Environmental Science,Correction;Retraction
https://openalex.org/W2153826721,Dexmedetomidine as anesthetic adjunct for fast tracking and pain control in off-pump coronary artery bypass,Saudi Journal of Anaesthesia,12,https://doi.org/10.4103/1658-354x.109557,https://api.labs.crossref.org/works/https://doi.org/10.4103/1658-354x.109557?mailto=christian.hauschke@tib.eu,2013,article,True,88,Anesthesia and Sedation Management,Health Sciences,Anesthesiology and Pain Medicine,Medknow,True,en,Medicine,Retraction
https://openalex.org/W2155550569,Retracted: Ergonomic Techniques for a Mobile E-Invoice System: Operational Requirements of an Information Management System,Human Factors and Ergonomics in Manufacturing & Service Industries,12,https://doi.org/10.1002/hfm.20340,https://api.labs.crossref.org/works/https://doi.org/10.1002/hfm.20340?mailto=christian.hauschke@tib.eu,2012,article,True,88,Ergonomics and Sustainability in Human-Compatible Systems,Physical Sciences,Biomedical Engineering,Wiley-Blackwell,False,en,Engineering,Retraction
https://openalex.org/W2157964429,Retracted: MyoD-dependent regulation of NF-κB activity couples cell-cycle withdrawal to myogenic differentiation,Skeletal Muscle,12,https://doi.org/10.1186/2044-5040-2-6,https://api.labs.crossref.org/works/https://doi.org/10.1186/2044-5040-2-6?mailto=christian.hauschke@tib.eu,2012,article,True,88,Role of Long Noncoding RNAs in Cancer and Development,Life Sciences,Cancer Research,BioMed Central,True,en,"Biochemistry, Genetics and Molecular Biology",Retraction
https://openalex.org/W2158398890,Association of Three Bacterial Species and Periodontal Status in Chinese Adults: an Epidemiological Approach,Journal of Clinical Microbiology,12,https://doi.org/10.1128/jcm.01819-10,https://api.labs.crossref.org/works/https://doi.org/10.1128/jcm.01819-10?mailto=christian.hauschke@tib.eu,2011,article,True,88,Periodontal Diseases and Oral Microbiome,Health Sciences,Periodontics,American Society for Microbiology,True,en,Dentistry,Retraction
https://openalex.org/W2161265236,Synthesis and Electrochemical Properties of Y-Doped LiNi<sub>1/3</sub>Mn<sub>1/3</sub>Co<sub>1/3</sub>O<sub>2</sub> Cathode Materials for Li-Ion Battery,Integrated Ferroelectrics,12,https://doi.org/10.1080/10584587.2011.575736,https://api.labs.crossref.org/works/https://doi.org/10.1080/10584587.2011.575736?mailto=christian.hauschke@tib.eu,2011,article,True,88,Lithium-ion Battery Technology,Physical Sciences,Electrical and Electronic Engineering,Taylor & Francis,False,en,Engineering,Retraction
https://openalex.org/W2169030339,"RETRACTION: Immunohistochemical and Functional Characterization of Peptide, Organic Cation, Neutral and Basic Amino Acid, and Monocarboxylate Drug Transporters in Human Ocular Tissues",Drug Metabolism and Disposition,12,https://doi.org/10.1124/dmd.112.045674,https://api.labs.crossref.org/works/https://doi.org/10.1124/dmd.112.045674?mailto=christian.hauschke@tib.eu,2012,article,True,88,Mechanisms of Multidrug Resistance in Cancer,Health Sciences,Oncology,American Society for Pharmacology and Experimental Therapeutics,True,en,Medicine,Retraction
https://openalex.org/W2169314880,"RETRACTED: Where, when, how high, and how long? The hemodynamics of emotional response in psychotropic-naïve patients with adolescent bipolar disorder.",Journal of Affective Disorders,12,https://doi.org/10.1016/j.jad.2012.11.025,https://api.labs.crossref.org/works/https://doi.org/10.1016/j.jad.2012.11.025?mailto=christian.hauschke@tib.eu,2013,article,True,88,Epidemiology and Management of Bipolar Disorder,Health Sciences,Psychiatry and Mental health,Elsevier BV,True,en,Medicine,Retraction;Crossmark Retraction
https://openalex.org/W2329532751,"Facile Synthesis of Symmetric, Monofunctional Cyanine Dyes for Imaging Applications",Bioconjugate Chemistry,12,https://doi.org/10.1021/bc2001006,https://api.labs.crossref.org/works/https://doi.org/10.1021/bc2001006?mailto=christian.hauschke@tib.eu,2011,article,True,88,Photodynamic Therapy in Oncology and Microbiology,Health Sciences,Pulmonary and Respiratory Medicine,American Chemical Society,False,en,Medicine,Retraction
https://openalex.org/W2334391116,Notice of Violation of IEEE Publication Principles: Modified Integer Factorization Algorithm Using V-Factor Method,,12,https://doi.org/10.1109/acct.2012.73,https://api.labs.crossref.org/works/https://doi.org/10.1109/acct.2012.73?mailto=christian.hauschke@tib.eu,2012,article,True,88,Cryptography and Error-Correcting Codes,Physical Sciences,Artificial Intelligence,,False,en,Computer Science,Retraction
https://openalex.org/W2593358005,RETRACTED ARTICLE: Impact of Different Treatment of Whole-Body Cryotherapy on Circulatory Parameters,Archivum Immunologiae et Therapiae Experimentalis,12,https://doi.org/10.1007/s00005-012-0163-4,https://api.labs.crossref.org/works/https://doi.org/10.1007/s00005-012-0163-4?mailto=christian.hauschke@tib.eu,2012,article,True,88,The Role of Exercise in Inflammation and Oxidative Stress,Health Sciences,Rehabilitation,Springer Science+Business Media,False,en,Medicine,Retraction;Crossmark Retraction
https://openalex.org/W2614427376,RETRACTED ARTICLE: Electrical Transmission between Mammalian Neurons is Supported by a Small Fraction of Gap Junction Channels,The Journal of Membrane Biology,12,https://doi.org/10.1007/s00232-012-9449-z,https://api.labs.crossref.org/works/https://doi.org/10.1007/s00232-012-9449-z?mailto=christian.hauschke@tib.eu,2012,article,True,88,Structure and Function of Gap Junctions and Connexins,Life Sciences,Molecular Biology,Springer Science+Business Media,False,en,"Biochemistry, Genetics and Molecular Biology",Retraction;Crossmark Retraction
https://openalex.org/W3124536928,"A Schumpeterian Model of Entrepreneurship, Innovation, and Regional Economic Growth",International Regional Science Review,12,https://doi.org/10.1177/0160017611429701,https://api.labs.crossref.org/works/https://doi.org/10.1177/0160017611429701?mailto=christian.hauschke@tib.eu,2012,article,True,88,Institutions and Economic Growth: Empirical Investigations and Theories,Social Sciences,Economics and Econometrics,SAGE Publishing,True,en,"Economics, Econometrics and Finance",Retraction
https://openalex.org/W1116071512,RETRACTED ARTICLE: Offline scripting-free author identification based on speeded-up robust features,International Journal on Document Analysis and Recognition (IJDAR),11,https://doi.org/10.1007/s10032-015-0252-0,https://api.labs.crossref.org/works/https://doi.org/10.1007/s10032-015-0252-0?mailto=christian.hauschke@tib.eu,2015,article,True,88,Handwriting Recognition and Text Detection,Physical Sciences,Computer Vision and Pattern Recognition,Springer Science+Business Media,False,en,Computer Science,Retraction;Crossmark Retraction
https://openalex.org/W1139081565,The financial crisis research: a bibliometric analysis,Scientometrics,11,https://doi.org/10.1007/s11192-015-1698-z,https://api.labs.crossref.org/works/https://doi.org/10.1007/s11192-015-1698-z?mailto=christian.hauschke@tib.eu,2015,article,True,88,Determinants of Credit Risk in Financial Markets,Social Sciences,Finance,Springer Nature (Netherlands),False,en,"Economics, Econometrics and Finance",Retraction
https://openalex.org/W1439830549,RETRACTED ARTICLE: Downregulation of miR-148b as biomarker for early detection of hepatocellular carcinoma and may serve as a prognostic marker,Tumor Biology,11,https://doi.org/10.1007/s13277-015-3777-4,https://api.labs.crossref.org/works/https://doi.org/10.1007/s13277-015-3777-4?mailto=christian.hauschke@tib.eu,2015,article,True,88,Role of Long Noncoding RNAs in Cancer and Development,Life Sciences,Cancer Research,SAGE Publishing,False,en,"Biochemistry, Genetics and Molecular Biology",Retraction;Crossmark Retraction
https://openalex.org/W1490277332,Cardiac Arrest following a Myocardial Infarction in a Child Treated with Methylphenidate,Case reports in pediatrics,11,https://doi.org/10.1155/2015/905097,https://api.labs.crossref.org/works/https://doi.org/10.1155/2015/905097?mailto=christian.hauschke@tib.eu,2015,article,True,88,Attention-Deficit/Hyperactivity Disorder,Health Sciences,Psychiatry and Mental health,Hindawi Publishing Corporation,True,en,Medicine,Retraction
https://openalex.org/W1524178286,Silymarin Accelerates Liver Regeneration after Partial Hepatectomy,Evidence-based Complementary and Alternative Medicine,11,https://doi.org/10.1155/2015/603529,https://api.labs.crossref.org/works/https://doi.org/10.1155/2015/603529?mailto=christian.hauschke@tib.eu,2015,article,True,88,Silymarin in Liver Diseases and Cancer Treatment,Health Sciences,Pulmonary and Respiratory Medicine,Hindawi Publishing Corporation,True,en,Medicine,Retraction
https://openalex.org/W1581043944,RETRACTION: Inhibition of protein phosphatase 5 (PP5) suppresses survival and growth of colorectal cancer cells,Biotechnology and Applied Biochemistry,11,https://doi.org/10.1002/bab.1308,https://api.labs.crossref.org/works/https://doi.org/10.1002/bab.1308?mailto=christian.hauschke@tib.eu,2015,article,True,88,ATP Synthase Function and Regulation,Life Sciences,Molecular Biology,Wiley-Blackwell,False,en,"Biochemistry, Genetics and Molecular Biology",Retraction
https://openalex.org/W1604357231,Notice of Retraction: Literature review on consumer adoption behavior of mobile commerce services,,11,https://doi.org/10.1109/icebeg.2011.5887118,https://api.labs.crossref.org/works/https://doi.org/10.1109/icebeg.2011.5887118?mailto=christian.hauschke@tib.eu,2011,article,True,88,User Acceptance of Information Technology,Social Sciences,Information Systems and Management,,False,en,Decision Sciences,Retraction
https://openalex.org/W1808272432,<i>Retracted</i>: Does natural variation in diversity affect biotic resistance?,Journal of Ecology,11,https://doi.org/10.1111/1365-2745.12439,https://api.labs.crossref.org/works/https://doi.org/10.1111/1365-2745.12439?mailto=christian.hauschke@tib.eu,2015,article,True,88,Biodiversity Conservation and Ecosystem Management,Physical Sciences,Nature and Landscape Conservation,Wiley-Blackwell,True,en,Environmental Science,Retraction
https://openalex.org/W1819300508,One-pot odourless synthesis of thioesters via in situ generation of thiobenzoic acids using benzoic anhydrides and thiourea,Beilstein Journal of Organic Chemistry,11,https://doi.org/10.3762/bjoc.11.141,https://api.labs.crossref.org/works/https://doi.org/10.3762/bjoc.11.141?mailto=christian.hauschke@tib.eu,2015,article,True,88,Transition-Metal-Catalyzed Sulfur Chemistry,Physical Sciences,Organic Chemistry,Beilstein Institute for the Advancement of Chemical Sciences,True,en,Chemistry,Retraction
https://openalex.org/W1833179195,Association between polymorphisms in the XRCC1 gene and the risk of non-small cell lung cancer,Genetics and Molecular Research,11,https://doi.org/10.4238/2015.october.21.9,https://api.labs.crossref.org/works/https://doi.org/10.4238/2015.october.21.9?mailto=christian.hauschke@tib.eu,2015,article,True,88,Molecular Mechanisms of DNA Damage Response,Life Sciences,Molecular Biology,Research Foundation of Ribeirão Preto,False,en,"Biochemistry, Genetics and Molecular Biology",Retraction
https://openalex.org/W1835679427,[ARTIGO RETRATADO] Abordagem sobre os diferentes processos de secagem empregados na obtenção de extratos secos de plantas medicinais,Revista brasileira de plantas medicinais,11,https://doi.org/10.1590/s1516-05722012000100015,https://api.labs.crossref.org/works/https://doi.org/10.1590/s1516-05722012000100015?mailto=christian.hauschke@tib.eu,2012,article,True,88,Utilization of Forest Biomass for Various Applications,Life Sciences,Forestry,São Paulo State University,True,pt,Agricultural and Biological Sciences,Retraction
https://openalex.org/W1900067519,Cadmium Telluride Nanostructure Deposition by RF Magnetron Sputtering on Flexible Cu Foils,Journal of Inorganic and Organometallic Polymers and Materials,11,https://doi.org/10.1007/s10904-015-0299-x,https://api.labs.crossref.org/works/https://doi.org/10.1007/s10904-015-0299-x?mailto=christian.hauschke@tib.eu,2015,article,True,88,Applications of Quantum Dots in Nanotechnology,Physical Sciences,Materials Chemistry,Springer Science+Business Media,False,en,Materials Science,Retraction
https://openalex.org/W1940427035,Motor organization of positive and negative emotional vocalization in the cat midbrain periaqueductal gray,The Journal of Comparative Neurology,11,https://doi.org/10.1002/cne.23869,https://api.labs.crossref.org/works/https://doi.org/10.1002/cne.23869?mailto=christian.hauschke@tib.eu,2015,article,True,88,Infant Crying and Colic Studies,Health Sciences,Pharmacy,Wiley,False,en,Health Professions,Retraction
https://openalex.org/W1945808363,"<i>Retracted</i>: 1,3,5‐<scp>T</scp>rihydroxy‐13,13‐dimethyl‐2<scp>H</scp>‐pyran [7,6‐b] xanthone directly targets heat shock protein 27 in hepatocellular carcinoma",Cell Biology International,11,https://doi.org/10.1002/cbin.10193,https://api.labs.crossref.org/works/https://doi.org/10.1002/cbin.10193?mailto=christian.hauschke@tib.eu,2013,article,True,88,Molecular Chaperones in Protein Folding and Disease,Life Sciences,Molecular Biology,Wiley-Blackwell,False,en,"Biochemistry, Genetics and Molecular Biology",Retraction
https://openalex.org/W1955722971,Oral administration of encapsulated bovine lactoferrin protein nanocapsules against intracellular parasite Toxoplasma gondii,International Journal of Nanomedicine,11,https://doi.org/10.2147/ijn.s85286,https://api.labs.crossref.org/works/https://doi.org/10.2147/ijn.s85286?mailto=christian.hauschke@tib.eu,2015,article,True,88,Toxoplasmosis and Neosporosis Research,Life Sciences,Parasitology,Dove Medical Press,True,en,Immunology and Microbiology,Correction
https://openalex.org/W1964645510,RETRACTED: Probiotics intake and metabolic syndrome: A proposal,Trends in Food Science and Technology,11,https://doi.org/10.1016/j.tifs.2011.05.006,https://api.labs.crossref.org/works/https://doi.org/10.1016/j.tifs.2011.05.006?mailto=christian.hauschke@tib.eu,2011,article,True,88,Role of Fructans in Nutrition and Health,Health Sciences,Nutrition and Dietetics,Elsevier BV,False,en,Nursing,Retraction
https://openalex.org/W1964662391,MNK1-Induced eIF-4E Phosphorylation in Myeloma Cells: A Pathway Mediating IL-6-Induced Expansion and Expression of Genes Involved in Metabolic and Proteotoxic Responses,PLOS ONE,11,https://doi.org/10.1371/journal.pone.0094011,https://api.labs.crossref.org/works/https://doi.org/10.1371/journal.pone.0094011?mailto=christian.hauschke@tib.eu,2014,article,True,88,mTOR Signaling in Growth and Disease,Life Sciences,Molecular Biology,Public Library of Science,True,en,"Biochemistry, Genetics and Molecular Biology",
https://openalex.org/W1970081501,Proteasome inhibitor sensitizes oral squamous cell carcinoma cells to TRAIL-mediated apoptosis,Oncology Reports,11,https://doi.org/10.3892/or.2010.1127,https://api.labs.crossref.org/works/https://doi.org/10.3892/or.2010.1127?mailto=christian.hauschke@tib.eu,2011,article,True,88,Molecular Mechanisms of Apoptosis and Cell Death,Life Sciences,Molecular Biology,Elsevier BV,True,en,"Biochemistry, Genetics and Molecular Biology",Retraction
https://openalex.org/W1971564910,RETRACTED ARTICLE: Narrow- versus mini-implants at crestal and subcrestal bone levels. Experimental study in beagle dogs at three months,Clinical Oral Investigations,11,https://doi.org/10.1007/s00784-014-1381-4,https://api.labs.crossref.org/works/https://doi.org/10.1007/s00784-014-1381-4?mailto=christian.hauschke@tib.eu,2014,article,True,88,Dental Implantology and Peri-implant Diseases,Health Sciences,Oral Surgery,Springer Nature,False,en,Dentistry,Retraction
