id,display_name,primary_location_display_name,cited_by_count,doi,crossref_call,publication_year,type,is_retracted,cited_by_percentile_year_min,primary_topic_display_name,primary_topic_domain_display_name,primary_topic_subfield_display_name,primary_location_source_host_organization_name,open_access_is_oa,language,primary_topic_field_display_name,update_nature
https://openalex.org/W3037470316,WITHDRAWN: Analysis of Infection Factors after Radical Mastectomy for Breast Cancer by CT Image and AUTO-plan Intelligent Analysis under Regional Nerve Block,Neuroscience Letters,1,https://doi.org/10.1016/j.neulet.2020.135214,https://api.labs.crossref.org/works/https://doi.org/10.1016/j.neulet.2020.135214?mailto=christian.hauschke@tib.eu,2020,article,True,67,Radiomics in Medical Imaging Analysis,Health Sciences,"Radiology, Nuclear Medicine and Imaging",Elsevier BV,False,en,Medicine,
https://openalex.org/W3037635748,Solving the problem of optimizing wind farm design using genetic algorithms,IOP Conference Series: Materials Science and Engineering,1,https://doi.org/10.1088/1757-899x/872/1/012029,https://api.labs.crossref.org/works/https://doi.org/10.1088/1757-899x/872/1/012029?mailto=christian.hauschke@tib.eu,2020,article,True,67,Wind Energy Technology and Aerodynamics,Physical Sciences,Aerospace Engineering,IOP Publishing,True,en,Engineering,
https://openalex.org/W3037854115,RETRACTED ARTICLE: Filter Bank Multicarrier Based Generalized Discrete Fourier Transform for Peak to Average Power Ratio Reduction,Mobile Networks and Applications,1,https://doi.org/10.1007/s11036-019-01391-8,https://api.labs.crossref.org/works/https://doi.org/10.1007/s11036-019-01391-8?mailto=christian.hauschke@tib.eu,2019,article,True,68,Cognitive Radio Networks and Smart Technologies,Physical Sciences,Computer Networks and Communications,Springer Science+Business Media,False,en,Computer Science,
https://openalex.org/W3037905795,The influence of grid connection of electric vehicles on microgrid and its coordinated control under the background of new energy power generation,International Journal of Electrical Engineering Education,1,https://doi.org/10.1177/0020720920931427,https://api.labs.crossref.org/works/https://doi.org/10.1177/0020720920931427?mailto=christian.hauschke@tib.eu,2020,article,True,67,Integration of Electric Vehicles in Power Systems,Physical Sciences,Electrical and Electronic Engineering,SAGE Publishing,False,en,Engineering,
https://openalex.org/W3038067299,RETRACTED ARTICLE: Scattering coefficients and pathgain of a multilayer tissue structure using ABCD matrix method,Journal of Ambient Intelligence and Humanized Computing,1,https://doi.org/10.1007/s12652-020-02244-z,https://api.labs.crossref.org/works/https://doi.org/10.1007/s12652-020-02244-z?mailto=christian.hauschke@tib.eu,2020,article,True,67,Wireless Body Area Networks in Healthcare,Physical Sciences,Biomedical Engineering,Springer Science+Business Media,False,en,Engineering,
https://openalex.org/W3038214013,WITHDRAWN:A Case Series of Stent Thrombosis During the COVID-19 Pandemic,JACC: Case Reports,1,https://doi.org/10.1016/j.jaccas.2020.05.029,https://api.labs.crossref.org/works/https://doi.org/10.1016/j.jaccas.2020.05.029?mailto=christian.hauschke@tib.eu,2020,article,True,67,Impact of COVID-19 on Cancer Patients and Care,Health Sciences,Oncology,Elsevier BV,True,en,Medicine,
https://openalex.org/W3038238603,RETRACTED: Performance of news clustering using ant colony optimization,Journal of Physics: Conference Series,1,https://doi.org/10.1088/1742-6596/1566/1/012101,https://api.labs.crossref.org/works/https://doi.org/10.1088/1742-6596/1566/1/012101?mailto=christian.hauschke@tib.eu,2020,article,True,67,Data Clustering Techniques and Algorithms,Physical Sciences,Artificial Intelligence,IOP Publishing,True,en,Computer Science,
https://openalex.org/W3038284493,WITHDRAWN: Introducing special cutaneous “sign” tribute to healthcare workers managing new coronavirus disease (Covid -19),Clinics in Dermatology,1,https://doi.org/10.1016/j.clindermatol.2020.04.011,https://api.labs.crossref.org/works/https://doi.org/10.1016/j.clindermatol.2020.04.011?mailto=christian.hauschke@tib.eu,2020,article,True,67,Prevention and Treatment of Pressure Ulcers,Health Sciences,Occupational Therapy,Elsevier BV,True,en,Health Professions,
https://openalex.org/W3038322361,WITHDRAWN:The efficacy of low vision rehabilitation in improving the quality of life for patients with impaired vision: a systematic review and meta-analysis of 46 randomized clinical trials,International Journal of Surgery,1,https://doi.org/10.1016/j.ijsu.2020.06.037,https://api.labs.crossref.org/works/https://doi.org/10.1016/j.ijsu.2020.06.037?mailto=christian.hauschke@tib.eu,2020,article,True,67,Global Epidemiology of Myopia and Visual Impairment,Health Sciences,Epidemiology,Elsevier BV,False,en,Medicine,
https://openalex.org/W3038484407,RETRACTED: Technology Related to Agricultural Transformation and Development based on 5G Technology,Journal of Physics: Conference Series,1,https://doi.org/10.1088/1742-6596/1574/1/012015,https://api.labs.crossref.org/works/https://doi.org/10.1088/1742-6596/1574/1/012015?mailto=christian.hauschke@tib.eu,2020,article,True,67,Drivers and Impediments for Cross-Border E-Commerce,Social Sciences,Business and International Management,IOP Publishing,True,en,"Business, Management and Accounting",
https://openalex.org/W3038485896,RETRACTED: The Integration of Professional Ethics of Modern Etiquette Students under the Background of Big Data,Journal of Physics: Conference Series,1,https://doi.org/10.1088/1742-6596/1574/1/012130,https://api.labs.crossref.org/works/https://doi.org/10.1088/1742-6596/1574/1/012130?mailto=christian.hauschke@tib.eu,2020,article,True,67,Drivers and Impediments for Cross-Border E-Commerce,Social Sciences,Business and International Management,IOP Publishing,True,en,"Business, Management and Accounting",
https://openalex.org/W3038602313,RETRACTED: Diversity of Aesthetic Features of Contemporary Watercolor Painting Based on Big Data Analysis,Journal of Physics: Conference Series,1,https://doi.org/10.1088/1742-6596/1574/1/012099,https://api.labs.crossref.org/works/https://doi.org/10.1088/1742-6596/1574/1/012099?mailto=christian.hauschke@tib.eu,2020,article,True,67,Innovations in Visual Communication Design and Technology,Physical Sciences,Computer Graphics and Computer-Aided Design,IOP Publishing,True,en,Computer Science,
https://openalex.org/W3038695054,RETRACTED: Two Co(II) coordination polymers exhibit picric acid sensing property and treatment activity in nonalcoholic fatty liver disease by reducing intestinal Escherichia coli counts,Journal of Molecular Structure,1,https://doi.org/10.1016/j.molstruc.2020.128832,https://api.labs.crossref.org/works/https://doi.org/10.1016/j.molstruc.2020.128832?mailto=christian.hauschke@tib.eu,2020,article,True,67,Chemistry and Applications of Metal-Organic Frameworks,Physical Sciences,Inorganic Chemistry,Elsevier BV,True,en,Chemistry,
https://openalex.org/W3038731416,Two Mixed-ligand Coordination Polymers: Crystal Structures and Protective Effect on Ischemic Stroke by Increasing &lt;i&gt;glp1r&lt;/i&gt; Expression,Journal of Oleo Science,1,https://doi.org/10.5650/jos.ess20047,https://api.labs.crossref.org/works/https://doi.org/10.5650/jos.ess20047?mailto=christian.hauschke@tib.eu,2020,article,True,67,Chemistry and Applications of Metal-Organic Frameworks,Physical Sciences,Inorganic Chemistry,Japan Oil Chemists' Society,True,en,Chemistry,
https://openalex.org/W3038838866,WITHDRAWN: Diagnosis of Intracranial Primary Central Nervous System Lymphoma Based on Magnetic Resonance Imaging,Neuroscience Letters,1,https://doi.org/10.1016/j.neulet.2020.135225,https://api.labs.crossref.org/works/https://doi.org/10.1016/j.neulet.2020.135225?mailto=christian.hauschke@tib.eu,2020,article,True,67,Diagnosis and Treatment of Primary Central Nervous System Lymphoma,Health Sciences,Neurology,Elsevier BV,False,en,Medicine,
https://openalex.org/W3038928171,RETRACTED: Research on the Matching Degree Between the Training Direction of Students Majoring in Film and Television Animation and Social Industry in Higher Vocational Colleges Based on Computer Big Data Research,Journal of Physics: Conference Series,1,https://doi.org/10.1088/1742-6596/1574/1/012037,https://api.labs.crossref.org/works/https://doi.org/10.1088/1742-6596/1574/1/012037?mailto=christian.hauschke@tib.eu,2020,article,True,67,Drivers and Impediments for Cross-Border E-Commerce,Social Sciences,Business and International Management,IOP Publishing,True,en,"Business, Management and Accounting",
https://openalex.org/W3038964030,RETRACTED: Ideological and Political Course Teaching in Colleges and Universities Based on the Construction of Computer Multimedia Technology,Journal of Physics: Conference Series,1,https://doi.org/10.1088/1742-6596/1574/1/012064,https://api.labs.crossref.org/works/https://doi.org/10.1088/1742-6596/1574/1/012064?mailto=christian.hauschke@tib.eu,2020,article,True,67,Innovation and Development of Ideological Education,Social Sciences,Education,IOP Publishing,True,en,Social Sciences,
https://openalex.org/W3039600659,"WITHDRAWN: Self-Management Behavior, Symptom Occurrence, and Psychological Distress in Liver Transplant Recipients in China: A Descriptive Correlational Study",Transplantation Proceedings,1,https://doi.org/10.1016/j.transproceed.2019.02.036,https://api.labs.crossref.org/works/https://doi.org/10.1016/j.transproceed.2019.02.036?mailto=christian.hauschke@tib.eu,2020,article,True,67,Impact of Stigma on Mental Health Care,Social Sciences,Social Psychology,Elsevier BV,True,en,Psychology,
https://openalex.org/W3039793234,WITHDRAWN: Analyzing risk factors for enterostomy infection and neuropsychology of patients by computer information data regression under endoscopic image guidance,Neuroscience Letters,1,https://doi.org/10.1016/j.neulet.2020.135223,https://api.labs.crossref.org/works/https://doi.org/10.1016/j.neulet.2020.135223?mailto=christian.hauschke@tib.eu,2020,article,True,67,Complications and Management of Stoma-related Issues,Health Sciences,Surgery,Elsevier BV,False,en,Medicine,
https://openalex.org/W3039984475,Research on the Influence of the Integration of Public Art and Computer on Urban Culture from the Perspective of Media Ecology,Journal of Physics: Conference Series,1,https://doi.org/10.1088/1742-6596/1574/1/012011,https://api.labs.crossref.org/works/https://doi.org/10.1088/1742-6596/1574/1/012011?mailto=christian.hauschke@tib.eu,2020,article,True,67,Innovations in Visual Communication Design and Technology,Physical Sciences,Computer Graphics and Computer-Aided Design,IOP Publishing,True,en,Computer Science,
https://openalex.org/W3040660470,RETRACTED: Evaporation screening and shielding in accelerating and rotating black holes,Annals of Physics,1,https://doi.org/10.1016/j.aop.2020.168249,https://api.labs.crossref.org/works/https://doi.org/10.1016/j.aop.2020.168249?mailto=christian.hauschke@tib.eu,2020,article,True,67,Holographic Derivation of Field Theories and Gravity,Physical Sciences,Nuclear and High Energy Physics,Elsevier BV,False,en,Physics and Astronomy,
https://openalex.org/W3041066143,RETRACTED ARTICLE: The diagnostic value of combined dynamic contrast-enhanced MRI (DCE-MRI) and diffusion-weighted imaging (DWI) in characterization of parotid gland tumors,Egyptian Journal of Radiology and Nuclear Medicine,1,https://doi.org/10.1186/s43055-020-00237-8,https://api.labs.crossref.org/works/https://doi.org/10.1186/s43055-020-00237-8?mailto=christian.hauschke@tib.eu,2020,article,True,67,Salivary Gland Tumors and Carcinomas,Health Sciences,Surgery,Springer Science+Business Media,True,en,Medicine,
https://openalex.org/W3041081688,RETRACTED ARTICLE: A novel patch selection technique in ANN B-Spline Bayesian hyperprior interpolation VLSI architecture using fuzzy logic for highspeed satellite image processing,Journal of Ambient Intelligence and Humanized Computing,1,https://doi.org/10.1007/s12652-020-02264-9,https://api.labs.crossref.org/works/https://doi.org/10.1007/s12652-020-02264-9?mailto=christian.hauschke@tib.eu,2020,article,True,67,Single Image Super-Resolution Techniques,Physical Sciences,Computer Vision and Pattern Recognition,Springer Science+Business Media,False,en,Computer Science,
https://openalex.org/W3041192254,RETRACTED ARTICLE: Ontology for distributed architecture of pedagogical warehouse in the field of machine learning,Education and Information Technologies,1,https://doi.org/10.1007/s10639-020-10266-5,https://api.labs.crossref.org/works/https://doi.org/10.1007/s10639-020-10266-5?mailto=christian.hauschke@tib.eu,2020,article,True,67,Semantic Web and Ontology Development,Physical Sciences,Artificial Intelligence,Springer Science+Business Media,True,en,Computer Science,
https://openalex.org/W3041313936,IGHG1 functions as an oncogene in tongue squamous cell carcinoma via JAK1/STAT5 signaling.,European Review for Medical and Pharmacological Sciences,1,https://doi.org/10.26355/eurrev_202101_24607,https://api.labs.crossref.org/works/https://doi.org/10.26355/eurrev_202101_24607?mailto=christian.hauschke@tib.eu,2020,article,True,67,Role of Long Noncoding RNAs in Cancer and Development,Life Sciences,Cancer Research,Verduci Editore,False,en,"Biochemistry, Genetics and Molecular Biology",
https://openalex.org/W3042263179,RETRACTED: Research on the influence of dual governance on the vulnerability of technology innovation network in major engineering projects,International Journal of Electrical Engineering Education,1,https://doi.org/10.1177/0020720920940606,https://api.labs.crossref.org/works/https://doi.org/10.1177/0020720920940606?mailto=christian.hauschke@tib.eu,2020,article,True,67,Success Factors in Project Management,Social Sciences,Management Science and Operations Research,SAGE Publishing,False,en,Decision Sciences,
https://openalex.org/W3042630171,RETRACTED: Research on Financial Management Innovation of Small and Medium Enterprises in the Context of Big Data,Journal of Physics: Conference Series,1,https://doi.org/10.1088/1742-6596/1575/1/012107,https://api.labs.crossref.org/works/https://doi.org/10.1088/1742-6596/1575/1/012107?mailto=christian.hauschke@tib.eu,2020,article,True,67,Assessment of Sustainable Development Indicators and Strategies,Physical Sciences,"Management, Monitoring, Policy and Law",IOP Publishing,True,en,Environmental Science,
https://openalex.org/W3042682225,Research on ultra-precision polisher for the internal surface of the elbow,International Journal of Electrical Engineering Education,1,https://doi.org/10.1177/0020720920940588,https://api.labs.crossref.org/works/https://doi.org/10.1177/0020720920940588?mailto=christian.hauschke@tib.eu,2020,article,True,67,Chemical Mechanical Polishing in Microelectronics Manufacturing,Physical Sciences,Biomedical Engineering,SAGE Publishing,False,en,Engineering,
https://openalex.org/W3042757208,Retraction article: Eight-dimensional octonion-like but associative normed division algebra,Communications in Algebra,1,https://doi.org/10.1080/00927872.2020.1791899,https://api.labs.crossref.org/works/https://doi.org/10.1080/00927872.2020.1791899?mailto=christian.hauschke@tib.eu,2020,article,True,67,Quaternionic Analysis and Applications,Physical Sciences,Applied Mathematics,Taylor & Francis,False,en,Mathematics,
https://openalex.org/W3042794378,RETRACTED: Application of virtual reality technology in Wushu education,International Journal of Electrical Engineering Education,1,https://doi.org/10.1177/0020720920940583,https://api.labs.crossref.org/works/https://doi.org/10.1177/0020720920940583?mailto=christian.hauschke@tib.eu,2020,article,True,67,Artificial Intelligence in Education and Technology,Physical Sciences,Artificial Intelligence,SAGE Publishing,False,en,Computer Science,
https://openalex.org/W3042825715,RETRACTED ARTICLE: Modeling and design of Magnetic Tunneling Junction using MoS2/graphene quantum dots/MoS2 approach,Journal of Nanoparticle Research,1,https://doi.org/10.1007/s11051-020-04920-9,https://api.labs.crossref.org/works/https://doi.org/10.1007/s11051-020-04920-9?mailto=christian.hauschke@tib.eu,2020,article,True,67,Two-Dimensional Materials,Physical Sciences,Materials Chemistry,Springer Science+Business Media,False,en,Materials Science,
https://openalex.org/W3042900466,WITHDRAWN: COVID-19 Emergency Responders in FDA’s Center for Drug Evaluation and Research,Journal of the American Pharmacists Association,1,https://doi.org/10.1016/j.japh.2020.04.007,https://api.labs.crossref.org/works/https://doi.org/10.1016/j.japh.2020.04.007?mailto=christian.hauschke@tib.eu,2020,article,True,67,Computational Methods in Drug Discovery,Physical Sciences,Computational Theory and Mathematics,Elsevier BV,True,en,Computer Science,
https://openalex.org/W3042980198,RETRACTED CHAPTER: Software Project Planning Through Comparison of Bio-inspired Algorithms,Communications in computer and information science,1,https://doi.org/10.1007/978-981-15-6648-6_27,https://api.labs.crossref.org/works/https://doi.org/10.1007/978-981-15-6648-6_27?mailto=christian.hauschke@tib.eu,2020,book-chapter,True,67,Agile Software Development in Software Engineering,Physical Sciences,Information Systems,Springer Science+Business Media,True,en,Computer Science,
https://openalex.org/W3043077780,RETRACTED: Evaluation Method of Campus Football Implementation Effectiveness Based on Computer Simulation Model,Journal of Physics: Conference Series,1,https://doi.org/10.1088/1742-6596/1578/1/012070,https://api.labs.crossref.org/works/https://doi.org/10.1088/1742-6596/1578/1/012070?mailto=christian.hauschke@tib.eu,2020,article,True,67,Drivers and Impediments for Cross-Border E-Commerce,Social Sciences,Business and International Management,IOP Publishing,True,en,"Business, Management and Accounting",
https://openalex.org/W3043158343,RETRACTED: Nonlinear average stochastic resonance for image enhancement,International Journal of Electrical Engineering Education,1,https://doi.org/10.1177/0020720920940613,https://api.labs.crossref.org/works/https://doi.org/10.1177/0020720920940613?mailto=christian.hauschke@tib.eu,2020,article,True,67,Stochastic Resonance in Nonlinear Systems,Physical Sciences,Statistical and Nonlinear Physics,SAGE Publishing,False,en,Physics and Astronomy,
https://openalex.org/W3043233447,Remote sensing image classification based on adaptive ant colony algorithm,Arabian Journal of Geosciences,1,https://doi.org/10.1007/s12517-020-05717-9,https://api.labs.crossref.org/works/https://doi.org/10.1007/s12517-020-05717-9?mailto=christian.hauschke@tib.eu,2020,article,True,67,Applications of Remote Sensing in Geoscience and Agriculture,Physical Sciences,Atmospheric Science,Springer Science+Business Media,False,en,Earth and Planetary Sciences,
https://openalex.org/W3043294370,RETRACTED ARTICLE: Investigation and improvement of layered lithium-ion nano-batteries by iron effect on storage energy efficiency,Journal of Nanoparticle Research,1,https://doi.org/10.1007/s11051-020-04927-2,https://api.labs.crossref.org/works/https://doi.org/10.1007/s11051-020-04927-2?mailto=christian.hauschke@tib.eu,2020,article,True,67,Lithium-ion Battery Technology,Physical Sciences,Electrical and Electronic Engineering,Springer Science+Business Media,False,en,Engineering,
https://openalex.org/W3043376351,Retracted: A new porous Co(II)‐coordination polymer for the chemical fixation of CO<sub>2</sub> and treatment effect against tuberculosis by reducing the <i>pckA</i> expression in <scp><i>Mycobacterium tuberculosis</i></scp>,Applied Organometallic Chemistry,1,https://doi.org/10.1002/aoc.5908,https://api.labs.crossref.org/works/https://doi.org/10.1002/aoc.5908?mailto=christian.hauschke@tib.eu,2020,article,True,67,Chemistry and Applications of Metal-Organic Frameworks,Physical Sciences,Inorganic Chemistry,Wiley,False,en,Chemistry,
https://openalex.org/W3043409621,"WITHDRAWN: Neurological examination, rather than vascular risk factor assessment, serves to distinguish strokes from stroke mimics in a population with high prevalence of vascular risk factors",World Neurosurgery,1,https://doi.org/10.1016/j.wneu.2020.07.075,https://api.labs.crossref.org/works/https://doi.org/10.1016/j.wneu.2020.07.075?mailto=christian.hauschke@tib.eu,2020,article,True,67,Diagnosis and Treatment of Carotid Artery Disease,Health Sciences,Pulmonary and Respiratory Medicine,Elsevier BV,False,en,Medicine,
https://openalex.org/W3043464792,RETRACTED ARTICLE: Suppressor capacity of copper nanoparticles biosynthesized using Crocus sativus L. leaf aqueous extract on methadone-induced cell death in adrenal phaeochromocytoma (PC12) cell line,Scientific Reports,1,https://doi.org/10.1038/s41598-020-68142-8,https://api.labs.crossref.org/works/https://doi.org/10.1038/s41598-020-68142-8?mailto=christian.hauschke@tib.eu,2020,article,True,67,Cancer Chemopreventive Properties of Saffron,Health Sciences,Oncology,Nature Portfolio,True,en,Medicine,
https://openalex.org/W3043482573,Corporate social responsibility of Internet enterprises based on data mining,International Journal of Electrical Engineering Education,1,https://doi.org/10.1177/0020720920940582,https://api.labs.crossref.org/works/https://doi.org/10.1177/0020720920940582?mailto=christian.hauschke@tib.eu,2020,article,True,67,Corporate Social Responsibility and Financial Performance,Social Sciences,Strategy and Management,SAGE Publishing,False,en,"Business, Management and Accounting",
https://openalex.org/W3043515727,WITHDRAWN: Tuberculosis of calcaneus—A case report and review of literature,International Journal of Surgery Case Reports,1,https://doi.org/10.1016/j.ijscr.2020.07.004,https://api.labs.crossref.org/works/https://doi.org/10.1016/j.ijscr.2020.07.004?mailto=christian.hauschke@tib.eu,2020,article,True,67,Diagnosis and Treatment of Spinal Infections,Health Sciences,Surgery,Elsevier BV,True,en,Medicine,
https://openalex.org/W3043689347,RETRACTED: Prediction models of sports lottery revenue in China,International Journal of Electrical Engineering Education,1,https://doi.org/10.1177/0020720920940589,https://api.labs.crossref.org/works/https://doi.org/10.1177/0020720920940589?mailto=christian.hauschke@tib.eu,2020,article,True,67,Pathological Gambling and Comorbid Disorders,Social Sciences,Clinical Psychology,SAGE Publishing,False,en,Psychology,
https://openalex.org/W3043705390,Research on the Integration of Chinese and Russian Original Ecological Dance Elements and Modern Elements Based on Computer Big Data Analysis,Journal of Physics: Conference Series,1,https://doi.org/10.1088/1742-6596/1578/1/012077,https://api.labs.crossref.org/works/https://doi.org/10.1088/1742-6596/1578/1/012077?mailto=christian.hauschke@tib.eu,2020,article,True,67,Biomechanics and Psychology of Dance Performance,Social Sciences,Experimental and Cognitive Psychology,IOP Publishing,True,en,Psychology,
https://openalex.org/W3043782054,RETRACTED: Lepton number violation in a unified framework,Progress of theoretical and experimental physics,1,https://doi.org/10.1093/ptep/ptaa107,https://api.labs.crossref.org/works/https://doi.org/10.1093/ptep/ptaa107?mailto=christian.hauschke@tib.eu,2020,article,True,67,Particle Physics and High-Energy Collider Experiments,Physical Sciences,Nuclear and High Energy Physics,University of Oxford,True,en,Physics and Astronomy,
https://openalex.org/W3043791407,RETRACTED: Remote sensing image landmark segmentation algorithm based on improved GSA and PCNN combination,International Journal of Electrical Engineering Education,1,https://doi.org/10.1177/0020720920936826,https://api.labs.crossref.org/works/https://doi.org/10.1177/0020720920936826?mailto=christian.hauschke@tib.eu,2020,article,True,67,Computational Modeling of Visual Saliency Detection,Physical Sciences,Computer Vision and Pattern Recognition,SAGE Publishing,False,en,Computer Science,
https://openalex.org/W3043803542,RETRACTED: Building the Training System of Physical Education Innovation Ability in Higher Vocational Colleges Based on Computer Information Technology,Journal of Physics: Conference Series,1,https://doi.org/10.1088/1742-6596/1578/1/012064,https://api.labs.crossref.org/works/https://doi.org/10.1088/1742-6596/1578/1/012064?mailto=christian.hauschke@tib.eu,2020,article,True,67,Drivers and Impediments for Cross-Border E-Commerce,Social Sciences,Business and International Management,IOP Publishing,True,en,"Business, Management and Accounting",
https://openalex.org/W3043858151,RETRACTED: A novel rough-wall model for large eddy simulation of high-Reynolds-number flow,International Journal of Electrical Engineering Education,1,https://doi.org/10.1177/0020720920940578,https://api.labs.crossref.org/works/https://doi.org/10.1177/0020720920940578?mailto=christian.hauschke@tib.eu,2020,article,True,67,Turbulent Flows and Vortex Dynamics,Physical Sciences,Computational Mechanics,SAGE Publishing,False,en,Engineering,
https://openalex.org/W3044164716,RETRACTED ARTICLE: Ameliorated monopole antenna with perforated ground for breast tumor detection,Journal of Ambient Intelligence and Humanized Computing,1,https://doi.org/10.1007/s12652-020-02380-6,https://api.labs.crossref.org/works/https://doi.org/10.1007/s12652-020-02380-6?mailto=christian.hauschke@tib.eu,2020,article,True,67,Microwave Imaging for Breast Cancer Detection,Physical Sciences,Biomedical Engineering,Springer Science+Business Media,False,en,Engineering,
