id,display_name,primary_location_display_name,cited_by_count,doi,crossref_call,publication_year,type,is_retracted,cited_by_percentile_year_min,primary_topic_display_name,primary_topic_domain_display_name,primary_topic_subfield_display_name,primary_location_source_host_organization_name,open_access_is_oa,language,primary_topic_field_display_name,update_nature
https://openalex.org/W1551420123,Notice of Retraction: The Design and Realization of Intelligent Data Collecting and Processing System,,0,https://doi.org/10.1109/cicc-itoe.2010.77,https://api.labs.crossref.org/works/https://doi.org/10.1109/cicc-itoe.2010.77?mailto=christian.hauschke@tib.eu,2010,article,True,0,Artificial Intelligence and Expert Systems,Physical Sciences,Artificial Intelligence,,False,en,Computer Science,
https://openalex.org/W1551544105,Notice of Retraction: Synthetically using action-oriented teaching method in vocational education,,0,https://doi.org/10.1109/iceit.2010.5607589,https://api.labs.crossref.org/works/https://doi.org/10.1109/iceit.2010.5607589?mailto=christian.hauschke@tib.eu,2010,article,True,0,Impact of Technology on Education and Training,Physical Sciences,Information Systems,,False,en,Computer Science,
https://openalex.org/W1551588198,Notice of Retraction: The rejection rate and rework rate calculation model in the mechanical spare part production,,0,https://doi.org/10.1109/cmce.2010.5609822,https://api.labs.crossref.org/works/https://doi.org/10.1109/cmce.2010.5609822?mailto=christian.hauschke@tib.eu,2010,article,True,0,Principles of Production Management and Operations,Social Sciences,Strategy and Management,,False,en,"Business, Management and Accounting",
https://openalex.org/W1551631934,Notice of Retraction: The Analysis of Resisting Wind for UHV Transmission Tower with Unequal Legs,,0,https://doi.org/10.1109/appeec.2010.5449447,https://api.labs.crossref.org/works/https://doi.org/10.1109/appeec.2010.5449447?mailto=christian.hauschke@tib.eu,2010,article,True,0,Ultra High Voltage Transmission Technology in China,Physical Sciences,Electrical and Electronic Engineering,,False,en,Engineering,
https://openalex.org/W1551905650,Notice of Retraction: Conditional Value-at-Risk in a newsvendor model with underage loss and overage penalty,,0,https://doi.org/10.1109/icemms.2010.5563510,https://api.labs.crossref.org/works/https://doi.org/10.1109/icemms.2010.5563510?mailto=christian.hauschke@tib.eu,2010,article,True,0,Coordination and Information Sharing in Supply Chains,Social Sciences,Management Information Systems,,False,en,"Business, Management and Accounting",
https://openalex.org/W1552072386,Notice of Retraction: Adaptability evaluation of the machine tools structure based on the AHP,,0,https://doi.org/10.1109/iccasm.2010.5620794,https://api.labs.crossref.org/works/https://doi.org/10.1109/iccasm.2010.5620794?mailto=christian.hauschke@tib.eu,2010,article,True,0,Intelligent Control System for Industrial Processes,Physical Sciences,Control and Systems Engineering,,False,en,Engineering,
https://openalex.org/W1552177260,Notice of Retraction: Research of 3D Geological Body Modeling Methods Based on TEN,,0,https://doi.org/10.1109/iciecs.2010.5678332,https://api.labs.crossref.org/works/https://doi.org/10.1109/iciecs.2010.5678332?mailto=christian.hauschke@tib.eu,2010,article,True,0,Geological Modeling and Uncertainty Analysis,Physical Sciences,Geochemistry and Petrology,,False,en,Earth and Planetary Sciences,
https://openalex.org/W1552439895,Notice of Retraction: Study on optimizing advance angle of injection of the armored vehicle diesel engine at different loads,,0,https://doi.org/10.1109/iccasm.2010.5619418,https://api.labs.crossref.org/works/https://doi.org/10.1109/iccasm.2010.5619418?mailto=christian.hauschke@tib.eu,2010,article,True,0,Intelligent Control System for Industrial Processes,Physical Sciences,Control and Systems Engineering,,False,en,Engineering,
https://openalex.org/W1552571115,Notice of Retraction: Noninvasive glucose monitoring in vivo based on Monte Carlo modeling,,0,https://doi.org/10.1109/iccasm.2010.5620452,https://api.labs.crossref.org/works/https://doi.org/10.1109/iccasm.2010.5620452?mailto=christian.hauschke@tib.eu,2010,article,True,0,Biomedical Applications of Spectroscopy Techniques,Life Sciences,Biophysics,,False,en,"Biochemistry, Genetics and Molecular Biology",
https://openalex.org/W1552886409,Notice of Retraction: An experimental study of messy genetic algorithm on HIFF problem,,0,https://doi.org/10.1109/iccsit.2010.5564848,https://api.labs.crossref.org/works/https://doi.org/10.1109/iccsit.2010.5564848?mailto=christian.hauschke@tib.eu,2010,article,True,0,Control Systems and Network Applications,Physical Sciences,Control and Systems Engineering,,False,en,Engineering,
https://openalex.org/W1552968250,Notice of Retraction: Design and Implementation of Support System for Industrializing Technological Innovation Achievements in Universities,,0,https://doi.org/10.1109/etcs.2010.281,https://api.labs.crossref.org/works/https://doi.org/10.1109/etcs.2010.281?mailto=christian.hauschke@tib.eu,2010,article,True,0,Impact of Technology on Education and Training,Physical Sciences,Information Systems,,False,en,Computer Science,
https://openalex.org/W1552979826,Notice of Retraction: The forming mechanism of soil crust on magnesite mining area,,0,https://doi.org/10.1109/esiat.2010.5567433,https://api.labs.crossref.org/works/https://doi.org/10.1109/esiat.2010.5567433?mailto=christian.hauschke@tib.eu,2010,article,True,0,Mining Technology and Safety Measures,Physical Sciences,"Safety, Risk, Reliability and Quality",,False,en,Engineering,
https://openalex.org/W1552980674,Notice of Retraction: Numerical simulation on side heat transfer in 300kA aluminum reduction cell with graphitized cathode,,0,https://doi.org/10.1109/iccasm.2010.5622788,https://api.labs.crossref.org/works/https://doi.org/10.1109/iccasm.2010.5622788?mailto=christian.hauschke@tib.eu,2010,article,True,0,Induction Heating Technology and Applications,Physical Sciences,Mechanical Engineering,,False,en,Engineering,
https://openalex.org/W1553036988,Notice of Retraction: The application of genetic algorithm to closure temperature fields and shape optimization of Jinping high arch dam,2010 Sixth International Conference on Natural Computation,0,https://doi.org/10.1109/icnc.2010.5583576,https://api.labs.crossref.org/works/https://doi.org/10.1109/icnc.2010.5583576?mailto=christian.hauschke@tib.eu,2010,article,True,0,Statistics and Mechanisms of Embankment Dam Failures,Physical Sciences,Civil and Structural Engineering,,False,en,Engineering,
https://openalex.org/W1553148159,Notice of Retraction: Research on the Design and Evaluation of Signal Coordination Control System in Urban Main Road,,0,https://doi.org/10.1109/leits.2010.5664948,https://api.labs.crossref.org/works/https://doi.org/10.1109/leits.2010.5664948?mailto=christian.hauschke@tib.eu,2010,article,True,0,Intelligent Control System for Industrial Processes,Physical Sciences,Control and Systems Engineering,,False,en,Engineering,
https://openalex.org/W1553306168,Notice of Retraction: Finite element modeling and analysis for key parts of a new type internal combustion engine,,0,https://doi.org/10.1109/iccasm.2010.5619335,https://api.labs.crossref.org/works/https://doi.org/10.1109/iccasm.2010.5619335?mailto=christian.hauschke@tib.eu,2010,article,True,0,Modelling and Optimization of Composite Springs in Vehicles,Physical Sciences,Mechanical Engineering,,False,en,Engineering,
https://openalex.org/W1553335934,Notice of Retraction: Searching for robust optimal solutions by an evolutionary algorithm,,0,https://doi.org/10.1109/icacc.2010.5487133,https://api.labs.crossref.org/works/https://doi.org/10.1109/icacc.2010.5487133?mailto=christian.hauschke@tib.eu,2010,article,True,0,Swarm Intelligence Optimization Algorithms,Physical Sciences,Artificial Intelligence,,False,en,Computer Science,
https://openalex.org/W1553365335,Notice of Retraction: The role of Primary and Secondary industry in pulling the growth of GDP,,0,https://doi.org/10.1109/cctae.2010.5544063,https://api.labs.crossref.org/works/https://doi.org/10.1109/cctae.2010.5544063?mailto=christian.hauschke@tib.eu,2010,article,True,0,Institutions and Economic Growth: Empirical Investigations and Theories,Social Sciences,Economics and Econometrics,,False,en,"Economics, Econometrics and Finance",
https://openalex.org/W1553389787,Notice of Retraction: The Effect of Monetary Shocks on Welfare: An Econometric Investigation,,0,https://doi.org/10.1109/iccea.2010.96,https://api.labs.crossref.org/works/https://doi.org/10.1109/iccea.2010.96?mailto=christian.hauschke@tib.eu,2010,article,True,0,Macroeconomic Analysis and Policy Implications,Social Sciences,"General Economics, Econometrics and Finance",,False,en,"Economics, Econometrics and Finance",
https://openalex.org/W1553452828,Notice of Retraction: Multi-level Fuzzy Comprehensive Evaluation of Educational Technique Ability Training Performance of University Teachers,,0,https://doi.org/10.1109/etcs.2010.297,https://api.labs.crossref.org/works/https://doi.org/10.1109/etcs.2010.297?mailto=christian.hauschke@tib.eu,2010,article,True,0,Application of Fuzzy Logic in Educational Assessment,Physical Sciences,Information Systems,,False,en,Computer Science,
https://openalex.org/W1553482510,Notice of Retraction: Study on the development actuality and deal with situation of the private sector of economy in Handan,,0,https://doi.org/10.1109/iccsit.2010.5563611,https://api.labs.crossref.org/works/https://doi.org/10.1109/iccsit.2010.5563611?mailto=christian.hauschke@tib.eu,2010,article,True,0,Spatial Shift-Share Analysis in Economic Development,Social Sciences,Economics and Econometrics,,False,en,"Economics, Econometrics and Finance",
https://openalex.org/W1553543625,Notice of Retraction: A promising curriculum model,,0,https://doi.org/10.1109/iceit.2010.5607661,https://api.labs.crossref.org/works/https://doi.org/10.1109/iceit.2010.5607661?mailto=christian.hauschke@tib.eu,2010,article,True,0,Engineering Education and Curriculum Development,Physical Sciences,Media Technology,,False,en,Engineering,
https://openalex.org/W1553879480,Notice of Retraction: Analysis of MAC Protocol Based on Dual-Probability Detection and Wireless Sensor Networks,,0,https://doi.org/10.1109/iciecs.2010.5678331,https://api.labs.crossref.org/works/https://doi.org/10.1109/iciecs.2010.5678331?mailto=christian.hauschke@tib.eu,2010,article,True,0,Wireless Sensor Networks: Survey and Applications,Physical Sciences,Computer Networks and Communications,,False,en,Computer Science,
https://openalex.org/W1554375278,Perspectives on GIS Development in China,,0,https://doi.org/10.1109/ifita.2010.180,https://api.labs.crossref.org/works/https://doi.org/10.1109/ifita.2010.180?mailto=christian.hauschke@tib.eu,2010,article,True,0,Volunteered Geographic Information and Geospatial Crowdsourcing,Social Sciences,"Geography, Planning and Development",,False,en,Social Sciences,
https://openalex.org/W1554394624,Notice of Retraction: The enlightenment from “the Samsung Model” to Lenovo's “going out” strategy,2010 2nd IEEE InternationalConference on Network Infrastructure and Digital Content,0,https://doi.org/10.1109/icnidc.2010.5657986,https://api.labs.crossref.org/works/https://doi.org/10.1109/icnidc.2010.5657986?mailto=christian.hauschke@tib.eu,2010,article,True,0,Knowledge Management and Organizational Innovation,Social Sciences,Strategy and Management,,False,en,"Business, Management and Accounting",
https://openalex.org/W1554580042,Notice of Retraction: Application of vague-based rough decision-making approach to block division planning,,0,https://doi.org/10.1109/icicisys.2010.5658737,https://api.labs.crossref.org/works/https://doi.org/10.1109/icicisys.2010.5658737?mailto=christian.hauschke@tib.eu,2010,article,True,0,Rough Sets Theory and Applications,Physical Sciences,Computational Theory and Mathematics,,False,en,Computer Science,
https://openalex.org/W1554799114,Notice of Retraction: Developing a Mega event impact scale,,0,https://doi.org/10.1109/icetc.2010.5529540,https://api.labs.crossref.org/works/https://doi.org/10.1109/icetc.2010.5529540?mailto=christian.hauschke@tib.eu,2010,article,True,0,Psychological and Sociocultural Aspects of Extreme Sports,Social Sciences,Social Psychology,,False,en,Psychology,
https://openalex.org/W1554966596,Notice of Retraction: Business modeling for the construction of virtual enterprise in project logistics,,0,https://doi.org/10.1109/icams.2010.5552955,https://api.labs.crossref.org/works/https://doi.org/10.1109/icams.2010.5552955?mailto=christian.hauschke@tib.eu,2010,article,True,0,Collaborative Networks in Manufacturing and Organizations,Social Sciences,Management of Technology and Innovation,,False,en,"Business, Management and Accounting",
https://openalex.org/W1555124694,Notice of Retraction: Prediction of regional economies based on the hybrid method of support vector machine and genetic algorithm,,0,https://doi.org/10.1109/iccet.2010.5485572,https://api.labs.crossref.org/works/https://doi.org/10.1109/iccet.2010.5485572?mailto=christian.hauschke@tib.eu,2010,article,True,0,Spatial Shift-Share Analysis in Economic Development,Social Sciences,Economics and Econometrics,,False,en,"Economics, Econometrics and Finance",
https://openalex.org/W1555147818,Notice of Retraction: Electronic Service Delivery: Endeavor to improve the Government Innovation,,0,https://doi.org/10.1109/icams.2010.5553038,https://api.labs.crossref.org/works/https://doi.org/10.1109/icams.2010.5553038?mailto=christian.hauschke@tib.eu,2010,article,True,0,Evolution and Impact of E-Government Initiatives,Social Sciences,Political Science and International Relations,,False,en,Social Sciences,
https://openalex.org/W1555220066,Notice of Retraction: Efficient sub-optimal earliest deadline with local search job shop scheduling algorithm,,0,https://doi.org/10.1109/icams.2010.5552968,https://api.labs.crossref.org/works/https://doi.org/10.1109/icams.2010.5552968?mailto=christian.hauschke@tib.eu,2010,article,True,0,Scheduling Problems in Manufacturing Systems,Physical Sciences,Industrial and Manufacturing Engineering,,False,en,Engineering,
https://openalex.org/W1555334289,Notice of Retraction: The effect of Sargassum fusiforme polysaccharides on the functioning of erythrocyte membrane of S180 mice by affecting Ca<sup>2+</sup> channels,,0,https://doi.org/10.1109/esiat.2010.5568424,https://api.labs.crossref.org/works/https://doi.org/10.1109/esiat.2010.5568424?mailto=christian.hauschke@tib.eu,2010,article,True,0,Theory and Simulations of Polyelectrolytes in Solutions,Physical Sciences,Physical and Theoretical Chemistry,,False,en,Chemistry,
https://openalex.org/W1555517392,Notice of Retraction: The Study of Gray Ratio for Composable Model Based on Metamodel,,0,https://doi.org/10.1109/iciecs.2010.5678206,https://api.labs.crossref.org/works/https://doi.org/10.1109/iciecs.2010.5678206?mailto=christian.hauschke@tib.eu,2010,article,True,0,Intelligent Control System for Industrial Processes,Physical Sciences,Control and Systems Engineering,,False,en,Engineering,
https://openalex.org/W1555750722,"Notice of Retraction: Empirical Study on the Supply and Demand of Higher Education Students in Shandong Province Based on Grey Model GM (1, 1)",,0,https://doi.org/10.1109/etcs.2010.332,https://api.labs.crossref.org/works/https://doi.org/10.1109/etcs.2010.332?mailto=christian.hauschke@tib.eu,2010,article,True,0,Application of Grey System Theory in Forecasting,Social Sciences,Management Science and Operations Research,,False,en,Decision Sciences,
https://openalex.org/W1555752410,Notice of Retraction: Competitive Strength Evaluation of New Energy in Hebei Based on Entropy Weight and TOPSIS,,0,https://doi.org/10.1109/cicc-itoe.2010.36,https://api.labs.crossref.org/works/https://doi.org/10.1109/cicc-itoe.2010.36?mailto=christian.hauschke@tib.eu,2010,article,True,0,Ecological Assessment and Urban Development,Physical Sciences,Ecology,,False,en,Environmental Science,
https://openalex.org/W1556023191,Notice of Retraction: Primary exploration on the trend of business development in the construction of community at present,,0,https://doi.org/10.1109/esiat.2010.5567381,https://api.labs.crossref.org/works/https://doi.org/10.1109/esiat.2010.5567381?mailto=christian.hauschke@tib.eu,2010,article,True,0,Impact of Technology on Education and Training,Physical Sciences,Information Systems,,False,en,Computer Science,
https://openalex.org/W1556119651,Notice of Retraction: Robust design method in motion mechanism using inverse-proportional inertia weight quantum-behaved particle swarm algorithm,,0,https://doi.org/10.1109/iccsit.2010.5564597,https://api.labs.crossref.org/works/https://doi.org/10.1109/iccsit.2010.5564597?mailto=christian.hauschke@tib.eu,2010,article,True,0,Autofocusing in Microscopy and Photography,Physical Sciences,Media Technology,,False,en,Engineering,
https://openalex.org/W1556391826,Notice of Retraction: Applications of fuzzy judgment in analysis of materials,2010 Sixth International Conference on Natural Computation,0,https://doi.org/10.1109/icnc.2010.5582730,https://api.labs.crossref.org/works/https://doi.org/10.1109/icnc.2010.5582730?mailto=christian.hauschke@tib.eu,2010,article,True,0,Multi-Criteria Decision Making,Social Sciences,Management Science and Operations Research,,False,en,Decision Sciences,
https://openalex.org/W1556500705,Notice of Retraction: Numerical simulation on expanding of corrosive crack in RC structure,,0,https://doi.org/10.1109/iccasm.2010.5619105,https://api.labs.crossref.org/works/https://doi.org/10.1109/iccasm.2010.5619105?mailto=christian.hauschke@tib.eu,2010,article,True,0,Seismic Design and Analysis of Underground Structures,Physical Sciences,Civil and Structural Engineering,,False,en,Engineering,
https://openalex.org/W1556520257,Notice of Retraction: The study of the college counselor's Development Model and assessment index system in China,,0,https://doi.org/10.1109/iceit.2010.5607500,https://api.labs.crossref.org/works/https://doi.org/10.1109/iceit.2010.5607500?mailto=christian.hauschke@tib.eu,2010,article,True,0,Impact of Technology on Education and Training,Physical Sciences,Information Systems,,False,en,Computer Science,
https://openalex.org/W1556758385,Notice of Retraction: Apply data mining to predict teachers' position settlement: A case study of university,,0,https://doi.org/10.1109/iccsit.2010.5565186,https://api.labs.crossref.org/works/https://doi.org/10.1109/iccsit.2010.5565186?mailto=christian.hauschke@tib.eu,2010,article,True,0,Data Mining Techniques and Applications,Physical Sciences,Information Systems,,False,en,Computer Science,
https://openalex.org/W1556996957,Notice of Retraction: Application of Multi-Policy Data Stream Off-Line Analysis,,0,https://doi.org/10.1109/iciecs.2010.5678380,https://api.labs.crossref.org/works/https://doi.org/10.1109/iciecs.2010.5678380?mailto=christian.hauschke@tib.eu,2010,article,True,0,Data Stream Management Systems and Techniques,Physical Sciences,Computer Networks and Communications,,False,en,Computer Science,
