id,display_name,primary_location_display_name,cited_by_count,doi,crossref_call,publication_year,type,is_retracted,cited_by_percentile_year_min,primary_topic_display_name,primary_topic_domain_display_name,primary_topic_subfield_display_name,primary_location_source_host_organization_name,open_access_is_oa,language,primary_topic_field_display_name,update_nature
https://openalex.org/W3044328009,WITHDRAWN: Impact on Delayed Graft Function of the Renal Resistive Index in the Immediate Postoperative Period After Kidney Transplantation: A Cohort Analysis,Transplantation Proceedings,1,https://doi.org/10.1016/j.transproceed.2019.09.004,https://api.labs.crossref.org/works/https://doi.org/10.1016/j.transproceed.2019.09.004?mailto=christian.hauschke@tib.eu,2020,article,True,67,Kidney Transplantation,Health Sciences,Transplantation,Elsevier BV,False,en,Medicine,
https://openalex.org/W3044454159,"High-throughput sequencing in diagnostics and prevention of herpes simplex virus infection (Herpesviridae, Alphaherpesvirinae, Simplexvirus, Human alphaherpesvirus 1)",Voprosy virusologii,1,https://doi.org/10.36233/0507-4088-2020-65-3-126-131,https://api.labs.crossref.org/works/https://doi.org/10.36233/0507-4088-2020-65-3-126-131?mailto=christian.hauschke@tib.eu,2020,article,True,67,"Herpesviruses: Epidemiology, Pathogenesis, and Management",Health Sciences,Epidemiology,Central Research Institute for Epidemiology,True,en,Medicine,
https://openalex.org/W3044517272,RETRACTED: An invasive group A streptococcal infection outbreak: a community nursing experience,Journal of Infection Prevention,1,https://doi.org/10.1177/1757177420935634,https://api.labs.crossref.org/works/https://doi.org/10.1177/1757177420935634?mailto=christian.hauschke@tib.eu,2020,article,True,67,Global Burden of Group A Streptococcal Diseases,Health Sciences,"Public Health, Environmental and Occupational Health",SAGE Publishing,False,en,Medicine,
https://openalex.org/W3044846902,RETRACTED ARTICLE: Real time link quality based route selection and transmission in industrial Manet for improved QoS,Journal of Ambient Intelligence and Humanized Computing,1,https://doi.org/10.1007/s12652-020-02331-1,https://api.labs.crossref.org/works/https://doi.org/10.1007/s12652-020-02331-1?mailto=christian.hauschke@tib.eu,2020,article,True,67,Wireless Medium Access Control Protocols,Physical Sciences,Computer Networks and Communications,Springer Science+Business Media,False,en,Computer Science,
https://openalex.org/W3044960771,RETRACTED ARTICLE: Research on underwater flexible target recognition algorithm under non-uniform light,Intelligent Service Robotics,1,https://doi.org/10.1007/s11370-020-00331-w,https://api.labs.crossref.org/works/https://doi.org/10.1007/s11370-020-00331-w?mailto=christian.hauschke@tib.eu,2020,article,True,67,Image Enhancement Techniques,Physical Sciences,Computer Vision and Pattern Recognition,Springer Science+Business Media,False,en,Computer Science,
https://openalex.org/W3045137530,RETRACTED ARTICLE: MANET security routing protocols based on a machine learning technique (Raspberry PIs),Journal of Ambient Intelligence and Humanized Computing,1,https://doi.org/10.1007/s12652-020-02211-8,https://api.labs.crossref.org/works/https://doi.org/10.1007/s12652-020-02211-8?mailto=christian.hauschke@tib.eu,2020,article,True,67,Wireless Sensor Networks: Survey and Applications,Physical Sciences,Computer Networks and Communications,Springer Science+Business Media,False,en,Computer Science,
https://openalex.org/W3045303619,Nationwide response to air pollution: Environmental behavior model based on self-identity and social identity process,International Journal of Electrical Engineering Education,1,https://doi.org/10.1177/0020720920940604,https://api.labs.crossref.org/works/https://doi.org/10.1177/0020720920940604?mailto=christian.hauschke@tib.eu,2020,article,True,67,Factors Influencing Pro-environmental Behavior,Physical Sciences,"Management, Monitoring, Policy and Law",SAGE Publishing,False,en,Environmental Science,
https://openalex.org/W3045363432,Retracted article: Surface response methodology for optimizing the degradation kinetics and efficiency removal of sulfamethazine in a UV/S<sub>2</sub>O<sub>8</sub><sup>2−</sup> oxidation process,"Journal of Environmental Science And Health, Part A",1,https://doi.org/10.1080/10934529.2020.1797384,https://api.labs.crossref.org/works/https://doi.org/10.1080/10934529.2020.1797384?mailto=christian.hauschke@tib.eu,2020,article,True,67,Antibiotic Resistance in Aquatic Environments and Wastewater,Physical Sciences,Pollution,Taylor & Francis,False,en,Environmental Science,
https://openalex.org/W3045451238,WITHDRAWN: Review on nucleation catalysis of tetragonal D022 Al3Ti and L12 modified (Al1−xMex)3Ti intermetallic compounds for solidification of alpha-Al grains,Catalysis Today,1,https://doi.org/10.1016/j.cattod.2020.07.011,https://api.labs.crossref.org/works/https://doi.org/10.1016/j.cattod.2020.07.011?mailto=christian.hauschke@tib.eu,2020,article,True,67,Aluminium Alloys for Aerospace and Automotive Applications,Physical Sciences,Aerospace Engineering,Elsevier BV,True,en,Engineering,
https://openalex.org/W3045483004,RETRACTED ARTICLE: A porous Co(II)–MOF for selective C<sub>2</sub>H<sub>2</sub>/CO<sub>2</sub> separation and treatment activity on virus-induced COPD <i>via</i> reducing <i>tlr3</i> gene expression,Journal of Coordination Chemistry,1,https://doi.org/10.1080/00958972.2020.1786886,https://api.labs.crossref.org/works/https://doi.org/10.1080/00958972.2020.1786886?mailto=christian.hauschke@tib.eu,2020,article,True,67,Chemistry and Applications of Metal-Organic Frameworks,Physical Sciences,Inorganic Chemistry,Taylor & Francis,False,en,Chemistry,
https://openalex.org/W3045522170,RETRACTED: Teaching application of watercolor light color technique,International Journal of Electrical Engineering Education,1,https://doi.org/10.1177/0020720920936830,https://api.labs.crossref.org/works/https://doi.org/10.1177/0020720920936830?mailto=christian.hauschke@tib.eu,2020,article,True,67,Innovations in Visual Communication Design and Technology,Physical Sciences,Computer Graphics and Computer-Aided Design,SAGE Publishing,False,en,Computer Science,Retraction
https://openalex.org/W3045535855,RETRACTED ARTICLE: Secure cubic dimension acoustic and routing in acoustic sensor network,Journal of Ambient Intelligence and Humanized Computing,1,https://doi.org/10.1007/s12652-020-02397-x,https://api.labs.crossref.org/works/https://doi.org/10.1007/s12652-020-02397-x?mailto=christian.hauschke@tib.eu,2020,article,True,67,Real-time Water Quality Monitoring and Aquaculture Management,Physical Sciences,Water Science and Technology,Springer Science+Business Media,False,en,Environmental Science,Retraction;Crossmark Retraction
https://openalex.org/W3045575269,Evaluation of maker space index system based on machine learning and intelligent interactive system,Journal of Intelligent and Fuzzy Systems,1,https://doi.org/10.3233/jifs-189068,https://api.labs.crossref.org/works/https://doi.org/10.3233/jifs-189068?mailto=christian.hauschke@tib.eu,2020,article,True,67,Smart Technology and Data Analytics Applications,Physical Sciences,Information Systems,IOS Press,False,en,Computer Science,Retraction
https://openalex.org/W3045609497,Ergonomics of work space: Changing dynamics on OCRA evaluation and work aids,International Journal of Electrical Engineering Education,1,https://doi.org/10.1177/0020720920940592,https://api.labs.crossref.org/works/https://doi.org/10.1177/0020720920940592?mailto=christian.hauschke@tib.eu,2020,article,True,67,Global Burden of Chronic Pain,Health Sciences,Pharmacology,SAGE Publishing,False,en,Medicine,Retraction
https://openalex.org/W3045846088,Retracted: Gender Differences in Alcohol Treatment,Alcohol and Alcoholism,1,https://doi.org/10.1093/alcalc/agaa071,https://api.labs.crossref.org/works/https://doi.org/10.1093/alcalc/agaa071?mailto=christian.hauschke@tib.eu,2020,article,True,67,Epidemiology and Interventions for Substance Use Disorders,Health Sciences,Epidemiology,Oxford University Press,True,en,Medicine,Retraction
https://openalex.org/W3046008455,RETRACTED ARTICLE: A New Coordination Polymer Based on Two Dual-Functional Ligands: Structural Insights and Treatment Effect Against Inflammatory Metrorrhagia by Inhibiting NF-κb Activation and IL-1β Release,Journal of Structural Chemistry,1,https://doi.org/10.1134/s0022476620040101,https://api.labs.crossref.org/works/https://doi.org/10.1134/s0022476620040101?mailto=christian.hauschke@tib.eu,2020,article,True,67,Chemistry and Applications of Metal-Organic Frameworks,Physical Sciences,Inorganic Chemistry,Pleiades Publishing,False,en,Chemistry,Retraction
https://openalex.org/W3046711616,Recognition of English spoken stressed syllables based on natural language processing and endpoint detection algorithm,Journal of Intelligent and Fuzzy Systems,1,https://doi.org/10.3233/jifs-189049,https://api.labs.crossref.org/works/https://doi.org/10.3233/jifs-189049?mailto=christian.hauschke@tib.eu,2020,article,True,67,Artificial Intelligence in Education and Technology,Physical Sciences,Artificial Intelligence,IOS Press,False,en,Computer Science,Retraction
https://openalex.org/W3046754511,RETRACTED ARTICLE: Protecting user profile based on attribute-based encryption using multilevel access security by restricting unauthorization in the cloud environment,Journal of Ambient Intelligence and Humanized Computing,1,https://doi.org/10.1007/s12652-020-02400-5,https://api.labs.crossref.org/works/https://doi.org/10.1007/s12652-020-02400-5?mailto=christian.hauschke@tib.eu,2020,article,True,67,Security Challenges in Cloud Computing,Physical Sciences,Information Systems,Springer Science+Business Media,False,en,Computer Science,Retraction;Crossmark Retraction
https://openalex.org/W3046948742,"RETRACTED ARTICLE: RINT1 is a new suppression target to reduce colon cancer cell growth, migration and invasion through regulating ZW10/NAG-1 expression",Molecular and Cellular Biochemistry,1,https://doi.org/10.1007/s11010-020-03858-9,https://api.labs.crossref.org/works/https://doi.org/10.1007/s11010-020-03858-9?mailto=christian.hauschke@tib.eu,2020,article,True,67,Role of Growth Factors in Health and Disease,Health Sciences,Rheumatology,Springer Science+Business Media,True,en,Medicine,Retraction;Crossmark Retraction
https://openalex.org/W3047119237,RETRACTED ARTICLE: A various soft tissue evaluation of the patients treated by nanocoating orthodontic arch-wires: perceptions in lateral profile photographs and lateral cephalometric radiograps,Journal of Nanoparticle Research,1,https://doi.org/10.1007/s11051-020-04930-7,https://api.labs.crossref.org/works/https://doi.org/10.1007/s11051-020-04930-7?mailto=christian.hauschke@tib.eu,2020,article,True,67,Orthodontic Research and Treatment,Health Sciences,Orthodontics,Springer Science+Business Media,False,en,Dentistry,Retraction
https://openalex.org/W3047323501,RETRACTED: Influence of negative corona discharge on the Zeta potential of diesel particles,Science Progress,1,https://doi.org/10.1177/0036850420946164,https://api.labs.crossref.org/works/https://doi.org/10.1177/0036850420946164?mailto=christian.hauschke@tib.eu,2020,article,True,67,Modern Electrostatic Gas Cleaning Technologies and Methods,Physical Sciences,Electrical and Electronic Engineering,SAGE Publishing,True,en,Engineering,Retraction
https://openalex.org/W3047440740,RETRACTED: Proof in the Science of the Criminal Process in Ukraine: Conceptual Approaches to Understanding the Essence,International Journal of Offender Therapy and Comparative Criminology,1,https://doi.org/10.1177/0306624x20946924,https://api.labs.crossref.org/works/https://doi.org/10.1177/0306624x20946924?mailto=christian.hauschke@tib.eu,2020,article,True,67,Legal Regulation in Global Society,Social Sciences,Political Science and International Relations,SAGE Publishing,False,en,Social Sciences,Retraction
https://openalex.org/W3047485847,Retracted: Two New Co(II) Coordination Polymers: Photocatalytic Properties and Treatment Activity on Sepsis by Reducing TNF‐α and IL‐1β Releasing,ChemistrySelect,1,https://doi.org/10.1002/slct.202001746,https://api.labs.crossref.org/works/https://doi.org/10.1002/slct.202001746?mailto=christian.hauschke@tib.eu,2020,article,True,67,Chemistry and Applications of Metal-Organic Frameworks,Physical Sciences,Inorganic Chemistry,Wiley-Blackwell,False,en,Chemistry,
https://openalex.org/W3047770972,Pharmacist-Led Discharge Medication Counseling and its Corresponding Impact on Medication Adherence and Hospital Readmission Rates,Innovations in pharmacy,1,https://doi.org/10.24926/iip.v11i3.3352,https://api.labs.crossref.org/works/https://doi.org/10.24926/iip.v11i3.3352?mailto=christian.hauschke@tib.eu,2020,article,True,67,Improving Patient Adherence to Medication Regimens,Health Sciences,Family Practice,University of Minnesota Libraries Publishing,True,en,Medicine,Retraction
https://openalex.org/W3047813066,RETRACTED ARTICLE: Classification based on underwater degradation using neural network,Journal of Ambient Intelligence and Humanized Computing,1,https://doi.org/10.1007/s12652-020-02437-6,https://api.labs.crossref.org/works/https://doi.org/10.1007/s12652-020-02437-6?mailto=christian.hauschke@tib.eu,2020,article,True,67,Real-time Water Quality Monitoring and Aquaculture Management,Physical Sciences,Water Science and Technology,Springer Science+Business Media,False,en,Environmental Science,Retraction;Crossmark Retraction
https://openalex.org/W3048032436,RETRACTED: The location tracking and intelligent street lighting control system based on the RFID and Zigbee for energy efficiency,International Journal of Electrical Engineering Education,1,https://doi.org/10.1177/0020720920944441,https://api.labs.crossref.org/works/https://doi.org/10.1177/0020720920944441?mailto=christian.hauschke@tib.eu,2020,article,True,67,Smart Vehicle Safety and Monitoring Systems,Physical Sciences,Mechanical Engineering,SAGE Publishing,False,en,Engineering,Retraction;Expression of concern
https://openalex.org/W3048097892,Wiener filter based deep convolutional network approach for classification of satellite images,Journal of Ambient Intelligence and Humanized Computing,1,https://doi.org/10.1007/s12652-020-02410-3,https://api.labs.crossref.org/works/https://doi.org/10.1007/s12652-020-02410-3?mailto=christian.hauschke@tib.eu,2020,article,True,67,Hyperspectral Image Analysis and Classification,Physical Sciences,Media Technology,Springer Science+Business Media,False,en,Engineering,Retraction;Crossmark Retraction
https://openalex.org/W3048187528,Retraction of “Nanogold and Multiwalled Carbon Nanotubes Composited Electrode for Phosphate Detection by Measuring the Oxygen Activity of Manganese Oxides”,Environmental Science & Technology,1,https://doi.org/10.1021/acs.est.0c01643,https://api.labs.crossref.org/works/https://doi.org/10.1021/acs.est.0c01643?mailto=christian.hauschke@tib.eu,2020,article,True,67,Electrochemical Biosensor Technology,Physical Sciences,Electrical and Electronic Engineering,American Chemical Society,True,en,Engineering,Retraction
https://openalex.org/W3048368835,Optimal Stocking Density of Vannamei Shrimp Lytopenaeus Vannamei at Low Salinity Using Spherical Tarpaulin Pond,IOP Conference Series: Earth and Environmental Science,1,https://doi.org/10.1088/1755-1315/537/1/012041,https://api.labs.crossref.org/works/https://doi.org/10.1088/1755-1315/537/1/012041?mailto=christian.hauschke@tib.eu,2020,article,True,67,Life History and Ecology of Seahorses,Life Sciences,Aquatic Science,IOP Publishing,True,en,Agricultural and Biological Sciences,Retraction
https://openalex.org/W3049166594,RETRACTED: Construction of an excellent eco-friendly anti-corrosion system based on epoxy@Sm2O3-polydopamine biopolymer on the mild steel surface,Journal of the Taiwan Institute of Chemical Engineers,1,https://doi.org/10.1016/j.jtice.2020.07.016,https://api.labs.crossref.org/works/https://doi.org/10.1016/j.jtice.2020.07.016?mailto=christian.hauschke@tib.eu,2020,article,True,67,Corrosion Inhibitors and Protection Mechanisms,Physical Sciences,Materials Chemistry,Elsevier BV,False,en,Materials Science,Crossmark Retraction
https://openalex.org/W3049225985,Three-dimensional numerical simulation of the straight shale cutting process of single polycrystalline diamond cutter,Arabian Journal of Geosciences,1,https://doi.org/10.1007/s12517-020-05768-y,https://api.labs.crossref.org/works/https://doi.org/10.1007/s12517-020-05768-y?mailto=christian.hauschke@tib.eu,2020,article,True,67,Prediction of Tunnel Boring Machine Performance,Physical Sciences,Civil and Structural Engineering,Springer Science+Business Media,False,en,Engineering,Expression of concern
https://openalex.org/W3049685304,RETRACTED: Two metal-organic frameworks for selective C2H2/CO2 separation and exert therapeutic effect on postpartum hemorrhage by increasing the prothrombin activity,Journal of Solid State Chemistry,1,https://doi.org/10.1016/j.jssc.2020.121629,https://api.labs.crossref.org/works/https://doi.org/10.1016/j.jssc.2020.121629?mailto=christian.hauschke@tib.eu,2020,article,True,67,Chemistry and Applications of Metal-Organic Frameworks,Physical Sciences,Inorganic Chemistry,Elsevier BV,False,en,Chemistry,Crossmark Retraction
https://openalex.org/W3050259234,"Accounting for indirect protection in the benefit–risk ratio estimation of rotavirus vaccination in children under the age of 5 years, France, 2018",Eurosurveillance,1,https://doi.org/10.2807/1560-7917.es.2020.25.33.1900538,https://api.labs.crossref.org/works/https://doi.org/10.2807/1560-7917.es.2020.25.33.1900538?mailto=christian.hauschke@tib.eu,2020,article,True,67,Gastrointestinal Viral Infections and Vaccines Development,Health Sciences,Infectious Diseases,European Centre for Disease Prevention and Control,True,en,Medicine,Correction;Expression of concern
https://openalex.org/W3051525836,RETRACTED: Research on 3D Animation Design Based on VR Technology,Journal of Physics: Conference Series,1,https://doi.org/10.1088/1742-6596/1607/1/012016,https://api.labs.crossref.org/works/https://doi.org/10.1088/1742-6596/1607/1/012016?mailto=christian.hauschke@tib.eu,2020,article,True,67,Innovations in Visual Communication Design and Technology,Physical Sciences,Computer Graphics and Computer-Aided Design,IOP Publishing,True,en,Computer Science,Retraction
https://openalex.org/W3051924121,<b><i>Retracted:</i></b> Cell Fate and Tissue Remodeling in Canine Urethral Repair Using a Bone Marrow Mesenchymal Stem Cell+Endothelial Progenitor Cell Amniotic Patch,Tissue Engineering Part A,1,https://doi.org/10.1089/ten.tea.2020.0129,https://api.labs.crossref.org/works/https://doi.org/10.1089/ten.tea.2020.0129?mailto=christian.hauschke@tib.eu,2020,article,True,67,Tissue Engineering and Regenerative Medicine,Health Sciences,Surgery,"Mary Ann Liebert, Inc.",False,en,Medicine,Retraction
https://openalex.org/W3059598080,Preclinical assessment of Tc-99m labeled Nano colloid Liposomes as an Effective Blood Pool Radiopharmaceutical.,Egyptian Journal of Nuclear Medicine,1,https://doi.org/10.21608/egyjnm.2020.106695,https://api.labs.crossref.org/works/https://doi.org/10.21608/egyjnm.2020.106695?mailto=christian.hauschke@tib.eu,2020,article,True,67,Development and Applications of Radiopharmaceuticals,Health Sciences,"Radiology, Nuclear Medicine and Imaging",,True,en,Medicine,Retraction
https://openalex.org/W3060783421,RETRACTED: Reflections on the Development of Rural E-commerce and the Cultivation of Professional Farmers in the Era of New Media,Journal of Physics: Conference Series,1,https://doi.org/10.1088/1742-6596/1601/5/052001,https://api.labs.crossref.org/works/https://doi.org/10.1088/1742-6596/1601/5/052001?mailto=christian.hauschke@tib.eu,2020,article,True,67,Drivers and Impediments for Cross-Border E-Commerce,Social Sciences,Business and International Management,IOP Publishing,True,en,"Business, Management and Accounting",Retraction
https://openalex.org/W3080204718,Reconstructing the Dynamic Processes of the Taimali Landslide in Taiwan Using the Waveform Inversion Method,Applied sciences,1,https://doi.org/10.3390/app10175872,https://api.labs.crossref.org/works/https://doi.org/10.3390/app10175872?mailto=christian.hauschke@tib.eu,2020,article,True,67,Landslide Hazards and Risk Assessment,Physical Sciences,"Management, Monitoring, Policy and Law",Multidisciplinary Digital Publishing Institute,True,en,Environmental Science,Retraction
https://openalex.org/W3080361412,RETRACTED ARTICLE: Secondary treated wastewater of latex processing: reusing for irrigation or treatment by membrane filtration,Research on Chemical Intermediates,1,https://doi.org/10.1007/s11164-020-04244-2,https://api.labs.crossref.org/works/https://doi.org/10.1007/s11164-020-04244-2?mailto=christian.hauschke@tib.eu,2020,article,True,67,Advancements in Water Purification Technologies,Physical Sciences,Water Science and Technology,Springer Science+Business Media,False,en,Environmental Science,Retraction
https://openalex.org/W3080482532,RETRACTED: Management Innovations Research of the Logistics Enterprises Based on the Big Data Environment,Journal of Physics: Conference Series,1,https://doi.org/10.1088/1742-6596/1616/1/012010,https://api.labs.crossref.org/works/https://doi.org/10.1088/1742-6596/1616/1/012010?mailto=christian.hauschke@tib.eu,2020,article,True,67,Drivers and Impediments for Cross-Border E-Commerce,Social Sciences,Business and International Management,IOP Publishing,True,en,"Business, Management and Accounting",Retraction
https://openalex.org/W3080488775,RETRACTED: Evaluation of citizen Education of Citizen’s Green Development View based on big data,International Journal of Electrical Engineering Education,1,https://doi.org/10.1177/0020720920940608,https://api.labs.crossref.org/works/https://doi.org/10.1177/0020720920940608?mailto=christian.hauschke@tib.eu,2020,article,True,67,Computational Thinking in Education,Physical Sciences,Computer Science Applications,SAGE Publishing,False,en,Computer Science,Retraction
https://openalex.org/W3080603469,Synthesis of cubic boron nitride diffused-D2 steel surface composite by thermo-chemical diffusion process to enhance the wear resistance,Materials Research Express,1,https://doi.org/10.1088/2053-1591/abb10e,https://api.labs.crossref.org/works/https://doi.org/10.1088/2053-1591/abb10e?mailto=christian.hauschke@tib.eu,2020,article,True,67,Mechanical Properties of Thin Film Coatings,Physical Sciences,Mechanics of Materials,IOP Publishing,True,en,Engineering,Retraction
https://openalex.org/W3080786894,RETRACTED ARTICLE: Approach towards problem solving on single machine scheduling with unequal release dates and learning effect,INFOR: Information Systems and Operational Research,1,https://doi.org/10.1080/03155986.2020.1807243,https://api.labs.crossref.org/works/https://doi.org/10.1080/03155986.2020.1807243?mailto=christian.hauschke@tib.eu,2020,article,True,67,Scheduling Problems in Manufacturing Systems,Physical Sciences,Industrial and Manufacturing Engineering,Taylor & Francis,False,en,Engineering,Retraction
https://openalex.org/W3080895065,REMOVED: VitSeg: Weakly supervised vitiligo segmentation in skin image,Computerized Medical Imaging and Graphics,1,https://doi.org/10.1016/j.compmedimag.2020.101779,https://api.labs.crossref.org/works/https://doi.org/10.1016/j.compmedimag.2020.101779?mailto=christian.hauschke@tib.eu,2020,article,True,67,Melanin Pigmentation in Mammalian Skin,Life Sciences,Cell Biology,Elsevier BV,False,en,"Biochemistry, Genetics and Molecular Biology",Retraction
https://openalex.org/W3081096924,RETRACTED ARTICLE: Speech big data cluster modeling based on joint neural network and Spark-SVM with evolutionary intelligence,Evolutionary Intelligence,1,https://doi.org/10.1007/s12065-020-00462-0,https://api.labs.crossref.org/works/https://doi.org/10.1007/s12065-020-00462-0?mailto=christian.hauschke@tib.eu,2020,article,True,67,Dynamics of Urban Structure through Spatial Network Analysis,Social Sciences,Urban Studies,Springer Science+Business Media,False,en,Social Sciences,Retraction;Crossmark Retraction
https://openalex.org/W3081780875,RETRACTED ARTICLE: Residual effect of two chemical insecticides on functional response of Habrobracon hebetor say (Hymenoptera: Braconidae) to Ephestia kuehniella Zeller (Lepidoptera: Pyralidae),International Journal of Tropical Insect Science,1,https://doi.org/10.1007/s42690-020-00245-1,https://api.labs.crossref.org/works/https://doi.org/10.1007/s42690-020-00245-1?mailto=christian.hauschke@tib.eu,2020,article,True,67,Botanical Insecticides in Agriculture and Pest Management,Life Sciences,Plant Science,Springer Nature,True,en,Agricultural and Biological Sciences,Crossmark Retraction
https://openalex.org/W3081907017,Multiobject Detection Algorithm Based on Adaptive Default Box Mechanism,Complexity,1,https://doi.org/10.1155/2020/5763476,https://api.labs.crossref.org/works/https://doi.org/10.1155/2020/5763476?mailto=christian.hauschke@tib.eu,2020,article,True,67,Deep Learning in Computer Vision and Image Recognition,Physical Sciences,Computer Vision and Pattern Recognition,Hindawi Publishing Corporation,True,en,Computer Science,Retraction
https://openalex.org/W3082242459,RETRACTED ARTICLE: Topic flexible aspect based sentiment analysis using minimum spanning tree with Cuckoo search,Journal of Ambient Intelligence and Humanized Computing,1,https://doi.org/10.1007/s12652-020-02416-x,https://api.labs.crossref.org/works/https://doi.org/10.1007/s12652-020-02416-x?mailto=christian.hauschke@tib.eu,2020,article,True,67,Sentiment Analysis and Opinion Mining,Physical Sciences,Artificial Intelligence,Springer Science+Business Media,False,en,Computer Science,Retraction;Crossmark Retraction
