id,display_name,primary_location_display_name,cited_by_count,doi,crossref_call,publication_year,type,is_retracted,cited_by_percentile_year_min,primary_topic_display_name,primary_topic_domain_display_name,primary_topic_subfield_display_name,primary_location_source_host_organization_name,open_access_is_oa,language,primary_topic_field_display_name,update_nature
https://openalex.org/W2023182009,RETRACTED: Effects of immunotoxic activity of the major essential oil of<i>Angelica purpuraefolia</i>Chung against<i>Aedes aegypti</i>L,Immunopharmacology and Immunotoxicology,13,https://doi.org/10.3109/08923971003639493,https://api.labs.crossref.org/works/https://doi.org/10.3109/08923971003639493?mailto=christian.hauschke@tib.eu,2010,article,True,88,Botanical Insecticides in Agriculture and Pest Management,Life Sciences,Plant Science,Taylor & Francis,False,en,Agricultural and Biological Sciences,Retraction
https://openalex.org/W2044207925,"Localization of the supraorbital, infraorbital, and mental foramina using palpable, bony landmarks",Clinical Anatomy,13,https://doi.org/10.1002/ca.20923,https://api.labs.crossref.org/works/https://doi.org/10.1002/ca.20923?mailto=christian.hauschke@tib.eu,2010,article,True,88,Epidemiology and Management of Maxillofacial Trauma,Health Sciences,Surgery,Wiley,False,en,Medicine,Retraction
https://openalex.org/W2056935658,RETRACTED: Convergence of weighted sums for arrays of negatively dependent random variables and its applications,Journal of Statistical Planning and Inference,13,https://doi.org/10.1016/j.jspi.2010.02.021,https://api.labs.crossref.org/works/https://doi.org/10.1016/j.jspi.2010.02.021?mailto=christian.hauschke@tib.eu,2010,article,True,88,Modeling Risk in Insurance and Finance,Social Sciences,Management Science and Operations Research,Elsevier BV,True,en,Decision Sciences,Retraction
https://openalex.org/W2085169574,Mortality Resulting From Head Injury in Professional Boxing,Neurosurgery,13,https://doi.org/10.1227/01.neu.0000373207.04297.13,https://api.labs.crossref.org/works/https://doi.org/10.1227/01.neu.0000373207.04297.13?mailto=christian.hauschke@tib.eu,2010,article,True,88,Post-mortem Imaging Techniques and Applications,Health Sciences,"Radiology, Nuclear Medicine and Imaging",Lippincott Williams & Wilkins,False,en,Medicine,Retraction
https://openalex.org/W2093302710,"Synthetic<i>N</i>-Acetyl-<scp>d</scp>-glucosamine Based Fully Branched Tetrasaccharide, a Mimetic of the Endogenous Ligand for CD69, Activates CD69<sup>+</sup>Killer Lymphocytes upon Dimerization via a Hydrophilic Flexible Linker",Journal of Medicinal Chemistry,13,https://doi.org/10.1021/jm100055b,https://api.labs.crossref.org/works/https://doi.org/10.1021/jm100055b?mailto=christian.hauschke@tib.eu,2010,article,True,88,Natural Killer Cells in Immunity,Life Sciences,Immunology,American Chemical Society,False,en,Immunology and Microbiology,Retraction
https://openalex.org/W2119576805,Inhaled aerosol particle dosimetry in mice: A review,Inhalation Toxicology,13,https://doi.org/10.3109/08958378.2010.515624,https://api.labs.crossref.org/works/https://doi.org/10.3109/08958378.2010.515624?mailto=christian.hauschke@tib.eu,2010,article,True,88,Pulmonary Drug Delivery Techniques,Health Sciences,Pulmonary and Respiratory Medicine,Taylor & Francis,True,en,Medicine,Retraction
https://openalex.org/W2133093866,Surgical management of localised renal cell carcinoma,Cochrane Database of Systematic Reviews,13,https://doi.org/10.1002/14651858.cd006579.pub2,https://api.labs.crossref.org/works/https://doi.org/10.1002/14651858.cd006579.pub2?mailto=christian.hauschke@tib.eu,2010,reference-entry,True,88,Renal Cell Carcinoma,Health Sciences,Pulmonary and Respiratory Medicine,Cochrane,False,en,Medicine,Retraction
https://openalex.org/W2138618233,ErbB-Inhibitory Protein: A Modified Ectodomain of Epidermal Growth Factor Receptor Synergizes with Dasatinib to Inhibit Growth of Breast Cancer Cells,Molecular Cancer Therapeutics,13,https://doi.org/10.1158/1535-7163.mct-10-0019,https://api.labs.crossref.org/works/https://doi.org/10.1158/1535-7163.mct-10-0019?mailto=christian.hauschke@tib.eu,2010,article,True,88,HER2 Signaling in Breast Cancer Treatment,Health Sciences,Oncology,American Association for Cancer Research,True,en,Medicine,Correction
https://openalex.org/W2157574520,Regulation of resistin by cyclic mechanical stretch in cultured rat vascular smooth muscle cells,Clinical Science,13,https://doi.org/10.1042/cs20090155,https://api.labs.crossref.org/works/https://doi.org/10.1042/cs20090155?mailto=christian.hauschke@tib.eu,2010,article,True,88,Inflammation and Obesity-Related Metabolic Disorders,Health Sciences,Epidemiology,Portland Press,False,en,Medicine,Retraction
https://openalex.org/W2235760971,RETRACTED ARTICLE: Perspectives for the long-term penetration of new renewables in complex energy systems: the Italian scenario,"Environment, Development and Sustainability",13,https://doi.org/10.1007/s10668-010-9263-7,https://api.labs.crossref.org/works/https://doi.org/10.1007/s10668-010-9263-7?mailto=christian.hauschke@tib.eu,2010,article,True,88,Integration of Renewable Energy Systems in Power Grids,Physical Sciences,Electrical and Electronic Engineering,Springer Science+Business Media,False,en,Engineering,Retraction;Crossmark Retraction
https://openalex.org/W2259140478,RETRACTED: A role for plasma transforming growth factor-β and matrix metalloproteinases in aortic aneurysm surveillance in Marfan syndrome?,Atherosclerosis,13,https://doi.org/10.1016/j.atherosclerosis.2009.08.003,https://api.labs.crossref.org/works/https://doi.org/10.1016/j.atherosclerosis.2009.08.003?mailto=christian.hauschke@tib.eu,2010,article,True,88,Genetic and Molecular Studies of Connective Tissue Disorders,Life Sciences,Genetics,Elsevier BV,True,en,"Biochemistry, Genetics and Molecular Biology",Retraction
https://openalex.org/W2275050089,Notice of Retraction: Review of Smart Grid and its Development Prospect in Sichuan,,13,https://doi.org/10.1109/appeec.2010.5448788,https://api.labs.crossref.org/works/https://doi.org/10.1109/appeec.2010.5448788?mailto=christian.hauschke@tib.eu,2010,article,True,88,Energy Storage in Power Systems,Physical Sciences,Energy Engineering and Power Technology,,False,en,Energy,Retraction
https://openalex.org/W2607974,Schizophrenia treatment. Critical review on the drugs and mechanisms of action of antipsychotics.,PubMed,13,,https://api.labs.crossref.org/works/null?mailto=christian.hauschke@tib.eu,2010,article,True,88,Schizophrenia Research and Treatment,Health Sciences,Psychiatry and Mental health,National Institutes of Health,False,en,Medicine,
https://openalex.org/W55279346,RETRACTED ARTICLE: A Study on the percolation threshold of polyethylene matrix composites filled carbon powder,Electronic Materials Letters,13,https://doi.org/10.3365/eml.2010.06.065,https://api.labs.crossref.org/works/https://doi.org/10.3365/eml.2010.06.065?mailto=christian.hauschke@tib.eu,2010,article,True,88,Carbon Nanotubes and their Applications,Physical Sciences,Materials Chemistry,Springer Science+Business Media,False,en,Materials Science,Retraction;Crossmark Retraction
https://openalex.org/W1553760404,A novel approach to treat residual peridevice leakage after left-atrial appendage closure,Catheterization and Cardiovascular Interventions,12,https://doi.org/10.1002/ccd.23014,https://api.labs.crossref.org/works/https://doi.org/10.1002/ccd.23014?mailto=christian.hauschke@tib.eu,2013,article,True,88,Atrial Fibrillation,Health Sciences,Cardiology and Cardiovascular Medicine,Wiley,False,en,Medicine,Retraction
https://openalex.org/W1742498162,RETRACTED: EcPV2 DNA in equine squamous cell carcinomas and normal genital and ocular mucosa,Veterinary Microbiology,12,https://doi.org/10.1016/j.vetmic.2010.07.008,https://api.labs.crossref.org/works/https://doi.org/10.1016/j.vetmic.2010.07.008?mailto=christian.hauschke@tib.eu,2011,article,True,88,Human Papillomavirus and Cervical Cancer Epidemiology,Health Sciences,Epidemiology,Elsevier BV,True,en,Medicine,Retraction
https://openalex.org/W1914832065,"Retracted: S14G‐humanin inhibits Aβ1–42 fibril formation, disaggregates preformed fibrils, and protects against Aβ‐induced cytotoxicity <i>in vitro</i>",Journal of Peptide Science,12,https://doi.org/10.1002/psc.2484,https://api.labs.crossref.org/works/https://doi.org/10.1002/psc.2484?mailto=christian.hauschke@tib.eu,2013,article,True,88,Role of Growth Factors in Health and Disease,Health Sciences,Rheumatology,Wiley,False,en,Medicine,Retraction
https://openalex.org/W1965274612,Retracted: Administration of <scp>MS</scp>‐275 Improves Cognitive Performance and Reduces Cell Death Following Traumatic Brain Injury in Rats,CNS Neuroscience & Therapeutics,12,https://doi.org/10.1111/cns.12082,https://api.labs.crossref.org/works/https://doi.org/10.1111/cns.12082?mailto=christian.hauschke@tib.eu,2013,article,True,88,Management and Pathophysiology of Traumatic Brain Injury,Health Sciences,Neurology,Wiley,True,en,Medicine,Retraction
https://openalex.org/W1965629903,Hydrophilic Prodrug Approach for Reduced Pigment Binding and Enhanced Transscleral Retinal Delivery of Celecoxib,Molecular Pharmaceutics,12,https://doi.org/10.1021/mp2005164,https://api.labs.crossref.org/works/https://doi.org/10.1021/mp2005164?mailto=christian.hauschke@tib.eu,2012,article,True,88,Cyclooxygenase-2 Inhibitors in Inflammation and Cancer,Health Sciences,Pharmacology,American Chemical Society,True,en,Medicine,Retraction
https://openalex.org/W1966558503,Blockade of NKG2D Synergized With CTLA4-Ig in Promoting Long-Term Graft Survival in Murine Models of Cardiac Transplantation [RETRACTED],Transplantation,12,https://doi.org/10.1097/tp.0b013e31823ffce7,https://api.labs.crossref.org/works/https://doi.org/10.1097/tp.0b013e31823ffce7?mailto=christian.hauschke@tib.eu,2012,article,True,88,Natural Killer Cells in Immunity,Life Sciences,Immunology,Wolters Kluwer,True,en,Immunology and Microbiology,Retraction
https://openalex.org/W1973620762,Correlation of Electrocardiographic Changes and Myocardial Fibrosis in Patients With Hypertrophic Cardiomyopathy Detected by Cardiac Magnetic Resonance Imaging,Clinical Cardiology,12,https://doi.org/10.1002/clc.22062,https://api.labs.crossref.org/works/https://doi.org/10.1002/clc.22062?mailto=christian.hauschke@tib.eu,2012,article,True,88,Diagnosis and Management of Hypertrophic Cardiomyopathy,Health Sciences,Cardiology and Cardiovascular Medicine,Wiley,True,en,Medicine,Retraction
https://openalex.org/W1974021165,RETRACTED ARTICLE: Texture-guided volumetric deformation and visualization using 3D moving least squares,The Visual Computer,12,https://doi.org/10.1007/s00371-011-0635-2,https://api.labs.crossref.org/works/https://doi.org/10.1007/s00371-011-0635-2?mailto=christian.hauschke@tib.eu,2011,article,True,88,Computer Graphics and Visualization Techniques,Physical Sciences,Computer Graphics and Computer-Aided Design,Springer Science+Business Media,False,en,Computer Science,Retraction;Crossmark Retraction
https://openalex.org/W1977315729,Near-Deterministic Discrimination of All Bell States with Linear Optics,Physical Review Letters,12,https://doi.org/10.1103/physrevlett.107.080403,https://api.labs.crossref.org/works/https://doi.org/10.1103/physrevlett.107.080403?mailto=christian.hauschke@tib.eu,2011,article,True,88,Quantum Information and Computation,Physical Sciences,Artificial Intelligence,American Physical Society,True,en,Computer Science,Retraction
https://openalex.org/W1978878186,<i>Retracted:</i> Antitumor activity of human γδ <scp>T</scp> cells transducted with <scp>CD</scp>8 and with <scp>T</scp>‐cell receptors of tumor‐specific cytotoxic <scp>T</scp> lymphocytes,Cancer Science,12,https://doi.org/10.1111/j.1349-7006.2012.02337.x,https://api.labs.crossref.org/works/https://doi.org/10.1111/j.1349-7006.2012.02337.x?mailto=christian.hauschke@tib.eu,2012,article,True,88,Chimeric Antigen Receptor T Cell Therapy,Health Sciences,Oncology,Wiley-Blackwell,True,en,Medicine,Retraction
https://openalex.org/W1981890871,RETRACTED ARTICLE: Induced Chiral Smectic Phase in Mixtures of Mesogenic and Non-Mesogenic Compounds,Molecular Crystals and Liquid Crystals,12,https://doi.org/10.1080/15421406.2011.590358,https://api.labs.crossref.org/works/https://doi.org/10.1080/15421406.2011.590358?mailto=christian.hauschke@tib.eu,2011,article,True,88,Liquid Crystal Research,Physical Sciences,"Electronic, Optical and Magnetic Materials",Taylor & Francis,False,en,Materials Science,Expression of concern;Retraction
https://openalex.org/W1984004520,RETRACTED ARTICLE: Effect of lead pollution on soil microbiological index under spinach (Spinacia oleracea L.) cultivation,Journal of Soils and Sediments,12,https://doi.org/10.1007/s11368-013-0802-3,https://api.labs.crossref.org/works/https://doi.org/10.1007/s11368-013-0802-3?mailto=christian.hauschke@tib.eu,2013,article,True,88,Environmental Impact of Heavy Metal Contamination,Physical Sciences,Pollution,Springer Science+Business Media,False,en,Environmental Science,Expression of concern;Retraction
https://openalex.org/W1990476653,RETRACTED: Piceatannol suppresses endotoxin-induced ocular inflammation in rats,International Immunopharmacology,12,https://doi.org/10.1016/j.intimp.2013.07.007,https://api.labs.crossref.org/works/https://doi.org/10.1016/j.intimp.2013.07.007?mailto=christian.hauschke@tib.eu,2013,article,True,88,Epidemiology and Management of Ocular Inflammatory Diseases,Health Sciences,Ophthalmology,Elsevier BV,True,en,Medicine,Retraction;Crossmark Retraction
https://openalex.org/W1991502359,Vitamin D reduces falls and hip fractures in vascular Parkinsonism but not in Parkinson&amp;rsquo;s disease,Therapeutics and Clinical Risk Management,12,https://doi.org/10.2147/tcrm.s43811,https://api.labs.crossref.org/works/https://doi.org/10.2147/tcrm.s43811?mailto=christian.hauschke@tib.eu,2013,article,True,88,Pathophysiology of Parkinson's Disease,Health Sciences,Neurology,Dove Medical Press,True,en,Medicine,Retraction;Expression of concern
https://openalex.org/W1995908416,Application of the (<i>G′/G</i>)-expansion method to nonlinear blood flow in large vessels,Physica Scripta,12,https://doi.org/10.1088/0031-8949/83/04/045803,https://api.labs.crossref.org/works/https://doi.org/10.1088/0031-8949/83/04/045803?mailto=christian.hauschke@tib.eu,2011,article,True,88,Rogue Waves in Nonlinear Systems,Physical Sciences,Statistical and Nonlinear Physics,IOP Publishing,False,en,Physics and Astronomy,Retraction
https://openalex.org/W1996367914,Revisiting Hydrocephalus as a Model to Study Brain Resilience,Frontiers in Human Neuroscience,12,https://doi.org/10.3389/fnhum.2011.00181,https://api.labs.crossref.org/works/https://doi.org/10.3389/fnhum.2011.00181?mailto=christian.hauschke@tib.eu,2012,article,True,88,Brain Fluid Dynamics and Waste Clearance Mechanisms,Life Sciences,Cellular and Molecular Neuroscience,Frontiers Media,True,en,Neuroscience,Retraction
https://openalex.org/W1999479322,Adenoviral Gene Transfer of PLD1-D4 Enhances Insulin Sensitivity in Mice by Disrupting Phospholipase D1 Interaction with PED/PEA-15,PLOS ONE,12,https://doi.org/10.1371/journal.pone.0060555,https://api.labs.crossref.org/works/https://doi.org/10.1371/journal.pone.0060555?mailto=christian.hauschke@tib.eu,2013,article,True,88,Pancreatic Islet Dysfunction and Regeneration,Health Sciences,Surgery,Public Library of Science,True,en,Medicine,Expression of concern
https://openalex.org/W1999704477,<i>Retracted:</i> Muscles within muscles: a tensiomyographic and histochemical analysis of the normal human vastus medialis longus and vastus medialis obliquus muscles,Journal of Anatomy,12,https://doi.org/10.1111/joa.12045,https://api.labs.crossref.org/works/https://doi.org/10.1111/joa.12045?mailto=christian.hauschke@tib.eu,2013,article,True,88,Biomechanics of Running-Related Injuries,Physical Sciences,Biomedical Engineering,Wiley,True,en,Engineering,Retraction
https://openalex.org/W2006830214,RETRACTED ARTICLE: Controlling the properties of silver nanoparticles deposited on surfaces using supercritical carbon dioxide for surface-enhanced Raman spectroscopy,Journal of Nanoparticle Research,12,https://doi.org/10.1007/s11051-012-0836-2,https://api.labs.crossref.org/works/https://doi.org/10.1007/s11051-012-0836-2?mailto=christian.hauschke@tib.eu,2012,article,True,88,"Plasmonic Nanoparticles: Synthesis, Properties, and Applications",Physical Sciences,"Electronic, Optical and Magnetic Materials",Springer Science+Business Media,False,en,Materials Science,Retraction
https://openalex.org/W2007154530,"Fabrication of Tantalum and Nitrogen Codoped ZnO (Ta, N-ZnO) Thin Films Using the Electrospay: Twin Applications as an Excellent Transparent Electrode and a Field Emitter",ACS Applied Materials & Interfaces,12,https://doi.org/10.1021/am4003342,https://api.labs.crossref.org/works/https://doi.org/10.1021/am4003342?mailto=christian.hauschke@tib.eu,2013,article,True,88,Zinc Oxide Nanostructures,Physical Sciences,Materials Chemistry,American Chemical Society,False,en,Materials Science,Retraction
https://openalex.org/W2009763276,RETRACTED: Response of ship hull laminated plates to close proximity blast loads,Computational Materials Science,12,https://doi.org/10.1016/j.commatsci.2011.07.036,https://api.labs.crossref.org/works/https://doi.org/10.1016/j.commatsci.2011.07.036?mailto=christian.hauschke@tib.eu,2012,article,True,88,Progressive Collapse of Structures,Physical Sciences,Civil and Structural Engineering,Elsevier BV,False,en,Engineering,Retraction
https://openalex.org/W2011244647,Rtt107 Phosphorylation Promotes Localisation to DNA Double-Stranded Breaks (DSBs) and Recombinational Repair between Sister Chromatids,PLOS ONE,12,https://doi.org/10.1371/journal.pone.0020152,https://api.labs.crossref.org/works/https://doi.org/10.1371/journal.pone.0020152?mailto=christian.hauschke@tib.eu,2011,article,True,88,Molecular Mechanisms of DNA Damage Response,Life Sciences,Molecular Biology,Public Library of Science,True,en,"Biochemistry, Genetics and Molecular Biology",Retraction
https://openalex.org/W2017033407,SDR9C7 Promotes Lymph Node Metastases in Patients with Esophageal Squamous Cell Carcinoma,PLOS ONE,12,https://doi.org/10.1371/journal.pone.0052184,https://api.labs.crossref.org/works/https://doi.org/10.1371/journal.pone.0052184?mailto=christian.hauschke@tib.eu,2013,article,True,88,Protein Arginine Methylation in Mammals,Life Sciences,Molecular Biology,Public Library of Science,True,en,"Biochemistry, Genetics and Molecular Biology",Retraction
https://openalex.org/W2024297218,Retracted: The Relationship between Personality Traits and Sales Force Automation Usage: A Preliminary Study,Human Factors and Ergonomics in Manufacturing & Service Industries,12,https://doi.org/10.1002/hfm.20313,https://api.labs.crossref.org/works/https://doi.org/10.1002/hfm.20313?mailto=christian.hauschke@tib.eu,2012,article,True,88,Personality Traits and Their Impacts on Life Outcomes,Social Sciences,Clinical Psychology,Wiley-Blackwell,False,en,Psychology,Retraction
https://openalex.org/W2024370211,RETRACTED: Synthesis and antimicrobial activity of some new quinazolin-4(3H)-one derivatives,Journal of Saudi Chemical Society,12,https://doi.org/10.1016/j.jscs.2010.06.001,https://api.labs.crossref.org/works/https://doi.org/10.1016/j.jscs.2010.06.001?mailto=christian.hauschke@tib.eu,2011,article,True,88,Chemistry and Pharmacology of Quinazoline Compounds,Physical Sciences,Organic Chemistry,Elsevier BV,True,en,Chemistry,Retraction
https://openalex.org/W2024569186,Episodic Memory: A Comparative Approach,Frontiers in Behavioral Neuroscience,12,https://doi.org/10.3389/fnbeh.2013.00063,https://api.labs.crossref.org/works/https://doi.org/10.3389/fnbeh.2013.00063?mailto=christian.hauschke@tib.eu,2013,article,True,88,Neural Mechanisms of Memory Formation and Spatial Navigation,Life Sciences,Cognitive Neuroscience,Frontiers Media,True,en,Neuroscience,Retraction
https://openalex.org/W2029106298,RETRACTED: Graphene as excellent support for rapid and efficient near infrared-assisted triptic proteolysis,Colloids and Surfaces B: Biointerfaces,12,https://doi.org/10.1016/j.colsurfb.2012.11.040,https://api.labs.crossref.org/works/https://doi.org/10.1016/j.colsurfb.2012.11.040?mailto=christian.hauschke@tib.eu,2013,article,True,88,Biomedical Applications of Graphene Nanomaterials,Physical Sciences,Biomedical Engineering,Elsevier BV,False,en,Engineering,Retraction
https://openalex.org/W2031432337,RETRACTED: Anti-fibrotic cardio protective efficacy of aminoguanidine against streptozotocin induced cardiac fibrosis and high glucose induced collagen up regulation in cardiac fibroblasts,Chemico-Biological Interactions,12,https://doi.org/10.1016/j.cbi.2012.04.005,https://api.labs.crossref.org/works/https://doi.org/10.1016/j.cbi.2012.04.005?mailto=christian.hauschke@tib.eu,2012,article,True,88,Molecular Mechanisms of Cardiac Remodeling and Repair,Health Sciences,Cardiology and Cardiovascular Medicine,Elsevier BV,True,en,Medicine,Retraction
https://openalex.org/W2033318918,Evaluating UNMIT's Contribution to Establishing the Rule of Law in Timor-Leste,Asia Pacific Review,12,https://doi.org/10.1080/13439006.2013.788335,https://api.labs.crossref.org/works/https://doi.org/10.1080/13439006.2013.788335?mailto=christian.hauschke@tib.eu,2013,article,True,88,Local Turn in Peacebuilding and Resilience Governance,Social Sciences,Sociology and Political Science,Taylor & Francis,False,en,Social Sciences,Retraction
https://openalex.org/W2040154801,RETRACTED: Fabrication and electromagnetic characteristics of microwave absorbers containing Li0.35Zn0.3Fe2.35O4 micro-belts and nickel-coated carbon fibers,Journal of Magnetism and Magnetic Materials,12,https://doi.org/10.1016/j.jmmm.2013.06.017,https://api.labs.crossref.org/works/https://doi.org/10.1016/j.jmmm.2013.06.017?mailto=christian.hauschke@tib.eu,2013,article,True,88,Electromagnetic Interference Shielding and Materials,Physical Sciences,"Electronic, Optical and Magnetic Materials",Elsevier BV,False,en,Materials Science,Retraction;Crossmark Retraction
https://openalex.org/W2041672884,Retracted: Computer‐aided ergonomics and visualization for improving 3D display techniques,Human Factors and Ergonomics in Manufacturing & Service Industries,12,https://doi.org/10.1002/hfm.20298,https://api.labs.crossref.org/works/https://doi.org/10.1002/hfm.20298?mailto=christian.hauschke@tib.eu,2012,article,True,88,Ergonomics and Human Factors in Technology Use,Social Sciences,Social Psychology,Wiley-Blackwell,False,en,Psychology,Retraction
https://openalex.org/W2043394261,Somatostatin antagonist induces catalepsy in the aged rat,Psychopharmacology,12,https://doi.org/10.1007/s00213-012-2961-0,https://api.labs.crossref.org/works/https://doi.org/10.1007/s00213-012-2961-0?mailto=christian.hauschke@tib.eu,2012,article,True,88,Deep Brain Stimulation for Neurological Disorders,Health Sciences,Neurology,Springer Science+Business Media,False,en,Medicine,Expression of concern
https://openalex.org/W2044349239,RETRACTED ARTICLE: Hypermethylation of the 5′ CpG island of the p14ARF flanking exon 1β in human colorectal cancer displaying a restricted pattern of p53 overexpression concomitant with increased MDM2 expression,Clinical Epigenetics,12,https://doi.org/10.1186/1868-7083-4-9,https://api.labs.crossref.org/works/https://doi.org/10.1186/1868-7083-4-9?mailto=christian.hauschke@tib.eu,2012,article,True,88,Epigenetic Modifications and Their Functional Implications,Life Sciences,Molecular Biology,BioMed Central,True,en,"Biochemistry, Genetics and Molecular Biology",Retraction
https://openalex.org/W2044518493,Accuracy of noninvasive haemoglobin measurement by pulse oximetry depends on the type of infusion fluid,European Journal of Anaesthesiology,12,https://doi.org/10.1097/eja.0b013e3283592733,https://api.labs.crossref.org/works/https://doi.org/10.1097/eja.0b013e3283592733?mailto=christian.hauschke@tib.eu,2013,article,True,88,Optimization of Perioperative Fluid Therapy,Health Sciences,Surgery,Lippincott Williams & Wilkins,True,en,Medicine,Retraction
https://openalex.org/W2053036049,RETRACTED ARTICLE: Sequential clomiphene citrate/hMG versus hMG for ovulation induction in clomiphene citrate-resistant women,Archives of Gynecology and Obstetrics,12,https://doi.org/10.1007/s00404-012-2597-7,https://api.labs.crossref.org/works/https://doi.org/10.1007/s00404-012-2597-7?mailto=christian.hauschke@tib.eu,2012,article,True,88,Diagnosis and Management of Polycystic Ovary Syndrome,Health Sciences,Reproductive Medicine,Springer Science+Business Media,False,en,Medicine,Retraction;Expression of concern;Crossmark Retraction
https://openalex.org/W2063842872,RETRACTED ARTICLE: Predicting the effects of nanoparticles on early age compressive strength of ash-based geopolymers by artificial neural networks,Neural Computing and Applications,12,https://doi.org/10.1007/s00521-012-1085-0,https://api.labs.crossref.org/works/https://doi.org/10.1007/s00521-012-1085-0?mailto=christian.hauschke@tib.eu,2012,article,True,88,Geopolymer and Alternative Cementitious Materials,Physical Sciences,Civil and Structural Engineering,Springer Science+Business Media,False,en,Engineering,Retraction
https://openalex.org/W2064849221,The effect of aging on the DNA damage and repair capacity in 2BS cells undergoing oxidative stress,Molecular Biology Reports,12,https://doi.org/10.1007/s11033-011-0731-4,https://api.labs.crossref.org/works/https://doi.org/10.1007/s11033-011-0731-4?mailto=christian.hauschke@tib.eu,2011,article,True,88,Molecular Mechanisms of DNA Damage Response,Life Sciences,Molecular Biology,Springer Nature,False,en,"Biochemistry, Genetics and Molecular Biology",Expression of concern
