id,display_name,primary_location_display_name,cited_by_count,doi,crossref_call,publication_year,type,is_retracted,cited_by_percentile_year_min,primary_topic_display_name,primary_topic_domain_display_name,primary_topic_subfield_display_name,primary_location_source_host_organization_name,open_access_is_oa,language,primary_topic_field_display_name,update_nature
https://openalex.org/W2070692173,RETRACTED: ABO A MATLAB PACKAGE FOR ANISOTROPY-BASED PERFORMANCE ANALYSIS AND CONTROLLER DESIGN,IFAC Proceedings Volumes,0,https://doi.org/10.3182/20071017-3-br-2923.00029,https://api.labs.crossref.org/works/https://doi.org/10.3182/20071017-3-br-2923.00029?mailto=christian.hauschke@tib.eu,2007,article,True,0,Analysis and Design of Fractional Order Control Systems,Physical Sciences,Control and Systems Engineering,Elsevier BV,True,en,Engineering,
https://openalex.org/W2073181849,Notice of Violation of IEEE Publication Principles - A -5OdBc Spur 0.13μm CMOS Ring Oscillator PLL for DBS Satellite Receiver SOCs Using a Multi-Regulator Architecture,,0,https://doi.org/10.1109/rws.2007.351859,https://api.labs.crossref.org/works/https://doi.org/10.1109/rws.2007.351859?mailto=christian.hauschke@tib.eu,2007,article,True,0,Radio Frequency Integrated Circuit Design,Physical Sciences,Electrical and Electronic Engineering,,False,en,Engineering,
https://openalex.org/W2073727081,"Poly[aqua(2,2′-bipyridine)(μ<sub>3</sub>-pyridine-2,4-dicarboxylato)palladium(II)]",Acta Crystallographica Section E-structure Reports Online,0,https://doi.org/10.1107/s1600536807047575,https://api.labs.crossref.org/works/https://doi.org/10.1107/s1600536807047575?mailto=christian.hauschke@tib.eu,2007,article,True,0,Platinum-Based Cancer Chemotherapy,Health Sciences,Oncology,International Union of Crystallography,False,en,Medicine,
https://openalex.org/W2074631414,REMOVED: RBMK plants in the Soviet and Russian nuclear power industry,Nuclear Engineering and Design,0,https://doi.org/10.1016/j.nucengdes.2007.03.028,https://api.labs.crossref.org/works/https://doi.org/10.1016/j.nucengdes.2007.03.028?mailto=christian.hauschke@tib.eu,2007,article,True,0,Characterization and Behavior of Nuclear Graphite Materials,Physical Sciences,Materials Chemistry,Elsevier BV,True,en,Materials Science,
https://openalex.org/W2075529044,<i>Retracted:</i> Alteration of cystatin C in the cerebrospinal fluid of multiple sclerosis,Annals of Neurology,0,https://doi.org/10.1002/ana.20866,https://api.labs.crossref.org/works/https://doi.org/10.1002/ana.20866?mailto=christian.hauschke@tib.eu,2007,article,True,0,Blood-Brain Barrier and Neurovascular Interactions,Life Sciences,Neurology,Wiley,False,en,Neuroscience,
https://openalex.org/W2082323035,REMOVED ARTICLE: A STRUCTURAL EQUATION MODELING (SEM) OF PATIENT SATISFACTION AMONG ELDERLY PATIENTS IN HOSPITAL SETTINGS,Educational Gerontology,0,https://doi.org/10.1080/03601277.2012.661339,https://api.labs.crossref.org/works/https://doi.org/10.1080/03601277.2012.661339?mailto=christian.hauschke@tib.eu,2018,article,True,0,Factors Influencing Patient Satisfaction with Healthcare,Health Sciences,General Health Professions,Taylor & Francis,False,en,Health Professions,
https://openalex.org/W2086167267,RETRACTED: ALGORITHMIC AND SOFTWARE IMPLEMENTATION OF ANISOTROPY-BASED ANALYSIS AND CONTROLLER DESIGN PROBLEMS,IFAC Proceedings Volumes,0,https://doi.org/10.3182/20070829-3-ru-4911.00039,https://api.labs.crossref.org/works/https://doi.org/10.3182/20070829-3-ru-4911.00039?mailto=christian.hauschke@tib.eu,2007,article,True,0,Autonomous Aerial Refueling Systems for UAVs,Physical Sciences,Aerospace Engineering,Elsevier BV,True,en,Engineering,
https://openalex.org/W2087007277,WITHDRAWN: A new Basic Research Section in Fertility and Sterility,Fertility and Sterility,0,https://doi.org/10.1016/j.fertnstert.2007.01.068,https://api.labs.crossref.org/works/https://doi.org/10.1016/j.fertnstert.2007.01.068?mailto=christian.hauschke@tib.eu,2007,article,True,0,Impact of Assisted Reproductive Technology on Perinatal Outcomes,Health Sciences,"Pediatrics, Perinatology and Child Health",Elsevier BV,False,en,Medicine,
https://openalex.org/W2089075179,Article Withdrawn: GNARE: A Grid-based Server for the Analysis of User Submitted Genomes,Nucleic Acids Research,0,https://doi.org/10.1093/nar/gkm366,https://api.labs.crossref.org/works/https://doi.org/10.1093/nar/gkm366?mailto=christian.hauschke@tib.eu,2007,article,True,0,RNA Sequencing Data Analysis,Life Sciences,Molecular Biology,Oxford University Press,True,en,"Biochemistry, Genetics and Molecular Biology",
https://openalex.org/W2095252588,RETRACTED ARTICLE: A modified edge-oriented spatial interpolation algorithm for consecutive blocks error concealment,Journal of Electronics (China),0,https://doi.org/10.1007/s11767-005-0155-1,https://api.labs.crossref.org/works/https://doi.org/10.1007/s11767-005-0155-1?mailto=christian.hauschke@tib.eu,2007,article,True,0,Advancements in Video Coding Standards and Techniques,Physical Sciences,Signal Processing,Springer Nature,False,en,Computer Science,
https://openalex.org/W2097711166,Notice of Retraction: Research on the Relation between Execution and Competition of Municipal Construction Company: A Case Study,,0,https://doi.org/10.1109/wicom.2007.1035,https://api.labs.crossref.org/works/https://doi.org/10.1109/wicom.2007.1035?mailto=christian.hauschke@tib.eu,2007,article,True,0,Strategic Management and Organizational Leadership,Social Sciences,Strategy and Management,,False,en,"Business, Management and Accounting",
https://openalex.org/W2102903829,Notice of Retraction: Network Economic Management Calls for Fire-New Ideas,,0,https://doi.org/10.1109/wicom.2007.824,https://api.labs.crossref.org/works/https://doi.org/10.1109/wicom.2007.824?mailto=christian.hauschke@tib.eu,2007,article,True,0,Understanding Attitudes Towards Public Transport and Private Car,Social Sciences,Transportation,,False,en,Social Sciences,
https://openalex.org/W2103896784,Notice of Violation of IEEE Publication Principles - Single and Dual Loop Ring Oscillator Based Frequency Synthesizers for Broadband Tuner Applications,,0,https://doi.org/10.1109/rfic.2007.380870,https://api.labs.crossref.org/works/https://doi.org/10.1109/rfic.2007.380870?mailto=christian.hauschke@tib.eu,2007,article,True,0,Phase-Locked Loops in High-Speed Circuits,Physical Sciences,Electrical and Electronic Engineering,,False,en,Engineering,
https://openalex.org/W2119513724,Notice of Retraction: Analysis of Oratosquillaorator Age Composition,,0,https://doi.org/10.1109/icbbe.2007.330,https://api.labs.crossref.org/works/https://doi.org/10.1109/icbbe.2007.330?mailto=christian.hauschke@tib.eu,2007,article,True,0,Spatial Shift-Share Analysis in Economic Development,Social Sciences,Economics and Econometrics,,False,en,"Economics, Econometrics and Finance",
https://openalex.org/W2124086464,THIS ARTICLE HAS BEEN RETRACTED Modeling Responses of Leafy Spurge Dispersal to Control Strategies,Journal of Integrative Plant Biology,0,https://doi.org/10.1111/j.1744-7909.2007.00601.x,https://api.labs.crossref.org/works/https://doi.org/10.1111/j.1744-7909.2007.00601.x?mailto=christian.hauschke@tib.eu,2007,article,True,0,Biodiversity Conservation and Ecosystem Management,Physical Sciences,Nature and Landscape Conservation,Wiley-Blackwell,False,en,Environmental Science,
https://openalex.org/W2127571455,A New Method for the Treatment of Sperm Samples for Ultrastructural Study Based on the Use of Animal Tissues as Biological Containers,Microscopy Research and Technique,0,https://doi.org/10.1002/jemt.20466,https://api.labs.crossref.org/works/https://doi.org/10.1002/jemt.20466?mailto=christian.hauschke@tib.eu,2007,article,True,0,Male Reproductive Health,Health Sciences,Reproductive Medicine,Wiley-Blackwell,False,en,Medicine,
https://openalex.org/W2137633987,Notice of Violation of IEEE Publication Principles&lt;BR&gt;A Zero-Second-IF SiGe BiCMOS Satellite Radio Tuner Using a Single PLL for Both RF and IF LO Generation and a Replica Ring-VCO Calibrated IF Filter,,0,https://doi.org/10.1109/bipol.2007.4351825,https://api.labs.crossref.org/works/https://doi.org/10.1109/bipol.2007.4351825?mailto=christian.hauschke@tib.eu,2007,article,True,0,Radio Frequency Integrated Circuit Design,Physical Sciences,Electrical and Electronic Engineering,,False,en,Engineering,
https://openalex.org/W2139780121,Notice of Retraction: Professional Management: The Future of Knowledge Worker Boundaryless Career Management,,0,https://doi.org/10.1109/wicom.2007.1108,https://api.labs.crossref.org/works/https://doi.org/10.1109/wicom.2007.1108?mailto=christian.hauschke@tib.eu,2007,article,True,0,Dimensions and Applications of Employability in Higher Education,Social Sciences,Education,,False,en,Social Sciences,
https://openalex.org/W2141299027,Notice of Violation of IEEE Publication Principles - A 10GHz 0.11μm CMOS Varactor-less LC-VCO for Multi-Standard 802.11a/b/g WLAN Using High Resolution Frequency Calibration,,0,https://doi.org/10.1109/rws.2007.351799,https://api.labs.crossref.org/works/https://doi.org/10.1109/rws.2007.351799?mailto=christian.hauschke@tib.eu,2007,article,True,0,Radio Frequency Integrated Circuit Design,Physical Sciences,Electrical and Electronic Engineering,,False,en,Engineering,
https://openalex.org/W2148423495,Notice of Retraction: A Study on the Improvement of Human Capital Measurement and Management with Activity Based Costing,,0,https://doi.org/10.1109/wicom.2007.1093,https://api.labs.crossref.org/works/https://doi.org/10.1109/wicom.2007.1093?mailto=christian.hauschke@tib.eu,2007,article,True,0,Value-based Management and Economic Performance Measurement,Social Sciences,Strategy and Management,,False,en,"Business, Management and Accounting",
https://openalex.org/W2152990176,Notice of Retraction: Finding Borders Between Coding and Noncoding DNA Regions By β-KL Divergence,,0,https://doi.org/10.1109/icbbe.2007.77,https://api.labs.crossref.org/works/https://doi.org/10.1109/icbbe.2007.77?mailto=christian.hauschke@tib.eu,2007,article,True,0,Genomic Signal Processing and Analysis Techniques,Life Sciences,Molecular Biology,,False,en,"Biochemistry, Genetics and Molecular Biology",
https://openalex.org/W2155373422,Notice of Retraction: Medical Device and Supply Market: Market Success of Small Companies in Economic Recession,,0,https://doi.org/10.1109/wicom.2007.1196,https://api.labs.crossref.org/works/https://doi.org/10.1109/wicom.2007.1196?mailto=christian.hauschke@tib.eu,2007,article,True,0,Knowledge Management and Organizational Innovation,Social Sciences,Strategy and Management,,False,en,"Business, Management and Accounting",
https://openalex.org/W2156918899,Notice of Violation of IEEE Publication Principles A 3.3 V 12.5 Gb/s 0.2 m SiGe BiCMOS Laser Diode Driver Using Bias Current Modulation Cancellation,IEEE Journal of Solid-state Circuits,0,https://doi.org/10.1109/jssc.2007.905228,https://api.labs.crossref.org/works/https://doi.org/10.1109/jssc.2007.905228?mailto=christian.hauschke@tib.eu,2007,article,True,0,Nanoelectronics and Transistors,Physical Sciences,Electrical and Electronic Engineering,Institute of Electrical and Electronics Engineers,False,en,Engineering,
https://openalex.org/W2160088879,Notice of Retraction: Assessment of IFAD Project Sustainability For Rural Poverty Reduction in China,,0,https://doi.org/10.1109/wicom.2007.1291,https://api.labs.crossref.org/works/https://doi.org/10.1109/wicom.2007.1291?mailto=christian.hauschke@tib.eu,2007,article,True,0,Fuzzy Class Membership Modeling in Environmental Sciences,Physical Sciences,Ecological Modeling,,False,en,Environmental Science,
https://openalex.org/W2199443956,Notice of Retraction: The Foundation and Application of Basilar Membrane's Vibrant Model,,0,https://doi.org/10.1109/icbbe.2007.101,https://api.labs.crossref.org/works/https://doi.org/10.1109/icbbe.2007.101?mailto=christian.hauschke@tib.eu,2007,article,True,0,Underwater Acoustic Sensor Networks and Communication,Physical Sciences,Ocean Engineering,,False,en,Engineering,
https://openalex.org/W2209924325,Notice of Retraction: Study on Methods of Analysis and Classification for Pulse-Condition,,0,https://doi.org/10.1109/icbbe.2007.140,https://api.labs.crossref.org/works/https://doi.org/10.1109/icbbe.2007.140?mailto=christian.hauschke@tib.eu,2007,article,True,0,Artificial Intelligence and Expert Systems,Physical Sciences,Artificial Intelligence,,False,en,Computer Science,
https://openalex.org/W2226149529,"Oxalatobis(propane-1,3-diamine)manganese(II) chloride monohydrate",Acta Crystallographica Section E-structure Reports Online,0,https://doi.org/10.1107/s1600536807065361,https://api.labs.crossref.org/works/https://doi.org/10.1107/s1600536807065361?mailto=christian.hauschke@tib.eu,2007,article,True,0,Chemical Crystallography,Physical Sciences,Inorganic Chemistry,International Union of Crystallography,True,en,Chemistry,
https://openalex.org/W2267654661,"RETIRADO - ""Mais calculado para enganar do que para informar"": os viajantes e o mapeamento da América Central (1821-1945)",Varia História,0,https://doi.org/10.1590/s0104-87752007000100006,https://api.labs.crossref.org/works/https://doi.org/10.1590/s0104-87752007000100006?mailto=christian.hauschke@tib.eu,2007,article,True,0,Legal Personhood for Artificial Intelligences,Social Sciences,Political Science and International Relations,Federal University of Minas Gerais,True,pt,Social Sciences,
https://openalex.org/W2284947581,Notice of Retraction: A Fast Fingerprint Identification Pre-Processing Algorithm,,0,https://doi.org/10.1109/icbbe.2007.156,https://api.labs.crossref.org/works/https://doi.org/10.1109/icbbe.2007.156?mailto=christian.hauschke@tib.eu,2007,article,True,0,Biometric Recognition and Security Systems,Physical Sciences,Signal Processing,,False,en,Computer Science,
https://openalex.org/W2291355855,Notice of Retraction: Multiscale ART Algorithm and Its Application in Low-Does CT,,0,https://doi.org/10.1109/icbbe.2007.185,https://api.labs.crossref.org/works/https://doi.org/10.1109/icbbe.2007.185?mailto=christian.hauschke@tib.eu,2007,article,True,0,Positron Emission Tomography Imaging in Oncology,Health Sciences,"Radiology, Nuclear Medicine and Imaging",,False,en,Medicine,
https://openalex.org/W2340771826,Concentrating solutions for a planar elliptic problem with large nonlinear exponent and Robin boundary condition,Advances in Nonlinear Analysis,0,https://doi.org/10.1515/anona-2015-0153,https://api.labs.crossref.org/works/https://doi.org/10.1515/anona-2015-0153?mailto=christian.hauschke@tib.eu,2019,article,True,0,Fractional Laplacian Operators,Physical Sciences,Applied Mathematics,De Gruyter,True,en,Mathematics,
https://openalex.org/W2396682126,A single chain (scFv425):sTRAIL fusion protein with specificity for the EGF receptor is effective in vitro but not in an in vivo brain tumor animal model,Journal of Neuro-Oncology,0,https://doi.org/10.1007/s11060-006-9322-y,https://api.labs.crossref.org/works/https://doi.org/10.1007/s11060-006-9322-y?mailto=christian.hauschke@tib.eu,2007,article,True,0,Neuroblastoma Research and Treatment,Health Sciences,Neurology,Springer Science+Business Media,True,en,Medicine,
https://openalex.org/W2409764805,Retraction,Experimental Physiology,0,https://doi.org/10.1113/expphysiol.2007.037242,https://api.labs.crossref.org/works/https://doi.org/10.1113/expphysiol.2007.037242?mailto=christian.hauschke@tib.eu,2007,article,True,0,Exercise Physiology and Cardiovascular Health,Health Sciences,Complementary and alternative medicine,Wiley-Blackwell,True,en,Medicine,
https://openalex.org/W2470489473,Fournier's gangrene and its management at a tertiary care hospital.,PubMed,0,,https://api.labs.crossref.org/works/null?mailto=christian.hauschke@tib.eu,2007,article,True,0,Global Burden of Group A Streptococcal Diseases,Health Sciences,"Public Health, Environmental and Occupational Health",National Institutes of Health,False,en,Medicine,
https://openalex.org/W2473705119,<i>Poétique de la fuite. Parcours rimbaldiens</i>,Lettres romanes,0,https://doi.org/10.1484/j.llr.3.154,https://api.labs.crossref.org/works/https://doi.org/10.1484/j.llr.3.154?mailto=christian.hauschke@tib.eu,2007,article,True,0,Psychodynamic Psychotherapy and Developmental Trauma,Social Sciences,Clinical Psychology,Brepols,True,fr,Psychology,
https://openalex.org/W2514299395,Statement of Retraction,Mechanics of Advanced Materials and Structures,0,https://doi.org/10.1080/15376494.2016.1227502,https://api.labs.crossref.org/works/https://doi.org/10.1080/15376494.2016.1227502?mailto=christian.hauschke@tib.eu,2019,article,True,0,Physical Metallurgy of Shape Memory Alloys,Physical Sciences,Materials Chemistry,Taylor & Francis,True,en,Materials Science,
https://openalex.org/W2533194104,Notice of Retraction: A Tentative Study on Venture Capital Investment in China,,0,https://doi.org/10.1109/wicom.2007.993,https://api.labs.crossref.org/works/https://doi.org/10.1109/wicom.2007.993?mailto=christian.hauschke@tib.eu,2007,article,True,0,Venture Capital and Start-Up Financing,Social Sciences,Accounting,,False,en,"Business, Management and Accounting",
https://openalex.org/W2534908856,Notice of Retraction: P-O Fit as an Alternative Predictor of Employee Service Performance: Do Shared Cognitions Matter?,,0,https://doi.org/10.1109/wicom.2007.1611,https://api.labs.crossref.org/works/https://doi.org/10.1109/wicom.2007.1611?mailto=christian.hauschke@tib.eu,2007,article,True,0,"Customer Relationships, Behavior, and Loyalty",Social Sciences,Organizational Behavior and Human Resource Management,,False,en,"Business, Management and Accounting",
https://openalex.org/W2535152165,Notice of Retraction: An Analysis of Medium and Long-Term Effects of QFII System on Corporate Governance: Evidence from PLCs on China's Capital Market,,0,https://doi.org/10.1109/wicom.2007.978,https://api.labs.crossref.org/works/https://doi.org/10.1109/wicom.2007.978?mailto=christian.hauschke@tib.eu,2007,article,True,0,Corporate Governance and Financial Performance,Social Sciences,Accounting,,False,en,"Business, Management and Accounting",
https://openalex.org/W2536553022,Notice of Retraction: Managing Customer Services: Entrepreneurship in Hospitality Industry,,0,https://doi.org/10.1109/wicom.2007.1041,https://api.labs.crossref.org/works/https://doi.org/10.1109/wicom.2007.1041?mailto=christian.hauschke@tib.eu,2007,article,True,0,Entrepreneurship and Business Innovation,Social Sciences,Management of Technology and Innovation,,False,en,"Business, Management and Accounting",Retraction
https://openalex.org/W2536780036,Notice of Retraction: Official Interest Rate and Bond Excess Return in Chinese Bond Market,,0,https://doi.org/10.1109/wicom.2007.1001,https://api.labs.crossref.org/works/https://doi.org/10.1109/wicom.2007.1001?mailto=christian.hauschke@tib.eu,2007,article,True,0,Theory and Applications of Option Pricing Models,Social Sciences,Finance,,False,en,"Economics, Econometrics and Finance",Retraction
https://openalex.org/W2536827991,Notice of Retraction: Political Risks and MNCs' Misconducts in International Business,,0,https://doi.org/10.1109/wicom.2007.1129,https://api.labs.crossref.org/works/https://doi.org/10.1109/wicom.2007.1129?mailto=christian.hauschke@tib.eu,2007,article,True,0,International Business Strategy in Emerging Economies,Social Sciences,Strategy and Management,,False,en,"Business, Management and Accounting",Retraction
https://openalex.org/W2537384681,Notice of Retraction: Research &amp; Analysis on Problems and Innovation Countermeasures of the Property Company Service Management in China,,0,https://doi.org/10.1109/wicom.2007.1440,https://api.labs.crossref.org/works/https://doi.org/10.1109/wicom.2007.1440?mailto=christian.hauschke@tib.eu,2007,article,True,0,,,,,False,en,,Retraction
https://openalex.org/W2537742404,Notice of Retraction: Research of Chinese Oil Companies' Investment in Eurasia Region,,0,https://doi.org/10.1109/wicom.2007.976,https://api.labs.crossref.org/works/https://doi.org/10.1109/wicom.2007.976?mailto=christian.hauschke@tib.eu,2007,article,True,0,Information Systems Outsourcing and Offshoring,Social Sciences,Management Information Systems,,False,en,"Business, Management and Accounting",Retraction
https://openalex.org/W2537859644,Notice of Retraction: An Analysis on Influential Factors of Service Economy Development in Zhejiang Province,,0,https://doi.org/10.1109/wicom.2007.970,https://api.labs.crossref.org/works/https://doi.org/10.1109/wicom.2007.970?mailto=christian.hauschke@tib.eu,2007,article,True,0,Concept and Measurement of Regional Competitiveness,Social Sciences,Strategy and Management,,False,en,"Business, Management and Accounting",Retraction
https://openalex.org/W2538709454,Notice of Retraction: The Framework of Asset-Backed Securitization for Public Project,,0,https://doi.org/10.1109/wicom.2007.990,https://api.labs.crossref.org/works/https://doi.org/10.1109/wicom.2007.990?mailto=christian.hauschke@tib.eu,2007,article,True,0,Success Factors in Project Management,Social Sciences,Management Science and Operations Research,,False,en,Decision Sciences,Retraction
https://openalex.org/W2539491684,Notice of Retraction: Research on purchasing strategy based on supplier relationship,,0,https://doi.org/10.1109/wicom.2007.1168,https://api.labs.crossref.org/works/https://doi.org/10.1109/wicom.2007.1168?mailto=christian.hauschke@tib.eu,2007,article,True,0,Coordination and Information Sharing in Supply Chains,Social Sciences,Management Information Systems,,False,en,"Business, Management and Accounting",Retraction
https://openalex.org/W2539709800,Notice of Retraction: Explorations of Improvisational Learning in Innovation,,0,https://doi.org/10.1109/wicom.2007.1643,https://api.labs.crossref.org/works/https://doi.org/10.1109/wicom.2007.1643?mailto=christian.hauschke@tib.eu,2007,article,True,0,Knowledge Management and Organizational Innovation,Social Sciences,Strategy and Management,,False,en,"Business, Management and Accounting",Retraction
https://openalex.org/W2539710917,Notice of Retraction: Innovation Oriented Selection for Shanghai Business Process Outsourcing Industry,,0,https://doi.org/10.1109/wicom.2007.1560,https://api.labs.crossref.org/works/https://doi.org/10.1109/wicom.2007.1560?mailto=christian.hauschke@tib.eu,2007,article,True,0,Information Systems Outsourcing and Offshoring,Social Sciences,Management Information Systems,,False,en,"Business, Management and Accounting",Retraction
https://openalex.org/W2540660178,Notice of Retraction: Patent Attitude: Transferring from Supply-Orientation to Demand- Orientation,,0,https://doi.org/10.1109/wicom.2007.1442,https://api.labs.crossref.org/works/https://doi.org/10.1109/wicom.2007.1442?mailto=christian.hauschke@tib.eu,2007,article,True,0,Analysis of Intellectual Property Rights and Innovation,Social Sciences,Management of Technology and Innovation,,False,en,"Business, Management and Accounting",Retraction
https://openalex.org/W2541551151,Notice of Retraction: Model Parent-Child Relationships between Lines and Parcels,,0,https://doi.org/10.1109/wicom.2007.1393,https://api.labs.crossref.org/works/https://doi.org/10.1109/wicom.2007.1393?mailto=christian.hauschke@tib.eu,2007,article,True,0,Distributed Constraint Optimization Problems and Algorithms,Physical Sciences,Computer Networks and Communications,,False,en,Computer Science,Retraction
https://openalex.org/W2542323165,Notice of Retraction: The Marketing Effect and Revelation of the Price Catabolization of Premium Brand Product,,0,https://doi.org/10.1109/wicom.2007.1063,https://api.labs.crossref.org/works/https://doi.org/10.1109/wicom.2007.1063?mailto=christian.hauschke@tib.eu,2007,article,True,0,Consumer Behavior in Brand Consumption and Identification,Social Sciences,Marketing,,False,en,"Business, Management and Accounting",Retraction
https://openalex.org/W2543394358,"Notice of Retraction: Rents, Power and Rents: Thought to Gain Competitive Advantage in Global Value Chain",,0,https://doi.org/10.1109/wicom.2007.832,https://api.labs.crossref.org/works/https://doi.org/10.1109/wicom.2007.832?mailto=christian.hauschke@tib.eu,2007,article,True,0,Knowledge Management and Organizational Innovation,Social Sciences,Strategy and Management,,False,en,"Business, Management and Accounting",Retraction
https://openalex.org/W2543527770,Notice of Retraction: Service Quality Evaluation of the Third-Party Logistics,,0,https://doi.org/10.1109/wicom.2007.1616,https://api.labs.crossref.org/works/https://doi.org/10.1109/wicom.2007.1616?mailto=christian.hauschke@tib.eu,2007,article,True,0,Comprehensive Assessment of Safety in Energy and Infrastructure,Physical Sciences,"Safety, Risk, Reliability and Quality",,False,en,Engineering,Retraction
https://openalex.org/W2544432152,Notice of Retraction: Analysis of Financing Plan for Real Estate Development Project,,0,https://doi.org/10.1109/wicom.2007.980,https://api.labs.crossref.org/works/https://doi.org/10.1109/wicom.2007.980?mailto=christian.hauschke@tib.eu,2007,article,True,0,Value Management in Construction Industry,Social Sciences,Strategy and Management,,False,en,"Business, Management and Accounting",Retraction
https://openalex.org/W2545428404,Notice of Retraction: A Comprehensive Analysis of Strategic Factors for the Start-Up of New Business Based on PSED,,0,https://doi.org/10.1109/wicom.2007.986,https://api.labs.crossref.org/works/https://doi.org/10.1109/wicom.2007.986?mailto=christian.hauschke@tib.eu,2007,article,True,0,Entrepreneurship and Business Innovation,Social Sciences,Management of Technology and Innovation,,False,en,"Business, Management and Accounting",Retraction
