id,display_name,primary_location_display_name,cited_by_count,doi,crossref_call,publication_year,type,is_retracted,cited_by_percentile_year_min,primary_topic_display_name,primary_topic_domain_display_name,primary_topic_subfield_display_name,primary_location_source_host_organization_name,open_access_is_oa,language,primary_topic_field_display_name,update_nature
https://openalex.org/W2084362501,RETRACTED: Gemcitabine and γ-cyclodextrin/docetaxel inclusion complex-loaded liposome for highly effective combinational therapy of osteosarcoma,International Journal of Pharmaceutics,24,https://doi.org/10.1016/j.ijpharm.2014.11.052,https://api.labs.crossref.org/works/https://doi.org/10.1016/j.ijpharm.2014.11.052?mailto=christian.hauschke@tib.eu,2015,article,True,93,Mechanisms and Applications of RNA Interference,Life Sciences,Molecular Biology,Elsevier BV,True,en,"Biochemistry, Genetics and Molecular Biology",Retraction;Crossmark Retraction
https://openalex.org/W2088322140,Differentiation of Human Skeletal Muscle Stem Cells into Odontoblasts Is Dependent on Induction of α1 Integrin Expression,Journal of Biological Chemistry,24,https://doi.org/10.1074/jbc.m113.526772,https://api.labs.crossref.org/works/https://doi.org/10.1074/jbc.m113.526772?mailto=christian.hauschke@tib.eu,2014,article,True,93,Multipotent Mesenchymal Stem Cells,Health Sciences,Genetics,Elsevier BV,True,en,Medicine,Retraction
https://openalex.org/W2089216934,RETRACTED: Improvement mechanism of resistance random access memory with supercritical CO2 fluid treatment,The Journal of Supercritical Fluids,24,https://doi.org/10.1016/j.supflu.2013.09.002,https://api.labs.crossref.org/works/https://doi.org/10.1016/j.supflu.2013.09.002?mailto=christian.hauschke@tib.eu,2014,article,True,93,Atomic Layer Deposition Technology,Physical Sciences,Electrical and Electronic Engineering,Elsevier BV,False,en,Engineering,Crossmark Retraction
https://openalex.org/W2128879111,Protective role of p120-catenin in maintaining the integrity of adherens and tight junctions in ventilator-induced lung injury,Respiratory Research,24,https://doi.org/10.1186/s12931-015-0217-3,https://api.labs.crossref.org/works/https://doi.org/10.1186/s12931-015-0217-3?mailto=christian.hauschke@tib.eu,2015,article,True,93,Neonatal Lung Development and Respiratory Morbidity,Health Sciences,Pulmonary and Respiratory Medicine,BioMed Central,True,en,Medicine,Retraction
https://openalex.org/W2129008780,RETRACTED: An ATP-Competitive Inhibitor Modulates the Allosteric Function of the HER3 Pseudokinase,Chemistry & Biology,24,https://doi.org/10.1016/j.chembiol.2014.02.011,https://api.labs.crossref.org/works/https://doi.org/10.1016/j.chembiol.2014.02.011?mailto=christian.hauschke@tib.eu,2014,article,True,93,"Therapeutic Antibodies: Development, Engineering, and Applications",Health Sciences,"Radiology, Nuclear Medicine and Imaging",Elsevier BV,True,en,Medicine,Retraction;Crossmark Retraction
https://openalex.org/W2129326213,FSD-C10: A more promising novel ROCK inhibitor than Fasudil for treatment of CNS autoimmunity,Bioscience Reports,24,https://doi.org/10.1042/bsr20150032,https://api.labs.crossref.org/works/https://doi.org/10.1042/bsr20150032?mailto=christian.hauschke@tib.eu,2015,article,True,93,Roles of Neurotrophins in Nervous System Function,Life Sciences,Cellular and Molecular Neuroscience,Portland Press,True,en,Neuroscience,Expression of concern
https://openalex.org/W2136778367,RETRACTED ARTICLE: Temperature-based estimation of global solar radiation using soft computing methodologies,Theoretical and Applied Climatology,24,https://doi.org/10.1007/s00704-015-1487-x,https://api.labs.crossref.org/works/https://doi.org/10.1007/s00704-015-1487-x?mailto=christian.hauschke@tib.eu,2015,article,True,93,Machine Learning Methods for Solar Radiation Forecasting,Physical Sciences,Artificial Intelligence,Springer Science+Business Media,False,en,Computer Science,Retraction
https://openalex.org/W2150651678,Variation in Parasympathetic Dysregulation Moderates Short-term Memory Problems in Childhood Attention-Deficit/Hyperactivity Disorder,Journal of Abnormal Child Psychology,24,https://doi.org/10.1007/s10802-015-0054-3,https://api.labs.crossref.org/works/https://doi.org/10.1007/s10802-015-0054-3?mailto=christian.hauschke@tib.eu,2015,article,True,93,Attention-Deficit/Hyperactivity Disorder,Health Sciences,Psychiatry and Mental health,Springer Science+Business Media,True,en,Medicine,Correction
https://openalex.org/W2158254887,"Chronic Alcohol Ingestion in Rats Alters Lung Metabolism, Promotes Lipid Accumulation, and Impairs Alveolar Macrophage Functions",American Journal of Respiratory Cell and Molecular Biology,24,https://doi.org/10.1165/rcmb.2014-0127oc,https://api.labs.crossref.org/works/https://doi.org/10.1165/rcmb.2014-0127oc?mailto=christian.hauschke@tib.eu,2014,article,True,93,Pathogenesis and Treatment of Alcoholic Liver Disease,Health Sciences,Pathology and Forensic Medicine,American Thoracic Society,True,en,Medicine,Retraction
https://openalex.org/W2181985983,Retracted Article: Laser produced plasma diagnosis of carcinogenic heavy metals in gallstones,Journal of Analytical Atomic Spectrometry,24,https://doi.org/10.1039/c5ja00358j,https://api.labs.crossref.org/works/https://doi.org/10.1039/c5ja00358j?mailto=christian.hauschke@tib.eu,2016,article,True,93,Laser-Induced Breakdown Spectroscopy in Material Analysis,Physical Sciences,Mechanics of Materials,Royal Society of Chemistry,False,en,Engineering,Retraction
https://openalex.org/W2182450724,RETRACTED: Bimetallic magnetic nanoparticle as a new platform for fabrication of pyridoxine and pyridoxal-5′-phosphate imprinted polymer modified high throughput electrochemical sensor,Biosensors and Bioelectronics,24,https://doi.org/10.1016/j.bios.2015.06.005,https://api.labs.crossref.org/works/https://doi.org/10.1016/j.bios.2015.06.005?mailto=christian.hauschke@tib.eu,2015,article,True,93,Electrochemical Biosensor Technology,Physical Sciences,Electrical and Electronic Engineering,Elsevier BV,False,en,Engineering,Retraction;Crossmark Retraction
https://openalex.org/W2203019958,Oxymatrine synergistically enhances the inhibitory effect of 5-fluorouracil on hepatocellular carcinoma in vitro and in vivo,Tumor Biology,24,https://doi.org/10.1007/s13277-015-4642-1,https://api.labs.crossref.org/works/https://doi.org/10.1007/s13277-015-4642-1?mailto=christian.hauschke@tib.eu,2015,article,True,93,Biological Activities of Prenylated Flavonoids,Life Sciences,Molecular Biology,SAGE Publishing,False,en,"Biochemistry, Genetics and Molecular Biology",Retraction
https://openalex.org/W2218675293,<b><i>Retracted:</i></b> Lentivirus-Mediated Knockdown of Myosin VI Inhibits Cell Proliferation of Breast Cancer Cell,Cancer Biotherapy and Radiopharmaceuticals,24,https://doi.org/10.1089/cbr.2014.1759,https://api.labs.crossref.org/works/https://doi.org/10.1089/cbr.2014.1759?mailto=christian.hauschke@tib.eu,2015,article,True,93,RNA Methylation and Modification in Gene Expression,Life Sciences,Molecular Biology,"Mary Ann Liebert, Inc.",False,en,"Biochemistry, Genetics and Molecular Biology",Retraction
https://openalex.org/W2255937166,Overexpression of SphK1 enhances cell proliferation and invasion in triple-negative breast cancer via the PI3K/AKT signaling pathway,Tumor Biology,24,https://doi.org/10.1007/s13277-016-4954-9,https://api.labs.crossref.org/works/https://doi.org/10.1007/s13277-016-4954-9?mailto=christian.hauschke@tib.eu,2016,article,True,93,Sphingolipid Signalling and Metabolism in Health and Disease,Life Sciences,Molecular Biology,SAGE Publishing,False,en,"Biochemistry, Genetics and Molecular Biology",Retraction
https://openalex.org/W2301776934,<i>All-Trans</i>-Retinoic Acid Enhances Mitochondrial Function in Models of Human Liver,Molecular Pharmacology,24,https://doi.org/10.1124/mol.116.103697,https://api.labs.crossref.org/works/https://doi.org/10.1124/mol.116.103697?mailto=christian.hauschke@tib.eu,2016,article,True,93,Role of Retinoic Acid in Biological Processes,Life Sciences,Molecular Biology,American Society for Pharmacology and Experimental Therapeutics,True,en,"Biochemistry, Genetics and Molecular Biology",Retraction
https://openalex.org/W2304950936,Role of antioxidants in gestational diabetes mellitus and relation to fetal outcome: a randomized controlled trial,Journal of Maternal-fetal & Neonatal Medicine,24,https://doi.org/10.3109/14767058.2016.1154526,https://api.labs.crossref.org/works/https://doi.org/10.3109/14767058.2016.1154526?mailto=christian.hauschke@tib.eu,2016,article,True,93,Impact of Gestational Diabetes Mellitus on Pregnancy,Health Sciences,Obstetrics and Gynecology,Informa,False,en,Medicine,Expression of concern
https://openalex.org/W2317716382,Recombination spot identification Based on gapped k-mers,Scientific Reports,24,https://doi.org/10.1038/srep23934,https://api.labs.crossref.org/works/https://doi.org/10.1038/srep23934?mailto=christian.hauschke@tib.eu,2016,article,True,93,Prediction of Protein Subcellular Localization,Life Sciences,Molecular Biology,Nature Portfolio,True,en,"Biochemistry, Genetics and Molecular Biology",Correction;Retraction
https://openalex.org/W2345243538,RETRACTED: β-Elemene against human lung cancer via up-regulation of P53 protein expression to promote the release of exosome,Lung Cancer,24,https://doi.org/10.1016/j.lungcan.2014.08.015,https://api.labs.crossref.org/works/https://doi.org/10.1016/j.lungcan.2014.08.015?mailto=christian.hauschke@tib.eu,2014,article,True,93,Exosome Biology and Function in Intercellular Communication,Life Sciences,Molecular Biology,Elsevier BV,False,en,"Biochemistry, Genetics and Molecular Biology",Retraction;Crossmark Retraction
https://openalex.org/W2395760461,Hybrid Surgery Versus Anterior Cervical Discectomy and Fusion in Multilevel Cervical Disc Diseases,Medicine,24,https://doi.org/10.1097/md.0000000000003621,https://api.labs.crossref.org/works/https://doi.org/10.1097/md.0000000000003621?mailto=christian.hauschke@tib.eu,2016,article,True,93,Surgical Interventions for Cervical Spine Disorders,Health Sciences,Surgery,Wolters Kluwer,True,en,Medicine,Retraction
https://openalex.org/W2404431066,Host–parasitoid evolution in a metacommunity,Proceedings of The Royal Society B: Biological Sciences,24,https://doi.org/10.1098/rspb.2016.0477,https://api.labs.crossref.org/works/https://doi.org/10.1098/rspb.2016.0477?mailto=christian.hauschke@tib.eu,2016,article,True,93,Impact of Pollinator Decline on Ecosystems and Agriculture,Life Sciences,"Ecology, Evolution, Behavior and Systematics",Royal Society,True,en,Agricultural and Biological Sciences,Correction;Expression of concern
https://openalex.org/W2464122775,RETRACTED ARTICLE: Prolonged food restriction decreases body condition and reduces repeatability in personality traits in web-building spiders,Behavioral Ecology and Sociobiology,24,https://doi.org/10.1007/s00265-016-2184-1,https://api.labs.crossref.org/works/https://doi.org/10.1007/s00265-016-2184-1?mailto=christian.hauschke@tib.eu,2016,article,True,93,Evolutionary Ecology of Animal Behavior and Traits,Life Sciences,"Ecology, Evolution, Behavior and Systematics",Springer Science+Business Media,False,en,Agricultural and Biological Sciences,Expression of concern;Retraction
https://openalex.org/W2494723352,RETRACTED ARTICLE: Towards understanding polyhydroxyalkanoates and their use,Journal of Polymer Research,24,https://doi.org/10.1007/s10965-016-0988-3,https://api.labs.crossref.org/works/https://doi.org/10.1007/s10965-016-0988-3?mailto=christian.hauschke@tib.eu,2016,article,True,93,Biodegradable Polymers as Biomaterials and Packaging,Physical Sciences,Biomaterials,Springer Science+Business Media,False,en,Materials Science,Retraction;Crossmark Retraction
https://openalex.org/W2518116721,"RETRACTED ARTICLE: Phytochemical Screening, Antioxidant and Antimicrobial activities of Senna occidentalis (L.) leaves Extract",Clinical Phytoscience,24,https://doi.org/10.1186/s40816-015-0007-y,https://api.labs.crossref.org/works/https://doi.org/10.1186/s40816-015-0007-y?mailto=christian.hauschke@tib.eu,2015,article,True,93,Biological Properties of Aloe Vera and Related Compounds,Life Sciences,Plant Science,Springer Nature,True,en,Agricultural and Biological Sciences,Retraction
https://openalex.org/W2520859340,RETRACTED: miR-361-5p inhibits hepatocellular carcinoma cell proliferation and invasion by targeting VEGFA,Biochemical and Biophysical Research Communications,24,https://doi.org/10.1016/j.bbrc.2016.09.076,https://api.labs.crossref.org/works/https://doi.org/10.1016/j.bbrc.2016.09.076?mailto=christian.hauschke@tib.eu,2016,article,True,93,Biogenesis and Functions of Circular RNAs,Life Sciences,Molecular Biology,Elsevier BV,False,en,"Biochemistry, Genetics and Molecular Biology",Retraction;Crossmark Retraction
https://openalex.org/W2529880736,"Retraction of “Few-Layer Antimonene: Large Yield Synthesis, Exact Atomical Structure, and Outstanding Optical Limiting”",Journal of the American Chemical Society,24,https://doi.org/10.1021/jacs.6b08698,https://api.labs.crossref.org/works/https://doi.org/10.1021/jacs.6b08698?mailto=christian.hauschke@tib.eu,2017,article,True,93,Applications of Quantum Dots in Nanotechnology,Physical Sciences,Materials Chemistry,American Chemical Society,True,en,Materials Science,Retraction
https://openalex.org/W2561055462,RETRACTED ARTICLE: Bio-HMGB1 from breast cancer contributes to M-MDSC differentiation from bone marrow progenitor cells and facilitates conversion of monocytes into MDSC-like cells,"Cancer Immunology, Immunotherapy",24,https://doi.org/10.1007/s00262-016-1942-2,https://api.labs.crossref.org/works/https://doi.org/10.1007/s00262-016-1942-2?mailto=christian.hauschke@tib.eu,2016,article,True,93,Biochemistry of Diabetic Complications,Life Sciences,Clinical Biochemistry,Springer Science+Business Media,False,en,"Biochemistry, Genetics and Molecular Biology",Retraction
https://openalex.org/W2562942374,Retracted Article: Multifunctional fluorescent chalcogenide hybrid nanodots (MoSe<sub>2</sub>:CdS and WSe<sub>2</sub>:CdS) as electro catalyst (for oxygen reduction/oxygen evolution reactions) and sensing probe for lead,"Journal of materials chemistry. A, Materials for energy and sustainability",24,https://doi.org/10.1039/c6ta08172j,https://api.labs.crossref.org/works/https://doi.org/10.1039/c6ta08172j?mailto=christian.hauschke@tib.eu,2017,article,True,93,Electrochemical Detection of Heavy Metal Ions,Physical Sciences,Electrochemistry,Royal Society of Chemistry,False,en,Chemistry,
https://openalex.org/W2573843229,miR-21-mediated Radioresistance Occurs via Promoting Repair of DNA Double Strand Breaks,Journal of Biological Chemistry,24,https://doi.org/10.1074/jbc.m116.772392,https://api.labs.crossref.org/works/https://doi.org/10.1074/jbc.m116.772392?mailto=christian.hauschke@tib.eu,2017,article,True,93,MicroRNA Regulation in Cancer and Development,Life Sciences,Cancer Research,Elsevier BV,True,en,"Biochemistry, Genetics and Molecular Biology",
https://openalex.org/W2597001181,RETRACTED ARTICLE:Interactions between Th1 cells and Tregs affect regulation of hepatic fibrosis in biliary atresia through the IFN-γ/STAT1 pathway,Cell Death & Differentiation,24,https://doi.org/10.1038/cdd.2017.31,https://api.labs.crossref.org/works/https://doi.org/10.1038/cdd.2017.31?mailto=christian.hauschke@tib.eu,2017,article,True,93,Pathogenesis and Management of Biliary Atresia,Health Sciences,Surgery,Springer Nature,True,en,Medicine,
https://openalex.org/W2605949290,RETRACTED ARTICLE: The Downregulation of MicroRNA-146a Modulates TGF-β Signaling Pathways Activity in Glioblastoma,Molecular Neurobiology,24,https://doi.org/10.1007/s12035-014-8938-8,https://api.labs.crossref.org/works/https://doi.org/10.1007/s12035-014-8938-8?mailto=christian.hauschke@tib.eu,2014,article,True,93,MicroRNA Regulation in Cancer and Development,Life Sciences,Cancer Research,Springer Science+Business Media,False,en,"Biochemistry, Genetics and Molecular Biology",
https://openalex.org/W2621137185,RETRACTED ARTICLE: An investigation on mechanical and metallurgical properties of 2024-T3 aluminum alloy spot friction welds,The International Journal of Advanced Manufacturing Technology,24,https://doi.org/10.1007/s00170-015-6997-2,https://api.labs.crossref.org/works/https://doi.org/10.1007/s00170-015-6997-2?mailto=christian.hauschke@tib.eu,2015,article,True,93,Advances in Friction Stir Welding and Processing,Physical Sciences,Mechanical Engineering,Springer Science+Business Media,False,en,Engineering,
https://openalex.org/W2735069781,Cx43- and Smad-Mediated TGF-β/ BMP Signaling Pathway Promotes Cartilage Differentiation of Bone Marrow Mesenchymal Stem Cells and Inhibits Osteoblast Differentiation,Cellular Physiology and Biochemistry,24,https://doi.org/10.1159/000478957,https://api.labs.crossref.org/works/https://doi.org/10.1159/000478957?mailto=christian.hauschke@tib.eu,2017,article,True,93,Osteoarthritis and Cartilage Repair,Health Sciences,Rheumatology,Karger Publishers,True,en,Medicine,
https://openalex.org/W2737983424,"Effects of microRNA-136 on melanoma cell proliferation, apoptosis, and epithelial–mesenchymal transition by targetting PMEL through the Wnt signaling pathway",Bioscience Reports,24,https://doi.org/10.1042/bsr20170743,https://api.labs.crossref.org/works/https://doi.org/10.1042/bsr20170743?mailto=christian.hauschke@tib.eu,2017,article,True,93,Wnt Signaling in Development and Disease,Life Sciences,Molecular Biology,Portland Press,True,en,"Biochemistry, Genetics and Molecular Biology",
https://openalex.org/W2738014443,MicroRNA-379 acts as a tumor suppressor in non-small cell lung cancer by targeting the IGF-1R-mediated AKT and ERK pathways,Oncology Reports,24,https://doi.org/10.3892/or.2017.5835,https://api.labs.crossref.org/works/https://doi.org/10.3892/or.2017.5835?mailto=christian.hauschke@tib.eu,2017,article,True,93,MicroRNA Regulation in Cancer and Development,Life Sciences,Cancer Research,Elsevier BV,True,en,"Biochemistry, Genetics and Molecular Biology",
https://openalex.org/W2738541201,Optical and dielectric properties of PVP based composite polymer electrolyte films,Polymer Science Series A,24,https://doi.org/10.1134/s0965545x17040095,https://api.labs.crossref.org/works/https://doi.org/10.1134/s0965545x17040095?mailto=christian.hauschke@tib.eu,2017,article,True,93,Lithium Battery Technologies,Physical Sciences,Electrical and Electronic Engineering,MAIK Nauka/Interperiodica,False,en,Engineering,
https://openalex.org/W2744456265,RETRACTED ARTICLE: Baduanjin Exercise for Insomnia: A Systematic Review and Meta-Analysis,Behavioral Sleep Medicine,24,https://doi.org/10.1080/15402002.2017.1363042,https://api.labs.crossref.org/works/https://doi.org/10.1080/15402002.2017.1363042?mailto=christian.hauschke@tib.eu,2017,article,True,93,Sleep and Insomnia,Social Sciences,Experimental and Cognitive Psychology,Taylor & Francis,False,en,Psychology,
https://openalex.org/W2747741463,Cylindrical shock waves in rotational axisymmetric non-ideal dusty gas with increasing energy under the action of monochromatic radiation,Physics of Fluids,24,https://doi.org/10.1063/1.4998962,https://api.labs.crossref.org/works/https://doi.org/10.1063/1.4998962?mailto=christian.hauschke@tib.eu,2017,article,True,93,Computational Fluid Dynamics,Physical Sciences,Computational Mechanics,American Institute of Physics,False,en,Engineering,
https://openalex.org/W2758159681,MicroRNA-363 inhibits ovarian cancer progression by inhibiting NOB1,Oncotarget,24,https://doi.org/10.18632/oncotarget.21417,https://api.labs.crossref.org/works/https://doi.org/10.18632/oncotarget.21417?mailto=christian.hauschke@tib.eu,2017,article,True,93,Biogenesis and Functions of Circular RNAs,Life Sciences,Molecular Biology,Impact Journals LLC,True,en,"Biochemistry, Genetics and Molecular Biology",
https://openalex.org/W2758795707,<i>Retracted</i>: In vivo and in vitro effects of microRNA‐124 on human gastric cancer by targeting JAG1 through the Notch signaling pathway,Journal of Cellular Biochemistry,24,https://doi.org/10.1002/jcb.26413,https://api.labs.crossref.org/works/https://doi.org/10.1002/jcb.26413?mailto=christian.hauschke@tib.eu,2017,article,True,93,MicroRNA Regulation in Cancer and Development,Life Sciences,Cancer Research,Wiley,True,en,"Biochemistry, Genetics and Molecular Biology",
https://openalex.org/W2766191041,<i>Retracted</i>: Effects of microRNA‐206 and its target gene IGF‐1 on sevoflurane‐induced activation of hippocampal astrocytes in aged rats through the PI3K/AKT/CREB signaling pathway,Journal of Cellular Physiology,24,https://doi.org/10.1002/jcp.26248,https://api.labs.crossref.org/works/https://doi.org/10.1002/jcp.26248?mailto=christian.hauschke@tib.eu,2017,article,True,93,Neurotoxic Effects of Anesthetic Agents on Brain Development,Life Sciences,Developmental Neuroscience,Wiley,True,en,Neuroscience,
https://openalex.org/W2766659290,Osseointegration of layer-by-layer polyelectrolyte multilayers loaded with IGF1 and coated on titanium implant under osteoporotic condition,International Journal of Nanomedicine,24,https://doi.org/10.2147/ijn.s148001,https://api.labs.crossref.org/works/https://doi.org/10.2147/ijn.s148001?mailto=christian.hauschke@tib.eu,2017,article,True,93,Bone Tissue Engineering and Biomaterials,Physical Sciences,Biomedical Engineering,Dove Medical Press,True,en,Engineering,
https://openalex.org/W2767169142,Deferoxamine-Induced Migration and Odontoblast Differentiation via ROS-Dependent Autophagy in Dental Pulp Stem Cells,Cellular Physiology and Biochemistry,24,https://doi.org/10.1159/000484506,https://api.labs.crossref.org/works/https://doi.org/10.1159/000484506?mailto=christian.hauschke@tib.eu,2017,article,True,93,Role of Autophagy in Disease and Health,Health Sciences,Epidemiology,Karger Publishers,True,en,Medicine,
https://openalex.org/W2769829719,"Detection of relapsing fever Borrelia spp., Bartonella spp. and Anaplasmataceae bacteria in argasid ticks in Algeria",PLOS Neglected Tropical Diseases,24,https://doi.org/10.1371/journal.pntd.0006064,https://api.labs.crossref.org/works/https://doi.org/10.1371/journal.pntd.0006064?mailto=christian.hauschke@tib.eu,2017,article,True,93,Viral Hemorrhagic Fevers and Zoonotic Infections,Health Sciences,Infectious Diseases,Public Library of Science,True,en,Medicine,
https://openalex.org/W2777963195,RETRACTED ARTICLE: Edge detection of satellite image using fuzzy logic,Cluster Computing,24,https://doi.org/10.1007/s10586-017-1508-x,https://api.labs.crossref.org/works/https://doi.org/10.1007/s10586-017-1508-x?mailto=christian.hauschke@tib.eu,2017,article,True,93,Hyperspectral Image Analysis and Classification,Physical Sciences,Media Technology,Springer Science+Business Media,False,en,Engineering,
https://openalex.org/W3103995270,Individual external dose monitoring of all citizens of Date City by passive dosimeter 5 to 51 months after the Fukushima NPP accident (series): 1. Comparison of individual dose with ambient dose rate monitored by aircraft surveys,Journal of Radiological Protection,24,https://doi.org/10.1088/1361-6498/37/1/1,https://api.labs.crossref.org/works/https://doi.org/10.1088/1361-6498/37/1/1?mailto=christian.hauschke@tib.eu,2016,article,True,93,Environmental Impacts of Fukushima Nuclear Disaster,Physical Sciences,Global and Planetary Change,IOP Publishing,True,en,Environmental Science,
https://openalex.org/W332660750,Hcn1 Is a Tremorgenic Genetic Component in a Rat Model of Essential Tremor,PLOS ONE,24,https://doi.org/10.1371/journal.pone.0123529,https://api.labs.crossref.org/works/https://doi.org/10.1371/journal.pone.0123529?mailto=christian.hauschke@tib.eu,2015,article,True,93,Deep Brain Stimulation for Neurological Disorders,Health Sciences,Neurology,Public Library of Science,True,en,Medicine,
https://openalex.org/W4236620996,Antiviral treatment for Bell's palsy (idiopathic facial paralysis),Cochrane Database of Systematic Reviews,24,https://doi.org/10.1002/14651858.cd001869.pub6,https://api.labs.crossref.org/works/https://doi.org/10.1002/14651858.cd001869.pub6?mailto=christian.hauschke@tib.eu,2015,reference-entry,True,93,Diagnosis and Management of Facial Paralysis,Health Sciences,Neurology,Cochrane,True,en,Medicine,
https://openalex.org/W4239646619,Peripheral nerve blocks for postoperative pain after major knee surgery,Cochrane Database of Systematic Reviews,24,https://doi.org/10.1002/14651858.cd010937,https://api.labs.crossref.org/works/https://doi.org/10.1002/14651858.cd010937?mailto=christian.hauschke@tib.eu,2014,reference-entry,True,93,Management of Postoperative Pain and Complications,Health Sciences,Surgery,Cochrane,True,en,Medicine,
https://openalex.org/W986833019,RETRACTED: Luminescence enhancement of bluish-green Sr2Al2SiO7:Eu2+ phosphor by dysprosium co-doping,Journal of Luminescence,24,https://doi.org/10.1016/j.jlumin.2015.06.023,https://api.labs.crossref.org/works/https://doi.org/10.1016/j.jlumin.2015.06.023?mailto=christian.hauschke@tib.eu,2015,article,True,93,Upconversion Nanoparticles,Physical Sciences,Materials Chemistry,Elsevier BV,False,en,Materials Science,
https://openalex.org/W1488952374,<i>Retracted</i>: MicroRNA‐217 overexpression induces drug resistance and invasion of breast cancer cells by targeting PTEN signaling,Cell Biology International,23,https://doi.org/10.1002/cbin.10506,https://api.labs.crossref.org/works/https://doi.org/10.1002/cbin.10506?mailto=christian.hauschke@tib.eu,2018,article,True,93,Role of Long Noncoding RNAs in Cancer and Development,Life Sciences,Cancer Research,Wiley-Blackwell,False,en,"Biochemistry, Genetics and Molecular Biology",
