id,display_name,primary_location_display_name,cited_by_count,doi,crossref_call,publication_year,type,is_retracted,cited_by_percentile_year_min,primary_topic_display_name,primary_topic_domain_display_name,primary_topic_subfield_display_name,primary_location_source_host_organization_name,open_access_is_oa,language,primary_topic_field_display_name,update_nature
https://openalex.org/W1503024100,Notice of Retraction: A study on measurement of integration of urban and rural areas based on Clustering Analysis,,0,https://doi.org/10.1109/aimsec.2011.6009656,https://api.labs.crossref.org/works/https://doi.org/10.1109/aimsec.2011.6009656?mailto=christian.hauschke@tib.eu,2011,article,True,0,Spatial Shift-Share Analysis in Economic Development,Social Sciences,Economics and Econometrics,,False,en,"Economics, Econometrics and Finance",
https://openalex.org/W1503335962,Notice of Retraction: Method for Evaluating the Effect of Petroleum Production,,0,https://doi.org/10.1109/appeec.2011.5748391,https://api.labs.crossref.org/works/https://doi.org/10.1109/appeec.2011.5748391?mailto=christian.hauschke@tib.eu,2011,article,True,0,Advanced Techniques in Reservoir Management,Physical Sciences,Ocean Engineering,,False,en,Engineering,
https://openalex.org/W1503372259,Notice of Retraction Enzymatic production of daidzein at optimum conditions,,0,https://doi.org/10.1109/iceceng.2011.6058444,https://api.labs.crossref.org/works/https://doi.org/10.1109/iceceng.2011.6058444?mailto=christian.hauschke@tib.eu,2011,article,True,0,,,,,False,en,,
https://openalex.org/W1503388620,Notice of Retraction: Teaching design of inquiry learning under network environment,,0,https://doi.org/10.1109/aimsec.2011.6009789,https://api.labs.crossref.org/works/https://doi.org/10.1109/aimsec.2011.6009789?mailto=christian.hauschke@tib.eu,2011,article,True,0,Self-Regulated Learning in Educational Research,Social Sciences,Developmental and Educational Psychology,,False,en,Psychology,
https://openalex.org/W1503449651,Notice of Retraction: A theoretical analysis on the sequence of China's economic liberalization,,0,https://doi.org/10.1109/icebeg.2011.5876657,https://api.labs.crossref.org/works/https://doi.org/10.1109/icebeg.2011.5876657?mailto=christian.hauschke@tib.eu,2011,article,True,0,International Finance and Capital Flows,Social Sciences,Finance,,False,en,"Economics, Econometrics and Finance",
https://openalex.org/W1503464479,Notice of Retraction: Humble opinion on several issues of application-based undergraduate cultivation system's innovation of independent college,,0,https://doi.org/10.1109/aimsec.2011.6010897,https://api.labs.crossref.org/works/https://doi.org/10.1109/aimsec.2011.6010897?mailto=christian.hauschke@tib.eu,2011,article,True,0,Meaning and Significance of Work,Social Sciences,Demography,,False,en,Social Sciences,
https://openalex.org/W1503480790,Notice of Retraction: Isolation and Identification of an Anaerobic Cellulolytic Bacterium,,0,https://doi.org/10.1109/icbbe.2011.5781489,https://api.labs.crossref.org/works/https://doi.org/10.1109/icbbe.2011.5781489?mailto=christian.hauschke@tib.eu,2011,article,True,0,Composting of Organic Wastes and Maturity Assessment,Life Sciences,Soil Science,,False,en,Agricultural and Biological Sciences,
https://openalex.org/W1503530024,Notice of Retraction: Synthesis and Identification of Artificial Antigen for Bupirimate,,0,https://doi.org/10.1109/icbbe.2011.5781585,https://api.labs.crossref.org/works/https://doi.org/10.1109/icbbe.2011.5781585?mailto=christian.hauschke@tib.eu,2011,article,True,0,Glycosylation in Health and Disease,Life Sciences,Molecular Biology,,False,en,"Biochemistry, Genetics and Molecular Biology",
https://openalex.org/W1503553437,Notice of Retraction: Weighted complex network of inter-province knowledge spillover in China,,0,https://doi.org/10.1109/icebeg.2011.5887007,https://api.labs.crossref.org/works/https://doi.org/10.1109/icebeg.2011.5887007?mailto=christian.hauschke@tib.eu,2011,article,True,0,Statistical Mechanics of Complex Networks,Physical Sciences,Statistical and Nonlinear Physics,,False,en,Physics and Astronomy,
https://openalex.org/W1503669147,Notice of Retraction: Innovation of anglo-american literature teaching oriented by improving practical abilities,,0,https://doi.org/10.1109/icebeg.2011.5887110,https://api.labs.crossref.org/works/https://doi.org/10.1109/icebeg.2011.5887110?mailto=christian.hauschke@tib.eu,2011,article,True,0,Language Teaching and Second Language Acquisition,Social Sciences,Language and Linguistics,,False,en,Arts and Humanities,
https://openalex.org/W1503744482,Retracted: TinyDB2: Porting a Query Driven Data Extraction System to TinyOS2.x,Communications in computer and information science,0,https://doi.org/10.1007/978-3-642-22543-7_30,https://api.labs.crossref.org/works/https://doi.org/10.1007/978-3-642-22543-7_30?mailto=christian.hauschke@tib.eu,2011,book-chapter,True,0,Wireless Sensor Networks: Survey and Applications,Physical Sciences,Computer Networks and Communications,Springer Science+Business Media,False,en,Computer Science,
https://openalex.org/W1503752180,Notice of Retraction: Dynamic process of Internet culture evolution based on complex network,,0,https://doi.org/10.1109/sws.2011.6101271,https://api.labs.crossref.org/works/https://doi.org/10.1109/sws.2011.6101271?mailto=christian.hauschke@tib.eu,2011,article,True,0,Statistical Mechanics of Complex Networks,Physical Sciences,Statistical and Nonlinear Physics,,False,en,Physics and Astronomy,
https://openalex.org/W1503876604,Notice of Retraction: Capital letters recognition based on neural network,,0,https://doi.org/10.1109/iceice.2011.5777504,https://api.labs.crossref.org/works/https://doi.org/10.1109/iceice.2011.5777504?mailto=christian.hauschke@tib.eu,2011,article,True,0,Artificial Intelligence and Expert Systems,Physical Sciences,Artificial Intelligence,,False,en,Computer Science,
https://openalex.org/W1503951930,Notice of Retraction: Research on the training mode of excellent talents in economics and management for transportation industry—A case study of Chongqing Jiaotong University,,0,https://doi.org/10.1109/aimsec.2011.6009714,https://api.labs.crossref.org/works/https://doi.org/10.1109/aimsec.2011.6009714?mailto=christian.hauschke@tib.eu,2011,article,True,0,Global Talent Management and Strategic HR Practices,Social Sciences,Organizational Behavior and Human Resource Management,,False,en,"Business, Management and Accounting",
https://openalex.org/W1504056232,Notice of Retraction: Predicament and countermeasure of assistance in employment of urban disadvantaged groups,,0,https://doi.org/10.1109/aimsec.2011.6011062,https://api.labs.crossref.org/works/https://doi.org/10.1109/aimsec.2011.6011062?mailto=christian.hauschke@tib.eu,2011,article,True,0,Emergency Management in Various Industries,Social Sciences,Organizational Behavior and Human Resource Management,,False,en,"Business, Management and Accounting",
https://openalex.org/W1504194367,Notice of Retraction: A study of incentive mechanism to weaken bullwhip effect of supply chains,,0,https://doi.org/10.1109/icsess.2011.5982281,https://api.labs.crossref.org/works/https://doi.org/10.1109/icsess.2011.5982281?mailto=christian.hauschke@tib.eu,2011,article,True,0,Coordination and Information Sharing in Supply Chains,Social Sciences,Management Information Systems,,False,en,"Business, Management and Accounting",
https://openalex.org/W1504196932,Notice of Retraction: Correlation analysis between the number of students taking the college entrance examination in china and school-age population base and mathematical model-building,,0,https://doi.org/10.1109/aimsec.2011.6010417,https://api.labs.crossref.org/works/https://doi.org/10.1109/aimsec.2011.6010417?mailto=christian.hauschke@tib.eu,2011,article,True,0,Application of Grey System Theory in Forecasting,Social Sciences,Management Science and Operations Research,,False,en,Decision Sciences,
https://openalex.org/W1504289467,Notice of Retraction: High Cell-Density Fermentation of Recombinant Escherichia coli Expressing PlyCB,,0,https://doi.org/10.1109/icbbe.2011.5780272,https://api.labs.crossref.org/works/https://doi.org/10.1109/icbbe.2011.5780272?mailto=christian.hauschke@tib.eu,2011,article,True,0,Recombinant Protein Production in Mammalian and Insect Cells,Life Sciences,Molecular Biology,,False,en,"Biochemistry, Genetics and Molecular Biology",
https://openalex.org/W1504319558,Notice of Retraction: Progress of research on China's farmland transfer issue from the perspective of peasant households,,0,https://doi.org/10.1109/aimsec.2011.6010966,https://api.labs.crossref.org/works/https://doi.org/10.1109/aimsec.2011.6010966?mailto=christian.hauschke@tib.eu,2011,article,True,0,Land Tenure and Property Rights in Agriculture,Life Sciences,Soil Science,,False,en,Agricultural and Biological Sciences,
https://openalex.org/W1504384580,Notice of Retraction: Reclamation Land Suitability Evaluation of Pingguo Karst Accumulative Bauxite,,0,https://doi.org/10.1109/icbbe.2011.5781619,https://api.labs.crossref.org/works/https://doi.org/10.1109/icbbe.2011.5781619?mailto=christian.hauschke@tib.eu,2011,article,True,0,Mining Technology and Safety Measures,Physical Sciences,"Safety, Risk, Reliability and Quality",,False,en,Engineering,
https://openalex.org/W1504574046,Notice of Retraction: Research on management method of modern engineering design specialization of China,,0,https://doi.org/10.1109/icebeg.2011.5887157,https://api.labs.crossref.org/works/https://doi.org/10.1109/icebeg.2011.5887157?mailto=christian.hauschke@tib.eu,2011,article,True,0,Engineering Education and Curriculum Development,Physical Sciences,Media Technology,,False,en,Engineering,
https://openalex.org/W1504575389,Notice of Retraction: A study on student management system of college instructor One of the results of research project from the Ministry of Education on instructors' standardized working system,,0,https://doi.org/10.1109/icbmei.2011.5920909,https://api.labs.crossref.org/works/https://doi.org/10.1109/icbmei.2011.5920909?mailto=christian.hauschke@tib.eu,2011,article,True,0,Application of Fuzzy Logic in Educational Assessment,Physical Sciences,Information Systems,,False,en,Computer Science,
https://openalex.org/W1504595270,Notice of Retraction: Economic analysis on balance between supply and demand of agricultural social services,,0,https://doi.org/10.1109/aimsec.2011.6010278,https://api.labs.crossref.org/works/https://doi.org/10.1109/aimsec.2011.6010278?mailto=christian.hauschke@tib.eu,2011,article,True,0,Governance of Cooperatives and Mutual Associations,Social Sciences,Strategy and Management,,False,en,"Business, Management and Accounting",
https://openalex.org/W1504607575,"Notice of Retraction: Bottleneck, overall ideas and suggestions on developing Changsha-Zhuzhou-Xiangtan regional low-carbon innovation system",,0,https://doi.org/10.1109/icsess.2011.5982438,https://api.labs.crossref.org/works/https://doi.org/10.1109/icsess.2011.5982438?mailto=christian.hauschke@tib.eu,2011,article,True,0,Science Policy and Innovation Management,Social Sciences,Information Systems and Management,,False,en,Decision Sciences,
https://openalex.org/W1504619480,Notice of Retraction: Temperature field simulation to Wire Electric Discharge Machining technology with rotary surface of engineering ceramic,,0,https://doi.org/10.1109/aimsec.2011.6009871,https://api.labs.crossref.org/works/https://doi.org/10.1109/aimsec.2011.6009871?mailto=christian.hauschke@tib.eu,2011,article,True,0,Electrical Discharge Machining Processes,Physical Sciences,Electrical and Electronic Engineering,,False,en,Engineering,
https://openalex.org/W1504630722,Notice of Retraction: The comparisons of service outsourcing competitiveness between Guangdong and Jiangsu based on Diamond Model,,0,https://doi.org/10.1109/icebeg.2011.5881404,https://api.labs.crossref.org/works/https://doi.org/10.1109/icebeg.2011.5881404?mailto=christian.hauschke@tib.eu,2011,article,True,0,Information Systems Outsourcing and Offshoring,Social Sciences,Management Information Systems,,False,en,"Business, Management and Accounting",
https://openalex.org/W1504662500,Notice of Retraction: A Fieldwork Study on Diurnal Cooling Effect of Green Space with Different Vertical Configuration,,0,https://doi.org/10.1109/icbbe.2011.5781322,https://api.labs.crossref.org/works/https://doi.org/10.1109/icbbe.2011.5781322?mailto=christian.hauschke@tib.eu,2011,article,True,0,Urban Heat Islands and Mitigation Strategies,Physical Sciences,Environmental Engineering,,False,en,Environmental Science,
https://openalex.org/W1504884428,"Notice of Retraction: R&amp;D Expenses, patenting application and the construction of innovation country",,0,https://doi.org/10.1109/icebeg.2011.5884521,https://api.labs.crossref.org/works/https://doi.org/10.1109/icebeg.2011.5884521?mailto=christian.hauschke@tib.eu,2011,article,True,0,Institutions and Economic Growth: Empirical Investigations and Theories,Social Sciences,Economics and Econometrics,,False,en,"Economics, Econometrics and Finance",
https://openalex.org/W1504891456,Notice of Retraction: Evaluation of customer experience in shopping online based on AHP,,0,https://doi.org/10.1109/icebeg.2011.5881783,https://api.labs.crossref.org/works/https://doi.org/10.1109/icebeg.2011.5881783?mailto=christian.hauschke@tib.eu,2011,article,True,0,Fuzzy Class Membership Modeling in Environmental Sciences,Physical Sciences,Ecological Modeling,,False,en,Environmental Science,
https://openalex.org/W1505022716,Notice of Retraction Reliability model of missile with disturbance-dependence,,0,https://doi.org/10.1109/qr2mse.2013.6625571,https://api.labs.crossref.org/works/https://doi.org/10.1109/qr2mse.2013.6625571?mailto=christian.hauschke@tib.eu,2013,article,True,0,Reliability Engineering and Maintenance Optimization,Physical Sciences,"Safety, Risk, Reliability and Quality",,False,en,Engineering,
https://openalex.org/W1505133878,Notice of Retraction: Practical exploration on developing the capability of postgraduates,,0,https://doi.org/10.1109/aimsec.2011.6009704,https://api.labs.crossref.org/works/https://doi.org/10.1109/aimsec.2011.6009704?mailto=christian.hauschke@tib.eu,2011,article,True,0,Physics of the Mind and Cognitive Science,Life Sciences,Cognitive Neuroscience,,False,en,Neuroscience,
https://openalex.org/W1505155891,Notice of Retraction On robust control for a class of uncertain DEDS,,0,https://doi.org/10.1109/iceceng.2011.6057285,https://api.labs.crossref.org/works/https://doi.org/10.1109/iceceng.2011.6057285?mailto=christian.hauschke@tib.eu,2011,article,True,0,Robotic Control and Stabilization Techniques,Physical Sciences,Control and Systems Engineering,,False,en,Engineering,
https://openalex.org/W1505218367,Notice of Retraction: Research on evaluating the implementation effect of Tourism Housing Estate based on feature analysis,,0,https://doi.org/10.1109/icebeg.2011.5877060,https://api.labs.crossref.org/works/https://doi.org/10.1109/icebeg.2011.5877060?mailto=christian.hauschke@tib.eu,2011,article,True,0,Assessment of Rural Sustainable Development Potentialities,Physical Sciences,"Management, Monitoring, Policy and Law",,False,en,Environmental Science,
https://openalex.org/W1505245379,Notice of Retraction: Analysis on inefficient ERP investment based on Behavioral Finance,,0,https://doi.org/10.1109/icebeg.2011.5882316,https://api.labs.crossref.org/works/https://doi.org/10.1109/icebeg.2011.5882316?mailto=christian.hauschke@tib.eu,2011,article,True,0,Critical Success Factors for ERP Implementation,Social Sciences,Management Information Systems,,False,en,"Business, Management and Accounting",
https://openalex.org/W1505278706,Notice of Retraction: Tetrandrine-Loaded Fibrous Extracellular Matrix for Cartilage Tissue Engineering,,0,https://doi.org/10.1109/icbbe.2011.5780289,https://api.labs.crossref.org/works/https://doi.org/10.1109/icbbe.2011.5780289?mailto=christian.hauschke@tib.eu,2011,article,True,0,Electrospun Nanofibers in Biomedical Applications,Physical Sciences,Biomaterials,,False,en,Materials Science,
https://openalex.org/W1505287639,Notice of Retraction The new research on the establishment of the mental health education system for modern college students,,0,https://doi.org/10.1109/icemms.2011.6015748,https://api.labs.crossref.org/works/https://doi.org/10.1109/icemms.2011.6015748?mailto=christian.hauschke@tib.eu,2011,article,True,0,Innovation and Development of Ideological Education,Social Sciences,Education,,False,en,Social Sciences,
https://openalex.org/W1505366906,Notice of Retraction: The latest progress of eco-compensation in China,,0,https://doi.org/10.1109/icebeg.2011.5882249,https://api.labs.crossref.org/works/https://doi.org/10.1109/icebeg.2011.5882249?mailto=christian.hauschke@tib.eu,2011,article,True,0,Challenges and Policy Implications of Biodiversity Offsets,Physical Sciences,"Management, Monitoring, Policy and Law",,False,en,Environmental Science,
https://openalex.org/W1505404755,Notice of Retraction: The design of liquid-type precision seeder for small seeds,,0,https://doi.org/10.1109/aimsec.2011.6010095,https://api.labs.crossref.org/works/https://doi.org/10.1109/aimsec.2011.6010095?mailto=christian.hauschke@tib.eu,2011,article,True,0,Advancements in Soil Mechanics and Terrain Interaction,Physical Sciences,Civil and Structural Engineering,,False,en,Engineering,
https://openalex.org/W1505509264,"Notice of Retraction: Innovation-independent, competence and advantage to the late comer in developing countries: Case of Taiwan IC industry",,0,https://doi.org/10.1109/icebeg.2011.5884499,https://api.labs.crossref.org/works/https://doi.org/10.1109/icebeg.2011.5884499?mailto=christian.hauschke@tib.eu,2011,article,True,0,Knowledge Management and Organizational Innovation,Social Sciences,Strategy and Management,,False,en,"Business, Management and Accounting",
https://openalex.org/W1505668912,Notice of Retraction: On the destruction of spiritual culture in university,,0,https://doi.org/10.1109/aimsec.2011.6009712,https://api.labs.crossref.org/works/https://doi.org/10.1109/aimsec.2011.6009712?mailto=christian.hauschke@tib.eu,2011,article,True,0,Interplay of Religion and Media in Modern Society,Social Sciences,Sociology and Political Science,,False,en,Social Sciences,
https://openalex.org/W1505673029,Notice of Retraction: The research and outlook of e-commerce training in China,,0,https://doi.org/10.1109/icebeg.2011.5882066,https://api.labs.crossref.org/works/https://doi.org/10.1109/icebeg.2011.5882066?mailto=christian.hauschke@tib.eu,2011,article,True,0,Information Technology Skills and Education,Physical Sciences,Information Systems,,False,en,Computer Science,
https://openalex.org/W1505707493,Notice of Retraction: Recognition of the value of customer loyalty for Chinese brand M &amp; A party,,0,https://doi.org/10.1109/icbmei.2011.5918015,https://api.labs.crossref.org/works/https://doi.org/10.1109/icbmei.2011.5918015?mailto=christian.hauschke@tib.eu,2011,article,True,0,"Customer Relationships, Behavior, and Loyalty",Social Sciences,Organizational Behavior and Human Resource Management,,False,en,"Business, Management and Accounting",
https://openalex.org/W1505747585,Notice of Retraction: Experimental study on Ti-alloy machined by EDM,,0,https://doi.org/10.1109/aimsec.2011.6010133,https://api.labs.crossref.org/works/https://doi.org/10.1109/aimsec.2011.6010133?mailto=christian.hauschke@tib.eu,2011,article,True,0,Electrical Discharge Machining Processes,Physical Sciences,Electrical and Electronic Engineering,,False,en,Engineering,
https://openalex.org/W1505770519,Notice of Retraction: Evidence of the Human Parvovirus B19 Circulating in Childbearing-Age Women in Wuhan of Hubei Province,,0,https://doi.org/10.1109/icbbe.2011.5780411,https://api.labs.crossref.org/works/https://doi.org/10.1109/icbbe.2011.5780411?mailto=christian.hauschke@tib.eu,2011,article,True,0,Parvovirus B19 Infection and Pathogenesis,Health Sciences,Infectious Diseases,,False,en,Medicine,Retraction
https://openalex.org/W1505770812,Notice of Retraction The clustering method study based on graph,,0,https://doi.org/10.1109/icnc.2011.6021910,https://api.labs.crossref.org/works/https://doi.org/10.1109/icnc.2011.6021910?mailto=christian.hauschke@tib.eu,2011,article,True,0,Microarray Data Analysis and Gene Expression Profiling,Life Sciences,Molecular Biology,,False,en,"Biochemistry, Genetics and Molecular Biology",Retraction
https://openalex.org/W1505806074,Notice of Retraction: Reproductive Toxicity of Anatase TiO2 Nanoparticles in Caenorhabditis elegans,,0,https://doi.org/10.1109/icbbe.2011.5781429,https://api.labs.crossref.org/works/https://doi.org/10.1109/icbbe.2011.5781429?mailto=christian.hauschke@tib.eu,2011,article,True,0,Nanotoxicology and Antimicrobial Nanoparticles,Physical Sciences,Materials Chemistry,,False,en,Materials Science,Retraction
https://openalex.org/W1505858596,Notice of Retraction Recognition of stratiform/cumuliform cloud based on G-K fuzzy clustering and SVM,,0,https://doi.org/10.1109/icnc.2011.6022264,https://api.labs.crossref.org/works/https://doi.org/10.1109/icnc.2011.6022264?mailto=christian.hauschke@tib.eu,2011,article,True,0,Artificial Intelligence and Expert Systems,Physical Sciences,Artificial Intelligence,,False,en,Computer Science,Retraction
https://openalex.org/W1505911856,Notice of Retraction: The Biosorption of Strontium by Immobilized Saccharomyces cerevisiae Cells under Culture Conditions,,0,https://doi.org/10.1109/icbbe.2011.5781054,https://api.labs.crossref.org/works/https://doi.org/10.1109/icbbe.2011.5781054?mailto=christian.hauschke@tib.eu,2011,article,True,0,Adsorption of Water Contaminants,Physical Sciences,Water Science and Technology,,False,en,Environmental Science,Retraction
https://openalex.org/W1505958137,Notice of Retraction: The decision-making for feed formula in animal husbandry breeding based on the revised simplex method,,0,https://doi.org/10.1109/aimsec.2011.6010746,https://api.labs.crossref.org/works/https://doi.org/10.1109/aimsec.2011.6010746?mailto=christian.hauschke@tib.eu,2011,article,True,0,Livestock Farming and Rural Development Practices,Life Sciences,Agronomy and Crop Science,,False,en,Agricultural and Biological Sciences,Retraction
https://openalex.org/W1506045805,Notice of Retraction Managing banks' asset and loan portfolios,,0,https://doi.org/10.1109/icemms.2011.6015797,https://api.labs.crossref.org/works/https://doi.org/10.1109/icemms.2011.6015797?mailto=christian.hauschke@tib.eu,2011,article,True,0,Banking and Finance in Economic Systems,Social Sciences,Finance,,False,en,"Economics, Econometrics and Finance",Retraction
https://openalex.org/W1506104666,Notice of Retraction: Analysis of the potential-transfer-trust in private equity investment trust,,0,https://doi.org/10.1109/icbmei.2011.5914494,https://api.labs.crossref.org/works/https://doi.org/10.1109/icbmei.2011.5914494?mailto=christian.hauschke@tib.eu,2011,article,True,0,Venture Capital and Start-Up Financing,Social Sciences,Accounting,,False,en,"Business, Management and Accounting",Retraction
https://openalex.org/W1506128751,Notice of Retraction Speaker classification based on high dimension feature vector,,0,https://doi.org/10.1109/icnc.2011.6022284,https://api.labs.crossref.org/works/https://doi.org/10.1109/icnc.2011.6022284?mailto=christian.hauschke@tib.eu,2011,article,True,0,Speech Recognition Technology,Physical Sciences,Artificial Intelligence,,False,en,Computer Science,Retraction
https://openalex.org/W1506327503,Notice of Retraction: Marketing channel characteristics and selection methods analysis of daily chemical industry,,0,https://doi.org/10.1109/aimsec.2011.6010500,https://api.labs.crossref.org/works/https://doi.org/10.1109/aimsec.2011.6010500?mailto=christian.hauschke@tib.eu,2011,article,True,0,"Customer Relationships, Behavior, and Loyalty",Social Sciences,Organizational Behavior and Human Resource Management,,False,en,"Business, Management and Accounting",Retraction
https://openalex.org/W1506540291,Notice of Retraction: Analysis of university students' entrepreneurial attitudes and influence factors of their entrepreneurial orientation,,0,https://doi.org/10.1109/aimsec.2011.6009705,https://api.labs.crossref.org/works/https://doi.org/10.1109/aimsec.2011.6009705?mailto=christian.hauschke@tib.eu,2011,article,True,0,Entrepreneurship and Business Innovation,Social Sciences,Management of Technology and Innovation,,False,en,"Business, Management and Accounting",Retraction
https://openalex.org/W1506547980,Notice of Retraction An empirical research of the business cycle synchronization among the GCC,,0,https://doi.org/10.1109/emeit.2011.6023926,https://api.labs.crossref.org/works/https://doi.org/10.1109/emeit.2011.6023926?mailto=christian.hauschke@tib.eu,2011,article,True,0,International Finance and Capital Flows,Social Sciences,Finance,,False,en,"Economics, Econometrics and Finance",Retraction
https://openalex.org/W1506549361,Notice of Retraction: Research of data integrated technology of valve CAD based on CORBA,,0,https://doi.org/10.1109/iceice.2011.5777333,https://api.labs.crossref.org/works/https://doi.org/10.1109/iceice.2011.5777333?mailto=christian.hauschke@tib.eu,2011,article,True,0,Design and Application of Intelligent Monitoring Systems,Physical Sciences,Control and Systems Engineering,,False,en,Engineering,Retraction
https://openalex.org/W1506660351,Notice of Retraction: Research on the future development of accounting under knowledge-based economy,,0,https://doi.org/10.1109/icebeg.2011.5882433,https://api.labs.crossref.org/works/https://doi.org/10.1109/icebeg.2011.5882433?mailto=christian.hauschke@tib.eu,2011,article,True,0,Intellectual Capital and Business Performance,Social Sciences,Strategy and Management,,False,en,"Business, Management and Accounting",Retraction
