id,display_name,primary_location_display_name,cited_by_count,doi,crossref_call,publication_year,type,is_retracted,cited_by_percentile_year_min,primary_topic_display_name,primary_topic_domain_display_name,primary_topic_subfield_display_name,primary_location_source_host_organization_name,open_access_is_oa,language,primary_topic_field_display_name,update_nature
https://openalex.org/W2796143756,Dopamine detection using mercaptopropionic acid and cysteamine for electrodes surface modification,Journal of electrical bioimpedance,0,https://doi.org/10.2478/joeb-2018-0002,https://api.labs.crossref.org/works/https://doi.org/10.2478/joeb-2018-0002?mailto=christian.hauschke@tib.eu,2018,article,True,0,Electrochemical Biosensor Technology,Physical Sciences,Electrical and Electronic Engineering,Oslo Bioimpedance Group,True,en,Engineering,Retraction
https://openalex.org/W2796807288,RETRACTED CHAPTER: New Tools and Techniques for Measuring Sustainability in Clothing,Textile science and clothing technology,0,https://doi.org/10.1007/978-981-10-8591-8_3,https://api.labs.crossref.org/works/https://doi.org/10.1007/978-981-10-8591-8_3?mailto=christian.hauschke@tib.eu,2018,book-chapter,True,0,Measurement and Evaluation of Sustainable Development,Physical Sciences,"Management, Monitoring, Policy and Law",Springer Nature,False,en,Environmental Science,
https://openalex.org/W2797012534,"RETRACTED: Gas electron multiplier (GEM) foil test, repair and effective gain calculation",Results in Physics,0,https://doi.org/10.1016/j.rinp.2018.02.011,https://api.labs.crossref.org/works/https://doi.org/10.1016/j.rinp.2018.02.011?mailto=christian.hauschke@tib.eu,2018,article,True,0,Advancements in Particle Detector Technology,Physical Sciences,Nuclear and High Energy Physics,Elsevier BV,True,en,Physics and Astronomy,Crossmark Retraction
https://openalex.org/W2797184153,Retracted: Setup and operational cost analysis of 1 Horse power rated split unit inverter and non inverter air conditioner for home usage in Malaysia,Journal of Fundamental and Applied Sciences,0,https://doi.org/10.4314/jfas.v10i6s.121,https://api.labs.crossref.org/works/https://doi.org/10.4314/jfas.v10i6s.121?mailto=christian.hauschke@tib.eu,2018,article,True,0,Refrigeration Systems and Technologies,Physical Sciences,Mechanical Engineering,University of El Oued,False,en,Engineering,
https://openalex.org/W2797263675,"Primary CNS high-grade B-cell lymphoma, with rearrangements of <i>MYC</i> and <i>BCL6</i> : a case report",Blood Research,0,https://doi.org/10.5045/br.2018.53.1.87,https://api.labs.crossref.org/works/https://doi.org/10.5045/br.2018.53.1.87?mailto=christian.hauschke@tib.eu,2018,article,True,0,Diagnosis and Treatment of Primary Central Nervous System Lymphoma,Health Sciences,Neurology,,True,en,Medicine,Retraction
https://openalex.org/W2797467449,Notice of Retraction: Carbon-Reinforced Flexible Band-Stop Frequency Selective Surface Design,IEEE Transactions on Electromagnetic Compatibility,0,https://doi.org/10.1109/temc.2018.2819203,https://api.labs.crossref.org/works/https://doi.org/10.1109/temc.2018.2819203?mailto=christian.hauschke@tib.eu,2018,article,True,0,Metasurfaces for Antenna and Radar Applications,Physical Sciences,Aerospace Engineering,Institute of Electrical and Electronics Engineers,False,en,Engineering,Retraction
https://openalex.org/W2797644131,RETRACTED: Pressure dependence of high order harmonic generation in nitrogen molecule and atmospheric air,Optik,0,https://doi.org/10.1016/j.ijleo.2018.04.027,https://api.labs.crossref.org/works/https://doi.org/10.1016/j.ijleo.2018.04.027?mailto=christian.hauschke@tib.eu,2018,article,True,0,Light Signal Transduction in Plants,Life Sciences,Plant Science,Elsevier BV,False,en,Agricultural and Biological Sciences,Retraction;Crossmark Retraction
https://openalex.org/W2798025951,RETRACTED: Successful anesthetic management of limb artery thrombectomy by posterior QL block in conjunction with FNB,Journal of Clinical Anesthesia,0,https://doi.org/10.1016/j.jclinane.2018.03.013,https://api.labs.crossref.org/works/https://doi.org/10.1016/j.jclinane.2018.03.013?mailto=christian.hauschke@tib.eu,2018,article,True,0,Management of Postoperative Pain and Complications,Health Sciences,Surgery,Elsevier BV,False,en,Medicine,Retraction;Crossmark Retraction
https://openalex.org/W2799589968,[ARTÍCULO RETRACTADO] Emprendimiento Sostenible como Estrategia para la Creación de Empresas,Science of human action,0,https://doi.org/10.21501/2500-669x.2707,https://api.labs.crossref.org/works/https://doi.org/10.21501/2500-669x.2707?mailto=christian.hauschke@tib.eu,2018,article,True,0,University Social Responsibility in Higher Education,Social Sciences,Education,Catholic University Luis Amigó,True,es,Social Sciences,Retraction
https://openalex.org/W2799598522,RETRACTED: Vergence eye movements direct others’ attention in three-dimensional space,Current Biology,0,https://doi.org/10.1016/j.cub.2018.03.031,https://api.labs.crossref.org/works/https://doi.org/10.1016/j.cub.2018.03.031?mailto=christian.hauschke@tib.eu,2018,article,True,0,Neural Mechanisms of Visual Perception and Processing,Life Sciences,Cognitive Neuroscience,Elsevier BV,True,en,Neuroscience,Retraction;Crossmark Retraction
https://openalex.org/W2800158879,Enzyme-Treated Asparagus Extract (ETAS) Facilitates the Turnover of UV-B-Irradiated Keratinocytes,Journal of Nutritional Science and Vitaminology,0,https://doi.org/10.3177/jnsv.64.138,https://api.labs.crossref.org/works/https://doi.org/10.3177/jnsv.64.138?mailto=christian.hauschke@tib.eu,2018,article,True,0,Bioactivity of Steroidal Saponins in Medicinal Plants,Life Sciences,Molecular Biology,Center for Academic Publications Japan,True,en,"Biochemistry, Genetics and Molecular Biology",Retraction
https://openalex.org/W2800654892,WITHDRAWN: The efficacy and safety of intravenous glucocorticoids in total hip arthroplasty: A systematic review and meta-analysis,International Journal of Surgery,0,https://doi.org/10.1016/j.ijsu.2018.04.056,https://api.labs.crossref.org/works/https://doi.org/10.1016/j.ijsu.2018.04.056?mailto=christian.hauschke@tib.eu,2018,article,True,0,Management of Postoperative Pain and Complications,Health Sciences,Surgery,Elsevier BV,False,en,Medicine,Retraction
https://openalex.org/W2800708267,"RETRACTED ARTICLE: Primary central nervous system high-grade B-cell lymphoma, with rearrangements of <i>MYC</i> and <i>BCL6</i>",Baylor University Medical Center Proceedings,0,https://doi.org/10.1080/08998280.2018.1460127,https://api.labs.crossref.org/works/https://doi.org/10.1080/08998280.2018.1460127?mailto=christian.hauschke@tib.eu,2018,article,True,0,Diagnosis and Treatment of Primary Central Nervous System Lymphoma,Health Sciences,Neurology,Taylor & Francis,True,en,Medicine,Retraction
https://openalex.org/W2800865127,WASP (Write a Scientific Paper): Ethical issues and data protection in research,Early Human Development,0,https://doi.org/10.1016/j.earlhumdev.2018.04.020,https://api.labs.crossref.org/works/https://doi.org/10.1016/j.earlhumdev.2018.04.020?mailto=christian.hauschke@tib.eu,2018,article,True,0,Scientific Writing and Publication Practices,Social Sciences,History and Philosophy of Science,Elsevier BV,False,en,Arts and Humanities,Expression of concern
https://openalex.org/W2800979723,Spatial and Transform Domain based Steganography Using Chaotic Maps for Color Images,Journal of Fundamental and Applied Sciences,0,https://doi.org/10.4314/jfas.v10i4s.212,https://api.labs.crossref.org/works/https://doi.org/10.4314/jfas.v10i4s.212?mailto=christian.hauschke@tib.eu,2018,article,True,0,Digital Image Watermarking Techniques,Physical Sciences,Computer Vision and Pattern Recognition,University of El Oued,False,en,Computer Science,
https://openalex.org/W2801035661,Retracted: Importance of teamwork for the satisfaction of managers in small and medium-sized enterprises in the Czech Republic,Journal of Fundamental and Applied Sciences,0,https://doi.org/10.4314/jfas.v10i4s.219,https://api.labs.crossref.org/works/https://doi.org/10.4314/jfas.v10i4s.219?mailto=christian.hauschke@tib.eu,2018,article,True,0,Transportation and Logistics Management,Physical Sciences,Industrial and Manufacturing Engineering,University of El Oued,False,en,Engineering,
https://openalex.org/W2801052960,Insights from diversified anti-angiogenic models: Role of β-interferon inducer DEAE-Dextran,Pharmacological Reports,0,https://doi.org/10.1016/j.pharep.2018.01.007,https://api.labs.crossref.org/works/https://doi.org/10.1016/j.pharep.2018.01.007?mailto=christian.hauschke@tib.eu,2018,article,True,0,Molecular Mechanisms of Angiogenesis and Vascular Function,Life Sciences,Molecular Biology,Elsevier BV,False,en,"Biochemistry, Genetics and Molecular Biology",Retraction
https://openalex.org/W2801291827,"ANTIBACTERIAL ACTIVITY OF CUMIN (CUMINUM CYMINUM L.) AND CLOVES (SYZYGIUM AROMATICUM) ESSENTIAL OILS, AND THEIR APPLICATION TO THE PRESERVATION OF MINCED MEAT",Journal of Fundamental and Applied Sciences,0,https://doi.org/10.4314/jfas.v10i5s.6,https://api.labs.crossref.org/works/https://doi.org/10.4314/jfas.v10i5s.6?mailto=christian.hauschke@tib.eu,2018,article,True,0,Antimicrobial Properties of Essential Oils in Foods,Life Sciences,Food Science,University of El Oued,False,en,Agricultural and Biological Sciences,
https://openalex.org/W2802235344,WASP (Write a Scientific Paper) using Excel – 12: Odds ratio and relative risk,Early Human Development,0,https://doi.org/10.1016/j.earlhumdev.2018.04.008,https://api.labs.crossref.org/works/https://doi.org/10.1016/j.earlhumdev.2018.04.008?mailto=christian.hauschke@tib.eu,2018,article,True,0,Scientific Writing and Publication Practices,Social Sciences,History and Philosophy of Science,Elsevier BV,False,en,Arts and Humanities,Expression of concern
https://openalex.org/W2802298268,Notice of Retraction: Objective MIMO Measurement,IEEE Transactions on Electromagnetic Compatibility,0,https://doi.org/10.1109/temc.2018.2804041,https://api.labs.crossref.org/works/https://doi.org/10.1109/temc.2018.2804041?mailto=christian.hauschke@tib.eu,2018,article,True,0,Reverberation Chambers in Electromagnetic Testing,Physical Sciences,Electrical and Electronic Engineering,Institute of Electrical and Electronics Engineers,False,en,Engineering,Retraction
https://openalex.org/W2802356270,Retracted: Optimization of Planning and Design of Urban Sewage Collection and Treatment Systems,Environmental Engineering Science,0,https://doi.org/10.1089/ees.2017.0019,https://api.labs.crossref.org/works/https://doi.org/10.1089/ees.2017.0019?mailto=christian.hauschke@tib.eu,2018,article,True,0,Development and Management of Urban Underground Space,Physical Sciences,Building and Construction,"Mary Ann Liebert, Inc.",False,en,Engineering,Retraction
https://openalex.org/W2802745598,RETRACTED ARTICLE: Evaluation of the pulley function of the hamulus of the hamate for the flexor tendons,Surgical and Radiologic Anatomy,0,https://doi.org/10.1007/s00276-018-2034-0,https://api.labs.crossref.org/works/https://doi.org/10.1007/s00276-018-2034-0?mailto=christian.hauschke@tib.eu,2018,article,True,0,Treatment and Outcomes of Hand Injuries,Health Sciences,Surgery,Springer Science+Business Media,False,en,Medicine,Retraction;Crossmark Retraction
https://openalex.org/W2802824235,RETRACTED ARTICLE: Fetal methotrexate syndrome and Antley–Bixler syndrome should not be confused,Pediatric Radiology,0,https://doi.org/10.1007/s00247-018-4125-9,https://api.labs.crossref.org/works/https://doi.org/10.1007/s00247-018-4125-9?mailto=christian.hauschke@tib.eu,2018,article,True,0,Genetics and Development of Craniofacial Abnormalities,Life Sciences,Genetics,Springer Science+Business Media,True,en,"Biochemistry, Genetics and Molecular Biology",Retraction;Crossmark Retraction
https://openalex.org/W2803246103,"Integration of case study approach, project design and computer modeling in managerial accounting education with a diploma thesis development as an example",Journal of Fundamental and Applied Sciences,0,https://doi.org/10.4314/jfas.v10i4s.104,https://api.labs.crossref.org/works/https://doi.org/10.4314/jfas.v10i4s.104?mailto=christian.hauschke@tib.eu,2018,article,True,0,Theoretical Foundations of Accounting and Reporting Practices,Social Sciences,Accounting,University of El Oued,False,en,"Business, Management and Accounting",
https://openalex.org/W2803335325,"Retracted Article: Overexpression of PCDH8 inhibits proliferation and invasion, and induces apoptosis in papillary thyroid cancer cells",RSC Advances,0,https://doi.org/10.1039/c8ra02291g,https://api.labs.crossref.org/works/https://doi.org/10.1039/c8ra02291g?mailto=christian.hauschke@tib.eu,2018,article,True,0,Wnt Signaling in Development and Disease,Life Sciences,Molecular Biology,Royal Society of Chemistry,True,en,"Biochemistry, Genetics and Molecular Biology",Retraction
https://openalex.org/W2803337284,RETRACTED ARTICLE: Primary Draining Vein Stenting for Obstructive Total Anomalous Pulmonary Venous Connection in Neonates with Right Atrial Isomerism and Functional Single Ventricle Improves Outcome,Pediatric Cardiology,0,https://doi.org/10.1007/s00246-018-1902-z,https://api.labs.crossref.org/works/https://doi.org/10.1007/s00246-018-1902-z?mailto=christian.hauschke@tib.eu,2018,article,True,0,Epidemiology and Management of Congenital Heart Disease,Health Sciences,Epidemiology,Springer Science+Business Media,False,en,Medicine,Retraction
https://openalex.org/W2803455282,Loop Unrolling implementation of An AES algorithm using Xilinx System generator,Journal of Fundamental and Applied Sciences,0,https://doi.org/10.4314/jfas.v10i5s.19,https://api.labs.crossref.org/works/https://doi.org/10.4314/jfas.v10i5s.19?mailto=christian.hauschke@tib.eu,2018,article,True,0,Chaos-based Image Encryption Techniques,Physical Sciences,Computer Vision and Pattern Recognition,University of El Oued,False,en,Computer Science,
https://openalex.org/W2803545871,RETRACTED ARTICLE: Pre-treatment DWI as a predictor of overall survival in locally advanced pancreatic cancer treated with Cyberknife radiotherapy and sequential S-1 therapy,Cancer Imaging,0,https://doi.org/10.1186/s40644-018-0139-7,https://api.labs.crossref.org/works/https://doi.org/10.1186/s40644-018-0139-7?mailto=christian.hauschke@tib.eu,2018,article,True,0,Pancreatic Cancer Research and Treatment,Health Sciences,Oncology,BioMed Central,True,en,Medicine,Retraction
https://openalex.org/W2803648579,RETRACTED: Short-Term Exposure to Movie Violence and Implicit Aggression During Adolescence,Youth & Society,0,https://doi.org/10.1177/0044118x18775846,https://api.labs.crossref.org/works/https://doi.org/10.1177/0044118x18775846?mailto=christian.hauschke@tib.eu,2018,article,True,0,Bullying Behaviors and Psychological Impact,Social Sciences,Social Psychology,SAGE Publishing,False,en,Psychology,Retraction
https://openalex.org/W2803709800,The issues of methodology of science in the Russian philosophy of the 19 th –20 th centuries,Journal of Fundamental and Applied Sciences,0,https://doi.org/10.4314/jfas.v10i5s.47,https://api.labs.crossref.org/works/https://doi.org/10.4314/jfas.v10i5s.47?mailto=christian.hauschke@tib.eu,2018,article,True,0,Multidisciplinary Studies in Social Sciences and Humanities,Social Sciences,General Social Sciences,University of El Oued,False,en,Social Sciences,
https://openalex.org/W2804078849,THE USAGE OF MOBILE APPLICATION AND CUSTOMER LOYALTY,Journal of Fundamental and Applied Sciences,0,https://doi.org/10.4314/jfas.v10i5s.51,https://api.labs.crossref.org/works/https://doi.org/10.4314/jfas.v10i5s.51?mailto=christian.hauschke@tib.eu,2018,article,True,0,User Acceptance of Information Technology,Social Sciences,Information Systems and Management,University of El Oued,False,en,Decision Sciences,
https://openalex.org/W2804311365,SOCIAL ENTREPRENEURSHIP INTENTION: FROM LITERATURE REVIEW TO CONCEPTUAL FRAMEWORK,Journal of Fundamental and Applied Sciences,0,https://doi.org/10.4314/jfas.v10i6s.82,https://api.labs.crossref.org/works/https://doi.org/10.4314/jfas.v10i6s.82?mailto=christian.hauschke@tib.eu,2018,article,True,0,Entrepreneurship and Business Innovation,Social Sciences,Management of Technology and Innovation,University of El Oued,False,en,"Business, Management and Accounting",
https://openalex.org/W2804320307,RETRACTED CHAPTER: In-silico Analysis of LncRNA-mRNA Target Prediction,Advances in intelligent systems and computing,0,https://doi.org/10.1007/978-981-10-8569-7_28,https://api.labs.crossref.org/works/https://doi.org/10.1007/978-981-10-8569-7_28?mailto=christian.hauschke@tib.eu,2018,book-chapter,True,0,Role of Long Noncoding RNAs in Cancer and Development,Life Sciences,Cancer Research,Springer Nature,False,en,"Biochemistry, Genetics and Molecular Biology",Retraction
https://openalex.org/W2804925325,"Withdrawn: Comment on [J. Math. Phys. 58, 101701 (2017)]",Journal of Mathematical Physics,0,https://doi.org/10.1063/1.5026919,https://api.labs.crossref.org/works/https://doi.org/10.1063/1.5026919?mailto=christian.hauschke@tib.eu,2018,article,True,0,Scientific Computing and Data Analysis with Python,Physical Sciences,Artificial Intelligence,American Institute of Physics,False,en,Computer Science,Retraction
https://openalex.org/W2805229425,RELATIONSHIP BETWEEN THE LOW POSITIVE CHARGE REGION AND MULTIPLICITY OF RETURN STROKE IN NEGATIVE GROUND FLASH,Journal of Fundamental and Applied Sciences,0,https://doi.org/10.4314/jfas.v10i5s.40,https://api.labs.crossref.org/works/https://doi.org/10.4314/jfas.v10i5s.40?mailto=christian.hauschke@tib.eu,2018,article,True,0,Global Lightning Distribution and Physics,Physical Sciences,Astronomy and Astrophysics,University of El Oued,False,en,Physics and Astronomy,
https://openalex.org/W2805356510,Retracted: Channel estimation with limited pilot beams in millimeter wave communications,Journal of Fundamental and Applied Sciences,0,https://doi.org/10.4314/jfas.v10i4s.218,https://api.labs.crossref.org/works/https://doi.org/10.4314/jfas.v10i4s.218?mailto=christian.hauschke@tib.eu,2018,article,True,0,Millimeter Wave Communications for 5G and Beyond,Physical Sciences,Electrical and Electronic Engineering,University of El Oued,False,en,Engineering,
https://openalex.org/W2805381322,RETRACTED ARTICLE: Experimental investigation on the effect of shell side interstitial twisted tapes in the performance of counter flow shell and tube heat exchanger,International Journal of Ambient Energy,0,https://doi.org/10.1080/01430750.2018.1484806,https://api.labs.crossref.org/works/https://doi.org/10.1080/01430750.2018.1484806?mailto=christian.hauschke@tib.eu,2018,article,True,0,Microchannel Heat Transfer and Cooling Technology,Physical Sciences,Mechanical Engineering,Taylor & Francis,True,en,Engineering,Retraction;Crossmark Retraction
https://openalex.org/W2805389114,IMPACT OF DISTRIBUTIVE AND PROCEDURAL JUSTICE ON TURNOVER INTENTION AND COUNTERPRODUCTIVE WORK BEHAVIOR: MEDIATING ROLE OF ORGANIZATIONAL CYNICISM,Journal of Fundamental and Applied Sciences,0,https://doi.org/10.4314/jfas.v10i6s.134,https://api.labs.crossref.org/works/https://doi.org/10.4314/jfas.v10i6s.134?mailto=christian.hauschke@tib.eu,2018,article,True,0,Influence of Work Environment on Employee Performance,Social Sciences,Human Factors and Ergonomics,University of El Oued,False,en,Social Sciences,
https://openalex.org/W2805392216,Retracted: The effect of organizational structure on innovation capacity in Moroccan SMEs: case of Kenitra-Rabat-Sale Region,Journal of Fundamental and Applied Sciences,0,https://doi.org/10.4314/jfas.v10i4s.213,https://api.labs.crossref.org/works/https://doi.org/10.4314/jfas.v10i4s.213?mailto=christian.hauschke@tib.eu,2018,article,True,0,Sustainable Development and Economic Management,Social Sciences,Economics and Econometrics,University of El Oued,False,en,"Economics, Econometrics and Finance",
https://openalex.org/W2805468299,"A SURVEY ON BIG DATA PROCESSING: TECHNIQUES, ISSUES AND CHALLENGES",Journal of Fundamental and Applied Sciences,0,https://doi.org/10.4314/jfas.v10i6s.16,https://api.labs.crossref.org/works/https://doi.org/10.4314/jfas.v10i6s.16?mailto=christian.hauschke@tib.eu,2018,article,True,0,Impact of Big Data on Society and Industry,Social Sciences,Information Systems and Management,University of El Oued,False,en,Decision Sciences,
https://openalex.org/W2805485287,DEVELOPMENT FOR THE STAND OF SOLAR PHOTOVOLTAIC BASED ON THE DIRECTION AND ANGLE ANALYSIS AT NORTH PENINSULAR MALAYSIA,Journal of Fundamental and Applied Sciences,0,https://doi.org/10.4314/jfas.v10i6s.44,https://api.labs.crossref.org/works/https://doi.org/10.4314/jfas.v10i6s.44?mailto=christian.hauschke@tib.eu,2018,article,True,0,Machine Learning Methods for Solar Radiation Forecasting,Physical Sciences,Artificial Intelligence,University of El Oued,False,en,Computer Science,
https://openalex.org/W2805526129,COLLABORATIVE KNOWLEDGE MANAGEMENT,Journal of Fundamental and Applied Sciences,0,https://doi.org/10.4314/jfas.v10i4s.93,https://api.labs.crossref.org/works/https://doi.org/10.4314/jfas.v10i4s.93?mailto=christian.hauschke@tib.eu,2018,article,True,0,Knowledge Sharing in Virtual Communities,Social Sciences,Communication,University of El Oued,False,en,Social Sciences,
https://openalex.org/W2805728664,RETRACTED ARTICLE: The inflation hedging ability of individual shares: Evidence from the Johannesburg Stock Exchange (JSE),Investment Analysts Journal,0,https://doi.org/10.1080/10293523.2018.1466499,https://api.labs.crossref.org/works/https://doi.org/10.1080/10293523.2018.1466499?mailto=christian.hauschke@tib.eu,2018,article,True,0,Impact of Oil Price Shocks on Economy,Social Sciences,Economics and Econometrics,Taylor & Francis,False,en,"Economics, Econometrics and Finance",Retraction
