id,display_name,primary_location_display_name,cited_by_count,doi,crossref_call,publication_year,type,is_retracted,cited_by_percentile_year_min,primary_topic_display_name,primary_topic_domain_display_name,primary_topic_subfield_display_name,primary_location_source_host_organization_name,open_access_is_oa,language,primary_topic_field_display_name,update_nature
https://openalex.org/W1823309251,Notice of Retraction The man-hour quota establishing for professionally concentrative repair of armored equipment unit based on GERT,,0,https://doi.org/10.1109/qr2mse.2013.6625804,https://api.labs.crossref.org/works/https://doi.org/10.1109/qr2mse.2013.6625804?mailto=christian.hauschke@tib.eu,2013,article,True,0,Intelligent Control System for Industrial Processes,Physical Sciences,Control and Systems Engineering,,False,en,Engineering,
https://openalex.org/W1823458882,Notice of Retraction: Perceived life stressors and societal risk judgments of Rural Residents: Moderate effects of public satisfaction with local administrations,,0,https://doi.org/10.1109/icbmei.2011.5918037,https://api.labs.crossref.org/works/https://doi.org/10.1109/icbmei.2011.5918037?mailto=christian.hauschke@tib.eu,2011,article,True,0,Role of Positive Emotions in Well-Being,Social Sciences,Social Psychology,,False,en,Psychology,
https://openalex.org/W1823515926,Notice of Retraction: An analysis on the influences of foreign capitals' Mergers and Acquisitions on China's industry security,,0,https://doi.org/10.1109/icebeg.2011.5881451,https://api.labs.crossref.org/works/https://doi.org/10.1109/icebeg.2011.5881451?mailto=christian.hauschke@tib.eu,2011,article,True,0,International Business Strategy in Emerging Economies,Social Sciences,Strategy and Management,,False,en,"Business, Management and Accounting",
https://openalex.org/W1823713925,Notice of Retraction: Study on the efficiency of high-growth enterprise debt financing,,0,https://doi.org/10.1109/icbmei.2011.5916941,https://api.labs.crossref.org/works/https://doi.org/10.1109/icbmei.2011.5916941?mailto=christian.hauschke@tib.eu,2011,article,True,0,Corporate Governance and Financial Performance,Social Sciences,Accounting,,False,en,"Business, Management and Accounting",
https://openalex.org/W1823842318,Notice of Retraction: Fault tree analysis of Energy Management Contract,,0,https://doi.org/10.1109/icebeg.2011.5881944,https://api.labs.crossref.org/works/https://doi.org/10.1109/icebeg.2011.5881944?mailto=christian.hauschke@tib.eu,2011,article,True,0,Comprehensive Assessment of Safety in Energy and Infrastructure,Physical Sciences,"Safety, Risk, Reliability and Quality",,False,en,Engineering,
https://openalex.org/W1824085476,Notice of Retraction: Empirical study on the relationship between the growth of regional industry and its energy consumption in China,,0,https://doi.org/10.1109/icebeg.2011.5882132,https://api.labs.crossref.org/works/https://doi.org/10.1109/icebeg.2011.5882132?mailto=christian.hauschke@tib.eu,2011,article,True,0,Application of Grey System Theory in Forecasting,Social Sciences,Management Science and Operations Research,,False,en,Decision Sciences,
https://openalex.org/W1824294563,Notice of Retraction: Empirical analysis on education investment and economic growth in China,,0,https://doi.org/10.1109/icebeg.2011.5882126,https://api.labs.crossref.org/works/https://doi.org/10.1109/icebeg.2011.5882126?mailto=christian.hauschke@tib.eu,2011,article,True,0,Institutions and Economic Growth: Empirical Investigations and Theories,Social Sciences,Economics and Econometrics,,False,en,"Economics, Econometrics and Finance",
https://openalex.org/W1824537115,Notice of Retraction Analysis of applying PHM in equipment maintenance,,0,https://doi.org/10.1109/qr2mse.2013.6625945,https://api.labs.crossref.org/works/https://doi.org/10.1109/qr2mse.2013.6625945?mailto=christian.hauschke@tib.eu,2013,article,True,0,Intelligent Control System for Industrial Processes,Physical Sciences,Control and Systems Engineering,,False,en,Engineering,
https://openalex.org/W1825103130,Notice of Retraction Economic analyses of business models on agriculture industrialization,,0,https://doi.org/10.1109/qr2mse.2013.6625979,https://api.labs.crossref.org/works/https://doi.org/10.1109/qr2mse.2013.6625979?mailto=christian.hauschke@tib.eu,2013,article,True,0,Governance of Cooperatives and Mutual Associations,Social Sciences,Strategy and Management,,False,en,"Business, Management and Accounting",
https://openalex.org/W1825158794,Notice of Retraction: The performances of smallcap initial public offerings evidence in New Zealand,,0,https://doi.org/10.1109/icebeg.2011.5881424,https://api.labs.crossref.org/works/https://doi.org/10.1109/icebeg.2011.5881424?mailto=christian.hauschke@tib.eu,2011,article,True,0,Corporate Governance and Financial Performance,Social Sciences,Accounting,,False,en,"Business, Management and Accounting",
https://openalex.org/W1825699164,Notice of Retraction: Water trading and its impact in Australia,,0,https://doi.org/10.1109/icetce.2011.5775741,https://api.labs.crossref.org/works/https://doi.org/10.1109/icetce.2011.5775741?mailto=christian.hauschke@tib.eu,2011,article,True,0,Optimal Operation of Water Resources Systems,Physical Sciences,Ocean Engineering,,False,en,Engineering,
https://openalex.org/W1825811963,Notice of Retraction Study on degradation state recognition for rotating machinery early fault based on PCA-FCM,,0,https://doi.org/10.1109/icnc.2011.6022265,https://api.labs.crossref.org/works/https://doi.org/10.1109/icnc.2011.6022265?mailto=christian.hauschke@tib.eu,2011,article,True,0,Intelligent Control System for Industrial Processes,Physical Sciences,Control and Systems Engineering,,False,en,Engineering,
https://openalex.org/W1825847020,Notice of Retraction: Road maintenance reform and marketization countermeasures: On the basis of empirical analysis of rural roads in Shaanxi province,,0,https://doi.org/10.1109/icebeg.2011.5885282,https://api.labs.crossref.org/works/https://doi.org/10.1109/icebeg.2011.5885282?mailto=christian.hauschke@tib.eu,2011,article,True,0,Weigh-in-Motion Technology,Physical Sciences,Mechanical Engineering,,False,en,Engineering,
https://openalex.org/W1825879340,Notice of Retraction: Empirical study on the customers' loyalty of economic hotels,,0,https://doi.org/10.1109/icebeg.2011.5882589,https://api.labs.crossref.org/works/https://doi.org/10.1109/icebeg.2011.5882589?mailto=christian.hauschke@tib.eu,2011,article,True,0,"Customer Relationships, Behavior, and Loyalty",Social Sciences,Organizational Behavior and Human Resource Management,,False,en,"Business, Management and Accounting",
https://openalex.org/W1825979495,Notice of Retraction Fire explosion risk analysis for hydrogen storage tank based on jet fire model,,0,https://doi.org/10.1109/qr2mse.2013.6625606,https://api.labs.crossref.org/works/https://doi.org/10.1109/qr2mse.2013.6625606?mailto=christian.hauschke@tib.eu,2013,article,True,0,Challenges and Applications of Detonation Propulsion Technology,Physical Sciences,Aerospace Engineering,,False,en,Engineering,
https://openalex.org/W1826288076,Notice of Retraction: Quality research on video case of normal informational technology,,0,https://doi.org/10.1109/icebeg.2011.5881353,https://api.labs.crossref.org/works/https://doi.org/10.1109/icebeg.2011.5881353?mailto=christian.hauschke@tib.eu,2011,article,True,0,Automatic Video Summarization and Analysis,Physical Sciences,Computer Vision and Pattern Recognition,,False,en,Computer Science,
https://openalex.org/W1826298766,Notice of Retraction: Variation of Red Flower Mutant Line in Impatiens balsamina SP4 Generation Induced by Spaceflight,,0,https://doi.org/10.1109/icbbe.2011.5780022,https://api.labs.crossref.org/works/https://doi.org/10.1109/icbbe.2011.5780022?mailto=christian.hauschke@tib.eu,2011,article,True,0,Elicitor Signal Transduction for Metabolite Production,Life Sciences,Molecular Biology,,False,en,"Biochemistry, Genetics and Molecular Biology",
https://openalex.org/W1826317655,Notice of Retraction: Proposing a framework to predict travel blogs' influence on potential tourists' travel intention,,0,https://doi.org/10.1109/icebeg.2011.5887135,https://api.labs.crossref.org/works/https://doi.org/10.1109/icebeg.2011.5887135?mailto=christian.hauschke@tib.eu,2011,article,True,0,Impact of Social Media on Consumer Behavior,Social Sciences,Sociology and Political Science,,False,en,Social Sciences,
https://openalex.org/W1826320508,"Notice of Retraction: The Sedimentary Record of Heavy Metal Pollution in a River in PRD, China",,0,https://doi.org/10.1109/icbbe.2011.5780762,https://api.labs.crossref.org/works/https://doi.org/10.1109/icbbe.2011.5780762?mailto=christian.hauschke@tib.eu,2011,article,True,0,Environmental Impact of Heavy Metal Contamination,Physical Sciences,Pollution,,False,en,Environmental Science,
https://openalex.org/W1826643579,Notice of Retraction: A fuzzy quantitative method for credibility grades of service trust,,0,https://doi.org/10.1109/icebeg.2011.5881309,https://api.labs.crossref.org/works/https://doi.org/10.1109/icebeg.2011.5881309?mailto=christian.hauschke@tib.eu,2011,article,True,0,Theoretical Framework of Cognitive Informatics and Computational Intelligence,Physical Sciences,Artificial Intelligence,,False,en,Computer Science,
https://openalex.org/W1827282418,Notice of Retraction: Enhancing graduate's employability through experimental learning Taking economics and business administration undergraduates as an example,,0,https://doi.org/10.1109/icbmei.2011.5917959,https://api.labs.crossref.org/works/https://doi.org/10.1109/icbmei.2011.5917959?mailto=christian.hauschke@tib.eu,2011,article,True,0,Effectiveness of Podcasting in Higher Education,Social Sciences,Education,,False,en,Social Sciences,
https://openalex.org/W1827483699,Notice of Retraction: Prediction of TP Concentration Threshold in Eutrophic Water Based on Grey Clustering Method,,0,https://doi.org/10.1109/icbbe.2011.5780871,https://api.labs.crossref.org/works/https://doi.org/10.1109/icbbe.2011.5780871?mailto=christian.hauschke@tib.eu,2011,article,True,0,Assessment of Surface Water Quality,Physical Sciences,Water Science and Technology,,False,en,Environmental Science,
https://openalex.org/W1827562889,Notice of Retraction: An empirical study on labor relations and staffs' job performance in enterprises,,0,https://doi.org/10.1109/icebeg.2011.5881454,https://api.labs.crossref.org/works/https://doi.org/10.1109/icebeg.2011.5881454?mailto=christian.hauschke@tib.eu,2011,article,True,0,Work Engagement and Organizational Behavior,Social Sciences,Organizational Behavior and Human Resource Management,,False,en,"Business, Management and Accounting",
https://openalex.org/W1827639940,Notice of Retraction: Empirical analysis and countermeasures on the efficiency of industrial input-output in science and technology in Wuhan,,0,https://doi.org/10.1109/icpim.2011.5983640,https://api.labs.crossref.org/works/https://doi.org/10.1109/icpim.2011.5983640?mailto=christian.hauschke@tib.eu,2011,article,True,0,Application of Grey System Theory in Forecasting,Social Sciences,Management Science and Operations Research,,False,en,Decision Sciences,
https://openalex.org/W1827871176,Notice of Retraction: Eco-Toxicity of the Mixture of Xylene and Pnitrotoluene to the Freshwater Brocarded Carp,,0,https://doi.org/10.1109/icbbe.2011.5780175,https://api.labs.crossref.org/works/https://doi.org/10.1109/icbbe.2011.5780175?mailto=christian.hauschke@tib.eu,2011,article,True,0,Aquatic Ecotoxicology and Biomarkers of Pollution,Physical Sciences,"Health, Toxicology and Mutagenesis",,False,en,Environmental Science,
https://openalex.org/W1827932209,Notice of Retraction: On bilingual teaching practice of computer orgnaization and architecture,,0,https://doi.org/10.1109/icebeg.2011.5886872,https://api.labs.crossref.org/works/https://doi.org/10.1109/icebeg.2011.5886872?mailto=christian.hauschke@tib.eu,2011,article,True,0,Impact of Technology on Education and Training,Physical Sciences,Information Systems,,False,en,Computer Science,
https://openalex.org/W1827932940,Notice of Retraction: Developing knowledge city from a dynamic perspective: Practices from outstanding knowledge cities,,0,https://doi.org/10.1109/icebeg.2011.5887069,https://api.labs.crossref.org/works/https://doi.org/10.1109/icebeg.2011.5887069?mailto=christian.hauschke@tib.eu,2011,article,True,0,Smart Cities: Innovations and Challenges,Physical Sciences,Media Technology,,False,en,Engineering,
https://openalex.org/W1828070053,"Notice of Retraction: Effects of Shelterbelts on Wind Erosion Control in the Desertified Cropland of North-Western Shandong Province, China",,0,https://doi.org/10.1109/icbbe.2011.5781541,https://api.labs.crossref.org/works/https://doi.org/10.1109/icbbe.2011.5781541?mailto=christian.hauschke@tib.eu,2011,article,True,0,Aeolian Geomorphology and Wind Erosion Dynamics,Physical Sciences,Earth-Surface Processes,,False,en,Earth and Planetary Sciences,
https://openalex.org/W1828196394,Notice of Retraction: Research on development of options trading of agricultural products in China,,0,https://doi.org/10.1109/icebeg.2011.5882421,https://api.labs.crossref.org/works/https://doi.org/10.1109/icebeg.2011.5882421?mailto=christian.hauschke@tib.eu,2011,article,True,0,Application of Real Options in Investment Strategies,Social Sciences,Finance,,False,en,"Economics, Econometrics and Finance",
https://openalex.org/W1828320879,"Notice of Retraction: Consumer bounded rationality, network externality and the evolution of E-Business network industry",,0,https://doi.org/10.1109/icebeg.2011.5886813,https://api.labs.crossref.org/works/https://doi.org/10.1109/icebeg.2011.5886813?mailto=christian.hauschke@tib.eu,2011,article,True,0,Competition in Two-Sided Markets,Social Sciences,Strategy and Management,,False,en,"Business, Management and Accounting",
https://openalex.org/W1828717204,Notice of Retraction: A study on main problems and strategies of water resources in the construction process of small towns and new countryside,,0,https://doi.org/10.1109/icebeg.2011.5882288,https://api.labs.crossref.org/works/https://doi.org/10.1109/icebeg.2011.5882288?mailto=christian.hauschke@tib.eu,2011,article,True,0,Land Use Change and Environmental Impact in China,Physical Sciences,Global and Planetary Change,,False,en,Environmental Science,
https://openalex.org/W1828718252,Notice of Retraction: Analysis on the relationship between Human Resource Management and Knowledge Management,,0,https://doi.org/10.1109/icebeg.2011.5881460,https://api.labs.crossref.org/works/https://doi.org/10.1109/icebeg.2011.5881460?mailto=christian.hauschke@tib.eu,2011,article,True,0,Knowledge Sharing in Virtual Communities,Social Sciences,Communication,,False,en,Social Sciences,
https://openalex.org/W1828728121,"Notice of Retraction: Study on the Treatment of Coal Chemical Wastewater by the Combined Process of Coagulation, Deposit of MAP and UV/Fenton Catalysis Oxygenation",,0,https://doi.org/10.1109/icbbe.2011.5781000,https://api.labs.crossref.org/works/https://doi.org/10.1109/icbbe.2011.5781000?mailto=christian.hauschke@tib.eu,2011,article,True,0,Advanced Oxidation Processes for Water Treatment,Physical Sciences,Water Science and Technology,,False,en,Environmental Science,
https://openalex.org/W1829129108,Notice of Retraction: Mechanism of cooperative education,,0,https://doi.org/10.1109/icebeg.2011.5881541,https://api.labs.crossref.org/works/https://doi.org/10.1109/icebeg.2011.5881541?mailto=christian.hauschke@tib.eu,2011,article,True,0,Family Business Studies and Management,Social Sciences,Organizational Behavior and Human Resource Management,,False,en,"Business, Management and Accounting",
https://openalex.org/W1829297515,Notice of Retraction: Analysis and comparison on Wang-Dao teaching and Wan-Dao teaching in graduate education,,0,https://doi.org/10.1109/icebeg.2011.5882532,https://api.labs.crossref.org/works/https://doi.org/10.1109/icebeg.2011.5882532?mailto=christian.hauschke@tib.eu,2011,article,True,0,Meaning and Significance of Work,Social Sciences,Demography,,False,en,Social Sciences,
https://openalex.org/W1829417298,"Notice of Retraction: Analysis of factors affecting the purchasing patterns, practices and concepts of diary product consumers in Ningxia Region and studies on the related marketing tactics",,0,https://doi.org/10.1109/icbmei.2011.5917989,https://api.labs.crossref.org/works/https://doi.org/10.1109/icbmei.2011.5917989?mailto=christian.hauschke@tib.eu,2011,article,True,0,"Customer Relationships, Behavior, and Loyalty",Social Sciences,Organizational Behavior and Human Resource Management,,False,en,"Business, Management and Accounting",
https://openalex.org/W1829535037,Notice of Retraction: Detection of Hepatitis E Virus in Pigs from Slaughterhouses in Shanghai of China,,0,https://doi.org/10.1109/icbbe.2011.5781509,https://api.labs.crossref.org/works/https://doi.org/10.1109/icbbe.2011.5781509?mailto=christian.hauschke@tib.eu,2011,article,True,0,Hepatitis E Infection and Treatment,Health Sciences,Hepatology,,False,en,Medicine,
https://openalex.org/W1829662220,Notice of Retraction: Study of Hydrogen Sulfide Removal on MDEA Modified Adsorbents for Gas Purification,,0,https://doi.org/10.1109/icbbe.2011.5781286,https://api.labs.crossref.org/works/https://doi.org/10.1109/icbbe.2011.5781286?mailto=christian.hauschke@tib.eu,2011,article,True,0,Sulfur Compounds Removal Technologies,Physical Sciences,Mechanical Engineering,,False,en,Engineering,
https://openalex.org/W1829822625,Notice of Retraction: Effect of the RMB exchange rate change on FDI inflow divided by industry,,0,https://doi.org/10.1109/icebeg.2011.5882345,https://api.labs.crossref.org/works/https://doi.org/10.1109/icebeg.2011.5882345?mailto=christian.hauschke@tib.eu,2011,article,True,0,International Business Strategy in Emerging Economies,Social Sciences,Strategy and Management,,False,en,"Business, Management and Accounting",
https://openalex.org/W1830028127,Notice of Retraction: Design of Ti/Al Multilayers for Soft X-Ray Mirrors,,0,https://doi.org/10.1109/paccs.2011.5990239,https://api.labs.crossref.org/works/https://doi.org/10.1109/paccs.2011.5990239?mailto=christian.hauschke@tib.eu,2011,article,True,0,X-ray Imaging Techniques and Applications,Physical Sciences,Radiation,,False,en,Physics and Astronomy,
https://openalex.org/W1830062345,"Notice of Retraction: The promotion strategy of relationship between knowledge management, niche optimization and competition advantage",,0,https://doi.org/10.1109/icebeg.2011.5885344,https://api.labs.crossref.org/works/https://doi.org/10.1109/icebeg.2011.5885344?mailto=christian.hauschke@tib.eu,2011,article,True,0,Coopetition in Business Networks and Innovation,Social Sciences,Strategy and Management,,False,en,"Business, Management and Accounting",
https://openalex.org/W1830690931,Notice of Retraction: Correlation analysis of the rare earth oxide prices,,0,https://doi.org/10.1109/icebeg.2011.5882336,https://api.labs.crossref.org/works/https://doi.org/10.1109/icebeg.2011.5882336?mailto=christian.hauschke@tib.eu,2011,article,True,0,Economic Development and Policy Analysis in Emerging Markets,Social Sciences,Economics and Econometrics,,False,en,"Economics, Econometrics and Finance",
https://openalex.org/W1830718807,Notice of Retraction A fusion method of zero-failure data in different environments for reliability assessment of success-failure type products,,0,https://doi.org/10.1109/qr2mse.2013.6625758,https://api.labs.crossref.org/works/https://doi.org/10.1109/qr2mse.2013.6625758?mailto=christian.hauschke@tib.eu,2013,article,True,0,Risk Analysis and Management,Social Sciences,"Statistics, Probability and Uncertainty",,False,en,Decision Sciences,
