id,display_name,primary_location_display_name,cited_by_count,doi,crossref_call,publication_year,type,is_retracted,cited_by_percentile_year_min,primary_topic_display_name,primary_topic_domain_display_name,primary_topic_subfield_display_name,primary_location_source_host_organization_name,open_access_is_oa,language,primary_topic_field_display_name,update_nature
https://openalex.org/W3013910161,"&lt;p&gt;Disposal Practices of Unused Medications Among Patients in Public Health Centers of Dessie Town, Northeast Ethiopia: A Cross Sectional Survey&lt;/p&gt;",Integrated pharmacy research and practice,5,https://doi.org/10.2147/iprp.s243069,https://api.labs.crossref.org/works/https://doi.org/10.2147/iprp.s243069?mailto=christian.hauschke@tib.eu,2020,article,True,83,Global Burden of Antimicrobial Resistance,Life Sciences,Applied Microbiology and Biotechnology,Dove Medical Press,True,en,Immunology and Microbiology,
https://openalex.org/W3014189447,RETRACTED: Machine learning approaches for estimation of sediment settling velocity,Journal of Hydrology,5,https://doi.org/10.1016/j.jhydrol.2020.124911,https://api.labs.crossref.org/works/https://doi.org/10.1016/j.jhydrol.2020.124911?mailto=christian.hauschke@tib.eu,2020,article,True,83,Hydrological Modeling and Water Resource Management,Physical Sciences,Water Science and Technology,Elsevier BV,False,en,Environmental Science,
https://openalex.org/W3014416883,RETRACTED ARTICLE: Laquinimod inhibits MMP+ induced NLRP3 inflammasome activation in human neuronal cells,Immunopharmacology and Immunotoxicology,5,https://doi.org/10.1080/08923973.2020.1746967,https://api.labs.crossref.org/works/https://doi.org/10.1080/08923973.2020.1746967?mailto=christian.hauschke@tib.eu,2020,article,True,83,Molecular Mechanisms of Inflammasome Activation and Regulation,Life Sciences,Molecular Biology,Taylor & Francis,False,en,"Biochemistry, Genetics and Molecular Biology",
https://openalex.org/W3014484343,Preventive effect of lemon seed flavonoids on carbon tetrachloride-induced liver injury in mice,RSC Advances,5,https://doi.org/10.1039/d0ra01415j,https://api.labs.crossref.org/works/https://doi.org/10.1039/d0ra01415j?mailto=christian.hauschke@tib.eu,2020,article,True,83,Mechanisms of Drug-Induced Hepatotoxicity,Life Sciences,Pharmacology,Royal Society of Chemistry,True,en,"Pharmacology, Toxicology and Pharmaceutics",
https://openalex.org/W3014663724,"Retracted: 0D/3D Cu(II)‐containing coordination complexes constructed from the N,O‐donor ligands: structural insights and anticancer activity",ChemistrySelect,5,https://doi.org/10.1002/slct.201904571,https://api.labs.crossref.org/works/https://doi.org/10.1002/slct.201904571?mailto=christian.hauschke@tib.eu,2020,article,True,83,Chemistry and Applications of Metal-Organic Frameworks,Physical Sciences,Inorganic Chemistry,Wiley-Blackwell,False,en,Chemistry,
https://openalex.org/W3014851556,RETRACTED ARTICLE: Spatial Distribution Characteristics and Influencing Factors of Rural Settlements in Plateau Mountainous Multi-ethnic Gathering Area,Wireless Personal Communications,5,https://doi.org/10.1007/s11277-020-07244-y,https://api.labs.crossref.org/works/https://doi.org/10.1007/s11277-020-07244-y?mailto=christian.hauschke@tib.eu,2020,article,True,83,Global Analysis of Ecosystem Services and Land Use,Physical Sciences,Global and Planetary Change,Springer Science+Business Media,False,en,Environmental Science,
https://openalex.org/W3015653343,RETRACTED: COVID-19 admissions calculators: General population and paediatric cohort,Early Human Development,5,https://doi.org/10.1016/j.earlhumdev.2020.105043,https://api.labs.crossref.org/works/https://doi.org/10.1016/j.earlhumdev.2020.105043?mailto=christian.hauschke@tib.eu,2020,article,True,83,Coronavirus Disease 2019,Health Sciences,Infectious Diseases,Elsevier BV,True,en,Medicine,
https://openalex.org/W3015657660,RETRACTED ARTICLE: Load prediction using (DoG–ALMS) for resource allocation based on IFP soft computing approach in cloud computing,Soft Computing,5,https://doi.org/10.1007/s00500-020-04864-1,https://api.labs.crossref.org/works/https://doi.org/10.1007/s00500-020-04864-1?mailto=christian.hauschke@tib.eu,2020,article,True,83,Cloud Computing and Big Data Technologies,Physical Sciences,Information Systems,Springer Science+Business Media,False,en,Computer Science,
https://openalex.org/W3015768470,Predictions of Drug–Protein Interactions and Study of Magnetically Assisted Release Dynamics of 5-Fluorouracil from Soya Protein-Coated Iron Oxide Core–Shell Nanoparticles,ACS Applied Bio Materials,5,https://doi.org/10.1021/acsabm.0c00178,https://api.labs.crossref.org/works/https://doi.org/10.1021/acsabm.0c00178?mailto=christian.hauschke@tib.eu,2020,article,True,83,Role of Fructans in Nutrition and Health,Health Sciences,Nutrition and Dietetics,American Chemical Society,False,en,Nursing,
https://openalex.org/W3015838585,Retraction of “Structurally Engineered Hollow Graphitized Carbon Nanocages as High-Performance Anodes for Potassium Ion Batteries”,ACS Nano,5,https://doi.org/10.1021/acsnano.0c01150,https://api.labs.crossref.org/works/https://doi.org/10.1021/acsnano.0c01150?mailto=christian.hauschke@tib.eu,2020,article,True,83,Lithium-ion Battery Technology,Physical Sciences,Electrical and Electronic Engineering,American Chemical Society,True,en,Engineering,
https://openalex.org/W3016496808,Abscisic Acid Is Required for Root Elongation Associated With Ca2+ Influx in Response to Water Stress,Frontiers in Plant Science,5,https://doi.org/10.3389/fpls.2020.00332,https://api.labs.crossref.org/works/https://doi.org/10.3389/fpls.2020.00332?mailto=christian.hauschke@tib.eu,2020,article,True,83,Plant Nutrient Uptake and Signaling Pathways,Life Sciences,Plant Science,Frontiers Media,True,en,Agricultural and Biological Sciences,
https://openalex.org/W3016551904,A Fast High-Affinity Fluorescent Serotonin Biosensor Engineered from a Tick Lipocalin,bioRxiv (Cold Spring Harbor Laboratory),5,https://doi.org/10.1101/2020.04.18.048397,https://api.labs.crossref.org/works/https://doi.org/10.1101/2020.04.18.048397?mailto=christian.hauschke@tib.eu,2020,article,True,83,Bioluminescence Imaging and Reporter Systems,Life Sciences,Molecular Biology,Cold Spring Harbor Laboratory,True,en,"Biochemistry, Genetics and Molecular Biology",
https://openalex.org/W3016560987,RETRACTED: Tin diselenide nanoflakes decorated hierarchical 1D TiO2 fiber: A robust and highly efficient co-catalyst for hydrogen evolution reaction,Applied Surface Science,5,https://doi.org/10.1016/j.apsusc.2020.146333,https://api.labs.crossref.org/works/https://doi.org/10.1016/j.apsusc.2020.146333?mailto=christian.hauschke@tib.eu,2020,article,True,83,Photocatalytic Materials for Solar Energy Conversion,Physical Sciences,"Renewable Energy, Sustainability and the Environment",Elsevier BV,False,en,Energy,
https://openalex.org/W3016921386,RETRACTED: G-5555 synergized miR-485-5p to alleviate cisplatin resistance in ovarian cancer cells via Pi3k/Akt signaling pathway,Journal of Reproductive Immunology,5,https://doi.org/10.1016/j.jri.2020.103129,https://api.labs.crossref.org/works/https://doi.org/10.1016/j.jri.2020.103129?mailto=christian.hauschke@tib.eu,2020,article,True,83,Role of Pim Oncogenes in Tumorigenesis,Health Sciences,Pathology and Forensic Medicine,Elsevier BV,False,en,Medicine,
https://openalex.org/W3016929199,RETRACTED: Long noncoding RNA LCTS5 inhibits non-small cell lung cancer by interacting with INO80,Life Sciences,5,https://doi.org/10.1016/j.lfs.2020.117680,https://api.labs.crossref.org/works/https://doi.org/10.1016/j.lfs.2020.117680?mailto=christian.hauschke@tib.eu,2020,article,True,83,Role of Long Noncoding RNAs in Cancer and Development,Life Sciences,Cancer Research,Elsevier BV,False,en,"Biochemistry, Genetics and Molecular Biology",
https://openalex.org/W3017305975,RETRACTED: Preparation of high-performance polymer piezoelectric thin film by electric field induction technology,Polymer,5,https://doi.org/10.1016/j.polymer.2020.122486,https://api.labs.crossref.org/works/https://doi.org/10.1016/j.polymer.2020.122486?mailto=christian.hauschke@tib.eu,2020,article,True,83,Wearable Nanogenerator Technology,Physical Sciences,Biomedical Engineering,Elsevier BV,False,en,Engineering,
https://openalex.org/W3017639727,Effect of miR-195-5p on cardiomyocyte apoptosis in rats with heart failure by regulating TGF-β1/Smad3 signaling pathway,Bioscience Reports,5,https://doi.org/10.1042/bsr20200566,https://api.labs.crossref.org/works/https://doi.org/10.1042/bsr20200566?mailto=christian.hauschke@tib.eu,2020,article,True,83,Molecular Mechanisms of Cardiac Remodeling and Repair,Health Sciences,Cardiology and Cardiovascular Medicine,Portland Press,True,en,Medicine,
https://openalex.org/W3017990766,"RETRACTED ARTICLE: Light hydrocarbon geochemistry: insight into oils/condensates families and inferred source rocks of the Woodford–Mississippian tight oil play in North-Central Oklahoma, USA",Petroleum Science,5,https://doi.org/10.1007/s12182-020-00441-1,https://api.labs.crossref.org/works/https://doi.org/10.1007/s12182-020-00441-1?mailto=christian.hauschke@tib.eu,2020,article,True,83,Characterization of Shale Gas Pore Structure,Physical Sciences,Mechanics of Materials,Elsevier BV,True,en,Engineering,
https://openalex.org/W3019380758,<i>Retracted:</i> Antibacterial activity and mechanism of <i>Tetrapleura tetraptera</i> stem extract against <i>Salmonella</i> strains and its application in raw chicken meat,Journal of Food Processing and Preservation,5,https://doi.org/10.1111/jfpp.14489,https://api.labs.crossref.org/works/https://doi.org/10.1111/jfpp.14489?mailto=christian.hauschke@tib.eu,2020,article,True,83,Antimicrobial Properties of Essential Oils in Foods,Life Sciences,Food Science,Wiley-Blackwell,True,en,Agricultural and Biological Sciences,
https://openalex.org/W3022192365,Retracted: Convolutional neural network based on differential privacy in exponential attenuation mode for image classification,Iet Image Processing,5,https://doi.org/10.1049/iet-ipr.2020.0078,https://api.labs.crossref.org/works/https://doi.org/10.1049/iet-ipr.2020.0078?mailto=christian.hauschke@tib.eu,2020,article,True,83,Privacy-Preserving Techniques for Data Analysis and Machine Learning,Physical Sciences,Artificial Intelligence,Institution of Engineering and Technology,True,en,Computer Science,
https://openalex.org/W3022354184,RETRACTED ARTICLE: A distributed fuzzy multicast routing protocol (DFMCRP) for maximizing the network lifetime in mobile ad-hoc networks,Journal of Ambient Intelligence and Humanized Computing,5,https://doi.org/10.1007/s12652-020-01936-w,https://api.labs.crossref.org/works/https://doi.org/10.1007/s12652-020-01936-w?mailto=christian.hauschke@tib.eu,2020,article,True,83,Ad Hoc Wireless Networks Research,Physical Sciences,Computer Networks and Communications,Springer Science+Business Media,False,en,Computer Science,
https://openalex.org/W3022997198,RETRACTED: COVID-19 and potential global mortality - Revisited,Early Human Development,5,https://doi.org/10.1016/j.earlhumdev.2020.105054,https://api.labs.crossref.org/works/https://doi.org/10.1016/j.earlhumdev.2020.105054?mailto=christian.hauschke@tib.eu,2020,article,True,83,Coronavirus Disease 2019,Health Sciences,Infectious Diseases,Elsevier BV,True,en,Medicine,
https://openalex.org/W3023389650,RETRACTED ARTICLE: Time series real time naive bayes electrocardiogram signal classification for efficient disease prediction using fuzzy rules,Journal of Ambient Intelligence and Humanized Computing,5,https://doi.org/10.1007/s12652-020-02003-0,https://api.labs.crossref.org/works/https://doi.org/10.1007/s12652-020-02003-0?mailto=christian.hauschke@tib.eu,2020,article,True,83,Analysis of Electrocardiogram Signals,Health Sciences,Cardiology and Cardiovascular Medicine,Springer Science+Business Media,False,en,Medicine,
https://openalex.org/W3023846484,Association of cigarette smoking and metabolic syndrome in a puerto rican adult population.,PubMed,5,,https://api.labs.crossref.org/works/null?mailto=christian.hauschke@tib.eu,2014,article,True,84,Influence of Corporations on Public Health Policy,Social Sciences,Organizational Behavior and Human Resource Management,National Institutes of Health,False,en,"Business, Management and Accounting",
https://openalex.org/W3023922690,RETRACTED: Stimulus-responsive tea polyphenols as nanocarrier for selective intracellular drug delivery,Journal of Biomaterials Applications,5,https://doi.org/10.1177/0885328220924539,https://api.labs.crossref.org/works/https://doi.org/10.1177/0885328220924539?mailto=christian.hauschke@tib.eu,2020,article,True,83,Nanotechnology and Imaging for Cancer Therapy and Diagnosis,Physical Sciences,Biomedical Engineering,SAGE Publishing,False,en,Engineering,
https://openalex.org/W3024070038,Smart community security monitoring based on artificial intelligence and improved machine learning algorithm,Journal of Intelligent and Fuzzy Systems,5,https://doi.org/10.3233/jifs-179809,https://api.labs.crossref.org/works/https://doi.org/10.3233/jifs-179809?mailto=christian.hauschke@tib.eu,2020,article,True,83,Anomaly Detection in High-Dimensional Data,Physical Sciences,Artificial Intelligence,IOS Press,False,en,Computer Science,
https://openalex.org/W3024254754,Acellularized spinal cord scaffolds incorporating bpV(pic)/PLGA microspheres promote axonal regeneration and functional recovery after spinal cord injury,RSC Advances,5,https://doi.org/10.1039/d0ra02661a,https://api.labs.crossref.org/works/https://doi.org/10.1039/d0ra02661a?mailto=christian.hauschke@tib.eu,2020,article,True,83,Pathophysiology and Treatment of Spinal Cord Injury,Health Sciences,Pathology and Forensic Medicine,Royal Society of Chemistry,True,en,Medicine,
https://openalex.org/W3024851445,Intelligent driving system of robot based on computer vision and neural network algorithm,Journal of Intelligent and Fuzzy Systems,5,https://doi.org/10.3233/jifs-179803,https://api.labs.crossref.org/works/https://doi.org/10.3233/jifs-179803?mailto=christian.hauschke@tib.eu,2020,article,True,83,Comprehensive Survey of Big Data Mining Approaches,Physical Sciences,Information Systems,IOS Press,False,en,Computer Science,
https://openalex.org/W3024962723,"Propensities of Old Growth, Mature and Regrowth Wet Eucalypt Forest, and Eucalyptus nitens Plantation, to Burn During Wildfire and Suffer Fire-Induced Crown Death",Fire,5,https://doi.org/10.3390/fire3020013,https://api.labs.crossref.org/works/https://doi.org/10.3390/fire3020013?mailto=christian.hauschke@tib.eu,2020,article,True,83,Impact of Climate Change on Forest Wildfires,Physical Sciences,Global and Planetary Change,Multidisciplinary Digital Publishing Institute,True,en,Environmental Science,
https://openalex.org/W3025202056,RETRACTED ARTICLE: Behavior based fuzzy security protocol for wireless networks,Journal of Ambient Intelligence and Humanized Computing,5,https://doi.org/10.1007/s12652-020-02060-5,https://api.labs.crossref.org/works/https://doi.org/10.1007/s12652-020-02060-5?mailto=christian.hauschke@tib.eu,2020,article,True,83,Network Intrusion Detection and Defense Mechanisms,Physical Sciences,Computer Networks and Communications,Springer Science+Business Media,False,en,Computer Science,
https://openalex.org/W3026291831,Protective effect of miR-146 against kidney injury in diabetic nephropathy rats through mediating the NF-κB signaling pathway.,PubMed,5,https://doi.org/10.26355/eurrev_202003_20688,https://api.labs.crossref.org/works/https://doi.org/10.26355/eurrev_202003_20688?mailto=christian.hauschke@tib.eu,2020,article,True,83,Role of Long Noncoding RNAs in Cancer and Development,Life Sciences,Cancer Research,National Institutes of Health,False,en,"Biochemistry, Genetics and Molecular Biology",
https://openalex.org/W3026836873,RETRACTED ARTICLE: Patients with ankylosing spondylitis treatment by golimumab: a systematic review and meta-analysis,European Spine Journal,5,https://doi.org/10.1007/s00586-020-06466-9,https://api.labs.crossref.org/works/https://doi.org/10.1007/s00586-020-06466-9?mailto=christian.hauschke@tib.eu,2020,article,True,83,Classification and Treatment of Spondyloarthritis,Health Sciences,Rheumatology,Springer Science+Business Media,False,en,Medicine,
https://openalex.org/W3028330133,RETRACTED: Normal reference ranges for fetal cardiac function: Assessed by modified Doppler myocardial performance index (Mod MPI) in the Egyptian population,European Journal of Obstetrics & Gynecology and Reproductive Biology,5,https://doi.org/10.1016/j.ejogrb.2020.05.011,https://api.labs.crossref.org/works/https://doi.org/10.1016/j.ejogrb.2020.05.011?mailto=christian.hauschke@tib.eu,2020,article,True,83,Pathophysiology and Management of Preeclampsia,Health Sciences,Obstetrics and Gynecology,Elsevier BV,False,en,Medicine,
https://openalex.org/W3029467907,RETRACTED ARTICLE: Phycoremediation of automobile exhaust gases using green microalgae: a twofold advantage for pollutant removal and concurrent biomass/lipid yields,Sustainable Environment Research,5,https://doi.org/10.1186/s42834-020-0046-z,https://api.labs.crossref.org/works/https://doi.org/10.1186/s42834-020-0046-z?mailto=christian.hauschke@tib.eu,2020,article,True,83,Microalgae as a Source for Biofuels Production,Physical Sciences,"Renewable Energy, Sustainability and the Environment",BioMed Central,True,en,Energy,
https://openalex.org/W3031801523,Expression of concern: Identification of volatile constituents released from IQOS heat-not-burn tobacco HeatSticks using a direct sampling method,Tobacco Control,5,https://doi.org/10.1136/tobaccocontrol-2019-055521,https://api.labs.crossref.org/works/https://doi.org/10.1136/tobaccocontrol-2019-055521?mailto=christian.hauschke@tib.eu,2020,article,True,83,Breath Analysis Technology,Physical Sciences,Biomedical Engineering,BMJ,True,en,Engineering,
https://openalex.org/W3031949016,siVEGF-loaded nanoparticle uptake by tumor-associated vascular endothelial cells for hepatocellular carcinoma,Nanomedicine,5,https://doi.org/10.2217/nnm-2020-0082,https://api.labs.crossref.org/works/https://doi.org/10.2217/nnm-2020-0082?mailto=christian.hauschke@tib.eu,2020,article,True,83,Molecular Mechanisms of Angiogenesis and Vascular Function,Life Sciences,Molecular Biology,Future Medicine,False,en,"Biochemistry, Genetics and Molecular Biology",
https://openalex.org/W3032445626,miR-135a inhibits malignant proliferation and diffusion of non-small cell lung cancer cells by down-regulating ROCK1 protein,Bioscience Reports,5,https://doi.org/10.1042/bsr20201276,https://api.labs.crossref.org/works/https://doi.org/10.1042/bsr20201276?mailto=christian.hauschke@tib.eu,2020,article,True,83,RNA Methylation and Modification in Gene Expression,Life Sciences,Molecular Biology,Portland Press,True,en,"Biochemistry, Genetics and Molecular Biology",
https://openalex.org/W3032461005,RETRACTED ARTICLE: Building a computational model for mood classification of music by integrating an asymptotic approach with the machine learning techniques,Journal of Ambient Intelligence and Humanized Computing,5,https://doi.org/10.1007/s12652-020-02145-1,https://api.labs.crossref.org/works/https://doi.org/10.1007/s12652-020-02145-1?mailto=christian.hauschke@tib.eu,2020,article,True,83,Audio Signal Classification and Analysis,Physical Sciences,Signal Processing,Springer Science+Business Media,False,en,Computer Science,
https://openalex.org/W3032586149,Noninvasive versus invasive ventilation: one modality cannot fit all during COVID-19 outbreak,Korean Journal of Anesthesiology,5,https://doi.org/10.4097/kja.20227,https://api.labs.crossref.org/works/https://doi.org/10.4097/kja.20227?mailto=christian.hauschke@tib.eu,2020,article,True,83,Mechanical Ventilation in Respiratory Failure and ARDS,Health Sciences,Pulmonary and Respiratory Medicine,Korean Society of Anesthesiologists,True,en,Medicine,
https://openalex.org/W3033023488,<i>Retracted:</i> An ANP‐fuzzy evaluation model of food quality safety supervision based on China's data,Food Science and Nutrition,5,https://doi.org/10.1002/fsn3.1561,https://api.labs.crossref.org/works/https://doi.org/10.1002/fsn3.1561?mailto=christian.hauschke@tib.eu,2020,article,True,83,Food Safety and Hygiene Practices,Life Sciences,Food Science,Wiley-Blackwell,True,en,Agricultural and Biological Sciences,
https://openalex.org/W3033540174,RETRACTED: Ultrasound image guided lateral cervical approach to stellate ganglion block for cervical headache,Neuroscience Letters,5,https://doi.org/10.1016/j.neulet.2020.135139,https://api.labs.crossref.org/works/https://doi.org/10.1016/j.neulet.2020.135139?mailto=christian.hauschke@tib.eu,2020,article,True,83,Pathophysiology of Lumbar Disc Degeneration and Treatment,Health Sciences,Pathology and Forensic Medicine,Elsevier BV,False,en,Medicine,
https://openalex.org/W3033924390,College multimedia teaching system devise and application evaluation,International Journal of Electrical Engineering Education,5,https://doi.org/10.1177/0020720920928477,https://api.labs.crossref.org/works/https://doi.org/10.1177/0020720920928477?mailto=christian.hauschke@tib.eu,2020,article,True,83,Education and Leadership in Complex Systems,Social Sciences,Education,SAGE Publishing,False,en,Social Sciences,
https://openalex.org/W3034335471,RETRACTED: Radiosynthesis and biological evaluation of fluorine-18 labeled N-acetylgalactosamine derivative [18F]FPGalNAc for PET imaging of asialoglycoprotein receptor-positive tumors,Nuclear Medicine and Biology,5,https://doi.org/10.1016/j.nucmedbio.2020.06.003,https://api.labs.crossref.org/works/https://doi.org/10.1016/j.nucmedbio.2020.06.003?mailto=christian.hauschke@tib.eu,2020,article,True,83,Ubiquitin-Proteasome Proteolytic Pathway,Life Sciences,Molecular Biology,Elsevier BV,False,en,"Biochemistry, Genetics and Molecular Biology",
https://openalex.org/W3034368676,RETRACTED: The prediction of undergraduate student performance in chemistry course using multilayer perceptron,IOP Conference Series: Materials Science and Engineering,5,https://doi.org/10.1088/1757-899x/769/1/012027,https://api.labs.crossref.org/works/https://doi.org/10.1088/1757-899x/769/1/012027?mailto=christian.hauschke@tib.eu,2020,article,True,83,Computational Methods in Drug Discovery,Physical Sciences,Computational Theory and Mathematics,IOP Publishing,True,en,Computer Science,
https://openalex.org/W3034503689,Bimetallic platinum–rhodium nanocomposites for dimethylamine borane dehydrogenation: an experimental and density functional theory study,Catalysis Science & Technology,5,https://doi.org/10.1039/d0cy00641f,https://api.labs.crossref.org/works/https://doi.org/10.1039/d0cy00641f?mailto=christian.hauschke@tib.eu,2020,article,True,83,Materials and Methods for Hydrogen Storage,Physical Sciences,Materials Chemistry,Royal Society of Chemistry,False,en,Materials Science,
https://openalex.org/W3035565519,RETRACTED ARTICLE: Investigation of guided wave dispersion characteristics for fundamental modes in an axisymmetric cylindrical waveguide using rooting strategy approach,Mechanics of Advanced Materials and Structures,5,https://doi.org/10.1080/15376494.2020.1777601,https://api.labs.crossref.org/works/https://doi.org/10.1080/15376494.2020.1777601?mailto=christian.hauschke@tib.eu,2020,article,True,83,Guided Wave Structural Health Monitoring in Materials,Physical Sciences,Mechanics of Materials,Taylor & Francis,False,en,Engineering,
https://openalex.org/W3035810551,RETRACTED ARTICLE: Computer aided innovation method for detection and classification of cervical cancer using ANFIS classifier,Journal of Ambient Intelligence and Humanized Computing,5,https://doi.org/10.1007/s12652-020-02191-9,https://api.labs.crossref.org/works/https://doi.org/10.1007/s12652-020-02191-9?mailto=christian.hauschke@tib.eu,2020,article,True,83,Machine Learning in Healthcare and Medicine,Health Sciences,Health Information Management,Springer Science+Business Media,False,en,Health Professions,
https://openalex.org/W3035831033,RETRACTED ARTICLE: A Nano-biosensors model with optimized bio-cyber communication system based on Internet of Bio-Nano Things for thrombosis prediction,Journal of Nanoparticle Research,5,https://doi.org/10.1007/s11051-020-04905-8,https://api.labs.crossref.org/works/https://doi.org/10.1007/s11051-020-04905-8?mailto=christian.hauschke@tib.eu,2020,article,True,83,Nanonetworks and Molecular Communication,Physical Sciences,Biomedical Engineering,Springer Science+Business Media,False,en,Engineering,
https://openalex.org/W3036129112,Overexpression of Wnt7a enhances radiosensitivity of non-small-cell lung cancer via the Wnt/JNK pathway,Biology Open,5,https://doi.org/10.1242/bio.050575,https://api.labs.crossref.org/works/https://doi.org/10.1242/bio.050575?mailto=christian.hauschke@tib.eu,2020,article,True,83,Wnt Signaling in Development and Disease,Life Sciences,Molecular Biology,The Company of Biologists,True,en,"Biochemistry, Genetics and Molecular Biology",
https://openalex.org/W3036752012,RETRACTED: Development of Graphic Design Based on Artificial Intelligence,Journal of Physics: Conference Series,5,https://doi.org/10.1088/1742-6596/1533/3/032022,https://api.labs.crossref.org/works/https://doi.org/10.1088/1742-6596/1533/3/032022?mailto=christian.hauschke@tib.eu,2020,article,True,83,Innovations in Visual Communication Design and Technology,Physical Sciences,Computer Graphics and Computer-Aided Design,IOP Publishing,True,en,Computer Science,
