id,display_name,primary_location_display_name,cited_by_count,doi,crossref_call,publication_year,type,is_retracted,cited_by_percentile_year_min,primary_topic_display_name,primary_topic_domain_display_name,primary_topic_subfield_display_name,primary_location_source_host_organization_name,open_access_is_oa,language,primary_topic_field_display_name,update_nature
https://openalex.org/W2049327743,"Identification of 17 HrpX-Regulated Proteins Including Two Novel Type III Effectors, XOC_3956 and XOC_1550, in Xanthomonas oryzae pv. oryzicola",PLOS ONE,11,https://doi.org/10.1371/journal.pone.0093205,https://api.labs.crossref.org/works/https://doi.org/10.1371/journal.pone.0093205?mailto=christian.hauschke@tib.eu,2014,article,True,88,Genomics and Pathogenicity of Plant Pathogenic Bacteria,Life Sciences,Plant Science,Public Library of Science,True,en,Agricultural and Biological Sciences,
https://openalex.org/W2052141192,Optimal quantum communication using multiparticle partially entangled states,Physical Review A,11,https://doi.org/10.1103/physreva.87.022307,https://api.labs.crossref.org/works/https://doi.org/10.1103/physreva.87.022307?mailto=christian.hauschke@tib.eu,2013,article,True,88,Quantum Information and Computation,Physical Sciences,Artificial Intelligence,American Physical Society,True,en,Computer Science,
https://openalex.org/W2052184817,RETRACTED ARTICLE: Artificial neural networks for prediction compressive strength of geopolymers with seeded waste ashes,Neural Computing and Applications,11,https://doi.org/10.1007/s00521-012-0931-4,https://api.labs.crossref.org/works/https://doi.org/10.1007/s00521-012-0931-4?mailto=christian.hauschke@tib.eu,2012,article,True,88,Geopolymer and Alternative Cementitious Materials,Physical Sciences,Civil and Structural Engineering,Springer Science+Business Media,False,en,Engineering,
https://openalex.org/W2058220378,Activation of the AMP-Activated Protein Kinase (AMPK) by Nitrated Lipids in Endothelial Cells,PLOS ONE,11,https://doi.org/10.1371/journal.pone.0031056,https://api.labs.crossref.org/works/https://doi.org/10.1371/journal.pone.0031056?mailto=christian.hauschke@tib.eu,2012,article,True,88,Role of AMP-Activated Protein Kinase in Cellular Metabolism,Life Sciences,Molecular Biology,Public Library of Science,True,en,"Biochemistry, Genetics and Molecular Biology",
https://openalex.org/W2059286540,Nuclear Factor Kappa-B Signaling Is Integral to Ocular Neovascularization in Ischemia-Independent Microenvironment,PLOS ONE,11,https://doi.org/10.1371/journal.pone.0101602,https://api.labs.crossref.org/works/https://doi.org/10.1371/journal.pone.0101602?mailto=christian.hauschke@tib.eu,2014,article,True,88,Age-Related Macular Degeneration Research,Health Sciences,Ophthalmology,Public Library of Science,True,en,Medicine,
https://openalex.org/W2063132780,Allergic urticaria: A case report of rare skin allergy with a common mouthwash,Indian Journal of Dermatology,11,https://doi.org/10.4103/0019-5154.105323,https://api.labs.crossref.org/works/https://doi.org/10.4103/0019-5154.105323?mailto=christian.hauschke@tib.eu,2013,article,True,88,Hypersensitivity Reactions to Drugs and Medications,Health Sciences,Pharmacology,Medknow,True,en,Medicine,
https://openalex.org/W2063230744,Impact of an educational program on nursing students&amp;rsquo; caring and self-perception in intensive clinical training in Jordan,Advances in medical education and practice,11,https://doi.org/10.2147/amep.s21201,https://api.labs.crossref.org/works/https://doi.org/10.2147/amep.s21201?mailto=christian.hauschke@tib.eu,2011,article,True,88,Mental Health and Quality of Life,Social Sciences,Clinical Psychology,Dove Medical Press,True,en,Psychology,
https://openalex.org/W2064839527,Phosphatase and Tensin Homolog Deleted on Chromosome 10 (PTEN) and PH Domain and Leucine-rich Repeat Phosphatase Cross-talk (PHLPP) in Cancer Cells and in Transforming Growth Factor β-Activated Stem Cells,Journal of Biological Chemistry,11,https://doi.org/10.1074/jbc.m113.537241,https://api.labs.crossref.org/works/https://doi.org/10.1074/jbc.m113.537241?mailto=christian.hauschke@tib.eu,2014,article,True,88,mTOR Signaling in Growth and Disease,Life Sciences,Molecular Biology,Elsevier BV,True,en,"Biochemistry, Genetics and Molecular Biology",
https://openalex.org/W2065469502,RETRACTED: Dual ACE-inhibition and angiotensin II AT1 receptor antagonism with curcumin attenuate maladaptive cardiac repair and improve ventricular systolic function after myocardial infarctionin rat heart,European Journal of Pharmacology,11,https://doi.org/10.1016/j.ejphar.2014.11.001,https://api.labs.crossref.org/works/https://doi.org/10.1016/j.ejphar.2014.11.001?mailto=christian.hauschke@tib.eu,2015,article,True,88,Bioavailability and Health Effects of Curcumin,Life Sciences,Molecular Medicine,Elsevier BV,False,en,"Biochemistry, Genetics and Molecular Biology",
https://openalex.org/W2067807640,RETRACTED: Acute ethanol administration affects memory reactivation: A look at the neuronal density and apoptosis in the rat hippocampus,"Pharmacology, Biochemistry and Behavior",11,https://doi.org/10.1016/j.pbb.2012.04.008,https://api.labs.crossref.org/works/https://doi.org/10.1016/j.pbb.2012.04.008?mailto=christian.hauschke@tib.eu,2012,article,True,88,Neural Mechanisms of Memory Formation and Spatial Navigation,Life Sciences,Cognitive Neuroscience,Elsevier BV,True,en,Neuroscience,
https://openalex.org/W2070870138,Sexual Dysfunction in Women with Diabetic Kidney,International Journal of Endocrinology,11,https://doi.org/10.1155/2014/346834,https://api.labs.crossref.org/works/https://doi.org/10.1155/2014/346834?mailto=christian.hauschke@tib.eu,2014,article,True,88,Epidemiology and Management of Sexual Dysfunction,Health Sciences,Psychiatry and Mental health,Hindawi Publishing Corporation,True,en,Medicine,
https://openalex.org/W2072327326,Silencing of HEPN1 is Responsible for the Aggressive Biological Behavior of Pituitary Somatotroph Adenomas,Cellular Physiology and Biochemistry,11,https://doi.org/10.1159/000343375,https://api.labs.crossref.org/works/https://doi.org/10.1159/000343375?mailto=christian.hauschke@tib.eu,2013,article,True,88,Diagnosis and Management of Pituitary Disorders,Health Sciences,"Endocrinology, Diabetes and Metabolism",Karger Publishers,True,en,Medicine,
https://openalex.org/W2072539952,RETRACTED ARTICLE: The Clinical Implications of Human Telomerase Reverse Transcriptase Expression in Grade and Prognosis of Gliomas: a Systematic Review and Meta-analysis,Molecular Neurobiology,11,https://doi.org/10.1007/s12035-015-9170-x,https://api.labs.crossref.org/works/https://doi.org/10.1007/s12035-015-9170-x?mailto=christian.hauschke@tib.eu,2015,article,True,88,Gliomas,Health Sciences,Genetics,Springer Science+Business Media,False,en,Medicine,
https://openalex.org/W2075986688,A Prospective Study of Early Loaded Single Implant-Retained Mandibular Overdentures: Preliminary One-Year Results,International Journal of Dentistry,11,https://doi.org/10.1155/2012/236409,https://api.labs.crossref.org/works/https://doi.org/10.1155/2012/236409?mailto=christian.hauschke@tib.eu,2012,article,True,88,Dental Implantology and Peri-implant Diseases,Health Sciences,Oral Surgery,Hindawi Publishing Corporation,True,en,Dentistry,
https://openalex.org/W2076371002,Morinda citrifolia leaves enhance osteogenic differentiation and mineralization of human periodontal ligament cells,Dental Materials Journal,11,https://doi.org/10.4012/dmj.2012-053,https://api.labs.crossref.org/works/https://doi.org/10.4012/dmj.2012-053?mailto=christian.hauschke@tib.eu,2012,article,True,88,Therapeutic Properties of Morinda citrifolia,Health Sciences,Complementary and alternative medicine,Japanese Society for Dental Materials and Devices,True,en,Medicine,
https://openalex.org/W2077537260,Ras Puts the Brake on Doxorubicin-mediated Cell Death in p53-expressing Cells,Journal of Biological Chemistry,11,https://doi.org/10.1074/jbc.m110.191916,https://api.labs.crossref.org/works/https://doi.org/10.1074/jbc.m110.191916?mailto=christian.hauschke@tib.eu,2011,article,True,88,Molecular Mechanisms of Apoptosis and Cell Death,Life Sciences,Molecular Biology,Elsevier BV,True,en,"Biochemistry, Genetics and Molecular Biology",
https://openalex.org/W2078151665,RETRACTED: To investigate the effect of osteoporosis and intervertebral disc degeneration on the endplate cartilage injury in rats,Asian Pacific Journal of Tropical Medicine,11,https://doi.org/10.1016/s1995-7645(14)60139-5,https://api.labs.crossref.org/works/https://doi.org/10.1016/s1995-7645(14)60139-5?mailto=christian.hauschke@tib.eu,2014,article,True,88,Pathophysiology of Lumbar Disc Degeneration and Treatment,Health Sciences,Pathology and Forensic Medicine,Elsevier BV,True,en,Medicine,
https://openalex.org/W2079248348,RETRACTED: Evolutionary design of constructive multilayer feedforward neural network,Journal of Vibration and Control,11,https://doi.org/10.1177/1077546312456726,https://api.labs.crossref.org/works/https://doi.org/10.1177/1077546312456726?mailto=christian.hauschke@tib.eu,2012,article,True,88,Neural Network Fundamentals and Applications,Physical Sciences,Artificial Intelligence,SAGE Publishing,False,en,Computer Science,
https://openalex.org/W2081044157,Aborting a malformed fetus: A debatable issue in Saudi Arabia,Journal of clinical neonatology,11,https://doi.org/10.4103/2249-4847.92231,https://api.labs.crossref.org/works/https://doi.org/10.4103/2249-4847.92231?mailto=christian.hauschke@tib.eu,2012,article,True,88,Prenatal Aneuploidy Diagnosis and Screening Techniques,Health Sciences,"Pediatrics, Perinatology and Child Health",Medknow,True,en,Medicine,
https://openalex.org/W2081097248,Micropatterning Different Cell Types with Microarray Amplification of Natural Directional Persistence,Advanced Healthcare Materials,11,https://doi.org/10.1002/adhm.201200141,https://api.labs.crossref.org/works/https://doi.org/10.1002/adhm.201200141?mailto=christian.hauschke@tib.eu,2012,article,True,88,Cell Mechanics and Extracellular Matrix Interactions,Life Sciences,Cell Biology,Wiley-Blackwell,True,en,"Biochemistry, Genetics and Molecular Biology",
https://openalex.org/W2082029879,RETRACTED: Prediction impact behavior of functionally graded steel by strain gradient plasticity theory,Computational Materials Science,11,https://doi.org/10.1016/j.commatsci.2011.06.004,https://api.labs.crossref.org/works/https://doi.org/10.1016/j.commatsci.2011.06.004?mailto=christian.hauschke@tib.eu,2011,article,True,88,Mechanical Properties of Thin Film Coatings,Physical Sciences,Mechanics of Materials,Elsevier BV,True,en,Engineering,
https://openalex.org/W2083411132,Ectopic Expression of a Maize Hybrid Down-Regulated Gene ZmARF25 Decreases Organ Size by Affecting Cellular Proliferation in Arabidopsis,PLOS ONE,11,https://doi.org/10.1371/journal.pone.0094830,https://api.labs.crossref.org/works/https://doi.org/10.1371/journal.pone.0094830?mailto=christian.hauschke@tib.eu,2014,article,True,88,Genetic Architecture of Quantitative Traits,Life Sciences,Genetics,Public Library of Science,True,en,"Biochemistry, Genetics and Molecular Biology",
https://openalex.org/W2085254022,RETRACTED: The evaluate tendencies of corrosion process for reinforcing steel when covered with special polymer sulfur coating,Engineering Failure Analysis,11,https://doi.org/10.1016/j.engfailanal.2014.01.005,https://api.labs.crossref.org/works/https://doi.org/10.1016/j.engfailanal.2014.01.005?mailto=christian.hauschke@tib.eu,2014,article,True,88,Electrical Tomography Techniques,Physical Sciences,Electrical and Electronic Engineering,Elsevier BV,True,en,Engineering,
https://openalex.org/W2085710166,Hexokinase II Binding to Mitochondria Is Necessary for Kupffer Cell Activation and Is Potentiated by Ethanol Exposure,Journal of Biological Chemistry,11,https://doi.org/10.1074/jbc.m114.580175,https://api.labs.crossref.org/works/https://doi.org/10.1074/jbc.m114.580175?mailto=christian.hauschke@tib.eu,2014,article,True,88,Heme Oxygenase and Carbon Monoxide Research,Life Sciences,Molecular Biology,Elsevier BV,True,en,"Biochemistry, Genetics and Molecular Biology",
https://openalex.org/W2090124575,"RETRACTED: RecA-Promoted, RecFOR-Independent Progressive Disassembly of Replisomes Stalled by Helicase Inactivation",Molecular Cell,11,https://doi.org/10.1016/j.molcel.2012.11.018,https://api.labs.crossref.org/works/https://doi.org/10.1016/j.molcel.2012.11.018?mailto=christian.hauschke@tib.eu,2013,article,True,88,Molecular Mechanisms of DNA Damage Response,Life Sciences,Molecular Biology,Elsevier BV,True,en,"Biochemistry, Genetics and Molecular Biology",
https://openalex.org/W2094531881,RETRACTED: Mineralized Tissue Formation by Bone Morphogenetic Protein-7–transfected Pulp Stem Cells,Journal of Endodontics,11,https://doi.org/10.1016/j.joen.2011.10.010,https://api.labs.crossref.org/works/https://doi.org/10.1016/j.joen.2011.10.010?mailto=christian.hauschke@tib.eu,2012,article,True,88,Multipotent Mesenchymal Stem Cells,Health Sciences,Genetics,Elsevier BV,False,en,Medicine,
https://openalex.org/W2097113616,Downregulation of ADAM10 Expression Inhibits Metastasis and Invasiveness of Human Hepatocellular Carcinoma HepG2 Cells,BioMed Research International,11,https://doi.org/10.1155/2013/434561,https://api.labs.crossref.org/works/https://doi.org/10.1155/2013/434561?mailto=christian.hauschke@tib.eu,2013,article,True,88,HER2 Signaling in Breast Cancer Treatment,Health Sciences,Oncology,Hindawi Publishing Corporation,True,en,Medicine,
https://openalex.org/W2097651531,InvA Protein Is a Nudix Hydrolase Required for Infection by Pathogenic Leptospira in Cell Lines and Animals,Journal of Biological Chemistry,11,https://doi.org/10.1074/jbc.m111.219931,https://api.labs.crossref.org/works/https://doi.org/10.1074/jbc.m111.219931?mailto=christian.hauschke@tib.eu,2011,article,True,88,Leptospirosis: Zoonotic Disease and Global Impact,Life Sciences,Parasitology,Elsevier BV,True,en,Immunology and Microbiology,
https://openalex.org/W2106116149,<i>Retracted:</i> Meta‐analysis on the comparison between two topical calcineurin inhibitors in atopic dermatitis,The Journal of Dermatology,11,https://doi.org/10.1111/j.1346-8138.2012.01529.x,https://api.labs.crossref.org/works/https://doi.org/10.1111/j.1346-8138.2012.01529.x?mailto=christian.hauschke@tib.eu,2012,article,True,88,Atopic Dermatitis and Skin Microbiome,Health Sciences,Dermatology,Wiley,False,en,Medicine,
https://openalex.org/W2110003394,Depression and health related quality of life in breast cancer patients.,PubMed,11,,https://api.labs.crossref.org/works/null?mailto=christian.hauschke@tib.eu,2013,article,True,88,Cancer Survivorship and Quality of Life,Health Sciences,Oncology,National Institutes of Health,False,en,Medicine,
https://openalex.org/W2111155616,Genetic and Functional Profiling of Crohn's Disease: Autophagy Mechanism and Susceptibility to Infectious Diseases,BioMed Research International,11,https://doi.org/10.1155/2013/297501,https://api.labs.crossref.org/works/https://doi.org/10.1155/2013/297501?mailto=christian.hauschke@tib.eu,2013,article,True,88,Genetics and Treatment of Inflammatory Bowel Disease,Life Sciences,Genetics,Hindawi Publishing Corporation,True,en,"Biochemistry, Genetics and Molecular Biology",
https://openalex.org/W2111207657,RETRACTED ARTICLE: Triptolide ameliorates lipopolysaccharide-induced acute lung injury in rats,European Journal of Medical Research,11,https://doi.org/10.1186/2047-783x-18-58,https://api.labs.crossref.org/works/https://doi.org/10.1186/2047-783x-18-58?mailto=christian.hauschke@tib.eu,2013,article,True,88,Therapeutic Potential of Herbal Medicines,Health Sciences,Complementary and alternative medicine,BioMed Central,True,en,Medicine,
https://openalex.org/W2114477405,Relative nutritional deficiencies associated with centrally acting monoamines,International Journal of General Medicine,11,https://doi.org/10.2147/ijgm.s31179,https://api.labs.crossref.org/works/https://doi.org/10.2147/ijgm.s31179?mailto=christian.hauschke@tib.eu,2012,article,True,88,Prenatal Exposure to Antiepileptic Drugs,Health Sciences,"Pediatrics, Perinatology and Child Health",Dove Medical Press,True,en,Medicine,
https://openalex.org/W2119484032,RETRACTED: The effects of limewater on flexural strength and water permeability of Al<sub>2</sub>O<sub>3</sub> nanoparticles binary blended concrete,Journal of Composite Materials,11,https://doi.org/10.1177/0021998310378907,https://api.labs.crossref.org/works/https://doi.org/10.1177/0021998310378907?mailto=christian.hauschke@tib.eu,2011,article,True,88,Geopolymer and Alternative Cementitious Materials,Physical Sciences,Civil and Structural Engineering,SAGE Publishing,False,en,Engineering,
https://openalex.org/W2127312832,Anti-citrullinated protein antibodies in rheumatoid arthritis: a functional role for mast cells and basophils?,Annals of the Rheumatic Diseases,11,https://doi.org/10.1136/ard.2010.138032,https://api.labs.crossref.org/works/https://doi.org/10.1136/ard.2010.138032?mailto=christian.hauschke@tib.eu,2011,article,True,88,Role of Mast Cells in Immunoregulation and Disease,Life Sciences,Immunology,BMJ,False,en,Immunology and Microbiology,
https://openalex.org/W2131138503,RETRACTED: Unlocking Past Emotion,Psychological Science,11,https://doi.org/10.1177/0956797612446351,https://api.labs.crossref.org/works/https://doi.org/10.1177/0956797612446351?mailto=christian.hauschke@tib.eu,2013,article,True,88,Development of Narrative Identity in Emerging Adulthood,Social Sciences,Developmental and Educational Psychology,SAGE Publishing,False,en,Psychology,
https://openalex.org/W2135565303,RETRACTED ARTICLE: ANN model to predict the effects of composition and heat treatment parameters on transformation start temperature of microalloyed steels,Neural Computing and Applications,11,https://doi.org/10.1007/s00521-012-1233-6,https://api.labs.crossref.org/works/https://doi.org/10.1007/s00521-012-1233-6?mailto=christian.hauschke@tib.eu,2012,article,True,88,High-Strength Steel Materials,Physical Sciences,Mechanical Engineering,Springer Science+Business Media,False,en,Engineering,
https://openalex.org/W2136374493,RETRACTED ARTICLE: Gene expression profiling analysis of locus coeruleus in idiopathic Parkinson’s disease by bioinformatics,Neurological Sciences,11,https://doi.org/10.1007/s10072-014-1889-z,https://api.labs.crossref.org/works/https://doi.org/10.1007/s10072-014-1889-z?mailto=christian.hauschke@tib.eu,2014,article,True,88,Pathophysiology of Parkinson's Disease,Health Sciences,Neurology,Springer Science+Business Media,False,en,Medicine,
https://openalex.org/W2142347151,High Cell Density Upregulates Calcium Oscillation by Increasing Calcium Store Content via Basal Mitogen-Activated Protein Kinase Activity,PLOS ONE,11,https://doi.org/10.1371/journal.pone.0137610,https://api.labs.crossref.org/works/https://doi.org/10.1371/journal.pone.0137610?mailto=christian.hauschke@tib.eu,2015,article,True,88,Molecular Mechanisms of Ion Channels Regulation,Life Sciences,Molecular Biology,Public Library of Science,True,en,"Biochemistry, Genetics and Molecular Biology",
https://openalex.org/W2149870378,"Retracted: Copper‐Catalyzed Synthesis of Substituted Isoindolo[2,1‐<i>a</i>]quinoxalines and Isoindolo[2,1‐<i>a</i>]quinoxalin‐6(5<i>H</i>)‐ones",European Journal of Organic Chemistry,11,https://doi.org/10.1002/ejoc.201300466,https://api.labs.crossref.org/works/https://doi.org/10.1002/ejoc.201300466?mailto=christian.hauschke@tib.eu,2013,article,True,88,Indolizine Synthesis and Bioactivity Studies,Physical Sciences,Organic Chemistry,Wiley,False,en,Chemistry,
https://openalex.org/W2152359206,Silencing of the COPS3 Gene by siRNA Reduces Proliferation of Lung Cancer Cells Most Likely via induction of Cell Cycle Arrest and Apoptosis,Asian Pacific Journal of Cancer Prevention,11,https://doi.org/10.7314/apjcp.2012.13.3.1043,https://api.labs.crossref.org/works/https://doi.org/10.7314/apjcp.2012.13.3.1043?mailto=christian.hauschke@tib.eu,2012,article,True,88,Mechanisms and Applications of RNA Interference,Life Sciences,Molecular Biology,West Asia Organization for Cancer Prevention,True,en,"Biochemistry, Genetics and Molecular Biology",
https://openalex.org/W2154426755,RETRACTED ARTICLE: Single-wall carbon nanohorns inhibited activation of microglia induced by lipopolysaccharide through blocking of Sirt3,Discover Nano,11,https://doi.org/10.1186/1556-276x-8-100,https://api.labs.crossref.org/works/https://doi.org/10.1186/1556-276x-8-100?mailto=christian.hauschke@tib.eu,2013,article,True,88,Role of Microglia in Neurological Disorders,Life Sciences,Neurology,,True,en,Neuroscience,
https://openalex.org/W2156034015,Exogenous IL-4-Expressing Bone Marrow Mesenchymal Stem Cells for the Treatment of Autoimmune Sensorineural Hearing Loss in a Guinea Pig Model,BioMed Research International,11,https://doi.org/10.1155/2014/856019,https://api.labs.crossref.org/works/https://doi.org/10.1155/2014/856019?mailto=christian.hauschke@tib.eu,2014,article,True,88,Cochlear Neuropathy and Hearing Loss Mechanisms,Life Sciences,Sensory Systems,Hindawi Publishing Corporation,True,en,Neuroscience,
https://openalex.org/W2164529516,HFCVD Application for Growth of Monoclinic Tungsten Trioxide Crystal Nano-walls,Journal of Inorganic and Organometallic Polymers and Materials,11,https://doi.org/10.1007/s10904-015-0291-5,https://api.labs.crossref.org/works/https://doi.org/10.1007/s10904-015-0291-5?mailto=christian.hauschke@tib.eu,2015,article,True,88,Advanced Materials for Smart Windows,Physical Sciences,Polymers and Plastics,Springer Science+Business Media,False,en,Materials Science,
https://openalex.org/W2169066896,RETRACTED ARTICLE: Down-regulated microRNA-124 expression as predictive biomarker and its prognostic significance with clinicopathological features in breast cancer patients,Diagnostic Pathology,11,https://doi.org/10.1186/s13000-015-0391-0,https://api.labs.crossref.org/works/https://doi.org/10.1186/s13000-015-0391-0?mailto=christian.hauschke@tib.eu,2015,article,True,88,MicroRNA Regulation in Cancer and Development,Life Sciences,Cancer Research,BioMed Central,True,en,"Biochemistry, Genetics and Molecular Biology",
https://openalex.org/W2172839892,Peak-end pizza: prices delay evaluations of quality,Journal of Product & Brand Management,11,https://doi.org/10.1108/jpbm-01-2015-0802,https://api.labs.crossref.org/works/https://doi.org/10.1108/jpbm-01-2015-0802?mailto=christian.hauschke@tib.eu,2015,article,True,88,Understanding Consumer Behavior in Retail Environments,Social Sciences,Marketing,Emerald Publishing Limited,False,en,"Business, Management and Accounting",
https://openalex.org/W2174865964,Notice of withdrawal: ‘Who Facilitated Misreporting in Securitized Loans?’,The Journal of Finance,11,https://doi.org/10.1111/jofi.12255,https://api.labs.crossref.org/works/https://doi.org/10.1111/jofi.12255?mailto=christian.hauschke@tib.eu,2015,article,True,88,Banking and Finance in Economic Systems,Social Sciences,Finance,Wiley-Blackwell,False,en,"Economics, Econometrics and Finance",
https://openalex.org/W2190454415,Combined RNAi targeting human Stat3 and ADAM9 as gene therapy for non-small cell lung cancer,Oncology Letters,11,https://doi.org/10.3892/ol.2015.4018,https://api.labs.crossref.org/works/https://doi.org/10.3892/ol.2015.4018?mailto=christian.hauschke@tib.eu,2015,article,True,88,Gene Therapy Techniques and Applications,Life Sciences,Genetics,Spandidos Publishing,True,en,"Biochemistry, Genetics and Molecular Biology",
https://openalex.org/W2190475335,FAM172A modulates apoptosis and proliferation of colon cancer cells via STAT1 binding to its promoter,Oncology Reports,11,https://doi.org/10.3892/or.2015.4485,https://api.labs.crossref.org/works/https://doi.org/10.3892/or.2015.4485?mailto=christian.hauschke@tib.eu,2015,article,True,88,Protein Arginine Methylation in Mammals,Life Sciences,Molecular Biology,Elsevier BV,True,en,"Biochemistry, Genetics and Molecular Biology",
https://openalex.org/W2205000987,RETRACTED ARTICLE: Modified box dimension and average weighted receiving time on the weighted fractal networks,Scientific Reports,11,https://doi.org/10.1038/srep18210,https://api.labs.crossref.org/works/https://doi.org/10.1038/srep18210?mailto=christian.hauschke@tib.eu,2015,article,True,88,Statistical Mechanics of Complex Networks,Physical Sciences,Statistical and Nonlinear Physics,Nature Portfolio,True,en,Physics and Astronomy,
https://openalex.org/W2205897252,[RETRACTED ARTICLE] The influence of the social capital on business performance: an analysis in the context of horizontal business networks,RAM. Revista de Administração Mackenzie,11,https://doi.org/10.1590/s1678-69712013000300009,https://api.labs.crossref.org/works/https://doi.org/10.1590/s1678-69712013000300009?mailto=christian.hauschke@tib.eu,2013,article,True,88,Financial Analysis and Management in Organizations,Social Sciences,Accounting,Universidade Presbiteriana Mackenzie,True,en,"Business, Management and Accounting",
https://openalex.org/W2215847805,RETRACTED ARTICLE: Cental macular thickness in patients with type 2 diabetes mellitus without clinical retinopathy,BMC Ophthalmology,11,https://doi.org/10.1186/1471-2415-13-11,https://api.labs.crossref.org/works/https://doi.org/10.1186/1471-2415-13-11?mailto=christian.hauschke@tib.eu,2013,article,True,88,Age-Related Macular Degeneration Research,Health Sciences,Ophthalmology,BioMed Central,True,en,Medicine,
https://openalex.org/W2258872917,RETRACTED ARTICLE: A compact photometer based on metal-waveguide-capillary: application to detecting glucose of nanomolar concentration,Scientific Reports,11,https://doi.org/10.1038/srep10476,https://api.labs.crossref.org/works/https://doi.org/10.1038/srep10476?mailto=christian.hauschke@tib.eu,2015,article,True,88,Advances in Chemical Sensor Technologies,Physical Sciences,Bioengineering,Nature Portfolio,True,en,Chemical Engineering,Retraction
