id,display_name,primary_location_display_name,cited_by_count,doi,crossref_call,publication_year,type,is_retracted,cited_by_percentile_year_min,primary_topic_display_name,primary_topic_domain_display_name,primary_topic_subfield_display_name,primary_location_source_host_organization_name,open_access_is_oa,language,primary_topic_field_display_name,update_nature
https://openalex.org/W2128045490,Self-reported health and health care use in an ageing population in the Agincourt sub-district of rural South Africa,Global Health Action,63,https://doi.org/10.3402/gha.v6i0.19305,https://api.labs.crossref.org/works/https://doi.org/10.3402/gha.v6i0.19305?mailto=christian.hauschke@tib.eu,2013,article,True,97,Impact of Social Factors on Health Outcomes,Social Sciences,Health,Taylor & Francis,True,en,Social Sciences,
https://openalex.org/W2146598568,"RETRACTED: Purified palmitoleic acid for the reduction of high-sensitivity C-reactive protein and serum lipids: A double-blinded, randomized, placebo controlled study",Journal of Clinical Lipidology,63,https://doi.org/10.1016/j.jacl.2014.08.001,https://api.labs.crossref.org/works/https://doi.org/10.1016/j.jacl.2014.08.001?mailto=christian.hauschke@tib.eu,2014,article,True,97,Cholesterol-lowering Treatment,Health Sciences,Surgery,Elsevier BV,True,en,Medicine,
https://openalex.org/W2311767975,RETRACTED: The ultrasound-guided continuous transmuscular quadratus lumborum block is an effective analgesia for total hip arthroplasty,Journal of Clinical Anesthesia,63,https://doi.org/10.1016/j.jclinane.2015.12.033,https://api.labs.crossref.org/works/https://doi.org/10.1016/j.jclinane.2015.12.033?mailto=christian.hauschke@tib.eu,2016,article,True,97,Management of Postoperative Pain and Complications,Health Sciences,Surgery,Elsevier BV,False,en,Medicine,
https://openalex.org/W2509796692,Impaired T cell function in malignant pleural effusion is caused by TGF‐β derived predominantly from macrophages,International Journal of Cancer,63,https://doi.org/10.1002/ijc.30289,https://api.labs.crossref.org/works/https://doi.org/10.1002/ijc.30289?mailto=christian.hauschke@tib.eu,2016,article,True,97,Diagnosis and Management of Pleural Diseases,Health Sciences,Pulmonary and Respiratory Medicine,Wiley,True,en,Medicine,
https://openalex.org/W2522963928,RETRACTED: Long-term outcomes of per-oral endoscopic myotomy in patients with achalasia with a minimum follow-up of 2 years: an international multicenter study,Gastrointestinal Endoscopy,63,https://doi.org/10.1016/j.gie.2016.09.017,https://api.labs.crossref.org/works/https://doi.org/10.1016/j.gie.2016.09.017?mailto=christian.hauschke@tib.eu,2017,article,True,97,Diagnosis and Management of Gastroesophageal Reflux Disease,Health Sciences,Gastroenterology,Elsevier BV,False,en,Medicine,
https://openalex.org/W2769080564,Long Non-Coding RNA H19 Protects H9c2 Cells against Hypoxia-Induced Injury by Targeting MicroRNA-139,Cellular Physiology and Biochemistry,63,https://doi.org/10.1159/000485354,https://api.labs.crossref.org/works/https://doi.org/10.1159/000485354?mailto=christian.hauschke@tib.eu,2017,article,True,97,Role of Long Noncoding RNAs in Cancer and Development,Life Sciences,Cancer Research,Karger Publishers,True,en,"Biochemistry, Genetics and Molecular Biology",
https://openalex.org/W2961785544,"RETRACTED ARTICLE: Overexpression of a cotton annexin gene, GhAnn1, enhances drought and salt stress tolerance in transgenic cotton",Plant Molecular Biology,63,https://doi.org/10.1007/s11103-014-0260-3,https://api.labs.crossref.org/works/https://doi.org/10.1007/s11103-014-0260-3?mailto=christian.hauschke@tib.eu,2014,article,True,97,"S100 Proteins: Structure, Function, and Pathology",Life Sciences,Molecular Biology,Springer Science+Business Media,False,en,"Biochemistry, Genetics and Molecular Biology",
https://openalex.org/W3123840175,Change Their Choice! Changing Behavior Using the <i>CAN</i> Approach and Activism Research,Psychology & Marketing,63,https://doi.org/10.1002/mar.20794,https://api.labs.crossref.org/works/https://doi.org/10.1002/mar.20794?mailto=christian.hauschke@tib.eu,2015,article,True,97,Impact of Ultra-Processed Foods on Health,Health Sciences,"Public Health, Environmental and Occupational Health",Wiley-Blackwell,False,en,Medicine,
https://openalex.org/W4250531709,Retracted: Analysis of the Strength of Legal Firearms Restrictions for Perpetrators of Domestic Violence and Their Associations With Intimate Partner Homicide,American Journal of Epidemiology,63,https://doi.org/10.1093/aje/kwx362,https://api.labs.crossref.org/works/https://doi.org/10.1093/aje/kwx362?mailto=christian.hauschke@tib.eu,2017,article,True,97,Intimate Partner Violence and Health Consequences,Social Sciences,Health,Oxford University Press,True,en,Social Sciences,
https://openalex.org/W7666405,RETRACTED: A review of energy storage systems in microgrids with wind turbines,Renewable & Sustainable Energy Reviews,63,https://doi.org/10.1016/j.rser.2012.09.039,https://api.labs.crossref.org/works/https://doi.org/10.1016/j.rser.2012.09.039?mailto=christian.hauschke@tib.eu,2013,article,True,97,Control and Synchronization in Microgrid Systems,Physical Sciences,Control and Systems Engineering,Elsevier BV,True,en,Engineering,
https://openalex.org/W1546765786,Cardamonin sensitizes tumour cells to TRAIL through ROS‐ and CHOP‐mediated up‐regulation of death receptors and down‐regulation of survival proteins,British Journal of Pharmacology,62,https://doi.org/10.1111/j.1476-5381.2011.01603.x,https://api.labs.crossref.org/works/https://doi.org/10.1111/j.1476-5381.2011.01603.x?mailto=christian.hauschke@tib.eu,2012,article,True,97,Molecular Mechanisms of Apoptosis and Cell Death,Life Sciences,Molecular Biology,Wiley-Blackwell,True,en,"Biochemistry, Genetics and Molecular Biology",
https://openalex.org/W1975775502,Transformation of postingestive glucose responses after deletion of sweet taste receptor subunits or gastric bypass surgery,American Journal of Physiology-endocrinology and Metabolism,62,https://doi.org/10.1152/ajpendo.00163.2012,https://api.labs.crossref.org/works/https://doi.org/10.1152/ajpendo.00163.2012?mailto=christian.hauschke@tib.eu,2012,article,True,97,Sweeteners' Taste and Impact on Health,Health Sciences,Nutrition and Dietetics,American Physiological Society,True,en,Nursing,
https://openalex.org/W1985534704,Conversion of Human Umbilical Cord Mesenchymal Stem Cells in Wharton’s Jelly to Dopamine Neurons Mediated by the Lmx1a and Neurturin In Vitro: Potential Therapeutic Application for Parkinson’s Disease in a Rhesus Monkey Model,PLOS ONE,62,https://doi.org/10.1371/journal.pone.0064000,https://api.labs.crossref.org/works/https://doi.org/10.1371/journal.pone.0064000?mailto=christian.hauschke@tib.eu,2013,article,True,97,Multipotent Mesenchymal Stem Cells,Health Sciences,Genetics,Public Library of Science,True,en,Medicine,
https://openalex.org/W2000844923,Suppression of the mTORC1/STAT3/Notch1 pathway by activated AMPK prevents hepatic insulin resistance induced by excess amino acids,American Journal of Physiology-endocrinology and Metabolism,62,https://doi.org/10.1152/ajpendo.00202.2013,https://api.labs.crossref.org/works/https://doi.org/10.1152/ajpendo.00202.2013?mailto=christian.hauschke@tib.eu,2014,article,True,97,Role of AMP-Activated Protein Kinase in Cellular Metabolism,Life Sciences,Molecular Biology,American Physiological Society,True,en,"Biochemistry, Genetics and Molecular Biology",
https://openalex.org/W2014961412,RETRACTED: Effects of geniposide on hepatocytes undergoing epithelial–mesenchymal transition in hepatic fibrosis by targeting TGFβ/Smad and ERK-MAPK signaling pathways,Biochimie,62,https://doi.org/10.1016/j.biochi.2015.03.015,https://api.labs.crossref.org/works/https://doi.org/10.1016/j.biochi.2015.03.015?mailto=christian.hauschke@tib.eu,2015,article,True,97,Mechanisms and Treatment of Liver Fibrosis,Health Sciences,Hepatology,Elsevier BV,True,en,Medicine,
https://openalex.org/W2030750371,Plasma D-Dimer Levels Are Associated with Stroke Subtypes and Infarction Volume in Patients with Acute Ischemic Stroke,PLOS ONE,62,https://doi.org/10.1371/journal.pone.0086465,https://api.labs.crossref.org/works/https://doi.org/10.1371/journal.pone.0086465?mailto=christian.hauschke@tib.eu,2014,article,True,97,Epidemiology and Management of Stroke,Health Sciences,Epidemiology,Public Library of Science,True,en,Medicine,
https://openalex.org/W2042379428,RETRACTED: Neuroprotective effect of Liuwei Dihuang decoction on cognition deficits of diabetic encephalopathy in streptozotocin-induced diabetic rat,Journal of Ethnopharmacology,62,https://doi.org/10.1016/j.jep.2013.09.003,https://api.labs.crossref.org/works/https://doi.org/10.1016/j.jep.2013.09.003?mailto=christian.hauschke@tib.eu,2013,article,True,97,Chronic Cerebral Hypoperfusion-Related Neurodegenerative Diseases,Life Sciences,Neurology,Elsevier BV,False,en,Neuroscience,
https://openalex.org/W2045508254,"RETRACTED: Assessment of an accidental vapour cloud explosion: Lessons from the Indian Oil Corporation Ltd. accident at Jaipur, India",Journal of Loss Prevention in the Process Industries,62,https://doi.org/10.1016/j.jlp.2012.09.009,https://api.labs.crossref.org/works/https://doi.org/10.1016/j.jlp.2012.09.009?mailto=christian.hauschke@tib.eu,2013,article,True,97,Challenges and Applications of Detonation Propulsion Technology,Physical Sciences,Aerospace Engineering,Elsevier BV,True,en,Engineering,
https://openalex.org/W2045842167,The Interplays between Autophagy and Apoptosis Induced by Enterovirus 71,PLOS ONE,62,https://doi.org/10.1371/journal.pone.0056966,https://api.labs.crossref.org/works/https://doi.org/10.1371/journal.pone.0056966?mailto=christian.hauschke@tib.eu,2013,article,True,97,"Aetiology, Diagnosis, and Management of Myocarditis",Health Sciences,Cardiology and Cardiovascular Medicine,Public Library of Science,True,en,Medicine,
https://openalex.org/W2062042069,Salivary Response to Lemon Juice as a Measure of Introversion,Perceptual and Motor Skills,62,https://doi.org/10.2466/pms.1967.24.3c.1047,https://api.labs.crossref.org/works/https://doi.org/10.2466/pms.1967.24.3c.1047?mailto=christian.hauschke@tib.eu,1967,article,True,97,Olfactory Dysfunction in Health and Disease,Life Sciences,Sensory Systems,SAGE Publishing,False,en,Neuroscience,
https://openalex.org/W2073979520,Ubiquinol Improves Symptoms in Children with Autism,Oxidative Medicine and Cellular Longevity,62,https://doi.org/10.1155/2014/798957,https://api.labs.crossref.org/works/https://doi.org/10.1155/2014/798957?mailto=christian.hauschke@tib.eu,2014,article,True,97,Autism Spectrum Disorders,Life Sciences,Cognitive Neuroscience,Hindawi Publishing Corporation,True,en,Neuroscience,
https://openalex.org/W2076382848,MicroRNA-128 promotes proliferation in osteosarcoma cells by downregulating PTEN,Tumor Biology,62,https://doi.org/10.1007/s13277-013-1274-1,https://api.labs.crossref.org/works/https://doi.org/10.1007/s13277-013-1274-1?mailto=christian.hauschke@tib.eu,2013,article,True,97,MicroRNA Regulation in Cancer and Development,Life Sciences,Cancer Research,SAGE Publishing,False,en,"Biochemistry, Genetics and Molecular Biology",
https://openalex.org/W2089952442,RETRACTED: Curcumin restores Nrf2 levels and prevents quinolinic acid-induced neurotoxicity,The Journal of Nutritional Biochemistry,62,https://doi.org/10.1016/j.jnutbio.2011.12.010,https://api.labs.crossref.org/works/https://doi.org/10.1016/j.jnutbio.2011.12.010?mailto=christian.hauschke@tib.eu,2013,article,True,97,Bioavailability and Health Effects of Curcumin,Life Sciences,Molecular Medicine,Elsevier BV,True,en,"Biochemistry, Genetics and Molecular Biology",
https://openalex.org/W2099152203,"RETRACTED ARTICLE: Flavocoxid, a dual inhibitor of COX-2 and 5-LOX of natural origin, attenuates the inflammatory response and protects mice from sepsis",Critical Care,62,https://doi.org/10.1186/1364-8535-16-r32,https://api.labs.crossref.org/works/https://doi.org/10.1186/1364-8535-16-r32?mailto=christian.hauschke@tib.eu,2012,article,True,97,Cyclooxygenase-2 Inhibitors in Inflammation and Cancer,Health Sciences,Pharmacology,BioMed Central,True,en,Medicine,
https://openalex.org/W2104557436,RETRACTED ARTICLE: Activation of Wnt/β-catenin signalling promotes mesenchymal stem cells to repair injured alveolar epithelium induced by lipopolysaccharide in mice,Stem Cell Research & Therapy,62,https://doi.org/10.1186/s13287-015-0060-y,https://api.labs.crossref.org/works/https://doi.org/10.1186/s13287-015-0060-y?mailto=christian.hauschke@tib.eu,2015,article,True,97,Neonatal Lung Development and Respiratory Morbidity,Health Sciences,Pulmonary and Respiratory Medicine,BioMed Central,True,en,Medicine,
https://openalex.org/W2152366622,WITHDRAWN: Is the impact of the extent of lymphadenectomy in radical prostatectomy related to the disease risk? A single center prospective study,Journal of Surgical Research,62,https://doi.org/10.1016/j.jss.2012.06.069,https://api.labs.crossref.org/works/https://doi.org/10.1016/j.jss.2012.06.069?mailto=christian.hauschke@tib.eu,2012,article,True,97,Prostate Cancer Research and Treatment,Health Sciences,Pulmonary and Respiratory Medicine,Elsevier BV,False,en,Medicine,
https://openalex.org/W2163146251,MicroRNA-217 Regulates WASF3 Expression and Suppresses Tumor Growth and Metastasis in Osteosarcoma,PLOS ONE,62,https://doi.org/10.1371/journal.pone.0109138,https://api.labs.crossref.org/works/https://doi.org/10.1371/journal.pone.0109138?mailto=christian.hauschke@tib.eu,2014,article,True,97,MicroRNA Regulation in Cancer and Development,Life Sciences,Cancer Research,Public Library of Science,True,en,"Biochemistry, Genetics and Molecular Biology",
https://openalex.org/W2242098312,Highly monodisperse Pt(0)@AC NPs as highly efficient and reusable catalysts: the effect of the surfactant on their catalytic activities in room temperature dehydrocoupling of DMAB,Catalysis Science & Technology,62,https://doi.org/10.1039/c5cy01371b,https://api.labs.crossref.org/works/https://doi.org/10.1039/c5cy01371b?mailto=christian.hauschke@tib.eu,2016,article,True,97,Materials and Methods for Hydrogen Storage,Physical Sciences,Materials Chemistry,Royal Society of Chemistry,False,en,Materials Science,
https://openalex.org/W2302238410,Apolipoprotein A-1 binding protein promotes macrophage cholesterol efflux by facilitating apolipoprotein A-1 binding to ABCA1 and preventing ABCA1 degradation,Atherosclerosis,62,https://doi.org/10.1016/j.atherosclerosis.2016.03.008,https://api.labs.crossref.org/works/https://doi.org/10.1016/j.atherosclerosis.2016.03.008?mailto=christian.hauschke@tib.eu,2016,article,True,97,Cholesterol Metabolism and Atherosclerosis,Health Sciences,Surgery,Elsevier BV,False,en,Medicine,
https://openalex.org/W2306356087,Sensitive Visual Detection of AHPND Bacteria Using Loop-Mediated Isothermal Amplification Combined with DNA-Functionalized Gold Nanoparticles as Probes,PLOS ONE,62,https://doi.org/10.1371/journal.pone.0151769,https://api.labs.crossref.org/works/https://doi.org/10.1371/journal.pone.0151769?mailto=christian.hauschke@tib.eu,2016,article,True,97,Immunological Responses in Aquatic Organisms,Life Sciences,Immunology,Public Library of Science,True,en,Immunology and Microbiology,
https://openalex.org/W2330173509,Conjugating <i>S</i>-Nitrosothiols with Glutathiose Stabilized Silver Sulfide Quantum Dots for Controlled Nitric Oxide Release and Near-Infrared Fluorescence Imaging,ACS Applied Materials & Interfaces,62,https://doi.org/10.1021/am4034153,https://api.labs.crossref.org/works/https://doi.org/10.1021/am4034153?mailto=christian.hauschke@tib.eu,2013,article,True,97,Applications of Quantum Dots in Nanotechnology,Physical Sciences,Materials Chemistry,American Chemical Society,False,en,Materials Science,
https://openalex.org/W2404358924,RETRACTED ARTICLE: MircoRNA-33a inhibits epithelial-to-mesenchymal transition and metastasis and could be a prognostic marker in non-small cell lung cancer,Scientific Reports,62,https://doi.org/10.1038/srep13677,https://api.labs.crossref.org/works/https://doi.org/10.1038/srep13677?mailto=christian.hauschke@tib.eu,2015,article,True,97,Role of Long Noncoding RNAs in Cancer and Development,Life Sciences,Cancer Research,Nature Portfolio,True,en,"Biochemistry, Genetics and Molecular Biology",
https://openalex.org/W2770458596,VEGF-A/Neuropilin 1 Pathway Confers Cancer Stemness via Activating Wnt/β-Catenin Axis in Breast Cancer Cells,Cellular Physiology and Biochemistry,62,https://doi.org/10.1159/000485455,https://api.labs.crossref.org/works/https://doi.org/10.1159/000485455?mailto=christian.hauschke@tib.eu,2017,article,True,97,Molecular Mechanisms of Angiogenesis and Vascular Function,Life Sciences,Molecular Biology,Karger Publishers,True,en,"Biochemistry, Genetics and Molecular Biology",
https://openalex.org/W1486653930,<i>Retracted:</i> Mechanisms and effects of curcumin on spatial learning and memory improvement in APPswe/PS1dE9 mice,Journal of Neuroscience Research,61,https://doi.org/10.1002/jnr.23322,https://api.labs.crossref.org/works/https://doi.org/10.1002/jnr.23322?mailto=christian.hauschke@tib.eu,2013,article,True,97,Mechanisms of Alzheimer's Disease,Health Sciences,Physiology,Wiley,False,en,Medicine,
https://openalex.org/W1781170077,RETRACTED ARTICLE: An apoptosis-enhancing drug overcomes platinum resistance in a tumour-initiating subpopulation of ovarian cancer,Nature Communications,61,https://doi.org/10.1038/ncomms8956,https://api.labs.crossref.org/works/https://doi.org/10.1038/ncomms8956?mailto=christian.hauschke@tib.eu,2015,article,True,97,Genomic Studies and Treatment of Ovarian Carcinoma,Health Sciences,Reproductive Medicine,Nature Portfolio,True,en,Medicine,
https://openalex.org/W1978247080,MiR-30a-5p Antisense Oligonucleotide Suppresses Glioma Cell Growth by Targeting SEPT7,PLOS ONE,61,https://doi.org/10.1371/journal.pone.0055008,https://api.labs.crossref.org/works/https://doi.org/10.1371/journal.pone.0055008?mailto=christian.hauschke@tib.eu,2013,article,True,97,Regulation of RNA Processing and Function,Life Sciences,Molecular Biology,Public Library of Science,True,en,"Biochemistry, Genetics and Molecular Biology",
https://openalex.org/W1985079736,Down-regulated Peroxisome Proliferator-activated Receptor γ (PPARγ) in Lung Epithelial Cells Promotes a PPARγ Agonist-reversible Proinflammatory Phenotype in Chronic Obstructive Pulmonary Disease (COPD),Journal of Biological Chemistry,61,https://doi.org/10.1074/jbc.m113.536805,https://api.labs.crossref.org/works/https://doi.org/10.1074/jbc.m113.536805?mailto=christian.hauschke@tib.eu,2014,article,True,97,Peroxisome Proliferator-Activated Receptors,Life Sciences,Molecular Biology,Elsevier BV,True,en,"Biochemistry, Genetics and Molecular Biology",
https://openalex.org/W2045110404,Combination Anti-CTLA-4 and Anti-RANKL in Metastatic Melanoma,Journal of Clinical Oncology,61,https://doi.org/10.1200/jco.2013.51.3572,https://api.labs.crossref.org/works/https://doi.org/10.1200/jco.2013.51.3572?mailto=christian.hauschke@tib.eu,2016,article,True,97,Mammalian MAP Kinase Signaling Pathways,Life Sciences,Molecular Biology,Lippincott Williams & Wilkins,False,en,"Biochemistry, Genetics and Molecular Biology",
https://openalex.org/W2071763303,RETRACTED: Rapamycin induces of protective autophagy in vascular endothelial cells exposed to oxygen–glucose deprivation,Brain Research,61,https://doi.org/10.1016/j.brainres.2014.01.017,https://api.labs.crossref.org/works/https://doi.org/10.1016/j.brainres.2014.01.017?mailto=christian.hauschke@tib.eu,2014,article,True,97,Role of Autophagy in Disease and Health,Health Sciences,Epidemiology,Elsevier BV,True,en,Medicine,
https://openalex.org/W2112597040,"Two metal-tolerance proteins, MTP1 and MTP4, are involved in Zn homeostasis and Cd sequestration in cucumber cells",Journal of Experimental Botany,61,https://doi.org/10.1093/jxb/eru459,https://api.labs.crossref.org/works/https://doi.org/10.1093/jxb/eru459?mailto=christian.hauschke@tib.eu,2014,article,True,97,Biofortification of Staple Crops for Human Nutrition,Life Sciences,Plant Science,Oxford University Press,True,en,Agricultural and Biological Sciences,
https://openalex.org/W2144185719,Fiery frills: carotenoid-based coloration predicts contest success in frillneck lizards,Behavioral Ecology,61,https://doi.org/10.1093/beheco/art041,https://api.labs.crossref.org/works/https://doi.org/10.1093/beheco/art041?mailto=christian.hauschke@tib.eu,2013,article,True,97,Evolutionary Ecology of Animal Behavior and Traits,Life Sciences,"Ecology, Evolution, Behavior and Systematics",Oxford University Press,True,en,Agricultural and Biological Sciences,
https://openalex.org/W2148373348,Chicory (Cichorium intybus L.) Root Extract Regulates the Oxidative Status and Antioxidant Gene Transcripts in CCl4-Induced Hepatotoxicity,PLOS ONE,61,https://doi.org/10.1371/journal.pone.0121549,https://api.labs.crossref.org/works/https://doi.org/10.1371/journal.pone.0121549?mailto=christian.hauschke@tib.eu,2015,article,True,97,Role of Paraoxonase Enzymes in Atherosclerosis and Oxidative Stress,Life Sciences,Clinical Biochemistry,Public Library of Science,True,en,"Biochemistry, Genetics and Molecular Biology",
https://openalex.org/W2150552947,Modification of Sialylation Mediates the Invasive Properties and Chemosensitivity of Human Hepatocellular Carcinoma,Molecular & Cellular Proteomics,61,https://doi.org/10.1074/mcp.m113.034025,https://api.labs.crossref.org/works/https://doi.org/10.1074/mcp.m113.034025?mailto=christian.hauschke@tib.eu,2014,article,True,97,Glycosylation in Health and Disease,Life Sciences,Molecular Biology,Elsevier BV,True,en,"Biochemistry, Genetics and Molecular Biology",
https://openalex.org/W2237877620,Increased expression of LncRNA BANCR and its prognostic significance in human hepatocellular carcinoma,World Journal of Surgical Oncology,61,https://doi.org/10.1186/s12957-015-0757-5,https://api.labs.crossref.org/works/https://doi.org/10.1186/s12957-015-0757-5?mailto=christian.hauschke@tib.eu,2016,article,True,97,Role of Long Noncoding RNAs in Cancer and Development,Life Sciences,Cancer Research,BioMed Central,True,en,"Biochemistry, Genetics and Molecular Biology",
https://openalex.org/W2332071678,RETRACTED: The preoperative platelet–lymphocyte ratio <i>versus</i> neutrophil–lymphocyte ratio: which is better as a prognostic factor in oral squamous cell carcinoma?,Therapeutic Advances in Medical Oncology,61,https://doi.org/10.1177/1758834016638019,https://api.labs.crossref.org/works/https://doi.org/10.1177/1758834016638019?mailto=christian.hauschke@tib.eu,2016,article,True,97,Inflammation's Role in Cancer Development and Progression,Health Sciences,Oncology,SAGE Publishing,True,en,Medicine,
https://openalex.org/W2627042624,RETRACTED ARTICLE: Intranasal delivery of quercetin-loaded mucoadhesive nanoemulsion for treatment of cerebral ischaemia,Artificial Cells Nanomedicine and Biotechnology,61,https://doi.org/10.1080/21691401.2017.1337024,https://api.labs.crossref.org/works/https://doi.org/10.1080/21691401.2017.1337024?mailto=christian.hauschke@tib.eu,2017,article,True,97,Mucosal Drug Delivery Systems,Life Sciences,Pharmaceutical Science,Informa,True,en,"Pharmacology, Toxicology and Pharmaceutics",
https://openalex.org/W2737273385,<i>Retracted</i>: Knockdown of long non‐coding RNA MALAT1 inhibits growth and motility of human hepatoma cells via modulation of miR‐195,Journal of Cellular Biochemistry,61,https://doi.org/10.1002/jcb.26297,https://api.labs.crossref.org/works/https://doi.org/10.1002/jcb.26297?mailto=christian.hauschke@tib.eu,2017,article,True,97,Role of Long Noncoding RNAs in Cancer and Development,Life Sciences,Cancer Research,Wiley,True,en,"Biochemistry, Genetics and Molecular Biology",
https://openalex.org/W2754201728,<i>ANGPTL1</i> Interacts with Integrin α1β1 to Suppress HCC Angiogenesis and Metastasis by Inhibiting JAK2/STAT3 Signaling,Cancer Research,61,https://doi.org/10.1158/0008-5472.can-17-0579,https://api.labs.crossref.org/works/https://doi.org/10.1158/0008-5472.can-17-0579?mailto=christian.hauschke@tib.eu,2017,article,True,97,Lipid Metabolism and Cardiovascular Disease,Health Sciences,Cardiology and Cardiovascular Medicine,American Association for Cancer Research,True,en,Medicine,
https://openalex.org/W2770319158,RETRACTED: Incidence of lower-extremity muscle weakness after quadratus lumborum block,Journal of Clinical Anesthesia,61,https://doi.org/10.1016/j.jclinane.2017.11.020,https://api.labs.crossref.org/works/https://doi.org/10.1016/j.jclinane.2017.11.020?mailto=christian.hauschke@tib.eu,2018,article,True,97,Management of Postoperative Pain and Complications,Health Sciences,Surgery,Elsevier BV,False,en,Medicine,
https://openalex.org/W2776951919,Anti-cancer activity of hierarchical ZSM-5 zeolites synthesized from rice-based waste materials,RSC Advances,61,https://doi.org/10.1039/c7ra11763a,https://api.labs.crossref.org/works/https://doi.org/10.1039/c7ra11763a?mailto=christian.hauschke@tib.eu,2018,article,True,97,Zeolite Chemistry and Catalysis,Physical Sciences,Inorganic Chemistry,Royal Society of Chemistry,True,en,Chemistry,
https://openalex.org/W2793104917,RETRACTED: Long non-coding RNA TUG1 inhibits apoptosis and inflammatory response in LPS-treated H9c2 cells by down-regulation of miR-29b,Biomedicine & Pharmacotherapy,61,https://doi.org/10.1016/j.biopha.2018.02.129,https://api.labs.crossref.org/works/https://doi.org/10.1016/j.biopha.2018.02.129?mailto=christian.hauschke@tib.eu,2018,article,True,97,Role of Long Noncoding RNAs in Cancer and Development,Life Sciences,Cancer Research,Elsevier BV,False,en,"Biochemistry, Genetics and Molecular Biology",
