id,display_name,primary_location_display_name,cited_by_count,doi,crossref_call,publication_year,type,is_retracted,cited_by_percentile_year_min,primary_topic_display_name,primary_topic_domain_display_name,primary_topic_subfield_display_name,primary_location_source_host_organization_name,open_access_is_oa,language,primary_topic_field_display_name,update_nature
https://openalex.org/W4283709497,Modeling and Simulation of English Speech Optimization Teaching Recognition Based on Intelligent Edge Detection Algorithm,Security and Communication Networks,1,https://doi.org/10.1155/2022/9314068,https://api.labs.crossref.org/works/https://doi.org/10.1155/2022/9314068?mailto=christian.hauschke@tib.eu,2022,article,True,69,Intelligent Manufacturing Technologies,Physical Sciences,Industrial and Manufacturing Engineering,Hindawi Publishing Corporation,True,en,Engineering,Retraction
https://openalex.org/W4283710398,Construction of Risk Control Decision-Making Model Platform for Transportation Hub Projects under the Background of Message Technique,Mobile Information Systems,1,https://doi.org/10.1155/2022/1199289,https://api.labs.crossref.org/works/https://doi.org/10.1155/2022/1199289?mailto=christian.hauschke@tib.eu,2022,article,True,69,Application of Wireless Sensor Networks,Physical Sciences,Control and Systems Engineering,IOS Press,True,en,Engineering,Retraction
https://openalex.org/W4283710925,Travel Time Estimation by Learning Driving Habits and Traffic Conditions,Journal of Advanced Transportation,1,https://doi.org/10.1155/2022/1308488,https://api.labs.crossref.org/works/https://doi.org/10.1155/2022/1308488?mailto=christian.hauschke@tib.eu,2022,article,True,69,Traffic Flow Prediction and Forecasting,Physical Sciences,Building and Construction,Hindawi Publishing Corporation,True,en,Engineering,Retraction
https://openalex.org/W4283711265,A Study of the Political Culture of the Ming and Qing Agribusiness Societies under the Imperial Environment,Journal of Environmental and Public Health,1,https://doi.org/10.1155/2022/5367271,https://api.labs.crossref.org/works/https://doi.org/10.1155/2022/5367271?mailto=christian.hauschke@tib.eu,2022,article,True,69,Religious Diversity and Regulation in Chinese Society,Social Sciences,Sociology and Political Science,Hindawi Publishing Corporation,True,en,Social Sciences,Retraction
https://openalex.org/W4283711837,Exploration of the Cultivation Path of Medical Students’ Politico-Ideological and Humanistic Quality Based on Deep Learning,Computational and Mathematical Methods in Medicine,1,https://doi.org/10.1155/2022/5766675,https://api.labs.crossref.org/works/https://doi.org/10.1155/2022/5766675?mailto=christian.hauschke@tib.eu,2022,article,True,69,Innovation and Development of Ideological Education,Social Sciences,Education,Hindawi Publishing Corporation,True,en,Social Sciences,Retraction
https://openalex.org/W4283711876,The Integrated Sustainable Development Mechanism of Sports Industry Based on Recombination Fusion Mode,Computational Intelligence and Neuroscience,1,https://doi.org/10.1155/2022/6906467,https://api.labs.crossref.org/works/https://doi.org/10.1155/2022/6906467?mailto=christian.hauschke@tib.eu,2022,article,True,69,Evolution and Impacts of Event Tourism,Social Sciences,Sociology and Political Science,Hindawi Publishing Corporation,True,en,Social Sciences,Retraction
https://openalex.org/W4283712163,Growth and Development in Preterm Infants and Maternal Parenting Stress after WeChat-Based Extended Care,Evidence-based Complementary and Alternative Medicine,1,https://doi.org/10.1155/2022/9987891,https://api.labs.crossref.org/works/https://doi.org/10.1155/2022/9987891?mailto=christian.hauschke@tib.eu,2022,article,True,69,Mortality and Sequelae of Preterm Birth,Health Sciences,"Pediatrics, Perinatology and Child Health",Hindawi Publishing Corporation,True,en,Medicine,Retraction
https://openalex.org/W4283712393,Simulation Analysis and Optimization Design of the Variable-Speed Constant-Frequency Doubly Fed Wind Power Generation Control System Based on PSCAD,Wireless Communications and Mobile Computing,1,https://doi.org/10.1155/2022/9133342,https://api.labs.crossref.org/works/https://doi.org/10.1155/2022/9133342?mailto=christian.hauschke@tib.eu,2022,article,True,69,Wind Power Integration in Power Systems,Physical Sciences,Electrical and Electronic Engineering,Wiley,True,en,Engineering,Retraction
https://openalex.org/W4283715420,Induction of Resistance of Antagonistic Bacterium Burkholderia contaminans to Postharvest Botrytis cinerea in Rosa vinifera,Computational and Mathematical Methods in Medicine,1,https://doi.org/10.1155/2022/7134161,https://api.labs.crossref.org/works/https://doi.org/10.1155/2022/7134161?mailto=christian.hauschke@tib.eu,2022,article,True,69,Intelligent Manufacturing Technologies,Physical Sciences,Industrial and Manufacturing Engineering,Hindawi Publishing Corporation,True,en,Engineering,Retraction
https://openalex.org/W4283720397,Clinical Efficacy of Xueshuantong plus Urokinase in the Treatment of Sudden Deafness,Evidence-based Complementary and Alternative Medicine,1,https://doi.org/10.1155/2022/7775556,https://api.labs.crossref.org/works/https://doi.org/10.1155/2022/7775556?mailto=christian.hauschke@tib.eu,2022,article,True,69,Cerebellar Contributions to Neurological Disorders and Functions,Life Sciences,Neurology,Hindawi Publishing Corporation,True,en,Neuroscience,Retraction
https://openalex.org/W4283721273,Clinical Application Effect of Cluster Management in Noninvasive Ventilator Nursing Care of Patients with Severe Heart Failure,Computational and Mathematical Methods in Medicine,1,https://doi.org/10.1155/2022/9628213,https://api.labs.crossref.org/works/https://doi.org/10.1155/2022/9628213?mailto=christian.hauschke@tib.eu,2022,article,True,69,Mechanical Ventilation in Respiratory Failure and ARDS,Health Sciences,Pulmonary and Respiratory Medicine,Hindawi Publishing Corporation,True,en,Medicine,Retraction
https://openalex.org/W4283727097,Analysis of the Influence of Hybrid Personalized Recommendation Algorithm on the Employment Tendency of Hotel Management Major,Mathematical Problems in Engineering,1,https://doi.org/10.1155/2022/6886076,https://api.labs.crossref.org/works/https://doi.org/10.1155/2022/6886076?mailto=christian.hauschke@tib.eu,2022,article,True,69,Challenges and Trends in Tourism Education and Hospitality Management,Social Sciences,"Tourism, Leisure and Hospitality Management",Hindawi Publishing Corporation,True,en,"Business, Management and Accounting",Retraction
https://openalex.org/W4283727194,Mathematical Models for Analysis the Impact of Institutional Quality and Multilateral Financial Institutions on the Success of Green PPP Projects,Journal of function spaces,1,https://doi.org/10.1155/2022/3825211,https://api.labs.crossref.org/works/https://doi.org/10.1155/2022/3825211?mailto=christian.hauschke@tib.eu,2022,article,True,69,Public-Private Partnerships in Infrastructure Development,Social Sciences,Strategy and Management,Hindawi Publishing Corporation,True,en,"Business, Management and Accounting",Retraction
https://openalex.org/W4283734249,Analysis of Co-Construction and Sharing Mechanism of Digital Education Resources based on Digital Information Encryption Technology,Security and Communication Networks,1,https://doi.org/10.1155/2022/4880385,https://api.labs.crossref.org/works/https://doi.org/10.1155/2022/4880385?mailto=christian.hauschke@tib.eu,2022,article,True,69,Drivers and Impediments for Cross-Border E-Commerce,Social Sciences,Business and International Management,Hindawi Publishing Corporation,True,en,"Business, Management and Accounting",Retraction
https://openalex.org/W4283735724,The Rights and Interests Protection Strategy of Express Employees under the Background of Big Data Environment,Journal of Environmental and Public Health,1,https://doi.org/10.1155/2022/6861781,https://api.labs.crossref.org/works/https://doi.org/10.1155/2022/6861781?mailto=christian.hauschke@tib.eu,2022,article,True,69,Intelligent Manufacturing Technologies,Physical Sciences,Industrial and Manufacturing Engineering,Hindawi Publishing Corporation,True,en,Engineering,Retraction
https://openalex.org/W4283736311,Personalized Teaching Strategy of University Ideology Course Based on Lagrange Neural Network and Big Data Technology,Computational Intelligence and Neuroscience,1,https://doi.org/10.1155/2022/1251839,https://api.labs.crossref.org/works/https://doi.org/10.1155/2022/1251839?mailto=christian.hauschke@tib.eu,2022,article,True,69,Innovation and Development of Ideological Education,Social Sciences,Education,Hindawi Publishing Corporation,True,en,Social Sciences,
https://openalex.org/W4283736319,Construction of 3D Model of College Public Physical Education Class Based on Text Mining Model,Wireless Communications and Mobile Computing,1,https://doi.org/10.1155/2022/2490960,https://api.labs.crossref.org/works/https://doi.org/10.1155/2022/2490960?mailto=christian.hauschke@tib.eu,2022,article,True,69,Drivers and Impediments for Cross-Border E-Commerce,Social Sciences,Business and International Management,Wiley,True,en,"Business, Management and Accounting",
https://openalex.org/W4283736685,Application of Accelerometer to Monitor Students’ Exercise Load in 50 m Round Trip,Computational Intelligence and Neuroscience,1,https://doi.org/10.1155/2022/3142677,https://api.labs.crossref.org/works/https://doi.org/10.1155/2022/3142677?mailto=christian.hauschke@tib.eu,2022,article,True,69,Activity Recognition in Pervasive Computing Environments,Physical Sciences,Computer Vision and Pattern Recognition,Hindawi Publishing Corporation,True,en,Computer Science,
https://openalex.org/W4283740795,Precision Marketing Strategy for Ecotourism Based on Data Mining and User Images,Mobile Information Systems,1,https://doi.org/10.1155/2022/1104633,https://api.labs.crossref.org/works/https://doi.org/10.1155/2022/1104633?mailto=christian.hauschke@tib.eu,2022,article,True,69,Efficient Cooperative Image Transmission in Sensor Networks,Physical Sciences,Computer Networks and Communications,IOS Press,True,en,Computer Science,
https://openalex.org/W4283745697,Hybrid Rider Optimization with Deep Learning Driven Biomedical Liver Cancer Detection and Classification,Computational Intelligence and Neuroscience,1,https://doi.org/10.1155/2022/6162445,https://api.labs.crossref.org/works/https://doi.org/10.1155/2022/6162445?mailto=christian.hauschke@tib.eu,2022,article,True,69,Classification of Brain Tumor Type and Grade,Life Sciences,Neurology,Hindawi Publishing Corporation,True,en,Neuroscience,
https://openalex.org/W4283750280,Upgrading and Optimization of Ski Tourism Resort Using Data Mining and Data Fusion,Wireless Communications and Mobile Computing,1,https://doi.org/10.1155/2022/5358440,https://api.labs.crossref.org/works/https://doi.org/10.1155/2022/5358440?mailto=christian.hauschke@tib.eu,2022,article,True,69,Drivers and Impediments for Cross-Border E-Commerce,Social Sciences,Business and International Management,Wiley,True,en,"Business, Management and Accounting",
https://openalex.org/W4283750768,A Wood Quality Defect Detection System Based on Deep Learning and Multicriterion Framework,Journal of Sensors,1,https://doi.org/10.1155/2022/3234148,https://api.labs.crossref.org/works/https://doi.org/10.1155/2022/3234148?mailto=christian.hauschke@tib.eu,2022,article,True,69,Intelligent Manufacturing Technologies,Physical Sciences,Industrial and Manufacturing Engineering,Hindawi Publishing Corporation,True,en,Engineering,
https://openalex.org/W4283750938,Dynamic Simulation Analysis of Carbon-Steel Hybrid Sucker Rod String in Vertical and Directional Wells,Mathematical Problems in Engineering,1,https://doi.org/10.1155/2022/5239355,https://api.labs.crossref.org/works/https://doi.org/10.1155/2022/5239355?mailto=christian.hauschke@tib.eu,2022,article,True,69,Application of Diagnostic Techniques in Oil Wells,Physical Sciences,Ocean Engineering,Hindawi Publishing Corporation,True,en,Engineering,
https://openalex.org/W4283754788,Clinical Treatment and Nursing Intervention Study of Clipping Treatment of Cerebral Aneurysm under the Health Model of Data Analysis,Emergency Medicine International,1,https://doi.org/10.1155/2022/8178963,https://api.labs.crossref.org/works/https://doi.org/10.1155/2022/8178963?mailto=christian.hauschke@tib.eu,2022,article,True,69,Machine Learning in Healthcare and Medicine,Health Sciences,Health Information Management,Hindawi Publishing Corporation,True,en,Health Professions,
https://openalex.org/W4283756231,Therapeutic Value of Traditional Chinese Massage plus Moxibustion for Degenerative Knee Osteoarthritis,Evidence-based Complementary and Alternative Medicine,1,https://doi.org/10.1155/2022/8305561,https://api.labs.crossref.org/works/https://doi.org/10.1155/2022/8305561?mailto=christian.hauschke@tib.eu,2022,article,True,69,Osteoarthritis and Cartilage Repair,Health Sciences,Rheumatology,Hindawi Publishing Corporation,True,en,Medicine,
https://openalex.org/W4283758388,"Effects of Tenofovir Combined with Recombinant Human Interferon α-2b on Negative Conversion Rate, Liver Function, Immune Status, and Drug Safety in Patients with Chronic Hepatitis B: A Systematic Review and Meta-Analysis",Evidence-based Complementary and Alternative Medicine,1,https://doi.org/10.1155/2022/1889628,https://api.labs.crossref.org/works/https://doi.org/10.1155/2022/1889628?mailto=christian.hauschke@tib.eu,2022,article,True,69,Hepatitis B Infection and Treatment,Health Sciences,Epidemiology,Hindawi Publishing Corporation,True,en,Medicine,
https://openalex.org/W4283760781,Analysis and Design of Cooperative Control Solutions for Electrical Systems of Laser CNC Machines,Shock and Vibration,1,https://doi.org/10.1155/2022/1423767,https://api.labs.crossref.org/works/https://doi.org/10.1155/2022/1423767?mailto=christian.hauschke@tib.eu,2022,article,True,69,Electrical Discharge Machining Processes,Physical Sciences,Electrical and Electronic Engineering,Hindawi Publishing Corporation,True,en,Engineering,
https://openalex.org/W4283765287,Vocational Therapy of Physical Training for Children’s Learning Motivation and Psychological Cognition,Occupational Therapy International,1,https://doi.org/10.1155/2022/8625830,https://api.labs.crossref.org/works/https://doi.org/10.1155/2022/8625830?mailto=christian.hauschke@tib.eu,2022,article,True,69,Physical Education and Sports Science Research,Health Sciences,"Physical Therapy, Sports Therapy and Rehabilitation",Hindawi Publishing Corporation,True,en,Health Professions,
https://openalex.org/W4283766417,Effect of Microscope Combined with Wechat Smart Platform on Clinical Efficacy and Gastrointestinal Function of Patients with Cholecystolithiasis Combined with Common Bile Duct Stones,Scanning,1,https://doi.org/10.1155/2022/9661506,https://api.labs.crossref.org/works/https://doi.org/10.1155/2022/9661506?mailto=christian.hauschke@tib.eu,2022,article,True,69,Diagnosis and Management of Biliary Tract Disorders,Health Sciences,Pulmonary and Respiratory Medicine,Wiley,True,en,Medicine,
https://openalex.org/W4283767346,Maintenance and Management Technology of Medical Imaging Equipment Based on Deep Learning,Contrast Media & Molecular Imaging,1,https://doi.org/10.1155/2022/6361098,https://api.labs.crossref.org/works/https://doi.org/10.1155/2022/6361098?mailto=christian.hauschke@tib.eu,2022,article,True,69,Artificial Intelligence in Medicine,Health Sciences,Health Informatics,Hindawi Publishing Corporation,True,en,Medicine,
https://openalex.org/W4283772161,Application of 3D Virtual Reality Sensor in Tourist Scenic Navigation System,Journal of Sensors,1,https://doi.org/10.1155/2022/1112261,https://api.labs.crossref.org/works/https://doi.org/10.1155/2022/1112261?mailto=christian.hauschke@tib.eu,2022,article,True,69,3D Geospatial Modelling Techniques,Physical Sciences,Geology,Hindawi Publishing Corporation,True,en,Earth and Planetary Sciences,
https://openalex.org/W4283774988,Application of Wireless Sensor Network Technology in Multipoint Control in Music Performance Management System,Computational Intelligence and Neuroscience,1,https://doi.org/10.1155/2022/2783944,https://api.labs.crossref.org/works/https://doi.org/10.1155/2022/2783944?mailto=christian.hauschke@tib.eu,2022,article,True,69,Artificial Intelligence in Education and Technology,Physical Sciences,Artificial Intelligence,Hindawi Publishing Corporation,True,en,Computer Science,
https://openalex.org/W4283779342,Effect of Vitapex Combined with AH-Plus Paste on Inflammation in Middle-Aged and Elderly Patients with Periodontal-Endodontic Disease,Computational and Mathematical Methods in Medicine,1,https://doi.org/10.1155/2022/7540961,https://api.labs.crossref.org/works/https://doi.org/10.1155/2022/7540961?mailto=christian.hauschke@tib.eu,2022,article,True,69,Periodontal Diseases and Oral Microbiome,Health Sciences,Periodontics,Hindawi Publishing Corporation,True,en,Dentistry,
https://openalex.org/W4283782039,Development and Teaching Application of Japanese Corpus Based on Big Data,Wireless Communications and Mobile Computing,1,https://doi.org/10.1155/2022/5965123,https://api.labs.crossref.org/works/https://doi.org/10.1155/2022/5965123?mailto=christian.hauschke@tib.eu,2022,article,True,69,Artificial Intelligence in Education and Technology,Physical Sciences,Artificial Intelligence,Wiley,True,en,Computer Science,
https://openalex.org/W4283782106,Simulation of the Electro-Superconducting System Based on the H Equation,Journal of Chemistry,1,https://doi.org/10.1155/2022/6831771,https://api.labs.crossref.org/works/https://doi.org/10.1155/2022/6831771?mailto=christian.hauschke@tib.eu,2022,article,True,69,Dynamics and Control of Magnetic Levitation Systems,Physical Sciences,Control and Systems Engineering,Hindawi Publishing Corporation,True,en,Engineering,
https://openalex.org/W4283782253,Blockchain Technology in the Management of Scientific and Technological Achievement Transformation in Chinese Universities,Mobile Information Systems,1,https://doi.org/10.1155/2022/1801037,https://api.labs.crossref.org/works/https://doi.org/10.1155/2022/1801037?mailto=christian.hauschke@tib.eu,2022,article,True,69,Factors Affecting Economic Development and Recovery,Social Sciences,"General Economics, Econometrics and Finance",IOS Press,True,en,"Economics, Econometrics and Finance",
https://openalex.org/W4283797776,Retraction Note to: A saboteur and mutant based built-in self-test and counting threshold-based built-in self repairing mechanism for memories,Journal of Ambient Intelligence and Humanized Computing,1,https://doi.org/10.1007/s12652-022-04295-w,https://api.labs.crossref.org/works/https://doi.org/10.1007/s12652-022-04295-w?mailto=christian.hauschke@tib.eu,2022,article,True,69,Memristive Devices for Neuromorphic Computing,Physical Sciences,Electrical and Electronic Engineering,Springer Science+Business Media,True,en,Engineering,
https://openalex.org/W4283808414,The Prevalence of Neurological Complication after Renal Transplantation,Evidence-based Complementary and Alternative Medicine,1,https://doi.org/10.1155/2022/8763304,https://api.labs.crossref.org/works/https://doi.org/10.1155/2022/8763304?mailto=christian.hauschke@tib.eu,2022,article,True,69,Posterior Reversible Encephalopathy Syndrome (PRES),Health Sciences,Psychiatry and Mental health,Hindawi Publishing Corporation,True,en,Medicine,
https://openalex.org/W4283810331,A Novel Framework for Automation Technology Based on Machine Vision and Robotics in Electrical Power Inspection Processing,Applied Bionics and Biomechanics,1,https://doi.org/10.1155/2022/9158936,https://api.labs.crossref.org/works/https://doi.org/10.1155/2022/9158936?mailto=christian.hauschke@tib.eu,2022,article,True,69,,,,Hindawi Publishing Corporation,True,en,,
https://openalex.org/W4283812060,Application of Improved BP Neural Network in the Optimization of Regional Economic Energy Consumption Structure,Wireless Communications and Mobile Computing,1,https://doi.org/10.1155/2022/1191271,https://api.labs.crossref.org/works/https://doi.org/10.1155/2022/1191271?mailto=christian.hauschke@tib.eu,2022,article,True,69,Electricity Price and Load Forecasting Methods,Physical Sciences,Electrical and Electronic Engineering,Wiley,True,en,Engineering,
https://openalex.org/W4283815713,Retraction Note to: Composite feature vector based cardiac arrhythmia classification using convolutional neural networks,Journal of Ambient Intelligence and Humanized Computing,1,https://doi.org/10.1007/s12652-022-04298-7,https://api.labs.crossref.org/works/https://doi.org/10.1007/s12652-022-04298-7?mailto=christian.hauschke@tib.eu,2022,article,True,69,Analysis of Electrocardiogram Signals,Health Sciences,Cardiology and Cardiovascular Medicine,Springer Science+Business Media,True,en,Medicine,
https://openalex.org/W4283815927,Construction of Teaching Mode of Film and TV Art in Institution of Higher Learning Using Virtual Simulation Technology,Computational Intelligence and Neuroscience,1,https://doi.org/10.1155/2022/6216232,https://api.labs.crossref.org/works/https://doi.org/10.1155/2022/6216232?mailto=christian.hauschke@tib.eu,2022,article,True,69,Optimization of Big Data Processing and Analysis,Physical Sciences,Artificial Intelligence,Hindawi Publishing Corporation,True,en,Computer Science,
https://openalex.org/W4283816240,SURF Algorithm-Based Data Aggregation Method and Digital Sharing Economy,Mobile Information Systems,1,https://doi.org/10.1155/2022/1513129,https://api.labs.crossref.org/works/https://doi.org/10.1155/2022/1513129?mailto=christian.hauschke@tib.eu,2022,article,True,69,Implications of Shared Autonomous Vehicle Services,Physical Sciences,Automotive Engineering,IOS Press,True,en,Engineering,
https://openalex.org/W4283837416,Implementation of Evidence in Preventing Postoperative Sore Throat of Patients Undergoing General Anesthesia Intubation Using the i-PARIHS Framework,Computational Intelligence and Neuroscience,1,https://doi.org/10.1155/2022/3151423,https://api.labs.crossref.org/works/https://doi.org/10.1155/2022/3151423?mailto=christian.hauschke@tib.eu,2022,article,True,69,Perioperative Cardiac Risk Assessment and Management,Health Sciences,Cardiology and Cardiovascular Medicine,Hindawi Publishing Corporation,True,en,Medicine,
https://openalex.org/W4284674221,Gene Mutation and Its Association with Clinicopathological Features in Young Patients with Non-Small-Cell Lung Cancer,Emergency Medicine International,1,https://doi.org/10.1155/2022/6333282,https://api.labs.crossref.org/works/https://doi.org/10.1155/2022/6333282?mailto=christian.hauschke@tib.eu,2022,article,True,69,Advancements in Lung Cancer Research,Health Sciences,Pulmonary and Respiratory Medicine,Hindawi Publishing Corporation,True,en,Medicine,
https://openalex.org/W4284686388,The Application of the Nurse-Led Sedation and Analgesia Management in ICU after Heart Surgeries,Evidence-based Complementary and Alternative Medicine,1,https://doi.org/10.1155/2022/7706172,https://api.labs.crossref.org/works/https://doi.org/10.1155/2022/7706172?mailto=christian.hauschke@tib.eu,2022,article,True,69,Management of Delirium in Critical Care Patients,Health Sciences,Critical Care and Intensive Care Medicine,Hindawi Publishing Corporation,True,en,Medicine,
https://openalex.org/W4284686649,Prediction Models for One-Year Survival of Adult Patients with Acute Kidney Injury: A Longitudinal Study Based on the Data from the Medical Information Mart for Intensive Care III Database,Evidence-based Complementary and Alternative Medicine,1,https://doi.org/10.1155/2022/5902907,https://api.labs.crossref.org/works/https://doi.org/10.1155/2022/5902907?mailto=christian.hauschke@tib.eu,2022,article,True,69,Management and Outcomes of Acute Kidney Injury,Health Sciences,Nephrology,Hindawi Publishing Corporation,True,en,Medicine,
https://openalex.org/W4284688418,Cardiac Magnetic Resonance Assessment of the Protective Effect of Remote Ischemic Postconditioning on Coronary Microcirculation after Reperfusion Therapy for Acute ST-Segment Elevation Myocardial Infarction,Computational and Mathematical Methods in Medicine,1,https://doi.org/10.1155/2022/5629763,https://api.labs.crossref.org/works/https://doi.org/10.1155/2022/5629763?mailto=christian.hauschke@tib.eu,2022,article,True,69,Advanced Cardiac Imaging Techniques and Diagnostics,Health Sciences,"Radiology, Nuclear Medicine and Imaging",Hindawi Publishing Corporation,True,en,Medicine,
