id,display_name,primary_location_display_name,cited_by_count,doi,crossref_call,publication_year,type,is_retracted,cited_by_percentile_year_min,primary_topic_display_name,primary_topic_domain_display_name,primary_topic_subfield_display_name,primary_location_source_host_organization_name,open_access_is_oa,language,primary_topic_field_display_name,update_nature
https://openalex.org/W2902146396,Fuzzy control in H-Bridge MLI for solar photovoltaic system to enhance load sharing,International Journal of Electrical Engineering Education,61,https://doi.org/10.1177/0020720918816002,https://api.labs.crossref.org/works/https://doi.org/10.1177/0020720918816002?mailto=christian.hauschke@tib.eu,2018,article,True,97,Lithium-ion Battery Management in Electric Vehicles,Physical Sciences,Automotive Engineering,SAGE Publishing,True,en,Engineering,
https://openalex.org/W1964918914,Isoquercitrin inhibits the progression of liver cancer in vivo and in vitro via the MAPK signalling pathway,Oncology Reports,60,https://doi.org/10.3892/or.2014.3099,https://api.labs.crossref.org/works/https://doi.org/10.3892/or.2014.3099?mailto=christian.hauschke@tib.eu,2014,article,True,97,Traditional Chinese Medicine in Modern Science,Health Sciences,Complementary and alternative medicine,Elsevier BV,True,en,Medicine,
https://openalex.org/W1983746744,Isoquercitrin inhibits the progression of pancreatic cancer in vivo and in vitro by regulating opioid receptors and the mitogen-activated protein kinase signalling pathway,Oncology Reports,60,https://doi.org/10.3892/or.2014.3626,https://api.labs.crossref.org/works/https://doi.org/10.3892/or.2014.3626?mailto=christian.hauschke@tib.eu,2014,article,True,97,Impact of Chronic Stress on Cancer Progression,Health Sciences,Psychiatry and Mental health,Elsevier BV,True,en,Medicine,
https://openalex.org/W2006598470,Genome-Wide Analysis of the Dof Transcription Factor Gene Family Reveals Soybean-Specific Duplicable and Functional Characteristics,PLOS ONE,60,https://doi.org/10.1371/journal.pone.0076809,https://api.labs.crossref.org/works/https://doi.org/10.1371/journal.pone.0076809?mailto=christian.hauschke@tib.eu,2013,article,True,97,Molecular Mechanisms of Plant Development and Regulation,Life Sciences,Plant Science,Public Library of Science,True,en,Agricultural and Biological Sciences,
https://openalex.org/W2032009340,MMP9 activation triggered by epidermal growth factor induced FoxO1 nuclear exclusion in non-small cell lung cancer,Tumor Biology,60,https://doi.org/10.1007/s13277-014-1850-z,https://api.labs.crossref.org/works/https://doi.org/10.1007/s13277-014-1850-z?mailto=christian.hauschke@tib.eu,2014,article,True,97,Role of Pim Oncogenes in Tumorigenesis,Health Sciences,Pathology and Forensic Medicine,SAGE Publishing,False,en,Medicine,
https://openalex.org/W2074620876,Somatic hypermutation maintains antibody thermodynamic stability during affinity maturation,Proceedings of the National Academy of Sciences of the United States of America,60,https://doi.org/10.1073/pnas.1301810110,https://api.labs.crossref.org/works/https://doi.org/10.1073/pnas.1301810110?mailto=christian.hauschke@tib.eu,2013,article,True,97,"Therapeutic Antibodies: Development, Engineering, and Applications",Health Sciences,"Radiology, Nuclear Medicine and Imaging",National Academy of Sciences,True,en,Medicine,
https://openalex.org/W2131603046,Fluoride release and recharge abilities of contemporary fluoride-containing restorative materials and dental adhesives,Dental Materials Journal,60,https://doi.org/10.4012/dmj.2012-144,https://api.labs.crossref.org/works/https://doi.org/10.4012/dmj.2012-144?mailto=christian.hauschke@tib.eu,2013,article,True,97,Dental Restorative Materials,Health Sciences,Orthodontics,Japanese Society for Dental Materials and Devices,True,en,Dentistry,
https://openalex.org/W2142065386,Computational Characterization of Exogenous MicroRNAs that Can Be Transferred into Human Circulation,PLOS ONE,60,https://doi.org/10.1371/journal.pone.0140587,https://api.labs.crossref.org/works/https://doi.org/10.1371/journal.pone.0140587?mailto=christian.hauschke@tib.eu,2015,article,True,97,MicroRNA Regulation in Cancer and Development,Life Sciences,Cancer Research,Public Library of Science,True,en,"Biochemistry, Genetics and Molecular Biology",
https://openalex.org/W2164082280,Histone demethylase JARID1C inactivation triggers genomic instability in sporadic renal cancer,Journal of Clinical Investigation,60,https://doi.org/10.1172/jci81040,https://api.labs.crossref.org/works/https://doi.org/10.1172/jci81040?mailto=christian.hauschke@tib.eu,2015,article,True,97,Epigenetic Modifications and Their Functional Implications,Life Sciences,Molecular Biology,American Society for Clinical Investigation,True,en,"Biochemistry, Genetics and Molecular Biology",
https://openalex.org/W2245881933,Real-life assessment of the validity of patient global impression of change in fibromyalgia,RMD Open,60,https://doi.org/10.1136/rmdopen-2015-000146,https://api.labs.crossref.org/works/https://doi.org/10.1136/rmdopen-2015-000146?mailto=christian.hauschke@tib.eu,2015,article,True,97,Diagnosis and Management of Fibromyalgia Syndrome,Health Sciences,Psychiatry and Mental health,BMJ,True,en,Medicine,
https://openalex.org/W2407046124,Nanospherical arabinogalactan proteins are a key component of the high-strength adhesive secreted by English ivy,Proceedings of the National Academy of Sciences of the United States of America,60,https://doi.org/10.1073/pnas.1600406113,https://api.labs.crossref.org/works/https://doi.org/10.1073/pnas.1600406113?mailto=christian.hauschke@tib.eu,2016,article,True,97,Molecular Mechanisms of Pollen Development and Function,Life Sciences,Molecular Biology,National Academy of Sciences,True,en,"Biochemistry, Genetics and Molecular Biology",
https://openalex.org/W2526085451,RETRACTED: miR-181a Induces Macrophage Polarized to M2 Phenotype and Promotes M2 Macrophage-mediated Tumor Cell Metastasis by Targeting KLF6 and C/EBPα,Molecular Therapy - Nucleic Acids,60,https://doi.org/10.1038/mtna.2016.71,https://api.labs.crossref.org/works/https://doi.org/10.1038/mtna.2016.71?mailto=christian.hauschke@tib.eu,2016,article,True,97,Role of Transcription Factors in Cell Regulation,Life Sciences,Molecular Biology,Cell Press,True,en,"Biochemistry, Genetics and Molecular Biology",
https://openalex.org/W2594509647,RETRACTED: The effects of the long non-coding RNA MALAT-1 regulated autophagy-related signaling pathway on chemotherapy resistance in diffuse large B-cell lymphoma,Biomedicine & Pharmacotherapy,60,https://doi.org/10.1016/j.biopha.2017.02.011,https://api.labs.crossref.org/works/https://doi.org/10.1016/j.biopha.2017.02.011?mailto=christian.hauschke@tib.eu,2017,article,True,97,Role of Long Noncoding RNAs in Cancer and Development,Life Sciences,Cancer Research,Elsevier BV,False,en,"Biochemistry, Genetics and Molecular Biology",
https://openalex.org/W2612139361,Melioidosis: Clinical impact and public health threat in the tropics,PLOS Neglected Tropical Diseases,60,https://doi.org/10.1371/journal.pntd.0004738,https://api.labs.crossref.org/works/https://doi.org/10.1371/journal.pntd.0004738?mailto=christian.hauschke@tib.eu,2017,article,True,97,"Epidemiology, Pathogenesis, and Management of Melioidosis",Health Sciences,Epidemiology,Public Library of Science,True,en,Medicine,
https://openalex.org/W2797685790,RETRACTED: Optical properties of two-dimensional GaS and GaSe monolayers,Physica E: Low-dimensional Systems and Nanostructures,60,https://doi.org/10.1016/j.physe.2018.04.019,https://api.labs.crossref.org/works/https://doi.org/10.1016/j.physe.2018.04.019?mailto=christian.hauschke@tib.eu,2018,article,True,97,Two-Dimensional Materials,Physical Sciences,Materials Chemistry,Elsevier BV,False,en,Materials Science,
https://openalex.org/W2885811648,RETRACTED ARTICLE: Hsp90β promotes aggressive vasculogenic mimicry via epithelial–mesenchymal transition in hepatocellular carcinoma,Oncogene,60,https://doi.org/10.1038/s41388-018-0428-4,https://api.labs.crossref.org/works/https://doi.org/10.1038/s41388-018-0428-4?mailto=christian.hauschke@tib.eu,2018,article,True,97,Molecular Mechanisms of Angiogenesis and Vascular Function,Life Sciences,Molecular Biology,Springer Nature,False,en,"Biochemistry, Genetics and Molecular Biology",
https://openalex.org/W1895021308,Motivational interviewing for alcohol misuse in young adults,Cochrane Database of Systematic Reviews,59,https://doi.org/10.1002/14651858.cd007025.pub2,https://api.labs.crossref.org/works/https://doi.org/10.1002/14651858.cd007025.pub2?mailto=christian.hauschke@tib.eu,2014,reference-entry,True,97,Epidemiology and Interventions for Substance Use Disorders,Health Sciences,Epidemiology,Cochrane,False,en,Medicine,
https://openalex.org/W1985944222,Dengue virus envelope protein domain I/II hinge determines long-lived serotype-specific dengue immunity,Proceedings of the National Academy of Sciences of the United States of America,59,https://doi.org/10.1073/pnas.1317350111,https://api.labs.crossref.org/works/https://doi.org/10.1073/pnas.1317350111?mailto=christian.hauschke@tib.eu,2014,article,True,97,Global Impact of Arboviral Diseases,Health Sciences,"Public Health, Environmental and Occupational Health",National Academy of Sciences,True,en,Medicine,
https://openalex.org/W1988693624,Retracted Article: Monodisperse Ni<sub>3</sub>Fe single-crystalline nanospheres as a highly efficient catalyst for the complete conversion of hydrous hydrazine to hydrogen at room temperature,"Journal of materials chemistry. A, Materials for energy and sustainability",59,https://doi.org/10.1039/c3ta10321h,https://api.labs.crossref.org/works/https://doi.org/10.1039/c3ta10321h?mailto=christian.hauschke@tib.eu,2013,article,True,97,Materials and Methods for Hydrogen Storage,Physical Sciences,Materials Chemistry,Royal Society of Chemistry,False,en,Materials Science,
https://openalex.org/W2061521956,CD133 and DNA-PK regulate MDR1 via the PI3K- or Akt-NF-κB pathway in multidrug-resistant glioblastoma cells in vitro,Oncogene,59,https://doi.org/10.1038/onc.2015.78,https://api.labs.crossref.org/works/https://doi.org/10.1038/onc.2015.78?mailto=christian.hauschke@tib.eu,2015,article,True,97,Gliomas,Health Sciences,Genetics,Springer Nature,True,en,Medicine,
https://openalex.org/W2076880656,"RETRACTED: Neuronal damage, central cholinergic dysfunction and oxidative damage correlate with cognitive deficits in rats with chronic cerebral hypoperfusion",Neurobiology of Learning and Memory,59,https://doi.org/10.1016/j.nlm.2013.11.016,https://api.labs.crossref.org/works/https://doi.org/10.1016/j.nlm.2013.11.016?mailto=christian.hauschke@tib.eu,2014,article,True,97,Chronic Cerebral Hypoperfusion-Related Neurodegenerative Diseases,Life Sciences,Neurology,Elsevier BV,True,en,Neuroscience,
https://openalex.org/W2080456178,Detection of Histone Acetylation Levels in the Dorsal Hippocampus Reveals Early Tagging on Specific Residues of H2B and H4 Histones in Response to Learning,PLOS ONE,59,https://doi.org/10.1371/journal.pone.0057816,https://api.labs.crossref.org/works/https://doi.org/10.1371/journal.pone.0057816?mailto=christian.hauschke@tib.eu,2013,article,True,97,Molecular Basis of Rett Syndrome and Related Disorders,Life Sciences,Genetics,Public Library of Science,True,en,"Biochemistry, Genetics and Molecular Biology",
https://openalex.org/W2118120499,"Retracted: Magnesium supplementation affects metabolic status and pregnancy outcomes in gestational diabetes: a randomized, double-blind, placebo-controlled trial",The American Journal of Clinical Nutrition,59,https://doi.org/10.3945/ajcn.114.098616,https://api.labs.crossref.org/works/https://doi.org/10.3945/ajcn.114.098616?mailto=christian.hauschke@tib.eu,2015,article,True,97,Role of Magnesium in Health and Disease,Health Sciences,Nutrition and Dietetics,Elsevier BV,True,en,Nursing,
https://openalex.org/W2139690699,RETRACTED ARTICLE: miR-663 attenuates tumor growth and invasiveness by targeting eEF1A2 in pancreatic cancer,Molecular Cancer,59,https://doi.org/10.1186/s12943-015-0315-3,https://api.labs.crossref.org/works/https://doi.org/10.1186/s12943-015-0315-3?mailto=christian.hauschke@tib.eu,2015,article,True,97,Pancreatic Cancer Research and Treatment,Health Sciences,Oncology,BioMed Central,True,en,Medicine,
https://openalex.org/W2218482279,RETRACTED: The highly efficient adsorption of Pb(II) on graphene oxides: A process combined by batch experiments and modeling techniques,Journal of Molecular Liquids,59,https://doi.org/10.1016/j.molliq.2015.12.061,https://api.labs.crossref.org/works/https://doi.org/10.1016/j.molliq.2015.12.061?mailto=christian.hauschke@tib.eu,2016,article,True,97,"Graphene: Properties, Synthesis, and Applications",Physical Sciences,Materials Chemistry,Elsevier BV,False,en,Materials Science,
https://openalex.org/W2297248363,"RETRACTED ARTICLE: Hericium erinaceus mycelium and its isolated erinacine A protection from MPTP-induced neurotoxicity through the ER stress, triggering an apoptosis cascade",Journal of Translational Medicine,59,https://doi.org/10.1186/s12967-016-0831-y,https://api.labs.crossref.org/works/https://doi.org/10.1186/s12967-016-0831-y?mailto=christian.hauschke@tib.eu,2016,article,True,97,Medicinal Mushrooms: Antitumor and Immunomodulating Properties,Health Sciences,Pharmacology,BioMed Central,True,en,Medicine,Retraction
https://openalex.org/W2317441279,RETRACTED: Endothelial PECAM-1 and its function in vascular physiology and atherogenic pathology,Experimental and Molecular Pathology,59,https://doi.org/10.1016/j.yexmp.2016.03.012,https://api.labs.crossref.org/works/https://doi.org/10.1016/j.yexmp.2016.03.012?mailto=christian.hauschke@tib.eu,2016,article,True,97,Integrin Signaling in Inflammation and Cancer,Health Sciences,Immunology and Allergy,Elsevier BV,False,en,Medicine,Retraction;Crossmark Retraction
https://openalex.org/W2345937915,A Remote Medication Monitoring System for Chronic Heart Failure Patients to Reduce Readmissions: A Two-Arm Randomized Pilot Study,Journal of Medical Internet Research,59,https://doi.org/10.2196/jmir.5256,https://api.labs.crossref.org/works/https://doi.org/10.2196/jmir.5256?mailto=christian.hauschke@tib.eu,2016,article,True,97,Diagnosis and Treatment of Heart Failure,Health Sciences,Cardiology and Cardiovascular Medicine,JMIR Publications,True,en,Medicine,Correction
https://openalex.org/W2525032563,Glyphosate in the general population and in applicators: a critical review of studies on exposures,Critical Reviews in Toxicology,59,https://doi.org/10.1080/10408444.2016.1214678,https://api.labs.crossref.org/works/https://doi.org/10.1080/10408444.2016.1214678?mailto=christian.hauschke@tib.eu,2016,article,True,97,Pesticide Pollution and Management,Physical Sciences,Pollution,Taylor & Francis,True,en,Environmental Science,Correction;Expression of concern
https://openalex.org/W2530995753,RETRACTED ARTICLE: Natural product pectolinarigenin inhibits osteosarcoma growth and metastasis via SHP-1-mediated STAT3 signaling inhibition,Cell Death and Disease,59,https://doi.org/10.1038/cddis.2016.305,https://api.labs.crossref.org/works/https://doi.org/10.1038/cddis.2016.305?mailto=christian.hauschke@tib.eu,2016,article,True,97,Role of STAT3 in Cancer Inflammation and Immunity,Health Sciences,Oncology,Springer Nature,True,en,Medicine,Retraction
https://openalex.org/W2545252664,Construction of a temperature-responsive terpolymer coating with recyclable bactericidal and self-cleaning antimicrobial properties,Biomaterials Science,59,https://doi.org/10.1039/c6bm00587j,https://api.labs.crossref.org/works/https://doi.org/10.1039/c6bm00587j?mailto=christian.hauschke@tib.eu,2016,article,True,97,Bone Tissue Engineering and Biomaterials,Physical Sciences,Biomedical Engineering,Royal Society of Chemistry,False,en,Engineering,Retraction
https://openalex.org/W2593715246,RETRACTED ARTICLE: miR-484 suppresses proliferation and epithelial–mesenchymal transition by targeting ZEB1 and SMAD2 in cervical cancer cells,Cancer Cell International,59,https://doi.org/10.1186/s12935-017-0407-9,https://api.labs.crossref.org/works/https://doi.org/10.1186/s12935-017-0407-9?mailto=christian.hauschke@tib.eu,2017,article,True,97,MicroRNA Regulation in Cancer and Development,Life Sciences,Cancer Research,BioMed Central,True,en,"Biochemistry, Genetics and Molecular Biology",Correction;Retraction
https://openalex.org/W2751586638,Identification of Plasmodium falciparum isolates lacking histidine-rich protein 2 and 3 in Eritrea,"Infection, Genetics and Evolution",59,https://doi.org/10.1016/j.meegid.2017.09.004,https://api.labs.crossref.org/works/https://doi.org/10.1016/j.meegid.2017.09.004?mailto=christian.hauschke@tib.eu,2017,article,True,97,Malaria,Health Sciences,"Public Health, Environmental and Occupational Health",Elsevier BV,False,en,Medicine,Expression of concern
https://openalex.org/W2766850416,Long non-coding RNA FTH1P3 facilitates uveal melanoma cell growth and invasion through miR-224-5p,PLOS ONE,59,https://doi.org/10.1371/journal.pone.0184746,https://api.labs.crossref.org/works/https://doi.org/10.1371/journal.pone.0184746?mailto=christian.hauschke@tib.eu,2017,article,True,97,Ocular Cancer Research and Treatment,Health Sciences,Ophthalmology,Public Library of Science,True,en,Medicine,Retraction
https://openalex.org/W2771417811,Evaluation of Chronic Nanosilver Toxicity to Adult Zebrafish,Frontiers in Physiology,59,https://doi.org/10.3389/fphys.2017.01011,https://api.labs.crossref.org/works/https://doi.org/10.3389/fphys.2017.01011?mailto=christian.hauschke@tib.eu,2017,article,True,97,Nanotoxicology and Antimicrobial Nanoparticles,Physical Sciences,Materials Chemistry,Frontiers Media,True,en,Materials Science,Retraction
https://openalex.org/W2775396086,<i>Retracted:</i> LncRNA XIST functions as a molecular sponge of miR‐194‐5p to regulate MAPK1 expression in hepatocellular carcinoma cell,Journal of Cellular Biochemistry,59,https://doi.org/10.1002/jcb.26540,https://api.labs.crossref.org/works/https://doi.org/10.1002/jcb.26540?mailto=christian.hauschke@tib.eu,2018,article,True,97,Role of Long Noncoding RNAs in Cancer and Development,Life Sciences,Cancer Research,Wiley,True,en,"Biochemistry, Genetics and Molecular Biology",Retraction
https://openalex.org/W2777199088,RETRACTED: Risk-Associated Long Noncoding RNA FOXD3-AS1 Inhibits Neuroblastoma Progression by Repressing PARP1-Mediated Activation of CTCF,Molecular Therapy,59,https://doi.org/10.1016/j.ymthe.2017.12.017,https://api.labs.crossref.org/works/https://doi.org/10.1016/j.ymthe.2017.12.017?mailto=christian.hauschke@tib.eu,2018,article,True,97,Neuroblastoma Research and Treatment,Health Sciences,Neurology,Elsevier BV,True,en,Medicine,Retraction;Crossmark Retraction
https://openalex.org/W2781054981,RETRACTED: Low-to-moderate intensity aerobic exercise training modulates irritable bowel syndrome through antioxidative and inflammatory mechanisms in women: Results of a randomized controlled trial,Cytokine,59,https://doi.org/10.1016/j.cyto.2017.12.016,https://api.labs.crossref.org/works/https://doi.org/10.1016/j.cyto.2017.12.016?mailto=christian.hauschke@tib.eu,2018,article,True,97,Functional Bowel Disorders and Gastrointestinal Health,Health Sciences,Gastroenterology,Elsevier BV,False,en,Medicine,Retraction;Crossmark Retraction
https://openalex.org/W2789357466,The prognostic value of HER2 in ovarian cancer: A meta-analysis of observational studies,PLOS ONE,59,https://doi.org/10.1371/journal.pone.0191972,https://api.labs.crossref.org/works/https://doi.org/10.1371/journal.pone.0191972?mailto=christian.hauschke@tib.eu,2018,article,True,97,Genomic Studies and Treatment of Ovarian Carcinoma,Health Sciences,Reproductive Medicine,Public Library of Science,True,en,Medicine,Expression of concern
https://openalex.org/W788929558,Fructose Mediated Non-Alcoholic Fatty Liver Is Attenuated by HO-1-SIRT1 Module in Murine Hepatocytes and Mice Fed a High Fructose Diet,PLOS ONE,59,https://doi.org/10.1371/journal.pone.0128648,https://api.labs.crossref.org/works/https://doi.org/10.1371/journal.pone.0128648?mailto=christian.hauschke@tib.eu,2015,article,True,97,Impact of Fructose on Metabolic Health,Health Sciences,"Endocrinology, Diabetes and Metabolism",Public Library of Science,True,en,Medicine,Retraction
https://openalex.org/W1751212901,“Unfocus” on foc.us: commercial tDCS headset impairs working memory,Experimental Brain Research,58,https://doi.org/10.1007/s00221-015-4391-9,https://api.labs.crossref.org/works/https://doi.org/10.1007/s00221-015-4391-9?mailto=christian.hauschke@tib.eu,2015,article,True,97,Effects of Brain Stimulation on Motor Cortex,Life Sciences,Neurology,Springer Science+Business Media,True,en,Neuroscience,Expression of concern
https://openalex.org/W1885443753,Community-based population-level interventions for promoting child oral health,Cochrane Database of Systematic Reviews,58,https://doi.org/10.1002/14651858.cd009837.pub2,https://api.labs.crossref.org/works/https://doi.org/10.1002/14651858.cd009837.pub2?mailto=christian.hauschke@tib.eu,2016,reference-entry,True,97,Global Oral Health and Dental Caries,Health Sciences,Periodontics,Cochrane,True,en,Dentistry,Retraction
https://openalex.org/W1966062493,IL-26 Promotes the Proliferation and Survival of Human Gastric Cancer Cells by Regulating the Balance of STAT1 and STAT3 Activation,PLOS ONE,58,https://doi.org/10.1371/journal.pone.0063588,https://api.labs.crossref.org/works/https://doi.org/10.1371/journal.pone.0063588?mailto=christian.hauschke@tib.eu,2013,article,True,97,Pathogenesis and Treatment of Whipple's Disease,Health Sciences,Pathology and Forensic Medicine,Public Library of Science,True,en,Medicine,Retraction
https://openalex.org/W1967328865,Spectrofluorimetric determination of melatonin in kernels of four different Pistacia varieties after ultrasound-assisted solid–liquid extraction,Spectrochimica Acta Part A: Molecular and Biomolecular Spectroscopy,58,https://doi.org/10.1016/j.saa.2014.05.010,https://api.labs.crossref.org/works/https://doi.org/10.1016/j.saa.2014.05.010?mailto=christian.hauschke@tib.eu,2014,article,True,97,Role of Oxidative Stress in Health and Disease,Health Sciences,Biochemistry,Elsevier BV,False,en,Medicine,Expression of concern
https://openalex.org/W2008925546,RETRACTED: Effect of thermal annealing on P3HT:PCBM bulk-heterojunction organic solar cells: A critical review,Renewable & Sustainable Energy Reviews,58,https://doi.org/10.1016/j.rser.2013.10.025,https://api.labs.crossref.org/works/https://doi.org/10.1016/j.rser.2013.10.025?mailto=christian.hauschke@tib.eu,2014,article,True,97,Organic Solar Cell Technology,Physical Sciences,Electrical and Electronic Engineering,Elsevier BV,False,en,Engineering,Retraction;Crossmark Retraction
https://openalex.org/W2019557137,Political Attitudes Develop Independently of Personality Traits,PLOS ONE,58,https://doi.org/10.1371/journal.pone.0118106,https://api.labs.crossref.org/works/https://doi.org/10.1371/journal.pone.0118106?mailto=christian.hauschke@tib.eu,2015,article,True,97,Intergroup Relations and Social Identity Theories,Social Sciences,Sociology and Political Science,Public Library of Science,True,en,Social Sciences,Correction
https://openalex.org/W2020995823,"MicroRNAs in Hepatocellular Carcinoma: Carcinogenesis, Progression, and Therapeutic Target",BioMed Research International,58,https://doi.org/10.1155/2014/486407,https://api.labs.crossref.org/works/https://doi.org/10.1155/2014/486407?mailto=christian.hauschke@tib.eu,2014,article,True,97,MicroRNA Regulation in Cancer and Development,Life Sciences,Cancer Research,Hindawi Publishing Corporation,True,en,"Biochemistry, Genetics and Molecular Biology",Retraction
https://openalex.org/W2028264252,MicroRNA-503 Acts as a Tumor Suppressor in Osteosarcoma by Targeting L1CAM,PLOS ONE,58,https://doi.org/10.1371/journal.pone.0114585,https://api.labs.crossref.org/works/https://doi.org/10.1371/journal.pone.0114585?mailto=christian.hauschke@tib.eu,2014,article,True,97,MicroRNA Regulation in Cancer and Development,Life Sciences,Cancer Research,Public Library of Science,True,en,"Biochemistry, Genetics and Molecular Biology",Retraction
https://openalex.org/W2044112683,Retracted: Levee Layouts and Design Optimization in Protection of Flood Areas,Journal of Irrigation and Drainage Engineering-asce,58,https://doi.org/10.1061/(asce)ir.1943-4774.0000864,https://api.labs.crossref.org/works/https://doi.org/10.1061/(asce)ir.1943-4774.0000864?mailto=christian.hauschke@tib.eu,2015,article,True,97,Global Flood Risk Assessment and Management,Physical Sciences,Global and Planetary Change,American Society of Civil Engineers,False,en,Environmental Science,Retraction
