id,display_name,primary_location_display_name,cited_by_count,doi,crossref_call,publication_year,type,is_retracted,cited_by_percentile_year_min,primary_topic_display_name,primary_topic_domain_display_name,primary_topic_subfield_display_name,primary_location_source_host_organization_name,open_access_is_oa,language,primary_topic_field_display_name,update_nature
https://openalex.org/W1795956121,Notice of Retraction: Analysis on collective learning in industrial clusters from the perspective of knowledge recourses,,0,https://doi.org/10.1109/icebeg.2011.5881459,https://api.labs.crossref.org/works/https://doi.org/10.1109/icebeg.2011.5881459?mailto=christian.hauschke@tib.eu,2011,article,True,0,Knowledge Management and Organizational Innovation,Social Sciences,Strategy and Management,,False,en,"Business, Management and Accounting",Retraction
https://openalex.org/W1796580715,Notice of Retraction: Empirical studies of export structure of China's wood forest products: 1995–2009,,0,https://doi.org/10.1109/icebeg.2011.5887087,https://api.labs.crossref.org/works/https://doi.org/10.1109/icebeg.2011.5887087?mailto=christian.hauschke@tib.eu,2011,article,True,0,Spatial Shift-Share Analysis in Economic Development,Social Sciences,Economics and Econometrics,,False,en,"Economics, Econometrics and Finance",Retraction
https://openalex.org/W1796609251,Notice of Retraction: Operation evaluation of listed estate companies based on principal component analysis,,0,https://doi.org/10.1109/icebeg.2011.5877037,https://api.labs.crossref.org/works/https://doi.org/10.1109/icebeg.2011.5877037?mailto=christian.hauschke@tib.eu,2011,article,True,0,Fuzzy Class Membership Modeling in Environmental Sciences,Physical Sciences,Ecological Modeling,,False,en,Environmental Science,Retraction
https://openalex.org/W1796907809,Notice of Retraction: Study on the integration of China's iron and steel industry based on circular economy,,0,https://doi.org/10.1109/icebeg.2011.5882029,https://api.labs.crossref.org/works/https://doi.org/10.1109/icebeg.2011.5882029?mailto=christian.hauschke@tib.eu,2011,article,True,0,Reduction Kinetics in Ironmaking Processes,Physical Sciences,Mechanical Engineering,,False,en,Engineering,Retraction
https://openalex.org/W1797945938,Notice of Retraction: Voltammetric Determination of Norepinphrine on a Glassy Carbon Electrode Modified with Poly (L-Aspartic Acid),,0,https://doi.org/10.1109/icbbe.2011.5780173,https://api.labs.crossref.org/works/https://doi.org/10.1109/icbbe.2011.5780173?mailto=christian.hauschke@tib.eu,2011,article,True,0,Electrochemical Biosensor Technology,Physical Sciences,Electrical and Electronic Engineering,,False,en,Engineering,Retraction
https://openalex.org/W1798421279,Notice of Retraction: Dynamic Nucleosome Positioning around Functional Transcription Factor Binding Sites in the Promoters of Inducible NF-kappaB Target Genes,,0,https://doi.org/10.1109/icbbe.2011.5780146,https://api.labs.crossref.org/works/https://doi.org/10.1109/icbbe.2011.5780146?mailto=christian.hauschke@tib.eu,2011,article,True,0,Innate Immunity to Viral Infection,Life Sciences,Immunology,,False,en,Immunology and Microbiology,Retraction
https://openalex.org/W1798703781,Notice of Retraction: Effects of Magnesium Salt on the Anaerobic Gas Production of Modified Sludge,,0,https://doi.org/10.1109/icbbe.2011.5781366,https://api.labs.crossref.org/works/https://doi.org/10.1109/icbbe.2011.5781366?mailto=christian.hauschke@tib.eu,2011,article,True,0,Freeze Desalination for Water Treatment and Concentration,Physical Sciences,Mechanics of Materials,,False,en,Engineering,Retraction
https://openalex.org/W1799247728,Notice of Retraction: Three-dimensional numerical simulation for shaped charge jet penetrating into target,,0,https://doi.org/10.1109/qr2mse.2013.6625977,https://api.labs.crossref.org/works/https://doi.org/10.1109/qr2mse.2013.6625977?mailto=christian.hauschke@tib.eu,2013,article,True,0,Smoothed Particle Hydrodynamics in Fluid Dynamics,Physical Sciences,Computational Mechanics,,False,en,Engineering,Retraction
https://openalex.org/W1801722071,Notice of Retraction: Evaiuation on evaluation indicator system of independent innovation capability of China's automotive enterprise,,0,https://doi.org/10.1109/icpim.2011.5983638,https://api.labs.crossref.org/works/https://doi.org/10.1109/icpim.2011.5983638?mailto=christian.hauschke@tib.eu,2011,article,True,0,Comprehensive Assessment of Safety in Energy and Infrastructure,Physical Sciences,"Safety, Risk, Reliability and Quality",,False,en,Engineering,Retraction
https://openalex.org/W1802873932,Notice of Retraction Series system failure rate modeling by load-strength interference analysis,,0,https://doi.org/10.1109/qr2mse.2013.6625539,https://api.labs.crossref.org/works/https://doi.org/10.1109/qr2mse.2013.6625539?mailto=christian.hauschke@tib.eu,2013,article,True,0,Simulation and Analysis of Road Safety Barriers,Physical Sciences,Civil and Structural Engineering,,False,en,Engineering,Retraction
https://openalex.org/W1803014510,Notice of Retraction: The Contribution of Leaching under Different pH to Nutrients Release of Cattail Litter,,0,https://doi.org/10.1109/icbbe.2011.5781463,https://api.labs.crossref.org/works/https://doi.org/10.1109/icbbe.2011.5781463?mailto=christian.hauschke@tib.eu,2011,article,True,0,Biogeochemical Cycling of Nutrients in Aquatic Ecosystems,Physical Sciences,Environmental Chemistry,,False,en,Environmental Science,Retraction
https://openalex.org/W1803470643,Notice of Retraction: Study on the Anaerobic Biodegradability of Dissolved and Colloidal Substance in Wastewater of Recycled Paper Making,,0,https://doi.org/10.1109/icbbe.2011.5781029,https://api.labs.crossref.org/works/https://doi.org/10.1109/icbbe.2011.5781029?mailto=christian.hauschke@tib.eu,2011,article,True,0,On-line Monitoring of Wastewater Quality,Physical Sciences,Industrial and Manufacturing Engineering,,False,en,Environmental Science,Retraction
https://openalex.org/W1803932647,Notice of Retraction: Study on building enterprise culture within human resources management,,0,https://doi.org/10.1109/icbmei.2011.5918026,https://api.labs.crossref.org/works/https://doi.org/10.1109/icbmei.2011.5918026?mailto=christian.hauschke@tib.eu,2011,article,True,0,Global Talent Management and Strategic HR Practices,Social Sciences,Organizational Behavior and Human Resource Management,,False,en,"Business, Management and Accounting",Retraction
https://openalex.org/W1804316907,Notice of Retraction: Earthquake Hazard and Seismic Risk Reduction for Building Structural Systems,,0,https://doi.org/10.1109/icbbe.2011.5781571,https://api.labs.crossref.org/works/https://doi.org/10.1109/icbbe.2011.5781571?mailto=christian.hauschke@tib.eu,2011,article,True,0,Progressive Collapse of Structures,Physical Sciences,Civil and Structural Engineering,,False,en,Engineering,Retraction
https://openalex.org/W1804891930,Notice of Retraction: The Application of Group Cooperation Model in Teaching Data Structures,,0,https://doi.org/10.1109/paccs.2011.5990308,https://api.labs.crossref.org/works/https://doi.org/10.1109/paccs.2011.5990308?mailto=christian.hauschke@tib.eu,2011,article,True,0,Application of Fuzzy Logic in Educational Assessment,Physical Sciences,Information Systems,,False,en,Computer Science,Retraction
https://openalex.org/W1805904546,Notice of Retraction: Total and Methyl Mercury Varieties in Water and Sediment of Wuli River in the past 25 Years,,0,https://doi.org/10.1109/icbbe.2011.5780867,https://api.labs.crossref.org/works/https://doi.org/10.1109/icbbe.2011.5780867?mailto=christian.hauschke@tib.eu,2011,article,True,0,Toxicology and Environmental Impacts of Mercury Contamination,Physical Sciences,"Health, Toxicology and Mutagenesis",,False,en,Environmental Science,Retraction
https://openalex.org/W1806842757,Notice of Retraction: A Pediocin Produced by Pediococcus acidilactici Strain PA003 and Its Partial Characteristics,,0,https://doi.org/10.1109/icbbe.2011.5780062,https://api.labs.crossref.org/works/https://doi.org/10.1109/icbbe.2011.5780062?mailto=christian.hauschke@tib.eu,2011,article,True,0,Probiotics and Prebiotics,Life Sciences,Food Science,,False,en,Agricultural and Biological Sciences,Retraction
https://openalex.org/W1806919333,Notice of Retraction Application of API RBI methodology on stabilizer tower in natural gas plant,,0,https://doi.org/10.1109/qr2mse.2013.6625526,https://api.labs.crossref.org/works/https://doi.org/10.1109/qr2mse.2013.6625526?mailto=christian.hauschke@tib.eu,2013,article,True,0,Artificial Intelligence and Expert Systems,Physical Sciences,Artificial Intelligence,,False,en,Computer Science,Retraction
https://openalex.org/W1808405994,Notice of Retraction Rate-dependent behavior and failure characteristics of carbon/Kevlar hybrid woven composites,,0,https://doi.org/10.1109/qr2mse.2013.6625693,https://api.labs.crossref.org/works/https://doi.org/10.1109/qr2mse.2013.6625693?mailto=christian.hauschke@tib.eu,2013,article,True,0,Composite Materials and Structures,Physical Sciences,Mechanics of Materials,,False,en,Engineering,Retraction
https://openalex.org/W1809064436,Notice of Retraction: Up-Regulation of the NGF-mRNA in Macrophage Cell Induced by Formaldehyde and DEHP,,0,https://doi.org/10.1109/icbbe.2011.5781415,https://api.labs.crossref.org/works/https://doi.org/10.1109/icbbe.2011.5781415?mailto=christian.hauschke@tib.eu,2011,article,True,0,Brown Adipose Tissue Function and Physiology,Health Sciences,Physiology,,False,en,Medicine,Retraction
https://openalex.org/W1809938346,Notice of Retraction: Study on Advanced Treatment Process for Drilling Wastewater by Fenton Oxidation,,0,https://doi.org/10.1109/icbbe.2011.5781001,https://api.labs.crossref.org/works/https://doi.org/10.1109/icbbe.2011.5781001?mailto=christian.hauschke@tib.eu,2011,article,True,0,Microbial Bioremediation of Organic Pollutants,Physical Sciences,Pollution,,True,en,Environmental Science,
https://openalex.org/W1810062256,Notice of Retraction: Performance analysis of e-government affairs under economic angle,,0,https://doi.org/10.1109/icebeg.2011.5877041,https://api.labs.crossref.org/works/https://doi.org/10.1109/icebeg.2011.5877041?mailto=christian.hauschke@tib.eu,2011,article,True,0,Network Formation and Game Dynamics,Social Sciences,Management Science and Operations Research,,False,en,Decision Sciences,
https://openalex.org/W1810314667,Notice of Retraction: Innovative design of mechanical equipment model for function programming,,0,https://doi.org/10.1109/icpim.2011.5983721,https://api.labs.crossref.org/works/https://doi.org/10.1109/icpim.2011.5983721?mailto=christian.hauschke@tib.eu,2011,article,True,0,Design for Manufacture and Assembly in Manufacturing,Physical Sciences,Industrial and Manufacturing Engineering,,False,en,Engineering,
https://openalex.org/W1810355973,Notice of Retraction: Quantificational research on public policy responsive degree: Taking social aid policy in Ningbo as example,,0,https://doi.org/10.1109/icebeg.2011.5882628,https://api.labs.crossref.org/works/https://doi.org/10.1109/icebeg.2011.5882628?mailto=christian.hauschke@tib.eu,2011,article,True,0,Personalisation of Social Care Services,Social Sciences,Education,,False,en,Social Sciences,
https://openalex.org/W1810747094,Notice of Retraction: Adsorption and Desorption of Cr(III) on a Spherical Cellulose Adsorbent,,0,https://doi.org/10.1109/icbbe.2011.5781032,https://api.labs.crossref.org/works/https://doi.org/10.1109/icbbe.2011.5781032?mailto=christian.hauschke@tib.eu,2011,article,True,0,Adsorption of Water Contaminants,Physical Sciences,Water Science and Technology,,False,en,Environmental Science,
https://openalex.org/W1811931336,Notice of Retraction: Relationship between interpersonal conflict and counterproductive work behavior: The effects of negative affectivity,,0,https://doi.org/10.1109/icebeg.2011.5882413,https://api.labs.crossref.org/works/https://doi.org/10.1109/icebeg.2011.5882413?mailto=christian.hauschke@tib.eu,2011,article,True,0,Work Engagement and Organizational Behavior,Social Sciences,Organizational Behavior and Human Resource Management,,False,en,"Business, Management and Accounting",
https://openalex.org/W1812092947,Notice of Retraction: Adsorption Isotherms for Fluoride Adsorption onto Ca-Rectorite: Comparison of Linear and Nonlinear Method,,0,https://doi.org/10.1109/icbbe.2011.5780962,https://api.labs.crossref.org/works/https://doi.org/10.1109/icbbe.2011.5780962?mailto=christian.hauschke@tib.eu,2011,article,True,0,Fluoride Contamination in Drinking Water and Defluoridation Methods,Physical Sciences,Water Science and Technology,,False,en,Environmental Science,
https://openalex.org/W1812619661,Notice of Retraction: The design method of ecovillage under the influence of ecologism trend of thought,,0,https://doi.org/10.1109/icetce.2011.5776279,https://api.labs.crossref.org/works/https://doi.org/10.1109/icetce.2011.5776279?mailto=christian.hauschke@tib.eu,2011,article,True,0,Parametric Architecture and Urban Design,Physical Sciences,Architecture,,False,en,Engineering,
https://openalex.org/W1812770710,Notice of Retraction: TiO2 Anatase Coatings on Porous NiTi Shape Memory Alloy Prepared by a Dipping Sol-Gel Method,,0,https://doi.org/10.1109/icbbe.2011.5780703,https://api.labs.crossref.org/works/https://doi.org/10.1109/icbbe.2011.5780703?mailto=christian.hauschke@tib.eu,2011,article,True,0,Physical Metallurgy of Shape Memory Alloys,Physical Sciences,Materials Chemistry,,False,en,Materials Science,
https://openalex.org/W1813015813,Notice of Retraction: ISL-Induced Differentiation Is Associated with NADPH Oxidase in HL-60 Cells,,0,https://doi.org/10.1109/icbbe.2011.5781647,https://api.labs.crossref.org/works/https://doi.org/10.1109/icbbe.2011.5781647?mailto=christian.hauschke@tib.eu,2011,article,True,0,Pharmacological Effects of Licorice Roots,Life Sciences,Pharmacology,,False,en,"Pharmacology, Toxicology and Pharmaceutics",
https://openalex.org/W1813312684,Notice of Retraction: Research on applying the internet of things for logistics business process reengineering,,0,https://doi.org/10.1109/icebeg.2011.5881694,https://api.labs.crossref.org/works/https://doi.org/10.1109/icebeg.2011.5881694?mailto=christian.hauschke@tib.eu,2011,article,True,0,Collaborative Networks in Manufacturing and Organizations,Social Sciences,Management of Technology and Innovation,,False,en,"Business, Management and Accounting",
https://openalex.org/W1813429861,Notice of Retraction: Study on the development of carbon finance in low carbon economy,,0,https://doi.org/10.1109/icebeg.2011.5882214,https://api.labs.crossref.org/works/https://doi.org/10.1109/icebeg.2011.5882214?mailto=christian.hauschke@tib.eu,2011,article,True,0,Economic Implications of Climate Change Policies,Social Sciences,Economics and Econometrics,,False,en,"Economics, Econometrics and Finance",
https://openalex.org/W1813920944,Notice of Retraction: Online Automatic Monitoring of Trace Amounts of Zinc in Environmental Water,,0,https://doi.org/10.1109/icbbe.2011.5780757,https://api.labs.crossref.org/works/https://doi.org/10.1109/icbbe.2011.5780757?mailto=christian.hauschke@tib.eu,2011,article,True,0,On-line Monitoring of Wastewater Quality,Physical Sciences,Industrial and Manufacturing Engineering,,False,en,Environmental Science,
https://openalex.org/W1814480118,Notice of Retraction: Calibration of the Parameters in the Transport Model of the Migration of Lead in Soil-Vegetable System,,0,https://doi.org/10.1109/icbbe.2011.5780756,https://api.labs.crossref.org/works/https://doi.org/10.1109/icbbe.2011.5780756?mailto=christian.hauschke@tib.eu,2011,article,True,0,Ecological Assessment and Urban Development,Physical Sciences,Ecology,,False,en,Environmental Science,
https://openalex.org/W1816461854,Notice of Retraction: Power consumption demand analysis of urban residents — Takes Yantai as an exampling,,0,https://doi.org/10.1109/icebeg.2011.5881350,https://api.labs.crossref.org/works/https://doi.org/10.1109/icebeg.2011.5881350?mailto=christian.hauschke@tib.eu,2011,article,True,0,Energy Storage in Power Systems,Physical Sciences,Energy Engineering and Power Technology,,False,en,Energy,
https://openalex.org/W1816516439,Notice of Retraction Analysis of multi-body systems with revolute joint wear,,0,https://doi.org/10.1109/qr2mse.2013.6625704,https://api.labs.crossref.org/works/https://doi.org/10.1109/qr2mse.2013.6625704?mailto=christian.hauschke@tib.eu,2013,article,True,0,Dynamics and Control of Multibody Mechanical Systems,Physical Sciences,Control and Systems Engineering,,False,en,Engineering,
https://openalex.org/W1818297257,Notice of Retraction: Vegetation Reconstruction in Littoral Zone of Three Gorges Reservoir,,0,https://doi.org/10.1109/icbbe.2011.5781562,https://api.labs.crossref.org/works/https://doi.org/10.1109/icbbe.2011.5781562?mailto=christian.hauschke@tib.eu,2011,article,True,0,Ecological Dynamics of Riverine Landscapes,Physical Sciences,Ecology,,False,en,Environmental Science,
https://openalex.org/W1818963559,Notice of Retraction: A design of full digital servo system based on PC/ 104,,0,https://doi.org/10.1109/iceice.2011.5777419,https://api.labs.crossref.org/works/https://doi.org/10.1109/iceice.2011.5777419?mailto=christian.hauschke@tib.eu,2011,article,True,0,Control Systems and Network Applications,Physical Sciences,Control and Systems Engineering,,False,en,Engineering,
https://openalex.org/W1820051363,Notice of Retraction: Carbon Metabolism in the Soils Fumigated with Methyl Bromide Alternatives,,0,https://doi.org/10.1109/icbbe.2011.5781393,https://api.labs.crossref.org/works/https://doi.org/10.1109/icbbe.2011.5781393?mailto=christian.hauschke@tib.eu,2011,article,True,0,Meta-analysis in Ecology and Agriculture Research,Life Sciences,"Ecology, Evolution, Behavior and Systematics",,False,en,Agricultural and Biological Sciences,
https://openalex.org/W1820097760,Notice of Retraction: Comparison of Motion Response Calculation Methods of Deepwater Semi-Submersible Platform,,0,https://doi.org/10.1109/paccs.2011.5990276,https://api.labs.crossref.org/works/https://doi.org/10.1109/paccs.2011.5990276?mailto=christian.hauschke@tib.eu,2011,article,True,0,Modeling and Assessment of Pipeline Corrosion Damage,Physical Sciences,Mechanical Engineering,,False,en,Engineering,
https://openalex.org/W1820526068,Notice of Retraction: The economic model and empirical analysis of urban social capital in China: 1988–2008,,0,https://doi.org/10.1109/icebeg.2011.5887202,https://api.labs.crossref.org/works/https://doi.org/10.1109/icebeg.2011.5887202?mailto=christian.hauschke@tib.eu,2011,article,True,0,Social Capital and Trust in Communities,Social Sciences,Sociology and Political Science,,False,en,Social Sciences,
https://openalex.org/W1820641425,Notice of Retraction: Toxicity Assessment of Effluents Discharged into Bohai Sea of China Using a Battery of Bioassay,,0,https://doi.org/10.1109/icbbe.2011.5781574,https://api.labs.crossref.org/works/https://doi.org/10.1109/icbbe.2011.5781574?mailto=christian.hauschke@tib.eu,2011,article,True,0,On-line Monitoring of Wastewater Quality,Physical Sciences,Industrial and Manufacturing Engineering,,False,en,Environmental Science,
https://openalex.org/W1820785655,Notice of Retraction: Electrochemical Study on High Concentration Cyanide-Contained Wastewater,,0,https://doi.org/10.1109/icbbe.2011.5780817,https://api.labs.crossref.org/works/https://doi.org/10.1109/icbbe.2011.5780817?mailto=christian.hauschke@tib.eu,2011,article,True,0,Cyanogenic Glycosides in Plants and Industrial Wastewaters,Life Sciences,Plant Science,,False,en,Agricultural and Biological Sciences,
https://openalex.org/W1820976745,Notice of Retraction Bifurcation analysis and control of the Rossler system,,0,https://doi.org/10.1109/icnc.2011.6022317,https://api.labs.crossref.org/works/https://doi.org/10.1109/icnc.2011.6022317?mailto=christian.hauschke@tib.eu,2011,article,True,0,Chaos Synchronization and Control in Complex Systems,Physical Sciences,Statistical and Nonlinear Physics,,False,en,Physics and Astronomy,
https://openalex.org/W1821268155,Notice of Retraction Measurement error separation based on EMD,,0,https://doi.org/10.1109/qr2mse.2013.6625950,https://api.labs.crossref.org/works/https://doi.org/10.1109/qr2mse.2013.6625950?mailto=christian.hauschke@tib.eu,2013,article,True,0,Artificial Intelligence and Expert Systems,Physical Sciences,Artificial Intelligence,,False,en,Computer Science,
https://openalex.org/W1821273497,Notice of Retraction Reliability improvement of nuclear-used seal auxiliary system with redundancy at the conceptual design stage by RBD Modeling,,0,https://doi.org/10.1109/qr2mse.2013.6625617,https://api.labs.crossref.org/works/https://doi.org/10.1109/qr2mse.2013.6625617?mailto=christian.hauschke@tib.eu,2013,article,True,0,Materials Engineering in Industrial Applications,Physical Sciences,Mechanics of Materials,,False,en,Engineering,
https://openalex.org/W1821582864,"Notice of Retraction: A study on the culture heritage conservation of Tianjin, economic center of North China",,0,https://doi.org/10.1109/icetce.2011.5775989,https://api.labs.crossref.org/works/https://doi.org/10.1109/icetce.2011.5775989?mailto=christian.hauschke@tib.eu,2011,article,True,0,"Temporal, Spatial, and Social Aspects of Cultural Heritage Studies",Social Sciences,Archeology,,False,en,Arts and Humanities,
https://openalex.org/W1821631181,"Notice of Retraction: A relational study on personality trait, achievement goal, and test anxiety in high school students",,0,https://doi.org/10.1109/icebeg.2011.5887017,https://api.labs.crossref.org/works/https://doi.org/10.1109/icebeg.2011.5887017?mailto=christian.hauschke@tib.eu,2011,article,True,0,The Psychology of Achievement Motivation and Learning,Social Sciences,Experimental and Cognitive Psychology,,False,en,Psychology,
https://openalex.org/W1821944239,Notice of Retraction: Create the new system of management of important transition zones in the natural reserve — Based on the agreement to protect mechanism of important transition zones in the natural reserve,,0,https://doi.org/10.1109/icebeg.2011.5881305,https://api.labs.crossref.org/works/https://doi.org/10.1109/icebeg.2011.5881305?mailto=christian.hauschke@tib.eu,2011,article,True,0,Drivers and Impacts of Tropical Deforestation,Physical Sciences,Global and Planetary Change,,False,en,Environmental Science,
https://openalex.org/W1822042283,Notice of Retraction: Study on Manganese adsorption by modified Manganese sand in groundwater,,0,https://doi.org/10.1109/icetce.2011.5775408,https://api.labs.crossref.org/works/https://doi.org/10.1109/icetce.2011.5775408?mailto=christian.hauschke@tib.eu,2011,article,True,0,Ecological Assessment and Urban Development,Physical Sciences,Ecology,,False,en,Environmental Science,
https://openalex.org/W1822101029,Notice of Retraction: The Research on the Transportation Simulation of Di-(2-Ethylhexyl)Phthalate (DEHP) in Vadose Zone,,0,https://doi.org/10.1109/icbbe.2011.5780798,https://api.labs.crossref.org/works/https://doi.org/10.1109/icbbe.2011.5780798?mailto=christian.hauschke@tib.eu,2011,article,True,0,Endocrine Disruption by Chemical Exposure,Physical Sciences,"Health, Toxicology and Mutagenesis",,False,en,Environmental Science,
https://openalex.org/W1822358343,Notice of Retraction: Research on tax polices for encouraging independent innovation of enterprise,,0,https://doi.org/10.1109/icebeg.2011.5882655,https://api.labs.crossref.org/works/https://doi.org/10.1109/icebeg.2011.5882655?mailto=christian.hauschke@tib.eu,2011,article,True,0,Corporate Tax Avoidance and Strategies,Social Sciences,Accounting,,False,en,"Business, Management and Accounting",
https://openalex.org/W1822567779,Retraction notice,Journal of Vibration and Control,0,https://doi.org/10.1177/1077546312472925,https://api.labs.crossref.org/works/https://doi.org/10.1177/1077546312472925?mailto=christian.hauschke@tib.eu,2013,article,True,0,Underwater Acoustic Sensor Networks and Communication,Physical Sciences,Ocean Engineering,SAGE Publishing,True,en,Engineering,
https://openalex.org/W1822661938,Notice of Retraction: Research on the forecast model of educational equipment economical life time,,0,https://doi.org/10.1109/icbmei.2011.5916955,https://api.labs.crossref.org/works/https://doi.org/10.1109/icbmei.2011.5916955?mailto=christian.hauschke@tib.eu,2011,article,True,0,Comprehensive Assessment of Safety in Energy and Infrastructure,Physical Sciences,"Safety, Risk, Reliability and Quality",,False,en,Engineering,
https://openalex.org/W1822682414,Notice of Retraction: Numerical Analysis of Particle Distribution in Floor Heating Room,,0,https://doi.org/10.1109/icbbe.2011.5781324,https://api.labs.crossref.org/works/https://doi.org/10.1109/icbbe.2011.5781324?mailto=christian.hauschke@tib.eu,2011,article,True,0,Turbulent Interactions with Dispersed Particles and Droplets,Physical Sciences,Ocean Engineering,,False,en,Engineering,
https://openalex.org/W1823179690,Notice of Retraction: Dependences of Soil Physical Properties on Altitudes in Pinus armandii Forest Ecosystem,,0,https://doi.org/10.1109/icbbe.2011.5781563,https://api.labs.crossref.org/works/https://doi.org/10.1109/icbbe.2011.5781563?mailto=christian.hauschke@tib.eu,2011,article,True,0,Web-Based Global Education and Sustainability,Social Sciences,Education,,False,en,Social Sciences,
https://openalex.org/W1823238659,Notice of Retraction: Analysis of High-Frequency Risk Factors among Patients with Coronary Heart Disease in Guangzhou,,0,https://doi.org/10.1109/icbbe.2011.5781613,https://api.labs.crossref.org/works/https://doi.org/10.1109/icbbe.2011.5781613?mailto=christian.hauschke@tib.eu,2011,article,True,0,Promotion and Disease Reduction in Cardiovascular Health,Health Sciences,Cardiology and Cardiovascular Medicine,,False,en,Medicine,
