id,display_name,primary_location_display_name,cited_by_count,doi,crossref_call,publication_year,type,is_retracted,cited_by_percentile_year_min,primary_topic_display_name,primary_topic_domain_display_name,primary_topic_subfield_display_name,primary_location_source_host_organization_name,open_access_is_oa,language,primary_topic_field_display_name,update_nature
https://openalex.org/W4281843932,Description of Quantum Mechanics as a Branch of Mathematical Physics That Deals with the Emission and Absorption of Energy by Matter,arXiv (Cornell University),1,https://doi.org/10.1155/2022/4293800,https://api.labs.crossref.org/works/https://doi.org/10.1155/2022/4293800?mailto=christian.hauschke@tib.eu,2022,article,True,69,Foundations of Quantum Mechanics and Interpretations,Physical Sciences,"Atomic and Molecular Physics, and Optics",Cornell University,True,en,Physics and Astronomy,Retraction
https://openalex.org/W4281853414,The Effect of Exercise Training on the Detection of Heart Rate and Body Temperature Sensors in Adolescents,Journal of Sensors,1,https://doi.org/10.1155/2022/5763019,https://api.labs.crossref.org/works/https://doi.org/10.1155/2022/5763019?mailto=christian.hauschke@tib.eu,2022,article,True,69,Analysis and Applications of Heart Rate Variability,Health Sciences,Cardiology and Cardiovascular Medicine,Hindawi Publishing Corporation,True,en,Medicine,Retraction
https://openalex.org/W4281854818,Application of CAD in Semifinished Product Packaging Art Design,Security and Communication Networks,1,https://doi.org/10.1155/2022/8937896,https://api.labs.crossref.org/works/https://doi.org/10.1155/2022/8937896?mailto=christian.hauschke@tib.eu,2022,article,True,69,Innovations in Visual Communication Design and Technology,Physical Sciences,Computer Graphics and Computer-Aided Design,Hindawi Publishing Corporation,True,en,Computer Science,Retraction
https://openalex.org/W4281866499,The Efficacy of Orthodontics plus Implant Anchorage in Orthodontic Treatment: A Randomized Controlled Study,Evidence-based Complementary and Alternative Medicine,1,https://doi.org/10.1155/2022/4049076,https://api.labs.crossref.org/works/https://doi.org/10.1155/2022/4049076?mailto=christian.hauschke@tib.eu,2022,article,True,69,Orthodontic Research and Treatment,Health Sciences,Orthodontics,Hindawi Publishing Corporation,True,en,Dentistry,Retraction
https://openalex.org/W4281870471,Path Planning of Energy Robot Based on Improved Ant Colony Algorithm,Wireless Communications and Mobile Computing,1,https://doi.org/10.1155/2022/3216045,https://api.labs.crossref.org/works/https://doi.org/10.1155/2022/3216045?mailto=christian.hauschke@tib.eu,2022,article,True,69,Intelligent Manufacturing Technologies,Physical Sciences,Industrial and Manufacturing Engineering,Wiley,True,en,Engineering,Retraction
https://openalex.org/W4281873013,Design of Customer Churn Early Warning System Based on Mobile Communication Technology Based on Data Mining,Journal of Electrical and Computer Engineering,1,https://doi.org/10.1155/2022/9701349,https://api.labs.crossref.org/works/https://doi.org/10.1155/2022/9701349?mailto=christian.hauschke@tib.eu,2022,article,True,69,Customer Equity Management and Prediction,Social Sciences,Marketing,Hindawi Publishing Corporation,True,en,"Business, Management and Accounting",Retraction
https://openalex.org/W4281875884,RETRACTED: Application of blockchain technology based on big data analysis in sustainable agriculture,Agronomy Journal,1,https://doi.org/10.1002/agj2.21105,https://api.labs.crossref.org/works/https://doi.org/10.1002/agj2.21105?mailto=christian.hauschke@tib.eu,2022,article,True,69,Blockchain and Internet of Things Integration,Physical Sciences,Information Systems,John Wiley & Sons Ltd,False,en,Computer Science,
https://openalex.org/W4281885945,Analysis of Real-Time Early Warning Algorithm of Environmental Risk of Air Pollutants Based on Computer Simulation Technology,Mobile Information Systems,1,https://doi.org/10.1155/2022/4747149,https://api.labs.crossref.org/works/https://doi.org/10.1155/2022/4747149?mailto=christian.hauschke@tib.eu,2022,article,True,69,Low-Cost Air Quality Monitoring Systems,Physical Sciences,Environmental Engineering,IOS Press,True,en,Environmental Science,Retraction
https://openalex.org/W4281893217,The Macroreform of the Electronics Manufacturing Industry under the Industry 4.0 Wave Based on Financial Performance Indicators,Mobile Information Systems,1,https://doi.org/10.1155/2022/6436112,https://api.labs.crossref.org/works/https://doi.org/10.1155/2022/6436112?mailto=christian.hauschke@tib.eu,2022,article,True,69,Economic Complexity and Development of Nations,Social Sciences,Economics and Econometrics,IOS Press,True,en,"Economics, Econometrics and Finance",Retraction
https://openalex.org/W4281896218,CRP and ALT Levels in Individuals with Acute Biliary Pancreatitis after Endoscopic Retrograde Cholangiopancreatography and Endoscopic Sphincterotomy,Computational Intelligence and Neuroscience,1,https://doi.org/10.1155/2022/6492551,https://api.labs.crossref.org/works/https://doi.org/10.1155/2022/6492551?mailto=christian.hauschke@tib.eu,2022,article,True,69,Diagnosis and Management of Pancreatitis,Health Sciences,Surgery,Hindawi Publishing Corporation,True,en,Medicine,Retraction
https://openalex.org/W4281913200,Research on the Impact of Credit Support on the Income Increase of Family Farms in China: Based on Hunan Province,Mathematical Problems in Engineering,1,https://doi.org/10.1155/2022/8483031,https://api.labs.crossref.org/works/https://doi.org/10.1155/2022/8483031?mailto=christian.hauschke@tib.eu,2022,article,True,69,Land Tenure and Property Rights in Agriculture,Life Sciences,Soil Science,Hindawi Publishing Corporation,True,en,Agricultural and Biological Sciences,Retraction
https://openalex.org/W4281925273,Application of Network Information Technology in Physical Education and Training System under the Background of Big Data,Computational Intelligence and Neuroscience,1,https://doi.org/10.1155/2022/3081523,https://api.labs.crossref.org/works/https://doi.org/10.1155/2022/3081523?mailto=christian.hauschke@tib.eu,2022,article,True,69,Hackathons in Biomedical Engineering Education,Physical Sciences,Biomedical Engineering,Hindawi Publishing Corporation,True,en,Engineering,Retraction
https://openalex.org/W4281943262,The Development of “Internet +” Smart Environmental Protection Multi-Environment Perception System,Security and Communication Networks,1,https://doi.org/10.1155/2022/3680829,https://api.labs.crossref.org/works/https://doi.org/10.1155/2022/3680829?mailto=christian.hauschke@tib.eu,2022,article,True,69,Impact of Information Technology Infrastructure on Various Sectors,Physical Sciences,Information Systems,Hindawi Publishing Corporation,True,en,Computer Science,Retraction
https://openalex.org/W4281946692,Adaptive Integration Algorithm of Sports Event Network Marketing Data Based on Big Data,Security and Communication Networks,1,https://doi.org/10.1155/2022/7660071,https://api.labs.crossref.org/works/https://doi.org/10.1155/2022/7660071?mailto=christian.hauschke@tib.eu,2022,article,True,69,Impact of Big Data on Society and Industry,Social Sciences,Information Systems and Management,Hindawi Publishing Corporation,True,en,Decision Sciences,Retraction
https://openalex.org/W4281952577,Application of CT Ultrasonography Combined with Microscopic Intraperitoneal Hyperthermic Perfusion Chemotherapy in Postoperative Treatment of Oocyst Carcinoma,Scanning,1,https://doi.org/10.1155/2022/5444552,https://api.labs.crossref.org/works/https://doi.org/10.1155/2022/5444552?mailto=christian.hauschke@tib.eu,2022,article,True,69,Intelligent Manufacturing Technologies,Physical Sciences,Industrial and Manufacturing Engineering,Wiley,True,en,Engineering,Retraction
https://openalex.org/W4281961108,Research on the Oxidative Stress Response of Human Body Caused by Different Nutritional Supplements and the Improvement Effect of Exercise,Computational Intelligence and Neuroscience,1,https://doi.org/10.1155/2022/1355254,https://api.labs.crossref.org/works/https://doi.org/10.1155/2022/1355254?mailto=christian.hauschke@tib.eu,2022,article,True,69,Brown Adipose Tissue Function and Physiology,Health Sciences,Physiology,Hindawi Publishing Corporation,True,en,Medicine,Retraction
https://openalex.org/W4281961544,"Effects of Incontro, Alleanza, Responsabilita, Autonomia Intervention Model Combined with Orem Self-Care Model and the Use of Smart Wearable Devices on Perceived Stress and Self-Efficacy in Patients after Total Hip Arthroplasty",Computational Intelligence and Neuroscience,1,https://doi.org/10.1155/2022/5780084,https://api.labs.crossref.org/works/https://doi.org/10.1155/2022/5780084?mailto=christian.hauschke@tib.eu,2022,article,True,69,Projections and Outcomes of Arthroplasty Surgery in the US,Health Sciences,Surgery,Hindawi Publishing Corporation,True,en,Medicine,Retraction
https://openalex.org/W4281978325,RETRACTED: Federation payment tree: An improved payment channel for scaling and efficient ZK-hash time lock commitment framework in blockchain technology,Concurrent Engineering,1,https://doi.org/10.1177/1063293x221101358,https://api.labs.crossref.org/works/https://doi.org/10.1177/1063293x221101358?mailto=christian.hauschke@tib.eu,2022,article,True,69,Blockchain and Internet of Things Integration,Physical Sciences,Information Systems,SAGE Publishing,False,en,Computer Science,
https://openalex.org/W4281993233,Nifedipine plus Systematic Nursing on Pregnancy Outcomes in Patients with Gestational Hypertension,Evidence-based Complementary and Alternative Medicine,1,https://doi.org/10.1155/2022/4417790,https://api.labs.crossref.org/works/https://doi.org/10.1155/2022/4417790?mailto=christian.hauschke@tib.eu,2022,article,True,69,Pathophysiology and Management of Preeclampsia,Health Sciences,Obstetrics and Gynecology,Hindawi Publishing Corporation,True,en,Medicine,Retraction
https://openalex.org/W4282012906,Identification and Verification of Key Tumor Genes Associated with Diagnosis and Prognosis of Breast Cancer Based on Bioinformatics Analysis,Disease Markers,1,https://doi.org/10.1155/2022/9041466,https://api.labs.crossref.org/works/https://doi.org/10.1155/2022/9041466?mailto=christian.hauschke@tib.eu,2022,article,True,69,Lipid Metabolism in Cancer Pathogenesis,Life Sciences,Cancer Research,Hindawi Publishing Corporation,True,en,"Biochemistry, Genetics and Molecular Biology",Retraction
https://openalex.org/W4282015363,Strategy of Maintainable Renewal of Assembled Residential Buildings Based on PSO-ELM,Mathematical Problems in Engineering,1,https://doi.org/10.1155/2022/5813577,https://api.labs.crossref.org/works/https://doi.org/10.1155/2022/5813577?mailto=christian.hauschke@tib.eu,2022,article,True,69,Automated Pavement Inspection and Maintenance,Physical Sciences,Civil and Structural Engineering,Hindawi Publishing Corporation,True,en,Engineering,Retraction
https://openalex.org/W4282034472,Research on Modeling the Optimization of Power Load Combination for Power Sales Company,Mobile Information Systems,1,https://doi.org/10.1155/2022/9566927,https://api.labs.crossref.org/works/https://doi.org/10.1155/2022/9566927?mailto=christian.hauschke@tib.eu,2022,article,True,69,Demand Response in Smart Grids,Physical Sciences,Electrical and Electronic Engineering,IOS Press,True,en,Engineering,Retraction
https://openalex.org/W4282040058,The Effect of Oxytocin plus Carboprost Methylate in Preventing Postpartum Hemorrhage in High-Risk Pregnancy and Its Effect on Blood Pressure,Evidence-based Complementary and Alternative Medicine,1,https://doi.org/10.1155/2022/9878482,https://api.labs.crossref.org/works/https://doi.org/10.1155/2022/9878482?mailto=christian.hauschke@tib.eu,2022,article,True,69,Maternal Morbidity Associated with Pregnancy and Childbirth,Health Sciences,"Pediatrics, Perinatology and Child Health",Hindawi Publishing Corporation,True,en,Medicine,Retraction
https://openalex.org/W4282040565,Research on Structural Optimization of Prefabricated Components Based on Improved Immune Genetic Algorithm,Computational Intelligence and Neuroscience,1,https://doi.org/10.1155/2022/4648112,https://api.labs.crossref.org/works/https://doi.org/10.1155/2022/4648112?mailto=christian.hauschke@tib.eu,2022,article,True,69,Isogeometric Analysis in Computational Engineering,Physical Sciences,Computational Mechanics,Hindawi Publishing Corporation,True,en,Engineering,Retraction
https://openalex.org/W4282041890,Engineering Management Model Analysis Using Partial Differential Equation Hilbert Space,Security and Communication Networks,1,https://doi.org/10.1155/2022/5853721,https://api.labs.crossref.org/works/https://doi.org/10.1155/2022/5853721?mailto=christian.hauschke@tib.eu,2022,article,True,69,Building Information Modeling in Construction Industry,Physical Sciences,Building and Construction,Hindawi Publishing Corporation,True,en,Engineering,
https://openalex.org/W4282051891,Meta-Analysis of Dynamic Electrocardiography in the Diagnosis of Myocardial Ischemic Attack of Coronary Heart Disease,Computational and Mathematical Methods in Medicine,1,https://doi.org/10.1155/2022/3472413,https://api.labs.crossref.org/works/https://doi.org/10.1155/2022/3472413?mailto=christian.hauschke@tib.eu,2022,article,True,69,Analysis of Electrocardiogram Signals,Health Sciences,Cardiology and Cardiovascular Medicine,Hindawi Publishing Corporation,True,en,Medicine,Retraction
https://openalex.org/W4282051997,"Electrochemical-Based Extraction, Separation, and Purification of Coumarin Compounds from Trifolium chinensis",Journal of Chemistry,1,https://doi.org/10.1155/2022/6466271,https://api.labs.crossref.org/works/https://doi.org/10.1155/2022/6466271?mailto=christian.hauschke@tib.eu,2022,article,True,69,On-line Monitoring of Wastewater Quality,Physical Sciences,Industrial and Manufacturing Engineering,Hindawi Publishing Corporation,True,en,Environmental Science,Retraction
https://openalex.org/W4282548949,The Effect of Fine-Grained Control of Workflow on Informal Learning: The Mediating Effect of Teacher Burnout,Occupational Therapy International,1,https://doi.org/10.1155/2022/3479295,https://api.labs.crossref.org/works/https://doi.org/10.1155/2022/3479295?mailto=christian.hauschke@tib.eu,2022,article,True,69,Knowledge Base Graph Embedding for Visual Question Answering,Physical Sciences,Artificial Intelligence,Hindawi Publishing Corporation,True,en,Computer Science,
https://openalex.org/W4282551048,Analysis of the Effect of Sichs on Gastric Ulcer Rats Based on RNA Sequencing Technique,Computational and Mathematical Methods in Medicine,1,https://doi.org/10.1155/2022/9325836,https://api.labs.crossref.org/works/https://doi.org/10.1155/2022/9325836?mailto=christian.hauschke@tib.eu,2022,article,True,69,Role of Long Noncoding RNAs in Cancer and Development,Life Sciences,Cancer Research,Hindawi Publishing Corporation,True,en,"Biochemistry, Genetics and Molecular Biology",Retraction
https://openalex.org/W4282587025,A new firefly algorithm-based superpixel clustering method for vehicle segmentation,Soft Computing,1,https://doi.org/10.1007/s00500-022-07206-5,https://api.labs.crossref.org/works/https://doi.org/10.1007/s00500-022-07206-5?mailto=christian.hauschke@tib.eu,2022,article,True,69,Visual Object Tracking and Person Re-identification,Physical Sciences,Computer Vision and Pattern Recognition,Springer Science+Business Media,True,en,Computer Science,Retraction;Crossmark Retraction
https://openalex.org/W4282591249,Immune characteristics of children with autoimmune encephalitis and the correlation with a short-term prognosis,Italian Journal of Pediatrics,1,https://doi.org/10.1186/s13052-022-01247-0,https://api.labs.crossref.org/works/https://doi.org/10.1186/s13052-022-01247-0?mailto=christian.hauschke@tib.eu,2022,article,True,69,Autoimmune Encephalitis: Clinical Characteristics and Management,Health Sciences,Neurology,BioMed Central,True,en,Medicine,Retraction
https://openalex.org/W4282600410,Analysis of the Association between Teachers’ Classroom Teaching Behaviors and Students’ Knowledge Acceptance Based on Psychological Data Analysis,Occupational Therapy International,1,https://doi.org/10.1155/2022/2661398,https://api.labs.crossref.org/works/https://doi.org/10.1155/2022/2661398?mailto=christian.hauschke@tib.eu,2022,article,True,69,Educational Data Mining and Learning Analytics,Physical Sciences,Computer Science Applications,Hindawi Publishing Corporation,True,en,Computer Science,
https://openalex.org/W4282822228,Commentary: Computational Analysis for ERAS and Other Surgical Processes: Commentary From Clinical Perspective,Frontiers in Surgery,1,https://doi.org/10.3389/fsurg.2022.946963,https://api.labs.crossref.org/works/https://doi.org/10.3389/fsurg.2022.946963?mailto=christian.hauschke@tib.eu,2022,article,True,69,Enhanced Recovery After Surgery Protocols,Health Sciences,Surgery,Frontiers Media,True,en,Medicine,Retraction
https://openalex.org/W4282824101,Multiobjective Optimization Algorithm for EFRM Strategy,Security and Communication Networks,1,https://doi.org/10.1155/2022/4994383,https://api.labs.crossref.org/works/https://doi.org/10.1155/2022/4994383?mailto=christian.hauschke@tib.eu,2022,article,True,69,Enterprise Risk Management in Finance and Business,Social Sciences,Accounting,Hindawi Publishing Corporation,True,en,"Business, Management and Accounting",Retraction
https://openalex.org/W4282824835,Construction Method of Industrial College in Vocational Colleges Based on Cluster Analysis Algorithm,Computational and Mathematical Methods in Medicine,1,https://doi.org/10.1155/2022/3278395,https://api.labs.crossref.org/works/https://doi.org/10.1155/2022/3278395?mailto=christian.hauschke@tib.eu,2022,article,True,69,Knowledge Base Graph Embedding for Visual Question Answering,Physical Sciences,Artificial Intelligence,Hindawi Publishing Corporation,True,en,Computer Science,Retraction
https://openalex.org/W4282825261,Research on the Optimization Art Design of Internet Smart Home System Based on the New Era,Security and Communication Networks,1,https://doi.org/10.1155/2022/1031682,https://api.labs.crossref.org/works/https://doi.org/10.1155/2022/1031682?mailto=christian.hauschke@tib.eu,2022,article,True,69,Integration of 5G with Broadcasting Systems,Physical Sciences,Media Technology,Hindawi Publishing Corporation,True,en,Engineering,Retraction
https://openalex.org/W4282825384,Construction of Training Program for Specialized Nurses in the Central Sterile Supply Department (CSSD) Based on Post Competency,Computational Intelligence and Neuroscience,1,https://doi.org/10.1155/2022/3282245,https://api.labs.crossref.org/works/https://doi.org/10.1155/2022/3282245?mailto=christian.hauschke@tib.eu,2022,article,True,69,,,,Hindawi Publishing Corporation,True,en,,Retraction
https://openalex.org/W4282827851,Electrochemical Seismic Design and Artificial Intelligence System Modeling of High-Rise Steel Structure Buildings,Journal of Chemistry,1,https://doi.org/10.1155/2022/8693110,https://api.labs.crossref.org/works/https://doi.org/10.1155/2022/8693110?mailto=christian.hauschke@tib.eu,2022,article,True,69,Reinforcement Corrosion in Concrete Structures,Physical Sciences,Civil and Structural Engineering,Hindawi Publishing Corporation,True,en,Engineering,Retraction
https://openalex.org/W4282829622,Electronic Controller Automatic Test System Based on Intelligent Control Algorithm,Journal of Electrical and Computer Engineering,1,https://doi.org/10.1155/2022/6094612,https://api.labs.crossref.org/works/https://doi.org/10.1155/2022/6094612?mailto=christian.hauschke@tib.eu,2022,article,True,69,Adaptive Protection Schemes for Microgrids,Physical Sciences,Control and Systems Engineering,Hindawi Publishing Corporation,True,en,Engineering,Retraction
https://openalex.org/W4282834164,Research on the Strategy of Autonomous Learning under the Dual-Class Model of Ideological and Political Courses Based on the Knowledge Map Route,Wireless Communications and Mobile Computing,1,https://doi.org/10.1155/2022/2854233,https://api.labs.crossref.org/works/https://doi.org/10.1155/2022/2854233?mailto=christian.hauschke@tib.eu,2022,article,True,69,Innovation and Development of Ideological Education,Social Sciences,Education,Wiley,True,en,Social Sciences,Retraction
https://openalex.org/W4282834491,Sports Facilities Investment Based on Multi-objective Optimization and Attribute Decision-Making,Mathematical Problems in Engineering,1,https://doi.org/10.1155/2022/9051076,https://api.labs.crossref.org/works/https://doi.org/10.1155/2022/9051076?mailto=christian.hauschke@tib.eu,2022,article,True,69,Challenges and Innovations in Urban Logistics Systems,Physical Sciences,Building and Construction,Hindawi Publishing Corporation,True,en,Engineering,Retraction
https://openalex.org/W4282835029,Research on the Optimization of Agricultural Industry Structure Based on Genetic Algorithm,Advances in Meteorology,1,https://doi.org/10.1155/2022/3748080,https://api.labs.crossref.org/works/https://doi.org/10.1155/2022/3748080?mailto=christian.hauschke@tib.eu,2022,article,True,69,Deficit Irrigation for Agricultural Water Management,Life Sciences,Soil Science,Hindawi Publishing Corporation,True,en,Agricultural and Biological Sciences,Retraction
https://openalex.org/W4282841254,Design and Implementation of Human Motion Monitoring System on Account of Intelligent Computing of Internet of Things,Journal of Electrical and Computer Engineering,1,https://doi.org/10.1155/2022/3316433,https://api.labs.crossref.org/works/https://doi.org/10.1155/2022/3316433?mailto=christian.hauschke@tib.eu,2022,article,True,69,Efficient Cooperative Image Transmission in Sensor Networks,Physical Sciences,Computer Networks and Communications,Hindawi Publishing Corporation,True,en,Computer Science,Retraction
https://openalex.org/W4282841772,Changes in Physical Function of Shuttlecock Players after Short-Term Intensive Training based on Data Mining,Computational Intelligence and Neuroscience,1,https://doi.org/10.1155/2022/8153521,https://api.labs.crossref.org/works/https://doi.org/10.1155/2022/8153521?mailto=christian.hauschke@tib.eu,2022,article,True,69,Efficient Cooperative Image Transmission in Sensor Networks,Physical Sciences,Computer Networks and Communications,Hindawi Publishing Corporation,True,en,Computer Science,Retraction
https://openalex.org/W4282918715,A Post Hoc Exploratory Analysis: Induced Abortion Complications Mistaken for Miscarriage in the Emergency Room are a Risk Factor for Hospitalization,Health Services Research and Managerial Epidemiology,1,https://doi.org/10.1177/23333928221103107,https://api.labs.crossref.org/works/https://doi.org/10.1177/23333928221103107?mailto=christian.hauschke@tib.eu,2022,article,True,69,Contraception and Unintended Pregnancy Prevention,Health Sciences,"Public Health, Environmental and Occupational Health",SAGE Publishing,True,en,Medicine,Retraction
https://openalex.org/W4282922249,"Acupoint Massage plus Recombinant Bovine Basic Fibroblast Growth Factor Ophthalmic Gel and Limbal Stem Cell Transplantation on Visual Quality, Corneal Refraction, and Aesthetic Outcome in Patients with Pterygium",Evidence-based Complementary and Alternative Medicine,1,https://doi.org/10.1155/2022/7103496,https://api.labs.crossref.org/works/https://doi.org/10.1155/2022/7103496?mailto=christian.hauschke@tib.eu,2022,article,True,69,Corneal Tissue Engineering and Regeneration,Health Sciences,"Radiology, Nuclear Medicine and Imaging",Hindawi Publishing Corporation,True,en,Medicine,Retraction
https://openalex.org/W4282929808,Application of Visual Communication Combined with Electrochemistry in Ceramic Carving Product Design,Journal of Chemistry,1,https://doi.org/10.1155/2022/5768966,https://api.labs.crossref.org/works/https://doi.org/10.1155/2022/5768966?mailto=christian.hauschke@tib.eu,2022,article,True,69,Intelligent Manufacturing Technologies,Physical Sciences,Industrial and Manufacturing Engineering,Hindawi Publishing Corporation,True,en,Engineering,Retraction
https://openalex.org/W4282932355,Effects of Different Doses of Clopidogrel plus Early Rehabilitation Therapy on Motor Function and Inflammatory Factors in Patients with Ischemic Stroke,Evidence-based Complementary and Alternative Medicine,1,https://doi.org/10.1155/2022/9692382,https://api.labs.crossref.org/works/https://doi.org/10.1155/2022/9692382?mailto=christian.hauschke@tib.eu,2022,article,True,69,Epidemiology and Management of Stroke,Health Sciences,Epidemiology,Hindawi Publishing Corporation,True,en,Medicine,Retraction
https://openalex.org/W4282933238,Antileakage Technology of Computer Video Information Encryption Based on Digital Information Method,Security and Communication Networks,1,https://doi.org/10.1155/2022/3576562,https://api.labs.crossref.org/works/https://doi.org/10.1155/2022/3576562?mailto=christian.hauschke@tib.eu,2022,article,True,69,Chaos-based Image Encryption Techniques,Physical Sciences,Computer Vision and Pattern Recognition,Hindawi Publishing Corporation,True,en,Computer Science,Retraction
https://openalex.org/W4282959864,Acupuncture Combined with Traditional Chinese Medicine and Drug Therapy for the Treatment of Cerebral Infarction (Phlegm-Blood Stasis Syndrome) and Carotid Atherosclerotic Plaque: A Preliminary Randomized Controlled Study,Applied Bionics and Biomechanics,1,https://doi.org/10.1155/2022/5143408,https://api.labs.crossref.org/works/https://doi.org/10.1155/2022/5143408?mailto=christian.hauschke@tib.eu,2022,article,True,69,Integration of Traditional Medicine and Modern Science,Health Sciences,Complementary and alternative medicine,Hindawi Publishing Corporation,True,en,Medicine,Retraction
