id,display_name,primary_location_display_name,cited_by_count,doi,crossref_call,publication_year,type,is_retracted,cited_by_percentile_year_min,primary_topic_display_name,primary_topic_domain_display_name,primary_topic_subfield_display_name,primary_location_source_host_organization_name,open_access_is_oa,language,primary_topic_field_display_name,update_nature
https://openalex.org/W1974474718,RETRACTED: Characterization of ultrafine-grained aluminum tubes processed by Tube Cyclic Extrusion–Compression (TCEC),Materials Characterization,11,https://doi.org/10.1016/j.matchar.2014.06.013,https://api.labs.crossref.org/works/https://doi.org/10.1016/j.matchar.2014.06.013?mailto=christian.hauschke@tib.eu,2014,article,True,88,Nanomaterials and Mechanical Properties,Physical Sciences,Materials Chemistry,Elsevier BV,False,en,Materials Science,Retraction;Crossmark Retraction
https://openalex.org/W1975837871,Retracted Article: Catalytic decomposition of ammonium dinitramide (ADN) as high energetic material over CuO-based catalysts,Catalysis Science & Technology,11,https://doi.org/10.1039/c3cy00214d,https://api.labs.crossref.org/works/https://doi.org/10.1039/c3cy00214d?mailto=christian.hauschke@tib.eu,2013,article,True,88,Energetic Materials and Reactive Force Fields,Physical Sciences,Mechanics of Materials,Royal Society of Chemistry,False,en,Engineering,Retraction
https://openalex.org/W1980297267,RETRACTED ARTICLE: From the human visual system to the computational models of visual attention: a survey,Artificial Intelligence Review,11,https://doi.org/10.1007/s10462-012-9385-4,https://api.labs.crossref.org/works/https://doi.org/10.1007/s10462-012-9385-4?mailto=christian.hauschke@tib.eu,2013,article,True,88,Computational Modeling of Visual Saliency Detection,Physical Sciences,Computer Vision and Pattern Recognition,Springer Science+Business Media,True,en,Computer Science,Retraction;Crossmark Retraction
https://openalex.org/W1981920207,Epigenetic traces of childhood maltreatment in peripheral blood: a new strategy to explore gene–environment interactions,The British Journal of Psychiatry,11,https://doi.org/10.1192/bjp.bp.113.127209,https://api.labs.crossref.org/works/https://doi.org/10.1192/bjp.bp.113.127209?mailto=christian.hauschke@tib.eu,2014,article,True,88,Effects of Childhood Trauma and Adversity,Social Sciences,Clinical Psychology,Cambridge University Press,True,en,Psychology,Retraction
https://openalex.org/W1982552374,RETRACTED ARTICLE: Application of gene expression programming to predict the compressive damage of lightweight aluminosilicate geopolymer,Neural Computing and Applications,11,https://doi.org/10.1007/s00521-012-1137-5,https://api.labs.crossref.org/works/https://doi.org/10.1007/s00521-012-1137-5?mailto=christian.hauschke@tib.eu,2012,article,True,88,Geopolymer and Alternative Cementitious Materials,Physical Sciences,Civil and Structural Engineering,Springer Science+Business Media,False,en,Engineering,Retraction;Crossmark Retraction
https://openalex.org/W1983976603,Enhancement of Lipid Productivity in Oleaginous Colletotrichum Fungus through Genetic Transformation Using the Yeast CtDGAT2b Gene under Model-Optimized Growth Condition,PLOS ONE,11,https://doi.org/10.1371/journal.pone.0111253,https://api.labs.crossref.org/works/https://doi.org/10.1371/journal.pone.0111253?mailto=christian.hauschke@tib.eu,2014,article,True,88,Metabolic Engineering and Synthetic Biology,Life Sciences,Molecular Biology,Public Library of Science,True,en,"Biochemistry, Genetics and Molecular Biology",Retraction
https://openalex.org/W1985531244,"Evidence for the Likely Origin of Homochirality in Amino Acids, Sugars, and Nucleosides on Prebiotic Earth",Journal of the American Chemical Society,11,https://doi.org/10.1021/ja3012897,https://api.labs.crossref.org/works/https://doi.org/10.1021/ja3012897?mailto=christian.hauschke@tib.eu,2012,article,True,88,Origin of Life and Prebiotic Chemistry,Physical Sciences,Astronomy and Astrophysics,American Chemical Society,False,en,Physics and Astronomy,Retraction
https://openalex.org/W1986049140,"PknE, a Serine/Threonine Protein Kinase of Mycobacterium tuberculosis Initiates Survival Crosstalk That Also Impacts HIV Coinfection",PLOS ONE,11,https://doi.org/10.1371/journal.pone.0083541,https://api.labs.crossref.org/works/https://doi.org/10.1371/journal.pone.0083541?mailto=christian.hauschke@tib.eu,2014,article,True,88,Tuberculosis,Health Sciences,Infectious Diseases,Public Library of Science,True,en,Medicine,Retraction
https://openalex.org/W1986610319,RETRACTED ARTICLE: Clinical significance of perineural invasion diagnosed by immunohistochemistry with anti-S100 antibody in Stage I-III colorectal cancer,Surgery Today,11,https://doi.org/10.1007/s00595-014-1096-9,https://api.labs.crossref.org/works/https://doi.org/10.1007/s00595-014-1096-9?mailto=christian.hauschke@tib.eu,2014,article,True,88,Colorectal Cancer Research and Treatment,Health Sciences,Oncology,Springer Science+Business Media,False,en,Medicine,Retraction;Crossmark Retraction
https://openalex.org/W1989821050,RETRACTED: Enhanced antitumor efficacy of 5-fluorouracil loaded methoxy poly(ethylene glycol)–poly(lactide) nanoparticles for efficient therapy against breast cancer,Colloids and Surfaces B: Biointerfaces,11,https://doi.org/10.1016/j.colsurfb.2015.02.048,https://api.labs.crossref.org/works/https://doi.org/10.1016/j.colsurfb.2015.02.048?mailto=christian.hauschke@tib.eu,2015,article,True,88,Nanoparticle-Based Drug Delivery Systems,Physical Sciences,Biomaterials,Elsevier BV,True,en,Materials Science,Retraction;Crossmark Retraction
https://openalex.org/W1990214506,RETRACTED: Organoclays prepared from montmorillonites with tetramethylolphosphonium chloride in different pH conditions,Powder Technology,11,https://doi.org/10.1016/j.powtec.2013.07.014,https://api.labs.crossref.org/works/https://doi.org/10.1016/j.powtec.2013.07.014?mailto=christian.hauschke@tib.eu,2013,article,True,88,"Polymer Nanocomposites: Preparation, Properties, and Applications",Physical Sciences,Polymers and Plastics,Elsevier BV,True,en,Materials Science,Retraction;Crossmark Retraction
https://openalex.org/W1990898526,Gene-Expression Changes in Cerium Chloride-Induced Injury of Mouse Hippocampus,PLOS ONE,11,https://doi.org/10.1371/journal.pone.0060092,https://api.labs.crossref.org/works/https://doi.org/10.1371/journal.pone.0060092?mailto=christian.hauschke@tib.eu,2013,article,True,88,Nanomaterials with Enzyme-Like Characteristics,Physical Sciences,Materials Chemistry,Public Library of Science,True,en,Materials Science,Retraction
https://openalex.org/W1992833453,Inhibition Effect of Substituted Thiadiazoles on Corrosion Activity of N80 Steel in HCl Solution,Journal of Metallurgy,11,https://doi.org/10.1155/2013/256403,https://api.labs.crossref.org/works/https://doi.org/10.1155/2013/256403?mailto=christian.hauschke@tib.eu,2013,article,True,88,Corrosion Inhibitors and Protection Mechanisms,Physical Sciences,Materials Chemistry,Hindawi Publishing Corporation,True,en,Materials Science,Retraction
https://openalex.org/W1995407788,The Effects of Fetal Gender on Serum Human Chorionic Gonadotropin and Testosterone in Normotensive and Preeclamptic Pregnancies,Journal of Pregnancy,11,https://doi.org/10.1155/2012/874290,https://api.labs.crossref.org/works/https://doi.org/10.1155/2012/874290?mailto=christian.hauschke@tib.eu,2012,article,True,88,Prenatal Aneuploidy Diagnosis and Screening Techniques,Health Sciences,"Pediatrics, Perinatology and Child Health",Hindawi Publishing Corporation,True,en,Medicine,Retraction
https://openalex.org/W1996524439,<i>Retracted:</i> Evolution and development of the homocercal caudal fin in teleosts,"Development, Growth & Differentiation",11,https://doi.org/10.1111/dgd.12088,https://api.labs.crossref.org/works/https://doi.org/10.1111/dgd.12088?mailto=christian.hauschke@tib.eu,2013,article,True,88,Biogeography and Conservation of Neotropical Freshwater Fishes,Physical Sciences,Nature and Landscape Conservation,Wiley-Blackwell,True,en,Environmental Science,Retraction
https://openalex.org/W1997802366,"RETRACTED ARTICLE: A method of multiplex PCR for detection of field released Beauveria bassiana, a fungal entomopathogen applied for pest management in jute (Corchorusolitorius)",World Journal of Microbiology & Biotechnology,11,https://doi.org/10.1007/s11274-015-1821-6,https://api.labs.crossref.org/works/https://doi.org/10.1007/s11274-015-1821-6?mailto=christian.hauschke@tib.eu,2015,article,True,88,Entomopathogenic Fungi as Biocontrol Agents,Life Sciences,Insect Science,Springer Science+Business Media,False,en,Agricultural and Biological Sciences,Retraction
https://openalex.org/W1999657311,"Darboux coordinates, Yang-Yang functional, and gauge theory",Theoretical and Mathematical Physics,11,https://doi.org/10.1007/s11232-014-0209-3,https://api.labs.crossref.org/works/https://doi.org/10.1007/s11232-014-0209-3?mailto=christian.hauschke@tib.eu,2014,article,True,88,Holographic Derivation of Field Theories and Gravity,Physical Sciences,Nuclear and High Energy Physics,Pleiades Publishing,True,en,Physics and Astronomy,Retraction
https://openalex.org/W2000319252,Concerted All-or-none Subunit Interactions Mediate Slow Deactivation of Human ether-à-go-go-related Gene K+ Channels,Journal of Biological Chemistry,11,https://doi.org/10.1074/jbc.m114.582437,https://api.labs.crossref.org/works/https://doi.org/10.1074/jbc.m114.582437?mailto=christian.hauschke@tib.eu,2014,article,True,88,Molecular Mechanisms of Cardiac Arrhythmias,Health Sciences,Cardiology and Cardiovascular Medicine,Elsevier BV,True,en,Medicine,
https://openalex.org/W2004720093,Biologically active and thermally stable polymeric Schiff base and its metal polychelates: Their synthesis and spectral aspects,Spectrochimica Acta Part A: Molecular and Biomolecular Spectroscopy,11,https://doi.org/10.1016/j.saa.2015.03.116,https://api.labs.crossref.org/works/https://doi.org/10.1016/j.saa.2015.03.116?mailto=christian.hauschke@tib.eu,2015,article,True,88,Synthesis and Characterization of Polymer Resins,Physical Sciences,Polymers and Plastics,Elsevier BV,False,en,Materials Science,
https://openalex.org/W2008616735,Pullout strength of misplaced pedicle screws in the thoracic and lumbar vertebrae - A cadaveric study,Indian Journal of Orthopaedics,11,https://doi.org/10.4103/0019-5413.111502,https://api.labs.crossref.org/works/https://doi.org/10.4103/0019-5413.111502?mailto=christian.hauschke@tib.eu,2013,article,True,88,Spine Surgery Techniques and Technologies,Health Sciences,Surgery,Springer Science+Business Media,True,en,Medicine,
https://openalex.org/W2011687524,"RETRACTED: Human bone marrow, umbilical cord or liver mesenchymal stromal cells fail to improve liver function in a model of CCl4-induced liver damage in NOD/SCID/IL-2Rγ(null) mice",Cytotherapy,11,https://doi.org/10.1016/j.jcyt.2014.07.003,https://api.labs.crossref.org/works/https://doi.org/10.1016/j.jcyt.2014.07.003?mailto=christian.hauschke@tib.eu,2014,article,True,88,Innate Immune Recognition and Signaling Pathways,Life Sciences,Immunology,Elsevier BV,True,en,Immunology and Microbiology,
https://openalex.org/W2011850176,RETRACTED: IL-1β-induced matrix metalloproteinase-13 is activated by a disintegrin and metalloprotease-28-regulated proliferation of human osteoblast-like cells,Experimental Cell Research,11,https://doi.org/10.1016/j.yexcr.2014.02.018,https://api.labs.crossref.org/works/https://doi.org/10.1016/j.yexcr.2014.02.018?mailto=christian.hauschke@tib.eu,2014,article,True,88,Role of Matrix Metalloproteinases in Cancer and Physiology,Life Sciences,Cancer Research,Elsevier BV,False,en,"Biochemistry, Genetics and Molecular Biology",
https://openalex.org/W2011986393,Proteasome inhibitors increase missense mutated dysferlin in patients with muscular dystrophy,Science Translational Medicine,11,https://doi.org/10.1126/scitranslmed.3009612,https://api.labs.crossref.org/works/https://doi.org/10.1126/scitranslmed.3009612?mailto=christian.hauschke@tib.eu,2014,article,True,88,Molecular Mechanisms of Muscle Regeneration and Atrophy,Life Sciences,Molecular Biology,American Association for the Advancement of Science,False,en,"Biochemistry, Genetics and Molecular Biology",
https://openalex.org/W2013554741,Inhibition of δ-opioid receptors induces brain glioma cell apoptosis through the mitochondrial and protein kinase C pathways,Oncology Letters,11,https://doi.org/10.3892/ol.2013.1546,https://api.labs.crossref.org/works/https://doi.org/10.3892/ol.2013.1546?mailto=christian.hauschke@tib.eu,2013,article,True,88,Impact of Chronic Stress on Cancer Progression,Health Sciences,Psychiatry and Mental health,Spandidos Publishing,True,en,Medicine,
https://openalex.org/W2013695202,Transgenic expression of human matrix metalloproteinase-1 attenuates pulmonary arterial hypertension in mice,Clinical Science,11,https://doi.org/10.1042/cs20110295,https://api.labs.crossref.org/works/https://doi.org/10.1042/cs20110295?mailto=christian.hauschke@tib.eu,2011,article,True,88,Diagnosis and Treatment of Pulmonary Hypertension,Health Sciences,Pulmonary and Respiratory Medicine,Portland Press,True,en,Medicine,
https://openalex.org/W2014738504,RETRACTED ARTICLE: Gene expression profiling analysis of the putamen for the investigation of compensatory mechanisms in Parkinson’s disease,BMC Neurology,11,https://doi.org/10.1186/1471-2377-13-181,https://api.labs.crossref.org/works/https://doi.org/10.1186/1471-2377-13-181?mailto=christian.hauschke@tib.eu,2013,article,True,88,Pathophysiology of Parkinson's Disease,Health Sciences,Neurology,BioMed Central,True,en,Medicine,
https://openalex.org/W2017285268,RETRACTED: A small-scale brackish water reverse-osmosis desalination system used in northern Saudi Arabia: A case study,Renewable & Sustainable Energy Reviews,11,https://doi.org/10.1016/j.rser.2012.05.009,https://api.labs.crossref.org/works/https://doi.org/10.1016/j.rser.2012.05.009?mailto=christian.hauschke@tib.eu,2012,article,True,88,Solar-Powered Water Desalination Technologies,Physical Sciences,"Renewable Energy, Sustainability and the Environment",Elsevier BV,False,en,Energy,
https://openalex.org/W2017724001,Detection of Abnormal Hemoglobin Variants by HPLC Method: Common Problems with Suggested Solutions,International Scholarly Research Notices,11,https://doi.org/10.1155/2014/257805,https://api.labs.crossref.org/works/https://doi.org/10.1155/2014/257805?mailto=christian.hauschke@tib.eu,2014,article,True,88,Genetic and Clinical Aspects of Hemoglobin Disorders,Health Sciences,Genetics,Hindawi Publishing Corporation,True,en,Medicine,
https://openalex.org/W2018514946,RETRACTED: Elucidating of rotation speed in friction stir welding of pure copper: Thermal modeling,Computational Materials Science,11,https://doi.org/10.1016/j.commatsci.2013.08.040,https://api.labs.crossref.org/works/https://doi.org/10.1016/j.commatsci.2013.08.040?mailto=christian.hauschke@tib.eu,2014,article,True,88,Advances in Friction Stir Welding and Processing,Physical Sciences,Mechanical Engineering,Elsevier BV,False,en,Engineering,
https://openalex.org/W2020667354,Thiolated chitosan nanoparticles as a delivery system for antisense therapy: evaluation against EGFR in T47D breast cancer cells,International Journal of Nanomedicine,11,https://doi.org/10.2147/ijn.s22731,https://api.labs.crossref.org/works/https://doi.org/10.2147/ijn.s22731?mailto=christian.hauschke@tib.eu,2011,article,True,88,Mechanisms and Applications of RNA Interference,Life Sciences,Molecular Biology,Dove Medical Press,True,en,"Biochemistry, Genetics and Molecular Biology",
https://openalex.org/W2020994298,Lower CSF interleukin-6 predicts future depression in a population-based sample of older women followed for 17 years,"Brain, Behavior, and Immunity",11,https://doi.org/10.1016/j.bbi.2013.03.011,https://api.labs.crossref.org/works/https://doi.org/10.1016/j.bbi.2013.03.011?mailto=christian.hauschke@tib.eu,2013,article,True,88,Neuroimmune Interaction in Psychiatric Disorders,Life Sciences,Biological Psychiatry,Elsevier BV,False,en,Neuroscience,
https://openalex.org/W2021495733,RETRACTED: Polyphosphate induces matrix metalloproteinase-3-mediated proliferation of odontoblast-like cells derived from induced pluripotent stem cells,Experimental Cell Research,11,https://doi.org/10.1016/j.yexcr.2015.01.007,https://api.labs.crossref.org/works/https://doi.org/10.1016/j.yexcr.2015.01.007?mailto=christian.hauschke@tib.eu,2015,article,True,88,Risk Factors for Gingival Overgrowth in Medication Use,Health Sciences,Pharmacy,Elsevier BV,True,en,Health Professions,
https://openalex.org/W2023341706,Comparison of Sequential and Standard Therapy for Helicobacter pylori Eradication in Children and Investigation of Clarithromycin Resistance,Journal of Pediatric Gastroenterology and Nutrition,11,https://doi.org/10.1097/mpg.0b013e3182575f9c,https://api.labs.crossref.org/works/https://doi.org/10.1097/mpg.0b013e3182575f9c?mailto=christian.hauschke@tib.eu,2012,article,True,88,Helicobacter pylori Infection and Gastric Cancer,Health Sciences,Surgery,Lippincott Williams & Wilkins,True,en,Medicine,
https://openalex.org/W2026785096,"Synthesis, Characterization, and Biological–Pharmacological Evaluation of New Phosphazenes Bearing Dioxybiphenyl and Schiff Base Groups",Archiv der Pharmazie,11,https://doi.org/10.1002/ardp.201100412,https://api.labs.crossref.org/works/https://doi.org/10.1002/ardp.201100412?mailto=christian.hauschke@tib.eu,2012,article,True,88,Flame Retardant Polymer Materials,Physical Sciences,Polymers and Plastics,Wiley-Blackwell,False,en,Materials Science,
https://openalex.org/W2028705235,Human Phosphatidylethanolamine-Binding Protein 4 Promoted the Radioresistance of Human Rectal Cancer by Activating Akt in an ROS-Dependent Way,PLOS ONE,11,https://doi.org/10.1371/journal.pone.0090062,https://api.labs.crossref.org/works/https://doi.org/10.1371/journal.pone.0090062?mailto=christian.hauschke@tib.eu,2014,article,True,88,Role of Pim Oncogenes in Tumorigenesis,Health Sciences,Pathology and Forensic Medicine,Public Library of Science,True,en,Medicine,
https://openalex.org/W2029717521,"Clinical significance of p95HER2 overexpression, PTEN loss and PI3K expression in p185HER2-positive metastatic breast cancer patients treated with trastuzumab-based therapies",British Journal of Cancer,11,https://doi.org/10.1038/bjc.2014.72,https://api.labs.crossref.org/works/https://doi.org/10.1038/bjc.2014.72?mailto=christian.hauschke@tib.eu,2014,article,True,88,HER2 Signaling in Breast Cancer Treatment,Health Sciences,Oncology,Springer Nature,True,en,Medicine,
https://openalex.org/W203019749,Using Constitutive Activity to Define Appropriate High-Throughput Screening Assays for Orphan G Protein-Coupled Receptors,Methods in molecular biology,11,https://doi.org/10.1007/978-1-4939-2336-6_7,https://api.labs.crossref.org/works/https://doi.org/10.1007/978-1-4939-2336-6_7?mailto=christian.hauschke@tib.eu,2015,book-chapter,True,88,Structure and Function of G Protein-Coupled Receptors,Life Sciences,Molecular Biology,Springer Science+Business Media,False,en,"Biochemistry, Genetics and Molecular Biology",
https://openalex.org/W2030889355,Magnesium lithospermate B alleviates the production of endothelin-1 through an NO-dependent mechanism and reduces experimental vasospasm in rats,Acta Neurochirurgica,11,https://doi.org/10.1007/s00701-011-1082-6,https://api.labs.crossref.org/works/https://doi.org/10.1007/s00701-011-1082-6?mailto=christian.hauschke@tib.eu,2011,article,True,88,Role of Nitric Oxide in Health and Disease,Health Sciences,Physiology,Springer Science+Business Media,False,en,Medicine,
https://openalex.org/W2033378609,Prenatal Cocaine Exposure Uncouples mGluR1 from Homer1 and Gq Proteins,PLOS ONE,11,https://doi.org/10.1371/journal.pone.0091671,https://api.labs.crossref.org/works/https://doi.org/10.1371/journal.pone.0091671?mailto=christian.hauschke@tib.eu,2014,article,True,88,Molecular Mechanisms of Synaptic Plasticity and Neurological Disorders,Life Sciences,Cellular and Molecular Neuroscience,Public Library of Science,True,en,Neuroscience,
https://openalex.org/W2034073858,Retracted: Translation and validation of the Hindi version of the Geriatric Oral Health Assessment Index,Gerodontology,11,https://doi.org/10.1111/j.1741-2358.2011.00609.x,https://api.labs.crossref.org/works/https://doi.org/10.1111/j.1741-2358.2011.00609.x?mailto=christian.hauschke@tib.eu,2012,article,True,88,Global Oral Health and Dental Caries,Health Sciences,Periodontics,Wiley-Blackwell,False,en,Dentistry,
https://openalex.org/W2034145954,RETRACTED: Flap side edge noise modeling and prediction,Journal of Sound and Vibration,11,https://doi.org/10.1016/j.jsv.2013.02.029,https://api.labs.crossref.org/works/https://doi.org/10.1016/j.jsv.2013.02.029?mailto=christian.hauschke@tib.eu,2013,article,True,88,Aeroacoustic Analysis of Jet Noise,Physical Sciences,Aerospace Engineering,Elsevier BV,True,en,Engineering,
https://openalex.org/W2035125198,Alteration of p53-binding protein 1 expression as a risk factor for local recurrence in patients undergoing resection for extrahepatic cholangiocarcinoma,International Journal of Oncology,11,https://doi.org/10.3892/ijo.2011.959,https://api.labs.crossref.org/works/https://doi.org/10.3892/ijo.2011.959?mailto=christian.hauschke@tib.eu,2011,article,True,88,Cholangiocarcinoma,Health Sciences,Surgery,Spandidos Publishing,True,en,Medicine,
https://openalex.org/W2038676761,RETRACTED: Pierisformoside B exhibits neuroprotective and anti-inflammatory effects in murine hippocampal and microglial cells via the HO-1/Nrf2-mediated pathway,International Immunopharmacology,11,https://doi.org/10.1016/j.intimp.2014.12.014,https://api.labs.crossref.org/works/https://doi.org/10.1016/j.intimp.2014.12.014?mailto=christian.hauschke@tib.eu,2015,article,True,88,Role of Microglia in Neurological Disorders,Life Sciences,Neurology,Elsevier BV,True,en,Neuroscience,
https://openalex.org/W2040422194,RETRACTED: Safety evaluation of nonthermal atmospheric pressure plasma liquid treatment: Single DNA molecule-based method,Journal of Electrostatics,11,https://doi.org/10.1016/j.elstat.2014.02.004,https://api.labs.crossref.org/works/https://doi.org/10.1016/j.elstat.2014.02.004?mailto=christian.hauschke@tib.eu,2014,article,True,88,Applications of Plasma in Medicine and Biology,Health Sciences,"Radiology, Nuclear Medicine and Imaging",Elsevier BV,True,en,Medicine,
https://openalex.org/W2041028465,FAM172A induces S phase arrest of HepG2 cells via Notch 3,Oncology Reports,11,https://doi.org/10.3892/or.2013.2235,https://api.labs.crossref.org/works/https://doi.org/10.3892/or.2013.2235?mailto=christian.hauschke@tib.eu,2013,article,True,88,Wnt Signaling in Development and Disease,Life Sciences,Molecular Biology,Elsevier BV,True,en,"Biochemistry, Genetics and Molecular Biology",
https://openalex.org/W2041063491,Probiotics and prebiotics in periodontal therapy,Indian Journal of Dental Research,11,https://doi.org/10.4103/0970-9290.84312,https://api.labs.crossref.org/works/https://doi.org/10.4103/0970-9290.84312?mailto=christian.hauschke@tib.eu,2011,article,True,88,Periodontal Diseases and Oral Microbiome,Health Sciences,Periodontics,Medknow,True,en,Dentistry,
https://openalex.org/W2041729353,Andrographolide Enhances Proliferation and Prevents Dedifferentiation of Rabbit Articular Chondrocytes: An<i>In Vitro</i>Study,Evidence-based Complementary and Alternative Medicine,11,https://doi.org/10.1155/2015/984850,https://api.labs.crossref.org/works/https://doi.org/10.1155/2015/984850?mailto=christian.hauschke@tib.eu,2015,article,True,88,Medicinal Properties of Andrographis Paniculata,Health Sciences,Complementary and alternative medicine,Hindawi Publishing Corporation,True,en,Medicine,
https://openalex.org/W2042890992,RETRACTD ARTICLE: Can <i>Porphyromonas gingivalis</i> be a novel aetiology for recurrent miscarriage?,The European Journal of Contraception & Reproductive Health Care,11,https://doi.org/10.3109/13625187.2014.962651,https://api.labs.crossref.org/works/https://doi.org/10.3109/13625187.2014.962651?mailto=christian.hauschke@tib.eu,2014,article,True,88,Epidemiology and Causes of Preterm Birth,Health Sciences,Epidemiology,Taylor & Francis,False,en,Medicine,
https://openalex.org/W2045968886,"Update on the Genetics of Androgenetic Alopecia, Female Pattern Hair Loss, and Alopecia Areata: Implications for Molecular Diagnostic Testing",Seminars in Cutaneous Medicine and Surgery,11,https://doi.org/10.1016/j.sder.2012.08.003,https://api.labs.crossref.org/works/https://doi.org/10.1016/j.sder.2012.08.003?mailto=christian.hauschke@tib.eu,2012,article,True,88,Regulation and Function of Hair Follicle Stem Cells,Health Sciences,Urology,,False,en,Medicine,
https://openalex.org/W2046581308,RETRACTED: Silica supported microporous melamine tri sulfonic acid catalyst towards biodiesel fuel production from waste cooking oil and utilization of side stream,Applied Catalysis A: General,11,https://doi.org/10.1016/j.apcata.2015.01.015,https://api.labs.crossref.org/works/https://doi.org/10.1016/j.apcata.2015.01.015?mailto=christian.hauschke@tib.eu,2015,article,True,88,Technical Aspects of Biodiesel Production,Physical Sciences,Biomedical Engineering,Elsevier BV,True,en,Engineering,
https://openalex.org/W2046943175,RETRACTED: Modeling impact resistance of aluminum–epoxy-laminated composites by artificial neural networks,Journal of Composite Materials,11,https://doi.org/10.1177/0021998311421222,https://api.labs.crossref.org/works/https://doi.org/10.1177/0021998311421222?mailto=christian.hauschke@tib.eu,2011,article,True,88,Fiber Reinforced Concrete in Civil Engineering,Physical Sciences,Civil and Structural Engineering,SAGE Publishing,False,en,Engineering,
