id,display_name,primary_location_display_name,cited_by_count,doi,crossref_call,publication_year,type,is_retracted,cited_by_percentile_year_min,primary_topic_display_name,primary_topic_domain_display_name,primary_topic_subfield_display_name,primary_location_source_host_organization_name,open_access_is_oa,language,primary_topic_field_display_name,update_nature
https://openalex.org/W3115248073,WITHDRAWN: Effect of polypropylene fibre on swelling behaviour of black cotton soil,Materials Today: Proceedings,2,https://doi.org/10.1016/j.matpr.2020.09.356,https://api.labs.crossref.org/works/https://doi.org/10.1016/j.matpr.2020.09.356?mailto=christian.hauschke@tib.eu,2020,article,True,75,Mechanical Behavior of Soil Reinforcement Techniques,Physical Sciences,Civil and Structural Engineering,Elsevier BV,False,en,Engineering,
https://openalex.org/W3115652416,WITHDRAWN: Electrochemical detection of heavy metals using carbon quantum dots modified with metal oxides,Materials Today: Proceedings,2,https://doi.org/10.1016/j.matpr.2020.10.693,https://api.labs.crossref.org/works/https://doi.org/10.1016/j.matpr.2020.10.693?mailto=christian.hauschke@tib.eu,2020,article,True,75,Synthesis and Applications of Carbon Quantum Dots,Physical Sciences,Materials Chemistry,Elsevier BV,False,en,Materials Science,
https://openalex.org/W3117070397,WITHDRAWN: A review on video watermarking techniques for compressed domain with optimization algorithms,Materials Today: Proceedings,2,https://doi.org/10.1016/j.matpr.2020.11.319,https://api.labs.crossref.org/works/https://doi.org/10.1016/j.matpr.2020.11.319?mailto=christian.hauschke@tib.eu,2020,article,True,75,Digital Image Watermarking Techniques,Physical Sciences,Computer Vision and Pattern Recognition,Elsevier BV,False,en,Computer Science,
https://openalex.org/W3117203614,WITHDRAWN: The routing based protocol technique for enhancing the performance metrics using MQTT in the Internet of Things,Materials Today: Proceedings,2,https://doi.org/10.1016/j.matpr.2020.11.070,https://api.labs.crossref.org/works/https://doi.org/10.1016/j.matpr.2020.11.070?mailto=christian.hauschke@tib.eu,2020,article,True,75,Internet of Things and Edge Computing,Physical Sciences,Computer Networks and Communications,Elsevier BV,False,en,Computer Science,
https://openalex.org/W3117606745,WITHDRAWN: Mechanical and corrosion behavior of Groundnut Shell ash particle (GSAp) reinforced AZ31 magnesium composite,Materials Today: Proceedings,2,https://doi.org/10.1016/j.matpr.2020.11.834,https://api.labs.crossref.org/works/https://doi.org/10.1016/j.matpr.2020.11.834?mailto=christian.hauschke@tib.eu,2020,article,True,75,Metal Matrix Composites: Science and Applications,Physical Sciences,Mechanical Engineering,Elsevier BV,False,en,Engineering,
https://openalex.org/W3124094355,siRNA-mediated inhibition of endogenous brain-derived neurotrophic factor gene modulates the biological behavior of HeLa cells,Oncology Reports,2,https://doi.org/10.3892/or.2017.5569,https://api.labs.crossref.org/works/https://doi.org/10.3892/or.2017.5569?mailto=christian.hauschke@tib.eu,2017,article,True,76,Mechanisms and Applications of RNA Interference,Life Sciences,Molecular Biology,Elsevier BV,True,en,"Biochemistry, Genetics and Molecular Biology",
https://openalex.org/W3124525684,Notice of Retraction: Preservice Teachers' Perception about Nature of Science,,2,https://doi.org/10.1109/icnc.2009.16,https://api.labs.crossref.org/works/https://doi.org/10.1109/icnc.2009.16?mailto=christian.hauschke@tib.eu,2009,article,True,75,Enhancing Science Education through Inquiry and Argumentation,Social Sciences,Education,,False,en,Social Sciences,
https://openalex.org/W3125132151,RETRACTED ARTICLE: Radiation Sialadenitis Induced by High-dose Radioactive Iodine Therapy,Nuclear Medicine and Molecular Imaging,2,https://doi.org/10.1007/s13139-010-0027-y,https://api.labs.crossref.org/works/https://doi.org/10.1007/s13139-010-0027-y?mailto=christian.hauschke@tib.eu,2010,article,True,76,Salivary Gland Tumors and Carcinomas,Health Sciences,Surgery,Springer Science+Business Media,True,en,Medicine,
https://openalex.org/W3129068483,"Retraction: ‘Influencing Factors on Wet Grip and Rolling Resistance Properties of Styrene-Butadiene Rubber Composites’ by Choi, S.-S., Kwon, H.-M., Kim, Y., Ko, E. and Lee, K.-S.",Bulletin of the Korean Chemical Society,2,https://doi.org/10.1002/bkcs.11086,https://api.labs.crossref.org/works/https://doi.org/10.1002/bkcs.11086?mailto=christian.hauschke@tib.eu,2017,article,True,76,Recycling Technologies for Carbon Fiber Composites,Physical Sciences,Mechanical Engineering,Wiley-Blackwell,False,en,Engineering,
https://openalex.org/W4205809048,Retracted Article: Chemical etching of a cobalt-based metal-organic framework for enhancing the electrocatalytic oxygen evolution reaction,"Journal of materials chemistry. A, Materials for energy and sustainability",2,https://doi.org/10.1039/c7ta02103h,https://api.labs.crossref.org/works/https://doi.org/10.1039/c7ta02103h?mailto=christian.hauschke@tib.eu,2017,article,True,76,Conducting Polymer Research,Physical Sciences,Polymers and Plastics,Royal Society of Chemistry,False,en,Materials Science,
https://openalex.org/W4229519787,"Abstracts From the 16th International Congress on Twin Studies and the 4th World Congress on Twin Pregnancy, Madrid, Spain November 16–18, 2017",Twin Research and Human Genetics,2,https://doi.org/10.1017/thg.2017.63,https://api.labs.crossref.org/works/https://doi.org/10.1017/thg.2017.63?mailto=christian.hauschke@tib.eu,2017,article,True,76,Impact of Assisted Reproductive Technology on Perinatal Outcomes,Health Sciences,"Pediatrics, Perinatology and Child Health",Cambridge University Press,True,en,Medicine,
https://openalex.org/W4233003226,The Effects of Age and Shiftwork on Perceived Sleep Problems: Results From the VISAT-Combined Longitudinal and Cross-Sectional Study: Retracted,Journal of Occupational and Environmental Medicine,2,https://doi.org/10.1097/jom.0b013e3181d8d9e4,https://api.labs.crossref.org/works/https://doi.org/10.1097/jom.0b013e3181d8d9e4?mailto=christian.hauschke@tib.eu,2010,article,True,76,Effects of Sleep Deprivation and Fatigue on Performance,Social Sciences,Experimental and Cognitive Psychology,Lippincott Williams & Wilkins,False,en,Psychology,
https://openalex.org/W4235496114,Interventions for fatigue and weight loss in adults with advanced progressive illness,Cochrane Database of Systematic Reviews,2,https://doi.org/10.1002/14651858.cd008427,https://api.labs.crossref.org/works/https://doi.org/10.1002/14651858.cd008427?mailto=christian.hauschke@tib.eu,2010,reference-entry,True,76,"Sarcopenia: Definition, Diagnosis, and Implications",Health Sciences,Physiology,Cochrane,True,en,Medicine,
https://openalex.org/W4237447743,"Proposal of Lysinibacillus sinduriensis sp. nov., and transfer of Bacillus massiliensis and Bacillus odysseyi to Lysinibacillus as Lysinibacillus massiliensis comb. nov. and Lysinibacillus odysseyi comb. nov. with emended descriptions of the genus",International Journal of Systematic and Evolutionary Microbiology,2,https://doi.org/10.1099/ijs.0.015370-0,https://api.labs.crossref.org/works/https://doi.org/10.1099/ijs.0.015370-0?mailto=christian.hauschke@tib.eu,2010,article,True,76,DNA Barcoding for Food Authentication and Fraud Detection,Life Sciences,Molecular Biology,Microbiology Society,False,en,"Biochemistry, Genetics and Molecular Biology",
https://openalex.org/W4238776557,PrP-specific camel antibodies with the ability to immunodetect intracellular prion protein,Journal of General Virology,2,https://doi.org/10.1099/vir.0.018754-0,https://api.labs.crossref.org/works/https://doi.org/10.1099/vir.0.018754-0?mailto=christian.hauschke@tib.eu,2010,article,True,76,Prion Diseases: Causes and Molecular Basis,Life Sciences,Molecular Biology,Microbiology Society,True,en,"Biochemistry, Genetics and Molecular Biology",
https://openalex.org/W4238809523,RETRACTED ARTICLE: AC-field Frequency Response of Cu0.5Tl0.5Ba2(Ca2−q Mg q )Cu3O10−δ Bulk Superconductor,Journal of Superconductivity and Novel Magnetism,2,https://doi.org/10.1007/s10948-010-0827-4,https://api.labs.crossref.org/works/https://doi.org/10.1007/s10948-010-0827-4?mailto=christian.hauschke@tib.eu,2010,article,True,76,Giant Dielectric Constant Materials and Phenomena,Physical Sciences,Materials Chemistry,Springer Science+Business Media,False,en,Materials Science,
https://openalex.org/W4241631055,A pilot study on perceived stress and PTSD symptomatology in relation to four dimensions of older women's physical health,Aging & Mental Health,2,https://doi.org/10.1080/13607860903046578,https://api.labs.crossref.org/works/https://doi.org/10.1080/13607860903046578?mailto=christian.hauschke@tib.eu,2010,article,True,76,Salutogenesis and Sense of Coherence in Health,Health Sciences,General Health Professions,Routledge,False,en,Health Professions,
https://openalex.org/W4241857013,RETRACTED ARTICLE: Real-time slope water table forecasting by multi-tank model combined with dual ensemble Kalman filter,Landslides,2,https://doi.org/10.1007/s10346-010-0223-y,https://api.labs.crossref.org/works/https://doi.org/10.1007/s10346-010-0223-y?mailto=christian.hauschke@tib.eu,2010,article,True,76,Hydrological Modeling and Water Resource Management,Physical Sciences,Water Science and Technology,Springer Science+Business Media,False,en,Environmental Science,
https://openalex.org/W4244010743,Robotic assisted surgery for gynaecological cancer,Cochrane Database of Systematic Reviews,2,https://doi.org/10.1002/14651858.cd008640,https://api.labs.crossref.org/works/https://doi.org/10.1002/14651858.cd008640?mailto=christian.hauschke@tib.eu,2010,reference-entry,True,76,Gynecologic Oncology,Health Sciences,Obstetrics and Gynecology,Cochrane,False,en,Medicine,
https://openalex.org/W4244447200,Effect of Deconditioning on Cortical and Cancellous Bone Growth in the Exercise Trained Young Rats,Journal of Bone and Mineral Research,2,https://doi.org/10.1002/jbmr.3306,https://api.labs.crossref.org/works/https://doi.org/10.1002/jbmr.3306?mailto=christian.hauschke@tib.eu,2017,article,True,76,Osteoporosis,Health Sciences,Orthopedics and Sports Medicine,Oxford University Press,True,en,Medicine,
https://openalex.org/W4245621569,Development of a bespoke human factors taxonomy for gliding accident analysis and its revelations about highly inexperienced UK glider pilots,Ergonomics,2,https://doi.org/10.1080/00140130902836259,https://api.labs.crossref.org/works/https://doi.org/10.1080/00140130902836259?mailto=christian.hauschke@tib.eu,2009,article,True,75,Human Interaction with Automation Systems,Social Sciences,Social Psychology,Taylor & Francis,False,en,Psychology,
https://openalex.org/W4247100225,Botulinum toxin for subacute/chronic neck pain,Cochrane Database of Systematic Reviews,2,https://doi.org/10.1002/14651858.cd008626,https://api.labs.crossref.org/works/https://doi.org/10.1002/14651858.cd008626?mailto=christian.hauschke@tib.eu,2010,reference-entry,True,76,Global Burden of Chronic Pain,Health Sciences,Pharmacology,Cochrane,False,en,Medicine,
https://openalex.org/W4247697145,"Isolation and characterization of 26 polymorphic microsatellite loci in golden mahseer, Tor putitora (Teleostei, Cyprinidae) and their cross-species amplification in four related species",Conservation Genetics Resources,2,https://doi.org/10.1007/s12686-010-9309-z,https://api.labs.crossref.org/works/https://doi.org/10.1007/s12686-010-9309-z?mailto=christian.hauschke@tib.eu,2010,article,True,76,Population Genetic Structure and Dynamics,Life Sciences,Genetics,Springer Science+Business Media,False,en,"Biochemistry, Genetics and Molecular Biology",
https://openalex.org/W4249649513,Fourier series approximation for periodic solution of system of integral equations using Szego–Bernstein weights,International Journal of Computer Mathematics,2,https://doi.org/10.1080/00207160802380934,https://api.labs.crossref.org/works/https://doi.org/10.1080/00207160802380934?mailto=christian.hauschke@tib.eu,2010,article,True,76,Anomalous Diffusion Modeling and Analysis,Physical Sciences,Modeling and Simulation,Taylor & Francis,False,en,Mathematics,
https://openalex.org/W4251717380,WITHDRAWN: TcJAMYC: A bHLH transcription factor that activates paclitaxel biosynthetic pathway genes in yew,Journal of Biological Chemistry,2,https://doi.org/10.1074/jbc.m109.026195,https://api.labs.crossref.org/works/https://doi.org/10.1074/jbc.m109.026195?mailto=christian.hauschke@tib.eu,2009,article,True,75,"14-3-3 Proteins: Structure, Function, and Regulation",Life Sciences,Molecular Biology,Elsevier BV,False,en,"Biochemistry, Genetics and Molecular Biology",
https://openalex.org/W4252862619,Erratum,Aircraft engineering,2,https://doi.org/10.1108/00022660910926908,https://api.labs.crossref.org/works/https://doi.org/10.1108/00022660910926908?mailto=christian.hauschke@tib.eu,2009,erratum,True,75,Biological and Biomimetic Flight Dynamics,Physical Sciences,Aerospace Engineering,Emerald Publishing Limited,False,en,Engineering,
https://openalex.org/W4253793028,Dominant-negative effects of a novel mutation in the filamin myopathy,Neurology,2,https://doi.org/10.1212/wnl.0b013e3182031bb3,https://api.labs.crossref.org/works/https://doi.org/10.1212/wnl.0b013e3182031bb3?mailto=christian.hauschke@tib.eu,2010,article,True,76,Functions and Regulation of RNA Editing by ADARs,Life Sciences,Molecular Biology,Lippincott Williams & Wilkins,False,en,"Biochemistry, Genetics and Molecular Biology",
https://openalex.org/W4254152544,Orthotic devices after stroke and other non-progressive brain lesions,Cochrane Database of Systematic Reviews,2,https://doi.org/10.1002/14651858.cd003694.pub2,https://api.labs.crossref.org/works/https://doi.org/10.1002/14651858.cd003694.pub2?mailto=christian.hauschke@tib.eu,2009,reference-entry,True,75,Principles and Interventions in Stroke Rehabilitation,Health Sciences,Rehabilitation,Cochrane,False,en,Medicine,
https://openalex.org/W4298026000,Abstracts of the 2010 International MASCC/ISOO Symposium,Supportive Care in Cancer,2,https://doi.org/10.1007/s00520-010-0891-0,https://api.labs.crossref.org/works/https://doi.org/10.1007/s00520-010-0891-0?mailto=christian.hauschke@tib.eu,2010,article,True,76,Genomic Landscape of Cancer and Mutational Signatures,Life Sciences,Cancer Research,Springer Science+Business Media,False,en,"Biochemistry, Genetics and Molecular Biology",
https://openalex.org/W68496087,[Laparoscopic radical and partial nephrectomy: an overview].,Urologe A,2,,https://api.labs.crossref.org/works/null?mailto=christian.hauschke@tib.eu,2009,article,True,75,Renal Cell Carcinoma,Health Sciences,Pulmonary and Respiratory Medicine,Springer Science+Business Media,False,en,Medicine,
https://openalex.org/W1479496540,Retraction,Journal of Experimental Medicine,6,https://doi.org/10.1084/jem.186.1.171,https://api.labs.crossref.org/works/https://doi.org/10.1084/jem.186.1.171?mailto=christian.hauschke@tib.eu,1997,article,True,77,,,,Rockefeller University Press,True,,,
https://openalex.org/W1537700532,Loss of heterozygosity studies and deletion mapping identify two putative chromosome 14q tumor suppressor loci in renal oncocytomas.,PubMed,6,,https://api.labs.crossref.org/works/null?mailto=christian.hauschke@tib.eu,1997,article,True,77,Renal Cell Carcinoma,Health Sciences,Pulmonary and Respiratory Medicine,National Institutes of Health,False,en,Medicine,
https://openalex.org/W1976018023,Gynaecological conditions and sexual dysfunction,Sexual and marital therapy,6,https://doi.org/10.1080/02674659108406533,https://api.labs.crossref.org/works/https://doi.org/10.1080/02674659108406533?mailto=christian.hauschke@tib.eu,1991,article,True,77,Molecular Biology of Steroidogenesis and Disorders,Life Sciences,Molecular Biology,Taylor & Francis,False,en,"Biochemistry, Genetics and Molecular Biology",
https://openalex.org/W1981152458,RETRACTED: Post-tetanic burst: a new monitoring method for intense neuromuscular block,British Journal of Anaesthesia,6,https://doi.org/10.1093/bja/74.3.293,https://api.labs.crossref.org/works/https://doi.org/10.1093/bja/74.3.293?mailto=christian.hauschke@tib.eu,1995,article,True,76,Anesthesia and Sedation Management,Health Sciences,Anesthesiology and Pain Medicine,Elsevier BV,True,en,Medicine,
https://openalex.org/W2001262222,RETRACTED: Transfer characteristics and uptake of nickel by red clover grown on nickel amended alluvial soils of an arid zone,"Agriculture, Ecosystems & Environment",6,https://doi.org/10.1016/s0167-8809(97)00053-4,https://api.labs.crossref.org/works/https://doi.org/10.1016/s0167-8809(97)00053-4?mailto=christian.hauschke@tib.eu,1997,article,True,77,Biofortification of Staple Crops for Human Nutrition,Life Sciences,Plant Science,Elsevier BV,True,en,Agricultural and Biological Sciences,
https://openalex.org/W2026446081,Circulatory effects of the PDE‐inhibitors piroximone and enoximone,British Journal of Clinical Pharmacology,6,https://doi.org/10.1111/j.1365-2125.1993.tb00369.x,https://api.labs.crossref.org/works/https://doi.org/10.1111/j.1365-2125.1993.tb00369.x?mailto=christian.hauschke@tib.eu,1993,article,True,76,Management of Hypertension and Cardiovascular Risk Factors,Health Sciences,Cardiology and Cardiovascular Medicine,Wiley-Blackwell,True,en,Medicine,
https://openalex.org/W2026915809,Regeneration of transformed shoots from electroporated soybean (Glycine max (L.) Merr.) protoplasts,Plant Cell Reports,6,https://doi.org/10.1007/bf00236466,https://api.labs.crossref.org/works/https://doi.org/10.1007/bf00236466?mailto=christian.hauschke@tib.eu,1991,article,True,77,Elicitor Signal Transduction for Metabolite Production,Life Sciences,Molecular Biology,Springer Science+Business Media,False,en,"Biochemistry, Genetics and Molecular Biology",
https://openalex.org/W2039889929,RETRACTED ARTICLE: Does continuous heparinization influence platelet function in the intensive care patient?,Intensive Care Medicine,6,https://doi.org/10.1007/s001340050374,https://api.labs.crossref.org/works/https://doi.org/10.1007/s001340050374?mailto=christian.hauschke@tib.eu,1997,article,True,77,Impact of Trauma Care Systems on Mortality,Health Sciences,Emergency Medicine,Springer Science+Business Media,False,en,Medicine,
https://openalex.org/W22525590,"Human fatty acid ethyl ester synthase-III gene: genomic organization, nucleotide sequencing and chromosomal localization.",Molecular and Cellular Biochemistry,6,https://doi.org/10.1023/a:1006892030277,https://api.labs.crossref.org/works/https://doi.org/10.1023/a:1006892030277?mailto=christian.hauschke@tib.eu,1997,article,True,77,Peroxisome Proliferator-Activated Receptors,Life Sciences,Molecular Biology,Springer Science+Business Media,False,en,"Biochemistry, Genetics and Molecular Biology",
https://openalex.org/W2258625936,Spinal cord injury increases the risk of abdominal aortic aneurysm.,PubMed,6,,https://api.labs.crossref.org/works/null?mailto=christian.hauschke@tib.eu,1996,article,True,77,Diagnosis and Management of Aortic Diseases,Health Sciences,Pulmonary and Respiratory Medicine,National Institutes of Health,False,en,Medicine,
https://openalex.org/W2320097823,Minimal Effect of Advanced Aging on Susceptibility of Mice to Infection with Mycobacterium tuberculosis,The Journal of Infectious Diseases,6,https://doi.org/10.1093/infdis/168.4.1059,https://api.labs.crossref.org/works/https://doi.org/10.1093/infdis/168.4.1059?mailto=christian.hauschke@tib.eu,1993,article,True,76,Tuberculosis,Health Sciences,Infectious Diseases,Oxford University Press,False,en,Medicine,
https://openalex.org/W2403913253,Ethylene glycol ethers as hemopoietic toxins--in vitro studies of acute exposure.,PubMed,6,,https://api.labs.crossref.org/works/null?mailto=christian.hauschke@tib.eu,1992,article,True,76,Immunotoxicology in Toxicologic Pathology Research,Life Sciences,Immunology,National Institutes of Health,False,en,Immunology and Microbiology,
https://openalex.org/W2404523453,"Common colds. Causes, potential cures, and treatment.",PubMed,6,,https://api.labs.crossref.org/works/null?mailto=christian.hauschke@tib.eu,1993,article,True,76,Diagnosis and Management of Chronic Cough,Health Sciences,Pulmonary and Respiratory Medicine,National Institutes of Health,False,en,Medicine,
https://openalex.org/W2406153776,Retracted: Blood Flow Velocity in the Middle Cerebral Artery Response to Tourniquet Release,Anaesthesia and Intensive Care,6,https://doi.org/10.1177/0310057x9902700304,https://api.labs.crossref.org/works/https://doi.org/10.1177/0310057x9902700304?mailto=christian.hauschke@tib.eu,1999,article,True,77,Management and Pathophysiology of Traumatic Brain Injury,Health Sciences,Neurology,SAGE Publishing,True,en,Medicine,
https://openalex.org/W2437360154,[Involvement of free radicals in lead poisoning].,PubMed,6,,https://api.labs.crossref.org/works/null?mailto=christian.hauschke@tib.eu,1994,article,True,76,Health Risks in Children and Adolescents,Health Sciences,"Pediatrics, Perinatology and Child Health",National Institutes of Health,False,en,Medicine,
https://openalex.org/W4229721953,R plasmid in Escherichia coli O103 coding for colonization of the rabbit intestinal tract,Infection and Immunity,6,https://doi.org/10.1128/iai.59.6.1888-1892.1991,https://api.labs.crossref.org/works/https://doi.org/10.1128/iai.59.6.1888-1892.1991?mailto=christian.hauschke@tib.eu,1991,article,True,77,Pathogenesis and Virulence of Escherichia coli,Life Sciences,Endocrinology,American Society for Microbiology,True,en,"Biochemistry, Genetics and Molecular Biology",
https://openalex.org/W4254794903,The Ulinastatin-Induced Effect on Neuromuscular Block Caused by Vecuronium,Anesthesia & Analgesia,6,https://doi.org/10.1213/00000539-199912000-00048,https://api.labs.crossref.org/works/https://doi.org/10.1213/00000539-199912000-00048?mailto=christian.hauschke@tib.eu,1999,article,True,77,Anesthesia and Sedation Management,Health Sciences,Anesthesiology and Pain Medicine,Lippincott Williams & Wilkins,True,en,Medicine,
https://openalex.org/W1972419333,The E2 protein of human papillomavirus type 16. Over-expression and purification of an active transcriptional regulator,European journal of biochemistry,5,https://doi.org/10.1111/j.1432-1033.1990.tb15549.x,https://api.labs.crossref.org/works/https://doi.org/10.1111/j.1432-1033.1990.tb15549.x?mailto=christian.hauschke@tib.eu,1990,article,True,76,The p53 Signaling Network in Cancer Research,Health Sciences,Oncology,Wiley-Blackwell,True,en,Medicine,
https://openalex.org/W1972775864,Extravascular Lung Water in Patients with Mitral Stenosis: Relationship to Pulmonary Capillary Wedge Pressure and Kerley B Lines,Radiology,5,https://doi.org/10.1148/radiology.153.2.317,https://api.labs.crossref.org/works/https://doi.org/10.1148/radiology.153.2.317?mailto=christian.hauschke@tib.eu,1984,article,True,76,Diagnosis and Treatment of Pulmonary Hypertension,Health Sciences,Pulmonary and Respiratory Medicine,Radiological Society of North America,False,en,Medicine,
https://openalex.org/W2037338461,Computed tomographic analysis of the effects of hyperosmolar mannitol and methylprednisolone on myocardial infarct size,Journal of the American College of Cardiology,5,https://doi.org/10.1016/s0735-1097(85)80047-4,https://api.labs.crossref.org/works/https://doi.org/10.1016/s0735-1097(85)80047-4?mailto=christian.hauschke@tib.eu,1985,article,True,76,Advanced Cardiac Imaging Techniques and Diagnostics,Health Sciences,"Radiology, Nuclear Medicine and Imaging",Elsevier BV,True,en,Medicine,
https://openalex.org/W2062388108,"PERSONALITY, SMOKING, AND ALCOHOL AS SYNERGISTIC RISK FACTORS FOR CANCER OF THE MOUTH AND PHARYNX",Psychological Reports,5,https://doi.org/10.2466/pr0.67.7.1024-1026,https://api.labs.crossref.org/works/https://doi.org/10.2466/pr0.67.7.1024-1026?mailto=christian.hauschke@tib.eu,1990,article,True,76,Smoking Cessation and Health Effects of Tobacco,Health Sciences,Physiology,SAGE Publishing,False,en,Medicine,
https://openalex.org/W2412092240,The Effect of an Alpha-2 Agonist on Bladder Function and Cord Histology after Spinal Cord Injury,The Journal of Urology,5,https://doi.org/10.1016/s0022-5347(17)39791-4,https://api.labs.crossref.org/works/https://doi.org/10.1016/s0022-5347(17)39791-4?mailto=christian.hauschke@tib.eu,1990,article,True,76,Neural Mechanisms of Respiratory Control and Homeostasis,Life Sciences,Endocrine and Autonomic Systems,Lippincott Williams & Wilkins,False,en,Neuroscience,
https://openalex.org/W2465586851,Effects of thioridazine and withdrawal dyskinesias on workshop performance of mentally retarded young adults [retracted in Am J Psychiatry 1989 May;146(5):634],American Journal of Psychiatry,5,https://doi.org/10.1176/ajp.139.11.1447,https://api.labs.crossref.org/works/https://doi.org/10.1176/ajp.139.11.1447?mailto=christian.hauschke@tib.eu,1982,article,True,76,Attention-Deficit/Hyperactivity Disorder,Health Sciences,Psychiatry and Mental health,American Psychiatric Association,False,en,Medicine,
https://openalex.org/W4229804070,Selective inhibition of interleukin 2 gene function following thymocyte antigen/major histocompatibility complex receptor crosslinking: possible thymic selection mechanism.,Proceedings of the National Academy of Sciences of the United States of America,5,https://doi.org/10.1073/pnas.83.18.7008,https://api.labs.crossref.org/works/https://doi.org/10.1073/pnas.83.18.7008?mailto=christian.hauschke@tib.eu,1986,article,True,76,Natural Killer Cells in Immunity,Life Sciences,Immunology,National Academy of Sciences,True,en,Immunology and Microbiology,
