id,display_name,primary_location_display_name,cited_by_count,doi,crossref_call,publication_year,type,is_retracted,cited_by_percentile_year_min,primary_topic_display_name,primary_topic_domain_display_name,primary_topic_subfield_display_name,primary_location_source_host_organization_name,open_access_is_oa,language,primary_topic_field_display_name,update_nature
https://openalex.org/W1543274658,Notice of Retraction: Analysis of flow field and parameter optimization on the intake port of the non-road small spark-ignition engine,,0,https://doi.org/10.1109/opee.2010.5508118,https://api.labs.crossref.org/works/https://doi.org/10.1109/opee.2010.5508118?mailto=christian.hauschke@tib.eu,2010,article,True,0,Chemical Kinetics of Combustion Processes,Physical Sciences,Fluid Flow and Transfer Processes,,False,en,Chemical Engineering,
https://openalex.org/W1543362578,Notice of Retraction: Combustion character of Citroen c4-1.6L engine at a constant torque,,0,https://doi.org/10.1109/iccasm.2010.5619297,https://api.labs.crossref.org/works/https://doi.org/10.1109/iccasm.2010.5619297?mailto=christian.hauschke@tib.eu,2010,article,True,0,Chemical Kinetics of Combustion Processes,Physical Sciences,Fluid Flow and Transfer Processes,,False,en,Chemical Engineering,
https://openalex.org/W1543438582,Notice of Retraction: Matrix numerical analysis,,0,https://doi.org/10.1109/iccet.2010.5485787,https://api.labs.crossref.org/works/https://doi.org/10.1109/iccet.2010.5485787?mailto=christian.hauschke@tib.eu,2010,article,True,0,Dimensional Metrology and Error Compensation,Physical Sciences,Mechanical Engineering,,False,en,Engineering,
https://openalex.org/W1543516008,Notice of Retraction: Agent-construction government investment project management new mode,,0,https://doi.org/10.1109/edt.2010.5496592,https://api.labs.crossref.org/works/https://doi.org/10.1109/edt.2010.5496592?mailto=christian.hauschke@tib.eu,2010,article,True,0,Optimization of Elevator Traffic Control Systems,Physical Sciences,Control and Systems Engineering,,False,en,Engineering,
https://openalex.org/W1543537747,Notice of Retraction: Satisfaction degree measurement architecture for restaurants: An exploratory study,,0,https://doi.org/10.1109/iccasm.2010.5622124,https://api.labs.crossref.org/works/https://doi.org/10.1109/iccasm.2010.5622124?mailto=christian.hauschke@tib.eu,2010,article,True,0,"Customer Relationships, Behavior, and Loyalty",Social Sciences,Organizational Behavior and Human Resource Management,,False,en,"Business, Management and Accounting",
https://openalex.org/W1543652122,Notice of Retraction: Network Governance: A Path Selection of Sustainable Development for Chinese Heritage Resources,,0,https://doi.org/10.1109/icmss.2010.5576331,https://api.labs.crossref.org/works/https://doi.org/10.1109/icmss.2010.5576331?mailto=christian.hauschke@tib.eu,2010,article,True,0,Drivers and Impacts of Tropical Deforestation,Physical Sciences,Global and Planetary Change,,False,en,Environmental Science,
https://openalex.org/W1543719702,Notice of Retraction: Research on UDM safety behavior audit method,,0,https://doi.org/10.1109/iccasm.2010.5620274,https://api.labs.crossref.org/works/https://doi.org/10.1109/iccasm.2010.5620274?mailto=christian.hauschke@tib.eu,2010,article,True,0,Enhancing Workplace Safety Culture and Practices,Health Sciences,Radiological and Ultrasound Technology,,False,en,Health Professions,
https://openalex.org/W1543742421,"Notice of Retraction: Impacts of entrepreneurial orientation, entrepreneurial motivation on business performance: Empirical study based on the internet-shops",,0,https://doi.org/10.1109/iccasm.2010.5622649,https://api.labs.crossref.org/works/https://doi.org/10.1109/iccasm.2010.5622649?mailto=christian.hauschke@tib.eu,2010,article,True,0,Entrepreneurship and Business Innovation,Social Sciences,Management of Technology and Innovation,,False,en,"Business, Management and Accounting",
https://openalex.org/W1543853853,Notice of Retraction: Research on factors impacting on higher education development —based on stepwise regression,,0,https://doi.org/10.1109/iceit.2010.5608363,https://api.labs.crossref.org/works/https://doi.org/10.1109/iceit.2010.5608363?mailto=christian.hauschke@tib.eu,2010,article,True,0,Application of Fuzzy Logic in Educational Assessment,Physical Sciences,Information Systems,,False,en,Computer Science,
https://openalex.org/W1544156966,Notice of Retraction: P-sets and the generation of F̄- dynamic Information,,0,https://doi.org/10.1109/iccsit.2010.5564562,https://api.labs.crossref.org/works/https://doi.org/10.1109/iccsit.2010.5564562?mailto=christian.hauschke@tib.eu,2010,article,True,0,Rough Sets Theory and Applications,Physical Sciences,Computational Theory and Mathematics,,False,en,Computer Science,
https://openalex.org/W1544281394,Notice of Retraction: A channel quality based unequal error protection method for wireless video transmission,,0,https://doi.org/10.1109/cctae.2010.5543409,https://api.labs.crossref.org/works/https://doi.org/10.1109/cctae.2010.5543409?mailto=christian.hauschke@tib.eu,2010,article,True,0,Advancements in Video Coding Standards and Techniques,Physical Sciences,Signal Processing,,False,en,Computer Science,
https://openalex.org/W1544335329,Notice of Retraction: An Empirical Study on the Relationship between TMT Structural Characteristic and Performance--Based on Listed Companies of Energy Industry of China,,0,https://doi.org/10.1109/icmss.2010.5577448,https://api.labs.crossref.org/works/https://doi.org/10.1109/icmss.2010.5577448?mailto=christian.hauschke@tib.eu,2010,article,True,0,International Business Strategy in Emerging Economies,Social Sciences,Strategy and Management,,False,en,"Business, Management and Accounting",
https://openalex.org/W1544349783,Notice of Retraction: Research on development of part-time graduate education,,0,https://doi.org/10.1109/iceit.2010.5607678,https://api.labs.crossref.org/works/https://doi.org/10.1109/iceit.2010.5607678?mailto=christian.hauschke@tib.eu,2010,article,True,0,Recognition of Prior Learning in Higher Education,Social Sciences,Education,,False,en,Social Sciences,
https://openalex.org/W1544504881,Notice of Retraction: Application of Approximate Vector Indexing Method in Medical Image Retrieval Platform,,0,https://doi.org/10.1109/iciecs.2010.5678410,https://api.labs.crossref.org/works/https://doi.org/10.1109/iciecs.2010.5678410?mailto=christian.hauschke@tib.eu,2010,article,True,0,Trajectory Data Mining and Analysis,Physical Sciences,Signal Processing,,False,en,Computer Science,
https://openalex.org/W1544537337,Notice of Retraction: The separation and degradation ability of predominant aerobic microorganism in Coal Chemical Industry Wastewater,,0,https://doi.org/10.1109/appeec.2010.5448751,https://api.labs.crossref.org/works/https://doi.org/10.1109/appeec.2010.5448751?mailto=christian.hauschke@tib.eu,2010,article,True,0,Lignin Degradation by Enzymes in Bioremediation,Life Sciences,Plant Science,,False,en,Agricultural and Biological Sciences,
https://openalex.org/W1544572932,Notice of Retraction: Combination of ^1H NMR and Chemometrics for Discrimination of Rapeseed Oils,,0,https://doi.org/10.1109/etcs.2010.587,https://api.labs.crossref.org/works/https://doi.org/10.1109/etcs.2010.587?mailto=christian.hauschke@tib.eu,2010,article,True,0,Chemometrics in Analytical Chemistry and Food Technology,Physical Sciences,Analytical Chemistry,,False,en,Chemistry,
https://openalex.org/W1544722052,Notice of Retraction: Testing calcium nitrate addition as a tool for municipal river sediment remediation,,0,https://doi.org/10.1109/esiat.2010.5568556,https://api.labs.crossref.org/works/https://doi.org/10.1109/esiat.2010.5568556?mailto=christian.hauschke@tib.eu,2010,article,True,0,Eutrophication and Harmful Algal Blooms,Physical Sciences,Environmental Chemistry,,False,en,Environmental Science,
https://openalex.org/W1544882214,Notice of Retraction: Research on fuzzy comprehensive evaluation of strategic reorganization performance of state-owned enterprises,,0,https://doi.org/10.1109/icams.2010.5553246,https://api.labs.crossref.org/works/https://doi.org/10.1109/icams.2010.5553246?mailto=christian.hauschke@tib.eu,2010,article,True,0,Corporate Governance and Financial Performance,Social Sciences,Accounting,,False,en,"Business, Management and Accounting",
https://openalex.org/W1545385841,Notice of Retraction: Failure mode research of hyperstatic truss structure based on Ansys,,0,https://doi.org/10.1109/iccasm.2010.5619190,https://api.labs.crossref.org/works/https://doi.org/10.1109/iccasm.2010.5619190?mailto=christian.hauschke@tib.eu,2010,article,True,0,Intelligent Control System for Industrial Processes,Physical Sciences,Control and Systems Engineering,,False,en,Engineering,
https://openalex.org/W1545552225,Notice of Retraction: Study on main resonance bifurcations of SDOF asymmetrical trilinear system,,0,https://doi.org/10.1109/icacc.2010.5486868,https://api.labs.crossref.org/works/https://doi.org/10.1109/icacc.2010.5486868?mailto=christian.hauschke@tib.eu,2010,article,True,0,Design and Application of Intelligent Monitoring Systems,Physical Sciences,Control and Systems Engineering,,False,en,Engineering,
https://openalex.org/W1545824139,Notice of Retraction: A Model for Selecting IT Project Based on Multi-Granularity Linguistic Assessment Information,,0,https://doi.org/10.1109/etcs.2010.176,https://api.labs.crossref.org/works/https://doi.org/10.1109/etcs.2010.176?mailto=christian.hauschke@tib.eu,2010,article,True,0,Rough Sets Theory and Applications,Physical Sciences,Computational Theory and Mathematics,,False,en,Computer Science,
https://openalex.org/W1545855943,Notice of Retraction: A communication platform for teaching based on LabVIEW,2010 International Conference on Educational and Network Technology,0,https://doi.org/10.1109/icent.2010.5532142,https://api.labs.crossref.org/works/https://doi.org/10.1109/icent.2010.5532142?mailto=christian.hauschke@tib.eu,2010,article,True,0,Remote Laboratories in Engineering Education,Physical Sciences,Media Technology,,False,en,Engineering,
https://openalex.org/W1545968758,Notice of Retraction: Stability of hollow constructions repaired with carbon fiber-reinforced polymer,,0,https://doi.org/10.1109/icacte.2010.5579126,https://api.labs.crossref.org/works/https://doi.org/10.1109/icacte.2010.5579126?mailto=christian.hauschke@tib.eu,2010,article,True,0,Fiber-Reinforced Polymer Composites in Construction,Physical Sciences,Building and Construction,,False,en,Engineering,
https://openalex.org/W1546302734,Notice of Retraction: Superplasticity prediction and application of albronze based on artificial neural network,2010 Sixth International Conference on Natural Computation,0,https://doi.org/10.1109/icnc.2010.5583350,https://api.labs.crossref.org/works/https://doi.org/10.1109/icnc.2010.5583350?mailto=christian.hauschke@tib.eu,2010,article,True,0,Dynamic Recrystallization in Metal Deformation Processes,Physical Sciences,Mechanics of Materials,,False,en,Engineering,
https://openalex.org/W1546661100,Notice of Retraction: The effects of high performance work system on job embeddedness,,0,https://doi.org/10.1109/fitme.2010.5656298,https://api.labs.crossref.org/works/https://doi.org/10.1109/fitme.2010.5656298?mailto=christian.hauschke@tib.eu,2010,article,True,0,Work Engagement and Organizational Behavior,Social Sciences,Organizational Behavior and Human Resource Management,,False,en,"Business, Management and Accounting",
https://openalex.org/W1546687258,Notice of Retraction: Research of tool swinging method processing aspheric optical parts,,0,https://doi.org/10.1109/cmce.2010.5610207,https://api.labs.crossref.org/works/https://doi.org/10.1109/cmce.2010.5610207?mailto=christian.hauschke@tib.eu,2010,article,True,0,Chemical Mechanical Polishing in Microelectronics Manufacturing,Physical Sciences,Biomedical Engineering,,False,en,Engineering,
https://openalex.org/W1546804566,Notice of Retraction: Analysis of frequency response and fatigue of car body by random loading,,0,https://doi.org/10.1109/iccsit.2010.5565162,https://api.labs.crossref.org/works/https://doi.org/10.1109/iccsit.2010.5565162?mailto=christian.hauschke@tib.eu,2010,article,True,0,Modelling and Optimization of Composite Springs in Vehicles,Physical Sciences,Mechanical Engineering,,False,en,Engineering,
https://openalex.org/W1546806855,Notice of Retraction: An empirical study on the impact of cluster level of Xiamen Torch Hi-tech Zone on the regional economic,,0,https://doi.org/10.1109/icina.2010.5636477,https://api.labs.crossref.org/works/https://doi.org/10.1109/icina.2010.5636477?mailto=christian.hauschke@tib.eu,2010,article,True,0,Spatial Shift-Share Analysis in Economic Development,Social Sciences,Economics and Econometrics,,False,en,"Economics, Econometrics and Finance",
https://openalex.org/W1547118608,Notice of Retraction: Driving Fatigue Detection Using MATLAB Simulation,,0,https://doi.org/10.1109/iciecs.2010.5677855,https://api.labs.crossref.org/works/https://doi.org/10.1109/iciecs.2010.5677855?mailto=christian.hauschke@tib.eu,2010,article,True,0,Intelligent Control System for Industrial Processes,Physical Sciences,Control and Systems Engineering,,False,en,Engineering,
https://openalex.org/W1547647642,Notice of Retraction: Skid-steer simulation analysis of wheeled vehicle based on ADAMS,,0,https://doi.org/10.1109/iccasm.2010.5622810,https://api.labs.crossref.org/works/https://doi.org/10.1109/iccasm.2010.5622810?mailto=christian.hauschke@tib.eu,2010,article,True,0,Intelligent Control System for Industrial Processes,Physical Sciences,Control and Systems Engineering,,False,en,Engineering,
https://openalex.org/W1547999245,Notice of Retraction: Fuel gas production from catalytic steam gasification of municipal solid wastes,,0,https://doi.org/10.1109/esiat.2010.5568434,https://api.labs.crossref.org/works/https://doi.org/10.1109/esiat.2010.5568434?mailto=christian.hauschke@tib.eu,2010,article,True,0,Solid Waste Management,Physical Sciences,Industrial and Manufacturing Engineering,,False,en,Environmental Science,
https://openalex.org/W1548095846,Notice of Retraction: Effects of Poisson's ratio of tension-only material on optimal stiffness design,,0,https://doi.org/10.1109/iccasm.2010.5619203,https://api.labs.crossref.org/works/https://doi.org/10.1109/iccasm.2010.5619203?mailto=christian.hauschke@tib.eu,2010,article,True,0,Topology Optimization in Structural Engineering,Physical Sciences,Civil and Structural Engineering,,False,en,Engineering,
https://openalex.org/W1548118040,Notice of Retraction: Study on Turbine Through-Flow Model Based on Self-Adaptive BP Network,,0,https://doi.org/10.1109/appeec.2010.5449510,https://api.labs.crossref.org/works/https://doi.org/10.1109/appeec.2010.5449510?mailto=christian.hauschke@tib.eu,2010,article,True,0,Spatial Data Mining and Cloud Model Applications,Physical Sciences,Information Systems,,False,en,Computer Science,
https://openalex.org/W1548266068,Notice of Retraction: Do the journals prefer positive results?,,0,https://doi.org/10.1109/icams.2010.5553152,https://api.labs.crossref.org/works/https://doi.org/10.1109/icams.2010.5553152?mailto=christian.hauschke@tib.eu,2010,article,True,0,Corporate Social Responsibility and Financial Performance,Social Sciences,Strategy and Management,,False,en,"Business, Management and Accounting",
https://openalex.org/W1548532847,Notice of Retraction: Wood culture and education of the intangible cultural heritage,,0,https://doi.org/10.1109/iceit.2010.5607647,https://api.labs.crossref.org/works/https://doi.org/10.1109/iceit.2010.5607647?mailto=christian.hauschke@tib.eu,2010,article,True,0,"Temporal, Spatial, and Social Aspects of Cultural Heritage Studies",Social Sciences,Archeology,,False,en,Arts and Humanities,
https://openalex.org/W1548914856,Notice of Retraction: Some opinions on basic course teaching in university,,0,https://doi.org/10.1109/icetc.2010.5529517,https://api.labs.crossref.org/works/https://doi.org/10.1109/icetc.2010.5529517?mailto=christian.hauschke@tib.eu,2010,article,True,0,Impact of Technology on Education and Training,Physical Sciences,Information Systems,,False,en,Computer Science,
https://openalex.org/W1548969088,Notice of Retraction: Physical Experiment Based on Teaching-Aided Robot,,0,https://doi.org/10.1109/etcs.2010.91,https://api.labs.crossref.org/works/https://doi.org/10.1109/etcs.2010.91?mailto=christian.hauschke@tib.eu,2010,article,True,0,Cloud Robotics and Automation Research,Physical Sciences,Control and Systems Engineering,,False,en,Engineering,
https://openalex.org/W1549210175,Notice of Retraction: Concept Exploration Research of Warship Based on iSIGHT,,0,https://doi.org/10.1109/iciecs.2010.5677666,https://api.labs.crossref.org/works/https://doi.org/10.1109/iciecs.2010.5677666?mailto=christian.hauschke@tib.eu,2010,article,True,0,Simulation and Optimization of Industrial Processes,Physical Sciences,Control and Systems Engineering,,False,en,Engineering,
https://openalex.org/W1549306154,Notice of Retraction: The empirical study about emergency management of unexpected crisis in Chinese universities,,0,https://doi.org/10.1109/icemms.2010.5563472,https://api.labs.crossref.org/works/https://doi.org/10.1109/icemms.2010.5563472?mailto=christian.hauschke@tib.eu,2010,article,True,0,Emergency Management in Various Industries,Social Sciences,Organizational Behavior and Human Resource Management,,False,en,"Business, Management and Accounting",
https://openalex.org/W1549393167,Notice of Retraction: Microbial detection technology research progress,,0,https://doi.org/10.1109/cctae.2010.5545065,https://api.labs.crossref.org/works/https://doi.org/10.1109/cctae.2010.5545065?mailto=christian.hauschke@tib.eu,2010,article,True,0,Breath Analysis Technology,Physical Sciences,Biomedical Engineering,,False,en,Engineering,
https://openalex.org/W1549426376,Notice of Retraction: A Study on China's government financing platform for the risk of from the Dubai debt crisis,,0,https://doi.org/10.1109/fitme.2010.5654761,https://api.labs.crossref.org/works/https://doi.org/10.1109/fitme.2010.5654761?mailto=christian.hauschke@tib.eu,2010,article,True,0,Islamic Banking and Finance Literature Review,Social Sciences,Accounting,,False,en,"Business, Management and Accounting",
https://openalex.org/W1549440087,Notice of Retraction: The Interval Analysis for Static Response of Stream Turbine Blade with Uncertain Parameters,,0,https://doi.org/10.1109/appeec.2010.5449526,https://api.labs.crossref.org/works/https://doi.org/10.1109/appeec.2010.5449526?mailto=christian.hauschke@tib.eu,2010,article,True,0,Cavitation in Hydropower Systems and Turbines,Physical Sciences,Mechanics of Materials,,False,en,Engineering,
https://openalex.org/W1549636916,Notice of Retraction: A model for the spare-part distribution management in diesel engine industry,,0,https://doi.org/10.1109/iccasm.2010.5622509,https://api.labs.crossref.org/works/https://doi.org/10.1109/iccasm.2010.5622509?mailto=christian.hauschke@tib.eu,2010,article,True,0,Impact of Big Data Analytics on Business Performance,Social Sciences,Management Information Systems,,False,en,"Business, Management and Accounting",
https://openalex.org/W1549710543,Notice of Violation of IEEE Publication Principles: Classification model based on ranganathan's facets theory for information organization and management,,0,https://doi.org/10.1109/edt.2010.5496547,https://api.labs.crossref.org/works/https://doi.org/10.1109/edt.2010.5496547?mailto=christian.hauschke@tib.eu,2010,article,True,0,Information Overload in Knowledge Management and Work Performance,Social Sciences,Information Systems and Management,,False,en,Decision Sciences,
https://openalex.org/W1549734781,Notice of Retraction: Research and practice on the urban and rural basic medical insurance network integration,,0,https://doi.org/10.1109/iccasm.2010.5622992,https://api.labs.crossref.org/works/https://doi.org/10.1109/iccasm.2010.5622992?mailto=christian.hauschke@tib.eu,2010,article,True,0,,,,,False,en,,
https://openalex.org/W1549902676,Notice of Retraction: Engineering Design Plan for Building Intelligent System Integration,,0,https://doi.org/10.1109/cicc-itoe.2010.65,https://api.labs.crossref.org/works/https://doi.org/10.1109/cicc-itoe.2010.65?mailto=christian.hauschke@tib.eu,2010,article,True,0,Intelligent Control System for Industrial Processes,Physical Sciences,Control and Systems Engineering,,False,en,Engineering,
https://openalex.org/W1549932488,Notice of Retraction: The choice of the paths to enhance the core competitiveness of university teachers,,0,https://doi.org/10.1109/fitme.2010.5654819,https://api.labs.crossref.org/works/https://doi.org/10.1109/fitme.2010.5654819?mailto=christian.hauschke@tib.eu,2010,article,True,0,Impact of Technology on Education and Training,Physical Sciences,Information Systems,,False,en,Computer Science,
https://openalex.org/W1550121548,Notice of Retraction: Researching conductivity of the financial markets based on Granger-Causality model,,0,https://doi.org/10.1109/icams.2010.5553006,https://api.labs.crossref.org/works/https://doi.org/10.1109/icams.2010.5553006?mailto=christian.hauschke@tib.eu,2010,article,True,0,Application of Grey System Theory in Forecasting,Social Sciences,Management Science and Operations Research,,False,en,Decision Sciences,
https://openalex.org/W1550182221,Notice of Retraction: Cultivating the scientific research ability of undergraduates with thesis and research project combined,,0,https://doi.org/10.1109/icetc.2010.5529647,https://api.labs.crossref.org/works/https://doi.org/10.1109/icetc.2010.5529647?mailto=christian.hauschke@tib.eu,2010,article,True,0,Impact of Technology on Education and Training,Physical Sciences,Information Systems,,False,en,Computer Science,
https://openalex.org/W1550384474,Notice of Retraction: Numerical Analysis and Processing of Seismic Wave in Aseismic Research of Underground Structure,,0,https://doi.org/10.1109/icmss.2010.5577431,https://api.labs.crossref.org/works/https://doi.org/10.1109/icmss.2010.5577431?mailto=christian.hauschke@tib.eu,2010,article,True,0,Seismic Design and Analysis of Underground Structures,Physical Sciences,Civil and Structural Engineering,,False,en,Engineering,
https://openalex.org/W1550565273,Notice of Retraction: Study on turbulent characteristics of downburst winds using computational simulation method,,0,https://doi.org/10.1109/iccasm.2010.5620697,https://api.labs.crossref.org/works/https://doi.org/10.1109/iccasm.2010.5620697?mailto=christian.hauschke@tib.eu,2010,article,True,0,Applications of Remote Sensing in Geoscience and Agriculture,Physical Sciences,Atmospheric Science,,False,en,Earth and Planetary Sciences,
https://openalex.org/W1550586639,Notice of Retraction: The Design Framework of E-Commerce Platform of Chinese Forest Products,,0,https://doi.org/10.1109/icmss.2010.5576815,https://api.labs.crossref.org/works/https://doi.org/10.1109/icmss.2010.5576815?mailto=christian.hauschke@tib.eu,2010,article,True,0,Web Engineering for Applications Development,Physical Sciences,Information Systems,,False,en,Computer Science,
https://openalex.org/W1550603441,Notice of Retraction: Simulation of Co-combustion of Waste with Sludge for Power Generation by Aspen Plus,,0,https://doi.org/10.1109/appeec.2010.5448757,https://api.labs.crossref.org/works/https://doi.org/10.1109/appeec.2010.5448757?mailto=christian.hauschke@tib.eu,2010,article,True,0,Biomass Pyrolysis and Conversion Technologies,Physical Sciences,Biomedical Engineering,,False,en,Engineering,
https://openalex.org/W1550734246,"Notice of Retraction: An empirical study on the correlations among economic level, technological innovation and standardization",,0,https://doi.org/10.1109/fitme.2010.5654866,https://api.labs.crossref.org/works/https://doi.org/10.1109/fitme.2010.5654866?mailto=christian.hauschke@tib.eu,2010,article,True,0,Models and Dynamics of Technology Diffusion,Social Sciences,Management Science and Operations Research,,False,en,Decision Sciences,
https://openalex.org/W1550950554,Notice of Retraction: Numerical and experiments investigations of the process for explosion load drive liquid dispersed,,0,https://doi.org/10.1109/iccasm.2010.5619399,https://api.labs.crossref.org/works/https://doi.org/10.1109/iccasm.2010.5619399?mailto=christian.hauschke@tib.eu,2010,article,True,0,Challenges and Applications of Detonation Propulsion Technology,Physical Sciences,Aerospace Engineering,,False,en,Engineering,
https://openalex.org/W1550990461,Notice of Retraction: Research on Computation Methods of Fire Flowfield in Cylindrical Sealed Space,,0,https://doi.org/10.1109/etcs.2010.270,https://api.labs.crossref.org/works/https://doi.org/10.1109/etcs.2010.270?mailto=christian.hauschke@tib.eu,2010,article,True,0,Fire Safety in Tunnel Fires,Physical Sciences,"Safety, Risk, Reliability and Quality",,False,en,Engineering,
https://openalex.org/W1551021137,Notice of Retraction: Automatic thrust augmentation,,0,https://doi.org/10.1109/iccet.2010.5486136,https://api.labs.crossref.org/works/https://doi.org/10.1109/iccet.2010.5486136?mailto=christian.hauschke@tib.eu,2010,article,True,0,Autonomous Aerial Refueling Systems for UAVs,Physical Sciences,Aerospace Engineering,,False,en,Engineering,
https://openalex.org/W1551292285,Notice of Retraction: Numerical simulation of cathodic protection on buried X80 steel,2010 Sixth International Conference on Natural Computation,0,https://doi.org/10.1109/icnc.2010.5584877,https://api.labs.crossref.org/works/https://doi.org/10.1109/icnc.2010.5584877?mailto=christian.hauschke@tib.eu,2010,article,True,0,Study on Rock Mechanics in Deep Mining Engineering,Physical Sciences,Mechanics of Materials,,False,en,Engineering,
