id,display_name,primary_location_display_name,cited_by_count,doi,crossref_call,publication_year,type,is_retracted,cited_by_percentile_year_min,primary_topic_display_name,primary_topic_domain_display_name,primary_topic_subfield_display_name,primary_location_source_host_organization_name,open_access_is_oa,language,primary_topic_field_display_name,update_nature
https://openalex.org/W2605659762,RETRACTED ARTICLE: Protein–Protein Interaction Network Analysis in Chronic Obstructive Pulmonary Disease,Lung,5,https://doi.org/10.1007/s00408-013-9509-x,https://api.labs.crossref.org/works/https://doi.org/10.1007/s00408-013-9509-x?mailto=christian.hauschke@tib.eu,2013,article,True,83,Standardisation and Management of COPD,Health Sciences,Pulmonary and Respiratory Medicine,Springer Science+Business Media,True,en,Medicine,
https://openalex.org/W2612076045,Therapeutic effects of metformin and laparoscopic ovarian drilling in treatment of clomiphene and insulin-resistant polycystic ovary syndrome,Archives of Gynecology and Obstetrics,5,https://doi.org/10.1007/s00404-014-3486-z,https://api.labs.crossref.org/works/https://doi.org/10.1007/s00404-014-3486-z?mailto=christian.hauschke@tib.eu,2014,article,True,84,Diagnosis and Management of Polycystic Ovary Syndrome,Health Sciences,Reproductive Medicine,Springer Science+Business Media,False,en,Medicine,
https://openalex.org/W2614828340,RETRACTED ARTICLE: Promoter methylation of DAPK gene may contribute to the pathogenesis of nonsmall cell lung cancer: a meta-analysis,Tumor Biology,5,https://doi.org/10.1007/s13277-014-1796-1,https://api.labs.crossref.org/works/https://doi.org/10.1007/s13277-014-1796-1?mailto=christian.hauschke@tib.eu,2014,article,True,84,Epigenetic Modifications and Their Functional Implications,Life Sciences,Molecular Biology,SAGE Publishing,False,en,"Biochemistry, Genetics and Molecular Biology",
https://openalex.org/W2616465795,RETRACTED ARTICLE: Relationships of COX2 and MMP12 genetic polymorphisms with chronic obstructive pulmonary disease risk: a meta-analysis,Molecular Biology Reports,5,https://doi.org/10.1007/s11033-014-3715-3,https://api.labs.crossref.org/works/https://doi.org/10.1007/s11033-014-3715-3?mailto=christian.hauschke@tib.eu,2014,article,True,84,Standardisation and Management of COPD,Health Sciences,Pulmonary and Respiratory Medicine,Springer Nature,False,en,Medicine,
https://openalex.org/W2616542255,RETRACTED ARTICLE: Improved treatment of Asthma by using natural sources of antioxidants,SpringerPlus,5,https://doi.org/10.1186/2193-1801-2-278,https://api.labs.crossref.org/works/https://doi.org/10.1186/2193-1801-2-278?mailto=christian.hauschke@tib.eu,2013,article,True,83,Medicinal Plants and Their Bioactivities,Life Sciences,Plant Science,Springer International Publishing,True,en,Agricultural and Biological Sciences,
https://openalex.org/W2616817636,RETRACTED ARTICLE: Downregulation of miR-185 and upregulation of miR-218 expression may be potential diagnostic and prognostic biomarkers of human chondrosarcoma,Tumor Biology,5,https://doi.org/10.1007/s13277-015-4090-y,https://api.labs.crossref.org/works/https://doi.org/10.1007/s13277-015-4090-y?mailto=christian.hauschke@tib.eu,2015,article,True,84,Bone Tumors and Tumor-like Conditions in Skeletal System,Health Sciences,Rheumatology,SAGE Publishing,False,en,Medicine,
https://openalex.org/W2737541841,Effect of umbilical cord mesenchymal stem cell in peri-implant bone defect after immediate implant: an experiment study in beagle dogs.,PubMed,5,,https://api.labs.crossref.org/works/null?mailto=christian.hauschke@tib.eu,2014,article,True,84,Applications of Platelet-Rich Plasma in Regenerative Medicine,Health Sciences,Urology,National Institutes of Health,False,en,Medicine,
https://openalex.org/W2753177793,"THEORETICAL DEFINITION FOR QUALITY PARAMETERS OF SURFACE LAYER IN PARTS, TOOL-ELECTRODE WEAR AND PROCESS PRODUCTIVITY AT ELECTROEROSION MACHINING",Bulletin of Bryansk state technical university,5,https://doi.org/10.12737/18261,https://api.labs.crossref.org/works/https://doi.org/10.12737/18261?mailto=christian.hauschke@tib.eu,2016,article,True,84,Surface Modification Techniques for Metal Alloys,Physical Sciences,Mechanical Engineering,,True,en,Engineering,
https://openalex.org/W2901904439,RETRACTED ARTICLE: Ultra-High Strength and Ductile Lamellar-Structured Powder Metallurgy Binary Ti-Ta Alloys,JOM,5,https://doi.org/10.1007/s11837-015-1801-1,https://api.labs.crossref.org/works/https://doi.org/10.1007/s11837-015-1801-1?mailto=christian.hauschke@tib.eu,2016,article,True,84,Titanium Alloys for Biomedical Applications,Physical Sciences,Materials Chemistry,Springer Science+Business Media,False,en,Materials Science,
https://openalex.org/W2912561305,"RETRACTED ARTICLE: Genetic polymorphisms in VDR, ESR1 and ESR2 genes may contribute to susceptibility to Parkinson’s disease: a meta-analysis",Molecular Biology Reports,5,https://doi.org/10.1007/s11033-014-3317-0,https://api.labs.crossref.org/works/https://doi.org/10.1007/s11033-014-3317-0?mailto=christian.hauschke@tib.eu,2014,article,True,84,Functions and Regulation of RNA Editing by ADARs,Life Sciences,Molecular Biology,Springer Nature,False,en,"Biochemistry, Genetics and Molecular Biology",
https://openalex.org/W2922117816,RETRACTED ARTICLE: Clinical value of circulating tumor cells for the prognosis of postoperative transarterial chemoembolization therapy,Medical Oncology,5,https://doi.org/10.1007/s12032-014-0175-5,https://api.labs.crossref.org/works/https://doi.org/10.1007/s12032-014-0175-5?mailto=christian.hauschke@tib.eu,2014,article,True,84,Hepatocellular Carcinoma,Health Sciences,Hepatology,Springer Science+Business Media,False,en,Medicine,
https://openalex.org/W2941524414,Retracted: Culture as Constitutive: An Exploration of Audience and Journalist Perceptions of Journalism in Samoa,"Communication, Culture & Critique",5,https://doi.org/10.1111/cccr.12076,https://api.labs.crossref.org/works/https://doi.org/10.1111/cccr.12076?mailto=christian.hauschke@tib.eu,2014,article,True,84,Media Framing and Agenda Setting in Communication,Social Sciences,Communication,Oxford University Press,False,en,Social Sciences,
https://openalex.org/W2959043033,Production of interleukin-4 in CD133+ cervical cancer stem cells promotes resistance to apoptosis and initiates tumor growth,Molecular Medicine Reports,5,https://doi.org/10.3892/mmr.2016.5195,https://api.labs.crossref.org/works/https://doi.org/10.3892/mmr.2016.5195?mailto=christian.hauschke@tib.eu,2016,article,True,84,Cancer Stem Cells and Tumor Metastasis,Health Sciences,Oncology,Spandidos Publishing,True,en,Medicine,
https://openalex.org/W2964618164,RETRACTED: Composite reliability of workplace‐based assessment for international medical graduates,Medical Journal of Australia,5,https://doi.org/10.5694/mja16.00069,https://api.labs.crossref.org/works/https://doi.org/10.5694/mja16.00069?mailto=christian.hauschke@tib.eu,2016,article,True,84,Transformation of Medical Education and Professionalism,Health Sciences,"Public Health, Environmental and Occupational Health",Wiley,False,en,Medicine,
https://openalex.org/W2965024266,RETRACTED: Ultrasound-guided supra-iliac anterior quadratus lumborum block provides effective perioperative analgesia for total hip arthroplasty,Journal of Clinical Anesthesia,5,https://doi.org/10.1016/j.jclinane.2019.05.022,https://api.labs.crossref.org/works/https://doi.org/10.1016/j.jclinane.2019.05.022?mailto=christian.hauschke@tib.eu,2020,article,True,83,Management of Postoperative Pain and Complications,Health Sciences,Surgery,Elsevier BV,False,en,Medicine,
https://openalex.org/W2982659125,Impact and Cost-Effectiveness of Human Papillomavirus Vaccination Campaigns,"Cancer Epidemiology, Biomarkers & Prevention",5,https://doi.org/10.1158/1055-9965.epi-19-0767,https://api.labs.crossref.org/works/https://doi.org/10.1158/1055-9965.epi-19-0767?mailto=christian.hauschke@tib.eu,2020,article,True,83,Human Papillomavirus and Cervical Cancer Epidemiology,Health Sciences,Epidemiology,American Association for Cancer Research,False,en,Medicine,
https://openalex.org/W2985274730,RETRACTED: Development of curcumin-loaded silk fibroin nanoparticles as drug delivery vehicle for the treatment of ischemic stroke for patients in nursing care in hospitals,Journal of Drug Delivery Science and Technology,5,https://doi.org/10.1016/j.jddst.2019.101360,https://api.labs.crossref.org/works/https://doi.org/10.1016/j.jddst.2019.101360?mailto=christian.hauschke@tib.eu,2020,article,True,83,Bioavailability and Health Effects of Curcumin,Life Sciences,Molecular Medicine,Elsevier BV,False,en,"Biochemistry, Genetics and Molecular Biology",
https://openalex.org/W2986366468,RETRACTED: Propofol weakens hypoxia-aroused apoptosis and autophagy via elevating microRNA-137 in neurocytes,Experimental and Molecular Pathology,5,https://doi.org/10.1016/j.yexmp.2019.104327,https://api.labs.crossref.org/works/https://doi.org/10.1016/j.yexmp.2019.104327?mailto=christian.hauschke@tib.eu,2020,article,True,83,Role of Autophagy in Disease and Health,Health Sciences,Epidemiology,Elsevier BV,False,en,Medicine,
https://openalex.org/W2990441107,RETRACTED: CircLMTK2 acts as a tumor suppressor in prostate cancer via regulating the expression of microRNA-183,Life Sciences,5,https://doi.org/10.1016/j.lfs.2019.117097,https://api.labs.crossref.org/works/https://doi.org/10.1016/j.lfs.2019.117097?mailto=christian.hauschke@tib.eu,2020,article,True,83,Biogenesis and Functions of Circular RNAs,Life Sciences,Molecular Biology,Elsevier BV,False,en,"Biochemistry, Genetics and Molecular Biology",
https://openalex.org/W2997329684,RETRACTED: Energy-aware resource management for uplink non-orthogonal multiple access: Multi-agent deep reinforcement learning,Future Generation Computer Systems,5,https://doi.org/10.1016/j.future.2019.12.047,https://api.labs.crossref.org/works/https://doi.org/10.1016/j.future.2019.12.047?mailto=christian.hauschke@tib.eu,2020,article,True,83,Intelligent Reflecting Surfaces in Wireless Communications,Physical Sciences,Electrical and Electronic Engineering,Elsevier BV,False,en,Engineering,
https://openalex.org/W2997898168,RETRACTED: Pareto-based allocations of multi-type flexible AC transmission system devices for optimal reactive power dispatch using Kinetic Gas Molecule Optimization algorithm,Measurement and Control,5,https://doi.org/10.1177/0020294019866857,https://api.labs.crossref.org/works/https://doi.org/10.1177/0020294019866857?mailto=christian.hauschke@tib.eu,2020,article,True,83,Integration of Distributed Generation in Power Systems,Physical Sciences,Electrical and Electronic Engineering,SAGE Publishing,True,en,Engineering,
https://openalex.org/W2999231042,MicroRNA-301b and its target gene synaptosome-associated protein 91 as important modulators in esophageal cancer: functional experiments [RETRACTED],Anti-Cancer Drugs,5,https://doi.org/10.1097/cad.0000000000000893,https://api.labs.crossref.org/works/https://doi.org/10.1097/cad.0000000000000893?mailto=christian.hauschke@tib.eu,2020,article,True,83,MicroRNA Regulation in Cancer and Development,Life Sciences,Cancer Research,Lippincott Williams & Wilkins,False,en,"Biochemistry, Genetics and Molecular Biology",
https://openalex.org/W2999984571,The Nephroprotective Effect of TNF Receptor-Associated Factor 6 (TRAF6) Blockade on LPS-Induced Acute Renal Injury Through the Inhibition if Inflammation and Oxidative Stress,Medical Science Monitor,5,https://doi.org/10.12659/msm.919698,https://api.labs.crossref.org/works/https://doi.org/10.12659/msm.919698?mailto=christian.hauschke@tib.eu,2020,article,True,83,Management and Outcomes of Acute Kidney Injury,Health Sciences,Nephrology,International Scientific Information Inc.,True,en,Medicine,
https://openalex.org/W3000247117,"Euxanthone represses the proliferation, migration, and invasion of glioblastoma cells by modulating STAT3/SHP‐1 signaling",Anatomical Record-Advances in Integrative Anatomy and Evolutionary Biology,5,https://doi.org/10.1002/ar.24363,https://api.labs.crossref.org/works/https://doi.org/10.1002/ar.24363?mailto=christian.hauschke@tib.eu,2020,article,True,83,Role of Quinones in Toxicology and Pharmacology,Life Sciences,Toxicology,Wiley,True,en,"Pharmacology, Toxicology and Pharmaceutics",
https://openalex.org/W3000333421,"Naturally Occurring Sclareol Diterpene Augments the Chemosensitivity of Human Hela Cervical Cancer Cells by Inducing Mitochondrial Mediated Programmed Cell Death, S-Phase Cell Cycle Arrest and Targeting Mitogen-Activated Protein Kinase (MAPK)/Extracellular-Signal-Regulated Kinase (ERK) Signaling Pathway",Medical Science Monitor,5,https://doi.org/10.12659/msm.920248,https://api.labs.crossref.org/works/https://doi.org/10.12659/msm.920248?mailto=christian.hauschke@tib.eu,2020,article,True,83,Molecular Mechanisms and Medical Applications of Ginseng,Life Sciences,Molecular Biology,International Scientific Information Inc.,True,en,"Biochemistry, Genetics and Molecular Biology",
https://openalex.org/W3000409003,Using Big Data to Determine Potential Dropouts in Higher Education,Journal of Physics: Conference Series,5,https://doi.org/10.1088/1742-6596/1432/1/012077,https://api.labs.crossref.org/works/https://doi.org/10.1088/1742-6596/1432/1/012077?mailto=christian.hauschke@tib.eu,2020,article,True,83,Educational Data Mining and Learning Analytics,Physical Sciences,Computer Science Applications,IOP Publishing,True,en,Computer Science,
https://openalex.org/W3000571639,Neuroanatomical predictors of L-DOPA response in older adults with psychomotor slowing and depression: A pilot study,Journal of Affective Disorders,5,https://doi.org/10.1016/j.jad.2020.01.066,https://api.labs.crossref.org/works/https://doi.org/10.1016/j.jad.2020.01.066?mailto=christian.hauschke@tib.eu,2020,article,True,83,Analysis of Brain Functional Connectivity Networks,Life Sciences,Cognitive Neuroscience,Elsevier BV,True,en,Neuroscience,
https://openalex.org/W3001436459,RETRACTED: Speech enhancement method using deep learning approach for hearing-impaired listeners,Health Informatics Journal,5,https://doi.org/10.1177/1460458219893850,https://api.labs.crossref.org/works/https://doi.org/10.1177/1460458219893850?mailto=christian.hauschke@tib.eu,2020,article,True,83,Speech Enhancement Techniques,Physical Sciences,Signal Processing,SAGE Publishing,True,en,Computer Science,
https://openalex.org/W3001439224,&lt;p&gt;Procyanidin Compound (PC) Suppresses Lipopolysaccharide-Induced Cervical Cancer Cell Proliferation Through Blocking the TLR4/NF-κB Pathway&lt;/p&gt;,Cancer management and research,5,https://doi.org/10.2147/cmar.s226547,https://api.labs.crossref.org/works/https://doi.org/10.2147/cmar.s226547?mailto=christian.hauschke@tib.eu,2020,article,True,83,NF-?B Signaling in Inflammation and Cancer,Life Sciences,Cancer Research,Dove Medical Press,True,en,"Biochemistry, Genetics and Molecular Biology",
https://openalex.org/W3003767297,WITHDRAWN: Emotional regulation in gambling disorder,Current Opinion in Behavioral Sciences,5,https://doi.org/10.1016/j.cobeha.2019.10.014,https://api.labs.crossref.org/works/https://doi.org/10.1016/j.cobeha.2019.10.014?mailto=christian.hauschke@tib.eu,2020,article,True,83,Pathological Gambling and Comorbid Disorders,Social Sciences,Clinical Psychology,Elsevier BV,False,en,Psychology,
https://openalex.org/W3003979862,RETRACTED ARTICLE: Spectrum of cosmological correlation from vacuum fluctuation of stringy axion in entangled de Sitter space,The European Physical Journal C,5,https://doi.org/10.1140/epjc/s10052-019-7582-x,https://api.labs.crossref.org/works/https://doi.org/10.1140/epjc/s10052-019-7582-x?mailto=christian.hauschke@tib.eu,2020,article,True,83,Cosmological Parameters and Dark Energy,Physical Sciences,Astronomy and Astrophysics,Springer Science+Business Media,True,en,Physics and Astronomy,
https://openalex.org/W3004029340,WITHDRAWN: Uterine myomas: Clinical impact and pathophysiological bases,European Journal of Obstetrics & Gynecology and Reproductive Biology,5,https://doi.org/10.1016/j.ejogrb.2020.01.043,https://api.labs.crossref.org/works/https://doi.org/10.1016/j.ejogrb.2020.01.043?mailto=christian.hauschke@tib.eu,2020,article,True,83,Uterine Conditions and Treatments,Health Sciences,Obstetrics and Gynecology,Elsevier BV,True,en,Medicine,
https://openalex.org/W3004126614,RETRACTED ARTICLE: A Complete Formula of Ocean Surface Absolute Geostrophic Current,Scientific Reports,5,https://doi.org/10.1038/s41598-020-58458-w,https://api.labs.crossref.org/works/https://doi.org/10.1038/s41598-020-58458-w?mailto=christian.hauschke@tib.eu,2020,article,True,83,Global Sea Level Variability and Change,Physical Sciences,Oceanography,Nature Portfolio,True,en,Earth and Planetary Sciences,
https://openalex.org/W3004552550,RETRACTED ARTICLE: The correlation between social transformation economic risk and internet public opinion,Behaviour & Information Technology,5,https://doi.org/10.1080/0144929x.2020.1722750,https://api.labs.crossref.org/works/https://doi.org/10.1080/0144929x.2020.1722750?mailto=christian.hauschke@tib.eu,2020,article,True,83,Statistical Physics of Opinion Dynamics,Physical Sciences,Statistical and Nonlinear Physics,Taylor & Francis,False,en,Physics and Astronomy,
https://openalex.org/W3004723842,"RETRACTED ARTICLE: Robot acquisition, control and interfacing using multimodal feedback",Journal of Ambient Intelligence and Humanized Computing,5,https://doi.org/10.1007/s12652-020-01738-0,https://api.labs.crossref.org/works/https://doi.org/10.1007/s12652-020-01738-0?mailto=christian.hauschke@tib.eu,2020,article,True,83,Optoelectronic Systems for Measurement and Detection,Physical Sciences,Electrical and Electronic Engineering,Springer Science+Business Media,False,en,Engineering,
https://openalex.org/W3005119452,REMOVED: Steady and unsteady flow simulation with SRH-2D,Journal of Ocean Engineering and Science,5,https://doi.org/10.1016/j.joes.2020.01.002,https://api.labs.crossref.org/works/https://doi.org/10.1016/j.joes.2020.01.002?mailto=christian.hauschke@tib.eu,2020,article,True,83,Scale Effects in Hydraulic Engineering Models,Physical Sciences,Civil and Structural Engineering,Elsevier BV,True,en,Engineering,
https://openalex.org/W3006287448,Long non-coding RNA HAL suppresses the migration and invasion of serous ovarian cancer by inhibiting EMT signaling pathway,Bioscience Reports,5,https://doi.org/10.1042/bsr20194496,https://api.labs.crossref.org/works/https://doi.org/10.1042/bsr20194496?mailto=christian.hauschke@tib.eu,2020,article,True,83,Role of Long Noncoding RNAs in Cancer and Development,Life Sciences,Cancer Research,Portland Press,True,en,"Biochemistry, Genetics and Molecular Biology",
https://openalex.org/W3006473503,Retracted: MicroRNA let‐7b Inhibits Proliferation and Induces Apoptosis of Castration‐Resistant Prostate Cancer Cells by Blocking the Ras/Rho Signaling Pathway via NRAS,Clinical and Translational Science,5,https://doi.org/10.1111/cts.12743,https://api.labs.crossref.org/works/https://doi.org/10.1111/cts.12743?mailto=christian.hauschke@tib.eu,2020,article,True,83,MicroRNA Regulation in Cancer and Development,Life Sciences,Cancer Research,Wiley-Blackwell,True,en,"Biochemistry, Genetics and Molecular Biology",
https://openalex.org/W3006542873,RETRACTED ARTICLE: A novel approach based on BSPCI for quantifying functional connectivity pattern of the brain’s region for the classification of epileptic seizure,Journal of Ambient Intelligence and Humanized Computing,5,https://doi.org/10.1007/s12652-020-01774-w,https://api.labs.crossref.org/works/https://doi.org/10.1007/s12652-020-01774-w?mailto=christian.hauschke@tib.eu,2020,article,True,83,Analysis of Brain Functional Connectivity Networks,Life Sciences,Cognitive Neuroscience,Springer Science+Business Media,False,en,Neuroscience,
https://openalex.org/W3006821578,RETRACTED ARTICLE: Performance of single hop and multi hop relaying protocols in cognitive radio networks over Weibull fading channel,Journal of Ambient Intelligence and Humanized Computing,5,https://doi.org/10.1007/s12652-020-01739-z,https://api.labs.crossref.org/works/https://doi.org/10.1007/s12652-020-01739-z?mailto=christian.hauschke@tib.eu,2020,article,True,83,Cooperative Diversity in Wireless Networks,Physical Sciences,Computer Networks and Communications,Springer Science+Business Media,False,en,Computer Science,
https://openalex.org/W3007706913,WITHDRAWN: Circular RNA circUBA1 promotes gastric cancer proliferation and metastasis by acting as a competitive endogenous RNA through sponging miR-375 and regulating TEAD4,Cancer Letters,5,https://doi.org/10.1016/j.canlet.2020.02.022,https://api.labs.crossref.org/works/https://doi.org/10.1016/j.canlet.2020.02.022?mailto=christian.hauschke@tib.eu,2020,article,True,83,Biogenesis and Functions of Circular RNAs,Life Sciences,Molecular Biology,Elsevier BV,True,en,"Biochemistry, Genetics and Molecular Biology",
https://openalex.org/W3007877885,Oncolytic adenovirus Ad11 enhances the chemotherapy effect of cisplatin on osteosarcoma cells by inhibiting autophagy.,PubMed,5,,https://api.labs.crossref.org/works/null?mailto=christian.hauschke@tib.eu,2020,article,True,83,Gene Therapy Techniques and Applications,Life Sciences,Genetics,National Institutes of Health,False,en,"Biochemistry, Genetics and Molecular Biology",
https://openalex.org/W3008032904,RETRACTED ARTICLE: An optimal mobile data gathering in small scale WSN by power saving adaptive clustering techniques,Journal of Ambient Intelligence and Humanized Computing,5,https://doi.org/10.1007/s12652-020-01757-x,https://api.labs.crossref.org/works/https://doi.org/10.1007/s12652-020-01757-x?mailto=christian.hauschke@tib.eu,2020,article,True,83,Wireless Sensor Networks: Survey and Applications,Physical Sciences,Computer Networks and Communications,Springer Science+Business Media,False,en,Computer Science,
https://openalex.org/W3010779801,RETRACTED: Design of basketball robot based on behavior-based fuzzy control,International Journal of Advanced Robotic Systems,5,https://doi.org/10.1177/1729881420909965,https://api.labs.crossref.org/works/https://doi.org/10.1177/1729881420909965?mailto=christian.hauschke@tib.eu,2020,article,True,83,Artificial Intelligence in Education and Technology,Physical Sciences,Artificial Intelligence,SAGE Publishing,True,en,Computer Science,
https://openalex.org/W3010911556,"Downregulation of transcription factor TCTP elevates microRNA-200a expression to restrain Myt1L expression, thereby improving neurobehavior and oxidative stress injury in cerebral palsy rats",Cell Cycle,5,https://doi.org/10.1080/15384101.2020.1717044,https://api.labs.crossref.org/works/https://doi.org/10.1080/15384101.2020.1717044?mailto=christian.hauschke@tib.eu,2020,article,True,83,Impact of Chronic Stress on Cancer Progression,Health Sciences,Psychiatry and Mental health,Taylor & Francis,True,en,Medicine,
https://openalex.org/W3011337449,RETRACTED: Co infection of respiratory syncytial viruses (RSV) and Streptococcus pneumonia modulates pathogenesis and dependent of serotype and phase variant,Microbial Pathogenesis,5,https://doi.org/10.1016/j.micpath.2020.104126,https://api.labs.crossref.org/works/https://doi.org/10.1016/j.micpath.2020.104126?mailto=christian.hauschke@tib.eu,2020,article,True,83,Epidemiology and Pathogenesis of Respiratory Viral Infections,Health Sciences,Epidemiology,Elsevier BV,False,en,Medicine,
https://openalex.org/W3011967981,RETRACTED ARTICLE: Antenna selection with improved group based particle swarm optimization (IGPSO) and joint adaptive beam forming for wideband millimeter wave communication,Journal of Ambient Intelligence and Humanized Computing,5,https://doi.org/10.1007/s12652-020-01828-z,https://api.labs.crossref.org/works/https://doi.org/10.1007/s12652-020-01828-z?mailto=christian.hauschke@tib.eu,2020,article,True,83,Antenna Design and Applications,Physical Sciences,Aerospace Engineering,Springer Science+Business Media,False,en,Engineering,
https://openalex.org/W3012601770,"RETRACTED: Structural, electronic and magnetic properties of the Ni/Cu-embedded S-vacancy defective MoS2 monolayers and their effects on the adsorption of SOx and O3 molecules",Applied Surface Science,5,https://doi.org/10.1016/j.apsusc.2020.146179,https://api.labs.crossref.org/works/https://doi.org/10.1016/j.apsusc.2020.146179?mailto=christian.hauschke@tib.eu,2020,article,True,83,Two-Dimensional Materials,Physical Sciences,Materials Chemistry,Elsevier BV,True,en,Materials Science,
https://openalex.org/W3012615026,Long non-coding RNA NEAT1 promotes tumor development and metastasis through targeting miR-224-5p in malignant melanoma.,PubMed,5,https://doi.org/10.26355/eurrev_202002_20187,https://api.labs.crossref.org/works/https://doi.org/10.26355/eurrev_202002_20187?mailto=christian.hauschke@tib.eu,2020,article,True,83,Role of Long Noncoding RNAs in Cancer and Development,Life Sciences,Cancer Research,National Institutes of Health,False,en,"Biochemistry, Genetics and Molecular Biology",
https://openalex.org/W3012743317,Association Between Maternal Exposure to Magnetic Field Nonionizing Radiation During Pregnancy and Risk of Attention-Deficit/Hyperactivity Disorder in Offspring in a Longitudinal Birth Cohort,JAMA network open,5,https://doi.org/10.1001/jamanetworkopen.2020.1417,https://api.labs.crossref.org/works/https://doi.org/10.1001/jamanetworkopen.2020.1417?mailto=christian.hauschke@tib.eu,2020,article,True,83,The Exposome in Environmental Health Research,Physical Sciences,"Health, Toxicology and Mutagenesis",American Medical Association,True,en,Environmental Science,
