id,display_name,primary_location_display_name,cited_by_count,doi,crossref_call,publication_year,type,is_retracted,cited_by_percentile_year_min,primary_topic_display_name,primary_topic_domain_display_name,primary_topic_subfield_display_name,primary_location_source_host_organization_name,open_access_is_oa,language,primary_topic_field_display_name,update_nature
https://openalex.org/W4309612432,Circ_0075960 targets the miR-202-5p/CTNND1 axis to promote the growth and migration of endometrial carcinoma cells via regulating Wnt/β-catenin signaling activity,Journal of Gynecologic Oncology,2,https://doi.org/10.3802/jgo.2023.34.e11,https://api.labs.crossref.org/works/https://doi.org/10.3802/jgo.2023.34.e11?mailto=christian.hauschke@tib.eu,2023,article,True,91,Biogenesis and Functions of Circular RNAs,Life Sciences,Molecular Biology,Korean Society of Gynecologic Oncology,True,en,"Biochemistry, Genetics and Molecular Biology",Retraction
https://openalex.org/W4313290110,RETRACTED: Seismic impedance inversion in depth domain based on deep learning,Unconventional Resources,2,https://doi.org/10.1016/j.uncres.2022.12.004,https://api.labs.crossref.org/works/https://doi.org/10.1016/j.uncres.2022.12.004?mailto=christian.hauschke@tib.eu,2023,article,True,91,Seismic Waveform Inversion in Geophysics,Physical Sciences,Geophysics,Elsevier BV,True,en,Earth and Planetary Sciences,Crossmark Retraction
https://openalex.org/W4313590540,(Retracted) Transfer learning-based YOLOv3 model for road dense object detection,Journal of Electronic Imaging,2,https://doi.org/10.1117/1.jei.32.6.062505,https://api.labs.crossref.org/works/https://doi.org/10.1117/1.jei.32.6.062505?mailto=christian.hauschke@tib.eu,2023,article,True,91,Deep Learning in Computer Vision and Image Recognition,Physical Sciences,Computer Vision and Pattern Recognition,SPIE,True,en,Computer Science,Retraction
https://openalex.org/W4313594133,WITHDRAWN: Determination of the statistical distribution of drag and lift coefficients of refuse derived fuel by computer vision,Fuel,2,https://doi.org/10.1016/j.fuel.2022.127122,https://api.labs.crossref.org/works/https://doi.org/10.1016/j.fuel.2022.127122?mailto=christian.hauschke@tib.eu,2023,article,True,91,Ultrasonic Flow Measurement Techniques,Physical Sciences,Mechanics of Materials,Elsevier BV,True,en,Engineering,Crossmark Retraction
https://openalex.org/W4315643968,Interleukin-40 is a promising biomarker associated with type 2 diabetes mellitus risk,Immunology Letters,2,https://doi.org/10.1016/j.imlet.2023.01.006,https://api.labs.crossref.org/works/https://doi.org/10.1016/j.imlet.2023.01.006?mailto=christian.hauschke@tib.eu,2023,article,True,91,Inflammation and Obesity-Related Metabolic Disorders,Health Sciences,Epidemiology,Elsevier BV,False,en,Medicine,Expression of concern
https://openalex.org/W4317831263,The role of social circle COVID-19 illness and vaccination experiences in COVID-19 vaccination decisions: an online survey of the United States population,BMC Infectious Diseases,2,https://doi.org/10.1186/s12879-023-07998-3,https://api.labs.crossref.org/works/https://doi.org/10.1186/s12879-023-07998-3?mailto=christian.hauschke@tib.eu,2023,article,True,91,Factors Affecting Vaccine Hesitancy and Acceptance,Social Sciences,Health,BioMed Central,True,en,Social Sciences,Retraction
https://openalex.org/W4318250055,Transformer-based comparative multi-view illegal transaction detection,PLOS ONE,2,https://doi.org/10.1371/journal.pone.0276495,https://api.labs.crossref.org/works/https://doi.org/10.1371/journal.pone.0276495?mailto=christian.hauschke@tib.eu,2023,article,True,91,Handling Imbalanced Data in Classification Problems,Physical Sciences,Artificial Intelligence,Public Library of Science,True,en,Computer Science,Retraction
https://openalex.org/W4318686679,Genetic Analysis Reveals Different Mechanisms of IL-5 Involved in the Development of CAD in a Chinese Han Population,Oxidative Medicine and Cellular Longevity,2,https://doi.org/10.1155/2023/1700857,https://api.labs.crossref.org/works/https://doi.org/10.1155/2023/1700857?mailto=christian.hauschke@tib.eu,2023,article,True,91,Immunological Mechanisms in Atherosclerosis Development,Life Sciences,Immunology,Hindawi Publishing Corporation,True,en,Immunology and Microbiology,
https://openalex.org/W4318755684,Achieving near-Pt hydrogen production on defect nanocarbon<i>via</i>the synergy between carbon defects and heteroatoms,Chemical Communications,2,https://doi.org/10.1039/d2cc06895h,https://api.labs.crossref.org/works/https://doi.org/10.1039/d2cc06895h?mailto=christian.hauschke@tib.eu,2023,article,True,91,Electrocatalysis for Energy Conversion,Physical Sciences,"Renewable Energy, Sustainability and the Environment",Royal Society of Chemistry,False,en,Energy,
https://openalex.org/W4319072120,miR-141-3p Targeted SIRT1 to Inhibit Osteogenic Differentiation of Bone Marrow Mesenchymal Stem Cells,Stem Cells International,2,https://doi.org/10.1155/2023/9094092,https://api.labs.crossref.org/works/https://doi.org/10.1155/2023/9094092?mailto=christian.hauschke@tib.eu,2023,article,True,91,Role of Long Noncoding RNAs in Cancer and Development,Life Sciences,Cancer Research,Hindawi Publishing Corporation,True,en,"Biochemistry, Genetics and Molecular Biology",
https://openalex.org/W4319294099,"Sharing the Load by One Health: Integrating Canine Rabies Vaccination With Bovine Foot-and-Mouth Vaccination Program and Community Public Health Services in Rural Nilgiris District, Tamil Nadu, India.",PubMed,2,https://doi.org/10.4103/ijcm.ijcm_1438_21,https://api.labs.crossref.org/works/https://doi.org/10.4103/ijcm.ijcm_1438_21?mailto=christian.hauschke@tib.eu,2023,article,True,91,Rabies Virus Transmission and Control,Life Sciences,Virology,National Institutes of Health,False,en,Immunology and Microbiology,
https://openalex.org/W4319454531,Novel Prognostic Biomarkers for Cervical Squamous Cell Carcinoma and Endocervical Adenocarcinoma (CESC) Patients via Analysis of Competing Endogenous RNA (ceRNA) Network,Disease Markers,2,https://doi.org/10.1155/2023/1766080,https://api.labs.crossref.org/works/https://doi.org/10.1155/2023/1766080?mailto=christian.hauschke@tib.eu,2023,article,True,91,Role of Long Noncoding RNAs in Cancer and Development,Life Sciences,Cancer Research,Hindawi Publishing Corporation,True,en,"Biochemistry, Genetics and Molecular Biology",
https://openalex.org/W4319455878,Retracted Article: Parents' Supernatural Beliefs on Causes of Birth Defects: A Review from Islamic Perspective,Journal of Pediatric Genetics,2,https://doi.org/10.1055/s-0043-1761268,https://api.labs.crossref.org/works/https://doi.org/10.1055/s-0043-1761268?mailto=christian.hauschke@tib.eu,2023,article,True,91,Ethical Considerations in Pediatric Medical Decision-Making,Health Sciences,"Pediatrics, Perinatology and Child Health",Thieme Medical Publishers (Germany),False,en,Medicine,
https://openalex.org/W4319659179,RETRACTED: Deletion of the scavenger receptor Scarb1 in myeloid cells does not affect bone mass,Bone,2,https://doi.org/10.1016/j.bone.2023.116702,https://api.labs.crossref.org/works/https://doi.org/10.1016/j.bone.2023.116702?mailto=christian.hauschke@tib.eu,2023,article,True,91,Molecular Mechanisms of Osteoclast Differentiation and Bone Remodeling,Life Sciences,Molecular Biology,Elsevier BV,True,en,"Biochemistry, Genetics and Molecular Biology",
https://openalex.org/W4320482501,The Visceral Adiposity Index (VAI) and Lipid Accumulation Product (LAP) Are Predictors of Insulin Resistance and Hyperandrogenaemia in Obesity/Overweight Women with Polycystic Ovary Syndrome,BioMed Research International,2,https://doi.org/10.1155/2023/1508675,https://api.labs.crossref.org/works/https://doi.org/10.1155/2023/1508675?mailto=christian.hauschke@tib.eu,2023,article,True,91,Diagnosis and Management of Polycystic Ovary Syndrome,Health Sciences,Reproductive Medicine,Hindawi Publishing Corporation,True,en,Medicine,
https://openalex.org/W4320895079,Identification of Clinical Prognostic Regulators and Analysis of Ferroptosis-Related Signatures in the Tumor Immune Microenvironment in Lung Squamous Cell Carcinoma,Disease Markers,2,https://doi.org/10.1155/2023/9155944,https://api.labs.crossref.org/works/https://doi.org/10.1155/2023/9155944?mailto=christian.hauschke@tib.eu,2023,article,True,91,Role of Long Noncoding RNAs in Cancer and Development,Life Sciences,Cancer Research,Hindawi Publishing Corporation,True,en,"Biochemistry, Genetics and Molecular Biology",
https://openalex.org/W4320896027,Regulation of Chondrocyte Differentiation by miR-455-3p Secreted by Bone Marrow Stem Cells through Phosphatase and Tensin Homolog Deleted on Chromosome Ten/Phosphoinositide 3-Kinase-Protein Kinase B,Stem Cells International,2,https://doi.org/10.1155/2023/6738768,https://api.labs.crossref.org/works/https://doi.org/10.1155/2023/6738768?mailto=christian.hauschke@tib.eu,2023,article,True,91,Osteoarthritis and Cartilage Repair,Health Sciences,Rheumatology,Hindawi Publishing Corporation,True,en,Medicine,
https://openalex.org/W4321004130,Sodium thiosulfate through preserving mitochondrial dynamics ameliorates oxidative stress induced renal apoptosis and ferroptosis in 5/6 nephrectomized rats with chronic kidney diseases,PLOS ONE,2,https://doi.org/10.1371/journal.pone.0277652,https://api.labs.crossref.org/works/https://doi.org/10.1371/journal.pone.0277652?mailto=christian.hauschke@tib.eu,2023,article,True,91,Diagnosis and Treatment of Renal Artery Stenosis,Health Sciences,Pulmonary and Respiratory Medicine,Public Library of Science,True,en,Medicine,
https://openalex.org/W4321434203,Correlation between High Myopia Susceptibility and Polymorphisms of RASGRF1 Gene among College Students in Zhejiang,Journal of Environmental and Public Health,2,https://doi.org/10.1155/2023/6767410,https://api.labs.crossref.org/works/https://doi.org/10.1155/2023/6767410?mailto=christian.hauschke@tib.eu,2023,article,True,91,Global Epidemiology of Myopia and Visual Impairment,Health Sciences,Epidemiology,Hindawi Publishing Corporation,True,en,Medicine,
https://openalex.org/W4321446563,κ-Opioid Receptors Improve Vascular Endothelial Dysfunction in Salt-Sensitive Hypertension via PI3K/Akt/eNOS Signaling Pathway,Oxidative Medicine and Cellular Longevity,2,https://doi.org/10.1155/2023/5352959,https://api.labs.crossref.org/works/https://doi.org/10.1155/2023/5352959?mailto=christian.hauschke@tib.eu,2023,article,True,91,Effects of Dietary Sodium on Health,Health Sciences,Nutrition and Dietetics,Hindawi Publishing Corporation,True,en,Nursing,
https://openalex.org/W4321447055,"Integrative Nomogram of Computed Tomography Radiomics, Clinical, and Tumor Immune Features for Analysis of Disease-Free Survival of NSCLC Patients with Surgery",Journal of Oncology,2,https://doi.org/10.1155/2023/8607062,https://api.labs.crossref.org/works/https://doi.org/10.1155/2023/8607062?mailto=christian.hauschke@tib.eu,2023,article,True,91,Radiomics in Medical Imaging Analysis,Health Sciences,"Radiology, Nuclear Medicine and Imaging",Hindawi Publishing Corporation,True,en,Medicine,
https://openalex.org/W4321484734,The lncRNA XIST/miR-29b-3p/COL3A1 axis regulates central carbon metabolism in head and neck squamous cell carcinoma and is associated with poor tumor prognosis,Annals of Translational Medicine,2,https://doi.org/10.21037/atm-23-30,https://api.labs.crossref.org/works/https://doi.org/10.21037/atm-23-30?mailto=christian.hauschke@tib.eu,2023,article,True,91,Role of Long Noncoding RNAs in Cancer and Development,Life Sciences,Cancer Research,AME Publishing Company,True,en,"Biochemistry, Genetics and Molecular Biology",
https://openalex.org/W4323365173,Retracted: The Role of Educational Programs in the Development of Secondary Education (on the Example of Training Mathematics Teacher),"Mind, Brain, and Education",2,https://doi.org/10.1111/mbe.12349,https://api.labs.crossref.org/works/https://doi.org/10.1111/mbe.12349?mailto=christian.hauschke@tib.eu,2023,article,True,91,"Education, Innovation, and Sustainable Development",Social Sciences,Education,Wiley-Blackwell,False,en,Social Sciences,
https://openalex.org/W4323920659,<i>Retracted:</i> Microvascular resistance reserve in the presence of functionally significant epicardial stenosis and changes after revascularization,Physiological Reports,2,https://doi.org/10.14814/phy2.15627,https://api.labs.crossref.org/works/https://doi.org/10.14814/phy2.15627?mailto=christian.hauschke@tib.eu,2023,article,True,91,Advanced Cardiac Imaging Techniques and Diagnostics,Health Sciences,"Radiology, Nuclear Medicine and Imaging",Wiley-Blackwell,True,en,Medicine,
https://openalex.org/W4362456268,WITHDRAWN: JUN and ATF3 are deficient in prostate cancer patients and their delivery in vivo via lipid nanoparticles has therapeutic efficacy by enhancing immune surveillance,Pharmacological Research,2,https://doi.org/10.1016/j.phrs.2023.106753,https://api.labs.crossref.org/works/https://doi.org/10.1016/j.phrs.2023.106753?mailto=christian.hauschke@tib.eu,2023,article,True,91,Cancer Immunotherapy,Health Sciences,Oncology,Elsevier BV,True,en,Medicine,
https://openalex.org/W4362522626,The relationship of kinesiophobia with depression and anxiety in nursing homes.,PubMed,2,https://doi.org/10.26355/eurrev_202303_31764,https://api.labs.crossref.org/works/https://doi.org/10.26355/eurrev_202303_31764?mailto=christian.hauschke@tib.eu,2023,article,True,91,Gait Analysis and Fall Prevention in Elderly,Health Sciences,"Physical Therapy, Sports Therapy and Rehabilitation",National Institutes of Health,False,en,Health Professions,
https://openalex.org/W4366282695,Retracted: A Photoclick Thiol‐Ene Collagen‐Based Hydrogel Platform for Skeletal Muscle Tissue Engineering,Macromolecular Materials and Engineering,2,https://doi.org/10.1002/mame.202300029,https://api.labs.crossref.org/works/https://doi.org/10.1002/mame.202300029?mailto=christian.hauschke@tib.eu,2023,article,True,91,3D Bioprinting Technology,Physical Sciences,Biomedical Engineering,Wiley,True,en,Engineering,
https://openalex.org/W4366588620,Evaluation of the Anticancer Potential of Morus nigra and Ocimum basilicum Mixture against Different Cancer Cell Lines: An In Vitro Evaluation,BioMed Research International,2,https://doi.org/10.1155/2023/9337763,https://api.labs.crossref.org/works/https://doi.org/10.1155/2023/9337763?mailto=christian.hauschke@tib.eu,2023,article,True,91,Therapeutic Potential of Ayurvedic Medicine,Health Sciences,Complementary and alternative medicine,Hindawi Publishing Corporation,True,en,Medicine,
https://openalex.org/W4366607717,RETRACTED ARTICLE: Improved Deep Learning Method for Real-Time Ship Detection and Localization From SAR Image,Journal of the Indian Society of Remote Sensing,2,https://doi.org/10.1007/s12524-023-01689-x,https://api.labs.crossref.org/works/https://doi.org/10.1007/s12524-023-01689-x?mailto=christian.hauschke@tib.eu,2023,article,True,91,Deep Learning in Computer Vision and Image Recognition,Physical Sciences,Computer Vision and Pattern Recognition,Springer Science+Business Media,False,en,Computer Science,
https://openalex.org/W4366721981,Intelligent Control System Design of Ring Light via IOT Mobile Robot,Journal of Robotics,2,https://doi.org/10.1155/2023/4303194,https://api.labs.crossref.org/works/https://doi.org/10.1155/2023/4303194?mailto=christian.hauschke@tib.eu,2023,article,True,91,Embedded Systems and Data Acquisition,Physical Sciences,Control and Systems Engineering,Hindawi Publishing Corporation,True,en,Engineering,
https://openalex.org/W4367293146,Anti-fungal efficacy of Miswak Extract (Salvadora Persica) and commercial cleaner against Candida albicans on heat cured polymethylmethacrylate denture base,Journal of Applied Biomaterials & Functional Materials,2,https://doi.org/10.1177/22808000231165666,https://api.labs.crossref.org/works/https://doi.org/10.1177/22808000231165666?mailto=christian.hauschke@tib.eu,2023,article,True,91,Diagnosis and Management of Fungal Infections,Health Sciences,Infectious Diseases,SAGE Publishing,True,en,Medicine,
https://openalex.org/W4372183077,AZ63/Ti/Zr Nanocomposite for Bone-Related Biomedical Applications,BioMed Research International,2,https://doi.org/10.1155/2023/6297372,https://api.labs.crossref.org/works/https://doi.org/10.1155/2023/6297372?mailto=christian.hauschke@tib.eu,2023,article,True,91,Magnesium Alloys for Biomedical Applications,Physical Sciences,Biomaterials,Hindawi Publishing Corporation,True,en,Materials Science,
https://openalex.org/W4377013330,RETRACTED: Sulforaphane triggers iron overload-mediated ferroptosis in gastric carcinoma cells by activating the PI3K/IRP2/DMT1 pathway,Human & Experimental Toxicology,2,https://doi.org/10.1177/09603271231177295,https://api.labs.crossref.org/works/https://doi.org/10.1177/09603271231177295?mailto=christian.hauschke@tib.eu,2023,article,True,91,Mechanisms and Implications of Ferroptosis in Cancer,Health Sciences,Pulmonary and Respiratory Medicine,SAGE Publishing,True,en,Medicine,
https://openalex.org/W4377157828,Extended DPL-VIKOR Method for Risk Assessment of Technological Innovation Using Dual Probabilistic Linguistic Information,Journal of Mathematics,2,https://doi.org/10.1155/2023/7570984,https://api.labs.crossref.org/works/https://doi.org/10.1155/2023/7570984?mailto=christian.hauschke@tib.eu,2023,article,True,91,Multi-Criteria Decision Making,Social Sciences,Management Science and Operations Research,Hindawi Publishing Corporation,True,en,Decision Sciences,
https://openalex.org/W4377695019,WITHDRAWN: Machine Learning with Spatial Interpolation Techniques for Constructing 2-Dimensional Ozone Concentrations in Southern California during the COVID-19 Shutdown,Environmental Pollution,2,https://doi.org/10.1016/j.envpol.2023.121881,https://api.labs.crossref.org/works/https://doi.org/10.1016/j.envpol.2023.121881?mailto=christian.hauschke@tib.eu,2023,article,True,91,Low-Cost Air Quality Monitoring Systems,Physical Sciences,Environmental Engineering,Elsevier BV,True,en,Environmental Science,
https://openalex.org/W4377968583,RETRACTED: Effect of a variable laser beam profile system on productivity and surface quality of 316L stainless steel parts produced by Laser Powder Bed Fusion,CIRP Annals,2,https://doi.org/10.1016/j.cirp.2023.04.035,https://api.labs.crossref.org/works/https://doi.org/10.1016/j.cirp.2023.04.035?mailto=christian.hauschke@tib.eu,2023,article,True,91,Additive Manufacturing of Metallic Components,Physical Sciences,Mechanical Engineering,Elsevier BV,False,en,Engineering,
https://openalex.org/W4379382853,Part II: A step-by-step guide to latent class analysis,Journal of Clinical Epidemiology,2,https://doi.org/10.1016/j.jclinepi.2023.05.025,https://api.labs.crossref.org/works/https://doi.org/10.1016/j.jclinepi.2023.05.025?mailto=christian.hauschke@tib.eu,2023,article,True,91,Genomic Studies and Association Analyses,Life Sciences,Genetics,Elsevier BV,True,en,"Biochemistry, Genetics and Molecular Biology",
https://openalex.org/W4385075347,RETRACTED ARTICLE: LncRNA SOX21-AS1 accelerates endometrial carcinoma progression through the miR-7-5p/RAF1 pathway,World Journal of Surgical Oncology,2,https://doi.org/10.1186/s12957-023-03114-6,https://api.labs.crossref.org/works/https://doi.org/10.1186/s12957-023-03114-6?mailto=christian.hauschke@tib.eu,2023,article,True,91,Role of Long Noncoding RNAs in Cancer and Development,Life Sciences,Cancer Research,BioMed Central,True,en,"Biochemistry, Genetics and Molecular Biology",
https://openalex.org/W4385477182,RETRACTED: Dynamic Prediction of Outcomes for Youth at Clinical High Risk for Psychosis,JAMA Psychiatry,2,https://doi.org/10.1001/jamapsychiatry.2023.2378,https://api.labs.crossref.org/works/https://doi.org/10.1001/jamapsychiatry.2023.2378?mailto=christian.hauschke@tib.eu,2023,article,True,91,Schizophrenia Research and Treatment,Health Sciences,Psychiatry and Mental health,American Medical Association,False,en,Medicine,
https://openalex.org/W4385712153,"Study to compare the effect of casirivimab and imdevimab, remdesivir, and favipiravir on progression and multi-organ function of hospitalized COVID-19 patients",Open Medicine,2,https://doi.org/10.1515/med-2023-0768,https://api.labs.crossref.org/works/https://doi.org/10.1515/med-2023-0768?mailto=christian.hauschke@tib.eu,2023,article,True,91,Coronavirus Disease 2019,Health Sciences,Infectious Diseases,De Gruyter Open,True,en,Medicine,
https://openalex.org/W4385738473,Prediction of Ovarian Cancer Response to Therapy Based on Deep Learning Analysis of Histopathology Images,Cancers,2,https://doi.org/10.3390/cancers15164044,https://api.labs.crossref.org/works/https://doi.org/10.3390/cancers15164044?mailto=christian.hauschke@tib.eu,2023,article,True,91,Deep Learning in Medical Image Analysis,Physical Sciences,Artificial Intelligence,Multidisciplinary Digital Publishing Institute,True,en,Computer Science,
https://openalex.org/W4385948288,Google Bard Artificial Intelligence vs the 2022 Self-Assessment Study Program for Urology,Urology Practice,2,https://doi.org/10.1097/upj.0000000000000453,https://api.labs.crossref.org/works/https://doi.org/10.1097/upj.0000000000000453?mailto=christian.hauschke@tib.eu,2023,article,True,91,Artificial Intelligence in Medicine,Health Sciences,Health Informatics,Lippincott Williams & Wilkins,False,en,Medicine,
https://openalex.org/W2038982119,Altered Regulation of ERK1b by MEK1 and PTP-SL and Modified Elk1 Phosphorylation by ERK1b Are Caused by Abrogation of the Regulatory C-terminal Sequence of ERKs,Journal of Biological Chemistry,47,https://doi.org/10.1074/jbc.m105995200,https://api.labs.crossref.org/works/https://doi.org/10.1074/jbc.m105995200?mailto=christian.hauschke@tib.eu,2001,article,True,92,Mammalian MAP Kinase Signaling Pathways,Life Sciences,Molecular Biology,Elsevier BV,True,en,"Biochemistry, Genetics and Molecular Biology",
https://openalex.org/W2005137750,Morphologic and Histochemical Evaluation of Muscle in Patients with Chronic Pulmonary Emphysema Manifesting Generalized Emaciation,European Neurology,46,https://doi.org/10.1159/000117421,https://api.labs.crossref.org/works/https://doi.org/10.1159/000117421?mailto=christian.hauschke@tib.eu,1997,article,True,92,Standardisation and Management of COPD,Health Sciences,Pulmonary and Respiratory Medicine,Karger Publishers,True,en,Medicine,
https://openalex.org/W2053827627,Perylene: A promising organic field-effect transistor material,Applied Physics Letters,46,https://doi.org/10.1063/1.1329634,https://api.labs.crossref.org/works/https://doi.org/10.1063/1.1329634?mailto=christian.hauschke@tib.eu,2000,article,True,92,Organic Solar Cell Technology,Physical Sciences,Electrical and Electronic Engineering,American Institute of Physics,False,en,Engineering,
https://openalex.org/W2072846167,RETRACTED: Influence of immobilization upon calcium metabolism in the week following hemiplegic stroke,Journal of the Neurological Sciences,46,https://doi.org/10.1016/s0022-510x(00)00298-7,https://api.labs.crossref.org/works/https://doi.org/10.1016/s0022-510x(00)00298-7?mailto=christian.hauschke@tib.eu,2000,article,True,92,Vitamin D and Health Outcomes,Health Sciences,Pathology and Forensic Medicine,Elsevier BV,False,en,Medicine,
https://openalex.org/W2112727913,"Prevention of nausea and vomiting with granisetron, droperidol and metoclopramide during and after spinal anaesthesia for caesarean section: A randomized, double‐blind, placebo‐controlled trial",Acta Anaesthesiologica Scandinavica,46,https://doi.org/10.1111/j.1399-6576.1998.tb05350.x,https://api.labs.crossref.org/works/https://doi.org/10.1111/j.1399-6576.1998.tb05350.x?mailto=christian.hauschke@tib.eu,1998,article,True,92,Prevention and Management of Postoperative Nausea and Vomiting,Health Sciences,Surgery,Wiley-Blackwell,False,en,Medicine,
https://openalex.org/W2144313314,RETRACTED: Volume replacement in the surgical patient—does the type of solution make a difference?,British Journal of Anaesthesia,46,https://doi.org/10.1093/bja/84.6.783,https://api.labs.crossref.org/works/https://doi.org/10.1093/bja/84.6.783?mailto=christian.hauschke@tib.eu,2000,article,True,92,Optimization of Perioperative Fluid Therapy,Health Sciences,Surgery,Elsevier BV,True,en,Medicine,
https://openalex.org/W1579620420,Lipid Phosphate Phosphatase-1 and Ca2+ Control Lysophosphatidate Signaling through EDG-2 Receptors,Journal of Biological Chemistry,45,https://doi.org/10.1074/jbc.m003211200,https://api.labs.crossref.org/works/https://doi.org/10.1074/jbc.m003211200?mailto=christian.hauschke@tib.eu,2000,article,True,92,Sphingolipid Signalling and Metabolism in Health and Disease,Life Sciences,Molecular Biology,Elsevier BV,True,en,"Biochemistry, Genetics and Molecular Biology",
https://openalex.org/W1704507614,Mechanical Properties of Bulk Amorphous Zr–Al–Cu–Ni–Ag Alloys Containing Nanoscale Quasicrystalline Particles,Materials Transactions Jim,45,https://doi.org/10.2320/matertrans1989.40.1382,https://api.labs.crossref.org/works/https://doi.org/10.2320/matertrans1989.40.1382?mailto=christian.hauschke@tib.eu,1999,article,True,92,Mechanical Properties of Metallic Glasses,Physical Sciences,Mechanical Engineering,Japan Institute of Metals,True,en,Engineering,
https://openalex.org/W2086207797,RETRACTED: Toward an Optimal Oligosaccharide Ligand for Rat Natural Killer Cell Activation Receptor NKR-P1,Biochemical and Biophysical Research Communications,45,https://doi.org/10.1006/bbrc.2001.5537,https://api.labs.crossref.org/works/https://doi.org/10.1006/bbrc.2001.5537?mailto=christian.hauschke@tib.eu,2001,article,True,92,Natural Killer Cells in Immunity,Life Sciences,Immunology,Elsevier BV,True,en,Immunology and Microbiology,
