id,display_name,primary_location_display_name,cited_by_count,doi,crossref_call,publication_year,type,is_retracted,cited_by_percentile_year_min,primary_topic_display_name,primary_topic_domain_display_name,primary_topic_subfield_display_name,primary_location_source_host_organization_name,open_access_is_oa,language,primary_topic_field_display_name,update_nature
https://openalex.org/W1703086136,Notice of Retraction: Effect of Different Matters in Water on Accumulation of Dieldrin by Triolein-Embedded Membrane,,0,https://doi.org/10.1109/icbbe.2011.5780952,https://api.labs.crossref.org/works/https://doi.org/10.1109/icbbe.2011.5780952?mailto=christian.hauschke@tib.eu,2011,article,True,0,Impact of Persistent Organic Pollutants on Environment and Health,Physical Sciences,"Health, Toxicology and Mutagenesis",,False,en,Environmental Science,
https://openalex.org/W1703447839,Notice of Retraction: Reflections on the Cultivating Eligible Undergraduates Triggered by Difficult Newly Graduates Employment Situation,,0,https://doi.org/10.1109/paccs.2011.5990310,https://api.labs.crossref.org/works/https://doi.org/10.1109/paccs.2011.5990310?mailto=christian.hauschke@tib.eu,2011,article,True,0,Impact of Technology on Education and Training,Physical Sciences,Information Systems,,False,en,Computer Science,
https://openalex.org/W1703919251,Notice of Retraction: Study of Selenium Enrichment of Auricularia auricula-Judae (Wooden Ear Fungus),,0,https://doi.org/10.1109/icbbe.2011.5781516,https://api.labs.crossref.org/works/https://doi.org/10.1109/icbbe.2011.5781516?mailto=christian.hauschke@tib.eu,2011,article,True,0,Medicinal Mushrooms: Antitumor and Immunomodulating Properties,Health Sciences,Pharmacology,,False,en,Medicine,
https://openalex.org/W1704427037,Notice of Retraction: On the application of the case study in international settlement teaching,,0,https://doi.org/10.1109/icebeg.2011.5887127,https://api.labs.crossref.org/works/https://doi.org/10.1109/icebeg.2011.5887127?mailto=christian.hauschke@tib.eu,2011,article,True,0,Human Rights and International Relations,Social Sciences,Political Science and International Relations,,False,en,Social Sciences,
https://openalex.org/W1705715650,Notice of Retraction: Application of the cooling tower free cooling system in the field of building energy efficiency,,0,https://doi.org/10.1109/icetce.2011.5774696,https://api.labs.crossref.org/works/https://doi.org/10.1109/icetce.2011.5774696?mailto=christian.hauschke@tib.eu,2011,article,True,0,Thermochemical Energy Storage and Sorption Technologies,Physical Sciences,Mechanical Engineering,,False,en,Engineering,
https://openalex.org/W1706113006,Notice of Retraction: Comparison of higher education patterns based on opportunity cost,,0,https://doi.org/10.1109/icebeg.2011.5881301,https://api.labs.crossref.org/works/https://doi.org/10.1109/icebeg.2011.5881301?mailto=christian.hauschke@tib.eu,2011,article,True,0,Vocational Education and Training in Australia,Social Sciences,Education,,False,en,Social Sciences,
https://openalex.org/W1706512847,Notice of Retraction: Transition of economic development pattern and population structure analysis,,0,https://doi.org/10.1109/icbmei.2011.5914482,https://api.labs.crossref.org/works/https://doi.org/10.1109/icbmei.2011.5914482?mailto=christian.hauschke@tib.eu,2011,article,True,0,Institutions and Economic Growth: Empirical Investigations and Theories,Social Sciences,Economics and Econometrics,,False,en,"Economics, Econometrics and Finance",
https://openalex.org/W1706577735,Notice of Retraction: An analysis and managerial application on work-family conflict,,0,https://doi.org/10.1109/icbmei.2011.5916993,https://api.labs.crossref.org/works/https://doi.org/10.1109/icbmei.2011.5916993?mailto=christian.hauschke@tib.eu,2011,article,True,0,The Dynamics of Work and Family Interactions,Social Sciences,Sociology and Political Science,,False,en,Social Sciences,
https://openalex.org/W1707350643,Notice of Retraction: Discussion on China's anti-dumping system of services trade,,0,https://doi.org/10.1109/icebeg.2011.5884471,https://api.labs.crossref.org/works/https://doi.org/10.1109/icebeg.2011.5884471?mailto=christian.hauschke@tib.eu,2011,article,True,0,Impact of International Trade on Productivity and Growth,Social Sciences,"General Economics, Econometrics and Finance",,False,en,"Economics, Econometrics and Finance",
https://openalex.org/W1709094539,Notice of Retraction Bayesian credible limits of the reliability and its applications,,0,https://doi.org/10.1109/qr2mse.2013.6625589,https://api.labs.crossref.org/works/https://doi.org/10.1109/qr2mse.2013.6625589?mailto=christian.hauschke@tib.eu,2013,article,True,0,Process Fault Detection and Diagnosis in Industries,Physical Sciences,Control and Systems Engineering,,False,en,Engineering,
https://openalex.org/W1709306993,Notice of Retraction: Emergy analysis of ecological-economic system in Yueyang city,,0,https://doi.org/10.1109/icebeg.2011.5881316,https://api.labs.crossref.org/works/https://doi.org/10.1109/icebeg.2011.5881316?mailto=christian.hauschke@tib.eu,2011,article,True,0,Urban Metabolism and Sustainability Assessment,Physical Sciences,Environmental Engineering,,False,en,Environmental Science,
https://openalex.org/W1709476560,Notice of Retraction: Application of Chu culture in modern product design,,0,https://doi.org/10.1109/icpim.2011.5983710,https://api.labs.crossref.org/works/https://doi.org/10.1109/icpim.2011.5983710?mailto=christian.hauschke@tib.eu,2011,article,True,0,Color Psychology and Product Design,Social Sciences,Social Psychology,,False,en,Psychology,
https://openalex.org/W1710466981,"Notice of Retraction: The Meaning of the Inflammation Parameters in Exhaled Air from the Lower and Upper Respiratory Tract (Among Active and Passive Smokers, Allergic Rhinitis)",,0,https://doi.org/10.1109/icbbe.2011.5781391,https://api.labs.crossref.org/works/https://doi.org/10.1109/icbbe.2011.5781391?mailto=christian.hauschke@tib.eu,2011,article,True,0,Standardisation and Management of COPD,Health Sciences,Pulmonary and Respiratory Medicine,,False,en,Medicine,
https://openalex.org/W1711292747,Notice of Retraction: Study of an analysis method on the competitive situation of Chinese passenger car market,,0,https://doi.org/10.1109/icebeg.2011.5882675,https://api.labs.crossref.org/works/https://doi.org/10.1109/icebeg.2011.5882675?mailto=christian.hauschke@tib.eu,2011,article,True,0,Rebound Effect on Energy Efficiency and Consumption,Physical Sciences,"Renewable Energy, Sustainability and the Environment",,False,en,Energy,
https://openalex.org/W1712309533,Notice of Retraction: Effect of Nitrogen and Phosphor Removal in a UCT-HMBR and Its Influencing Factors,,0,https://doi.org/10.1109/icbbe.2011.5781007,https://api.labs.crossref.org/works/https://doi.org/10.1109/icbbe.2011.5781007?mailto=christian.hauschke@tib.eu,2011,article,True,0,Chemistry and Applications of Metal-Organic Frameworks,Physical Sciences,Inorganic Chemistry,,False,en,Chemistry,
https://openalex.org/W1712725713,Notice of Retraction: Knowledge diffusion based on social relationship network,,0,https://doi.org/10.1109/icebeg.2011.5881536,https://api.labs.crossref.org/works/https://doi.org/10.1109/icebeg.2011.5881536?mailto=christian.hauschke@tib.eu,2011,article,True,0,Automatic Keyword Extraction from Textual Data,Physical Sciences,Artificial Intelligence,,False,en,Computer Science,
https://openalex.org/W1715204996,Notice of Retraction: Experiment Study on Flocculation Process and Settling Velocity of Cohesive Sediment,,0,https://doi.org/10.1109/icbbe.2011.5781215,https://api.labs.crossref.org/works/https://doi.org/10.1109/icbbe.2011.5781215?mailto=christian.hauschke@tib.eu,2011,article,True,0,Aeolian Geomorphology and Wind Erosion Dynamics,Physical Sciences,Earth-Surface Processes,,False,en,Earth and Planetary Sciences,
https://openalex.org/W1715617803,Notice of Retraction: Industry status analysis based on input-output method,,0,https://doi.org/10.1109/icpim.2011.5983608,https://api.labs.crossref.org/works/https://doi.org/10.1109/icpim.2011.5983608?mailto=christian.hauschke@tib.eu,2011,article,True,0,Life Cycle Assessment and Environmental Impact Analysis,Physical Sciences,Environmental Engineering,,False,en,Environmental Science,
https://openalex.org/W1716773960,Notice of Retraction: Empirical analysis of financial development and income inequality in China,,0,https://doi.org/10.1109/icebeg.2011.5882124,https://api.labs.crossref.org/works/https://doi.org/10.1109/icebeg.2011.5882124?mailto=christian.hauschke@tib.eu,2011,article,True,0,Income Inequality and Poverty Dynamics,Social Sciences,Sociology and Political Science,,False,en,Social Sciences,
https://openalex.org/W1718591085,Notice of Retraction The study on equipment maintenance support evaluation system,,0,https://doi.org/10.1109/icnc.2011.6022049,https://api.labs.crossref.org/works/https://doi.org/10.1109/icnc.2011.6022049?mailto=christian.hauschke@tib.eu,2011,article,True,0,Fault Diagnosis in Complex Systems,Physical Sciences,Control and Systems Engineering,,False,en,Engineering,
https://openalex.org/W1718980580,Notice of Retraction: The Study on the Migration and Distribution of Heavy Metals in Soils,,0,https://doi.org/10.1109/icbbe.2011.5781345,https://api.labs.crossref.org/works/https://doi.org/10.1109/icbbe.2011.5781345?mailto=christian.hauschke@tib.eu,2011,article,True,0,Ecological Assessment and Urban Development,Physical Sciences,Ecology,,False,en,Environmental Science,
https://openalex.org/W1720455153,Notice of Retraction: The corporate-level strategy theory's evolution and new idea,,0,https://doi.org/10.1109/icebeg.2011.5885322,https://api.labs.crossref.org/works/https://doi.org/10.1109/icebeg.2011.5885322?mailto=christian.hauschke@tib.eu,2011,article,True,0,Coopetition in Business Networks and Innovation,Social Sciences,Strategy and Management,,False,en,"Business, Management and Accounting",
https://openalex.org/W1720627984,Notice of Retraction: Study on QTL Identification Associated with Plant Height in Maize (Zea mays L.),,0,https://doi.org/10.1109/icbbe.2011.5780076,https://api.labs.crossref.org/works/https://doi.org/10.1109/icbbe.2011.5780076?mailto=christian.hauschke@tib.eu,2011,article,True,0,Genetic Architecture of Quantitative Traits,Life Sciences,Genetics,,False,en,"Biochemistry, Genetics and Molecular Biology",
https://openalex.org/W1722589186,Notice of Retraction Effectiveness evaluation research of quality management system,,0,https://doi.org/10.1109/qr2mse.2013.6625803,https://api.labs.crossref.org/works/https://doi.org/10.1109/qr2mse.2013.6625803?mailto=christian.hauschke@tib.eu,2013,article,True,0,Comprehensive Assessment of Safety in Energy and Infrastructure,Physical Sciences,"Safety, Risk, Reliability and Quality",,False,en,Engineering,
https://openalex.org/W1723406844,Notice of Retraction: A study for the quantitative risk management of trust investment company,,0,https://doi.org/10.1109/icebeg.2011.5881678,https://api.labs.crossref.org/works/https://doi.org/10.1109/icebeg.2011.5881678?mailto=christian.hauschke@tib.eu,2011,article,True,0,Comprehensive Assessment of Safety in Energy and Infrastructure,Physical Sciences,"Safety, Risk, Reliability and Quality",,False,en,Engineering,
https://openalex.org/W1723542478,Notice of Retraction: Investigation of Plankton in Ballast Water of Two Chinese Domestic Voyages,,0,https://doi.org/10.1109/icbbe.2011.5781210,https://api.labs.crossref.org/works/https://doi.org/10.1109/icbbe.2011.5781210?mailto=christian.hauschke@tib.eu,2011,article,True,0,Marine Invasions and Biodiversity Loss in Mediterranean Sea,Physical Sciences,Global and Planetary Change,,False,en,Environmental Science,
https://openalex.org/W1725626076,"Notice of Retraction: Increase N,P,K Use Efficiency by Interaction of Controlled-Release N and K",,0,https://doi.org/10.1109/icbbe.2011.5781353,https://api.labs.crossref.org/works/https://doi.org/10.1109/icbbe.2011.5781353?mailto=christian.hauschke@tib.eu,2011,article,True,0,Design and Application of Intelligent Monitoring Systems,Physical Sciences,Control and Systems Engineering,,False,en,Engineering,
https://openalex.org/W1726643949,Notice of Retraction: Study on the relationship between redistributional fiscal expenditure and disparity between urban and rural area,,0,https://doi.org/10.1109/icebeg.2011.5882460,https://api.labs.crossref.org/works/https://doi.org/10.1109/icebeg.2011.5882460?mailto=christian.hauschke@tib.eu,2011,article,True,0,Impact of Infrastructure and Taxation on Economic Growth,Social Sciences,Economics and Econometrics,,False,en,"Economics, Econometrics and Finance",
https://openalex.org/W1726772210,Notice of Retraction Generation of the radar bright band and its stimulation analysis: Effection of the complex refractive index and raindrops final velocity,,0,https://doi.org/10.1109/icnc.2011.6022393,https://api.labs.crossref.org/works/https://doi.org/10.1109/icnc.2011.6022393?mailto=christian.hauschke@tib.eu,2011,article,True,0,Satellite-Based Precipitation Estimation and Validation,Physical Sciences,Atmospheric Science,,False,en,Earth and Planetary Sciences,
https://openalex.org/W1726934093,Notice of Retraction: Modeling of Water Pollutants Diffusion in Different Flow States,,0,https://doi.org/10.1109/icbbe.2011.5780742,https://api.labs.crossref.org/works/https://doi.org/10.1109/icbbe.2011.5780742?mailto=christian.hauschke@tib.eu,2011,article,True,0,Multiscale Methods for Heterogeneous Systems,Physical Sciences,Computational Theory and Mathematics,,False,en,Computer Science,
https://openalex.org/W1727082937,Notice of Retraction: Preparation and Acute Toxicological Effect of Hydrolyzed Collagen from Tilapia Scales,,0,https://doi.org/10.1109/icbbe.2011.5780072,https://api.labs.crossref.org/works/https://doi.org/10.1109/icbbe.2011.5780072?mailto=christian.hauschke@tib.eu,2011,article,True,0,Collagen Structure and Applications,Physical Sciences,Biomaterials,,False,en,Materials Science,
https://openalex.org/W1727262637,Notice of Retraction: Analysis on competitiveness of software outsourcing industry in Hangzhou,,0,https://doi.org/10.1109/icebeg.2011.5887035,https://api.labs.crossref.org/works/https://doi.org/10.1109/icebeg.2011.5887035?mailto=christian.hauschke@tib.eu,2011,article,True,0,Information Systems Outsourcing and Offshoring,Social Sciences,Management Information Systems,,False,en,"Business, Management and Accounting",
https://openalex.org/W1727297505,Notice of Retraction: Empirical study of individual influence on team knowledge sharing,,0,https://doi.org/10.1109/icebeg.2011.5881509,https://api.labs.crossref.org/works/https://doi.org/10.1109/icebeg.2011.5881509?mailto=christian.hauschke@tib.eu,2011,article,True,0,Knowledge Sharing in Virtual Communities,Social Sciences,Communication,,False,en,Social Sciences,
https://openalex.org/W1727423042,Notice of Retraction: Fingerprint Construction in Several Elite Aloe Varieties,,0,https://doi.org/10.1109/icbbe.2011.5780073,https://api.labs.crossref.org/works/https://doi.org/10.1109/icbbe.2011.5780073?mailto=christian.hauschke@tib.eu,2011,article,True,0,Biological Properties of Aloe Vera and Related Compounds,Life Sciences,Plant Science,,False,en,Agricultural and Biological Sciences,
https://openalex.org/W1727690322,Notice of Retraction: The effect of self-awareness on self-disclosure and intimacy of college student in computer-mediated communication,,0,https://doi.org/10.1109/icebeg.2011.5887203,https://api.labs.crossref.org/works/https://doi.org/10.1109/icebeg.2011.5887203?mailto=christian.hauschke@tib.eu,2011,article,True,0,Temporal Dynamics of Team Processes and Performance,Social Sciences,Social Psychology,,False,en,Psychology,
https://openalex.org/W1728803602,Notice of Retraction: Theoretical analysis of coordinating mechanisms for financial policies for China — ASEAN Free Trade Area,,0,https://doi.org/10.1109/icbmei.2011.5920523,https://api.labs.crossref.org/works/https://doi.org/10.1109/icbmei.2011.5920523?mailto=christian.hauschke@tib.eu,2011,article,True,0,Impact of International Trade on Productivity and Growth,Social Sciences,"General Economics, Econometrics and Finance",,False,en,"Economics, Econometrics and Finance",
https://openalex.org/W1729313480,"Notice of Retraction: Income fluctuation, risk coping strategy and poverty trap: An empirical study from northeast Sichuan province",,0,https://doi.org/10.1109/icebeg.2011.5882608,https://api.labs.crossref.org/works/https://doi.org/10.1109/icebeg.2011.5882608?mailto=christian.hauschke@tib.eu,2011,article,True,0,Risk Management and Vulnerability in Agriculture,Life Sciences,Soil Science,,False,en,Agricultural and Biological Sciences,
https://openalex.org/W1731453029,Notice of Retraction: Strategies of FDI to enhance China's economic competitiveness,,0,https://doi.org/10.1109/icebeg.2011.5881379,https://api.labs.crossref.org/works/https://doi.org/10.1109/icebeg.2011.5881379?mailto=christian.hauschke@tib.eu,2011,article,True,0,International Business Strategy in Emerging Economies,Social Sciences,Strategy and Management,,False,en,"Business, Management and Accounting",
https://openalex.org/W1732832494,Notice of Retraction: The integration of competitive intelligence and enterprise early warning,,0,https://doi.org/10.1109/icebeg.2011.5881868,https://api.labs.crossref.org/works/https://doi.org/10.1109/icebeg.2011.5881868?mailto=christian.hauschke@tib.eu,2011,article,True,0,Impact and Practices of Competitive Intelligence,Social Sciences,Strategy and Management,,False,en,"Business, Management and Accounting",
https://openalex.org/W1732898277,Notice of Retraction: Emotionalized design in web-based curriculum,,0,https://doi.org/10.1109/icebeg.2011.5881505,https://api.labs.crossref.org/works/https://doi.org/10.1109/icebeg.2011.5881505?mailto=christian.hauschke@tib.eu,2011,article,True,0,Physics of the Mind and Cognitive Science,Life Sciences,Cognitive Neuroscience,,False,en,Neuroscience,
https://openalex.org/W1733611200,Notice of Retraction: The application of the three-dimensional management view on the innovative product marketing channel operation in modern telecom enterprises,,0,https://doi.org/10.1109/icpim.2011.5983629,https://api.labs.crossref.org/works/https://doi.org/10.1109/icpim.2011.5983629?mailto=christian.hauschke@tib.eu,2011,article,True,0,Coopetition in Business Networks and Innovation,Social Sciences,Strategy and Management,,False,en,"Business, Management and Accounting",
https://openalex.org/W1733854552,Notice of Retraction Evaluation of avionic system based on OLS-RBF,,0,https://doi.org/10.1109/icnc.2011.6022116,https://api.labs.crossref.org/works/https://doi.org/10.1109/icnc.2011.6022116?mailto=christian.hauschke@tib.eu,2011,article,True,0,Spatial Data Mining and Cloud Model Applications,Physical Sciences,Information Systems,,False,en,Computer Science,
https://openalex.org/W1734005956,Notice of Retraction: Develop Urban Forest Shelter Belts to Prevent NPS Pollution in Coastal Region,,0,https://doi.org/10.1109/icbbe.2011.5781285,https://api.labs.crossref.org/works/https://doi.org/10.1109/icbbe.2011.5781285?mailto=christian.hauschke@tib.eu,2011,article,True,0,Meta-analysis in Ecology and Agriculture Research,Life Sciences,"Ecology, Evolution, Behavior and Systematics",,False,en,Agricultural and Biological Sciences,
