id,display_name,primary_location_display_name,cited_by_count,doi,crossref_call,publication_year,type,is_retracted,cited_by_percentile_year_min,primary_topic_display_name,primary_topic_domain_display_name,primary_topic_subfield_display_name,primary_location_source_host_organization_name,open_access_is_oa,language,primary_topic_field_display_name,update_nature
https://openalex.org/W2094390624,Diagnostic Performance of Computed Tomography for Preoperative Staging of Patients with Non-endometrioid Carcinomas of the Uterine Corpus,Annals of Surgical Oncology,5,https://doi.org/10.1245/s10434-015-4410-x,https://api.labs.crossref.org/works/https://doi.org/10.1245/s10434-015-4410-x?mailto=christian.hauschke@tib.eu,2015,article,True,84,Gynecologic Oncology,Health Sciences,Obstetrics and Gynecology,Springer Science+Business Media,True,en,Medicine,Expression of concern
https://openalex.org/W2095248512,RETRACTED ARTICLE: Effect of calcium and silicate application on pathogenicity of Erwinia carotovora subsp. carotovora in Zantedeschia spp.,"Horticulture, Environment, and Biotechnology",5,https://doi.org/10.1007/s13580-013-0059-1,https://api.labs.crossref.org/works/https://doi.org/10.1007/s13580-013-0059-1?mailto=christian.hauschke@tib.eu,2013,article,True,83,Role of Silicon in Plant Biology and Ecology,Life Sciences,Plant Science,Springer Science+Business Media,False,en,Agricultural and Biological Sciences,Retraction;Crossmark Retraction
https://openalex.org/W2095259632,RETRACTED: Modified U-shaped ileal neobladder after radical cystectomy: Assessment of functional outcomes and complications in Chinese patients,Urologic Oncology: Seminars and Original Investigations,5,https://doi.org/10.1016/j.urolonc.2012.05.009,https://api.labs.crossref.org/works/https://doi.org/10.1016/j.urolonc.2012.05.009?mailto=christian.hauschke@tib.eu,2013,article,True,83,Diagnosis and Treatment of Bladder Cancer,Health Sciences,Surgery,Elsevier BV,True,en,Medicine,Retraction
https://openalex.org/W2100095613,Additive effect of propofol and fentanyl precipitating cardiogenic shock,Journal of Pharmacology and Pharmacotherapeutics,5,https://doi.org/10.4103/0976-500x.114612,https://api.labs.crossref.org/works/https://doi.org/10.4103/0976-500x.114612?mailto=christian.hauschke@tib.eu,2013,article,True,83,Anesthesia and Sedation Management,Health Sciences,Anesthesiology and Pain Medicine,SAGE Publishing,True,en,Medicine,Retraction
https://openalex.org/W2103437059,"Retracted Article: Multifunctional tin dioxide materials: advances in preparation strategies, microstructure, and performance",Chemical Communications,5,https://doi.org/10.1039/c4cc06970f,https://api.labs.crossref.org/works/https://doi.org/10.1039/c4cc06970f?mailto=christian.hauschke@tib.eu,2015,article,True,84,Gas Sensing Technology and Materials,Physical Sciences,Electrical and Electronic Engineering,Royal Society of Chemistry,False,en,Engineering,Retraction
https://openalex.org/W2108808901,RETRACTED ARTICLE: Collecting duct carcinoma of the kidney: a clinicopathological study of five cases,Diagnostic Pathology,5,https://doi.org/10.1186/1746-1596-8-96,https://api.labs.crossref.org/works/https://doi.org/10.1186/1746-1596-8-96?mailto=christian.hauschke@tib.eu,2013,article,True,83,Renal Cell Carcinoma,Health Sciences,Pulmonary and Respiratory Medicine,BioMed Central,True,en,Medicine,Retraction
https://openalex.org/W2114750645,RETRACTED: Nicorandil vs nifedipine for the treatment of preterm labour: a randomized clinical trial,European Journal of Obstetrics & Gynecology and Reproductive Biology,5,https://doi.org/10.1016/j.ejogrb.2015.09.038,https://api.labs.crossref.org/works/https://doi.org/10.1016/j.ejogrb.2015.09.038?mailto=christian.hauschke@tib.eu,2015,article,True,84,Epidemiology and Causes of Preterm Birth,Health Sciences,Epidemiology,Elsevier BV,False,en,Medicine,Retraction;Crossmark Retraction
https://openalex.org/W2114834447,Meta-analysis of the association between GSTT1 null genotype and risk of nasopharyngeal carcinoma in Chinese,Tumor Biology,5,https://doi.org/10.1007/s13277-013-1047-x,https://api.labs.crossref.org/works/https://doi.org/10.1007/s13277-013-1047-x?mailto=christian.hauschke@tib.eu,2013,article,True,83,Role of Glutathione in Oxidative Stress Response,Life Sciences,Molecular Biology,SAGE Publishing,False,en,"Biochemistry, Genetics and Molecular Biology",Retraction
https://openalex.org/W2115373662,RETRACTED ARTICLE: Explanation of liquefaction in after shock of the 2011 great east Japan earthquake using numerical analysis,Natural Hazards,5,https://doi.org/10.1007/s11069-014-1289-y,https://api.labs.crossref.org/works/https://doi.org/10.1007/s11069-014-1289-y?mailto=christian.hauschke@tib.eu,2014,article,True,84,Soil Mechanics in Geotechnical Engineering Practice,Physical Sciences,Civil and Structural Engineering,Springer Science+Business Media,False,en,Engineering,Retraction;Crossmark Retraction
https://openalex.org/W2124475604,Time course of antiproteinuric effect of aliskiren in arterial hypertension associated with type 2 diabetes and microalbuminuria,Expert Opinion on Pharmacotherapy,5,https://doi.org/10.1517/14656566.2013.772981,https://api.labs.crossref.org/works/https://doi.org/10.1517/14656566.2013.772981?mailto=christian.hauschke@tib.eu,2013,article,True,83,Management of Primary Aldosteronism,Health Sciences,"Endocrinology, Diabetes and Metabolism",Taylor & Francis,False,en,Medicine,Expression of concern
https://openalex.org/W2126621990,"<i>Retracted</i>: Determination of 4‐hydroxy‐2‐nonenal in serum by high‐performance liquid chromatography with fluorescence detection after pre‐column derivatization using 4‐(<i>N</i>,<i>N</i>‐dimethylaminosulfonyl)‐7‐hydrazino‐2, 1,3‐benzoxadiazole",Biomedical Chromatography,5,https://doi.org/10.1002/bmc.3166,https://api.labs.crossref.org/works/https://doi.org/10.1002/bmc.3166?mailto=christian.hauschke@tib.eu,2014,article,True,84,Role of Oxidative Stress in Health and Disease,Health Sciences,Biochemistry,Wiley,False,en,Medicine,Retraction
https://openalex.org/W2128067527,RETRACTED ARTICLE: Recent developments in DNA vaccination approaches against poultry coccidiosis and its future endeavours,Worlds Poultry Science Journal,5,https://doi.org/10.1017/s0043933914000336,https://api.labs.crossref.org/works/https://doi.org/10.1017/s0043933914000336?mailto=christian.hauschke@tib.eu,2014,article,True,84,Poultry Coccidiosis Research and Control,Life Sciences,Animal Science and Zoology,Taylor & Francis,False,en,Agricultural and Biological Sciences,Retraction
https://openalex.org/W2128279480,Activation of IK1 Channel by Zacopride Attenuates Left Ventricular Remodeling in Rats With Myocardial Infarction,Journal of Cardiovascular Pharmacology,5,https://doi.org/10.1097/fjc.0000000000000127,https://api.labs.crossref.org/works/https://doi.org/10.1097/fjc.0000000000000127?mailto=christian.hauschke@tib.eu,2014,article,True,84,Molecular Mechanisms of Cardiac Arrhythmias,Health Sciences,Cardiology and Cardiovascular Medicine,Lippincott Williams & Wilkins,False,en,Medicine,Retraction
https://openalex.org/W2130417219,The Rational Third-Kind Chebyshev Pseudospectral Method for the Solution of the Thomas-Fermi Equation over Infinite Interval,Mathematical Problems in Engineering,5,https://doi.org/10.1155/2013/537810,https://api.labs.crossref.org/works/https://doi.org/10.1155/2013/537810?mailto=christian.hauschke@tib.eu,2013,article,True,83,Anomalous Diffusion Modeling and Analysis,Physical Sciences,Modeling and Simulation,Hindawi Publishing Corporation,True,en,Mathematics,Retraction
https://openalex.org/W2133059104,An Improved Ant Colony Optimization Approach for Optimization of Process Planning,The Scientific World Journal,5,https://doi.org/10.1155/2014/294513,https://api.labs.crossref.org/works/https://doi.org/10.1155/2014/294513?mailto=christian.hauschke@tib.eu,2014,article,True,84,Design for Manufacture and Assembly in Manufacturing,Physical Sciences,Industrial and Manufacturing Engineering,Hindawi Publishing Corporation,True,en,Engineering,Retraction
https://openalex.org/W2140567349,Retracted Article: Methanol-induced conformation transition of gland fibroin monitored by FTIR spectroscopy and terahertz spectroscopy,Analyst,5,https://doi.org/10.1039/c3an01547e,https://api.labs.crossref.org/works/https://doi.org/10.1039/c3an01547e?mailto=christian.hauschke@tib.eu,2014,article,True,84,Biomedical Applications of Silk Biomaterials,Physical Sciences,Biomaterials,Royal Society of Chemistry,False,en,Materials Science,Retraction
https://openalex.org/W2140875488,Retracted: Optimization of Ultrasound-Assisted Extraction of Natural Pigments from <i>A</i> <i>maranthus tricolor</i> L Leaves,Journal of Food Processing and Preservation,5,https://doi.org/10.1111/jfpp.12478,https://api.labs.crossref.org/works/https://doi.org/10.1111/jfpp.12478?mailto=christian.hauschke@tib.eu,2015,article,True,84,Betalains in Nutrition,Life Sciences,Food Science,Wiley-Blackwell,True,en,Agricultural and Biological Sciences,Retraction
https://openalex.org/W2145297881,Retracted: Effect of Post‐Thaw Storage Time on Motility and Fertility of Cryopreserved Beluga Sturgeon (<i>Huso huso</i>) Sperm,Reproduction in Domestic Animals,5,https://doi.org/10.1111/rda.12484,https://api.labs.crossref.org/works/https://doi.org/10.1111/rda.12484?mailto=christian.hauschke@tib.eu,2015,article,True,84,Reproductive Physiology and Endocrine Disruption in Fish,Life Sciences,Physiology,Wiley,False,en,"Biochemistry, Genetics and Molecular Biology",Retraction
https://openalex.org/W2147288558,RETRACTED ARTICLE: On the seismic performance of bamboo structure,Bulletin of Earthquake Engineering,5,https://doi.org/10.1007/s10518-013-9561-1,https://api.labs.crossref.org/works/https://doi.org/10.1007/s10518-013-9561-1?mailto=christian.hauschke@tib.eu,2013,article,True,83,Bamboo as a Biomass Resource and Building Material,Life Sciences,Plant Science,Springer Science+Business Media,True,en,Agricultural and Biological Sciences,Retraction;Crossmark Retraction
https://openalex.org/W2147295308,RETRACTED ARTICLE: New proposal for the serum ascites albumin gradient cut-off value in Chinese ascitic patients,Diagnostic Pathology,5,https://doi.org/10.1186/1746-1596-8-143,https://api.labs.crossref.org/works/https://doi.org/10.1186/1746-1596-8-143?mailto=christian.hauschke@tib.eu,2013,article,True,83,Optimization of Perioperative Fluid Therapy,Health Sciences,Surgery,BioMed Central,True,en,Medicine,Retraction
https://openalex.org/W2148031668,<i>Retracted</i>: Cardiopulmonary resuscitation: Outcome and its predictors among hospitalized elderly patients in Egypt,Geriatrics & Gerontology International,5,https://doi.org/10.1111/ggi.12099,https://api.labs.crossref.org/works/https://doi.org/10.1111/ggi.12099?mailto=christian.hauschke@tib.eu,2013,article,True,83,Management of Cardiac Arrest and Resuscitation,Health Sciences,Emergency Medicine,Wiley-Blackwell,False,en,Medicine,Retraction
https://openalex.org/W2148704325,RETRACTED ARTICLE: A remark on the a-minimally thin sets associated with the Schrödinger operator,Boundary Value Problems,5,https://doi.org/10.1186/1687-2770-2014-133,https://api.labs.crossref.org/works/https://doi.org/10.1186/1687-2770-2014-133?mailto=christian.hauschke@tib.eu,2014,article,True,84,Multiscale Methods for Heterogeneous Systems,Physical Sciences,Computational Theory and Mathematics,Springer Nature,True,en,Computer Science,Retraction
https://openalex.org/W2149372126,Microfluidic Method of Pig Oocyte Quality Assessment in relation to Different Follicular Size Based on Lab-on-Chip Technology,BioMed Research International,5,https://doi.org/10.1155/2014/467063,https://api.labs.crossref.org/works/https://doi.org/10.1155/2014/467063?mailto=christian.hauschke@tib.eu,2014,article,True,84,Microfluidic Techniques for Particle Manipulation and Separation,Physical Sciences,Biomedical Engineering,Hindawi Publishing Corporation,True,en,Engineering,Retraction
https://openalex.org/W2149790498,Digital phantoms generated by spectral and spatial light modulators,Journal of Biomedical Optics,5,https://doi.org/10.1117/1.jbo.20.12.121309,https://api.labs.crossref.org/works/https://doi.org/10.1117/1.jbo.20.12.121309?mailto=christian.hauschke@tib.eu,2015,article,True,84,Biomedical Optical Imaging and Spectroscopy,Health Sciences,"Radiology, Nuclear Medicine and Imaging",SPIE,True,en,Medicine,Retraction
https://openalex.org/W2153588410,RETRACTED ARTICLE: Evaluation of the hospital service in Turkey using fuzzy decision making approach,Journal of Intelligent Manufacturing,5,https://doi.org/10.1007/s10845-015-1157-y,https://api.labs.crossref.org/works/https://doi.org/10.1007/s10845-015-1157-y?mailto=christian.hauschke@tib.eu,2015,article,True,84,Multi-Criteria Decision Making,Social Sciences,Management Science and Operations Research,Springer Science+Business Media,False,en,Decision Sciences,Crossmark Retraction
https://openalex.org/W2153603975,Synthesis and Evaluation of Some Quinoline Schiff Bases as a Corrosion Inhibitor for Mild Steel in 1 N HCl,Journal of Dispersion Science and Technology,5,https://doi.org/10.1080/01932691.2012.756378,https://api.labs.crossref.org/works/https://doi.org/10.1080/01932691.2012.756378?mailto=christian.hauschke@tib.eu,2013,article,True,83,Corrosion Inhibitors and Protection Mechanisms,Physical Sciences,Materials Chemistry,Taylor & Francis,False,en,Materials Science,Retraction
https://openalex.org/W2156102298,RETRACTED ARTICLE: Matsaev type inequalities on smooth cones,Journal of Inequalities and Applications,5,https://doi.org/10.1186/s13660-015-0621-8,https://api.labs.crossref.org/works/https://doi.org/10.1186/s13660-015-0621-8?mailto=christian.hauschke@tib.eu,2015,article,True,84,Geometric Function Theory and Complex Analysis,Physical Sciences,Geometry and Topology,Springer Science+Business Media,True,en,Mathematics,Retraction
https://openalex.org/W2157010065,Data Fusion Based on Node Trust Evaluation in Wireless Sensor Networks,Journal of Sensors,5,https://doi.org/10.1155/2014/391401,https://api.labs.crossref.org/works/https://doi.org/10.1155/2014/391401?mailto=christian.hauschke@tib.eu,2014,article,True,84,Security in Wireless Sensor Networks,Physical Sciences,Computer Networks and Communications,Hindawi Publishing Corporation,True,en,Computer Science,Retraction
https://openalex.org/W2157167605,RETRACTED ARTICLE: Correlation of IL-1F genetic polymorphisms with the risk of colorectal cancer among Chinese populations,Tumor Biology,5,https://doi.org/10.1007/s13277-014-2653-y,https://api.labs.crossref.org/works/https://doi.org/10.1007/s13277-014-2653-y?mailto=christian.hauschke@tib.eu,2014,article,True,84,Reciprocal Development of TH17 and Treg Cells,Life Sciences,Immunology,SAGE Publishing,False,en,Immunology and Microbiology,Retraction;Crossmark Retraction
https://openalex.org/W2158023144,RETRACTED ARTICLE: A novel association between cytotoxin-associated gene A (CagA) positive strain of <i>Helicobacter pylori</i> and unexplained recurrent early pregnancy loss,The European Journal of Contraception & Reproductive Health Care,5,https://doi.org/10.3109/13625187.2013.873399,https://api.labs.crossref.org/works/https://doi.org/10.3109/13625187.2013.873399?mailto=christian.hauschke@tib.eu,2014,article,True,84,Helicobacter pylori Infection and Gastric Cancer,Health Sciences,Surgery,Taylor & Francis,False,en,Medicine,Retraction
https://openalex.org/W2163162979,Differential appraisal of age thresholds for mammographic screening in Holland and Switzerland,Journal of Communication in Healthcare,5,https://doi.org/10.1179/1753807614y.0000000070,https://api.labs.crossref.org/works/https://doi.org/10.1179/1753807614y.0000000070?mailto=christian.hauschke@tib.eu,2014,article,True,84,Theories of Behavior Change and Self-Regulation,Social Sciences,Applied Psychology,Taylor & Francis,False,en,Psychology,Correction
https://openalex.org/W2164345937,Pleiotropic signaling evoked by tumor necrosis factor in podocytes,American Journal of Physiology-renal Physiology,5,https://doi.org/10.1152/ajprenal.00146.2015,https://api.labs.crossref.org/works/https://doi.org/10.1152/ajprenal.00146.2015?mailto=christian.hauschke@tib.eu,2015,article,True,84,Pathophysiology of Glomerular Diseases and Nephrotic Syndromes,Health Sciences,Nephrology,American Physical Society,True,en,Medicine,Retraction
https://openalex.org/W2171676392,Alcohol consumption and hormonal alterations related to muscle hypertrophy: a review,Nutrition & Metabolism,5,https://doi.org/10.1186/1743-7075-11-26,https://api.labs.crossref.org/works/https://doi.org/10.1186/1743-7075-11-26?mailto=christian.hauschke@tib.eu,2014,article,True,84,Brown Adipose Tissue Function and Physiology,Health Sciences,Physiology,BioMed Central,True,en,Medicine,Retraction
https://openalex.org/W2171727455,The detection of (total and ccc) HBV DNA in liver transplant recipients with hepatitis B vaccine against HBV reinfection,Human Vaccines & Immunotherapeutics,5,https://doi.org/10.1080/21645515.2015.1063755,https://api.labs.crossref.org/works/https://doi.org/10.1080/21645515.2015.1063755?mailto=christian.hauschke@tib.eu,2015,article,True,84,Hepatitis B Infection and Treatment,Health Sciences,Epidemiology,Taylor & Francis,True,en,Medicine,Expression of concern
https://openalex.org/W2172912034,Confounding of the Association between Radiation Exposure from CT Scans and Risk of Leukemia and Brain Tumors by Cancer Susceptibility Syndromes,"Cancer Epidemiology, Biomarkers & Prevention",5,https://doi.org/10.1158/1055-9965.epi-15-0636,https://api.labs.crossref.org/works/https://doi.org/10.1158/1055-9965.epi-15-0636?mailto=christian.hauschke@tib.eu,2016,article,True,84,Classification and Treatment of Histiocytic Disorders,Health Sciences,Physiology,American Association for Cancer Research,True,en,Medicine,Retraction
https://openalex.org/W2174757432,"Retraction of: EUROPAEM EMF Guideline 2015 for the prevention, diagnosis and treatment of EMF-related health problems and illnesses",Reviews on environmental health,5,https://doi.org/10.1515/reveh-2015-0033,https://api.labs.crossref.org/works/https://doi.org/10.1515/reveh-2015-0033?mailto=christian.hauschke@tib.eu,2015,article,True,84,Biological Effects of Electromagnetic Fields,Life Sciences,Biophysics,De Gruyter,True,en,"Biochemistry, Genetics and Molecular Biology",Retraction
https://openalex.org/W2175945911,RETRACTED ARTICLE: The Risk of Prostate Cancer in Pilots: A Meta-Analysis,Aerospace medicine and human performance,5,https://doi.org/10.3357/amhp.4075.2015,https://api.labs.crossref.org/works/https://doi.org/10.3357/amhp.4075.2015?mailto=christian.hauschke@tib.eu,2015,article,True,84,Health Effects of Air Pollution,Physical Sciences,"Health, Toxicology and Mutagenesis",Aerospace Medical Association,False,en,Environmental Science,
https://openalex.org/W2197104828,RETRACTED ARTICLE: Sustainable supply chain network design: a case of Indian company,International Journal of Logistics: Research and Applications,5,https://doi.org/10.1080/13675567.2014.992305,https://api.labs.crossref.org/works/https://doi.org/10.1080/13675567.2014.992305?mailto=christian.hauschke@tib.eu,2014,article,True,84,Conceptualizing the Circular Economy and Sustainable Supply Chains,Social Sciences,Strategy and Management,Taylor & Francis,True,en,"Business, Management and Accounting",
https://openalex.org/W2201470953,Correlation Between High-Density Lipoprotein and Monocyte Subsets in Patients with Stable Coronary Heart Disease,Medical Science Monitor,5,https://doi.org/10.12659/msm.894485,https://api.labs.crossref.org/works/https://doi.org/10.12659/msm.894485?mailto=christian.hauschke@tib.eu,2015,article,True,84,Immunological Mechanisms in Atherosclerosis Development,Life Sciences,Immunology,International Scientific Information Inc.,True,en,Immunology and Microbiology,
https://openalex.org/W2201655904,Growth property at infinity of the maximum modulus with respect to the Schrödinger operator,International Journal of Mathematics,5,https://doi.org/10.1142/s0129167x16500099,https://api.labs.crossref.org/works/https://doi.org/10.1142/s0129167x16500099?mailto=christian.hauschke@tib.eu,2016,article,True,84,Multiscale Methods for Heterogeneous Systems,Physical Sciences,Computational Theory and Mathematics,World Scientific,False,en,Computer Science,
https://openalex.org/W2213588782,MiR-429 induces apoptosis of glioblastoma cell through Bcl-2,Tumor Biology,5,https://doi.org/10.1007/s13277-015-4291-4,https://api.labs.crossref.org/works/https://doi.org/10.1007/s13277-015-4291-4?mailto=christian.hauschke@tib.eu,2015,article,True,84,MicroRNA Regulation in Cancer and Development,Life Sciences,Cancer Research,SAGE Publishing,False,en,"Biochemistry, Genetics and Molecular Biology",
https://openalex.org/W2216136200,RETRACTED: Concentric and Eccentric Exercise,The Journal of Pain,5,https://doi.org/10.1016/j.jpain.2013.07.001,https://api.labs.crossref.org/works/https://doi.org/10.1016/j.jpain.2013.07.001?mailto=christian.hauschke@tib.eu,2013,article,True,83,The Role of Exercise in Inflammation and Oxidative Stress,Health Sciences,Rehabilitation,Elsevier BV,True,en,Medicine,
https://openalex.org/W2227075449,A Novel Image Recuperation Approach for Diagnosing and Ranking Retinopathy Disease Level Using Diabetic Fundus Image,PLOS ONE,5,https://doi.org/10.1371/journal.pone.0125542,https://api.labs.crossref.org/works/https://doi.org/10.1371/journal.pone.0125542?mailto=christian.hauschke@tib.eu,2015,article,True,84,Detection and Management of Retinal Diseases,Health Sciences,"Radiology, Nuclear Medicine and Imaging",Public Library of Science,True,en,Medicine,
https://openalex.org/W2231503677,RETRACTED: The Anaphase-Promoting Complex/Cyclosome Is Essential for Entry into Meiotic M-Phase,Developmental Cell,5,https://doi.org/10.1016/j.devcel.2015.12.009,https://api.labs.crossref.org/works/https://doi.org/10.1016/j.devcel.2015.12.009?mailto=christian.hauschke@tib.eu,2016,article,True,84,Regulation and Function of Microtubules in Cell Division,Life Sciences,Cell Biology,Elsevier BV,True,en,"Biochemistry, Genetics and Molecular Biology",
https://openalex.org/W2234872943,Ultimate multibit 1T-FeRAM with selectively nucleated grown single-grain PbZr<sub>0.52</sub>Ti<sub>0.48</sub>O<sub>3</sub>for very-large-scale-integrated memory,Journal of Physics D: Applied Physics,5,https://doi.org/10.1088/0022-3727/49/7/075106,https://api.labs.crossref.org/works/https://doi.org/10.1088/0022-3727/49/7/075106?mailto=christian.hauschke@tib.eu,2016,article,True,84,Lead-free Piezoelectric Materials,Physical Sciences,Materials Chemistry,Institute of Physics,False,en,Materials Science,
https://openalex.org/W2239090181,Anthropogenic Radio-Frequency Electromagnetic Fields Elicit Neuropathic Pain in an Amputation Model,PLOS ONE,5,https://doi.org/10.1371/journal.pone.0144268,https://api.labs.crossref.org/works/https://doi.org/10.1371/journal.pone.0144268?mailto=christian.hauschke@tib.eu,2016,article,True,84,Low-Level Laser Therapy in Biomedical Applications,Health Sciences,"Radiology, Nuclear Medicine and Imaging",Public Library of Science,True,en,Medicine,
https://openalex.org/W2285855762,WITHDRAWN: On modelling the behaviour of a ductile adhesive under low temperatures,International Journal of Adhesion and Adhesives,5,https://doi.org/10.1016/j.ijadhadh.2013.09.014,https://api.labs.crossref.org/works/https://doi.org/10.1016/j.ijadhadh.2013.09.014?mailto=christian.hauschke@tib.eu,2014,article,True,84,Ductile Fracture in Sheet Metal Forming,Physical Sciences,Mechanical Engineering,Elsevier BV,True,en,Engineering,
https://openalex.org/W2286593685,Design of New Power Management Circuit for Light Energy Harvesting System,Sensors,5,https://doi.org/10.3390/s16030270,https://api.labs.crossref.org/works/https://doi.org/10.3390/s16030270?mailto=christian.hauschke@tib.eu,2016,article,True,84,Vibration Energy Harvesting for Microsystems Applications,Physical Sciences,Mechanical Engineering,Multidisciplinary Digital Publishing Institute,True,en,Engineering,
https://openalex.org/W2291207285,Myosin VI contributes to malignant proliferation of human glioma cells,The Korean Journal of Physiology and Pharmacology,5,https://doi.org/10.4196/kjpp.2016.20.2.139,https://api.labs.crossref.org/works/https://doi.org/10.4196/kjpp.2016.20.2.139?mailto=christian.hauschke@tib.eu,2016,article,True,84,Regulation of RNA Processing and Function,Life Sciences,Molecular Biology,The Korean Society of Pharmacology,True,en,"Biochemistry, Genetics and Molecular Biology",
https://openalex.org/W2293377456,Fatal factitious Cushing syndrome (Münchhausen’s syndrome) in a patient with macroprolactinoma and silent corticotrophinoma: case report and literature review,Clinical Diabetes and Endocrinology,5,https://doi.org/10.1186/s40842-015-0002-8,https://api.labs.crossref.org/works/https://doi.org/10.1186/s40842-015-0002-8?mailto=christian.hauschke@tib.eu,2015,article,True,84,Child Abuse and Traumatic Brain Injury,Health Sciences,"Pediatrics, Perinatology and Child Health",BioMed Central,True,en,Medicine,
https://openalex.org/W2295380797,RETRACTED ARTICLE: Incremental Science Learning in Toddler's Play,International Journal of Science Education,5,https://doi.org/10.1080/21548455.2015.1020457,https://api.labs.crossref.org/works/https://doi.org/10.1080/21548455.2015.1020457?mailto=christian.hauschke@tib.eu,2015,article,True,84,Impact of Media on Children's Development,Social Sciences,Education,Taylor & Francis,True,en,Social Sciences,
