id,display_name,primary_location_display_name,cited_by_count,doi,crossref_call,publication_year,type,is_retracted,cited_by_percentile_year_min,primary_topic_display_name,primary_topic_domain_display_name,primary_topic_subfield_display_name,primary_location_source_host_organization_name,open_access_is_oa,language,primary_topic_field_display_name,update_nature
https://openalex.org/W820596889,Cationic guar gum orchestrated environmental synthesis for silver nano-bio-composite films,Carbohydrate Polymers,26,https://doi.org/10.1016/j.carbpol.2015.06.029,https://api.labs.crossref.org/works/https://doi.org/10.1016/j.carbpol.2015.06.029?mailto=christian.hauschke@tib.eu,2015,article,True,93,Nanotoxicology and Antimicrobial Nanoparticles,Physical Sciences,Materials Chemistry,Elsevier BV,False,en,Materials Science,Expression of concern
https://openalex.org/W991782938,Propofol suppresses proliferation and invasion of gastric cancer cells via downregulation of microRNA-221 expression,Genetics and Molecular Research,26,https://doi.org/10.4238/2015.july.17.20,https://api.labs.crossref.org/works/https://doi.org/10.4238/2015.july.17.20?mailto=christian.hauschke@tib.eu,2015,article,True,93,MicroRNA Regulation in Cancer and Development,Life Sciences,Cancer Research,Research Foundation of Ribeirão Preto,True,en,"Biochemistry, Genetics and Molecular Biology",Retraction
https://openalex.org/W1026365779,REMOVED: miR-4295 promotes cell proliferation and invasion in anaplastic thyroid carcinoma via CDKN1A,Biochemical and Biophysical Research Communications,25,https://doi.org/10.1016/j.bbrc.2015.07.128,https://api.labs.crossref.org/works/https://doi.org/10.1016/j.bbrc.2015.07.128?mailto=christian.hauschke@tib.eu,2015,article,True,93,RNA Methylation and Modification in Gene Expression,Life Sciences,Molecular Biology,Elsevier BV,True,en,"Biochemistry, Genetics and Molecular Biology",Retraction;Crossmark Retraction
https://openalex.org/W1587894052,MIG-7 and phosphorylated prohibitin coordinately regulate lung cancer invasion/metastasis,Oncotarget,25,https://doi.org/10.18632/oncotarget.2804,https://api.labs.crossref.org/works/https://doi.org/10.18632/oncotarget.2804?mailto=christian.hauschke@tib.eu,2014,article,True,93,Role of Growth Factors in Health and Disease,Health Sciences,Rheumatology,Impact Journals LLC,True,en,Medicine,Retraction
https://openalex.org/W1910413205,Retracted Article: Mesoporous amorphous FeOF nanococoons for high-rate and long-life rechargeable sodium-ion batteries,"Journal of materials chemistry. A, Materials for energy and sustainability",25,https://doi.org/10.1039/c5ta04288g,https://api.labs.crossref.org/works/https://doi.org/10.1039/c5ta04288g?mailto=christian.hauschke@tib.eu,2015,article,True,93,Lithium-ion Battery Technology,Physical Sciences,Electrical and Electronic Engineering,Royal Society of Chemistry,False,en,Engineering,Expression of concern;Retraction
https://openalex.org/W1965495949,6-Hydroxydopamine and lipopolysaccharides induced DNA damage in astrocytes: Involvement of nitric oxide and mitochondria,Mutation Research/Genetic Toxicology and Environmental Mutagenesis,25,https://doi.org/10.1016/j.mrgentox.2014.12.007,https://api.labs.crossref.org/works/https://doi.org/10.1016/j.mrgentox.2014.12.007?mailto=christian.hauschke@tib.eu,2015,article,True,93,Molecular Mechanisms of Synaptic Plasticity and Neurological Disorders,Life Sciences,Cellular and Molecular Neuroscience,Elsevier BV,False,en,Neuroscience,Expression of concern
https://openalex.org/W1967142248,"Live-Cell, Temporal Gene Expression Analysis of Osteogenic Differentiation in Adipose-Derived Stem Cells",Tissue Engineering Part A,25,https://doi.org/10.1089/ten.tea.2012.0127,https://api.labs.crossref.org/works/https://doi.org/10.1089/ten.tea.2012.0127?mailto=christian.hauschke@tib.eu,2013,article,True,93,Multipotent Mesenchymal Stem Cells,Health Sciences,Genetics,"Mary Ann Liebert, Inc.",True,en,Medicine,Retraction
https://openalex.org/W1972196679,"Role of Hepatitis C Virus Induced Osteopontin in Epithelial to Mesenchymal Transition, Migration and Invasion of Hepatocytes",PLOS ONE,25,https://doi.org/10.1371/journal.pone.0087464,https://api.labs.crossref.org/works/https://doi.org/10.1371/journal.pone.0087464?mailto=christian.hauschke@tib.eu,2014,article,True,93,Role of Osteopontin in Biomineralization and Inflammation,Health Sciences,Rheumatology,Public Library of Science,True,en,Medicine,Retraction
https://openalex.org/W1979676349,"RETRACTED: Effects of high-energy electro-pulsing treatment on microstructure, mechanical properties and corrosion behavior of Ti–6Al–4V alloy",Materials Science and Engineering: C,25,https://doi.org/10.1016/j.msec.2015.01.081,https://api.labs.crossref.org/works/https://doi.org/10.1016/j.msec.2015.01.081?mailto=christian.hauschke@tib.eu,2015,article,True,93,Effects of Electrically-Assisted Deformation in Metals and Ceramics,Physical Sciences,Electrical and Electronic Engineering,Elsevier BV,True,en,Engineering,Retraction;Crossmark Retraction
https://openalex.org/W1983878705,"Genetic Polymorphism of Glucokinase on the Risk of Type 2 Diabetes and Impaired Glucose Regulation: Evidence Based on 298, 468 Subjects",PLOS ONE,25,https://doi.org/10.1371/journal.pone.0055727,https://api.labs.crossref.org/works/https://doi.org/10.1371/journal.pone.0055727?mailto=christian.hauschke@tib.eu,2013,article,True,93,Pancreatic Islet Dysfunction and Regeneration,Health Sciences,Surgery,Public Library of Science,True,en,Medicine,Retraction
https://openalex.org/W1996916154,Intracisternal administration of an interleukin-6 receptor antagonist attenuates surgery-induced cognitive impairment by inhibition of neuroinflammatory responses in aged rats,Experimental and Therapeutic Medicine,25,https://doi.org/10.3892/etm.2014.2149,https://api.labs.crossref.org/works/https://doi.org/10.3892/etm.2014.2149?mailto=christian.hauschke@tib.eu,2014,article,True,93,Management of Delirium in Critical Care Patients,Health Sciences,Critical Care and Intensive Care Medicine,Spandidos Publishing,True,en,Medicine,Retraction
https://openalex.org/W2006078445,The effects of a transtheoretical model-based exercise stage-matched intervention on exercise behavior in patients with coronary heart disease: A randomized controlled trial,Patient Education and Counseling,25,https://doi.org/10.1016/j.pec.2014.03.013,https://api.labs.crossref.org/works/https://doi.org/10.1016/j.pec.2014.03.013?mailto=christian.hauschke@tib.eu,2014,article,True,93,Cardiac Rehabilitation and Cardiovascular Health Interventions,Health Sciences,Cardiology and Cardiovascular Medicine,Elsevier BV,False,en,Medicine,Retraction
https://openalex.org/W2008479102,"PAX6, a novel target of miR-335, inhibits cell proliferation and invasion in glioma cells",Molecular Medicine Reports,25,https://doi.org/10.3892/mmr.2014.2150,https://api.labs.crossref.org/works/https://doi.org/10.3892/mmr.2014.2150?mailto=christian.hauschke@tib.eu,2014,article,True,93,MicroRNA Regulation in Cancer and Development,Life Sciences,Cancer Research,Spandidos Publishing,True,en,"Biochemistry, Genetics and Molecular Biology",Retraction
https://openalex.org/W2013133976,"RETRACTED ARTICLE: Osteolytic bone metastasis is hampered by impinging on the interplay among autophagy, anoikis and ossification",Cell Death and Disease,25,https://doi.org/10.1038/cddis.2013.465,https://api.labs.crossref.org/works/https://doi.org/10.1038/cddis.2013.465?mailto=christian.hauschke@tib.eu,2014,article,True,93,Mechanisms and Treatment of Liver Fibrosis,Health Sciences,Hepatology,Springer Nature,True,en,Medicine,Retraction
https://openalex.org/W2017750957,Investigation on antibacterial synergism of Origanum vulgare and Thymus vulgaris essential oils,Archives of Biological Sciences,25,https://doi.org/10.2298/abs1302639s,https://api.labs.crossref.org/works/https://doi.org/10.2298/abs1302639s?mailto=christian.hauschke@tib.eu,2013,article,True,93,Antimicrobial Properties of Essential Oils in Foods,Life Sciences,Food Science,"University of Belgrade, University of Novi Sad",True,en,Agricultural and Biological Sciences,Correction
https://openalex.org/W2029021699,Reduction in ATP Levels Triggers Immunoproteasome Activation by the 11S (PA28) Regulator during Early Antiviral Response Mediated by IFNβ in Mouse Pancreatic β-Cells,PLOS ONE,25,https://doi.org/10.1371/journal.pone.0052408,https://api.labs.crossref.org/works/https://doi.org/10.1371/journal.pone.0052408?mailto=christian.hauschke@tib.eu,2013,article,True,93,Ubiquitin-Proteasome Proteolytic Pathway,Life Sciences,Molecular Biology,Public Library of Science,True,en,"Biochemistry, Genetics and Molecular Biology",Expression of concern
https://openalex.org/W2029278903,RETRACTED: Experiences in renewable energy and energy efficiency in Tunisia: Case study of a developing country,Renewable & Sustainable Energy Reviews,25,https://doi.org/10.1016/j.rser.2014.01.045,https://api.labs.crossref.org/works/https://doi.org/10.1016/j.rser.2014.01.045?mailto=christian.hauschke@tib.eu,2014,article,True,93,Indoor Air Pollution in Developing Countries,Physical Sciences,Pollution,Elsevier BV,True,en,Environmental Science,Retraction;Crossmark Retraction
https://openalex.org/W2035192626,TOX Acts an Oncological Role in Mycosis Fungoides,PLOS ONE,25,https://doi.org/10.1371/journal.pone.0117479,https://api.labs.crossref.org/works/https://doi.org/10.1371/journal.pone.0117479?mailto=christian.hauschke@tib.eu,2015,article,True,93,Classification and Treatment of Cutaneous Lymphomas,Health Sciences,Dermatology,Public Library of Science,True,en,Medicine,Retraction
https://openalex.org/W2044009718,Observation of large magnetodielectric and direct magnetoelectric behavior in LCMO/PVDF 0-3 nanocomposites,Applied Physics Letters,25,https://doi.org/10.1063/1.4793307,https://api.labs.crossref.org/works/https://doi.org/10.1063/1.4793307?mailto=christian.hauschke@tib.eu,2013,article,True,93,Multiferroic and Magnetoelectric Materials,Physical Sciences,"Electronic, Optical and Magnetic Materials",American Institute of Physics,False,en,Materials Science,Retraction
https://openalex.org/W2044983763,"RETRACTED ARTICLE: TNF receptor-associated factor 6 regulates proliferation, apoptosis, and invasion of glioma cells",Molecular and Cellular Biochemistry,25,https://doi.org/10.1007/s11010-013-1573-2,https://api.labs.crossref.org/works/https://doi.org/10.1007/s11010-013-1573-2?mailto=christian.hauschke@tib.eu,2013,article,True,93,NF-?B Signaling in Inflammation and Cancer,Life Sciences,Cancer Research,Springer Science+Business Media,False,en,"Biochemistry, Genetics and Molecular Biology",Retraction;Crossmark Retraction
https://openalex.org/W2049316722,Rehmannia Glutinosa Extract Activates Endothelial Progenitor Cells in a Rat Model of Myocardial Infarction through a SDF-1 α/CXCR4 Cascade,PLOS ONE,25,https://doi.org/10.1371/journal.pone.0054303,https://api.labs.crossref.org/works/https://doi.org/10.1371/journal.pone.0054303?mailto=christian.hauschke@tib.eu,2013,article,True,93,Molecular Mechanisms of Angiogenesis and Vascular Function,Life Sciences,Molecular Biology,Public Library of Science,True,en,"Biochemistry, Genetics and Molecular Biology",Retraction
https://openalex.org/W2062750863,RETRACTED ARTICLE: Critical role of CCDC6 in the neoplastic growth of testicular germ cell tumors,BMC Cancer,25,https://doi.org/10.1186/1471-2407-13-433,https://api.labs.crossref.org/works/https://doi.org/10.1186/1471-2407-13-433?mailto=christian.hauschke@tib.eu,2013,article,True,93,Molecular Mechanisms of DNA Damage Response,Life Sciences,Molecular Biology,BioMed Central,True,en,"Biochemistry, Genetics and Molecular Biology",Retraction
https://openalex.org/W2068486225,Retracted Article: Radio frequency triggered curcumin delivery from thermo and pH responsive nanoparticles containing gold nanoparticles and its <i>in vivo</i> localization studies in an orthotopic breast tumor model,RSC Advances,25,https://doi.org/10.1039/c4ra05727a,https://api.labs.crossref.org/works/https://doi.org/10.1039/c4ra05727a?mailto=christian.hauschke@tib.eu,2014,article,True,93,Mechanisms and Applications of RNA Interference,Life Sciences,Molecular Biology,Royal Society of Chemistry,False,en,"Biochemistry, Genetics and Molecular Biology",Retraction
https://openalex.org/W2078977791,CLASP-mediated cortical microtubule organization guides PIN polarization axis,Nature,25,https://doi.org/10.1038/nature11980,https://api.labs.crossref.org/works/https://doi.org/10.1038/nature11980?mailto=christian.hauschke@tib.eu,2013,article,True,93,Molecular Mechanisms of Plant Development and Regulation,Life Sciences,Plant Science,Nature Portfolio,False,en,Agricultural and Biological Sciences,Retraction
https://openalex.org/W2087230001,An experimental investigation into the effects of Cr<sub>2</sub>O<sub>3</sub> and ZnO<sub>2</sub> nanoparticles on the mechanical properties and durability of self-compacting mortar,International Journal of Materials Research,25,https://doi.org/10.3139/146.111245,https://api.labs.crossref.org/works/https://doi.org/10.3139/146.111245?mailto=christian.hauschke@tib.eu,2015,article,True,93,Geopolymer and Alternative Cementitious Materials,Physical Sciences,Civil and Structural Engineering,De Gruyter,False,en,Engineering,Retraction
https://openalex.org/W2090012993,β-Amyloid and α-Synuclein Cooperate To Block SNARE-Dependent Vesicle Fusion,Biochemistry,25,https://doi.org/10.1021/acs.biochem.5b00087,https://api.labs.crossref.org/works/https://doi.org/10.1021/acs.biochem.5b00087?mailto=christian.hauschke@tib.eu,2015,article,True,93,Mechanisms of Alzheimer's Disease,Health Sciences,Physiology,American Chemical Society,True,en,Medicine,Retraction
https://openalex.org/W2091682424,RETRACTED: Generalized adaptive neuro-fuzzy based method for wind speed distribution prediction,Flow Measurement and Instrumentation,25,https://doi.org/10.1016/j.flowmeasinst.2015.03.003,https://api.labs.crossref.org/works/https://doi.org/10.1016/j.flowmeasinst.2015.03.003?mailto=christian.hauschke@tib.eu,2015,article,True,93,Electricity Price and Load Forecasting Methods,Physical Sciences,Electrical and Electronic Engineering,Elsevier BV,True,en,Engineering,Retraction;Crossmark Retraction
https://openalex.org/W2092981234,RETRACTED: Microarray analysis of microRNA expression in liver cancer tissues and normal control,Gene,25,https://doi.org/10.1016/j.gene.2013.02.055,https://api.labs.crossref.org/works/https://doi.org/10.1016/j.gene.2013.02.055?mailto=christian.hauschke@tib.eu,2013,article,True,93,MicroRNA Regulation in Cancer and Development,Life Sciences,Cancer Research,Elsevier BV,False,en,"Biochemistry, Genetics and Molecular Biology",Retraction;Crossmark Retraction
https://openalex.org/W2104673049,RNAi Mediated Tiam1 Gene Knockdown Inhibits Invasion of Retinoblastoma,PLOS ONE,25,https://doi.org/10.1371/journal.pone.0070422,https://api.labs.crossref.org/works/https://doi.org/10.1371/journal.pone.0070422?mailto=christian.hauschke@tib.eu,2013,article,True,93,Integrin Signaling in Inflammation and Cancer,Health Sciences,Immunology and Allergy,Public Library of Science,True,en,Medicine,Expression of concern
https://openalex.org/W2135289190,"A novel derivative of betulinic acid, SYK023, suppresses lung cancer growth and malignancy",Oncotarget,25,https://doi.org/10.18632/oncotarget.3701,https://api.labs.crossref.org/works/https://doi.org/10.18632/oncotarget.3701?mailto=christian.hauschke@tib.eu,2015,article,True,93,Biological Activities of Triterpenoids and Saponins,Life Sciences,Molecular Biology,Impact Journals LLC,True,en,"Biochemistry, Genetics and Molecular Biology",Retraction
https://openalex.org/W2139414991,RETRACTED ARTICLE: Release-Active Dilutions of Diclofenac Enhance Anti-inflammatory Effect of Diclofenac in Carrageenan-Induced Rat Paw Edema Model,Inflammation,25,https://doi.org/10.1007/s10753-013-9705-0,https://api.labs.crossref.org/works/https://doi.org/10.1007/s10753-013-9705-0?mailto=christian.hauschke@tib.eu,2013,article,True,93,Cyclooxygenase-2 Inhibitors in Inflammation and Cancer,Health Sciences,Pharmacology,Springer Science+Business Media,True,en,Medicine,Retraction
https://openalex.org/W2172773927,<i>Retracted:</i> MicroRNA‐519a promotes proliferation and inhibits apoptosis of hepatocellular carcinoma cells by targeting FOXF2,FEBS Open Bio,25,https://doi.org/10.1016/j.fob.2015.10.009,https://api.labs.crossref.org/works/https://doi.org/10.1016/j.fob.2015.10.009?mailto=christian.hauschke@tib.eu,2015,article,True,93,MicroRNA Regulation in Cancer and Development,Life Sciences,Cancer Research,Wiley,True,en,"Biochemistry, Genetics and Molecular Biology",Retraction
https://openalex.org/W2181367762,MicroRNA-126 inhibits the migration and invasion of endometrial cancer cells by targeting insulin receptor substrate 1,Oncology Letters,25,https://doi.org/10.3892/ol.2015.4001,https://api.labs.crossref.org/works/https://doi.org/10.3892/ol.2015.4001?mailto=christian.hauschke@tib.eu,2015,article,True,93,MicroRNA Regulation in Cancer and Development,Life Sciences,Cancer Research,Spandidos Publishing,True,en,"Biochemistry, Genetics and Molecular Biology",Retraction
https://openalex.org/W2261929237,RETRACTED ARTICLE: γ-Aminobutyric acid (GABA) administration improves action selection processes: a randomised controlled trial,Scientific Reports,25,https://doi.org/10.1038/srep12770,https://api.labs.crossref.org/works/https://doi.org/10.1038/srep12770?mailto=christian.hauschke@tib.eu,2015,article,True,93,Neuronal Oscillations in Cortical Networks,Life Sciences,Cognitive Neuroscience,Nature Portfolio,True,en,Neuroscience,Retraction
https://openalex.org/W2326433559,FBXL5 targets cortactin for ubiquitination-mediated destruction to regulate gastric cancer cell migration,Tumor Biology,25,https://doi.org/10.1007/s13277-014-2104-9,https://api.labs.crossref.org/works/https://doi.org/10.1007/s13277-014-2104-9?mailto=christian.hauschke@tib.eu,2014,article,True,93,Role of Matrix Metalloproteinases in Cancer and Physiology,Life Sciences,Cancer Research,SAGE Publishing,False,en,"Biochemistry, Genetics and Molecular Biology",Retraction
https://openalex.org/W2410422868,RETRACTED ARTICLE: A novel IgY-Aptamer hybrid system for cost-effective detection of SEB and its evaluation on food and clinical samples,Scientific Reports,25,https://doi.org/10.1038/srep15151,https://api.labs.crossref.org/works/https://doi.org/10.1038/srep15151?mailto=christian.hauschke@tib.eu,2015,article,True,93,DNA Nanotechnology and Bioanalytical Applications,Life Sciences,Molecular Biology,Nature Portfolio,True,en,"Biochemistry, Genetics and Molecular Biology",Retraction
https://openalex.org/W1492515793,Retracted: K<sub>ATP</sub> channels in the nodose ganglia mediate the orexigenic actions of ghrelin,The Journal of Physiology,24,https://doi.org/10.1113/jp270788,https://api.labs.crossref.org/works/https://doi.org/10.1113/jp270788?mailto=christian.hauschke@tib.eu,2015,article,True,93,Neuroendocrine Regulation of Appetite and Body Weight,Life Sciences,Endocrine and Autonomic Systems,Wiley-Blackwell,True,en,Neuroscience,Correction;Retraction
https://openalex.org/W1603075604,Identification of biological markers for better characterization of older subjects with physical frailty and sarcopenia,Translational Neuroscience,24,https://doi.org/10.1515/tnsci-2015-0009,https://api.labs.crossref.org/works/https://doi.org/10.1515/tnsci-2015-0009?mailto=christian.hauschke@tib.eu,2015,article,True,93,"Sarcopenia: Definition, Diagnosis, and Implications",Health Sciences,Physiology,De Gruyter Open,True,en,Medicine,Retraction
https://openalex.org/W1754995342,"Retracted: Randomised clinical trial: the clinical efficacy and safety of an alginate‐antacid (Gaviscon Double Action) versus placebo, for decreasing upper gastrointestinal symptoms in symptomatic gastroesophageal reflux disease (<scp>GERD</scp>) in China",Alimentary Pharmacology & Therapeutics,24,https://doi.org/10.1111/apt.13334,https://api.labs.crossref.org/works/https://doi.org/10.1111/apt.13334?mailto=christian.hauschke@tib.eu,2015,article,True,93,Diagnosis and Management of Gastroesophageal Reflux Disease,Health Sciences,Gastroenterology,Wiley-Blackwell,True,en,Medicine,Retraction
https://openalex.org/W1838740286,Bidirectional regulation between TMEFF2 and STAT3 may contribute to<i>H</i><i>elicobacter pylori</i>-associated gastric carcinogenesis,International Journal of Cancer,24,https://doi.org/10.1002/ijc.29061,https://api.labs.crossref.org/works/https://doi.org/10.1002/ijc.29061?mailto=christian.hauschke@tib.eu,2014,article,True,93,Helicobacter pylori Infection and Gastric Cancer,Health Sciences,Surgery,Wiley,False,en,Medicine,Correction
https://openalex.org/W1936680103,Retracted: Formin‐like2 regulates Rho/ <scp>ROCK</scp> pathway to promote actin assembly and cell invasion of colorectal cancer,Cancer Science,24,https://doi.org/10.1111/cas.12768,https://api.labs.crossref.org/works/https://doi.org/10.1111/cas.12768?mailto=christian.hauschke@tib.eu,2015,article,True,93,Cell Mechanics and Extracellular Matrix Interactions,Life Sciences,Cell Biology,Wiley-Blackwell,True,en,"Biochemistry, Genetics and Molecular Biology",Retraction
https://openalex.org/W1973240512,RETRACTED: Modeling the causal relationship between energy and growth factors: Journey towards sustainable development,Renewable Energy,24,https://doi.org/10.1016/j.renene.2013.09.033,https://api.labs.crossref.org/works/https://doi.org/10.1016/j.renene.2013.09.033?mailto=christian.hauschke@tib.eu,2014,article,True,93,Rebound Effect on Energy Efficiency and Consumption,Physical Sciences,"Renewable Energy, Sustainability and the Environment",Elsevier BV,False,en,Energy,Retraction;Crossmark Retraction
https://openalex.org/W1986316373,Role of Surfactant in the Formation of Gold Nanoparticles in Aqueous Medium,Journal of Nanoparticles,24,https://doi.org/10.1155/2014/916429,https://api.labs.crossref.org/works/https://doi.org/10.1155/2014/916429?mailto=christian.hauschke@tib.eu,2014,article,True,93,"Plasmonic Nanoparticles: Synthesis, Properties, and Applications",Physical Sciences,"Electronic, Optical and Magnetic Materials",Hindawi Publishing Corporation,True,en,Materials Science,Retraction
https://openalex.org/W1997602276,Polyethylenimine-Assisted Growth of High-Aspect-Ratio Nitrogen-Doped ZnO (NZO) Nanorod Arrays and Their Effect on Performance of Dye-Sensitized Solar Cells,ACS Applied Materials & Interfaces,24,https://doi.org/10.1021/am500105x,https://api.labs.crossref.org/works/https://doi.org/10.1021/am500105x?mailto=christian.hauschke@tib.eu,2014,article,True,93,Zinc Oxide Nanostructures,Physical Sciences,Materials Chemistry,American Chemical Society,False,en,Materials Science,Retraction
https://openalex.org/W2016279588,RETRACTED ARTICLE: Adaptive neuro-fuzzy evaluation of wind farm power production as function of wind speed and direction,Stochastic Environmental Research and Risk Assessment,24,https://doi.org/10.1007/s00477-014-0901-8,https://api.labs.crossref.org/works/https://doi.org/10.1007/s00477-014-0901-8?mailto=christian.hauschke@tib.eu,2014,article,True,93,Electricity Price and Load Forecasting Methods,Physical Sciences,Electrical and Electronic Engineering,Springer Science+Business Media,False,en,Engineering,Retraction
https://openalex.org/W2027523686,Differential temporal expression of S100β in developing rat brain,Frontiers in Cellular Neuroscience,24,https://doi.org/10.3389/fncel.2015.00087,https://api.labs.crossref.org/works/https://doi.org/10.3389/fncel.2015.00087?mailto=christian.hauschke@tib.eu,2015,article,True,93,"S100 Proteins: Structure, Function, and Pathology",Life Sciences,Molecular Biology,Frontiers Media,True,en,"Biochemistry, Genetics and Molecular Biology",Retraction
https://openalex.org/W2044585846,Imbalance of Circulating Monocyte Subsets and PD-1 Dysregulation in Q Fever Endocarditis: The Role of IL-10 in PD-1 Modulation,PLOS ONE,24,https://doi.org/10.1371/journal.pone.0107533,https://api.labs.crossref.org/works/https://doi.org/10.1371/journal.pone.0107533?mailto=christian.hauschke@tib.eu,2014,article,True,93,Tick-Borne Diseases and Pathogens Transmission,Life Sciences,Parasitology,Public Library of Science,True,en,Immunology and Microbiology,Expression of concern
https://openalex.org/W2073791535,MicroRNA-92 promotes gastric cancer cell proliferation and invasion through targeting FXR,Tumor Biology,24,https://doi.org/10.1007/s13277-014-2342-x,https://api.labs.crossref.org/works/https://doi.org/10.1007/s13277-014-2342-x?mailto=christian.hauschke@tib.eu,2014,article,True,93,MicroRNA Regulation in Cancer and Development,Life Sciences,Cancer Research,SAGE Publishing,False,en,"Biochemistry, Genetics and Molecular Biology",Retraction
https://openalex.org/W2074806374,Induced Alpha Rhythms Track the Content and Quality of Visual Working Memory Representations with High Temporal Precision,The Journal of Neuroscience,24,https://doi.org/10.1523/jneurosci.0293-14.2014,https://api.labs.crossref.org/works/https://doi.org/10.1523/jneurosci.0293-14.2014?mailto=christian.hauschke@tib.eu,2014,article,True,93,Neuronal Oscillations in Cortical Networks,Life Sciences,Cognitive Neuroscience,Society for Neuroscience,True,en,Neuroscience,Retraction
https://openalex.org/W2081704400,Clinical Impact of De-Regulated Notch-1 and Notch-3 in the Development and Progression of HPV-Associated Different Histological Subtypes of Precancerous and Cancerous Lesions of Human Uterine Cervix,PLOS ONE,24,https://doi.org/10.1371/journal.pone.0098642,https://api.labs.crossref.org/works/https://doi.org/10.1371/journal.pone.0098642?mailto=christian.hauschke@tib.eu,2014,article,True,93,Human Papillomavirus and Cervical Cancer Epidemiology,Health Sciences,Epidemiology,Public Library of Science,True,en,Medicine,Retraction
