id,display_name,primary_location_display_name,cited_by_count,doi,crossref_call,publication_year,type,is_retracted,cited_by_percentile_year_min,primary_topic_display_name,primary_topic_domain_display_name,primary_topic_subfield_display_name,primary_location_source_host_organization_name,open_access_is_oa,language,primary_topic_field_display_name,update_nature
https://openalex.org/W4283275844,Effects of Routine Health Care Combined with Oral Vitamin D on Linear Growth in 5-Year-Old Children,Evidence-based Complementary and Alternative Medicine,1,https://doi.org/10.1155/2022/4677795,https://api.labs.crossref.org/works/https://doi.org/10.1155/2022/4677795?mailto=christian.hauschke@tib.eu,2022,article,True,69,Maternal and Child Nutrition in Developing Countries,Health Sciences,Nutrition and Dietetics,Hindawi Publishing Corporation,True,en,Nursing,Retraction
https://openalex.org/W4283276841,The Bioinformatic Study Uncovers Probable Critical Genes Involved in the Pathophysiology of Biliary Atresia,Computational and Mathematical Methods in Medicine,1,https://doi.org/10.1155/2022/9108804,https://api.labs.crossref.org/works/https://doi.org/10.1155/2022/9108804?mailto=christian.hauschke@tib.eu,2022,article,True,69,Pathogenesis and Management of Biliary Atresia,Health Sciences,Surgery,Hindawi Publishing Corporation,True,en,Medicine,Retraction
https://openalex.org/W4283310653,Effect Evaluation of Comfort Nursing Materials Assisted Nursing for Patients with Advanced Malignant Tumor,Scanning,1,https://doi.org/10.1155/2022/4766252,https://api.labs.crossref.org/works/https://doi.org/10.1155/2022/4766252?mailto=christian.hauschke@tib.eu,2022,article,True,69,Intelligent Manufacturing Technologies,Physical Sciences,Industrial and Manufacturing Engineering,Wiley,True,en,Engineering,Retraction
https://openalex.org/W4283318321,Research Status of Sports Industry Laws from the Perspective of Knowledge Graph,Security and Communication Networks,1,https://doi.org/10.1155/2022/6541921,https://api.labs.crossref.org/works/https://doi.org/10.1155/2022/6541921?mailto=christian.hauschke@tib.eu,2022,article,True,69,Evolution and Impacts of Event Tourism,Social Sciences,Sociology and Political Science,Hindawi Publishing Corporation,True,en,Social Sciences,Retraction
https://openalex.org/W4283320405,Genetic Relationship and Evolution Analysis among Malus Mill Plant Populations Based on SCoT Molecular Markers,Computational and Mathematical Methods in Medicine,1,https://doi.org/10.1155/2022/1002624,https://api.labs.crossref.org/works/https://doi.org/10.1155/2022/1002624?mailto=christian.hauschke@tib.eu,2022,article,True,69,Biosynthesis and Engineering of Terpenoids,Life Sciences,Molecular Biology,Hindawi Publishing Corporation,True,en,"Biochemistry, Genetics and Molecular Biology",Retraction
https://openalex.org/W4283323784,Large-Scale Shopping Mall Architectural Design Based on Intelligent BIM Technology,Security and Communication Networks,1,https://doi.org/10.1155/2022/3116074,https://api.labs.crossref.org/works/https://doi.org/10.1155/2022/3116074?mailto=christian.hauschke@tib.eu,2022,article,True,69,Building Information Modeling in Construction Industry,Physical Sciences,Building and Construction,Hindawi Publishing Corporation,True,en,Engineering,Retraction
https://openalex.org/W4283326182,Part Classification Prediction Based on Convolutional Neural Network,Mobile Information Systems,1,https://doi.org/10.1155/2022/5767818,https://api.labs.crossref.org/works/https://doi.org/10.1155/2022/5767818?mailto=christian.hauschke@tib.eu,2022,article,True,69,Fabric Defect Detection in Industrial Applications,Physical Sciences,Industrial and Manufacturing Engineering,IOS Press,True,en,Engineering,Retraction
https://openalex.org/W4283326549,Intertextuality between French Literature Creation and Literature Translation Based on Feature Extraction and Gram Matrix,Wireless Communications and Mobile Computing,1,https://doi.org/10.1155/2022/9375840,https://api.labs.crossref.org/works/https://doi.org/10.1155/2022/9375840?mailto=christian.hauschke@tib.eu,2022,article,True,69,Statistical Machine Translation and Natural Language Processing,Physical Sciences,Artificial Intelligence,Wiley,True,en,Computer Science,Retraction
https://openalex.org/W4283328335,Effects of Obstructive Sleep Apnea-Hypopnea Syndrome and Cognitive Function in Ischemic Stroke Based on Linear Regression Equation,Scanning,1,https://doi.org/10.1155/2022/4105169,https://api.labs.crossref.org/works/https://doi.org/10.1155/2022/4105169?mailto=christian.hauschke@tib.eu,2022,article,True,69,Intelligent Manufacturing Technologies,Physical Sciences,Industrial and Manufacturing Engineering,Wiley,True,en,Engineering,Retraction
https://openalex.org/W4283329403,Walking Position Data in Football Training Based on Embedded Action Recognition System,Mobile Information Systems,1,https://doi.org/10.1155/2022/4094025,https://api.labs.crossref.org/works/https://doi.org/10.1155/2022/4094025?mailto=christian.hauschke@tib.eu,2022,article,True,69,Human Action Recognition and Pose Estimation,Physical Sciences,Computer Vision and Pattern Recognition,IOS Press,True,en,Computer Science,Retraction
https://openalex.org/W4283330342,Data Verification of Logical Pk-Anonymization with Big Data Application and Key Generation in Cloud Computing,Journal of function spaces,1,https://doi.org/10.1155/2022/8345536,https://api.labs.crossref.org/works/https://doi.org/10.1155/2022/8345536?mailto=christian.hauschke@tib.eu,2022,article,True,69,Security Challenges in Cloud Computing,Physical Sciences,Information Systems,Hindawi Publishing Corporation,True,en,Computer Science,Retraction
https://openalex.org/W4283369512,Experimental Study on Compressive Strength of Ultrahigh Performance Concrete Prefabricated Wall Structure,Journal of Chemistry,1,https://doi.org/10.1155/2022/3380144,https://api.labs.crossref.org/works/https://doi.org/10.1155/2022/3380144?mailto=christian.hauschke@tib.eu,2022,article,True,69,Influence of Recycled Aggregate Concrete on Construction,Physical Sciences,Building and Construction,Hindawi Publishing Corporation,True,en,Engineering,Retraction
https://openalex.org/W4283376254,Intelligent Basketball Dribble Trajectory Monitoring Based on Data-Driven Technology,Security and Communication Networks,1,https://doi.org/10.1155/2022/2639539,https://api.labs.crossref.org/works/https://doi.org/10.1155/2022/2639539?mailto=christian.hauschke@tib.eu,2022,article,True,69,Smart Technology and Data Analytics Applications,Physical Sciences,Information Systems,Hindawi Publishing Corporation,True,en,Computer Science,Retraction
https://openalex.org/W4283377967,Augmented Reality Interactive Guide System and Method for Tourist Attractions Based on Geographic Location,Journal of Electrical and Computer Engineering,1,https://doi.org/10.1155/2022/7606289,https://api.labs.crossref.org/works/https://doi.org/10.1155/2022/7606289?mailto=christian.hauschke@tib.eu,2022,article,True,69,Augmented Reality and its Applications,Physical Sciences,Computer Vision and Pattern Recognition,Hindawi Publishing Corporation,True,en,Computer Science,Retraction
https://openalex.org/W4283386294,Evaluation and Analysis of Traditional Customary Law Based on the Perspective of Big Data,Computational and Mathematical Methods in Medicine,1,https://doi.org/10.1155/2022/5088630,https://api.labs.crossref.org/works/https://doi.org/10.1155/2022/5088630?mailto=christian.hauschke@tib.eu,2022,article,True,69,Artificial Intelligence and Technology Innovation,Physical Sciences,Artificial Intelligence,Hindawi Publishing Corporation,True,en,Computer Science,Retraction
https://openalex.org/W4283386379,Care Bundles plus Detailed Nursing on Mortality and Nursing Satisfaction of Patients with Septic Shock in ICU,Evidence-based Complementary and Alternative Medicine,1,https://doi.org/10.1155/2022/1177961,https://api.labs.crossref.org/works/https://doi.org/10.1155/2022/1177961?mailto=christian.hauschke@tib.eu,2022,article,True,69,Management of Delirium in Critical Care Patients,Health Sciences,Critical Care and Intensive Care Medicine,Hindawi Publishing Corporation,True,en,Medicine,Retraction
https://openalex.org/W4283392502,Curcumin Plant for Colorectal Cancer Prediction and Prevention Using In Silico Molecular Analysis; HOT-MELT Extrusion,Evidence-based Complementary and Alternative Medicine,1,https://doi.org/10.1155/2022/4376960,https://api.labs.crossref.org/works/https://doi.org/10.1155/2022/4376960?mailto=christian.hauschke@tib.eu,2022,article,True,69,Bioavailability and Health Effects of Curcumin,Life Sciences,Molecular Medicine,Hindawi Publishing Corporation,True,en,"Biochemistry, Genetics and Molecular Biology",Retraction
https://openalex.org/W4283392761,Library Document Resource Construction and Data Sharing Based on Semantic Web Technology,Mobile Information Systems,1,https://doi.org/10.1155/2022/2168655,https://api.labs.crossref.org/works/https://doi.org/10.1155/2022/2168655?mailto=christian.hauschke@tib.eu,2022,article,True,69,Data Sharing and Stewardship in Science,Physical Sciences,Information Systems,IOS Press,True,en,Computer Science,Retraction
https://openalex.org/W4283446039,Evolutionary Analysis of Supply Chain Integration Strategy on Chinese Steel-Producing Firms considering Policy Risk Cost Factor,Computational Intelligence and Neuroscience,1,https://doi.org/10.1155/2022/1136601,https://api.labs.crossref.org/works/https://doi.org/10.1155/2022/1136601?mailto=christian.hauschke@tib.eu,2022,article,True,69,Conceptualizing the Circular Economy and Sustainable Supply Chains,Social Sciences,Strategy and Management,Hindawi Publishing Corporation,True,en,"Business, Management and Accounting",Retraction
https://openalex.org/W4283446836,Prediction of Dissolved Oxygen Concentration in Sewage Treatment Process Based on Data Recognition Algorithm,International Journal of Analytical Chemistry,1,https://doi.org/10.1155/2022/1525902,https://api.labs.crossref.org/works/https://doi.org/10.1155/2022/1525902?mailto=christian.hauschke@tib.eu,2022,article,True,69,Intelligent Manufacturing Technologies,Physical Sciences,Industrial and Manufacturing Engineering,Hindawi Publishing Corporation,True,en,Engineering,Retraction
https://openalex.org/W4283448002,Key Technologies of Digital Protection of Historical and Cultural Heritage Based on Virtual Reality Technology,Mobile Information Systems,1,https://doi.org/10.1155/2022/1598160,https://api.labs.crossref.org/works/https://doi.org/10.1155/2022/1598160?mailto=christian.hauschke@tib.eu,2022,article,True,69,3D Geospatial Modelling Techniques,Physical Sciences,Geology,IOS Press,True,en,Earth and Planetary Sciences,Retraction
https://openalex.org/W4283451071,Chemical Regulation Effect of Water Use Efficiency of Maize Intercropping,Journal of Chemistry,1,https://doi.org/10.1155/2022/2914749,https://api.labs.crossref.org/works/https://doi.org/10.1155/2022/2914749?mailto=christian.hauschke@tib.eu,2022,article,True,69,Intelligent Manufacturing Technologies,Physical Sciences,Industrial and Manufacturing Engineering,Hindawi Publishing Corporation,True,en,Engineering,Retraction
https://openalex.org/W4283453331,The Influence of Children’s Psychological Language Development Based on Computer Digital Statistics Technology,Wireless Communications and Mobile Computing,1,https://doi.org/10.1155/2022/2897440,https://api.labs.crossref.org/works/https://doi.org/10.1155/2022/2897440?mailto=christian.hauschke@tib.eu,2022,article,True,69,Language Development and Acquisition in Children,Social Sciences,Developmental and Educational Psychology,Wiley,True,en,Psychology,Retraction
https://openalex.org/W4283454050,Analysis of the Clinical Value of MAGE-A9 Expressions in Cervical Cancer Tissues and PBMC,Emergency Medicine International,1,https://doi.org/10.1155/2022/1417752,https://api.labs.crossref.org/works/https://doi.org/10.1155/2022/1417752?mailto=christian.hauschke@tib.eu,2022,article,True,69,Immunobiology of Dendritic Cells,Life Sciences,Immunology,Hindawi Publishing Corporation,True,en,Immunology and Microbiology,
https://openalex.org/W4283457255,Efficacy and Mechanism of Roxadustat plus Oral Iron in the Treatment of Elderly Chronic Kidney Disease with Anemia,Evidence-based Complementary and Alternative Medicine,1,https://doi.org/10.1155/2022/9192655,https://api.labs.crossref.org/works/https://doi.org/10.1155/2022/9192655?mailto=christian.hauschke@tib.eu,2022,article,True,69,Role of Erythropoietin in Disease Treatment and Management,Health Sciences,Hematology,Hindawi Publishing Corporation,True,en,Medicine,Retraction
https://openalex.org/W4283457533,Intelligent Storage Data Classification System Based on the BP Neural Network,Journal of Control Science and Engineering,1,https://doi.org/10.1155/2022/5771148,https://api.labs.crossref.org/works/https://doi.org/10.1155/2022/5771148?mailto=christian.hauschke@tib.eu,2022,article,True,69,Intelligent Manufacturing Technologies,Physical Sciences,Industrial and Manufacturing Engineering,Hindawi Publishing Corporation,True,en,Engineering,Retraction
https://openalex.org/W4283457619,The Management of Educational Talents in Vocational Colleges Based on Wireless Network in the Artificial Intelligence Era,Computational Intelligence and Neuroscience,1,https://doi.org/10.1155/2022/2298139,https://api.labs.crossref.org/works/https://doi.org/10.1155/2022/2298139?mailto=christian.hauschke@tib.eu,2022,article,True,69,Knowledge Base Graph Embedding for Visual Question Answering,Physical Sciences,Artificial Intelligence,Hindawi Publishing Corporation,True,en,Computer Science,Retraction
https://openalex.org/W4283457829,"Synthesis, In Silico and Pharmacological Evaluation of New Thiazolidine-4-Carboxylic Acid Derivatives Against Ethanol-Induced Neurodegeneration and Memory Impairment",Journal of Inflammation Research,1,https://doi.org/10.2147/jir.s357082,https://api.labs.crossref.org/works/https://doi.org/10.2147/jir.s357082?mailto=christian.hauschke@tib.eu,2022,article,True,69,Role of Microglia in Neurological Disorders,Life Sciences,Neurology,Dove Medical Press,True,en,Neuroscience,Retraction
https://openalex.org/W4283458201,Research and Implementation of Civil Residence Right of Internet of Things for Smart Home,Mobile Information Systems,1,https://doi.org/10.1155/2022/7277581,https://api.labs.crossref.org/works/https://doi.org/10.1155/2022/7277581?mailto=christian.hauschke@tib.eu,2022,article,True,69,Legal and Regulatory Studies in Indonesia and China,Social Sciences,Political Science and International Relations,IOS Press,True,en,Social Sciences,Retraction
https://openalex.org/W4283463134,Genetic algorithm-based data controlling method using IoT-enabled WSN in power grid,Soft Computing,1,https://doi.org/10.1007/s00500-022-07186-6,https://api.labs.crossref.org/works/https://doi.org/10.1007/s00500-022-07186-6?mailto=christian.hauschke@tib.eu,2022,article,True,69,Wireless Sensor Networks: Survey and Applications,Physical Sciences,Computer Networks and Communications,Springer Science+Business Media,False,en,Computer Science,Retraction;Crossmark Retraction
https://openalex.org/W4283516837,Research on Virtual Interactive Animation Design System Based on Deep Learning,Computational Intelligence and Neuroscience,1,https://doi.org/10.1155/2022/5035369,https://api.labs.crossref.org/works/https://doi.org/10.1155/2022/5035369?mailto=christian.hauschke@tib.eu,2022,article,True,69,Efficient Cooperative Image Transmission in Sensor Networks,Physical Sciences,Computer Networks and Communications,Hindawi Publishing Corporation,True,en,Computer Science,Retraction
https://openalex.org/W4283575408,Cognitive Analysis of Pragmatic Functions of Discourse Markers in Spoken English in the Context of Computational Intelligence,Journal of Environmental and Public Health,1,https://doi.org/10.1155/2022/9883324,https://api.labs.crossref.org/works/https://doi.org/10.1155/2022/9883324?mailto=christian.hauschke@tib.eu,2022,article,True,69,Artificial Intelligence in Education and Technology,Physical Sciences,Artificial Intelligence,Hindawi Publishing Corporation,True,en,Computer Science,Retraction
https://openalex.org/W4283577055,Mechanical Motion Trajectory Control Tracking System Based on Machine Learning Algorithm,Mobile Information Systems,1,https://doi.org/10.1155/2022/5335199,https://api.labs.crossref.org/works/https://doi.org/10.1155/2022/5335199?mailto=christian.hauschke@tib.eu,2022,article,True,69,Smart Technology and Data Analytics Applications,Physical Sciences,Information Systems,IOS Press,True,en,Computer Science,Retraction
https://openalex.org/W4283580695,GIS Multimedia Technology in Regional Construction Land Suitability Evaluation in Mountainous Villages and Towns,Computational Intelligence and Neuroscience,1,https://doi.org/10.1155/2022/8305285,https://api.labs.crossref.org/works/https://doi.org/10.1155/2022/8305285?mailto=christian.hauschke@tib.eu,2022,article,True,69,Land-Use Suitability Assessment Using GIS,Physical Sciences,"Management, Monitoring, Policy and Law",Hindawi Publishing Corporation,True,en,Environmental Science,Retraction
https://openalex.org/W4283584145,Clinical Effectiveness of Free Upper Arm Medial Flap in Repairing Skin and Soft Tissue Defects of the Dorsum of the Hand,Evidence-based Complementary and Alternative Medicine,1,https://doi.org/10.1155/2022/7144037,https://api.labs.crossref.org/works/https://doi.org/10.1155/2022/7144037?mailto=christian.hauschke@tib.eu,2022,article,True,69,Microsurgical Reconstruction Techniques,Health Sciences,Surgery,Hindawi Publishing Corporation,True,en,Medicine,Retraction
https://openalex.org/W4283587469,Privacy Protection Algorithm Model of We-Media Network from the Perspective of Big Data,Wireless Communications and Mobile Computing,1,https://doi.org/10.1155/2022/4334979,https://api.labs.crossref.org/works/https://doi.org/10.1155/2022/4334979?mailto=christian.hauschke@tib.eu,2022,article,True,69,Privacy-Preserving Techniques for Data Analysis and Machine Learning,Physical Sciences,Artificial Intelligence,Wiley,True,en,Computer Science,Retraction
https://openalex.org/W4283646795,An Optical Fiber Sensing Method for Measuring the Surface Flatness of an Object,Computational Intelligence and Neuroscience,1,https://doi.org/10.1155/2022/8023271,https://api.labs.crossref.org/works/https://doi.org/10.1155/2022/8023271?mailto=christian.hauschke@tib.eu,2022,article,True,69,Fiber Optic Sensor Technology,Physical Sciences,Electrical and Electronic Engineering,Hindawi Publishing Corporation,True,en,Engineering,Retraction
https://openalex.org/W4283652268,Effects of Amiodarone and Esmolol for Heart Rate and Cardiovascular Changes,Emergency Medicine International,1,https://doi.org/10.1155/2022/9197369,https://api.labs.crossref.org/works/https://doi.org/10.1155/2022/9197369?mailto=christian.hauschke@tib.eu,2022,article,True,69,Analysis and Applications of Heart Rate Variability,Health Sciences,Cardiology and Cardiovascular Medicine,Hindawi Publishing Corporation,True,en,Medicine,Retraction
https://openalex.org/W4283657960,Application of Expert Adjustable Fuzzy Control Algorithm in Temperature Control System of Injection Machines,Computational Intelligence and Neuroscience,1,https://doi.org/10.1155/2022/3616814,https://api.labs.crossref.org/works/https://doi.org/10.1155/2022/3616814?mailto=christian.hauschke@tib.eu,2022,article,True,69,Optimization of Injection Molding Processes,Physical Sciences,Mechanical Engineering,Hindawi Publishing Corporation,True,en,Engineering,Retraction
https://openalex.org/W4283687100,Performance of PBL-Based Image Teaching in Clinical Emergency Teaching,Computational and Mathematical Methods in Medicine,1,https://doi.org/10.1155/2022/6096688,https://api.labs.crossref.org/works/https://doi.org/10.1155/2022/6096688?mailto=christian.hauschke@tib.eu,2022,article,True,69,Transformation of Medical Education and Professionalism,Health Sciences,"Public Health, Environmental and Occupational Health",Hindawi Publishing Corporation,True,en,Medicine,Retraction
https://openalex.org/W4283687944,High-Concurrency and High-Performance Application of Microservice Order System Based on Big Data,Security and Communication Networks,1,https://doi.org/10.1155/2022/3424283,https://api.labs.crossref.org/works/https://doi.org/10.1155/2022/3424283?mailto=christian.hauschke@tib.eu,2022,article,True,69,Log Analysis and System Performance Diagnosis,Physical Sciences,Computer Networks and Communications,Hindawi Publishing Corporation,True,en,Computer Science,
https://openalex.org/W4283688703,Effect of Ruanjian Xiaoying Granules on Hashimoto Rats with Depression of Liver and Deficiency of Spleen and Effect on Intestinal Microflora,Contrast Media & Molecular Imaging,1,https://doi.org/10.1155/2022/8221124,https://api.labs.crossref.org/works/https://doi.org/10.1155/2022/8221124?mailto=christian.hauschke@tib.eu,2022,article,True,69,Diversity and Function of Gut Microbiome,Life Sciences,Molecular Biology,Hindawi Publishing Corporation,True,en,"Biochemistry, Genetics and Molecular Biology",Retraction
https://openalex.org/W4283689823,Interactive Music Teaching Method Based on Big Data and Cloud Computing,Mobile Information Systems,1,https://doi.org/10.1155/2022/1803497,https://api.labs.crossref.org/works/https://doi.org/10.1155/2022/1803497?mailto=christian.hauschke@tib.eu,2022,article,True,69,Comprehensive Survey of Big Data Mining Approaches,Physical Sciences,Information Systems,IOS Press,True,en,Computer Science,Retraction
https://openalex.org/W4283691681,A Comparative Study on the Suitability and Treatment Compliance of an Improved Wristband Wearing Method Compared with the Traditional Method,Computational and Mathematical Methods in Medicine,1,https://doi.org/10.1155/2022/6789292,https://api.labs.crossref.org/works/https://doi.org/10.1155/2022/6789292?mailto=christian.hauschke@tib.eu,2022,article,True,69,Impact of Medical Malpractice on Healthcare System,Health Sciences,Pharmacy,Hindawi Publishing Corporation,True,en,Health Professions,Retraction
https://openalex.org/W4283692327,Precision Analysis of Noncircular Gears Based on CNC Machining Technology under Cloud Computing Platform,Shock and Vibration,1,https://doi.org/10.1155/2022/1359084,https://api.labs.crossref.org/works/https://doi.org/10.1155/2022/1359084?mailto=christian.hauschke@tib.eu,2022,article,True,69,Computer Numerical Control Systems in Manufacturing,Physical Sciences,Industrial and Manufacturing Engineering,Hindawi Publishing Corporation,True,en,Engineering,
https://openalex.org/W4283692614,Sales Forecast of Marketing Brand Based on BP Neural Network Model,Computational Intelligence and Neuroscience,1,https://doi.org/10.1155/2022/1769424,https://api.labs.crossref.org/works/https://doi.org/10.1155/2022/1769424?mailto=christian.hauschke@tib.eu,2022,article,True,69,Factors Influencing Wine Tourism and Consumer Behavior,Social Sciences,"Tourism, Leisure and Hospitality Management",Hindawi Publishing Corporation,True,en,"Business, Management and Accounting",Retraction
https://openalex.org/W4283693292,Decision Model of Wireless Communication Scheme Evaluation via Interval Number,Security and Communication Networks,1,https://doi.org/10.1155/2022/5916061,https://api.labs.crossref.org/works/https://doi.org/10.1155/2022/5916061?mailto=christian.hauschke@tib.eu,2022,article,True,69,Neural Network Fundamentals and Applications,Physical Sciences,Artificial Intelligence,Hindawi Publishing Corporation,True,en,Computer Science,
https://openalex.org/W4283700233,RETRACTED: Effect of CaCO3 whiskers on tensile properties of ultra-high-performance engineered cementitious composites,Journal of Building Engineering,1,https://doi.org/10.1016/j.jobe.2022.104896,https://api.labs.crossref.org/works/https://doi.org/10.1016/j.jobe.2022.104896?mailto=christian.hauschke@tib.eu,2022,article,True,69,Fiber Reinforced Concrete in Civil Engineering,Physical Sciences,Civil and Structural Engineering,Elsevier BV,False,en,Engineering,Retraction;Crossmark Retraction
https://openalex.org/W4283702980,On the Innovation Mechanism and Communication Path of Philosophical Thinking in Innovative Community Environment,Journal of Environmental and Public Health,1,https://doi.org/10.1155/2022/7359420,https://api.labs.crossref.org/works/https://doi.org/10.1155/2022/7359420?mailto=christian.hauschke@tib.eu,2022,article,True,69,Environmental Risk Assessment in Various Contexts,Physical Sciences,"Health, Toxicology and Mutagenesis",Hindawi Publishing Corporation,True,en,Environmental Science,Retraction
https://openalex.org/W4283705491,Oblique Crack Propagation of Brittle Rock under Uniaxial Compression and Its Influencing Factors,Wireless Communications and Mobile Computing,1,https://doi.org/10.1155/2022/1951885,https://api.labs.crossref.org/works/https://doi.org/10.1155/2022/1951885?mailto=christian.hauschke@tib.eu,2022,article,True,69,Rock Mechanics and Engineering,Physical Sciences,Mechanics of Materials,Wiley,True,en,Engineering,Retraction
https://openalex.org/W4283709010,Application of Internet of Things Architecture in Intelligent Classroom Teaching Analysis in Colleges and Universities,Mobile Information Systems,1,https://doi.org/10.1155/2022/4831937,https://api.labs.crossref.org/works/https://doi.org/10.1155/2022/4831937?mailto=christian.hauschke@tib.eu,2022,article,True,69,Smart Technology and Data Analytics Applications,Physical Sciences,Information Systems,IOS Press,True,en,Computer Science,Retraction
