id,display_name,primary_location_display_name,cited_by_count,doi,crossref_call,publication_year,type,is_retracted,cited_by_percentile_year_min,primary_topic_display_name,primary_topic_domain_display_name,primary_topic_subfield_display_name,primary_location_source_host_organization_name,open_access_is_oa,language,primary_topic_field_display_name,update_nature
https://openalex.org/W2547072734,Notice of Retraction: Research on the Evolution Mechanism of Enterprise Strategic Alliances Based on Resources Perspective,,0,https://doi.org/10.1109/wicom.2007.1044,https://api.labs.crossref.org/works/https://doi.org/10.1109/wicom.2007.1044?mailto=christian.hauschke@tib.eu,2007,article,True,0,Knowledge Management and Organizational Innovation,Social Sciences,Strategy and Management,,False,en,"Business, Management and Accounting",Retraction
https://openalex.org/W2563078332,WITHDRAWN: Designing and computational validation of microarray probe sets for the diagnosis of viruses of non-human vertebrates,Molecular and Cellular Probes,0,https://doi.org/10.1016/j.mcp.2016.12.004,https://api.labs.crossref.org/works/https://doi.org/10.1016/j.mcp.2016.12.004?mailto=christian.hauschke@tib.eu,2018,article,True,0,Viral Diseases in Livestock and Poultry,Life Sciences,Animal Science and Zoology,Elsevier BV,False,en,Agricultural and Biological Sciences,Retraction
https://openalex.org/W2572713229,Retracted: Rough standard neutrosophic sets: an application on standard neutrosophic information systems,Journal of Fundamental and Applied Sciences,0,https://doi.org/10.4314/jfas.v10i4s.84,https://api.labs.crossref.org/works/https://doi.org/10.4314/jfas.v10i4s.84?mailto=christian.hauschke@tib.eu,2018,article,True,0,Rough Sets Theory and Applications,Physical Sciences,Computational Theory and Mathematics,University of El Oued,False,en,Computer Science,
https://openalex.org/W2738605604,RETRACTED ARTICLE: Edge-Oriented Spatial Interpolation for Error Concealment of Consecutive Blocks,Journal of Computer Science and Technology,0,https://doi.org/10.1007/s11390-007-9044-4,https://api.labs.crossref.org/works/https://doi.org/10.1007/s11390-007-9044-4?mailto=christian.hauschke@tib.eu,2007,article,True,0,Reconfigurable Computing Systems and Design Methods,Physical Sciences,Hardware and Architecture,Springer Science+Business Media,False,en,Computer Science,Retraction
https://openalex.org/W2763535308,NOTICE OF RETRACTION: The Journal regretfully retracts the following paper: A Feasibility Study of a Top-Casing Electric Source Method for Detecting and Imaging a Shallow Hydraulically-Active Fractured Zone: 3D Finite Element Direct Current Modeling Approach,Geophysical Journal International,0,https://doi.org/10.1093/gji/ggx431,https://api.labs.crossref.org/works/https://doi.org/10.1093/gji/ggx431?mailto=christian.hauschke@tib.eu,2019,article,True,0,Hydraulic Fracturing in Shale Gas Reservoirs,Physical Sciences,Mechanical Engineering,Oxford University Press,True,en,Engineering,Retraction
https://openalex.org/W2766442937,"RETRACTED: Doping a phosphorescent rhenium complex into a silica matrix: construction, characterization and oxygen emission sensing behavior",Journal of Luminescence,0,https://doi.org/10.1016/j.jlumin.2017.10.071,https://api.labs.crossref.org/works/https://doi.org/10.1016/j.jlumin.2017.10.071?mailto=christian.hauschke@tib.eu,2018,article,True,0,Aggregation-Induced Emission in Fluorescent Materials,Physical Sciences,Materials Chemistry,Elsevier BV,False,en,Materials Science,Retraction;Crossmark Retraction
https://openalex.org/W2767390473,RETRACTED: Magneto transport measurements to unravel the epitaxial strain control of magnetic anisotropy in Ga1−xMnxAs/InGaAs layers,Journal of Magnetism and Magnetic Materials,0,https://doi.org/10.1016/j.jmmm.2017.11.001,https://api.labs.crossref.org/works/https://doi.org/10.1016/j.jmmm.2017.11.001?mailto=christian.hauschke@tib.eu,2018,article,True,0,Zinc Oxide Nanostructures,Physical Sciences,Materials Chemistry,Elsevier BV,False,en,Materials Science,Retraction;Crossmark Retraction
https://openalex.org/W2767870738,Retraction: Effect of Acupuncture and Chinese Herbal Medicine on Subacute Stroke Outcomes: A Single Center Randomized Controlled Trial,Acupuncture in Medicine,0,https://doi.org/10.1136/acupmed-2016-011167,https://api.labs.crossref.org/works/https://doi.org/10.1136/acupmed-2016-011167?mailto=christian.hauschke@tib.eu,2018,article,True,0,Acupuncture Mechanisms and Clinical Applications,Health Sciences,Complementary and alternative medicine,SAGE Publishing,True,en,Medicine,Retraction
https://openalex.org/W2768019138,REVIEW ALGORITMA C-THETA* DAN PROSPEK IMPLEMENTASINYA DI MASA DEPAN,Jurnal Teknik Informatika,0,https://doi.org/10.15408/jti.v10i2.6991,https://api.labs.crossref.org/works/https://doi.org/10.15408/jti.v10i2.6991?mailto=christian.hauschke@tib.eu,2018,article,True,0,Digital Image Processing and Artificial Neural Networks,Physical Sciences,Artificial Intelligence,,True,en,Computer Science,Retraction
https://openalex.org/W2769535650,Determinants of Credit and Financing Risk: Evidence of Dual Banking System in Indonesia,Al-Iqtishad: Jurnal Ilmu Ekonomi Syariah,0,https://doi.org/10.15408/aiq.v10i1.5903,https://api.labs.crossref.org/works/https://doi.org/10.15408/aiq.v10i1.5903?mailto=christian.hauschke@tib.eu,2018,article,True,0,Islamic Banking and Finance Literature Review,Social Sciences,Accounting,Jakarta State Islamic University,True,en,"Business, Management and Accounting",Retraction
https://openalex.org/W2770019039,RETRACTED ARTICLE: Stress distribution in adhesively bonded scarf joint under thermo-mechanical loads,Journal of Adhesion,0,https://doi.org/10.1080/00218464.2017.1399359,https://api.labs.crossref.org/works/https://doi.org/10.1080/00218464.2017.1399359?mailto=christian.hauschke@tib.eu,2018,article,True,0,Composite Materials and Structures,Physical Sciences,Mechanics of Materials,Taylor & Francis,False,en,Engineering,Retraction
https://openalex.org/W2770441627,WITHDRAWN: Three-dimensional seismic evidence of extensive gas hydrate deposits linked with large free gas columns suggests long-range advection mechanisms,Marine and Petroleum Geology,0,https://doi.org/10.1016/j.marpetgeo.2017.11.025,https://api.labs.crossref.org/works/https://doi.org/10.1016/j.marpetgeo.2017.11.025?mailto=christian.hauschke@tib.eu,2018,article,True,0,Anaerobic Methane Oxidation and Gas Hydrates,Physical Sciences,Environmental Chemistry,Elsevier BV,False,en,Environmental Science,Retraction
https://openalex.org/W2771082591,REMOVED: A comprehensive investigation on temperature dependent plastic deformation behavior of one austenitic stainless steel,Journal of Materials Processing Technology,0,https://doi.org/10.1016/j.jmatprotec.2017.12.002,https://api.labs.crossref.org/works/https://doi.org/10.1016/j.jmatprotec.2017.12.002?mailto=christian.hauschke@tib.eu,2018,article,True,0,High-Strength Steel Materials,Physical Sciences,Mechanical Engineering,Elsevier BV,False,en,Engineering,Retraction
https://openalex.org/W2771523960,Einstein-Maxwell Theory without Symmetry and Examples of Geodesics in Space with Torsion,Canadian Journal of Physics,0,https://doi.org/10.1139/cjp-2017-0896,https://api.labs.crossref.org/works/https://doi.org/10.1139/cjp-2017-0896?mailto=christian.hauschke@tib.eu,2019,article,True,0,Cosmological Parameters and Dark Energy,Physical Sciences,Astronomy and Astrophysics,NRC Research Press,False,en,Physics and Astronomy,Retraction
https://openalex.org/W2775015759,"RETRACTED: A checklist of crabs and molluscan macrofauna in tropical mangrove systems, Malaysia",Regional Studies in Marine Science,0,https://doi.org/10.1016/j.rsma.2017.11.014,https://api.labs.crossref.org/works/https://doi.org/10.1016/j.rsma.2017.11.014?mailto=christian.hauschke@tib.eu,2018,article,True,0,Importance of Mangrove Ecosystems in Coastal Protection,Physical Sciences,Ecology,Elsevier BV,False,en,Environmental Science,Retraction;Crossmark Retraction
https://openalex.org/W2776632732,Joining the dots,Nature Plants,0,https://doi.org/10.1038/s41477-017-0086-5,https://api.labs.crossref.org/works/https://doi.org/10.1038/s41477-017-0086-5?mailto=christian.hauschke@tib.eu,2018,article,True,0,Betalains in Nutrition,Life Sciences,Food Science,Nature Portfolio,False,en,Agricultural and Biological Sciences,Retraction
https://openalex.org/W2778831753,A Study of The Low Frequency-Dependent PbO Based Schottky Barrier Diode,Canadian Journal of Physics,0,https://doi.org/10.1139/cjp-2017-0723,https://api.labs.crossref.org/works/https://doi.org/10.1139/cjp-2017-0723?mailto=christian.hauschke@tib.eu,2018,article,True,0,Physics and Chemistry of Schottky Barrier Height,Physical Sciences,"Atomic and Molecular Physics, and Optics",NRC Research Press,True,en,Physics and Astronomy,Retraction
https://openalex.org/W2779368133,RETRACTED CHAPTER: Artifact Rejection for Concurrent TMS-EEG Data,Springer eBooks,0,https://doi.org/10.1007/978-3-319-71976-4_6,https://api.labs.crossref.org/works/https://doi.org/10.1007/978-3-319-71976-4_6?mailto=christian.hauschke@tib.eu,2018,book-chapter,True,0,Neuronal Oscillations in Cortical Networks,Life Sciences,Cognitive Neuroscience,Springer Nature,False,en,Neuroscience,Retraction
https://openalex.org/W2782072066,WITHDRAWN: Stilamin inhibits intestinal and pancreatic injury in rats with severe acute pancreatitis by down-regulating LCN2 expression,Pancreatology,0,https://doi.org/10.1016/j.pan.2017.12.015,https://api.labs.crossref.org/works/https://doi.org/10.1016/j.pan.2017.12.015?mailto=christian.hauschke@tib.eu,2018,article,True,0,Diagnosis and Management of Pancreatitis,Health Sciences,Surgery,Elsevier BV,False,en,Medicine,Retraction
https://openalex.org/W2782186634,RETRACTED: 647: Compliance of federally-funded maternal fetal medicine and neonatology studies to federally-mandated trial registration requirements,American Journal of Obstetrics and Gynecology,0,https://doi.org/10.1016/j.ajog.2017.11.176,https://api.labs.crossref.org/works/https://doi.org/10.1016/j.ajog.2017.11.176?mailto=christian.hauschke@tib.eu,2018,article,True,0,Ethical Considerations in Medical Research Participation,Health Sciences,"Public Health, Environmental and Occupational Health",Elsevier BV,True,en,Medicine,Retraction
https://openalex.org/W2782284845,RETRACTED ARTICLE: Cross-camera multi-person tracking by leveraging fast graph mining algorithm,Multimedia Tools and Applications,0,https://doi.org/10.1007/s11042-017-5403-5,https://api.labs.crossref.org/works/https://doi.org/10.1007/s11042-017-5403-5?mailto=christian.hauschke@tib.eu,2018,article,True,0,Visual Object Tracking and Person Re-identification,Physical Sciences,Computer Vision and Pattern Recognition,Springer Science+Business Media,False,en,Computer Science,Retraction;Crossmark Retraction
https://openalex.org/W2782808480,Using pgRNA–Cas9 system to knockout MKL1 inhibited cell migration and proliferation,Cogent biology,0,https://doi.org/10.1080/23312025.2018.1426255,https://api.labs.crossref.org/works/https://doi.org/10.1080/23312025.2018.1426255?mailto=christian.hauschke@tib.eu,2018,article,True,0,Clustered Regularly Interspaced Short Palindromic Repeats and CRISPR-associated proteins,Life Sciences,Molecular Biology,Cogent OA,True,en,"Biochemistry, Genetics and Molecular Biology",Retraction
https://openalex.org/W2783120359,Notice of Retraction: Defects Identification in a TSV Daisy-Chain Structure by a Machine Learning Approach,IEEE Transactions on Electromagnetic Compatibility,0,https://doi.org/10.1109/temc.2017.2787769,https://api.labs.crossref.org/works/https://doi.org/10.1109/temc.2017.2787769?mailto=christian.hauschke@tib.eu,2018,article,True,0,Failure Analysis of Integrated Circuits,Physical Sciences,Electrical and Electronic Engineering,Institute of Electrical and Electronics Engineers,False,en,Engineering,Retraction
https://openalex.org/W2783198437,WITHDRAWN: Monitoring the prevalence of genetically modified (GM) maize in Iran food products,Food and Chemical Toxicology,0,https://doi.org/10.1016/j.fct.2018.01.010,https://api.labs.crossref.org/works/https://doi.org/10.1016/j.fct.2018.01.010?mailto=christian.hauschke@tib.eu,2018,article,True,0,Clustered Regularly Interspaced Short Palindromic Repeats and CRISPR-associated proteins,Life Sciences,Molecular Biology,Elsevier BV,False,en,"Biochemistry, Genetics and Molecular Biology",Retraction
https://openalex.org/W2783909559,RETRACTED ARTICLE: A scheme for detecting outliers using sequential adjacency among entities,Cluster Computing,0,https://doi.org/10.1007/s10586-017-1536-6,https://api.labs.crossref.org/works/https://doi.org/10.1007/s10586-017-1536-6?mailto=christian.hauschke@tib.eu,2018,article,True,0,Dynamics of Urban Structure through Spatial Network Analysis,Social Sciences,Urban Studies,Springer Science+Business Media,False,en,Social Sciences,Retraction
https://openalex.org/W2784126650,Retracted: A novel composite coating to improve the environmental adaptability of combustible cartridges,Polymer Composites,0,https://doi.org/10.1002/pc.24721,https://api.labs.crossref.org/works/https://doi.org/10.1002/pc.24721?mailto=christian.hauschke@tib.eu,2018,article,True,0,Flame Retardant Polymer Materials,Physical Sciences,Polymers and Plastics,Wiley-Blackwell,False,en,Materials Science,Retraction
https://openalex.org/W2784146483,RETRACTED: Three-Minutes Sitting Test for evaluating lumbar foraminal stenosis: A preliminary report,The Journal of Spinal Cord Medicine,0,https://doi.org/10.1080/10790268.2017.1420537,https://api.labs.crossref.org/works/https://doi.org/10.1080/10790268.2017.1420537?mailto=christian.hauschke@tib.eu,2018,article,True,0,Pathophysiology of Lumbar Disc Degeneration and Treatment,Health Sciences,Pathology and Forensic Medicine,Taylor & Francis,False,en,Medicine,Retraction
https://openalex.org/W2784192745,RETRACTED ARTICLE: Automatic test case generation for validating the dynamic behaviors of the complete solar power monitoring system,Multimedia Tools and Applications,0,https://doi.org/10.1007/s11042-017-5599-4,https://api.labs.crossref.org/works/https://doi.org/10.1007/s11042-017-5599-4?mailto=christian.hauschke@tib.eu,2018,article,True,0,Photovoltaic Maximum Power Point Tracking Techniques,Physical Sciences,"Renewable Energy, Sustainability and the Environment",Springer Science+Business Media,False,en,Energy,Retraction;Crossmark Retraction
https://openalex.org/W2784474641,RETRACTED ARTICLE: Anxiety and fragile learning,International Forum of Psychoanalysis,0,https://doi.org/10.1080/0803706x.2017.1420917,https://api.labs.crossref.org/works/https://doi.org/10.1080/0803706x.2017.1420917?mailto=christian.hauschke@tib.eu,2018,article,True,0,Dynamic Assessment in Educational Psychology,Social Sciences,Developmental and Educational Psychology,Taylor & Francis,True,en,Psychology,Retraction;Crossmark Retraction
https://openalex.org/W2784491106,RETRACTED CHAPTER: A Resource Allocation Algorithm Based on Game Theory in UDN,Springer eBooks,0,https://doi.org/10.1007/978-3-319-73564-1_45,https://api.labs.crossref.org/works/https://doi.org/10.1007/978-3-319-73564-1_45?mailto=christian.hauschke@tib.eu,2018,book-chapter,True,0,Next Generation 5G Wireless Networks,Physical Sciences,Electrical and Electronic Engineering,Springer Nature,False,en,Engineering,Retraction
https://openalex.org/W2785169548,Brain Natriuretic Peptide Levels in Acute Inferior Myocardial Infarction,Journal of Clinical Medicine Research,0,https://doi.org/10.14740/jocmr3324w,https://api.labs.crossref.org/works/https://doi.org/10.14740/jocmr3324w?mailto=christian.hauschke@tib.eu,2018,article,True,0,Diagnosis and Treatment of Heart Failure,Health Sciences,Cardiology and Cardiovascular Medicine,Elmer Press Inc.,True,en,Medicine,Retraction
https://openalex.org/W2785211987,RETRACTED ARTICLE: Research on the Method of Music Content Analysis Based on Fuzzy Classification,Wireless Personal Communications,0,https://doi.org/10.1007/s11277-018-5248-x,https://api.labs.crossref.org/works/https://doi.org/10.1007/s11277-018-5248-x?mailto=christian.hauschke@tib.eu,2018,article,True,0,Audio Signal Classification and Analysis,Physical Sciences,Signal Processing,Springer Science+Business Media,False,en,Computer Science,Retraction
https://openalex.org/W2785768241,RETRACTED ARTICLE: Efficient object analysis by leveraging deeply-trained object proposals prediction model,Multimedia Tools and Applications,0,https://doi.org/10.1007/s11042-017-5390-6,https://api.labs.crossref.org/works/https://doi.org/10.1007/s11042-017-5390-6?mailto=christian.hauschke@tib.eu,2018,article,True,0,Computational Modeling of Visual Saliency Detection,Physical Sciences,Computer Vision and Pattern Recognition,Springer Science+Business Media,True,en,Computer Science,Retraction;Crossmark Retraction
https://openalex.org/W2785878285,Electrical Characterizations of ZnO-Based MOS-Type Schottky Barrier Diodes,Canadian Journal of Physics,0,https://doi.org/10.1139/cjp-2017-0715,https://api.labs.crossref.org/works/https://doi.org/10.1139/cjp-2017-0715?mailto=christian.hauschke@tib.eu,2018,article,True,0,Physics and Chemistry of Schottky Barrier Height,Physical Sciences,"Atomic and Molecular Physics, and Optics",NRC Research Press,True,en,Physics and Astronomy,Retraction
https://openalex.org/W2787717394,RETRACTED ARTICLE: Design and Implementation of a System Security Experiment Platform Based on Cloud,Wireless Personal Communications,0,https://doi.org/10.1007/s11277-017-5149-4,https://api.labs.crossref.org/works/https://doi.org/10.1007/s11277-017-5149-4?mailto=christian.hauschke@tib.eu,2018,article,True,0,Characterization and Detection of Android Malware,Physical Sciences,Signal Processing,Springer Science+Business Media,False,en,Computer Science,Retraction
https://openalex.org/W2787854033,High-Frequency Characteristics of Al/ZnO/p-Si Schottky Barrier Diode,Canadian Journal of Physics,0,https://doi.org/10.1139/cjp-2017-0727,https://api.labs.crossref.org/works/https://doi.org/10.1139/cjp-2017-0727?mailto=christian.hauschke@tib.eu,2018,article,True,0,Physics and Chemistry of Schottky Barrier Height,Physical Sciences,"Atomic and Molecular Physics, and Optics",NRC Research Press,True,en,Physics and Astronomy,Retraction
https://openalex.org/W2789473176,ATC Malachlorite® for treatment of patients with acute Plasmodium falciparum infection: A pilot study incorporating 500 patients in the rural area of Cameroon,GSC biological and pharmaceutical sciences,0,https://doi.org/10.30574/gscbps.2018.2.2.0004,https://api.labs.crossref.org/works/https://doi.org/10.30574/gscbps.2018.2.2.0004?mailto=christian.hauschke@tib.eu,2018,article,True,0,Malaria,Health Sciences,"Public Health, Environmental and Occupational Health",,True,en,Medicine,Retraction
https://openalex.org/W2789537349,"RETRACTED ARTICLE: Losing control: Mostly incongruent lists postpone, but do not eliminate, the Stroop effect","Attention, Perception, & Psychophysics",0,https://doi.org/10.3758/s13414-018-1496-9,https://api.labs.crossref.org/works/https://doi.org/10.3758/s13414-018-1496-9?mailto=christian.hauschke@tib.eu,2018,article,True,0,Neural Mechanisms of Cognitive Control and Decision Making,Life Sciences,Cognitive Neuroscience,Springer Science+Business Media,True,en,Neuroscience,Retraction
https://openalex.org/W2789676754,REMOVED: Fatal penetrating injury to the neck due to defective airbag deployment,Pathology,0,https://doi.org/10.1016/j.pathol.2017.12.268,https://api.labs.crossref.org/works/https://doi.org/10.1016/j.pathol.2017.12.268?mailto=christian.hauschke@tib.eu,2018,article,True,0,Management of Rib Fractures in Trauma Patients,Health Sciences,Surgery,Elsevier BV,True,en,Medicine,Retraction
https://openalex.org/W2789688882,Retracted: Understanding the relationship of tourism demands connecting with economy and tourism stock index in an extreme case of Thailand bivariate extreme value copula approach,Journal of Fundamental and Applied Sciences,0,https://doi.org/10.4314/jfas.v10i5s.57,https://api.labs.crossref.org/works/https://doi.org/10.4314/jfas.v10i5s.57?mailto=christian.hauschke@tib.eu,2018,article,True,0,Tourism and its Impact on Communities,Social Sciences,Sociology and Political Science,University of El Oued,False,en,Social Sciences,
https://openalex.org/W2789697534,RETRACTED: Online Education Improves Dementia Knowledge: Evidence From an International Intervention,Journal of Applied Gerontology,0,https://doi.org/10.1177/0733464818762069,https://api.labs.crossref.org/works/https://doi.org/10.1177/0733464818762069?mailto=christian.hauschke@tib.eu,2018,article,True,0,Diagnosis and Management of Alzheimer's Disease,Health Sciences,Psychiatry and Mental health,SAGE Publishing,False,en,Medicine,Retraction
https://openalex.org/W2789704415,RETRACTED ARTICLE: Boundary spanning strategies of internet companies in the context of big data,Multimedia Tools and Applications,0,https://doi.org/10.1007/s11042-018-5643-z,https://api.labs.crossref.org/works/https://doi.org/10.1007/s11042-018-5643-z?mailto=christian.hauschke@tib.eu,2018,article,True,0,Competition in Two-Sided Markets,Social Sciences,Strategy and Management,Springer Science+Business Media,True,en,"Business, Management and Accounting",Retraction;Crossmark Retraction
https://openalex.org/W2790347135,RETRACTED ARTICLE: Data acquisition ad hoc network system based on wireless sensor,Multimedia Tools and Applications,0,https://doi.org/10.1007/s11042-018-5645-x,https://api.labs.crossref.org/works/https://doi.org/10.1007/s11042-018-5645-x?mailto=christian.hauschke@tib.eu,2018,article,True,0,Optimization of Big Data Processing and Analysis,Physical Sciences,Artificial Intelligence,Springer Science+Business Media,True,en,Computer Science,Retraction;Crossmark Retraction
https://openalex.org/W2790404709,"WASP (Write a Scientific Paper): ""As we may think"" - The internet and its research potential revisited",Early Human Development,0,https://doi.org/10.1016/j.earlhumdev.2018.01.011,https://api.labs.crossref.org/works/https://doi.org/10.1016/j.earlhumdev.2018.01.011?mailto=christian.hauschke@tib.eu,2018,article,True,0,Scientific Writing and Publication Practices,Social Sciences,History and Philosophy of Science,Elsevier BV,False,en,Arts and Humanities,Expression of concern
https://openalex.org/W2790600108,"Retracted: The study of consumer needs toward the hand-woven textiles handicraft group at Baan Na or, Muang district, Loei province",Journal of Fundamental and Applied Sciences,0,https://doi.org/10.4314/jfas.v10i5s.53,https://api.labs.crossref.org/works/https://doi.org/10.4314/jfas.v10i5s.53?mailto=christian.hauschke@tib.eu,2018,article,True,0,Concept and Measurement of Regional Competitiveness,Social Sciences,Strategy and Management,University of El Oued,False,en,"Business, Management and Accounting",
https://openalex.org/W2790644011,RETRACTED ARTICLE: Application of Monte Carlo calculation method based on special graph in medical imaging,Cluster Computing,0,https://doi.org/10.1007/s10586-018-2332-7,https://api.labs.crossref.org/works/https://doi.org/10.1007/s10586-018-2332-7?mailto=christian.hauschke@tib.eu,2018,article,True,0,Positron Emission Tomography Imaging in Oncology,Health Sciences,"Radiology, Nuclear Medicine and Imaging",Springer Science+Business Media,False,en,Medicine,Retraction
https://openalex.org/W2790689963,WITHDRAWAL – Administrative Duplicate Publication: Max Weber’s Finanzwissenschaft,Journal of Classical Sociology,0,https://doi.org/10.1177/1468795x18755602,https://api.labs.crossref.org/works/https://doi.org/10.1177/1468795x18755602?mailto=christian.hauschke@tib.eu,2018,article,True,0,Max Weber's Contributions to Sociology and Social Theory,Social Sciences,Sociology and Political Science,SAGE Publishing,False,de,Social Sciences,Retraction
https://openalex.org/W2790732639,RETRACTED ARTICLE: Analytical and FE modelling of bidirectional stress distributions in adhesively bonded step-lap joints under thermo-mechanical loads,Journal of Adhesion Science and Technology,0,https://doi.org/10.1080/01694243.2018.1446771,https://api.labs.crossref.org/works/https://doi.org/10.1080/01694243.2018.1446771?mailto=christian.hauschke@tib.eu,2018,article,True,0,Composite Materials and Structures,Physical Sciences,Mechanics of Materials,Taylor & Francis,True,en,Engineering,Retraction;Crossmark Retraction
https://openalex.org/W2790775598,Batch crystallization of rifapentine for inhalable tuberculosis medication,AIP Conference Proceedings,0,https://doi.org/10.1063/1.5023970,https://api.labs.crossref.org/works/https://doi.org/10.1063/1.5023970?mailto=christian.hauschke@tib.eu,2018,article,True,0,Pulmonary Drug Delivery Techniques,Health Sciences,Pulmonary and Respiratory Medicine,American Institute of Physics,False,en,Medicine,Retraction
https://openalex.org/W2790857228,RETRACTED REVIEW: A Companion to Latin Greece,Al-Masaq: Journal of the Medieval Mediterranean,0,https://doi.org/10.1080/09503110.2018.1426701,https://api.labs.crossref.org/works/https://doi.org/10.1080/09503110.2018.1426701?mailto=christian.hauschke@tib.eu,2018,article,True,0,Byzantine and Eastern Mediterranean Studies,Social Sciences,Classics,Taylor & Francis,False,en,Arts and Humanities,Retraction
https://openalex.org/W2790986521,WITHDRAWN: Corrigendum to “On the fast convergence modeling and accurate calculation of PV output energy for operation and planning studies” [Energy Convers. Manage. 89 (2015) 497–506],Energy Conversion and Management,0,https://doi.org/10.1016/j.enconman.2018.02.074,https://api.labs.crossref.org/works/https://doi.org/10.1016/j.enconman.2018.02.074?mailto=christian.hauschke@tib.eu,2018,article,True,0,Integration of Renewable Energy Systems in Power Grids,Physical Sciences,Electrical and Electronic Engineering,Elsevier BV,False,en,Engineering,Retraction;Crossmark Retraction
