id,display_name,primary_location_display_name,cited_by_count,doi,crossref_call,publication_year,type,is_retracted,cited_by_percentile_year_min,primary_topic_display_name,primary_topic_domain_display_name,primary_topic_subfield_display_name,primary_location_source_host_organization_name,open_access_is_oa,language,primary_topic_field_display_name,update_nature
https://openalex.org/W2773121259,"Synthesis of biologically active nickelocenyl–amino acid conjugates using 1,3-dipolar cycloaddition click reactions",Russian Journal of General Chemistry,2,https://doi.org/10.1134/s107036321711024x,https://api.labs.crossref.org/works/https://doi.org/10.1134/s107036321711024x?mailto=christian.hauschke@tib.eu,2017,article,True,76,Click Chemistry in Chemical Biology and Drug Development,Physical Sciences,Organic Chemistry,Pleiades Publishing,False,en,Chemistry,Retraction
https://openalex.org/W2775934141,RETRACTED CHAPTER: Arbuscular Mycorrhizal Fungi: A Potential Tool for Restoration of Degraded Land,Springer eBooks,2,https://doi.org/10.1007/978-3-319-68867-1_22,https://api.labs.crossref.org/works/https://doi.org/10.1007/978-3-319-68867-1_22?mailto=christian.hauschke@tib.eu,2017,book-chapter,True,76,Mycorrhizal Fungi and Plant Interactions,Life Sciences,Plant Science,Springer Nature,False,en,Agricultural and Biological Sciences,Retraction
https://openalex.org/W2776743393,Liver X Receptors Activation Attenuates Ischemia Reperfusion Injury of Liver Graft in Rats,Journal of Investigative Surgery,2,https://doi.org/10.1080/08941939.2017.1412543,https://api.labs.crossref.org/works/https://doi.org/10.1080/08941939.2017.1412543?mailto=christian.hauschke@tib.eu,2017,article,True,76,Cholesterol Metabolism and Atherosclerosis,Health Sciences,Surgery,Taylor & Francis,False,en,Medicine,Retraction
https://openalex.org/W2780218215,A post hoc analysis of intra-subject coefficients of variation in pharmacokinetic measures to calculate optimal sample sizes for bioequivalence studies,Translational & clinical pharmacology,2,https://doi.org/10.12793/tcp.2017.25.4.179,https://api.labs.crossref.org/works/https://doi.org/10.12793/tcp.2017.25.4.179?mailto=christian.hauschke@tib.eu,2017,article,True,76,Statistical Methods in Clinical Trials and Drug Development,Physical Sciences,Statistics and Probability,,True,en,Mathematics,Retraction
https://openalex.org/W2781073004,RETRACTED: Analysis and Research on Spatial Data Storage Model Based on Cloud Computing Platform,IOP Conference Series: Earth and Environmental Science,2,https://doi.org/10.1088/1755-1315/100/1/012112,https://api.labs.crossref.org/works/https://doi.org/10.1088/1755-1315/100/1/012112?mailto=christian.hauschke@tib.eu,2017,article,True,76,Drivers and Impediments for Cross-Border E-Commerce,Social Sciences,Business and International Management,IOP Publishing,True,en,"Business, Management and Accounting",Retraction
https://openalex.org/W2781231119,<i>Retracted:</i> The Development of Willingness to Sacrifice and Unmitigated Communion in Intimate Partnerships,Journal of Marriage and Family,2,https://doi.org/10.1111/jomf.12455,https://api.labs.crossref.org/works/https://doi.org/10.1111/jomf.12455?mailto=christian.hauschke@tib.eu,2017,article,True,76,Theoretical Developments in Attachment and Relationships,Social Sciences,Social Psychology,Wiley-Blackwell,False,en,Psychology,Retraction
https://openalex.org/W2785050941,Retracted: Worst Pattern Of Invasion and occult cervical metastases for oral squamous carcinoma,Head & Neck,2,https://doi.org/10.1002/hed.24754,https://api.labs.crossref.org/works/https://doi.org/10.1002/hed.24754?mailto=christian.hauschke@tib.eu,2017,article,True,76,Epidemiology and Treatment of Head and Neck Cancer,Health Sciences,Otorhinolaryngology,Wiley,False,en,Medicine,Retraction
https://openalex.org/W2806081386,Value of serum Mycoplasma pneumoniae immunoglobulin in the diagnosis of mycoplasma-related pneumonia in newborns,Experimental and Therapeutic Medicine,2,https://doi.org/10.3892/etm.2017.4654,https://api.labs.crossref.org/works/https://doi.org/10.3892/etm.2017.4654?mailto=christian.hauschke@tib.eu,2017,article,True,76,Management and Epidemiology of Pneumonia,Health Sciences,Epidemiology,Spandidos Publishing,True,en,Medicine,Retraction
https://openalex.org/W2884100035,RETRACTED ARTICLE: Wetlands and Lakes of the World: Devashish Kar,Proceedings of the Zoological Society,2,https://doi.org/10.1007/s12595-017-0248-5,https://api.labs.crossref.org/works/https://doi.org/10.1007/s12595-017-0248-5?mailto=christian.hauschke@tib.eu,2017,article,True,76,Influence of Climate on Human Conflict,Social Sciences,Sociology and Political Science,Springer Science+Business Media,False,en,Social Sciences,Retraction
https://openalex.org/W2908871982,WITHDRAWN—Administrative Duplicate Publication: The Hexane Fraction of <i>Bursera microphylla</i> A. Gray Induces p21-Mediated Anti-Proliferative and Pro-Apoptotic Effects in Human Cancer-Derived Cell Lines,Integrative Cancer Therapies,2,https://doi.org/10.1177/1534735417696721,https://api.labs.crossref.org/works/https://doi.org/10.1177/1534735417696721?mailto=christian.hauschke@tib.eu,2017,article,True,76,Immunotoxin Therapy for Cancer Treatment,Life Sciences,Immunology,SAGE Publishing,True,en,Immunology and Microbiology,Retraction
https://openalex.org/W2952457984,Notice of Retraction: The Study of Knowledge Management Pattern in Supply Chain Enterprise,,2,https://doi.org/10.1109/icmss.2009.5302096,https://api.labs.crossref.org/works/https://doi.org/10.1109/icmss.2009.5302096?mailto=christian.hauschke@tib.eu,2009,article,True,75,Collaborative Networks in Manufacturing and Organizations,Social Sciences,Management of Technology and Innovation,,True,en,"Business, Management and Accounting",Retraction
https://openalex.org/W2973418691,Notice of Retraction: Advanced interconnect and antenna-in-package design for millimeter-wave 5G communications,,2,https://doi.org/10.1109/icept.2017.8046398,https://api.labs.crossref.org/works/https://doi.org/10.1109/icept.2017.8046398?mailto=christian.hauschke@tib.eu,2017,article,True,76,Microwave Engineering and Waveguides,Physical Sciences,Electrical and Electronic Engineering,,False,en,Engineering,Retraction
https://openalex.org/W2977251746,Baseline Demographics and Characteristics From a Paliperidone Palmitate Study in Subjects with Recent-Onset Schizophrenia or Schizophreniform Disorder.,PubMed,2,,https://api.labs.crossref.org/works/null?mailto=christian.hauschke@tib.eu,2017,article,True,76,Schizophrenia Research and Treatment,Health Sciences,Psychiatry and Mental health,National Institutes of Health,False,en,Medicine,
https://openalex.org/W2994794075,RETRACTED ARTICLE: New molecular tools in Neospora caninum for studying apicomplexan parasite proteins,Scientific Reports,2,https://doi.org/10.1038/s41598-017-03978-1,https://api.labs.crossref.org/works/https://doi.org/10.1038/s41598-017-03978-1?mailto=christian.hauschke@tib.eu,2017,article,True,76,Toxoplasmosis and Neosporosis Research,Life Sciences,Parasitology,Nature Portfolio,True,en,Immunology and Microbiology,Retraction
https://openalex.org/W2997000571,RETRACTED:An assessment of software defined networking approach in surveillance using sparse optimization algorithm,Computer Communications,2,https://doi.org/10.1016/j.comcom.2019.12.061,https://api.labs.crossref.org/works/https://doi.org/10.1016/j.comcom.2019.12.061?mailto=christian.hauschke@tib.eu,2020,article,True,75,Theory and Applications of Compressed Sensing,Physical Sciences,Computational Mechanics,Elsevier BV,False,en,Engineering,Crossmark Retraction
https://openalex.org/W2997272735,RETRACTED: Application of Machine Learning and Big Data in Doubly Fed Induction Generator based Stability Analysis of Multi Machine System using Substantial Transformative Optimization Algorithm,Microprocessors and Microsystems,2,https://doi.org/10.1016/j.micpro.2019.102971,https://api.labs.crossref.org/works/https://doi.org/10.1016/j.micpro.2019.102971?mailto=christian.hauschke@tib.eu,2020,article,True,75,Wind Power Integration in Power Systems,Physical Sciences,Electrical and Electronic Engineering,Elsevier BV,False,en,Engineering,Crossmark Retraction
https://openalex.org/W2999488452,Mitochondrial protein UCP1 mediates liver injury induced by LPS through EKR signaling pathway.,PubMed,2,,https://api.labs.crossref.org/works/null?mailto=christian.hauschke@tib.eu,2017,article,True,76,Mitochondrial Dynamics and Reactive Oxygen Species Regulation,Life Sciences,Molecular Biology,National Institutes of Health,False,en,"Biochemistry, Genetics and Molecular Biology",
https://openalex.org/W3004418990,Notice of Violation of IEEE Publication Principles: Design and implementation of a low-cost automated blood flow control device through smart phone for bio-medical application,,2,https://doi.org/10.1109/iciev.2017.8338600,https://api.labs.crossref.org/works/https://doi.org/10.1109/iciev.2017.8338600?mailto=christian.hauschke@tib.eu,2017,article,True,76,Analysis of Electrocardiogram Signals,Health Sciences,Cardiology and Cardiovascular Medicine,,False,en,Medicine,Retraction
https://openalex.org/W3006742635,RETRACTED: Reconfigurable parallelized TCAM architecture based on enhanced static memory cell,Microprocessors and Microsystems,2,https://doi.org/10.1016/j.micpro.2020.103073,https://api.labs.crossref.org/works/https://doi.org/10.1016/j.micpro.2020.103073?mailto=christian.hauschke@tib.eu,2020,article,True,75,Algorithms and Architectures for Packet Classification,Physical Sciences,Hardware and Architecture,Elsevier BV,False,en,Computer Science,Crossmark Retraction
https://openalex.org/W3010624073,Targeting survivin suppresses proliferation and invasion of retinoblastoma cells in vitro and in vivo.,PubMed,2,,https://api.labs.crossref.org/works/null?mailto=christian.hauschke@tib.eu,2017,article,True,76,The p53 Signaling Network in Cancer Research,Health Sciences,Oncology,National Institutes of Health,False,en,Medicine,
https://openalex.org/W3011628509,RETRACTED: Two Zn(II) coordination polymers: Luminescent sensing property and treatment capacity against stable coronary heart disease by regulating E.coli abundance and IL-17 content,Journal of Solid State Chemistry,2,https://doi.org/10.1016/j.jssc.2020.121316,https://api.labs.crossref.org/works/https://doi.org/10.1016/j.jssc.2020.121316?mailto=christian.hauschke@tib.eu,2020,article,True,75,Chemistry and Applications of Metal-Organic Frameworks,Physical Sciences,Inorganic Chemistry,Elsevier BV,False,en,Chemistry,Crossmark Retraction
https://openalex.org/W3016592236,"Anticancer effects of Daidzein against the human melanoma cell lines involves cell cycle arrest, autophagy and deactivation of PI3K/AKT signalling pathways.",Journal of B.U.ON. : official journal of the Balkan Union of Oncology,2,,https://api.labs.crossref.org/works/null?mailto=christian.hauschke@tib.eu,2020,article,True,75,Microbial Tannase Production and Applications,Life Sciences,Applied Microbiology and Biotechnology,BAKIS Productions LTD,False,en,Immunology and Microbiology,
https://openalex.org/W3020084036,RETRACTED: Efficient band gap opening in single-layer stanene via patterned Ga-As codoping: Towards semiconducting nanoelectronic devices,Synthetic Metals,2,https://doi.org/10.1016/j.synthmet.2020.116388,https://api.labs.crossref.org/works/https://doi.org/10.1016/j.synthmet.2020.116388?mailto=christian.hauschke@tib.eu,2020,article,True,75,"Graphene: Properties, Synthesis, and Applications",Physical Sciences,Materials Chemistry,Elsevier BV,False,en,Materials Science,Crossmark Retraction
https://openalex.org/W3024869412,"A Phase 1, Open-Label, Single Dose Pharmacokinetic Study in Stabilized Patients with Schizophrenia Following Risperidone Implant.",PubMed,2,,https://api.labs.crossref.org/works/null?mailto=christian.hauschke@tib.eu,2017,article,True,76,Prenatal Exposure to Antiepileptic Drugs,Health Sciences,"Pediatrics, Perinatology and Child Health",National Institutes of Health,False,en,Medicine,
https://openalex.org/W3025663384,"Knockdown of long noncoding RNA linc-ITGB1 suppresses migration, invasion of hepatocellular carcinoma via regulating ZEB1.",PubMed,2,https://doi.org/10.26355/eurrev_201711_13823,https://api.labs.crossref.org/works/https://doi.org/10.26355/eurrev_201711_13823?mailto=christian.hauschke@tib.eu,2017,article,True,76,Role of Long Noncoding RNAs in Cancer and Development,Life Sciences,Cancer Research,National Institutes of Health,False,en,"Biochemistry, Genetics and Molecular Biology",
https://openalex.org/W3026176247,RETRACTED ARTICLE: Metal-organic framework with dual functional sites for CO<sub>2</sub> catalytic fixation and treatment on COPD by down-regulating the <i>tlr3</i> expression on the lung mucosal epithelial cells,Journal of Coordination Chemistry,2,https://doi.org/10.1080/00958972.2020.1763968,https://api.labs.crossref.org/works/https://doi.org/10.1080/00958972.2020.1763968?mailto=christian.hauschke@tib.eu,2020,article,True,75,Chemistry and Applications of Metal-Organic Frameworks,Physical Sciences,Inorganic Chemistry,Taylor & Francis,False,en,Chemistry,
https://openalex.org/W3036285304,RETRACTED ARTICLE: A new Er(III)-based MOF showing anti-colon cancer activity by inhibiting IL-6-STAT3 signaling pathway and reducing TNF-α and IL-1β production,Journal of Coordination Chemistry,2,https://doi.org/10.1080/00958972.2020.1780216,https://api.labs.crossref.org/works/https://doi.org/10.1080/00958972.2020.1780216?mailto=christian.hauschke@tib.eu,2020,article,True,75,Chemistry and Applications of Metal-Organic Frameworks,Physical Sciences,Inorganic Chemistry,Taylor & Francis,False,en,Chemistry,
https://openalex.org/W3036943338,"RETRACTED: Taxonomic study on the montanellus species group of the genus Cyclommatus (Coleoptera: Lucanidae) from Borneo Island, Malaysia, and Indonesia",Journal of Asia-Pacific Biodiversity,2,https://doi.org/10.1016/j.japb.2020.06.004,https://api.labs.crossref.org/works/https://doi.org/10.1016/j.japb.2020.06.004?mailto=christian.hauschke@tib.eu,2020,article,True,75,Biogeographic Regionalization of Neotropical and Mexican Regions,Physical Sciences,Paleontology,Elsevier BV,True,en,Earth and Planetary Sciences,Crossmark Retraction
https://openalex.org/W3041275764,A sensitive N-nitroso-N-methylurea sensor based on graphene-like BC3 and NC3 layers,Molecular Physics,2,https://doi.org/10.1080/00268976.2020.1790682,https://api.labs.crossref.org/works/https://doi.org/10.1080/00268976.2020.1790682?mailto=christian.hauschke@tib.eu,2020,article,True,75,"Graphene: Properties, Synthesis, and Applications",Physical Sciences,Materials Chemistry,Taylor & Francis,False,en,Materials Science,
https://openalex.org/W3084930320,WITHDRAWN: Design &amp; implementation of real time autonomous car by using image processing &amp; IoT,Materials Today: Proceedings,2,https://doi.org/10.1016/j.matpr.2020.08.060,https://api.labs.crossref.org/works/https://doi.org/10.1016/j.matpr.2020.08.060?mailto=christian.hauschke@tib.eu,2020,article,True,75,Autonomous Vehicle Technology and Safety Systems,Physical Sciences,Automotive Engineering,Elsevier BV,False,en,Engineering,Crossmark Retraction
https://openalex.org/W3094338048,WITHDRAWN: The effect analysis for the nano powder dielectric processing of ti-6242 alloy is performed on wire cut-electric discharge,Materials Today: Proceedings,2,https://doi.org/10.1016/j.matpr.2020.09.368,https://api.labs.crossref.org/works/https://doi.org/10.1016/j.matpr.2020.09.368?mailto=christian.hauschke@tib.eu,2020,article,True,75,Electrical Discharge Machining Processes,Physical Sciences,Electrical and Electronic Engineering,Elsevier BV,False,en,Engineering,Crossmark Retraction
https://openalex.org/W3094458825,WITHDRAWN: Comprehensive study of pathology image analysis using deep learning algorithm,Materials Today: Proceedings,2,https://doi.org/10.1016/j.matpr.2020.09.515,https://api.labs.crossref.org/works/https://doi.org/10.1016/j.matpr.2020.09.515?mailto=christian.hauschke@tib.eu,2020,article,True,75,Precision Agriculture Technologies,Life Sciences,Plant Science,Elsevier BV,False,en,Agricultural and Biological Sciences,Crossmark Retraction
https://openalex.org/W3096933864,WITHDRAWN: Reversible watermarking using adaptive edge sensing interpolation,Materials Today: Proceedings,2,https://doi.org/10.1016/j.matpr.2020.09.533,https://api.labs.crossref.org/works/https://doi.org/10.1016/j.matpr.2020.09.533?mailto=christian.hauschke@tib.eu,2020,article,True,75,Digital Image Watermarking Techniques,Physical Sciences,Computer Vision and Pattern Recognition,Elsevier BV,False,en,Computer Science,Crossmark Retraction
https://openalex.org/W3097218026,WITHDRAWN: Dissemination of safety messages to vehicles and verification using model checking in VANETs,Materials Today: Proceedings,2,https://doi.org/10.1016/j.matpr.2020.09.427,https://api.labs.crossref.org/works/https://doi.org/10.1016/j.matpr.2020.09.427?mailto=christian.hauschke@tib.eu,2020,article,True,75,Vehicular Ad Hoc Networks and Communications,Physical Sciences,Electrical and Electronic Engineering,Elsevier BV,False,en,Engineering,Crossmark Retraction
https://openalex.org/W3097261318,WITHDRAWN: Efficient multipath driven lossless video transmission for VANETS,Materials Today: Proceedings,2,https://doi.org/10.1016/j.matpr.2020.09.439,https://api.labs.crossref.org/works/https://doi.org/10.1016/j.matpr.2020.09.439?mailto=christian.hauschke@tib.eu,2020,article,True,75,Vehicular Ad Hoc Networks and Communications,Physical Sciences,Electrical and Electronic Engineering,Elsevier BV,False,en,Engineering,Crossmark Retraction
https://openalex.org/W3097765802,WITHDRAWN: Wideband rotated square slot microstrip antenna with tuning stub,Materials Today: Proceedings,2,https://doi.org/10.1016/j.matpr.2020.09.633,https://api.labs.crossref.org/works/https://doi.org/10.1016/j.matpr.2020.09.633?mailto=christian.hauschke@tib.eu,2020,article,True,75,Antenna Design and Applications,Physical Sciences,Aerospace Engineering,Elsevier BV,False,en,Engineering,Crossmark Retraction
https://openalex.org/W3099626414,WITHDRAWN: A critical review in the design and optimization of thermo acoustic refrigeration system,Materials Today: Proceedings,2,https://doi.org/10.1016/j.matpr.2020.09.789,https://api.labs.crossref.org/works/https://doi.org/10.1016/j.matpr.2020.09.789?mailto=christian.hauschke@tib.eu,2020,article,True,75,Development and Optimization of Stirling Engines,Physical Sciences,Mechanical Engineering,Elsevier BV,False,en,Engineering,Crossmark Retraction
https://openalex.org/W3101643936,WITHDRAWN: Image classification based on high-dimensional feature retrieval intelligent algorithm,Microprocessors and Microsystems,2,https://doi.org/10.1016/j.micpro.2020.103497,https://api.labs.crossref.org/works/https://doi.org/10.1016/j.micpro.2020.103497?mailto=christian.hauschke@tib.eu,2020,article,True,75,Shape Matching and Object Recognition,Physical Sciences,Computer Vision and Pattern Recognition,Elsevier BV,False,en,Computer Science,Crossmark Retraction
https://openalex.org/W3102094578,WITHDRAWN: An exploratory study on image edge detection quality evaluation using various algorithms,Materials Today: Proceedings,2,https://doi.org/10.1016/j.matpr.2020.09.511,https://api.labs.crossref.org/works/https://doi.org/10.1016/j.matpr.2020.09.511?mailto=christian.hauschke@tib.eu,2020,article,True,75,Detection and Management of Retinal Diseases,Health Sciences,"Radiology, Nuclear Medicine and Imaging",Elsevier BV,False,en,Medicine,Crossmark Retraction
https://openalex.org/W3105824585,Analysis of Antiapoptosis Effect of Netrin-1 on Ischemic Stroke and Its Molecular Mechanism under Deleted in Colon Cancer/Extracellular Signal-Regulated Kinase Signaling Pathway,BioMed Research International,2,https://doi.org/10.1155/2020/8855949,https://api.labs.crossref.org/works/https://doi.org/10.1155/2020/8855949?mailto=christian.hauschke@tib.eu,2020,article,True,75,Molecular Mechanisms of Axon Guidance,Life Sciences,Cellular and Molecular Neuroscience,Hindawi Publishing Corporation,True,en,Neuroscience,
https://openalex.org/W3108754209,WITHDRAWN: Hybrid synchronization for a novel class of 6D system with unstable equilibrium points,Materials Today: Proceedings,2,https://doi.org/10.1016/j.matpr.2020.10.524,https://api.labs.crossref.org/works/https://doi.org/10.1016/j.matpr.2020.10.524?mailto=christian.hauschke@tib.eu,2020,article,True,75,Chaos Synchronization and Control in Complex Systems,Physical Sciences,Statistical and Nonlinear Physics,Elsevier BV,False,en,Physics and Astronomy,Crossmark Retraction
https://openalex.org/W3109633002,WITHDRAWN: Experimental investigation of hydrodynamic pressure and oil film temperature of surface textured offset halves journal bearing,Materials Today: Proceedings,2,https://doi.org/10.1016/j.matpr.2020.10.558,https://api.labs.crossref.org/works/https://doi.org/10.1016/j.matpr.2020.10.558?mailto=christian.hauschke@tib.eu,2020,article,True,75,Surface Texturing for Tribology,Physical Sciences,Mechanical Engineering,Elsevier BV,False,en,Engineering,Crossmark Retraction
https://openalex.org/W3109800969,"HHIP gene overexpression inhibits the growth, migration and invasion of human liver cancer cells.",,2,,https://api.labs.crossref.org/works/null?mailto=christian.hauschke@tib.eu,2020,article,True,75,Hedgehog Signaling in Development and Cancer,Life Sciences,Molecular Biology,,False,en,"Biochemistry, Genetics and Molecular Biology",
https://openalex.org/W3109903440,WITHDRAWN: PV system integration with multilevel-UPQC for power quality improvement in distribution system,Materials Today: Proceedings,2,https://doi.org/10.1016/j.matpr.2020.10.487,https://api.labs.crossref.org/works/https://doi.org/10.1016/j.matpr.2020.10.487?mailto=christian.hauschke@tib.eu,2020,article,True,75,Control and Synchronization in Microgrid Systems,Physical Sciences,Control and Systems Engineering,Elsevier BV,False,en,Engineering,Crossmark Retraction
https://openalex.org/W3110519048,WITHDRAWN: Robust convolutional neural network for arrhythmia prediction in ECG signals,Materials Today: Proceedings,2,https://doi.org/10.1016/j.matpr.2020.10.579,https://api.labs.crossref.org/works/https://doi.org/10.1016/j.matpr.2020.10.579?mailto=christian.hauschke@tib.eu,2020,article,True,75,Analysis of Electrocardiogram Signals,Health Sciences,Cardiology and Cardiovascular Medicine,Elsevier BV,False,en,Medicine,Crossmark Retraction
https://openalex.org/W3110916044,WITHDRAWN: Image integrity verification using blockchain,Materials Today: Proceedings,2,https://doi.org/10.1016/j.matpr.2020.10.864,https://api.labs.crossref.org/works/https://doi.org/10.1016/j.matpr.2020.10.864?mailto=christian.hauschke@tib.eu,2020,article,True,75,Digital Image Forgery Detection and Identification,Physical Sciences,Computer Vision and Pattern Recognition,Elsevier BV,False,en,Computer Science,
https://openalex.org/W3111156760,WITHDRAWN: A fuzzy EOQ inventory model with advance payment and various fuzzy numbers,Materials Today: Proceedings,2,https://doi.org/10.1016/j.matpr.2020.10.769,https://api.labs.crossref.org/works/https://doi.org/10.1016/j.matpr.2020.10.769?mailto=christian.hauschke@tib.eu,2020,article,True,75,Coordination and Information Sharing in Supply Chains,Social Sciences,Management Information Systems,Elsevier BV,False,en,"Business, Management and Accounting",
https://openalex.org/W3111600411,WITHDRAWN: Identify missing countries using GEEBLL iterative method for analyzing tweets opinion,Materials Today: Proceedings,2,https://doi.org/10.1016/j.matpr.2020.10.758,https://api.labs.crossref.org/works/https://doi.org/10.1016/j.matpr.2020.10.758?mailto=christian.hauschke@tib.eu,2020,article,True,75,Natural Language Processing,Physical Sciences,Artificial Intelligence,Elsevier BV,False,en,Computer Science,
https://openalex.org/W3111926116,WITHDRAWN: Compendious analysis of exploiting mobile phone radiations on invigorating physiological parameters of rice (Oryza sativa.L) seedlings,Materials Today: Proceedings,2,https://doi.org/10.1016/j.matpr.2020.10.761,https://api.labs.crossref.org/works/https://doi.org/10.1016/j.matpr.2020.10.761?mailto=christian.hauschke@tib.eu,2020,article,True,75,Influence of Magnetic Fields on Biological Systems,Life Sciences,Physiology,Elsevier BV,False,en,"Biochemistry, Genetics and Molecular Biology",
https://openalex.org/W3113116779,WITHDRAWN: Reduction in information loss due to isolated and dumb nodes using ant colony optimization for WSN,Materials Today: Proceedings,2,https://doi.org/10.1016/j.matpr.2020.10.081,https://api.labs.crossref.org/works/https://doi.org/10.1016/j.matpr.2020.10.081?mailto=christian.hauschke@tib.eu,2020,article,True,75,Wireless Sensor Networks: Survey and Applications,Physical Sciences,Computer Networks and Communications,Elsevier BV,False,en,Computer Science,
https://openalex.org/W3113936191,WITHDRAWN: Enhanced age prediction and gender classification (EAP-GC) framework using regression and SVM techniques,Materials Today: Proceedings,2,https://doi.org/10.1016/j.matpr.2020.10.857,https://api.labs.crossref.org/works/https://doi.org/10.1016/j.matpr.2020.10.857?mailto=christian.hauschke@tib.eu,2020,article,True,75,Face Recognition and Analysis Techniques,Physical Sciences,Computer Vision and Pattern Recognition,Elsevier BV,False,en,Computer Science,
https://openalex.org/W3114592658,WITHDRAWN: Advanced implementation patterns of internet of things with MQTT providers in the cutting edge communications,Materials Today: Proceedings,2,https://doi.org/10.1016/j.matpr.2020.11.090,https://api.labs.crossref.org/works/https://doi.org/10.1016/j.matpr.2020.11.090?mailto=christian.hauschke@tib.eu,2020,article,True,75,Internet of Things and Edge Computing,Physical Sciences,Computer Networks and Communications,Elsevier BV,False,en,Computer Science,
