id,display_name,primary_location_display_name,cited_by_count,doi,crossref_call,publication_year,type,is_retracted,cited_by_percentile_year_min,primary_topic_display_name,primary_topic_domain_display_name,primary_topic_subfield_display_name,primary_location_source_host_organization_name,open_access_is_oa,language,primary_topic_field_display_name,update_nature
https://openalex.org/W2914243257,TBCRC026: Phase II Trial Correlating Standardized Uptake Value With Pathologic Complete Response to Pertuzumab and Trastuzumab in Breast Cancer,Journal of Clinical Oncology,35,https://doi.org/10.1200/jco.2018.78.7986,https://api.labs.crossref.org/works/https://doi.org/10.1200/jco.2018.78.7986?mailto=christian.hauschke@tib.eu,2019,article,True,96,HER2 Signaling in Breast Cancer Treatment,Health Sciences,Oncology,Lippincott Williams & Wilkins,True,en,Medicine,Retraction
https://openalex.org/W2945003751,Measuring the critical effect of marketing mix on customer loyalty through customer satisfaction in food and beverage products,Management Science Letters,35,https://doi.org/10.5267/j.msl.2019.5.012,https://api.labs.crossref.org/works/https://doi.org/10.5267/j.msl.2019.5.012?mailto=christian.hauschke@tib.eu,2019,article,True,96,"Customer Relationships, Behavior, and Loyalty",Social Sciences,Organizational Behavior and Human Resource Management,Growing Science,True,en,"Business, Management and Accounting",Retraction
https://openalex.org/W2949944784,<i>Retracted:</i> Long non‐coding RNA <i>NORAD</i> promotes the occurrence and development of non‐small cell lung cancer by adsorbing MiR‐656‐3p,Molecular Genetics & Genomic Medicine,35,https://doi.org/10.1002/mgg3.757,https://api.labs.crossref.org/works/https://doi.org/10.1002/mgg3.757?mailto=christian.hauschke@tib.eu,2019,article,True,96,Role of Long Noncoding RNAs in Cancer and Development,Life Sciences,Cancer Research,Wiley,True,en,"Biochemistry, Genetics and Molecular Biology",Retraction
https://openalex.org/W2950764941,RETRACTED ARTICLE: Medical Image Enhancement by a Bilateral Filter Using Optimization Technique,Journal of Medical Systems,35,https://doi.org/10.1007/s10916-019-1370-x,https://api.labs.crossref.org/works/https://doi.org/10.1007/s10916-019-1370-x?mailto=christian.hauschke@tib.eu,2019,article,True,96,Image Denoising Techniques and Algorithms,Physical Sciences,Computer Vision and Pattern Recognition,Springer Science+Business Media,False,en,Computer Science,Retraction;Crossmark Retraction
https://openalex.org/W2951334981,RETRACTED: LINC00472 Acts as a Tumor Suppressor in NSCLC through KLLN-Mediated p53-Signaling Pathway via MicroRNA-149-3p and MicroRNA-4270,Molecular Therapy - Nucleic Acids,35,https://doi.org/10.1016/j.omtn.2019.06.003,https://api.labs.crossref.org/works/https://doi.org/10.1016/j.omtn.2019.06.003?mailto=christian.hauschke@tib.eu,2019,article,True,96,Role of Long Noncoding RNAs in Cancer and Development,Life Sciences,Cancer Research,Cell Press,True,en,"Biochemistry, Genetics and Molecular Biology",Retraction;Crossmark Retraction
https://openalex.org/W2953568798,"<i>Retracted</i>: miR‐942 promotes tumor migration, invasion, and angiogenesis by regulating EMT via BARX2 in non‐small‐cell lung cancer",Journal of Cellular Physiology,35,https://doi.org/10.1002/jcp.28928,https://api.labs.crossref.org/works/https://doi.org/10.1002/jcp.28928?mailto=christian.hauschke@tib.eu,2019,article,True,96,MicroRNA Regulation in Cancer and Development,Life Sciences,Cancer Research,Wiley,False,en,"Biochemistry, Genetics and Molecular Biology",Retraction
https://openalex.org/W2966023961,Functionalization of carbon nanomaterials by means of phytic acid for uranium enrichment,Science of The Total Environment,35,https://doi.org/10.1016/j.scitotenv.2019.133697,https://api.labs.crossref.org/works/https://doi.org/10.1016/j.scitotenv.2019.133697?mailto=christian.hauschke@tib.eu,2019,article,True,96,Chemistry of Actinide and Lanthanide Elements,Physical Sciences,Inorganic Chemistry,Elsevier BV,False,en,Chemistry,
https://openalex.org/W2967799211,RETRACTED ARTICLE: Long noncoding RNA H19 regulates HIF-1α/AXL signaling through inhibiting miR-20b-5p in endometrial cancer,Cell Cycle,35,https://doi.org/10.1080/15384101.2019.1648958,https://api.labs.crossref.org/works/https://doi.org/10.1080/15384101.2019.1648958?mailto=christian.hauschke@tib.eu,2019,article,True,96,Role of Long Noncoding RNAs in Cancer and Development,Life Sciences,Cancer Research,Taylor & Francis,True,en,"Biochemistry, Genetics and Molecular Biology",
https://openalex.org/W2980061108,Long non-coding RNA <i>SNHG4</i> promotes cervical cancer progression through regulating c-Met via targeting miR-148a-3p,Cell Cycle,35,https://doi.org/10.1080/15384101.2019.1674071,https://api.labs.crossref.org/works/https://doi.org/10.1080/15384101.2019.1674071?mailto=christian.hauschke@tib.eu,2019,article,True,96,Role of Long Noncoding RNAs in Cancer and Development,Life Sciences,Cancer Research,Taylor & Francis,True,en,"Biochemistry, Genetics and Molecular Biology",
https://openalex.org/W2915113448,RETRACTED ARTICLE: Overexpression of microRNA-202-3p protects against myocardial ischemia-reperfusion injury through activation of TGF-β1/Smads signaling pathway by targeting TRPM6,Cell Cycle,34,https://doi.org/10.1080/15384101.2019.1580494,https://api.labs.crossref.org/works/https://doi.org/10.1080/15384101.2019.1580494?mailto=christian.hauschke@tib.eu,2019,article,True,96,Role of Magnesium in Health and Disease,Health Sciences,Nutrition and Dietetics,Taylor & Francis,True,en,Nursing,
https://openalex.org/W2941834987,"Evaluation of ultrasound-guided erector spinae plane block and oblique subcostal transversus abdominis plane block in laparoscopic cholecystectomy: Randomized, controlled, prospective study",Anesthesia: Essays and Researches,34,https://doi.org/10.4103/aer.aer_194_18,https://api.labs.crossref.org/works/https://doi.org/10.4103/aer.aer_194_18?mailto=christian.hauschke@tib.eu,2019,article,True,96,Management of Postoperative Pain and Complications,Health Sciences,Surgery,Medknow,True,en,Medicine,
https://openalex.org/W2942175174,<i>Retracted</i>: Curcumin ameliorates atherosclerosis through upregulation of miR‐126,Journal of Cellular Physiology,34,https://doi.org/10.1002/jcp.28708,https://api.labs.crossref.org/works/https://doi.org/10.1002/jcp.28708?mailto=christian.hauschke@tib.eu,2019,article,True,96,MicroRNA Regulation in Cancer and Development,Life Sciences,Cancer Research,Wiley,True,en,"Biochemistry, Genetics and Molecular Biology",
https://openalex.org/W2943889429,"RETRACTED: Therapeutic effects of chrysin in a rat model of traumatic brain injury: A behavioral, biochemical, and histological study",Life Sciences,34,https://doi.org/10.1016/j.lfs.2019.05.007,https://api.labs.crossref.org/works/https://doi.org/10.1016/j.lfs.2019.05.007?mailto=christian.hauschke@tib.eu,2019,article,True,96,Management and Pathophysiology of Traumatic Brain Injury,Health Sciences,Neurology,Elsevier BV,False,en,Medicine,
https://openalex.org/W2947755469,RETRACTED ARTICLE: Hsa_circ_0005379 regulates malignant behavior of oral squamous cell carcinoma through the EGFR pathway,BMC Cancer,34,https://doi.org/10.1186/s12885-019-5593-5,https://api.labs.crossref.org/works/https://doi.org/10.1186/s12885-019-5593-5?mailto=christian.hauschke@tib.eu,2019,article,True,96,Biogenesis and Functions of Circular RNAs,Life Sciences,Molecular Biology,BioMed Central,True,en,"Biochemistry, Genetics and Molecular Biology",
https://openalex.org/W2951544987,RETRACTED ARTICLE: Piceatannol protects against cisplatin nephrotoxicity via activation of Nrf2/HO-1 pathway and hindering NF-κB inflammatory cascade,Naunyn-Schmiedeberg's Archives of Pharmacology,34,https://doi.org/10.1007/s00210-019-01673-8,https://api.labs.crossref.org/works/https://doi.org/10.1007/s00210-019-01673-8?mailto=christian.hauschke@tib.eu,2019,article,True,96,Mechanisms and Renoprotective Strategies for Cisplatin Nephrotoxicity,Health Sciences,Pathology and Forensic Medicine,Springer Science+Business Media,False,en,Medicine,
https://openalex.org/W2965451420,"RETRACTED ARTICLE: Risk factors, clinical presentations and predictors of stroke among adult patients admitted to stroke unit of Jimma university medical center, south west Ethiopia: prospective observational study",BMC Neurology,34,https://doi.org/10.1186/s12883-019-1412-5,https://api.labs.crossref.org/works/https://doi.org/10.1186/s12883-019-1412-5?mailto=christian.hauschke@tib.eu,2019,article,True,96,Epidemiology and Management of Stroke,Health Sciences,Epidemiology,BioMed Central,True,en,Medicine,
https://openalex.org/W2966807915,"Silencing circular RNA circZNF609 restrains growth, migration and invasion by up-regulating microRNA-186-5p in prostate cancer",Artificial Cells Nanomedicine and Biotechnology,34,https://doi.org/10.1080/21691401.2019.1648281,https://api.labs.crossref.org/works/https://doi.org/10.1080/21691401.2019.1648281?mailto=christian.hauschke@tib.eu,2019,article,True,96,Biogenesis and Functions of Circular RNAs,Life Sciences,Molecular Biology,Informa,True,en,"Biochemistry, Genetics and Molecular Biology",
https://openalex.org/W2967257579,Rubidium-Containing Calcium Alginate Hydrogel for Antibacterial and Diabetic Skin Wound Healing Applications,ACS Biomaterials Science & Engineering,34,https://doi.org/10.1021/acsbiomaterials.9b00547,https://api.labs.crossref.org/works/https://doi.org/10.1021/acsbiomaterials.9b00547?mailto=christian.hauschke@tib.eu,2019,article,True,96,Wound Healing and Regeneration,Health Sciences,Rehabilitation,American Chemical Society,False,en,Medicine,
https://openalex.org/W2981756030,Extensive culturomics of 8 healthy samples enhances metagenomics efficiency,PLOS ONE,34,https://doi.org/10.1371/journal.pone.0223543,https://api.labs.crossref.org/works/https://doi.org/10.1371/journal.pone.0223543?mailto=christian.hauschke@tib.eu,2019,article,True,96,Diversity and Function of Gut Microbiome,Life Sciences,Molecular Biology,Public Library of Science,True,en,"Biochemistry, Genetics and Molecular Biology",
https://openalex.org/W2775130764,<i>Retracted</i>: lncRNA CCAT1 contributes to the growth and invasion of gastric cancer via targeting miR‐219‐1,Journal of Cellular Biochemistry,33,https://doi.org/10.1002/jcb.29239,https://api.labs.crossref.org/works/https://doi.org/10.1002/jcb.29239?mailto=christian.hauschke@tib.eu,2019,article,True,96,Role of Long Noncoding RNAs in Cancer and Development,Life Sciences,Cancer Research,Wiley,False,en,"Biochemistry, Genetics and Molecular Biology",
https://openalex.org/W2890168669,RETRACTED: Pericapsular nerve group (PENG) block is effective for dislocation of the hip joint,Journal of Clinical Anesthesia,33,https://doi.org/10.1016/j.jclinane.2018.09.022,https://api.labs.crossref.org/works/https://doi.org/10.1016/j.jclinane.2018.09.022?mailto=christian.hauschke@tib.eu,2019,article,True,96,Incidence and Management of Hip Fractures,Health Sciences,Surgery,Elsevier BV,False,en,Medicine,
https://openalex.org/W2902561545,<i>Retracted</i>: MicroRNA‐99b suppresses human cervical cancer cell activity by inhibiting the PI3K/AKT/mTOR signaling pathway,Journal of Cellular Physiology,33,https://doi.org/10.1002/jcp.27645,https://api.labs.crossref.org/works/https://doi.org/10.1002/jcp.27645?mailto=christian.hauschke@tib.eu,2019,article,True,96,MicroRNA Regulation in Cancer and Development,Life Sciences,Cancer Research,Wiley,True,en,"Biochemistry, Genetics and Molecular Biology",
https://openalex.org/W2902858309,Long non-coding RNA THRIL promotes LPS-induced inflammatory injury by down-regulating microRNA-125b in ATDC5 cells,International Immunopharmacology,33,https://doi.org/10.1016/j.intimp.2018.11.038,https://api.labs.crossref.org/works/https://doi.org/10.1016/j.intimp.2018.11.038?mailto=christian.hauschke@tib.eu,2019,article,True,96,Role of Long Noncoding RNAs in Cancer and Development,Life Sciences,Cancer Research,Elsevier BV,False,en,"Biochemistry, Genetics and Molecular Biology",
https://openalex.org/W2903411342,RETRACTED: miR-141 alleviates LPS-induced inflammation injury in WI-38 fibroblasts by up-regulation of NOX2,Life Sciences,33,https://doi.org/10.1016/j.lfs.2018.11.056,https://api.labs.crossref.org/works/https://doi.org/10.1016/j.lfs.2018.11.056?mailto=christian.hauschke@tib.eu,2019,article,True,96,MicroRNA Regulation in Cancer and Development,Life Sciences,Cancer Research,Elsevier BV,False,en,"Biochemistry, Genetics and Molecular Biology",
https://openalex.org/W2906646697,"RETRACTED: Long non-coding RNA HULC promotes proliferation, migration and invasion of pancreatic cancer cells by down-regulating microRNA-15a",International Journal of Biological Macromolecules,33,https://doi.org/10.1016/j.ijbiomac.2018.12.238,https://api.labs.crossref.org/works/https://doi.org/10.1016/j.ijbiomac.2018.12.238?mailto=christian.hauschke@tib.eu,2019,article,True,96,Role of Long Noncoding RNAs in Cancer and Development,Life Sciences,Cancer Research,Elsevier BV,False,en,"Biochemistry, Genetics and Molecular Biology",
https://openalex.org/W2913585446,<i>Retracted:</i> LncRNA LINC01305 silencing inhibits cell epithelial‐mesenchymal transition in cervical cancer by inhibiting TNXB‐mediated PI3K/Akt signalling pathway,Journal of Cellular and Molecular Medicine,33,https://doi.org/10.1111/jcmm.14161,https://api.labs.crossref.org/works/https://doi.org/10.1111/jcmm.14161?mailto=christian.hauschke@tib.eu,2019,article,True,96,Role of Long Noncoding RNAs in Cancer and Development,Life Sciences,Cancer Research,Wiley-Blackwell,True,en,"Biochemistry, Genetics and Molecular Biology",
https://openalex.org/W2943377078,RETRACTED: A new synthesis and adsorption mechanism of ZrO2 based metal-organic frames for efficient removal of mercury ions from aqueous solution,Ceramics International,33,https://doi.org/10.1016/j.ceramint.2019.04.246,https://api.labs.crossref.org/works/https://doi.org/10.1016/j.ceramint.2019.04.246?mailto=christian.hauschke@tib.eu,2019,article,True,96,Chemistry and Applications of Metal-Organic Frameworks,Physical Sciences,Inorganic Chemistry,Elsevier BV,False,en,Chemistry,
https://openalex.org/W2950995823,Flavor-cyber-agriculture: Optimization of plant metabolites in an open-source control environment through surrogate modeling,PLOS ONE,33,https://doi.org/10.1371/journal.pone.0213918,https://api.labs.crossref.org/works/https://doi.org/10.1371/journal.pone.0213918?mailto=christian.hauschke@tib.eu,2019,article,True,96,Light Signal Transduction in Plants,Life Sciences,Plant Science,Public Library of Science,True,en,Agricultural and Biological Sciences,
https://openalex.org/W2952428693,RETRACTED: Long noncoding RNA SNHG16 promotes human retinoblastoma progression via sponging miR-140-5p,Biomedicine & Pharmacotherapy,33,https://doi.org/10.1016/j.biopha.2019.109153,https://api.labs.crossref.org/works/https://doi.org/10.1016/j.biopha.2019.109153?mailto=christian.hauschke@tib.eu,2019,article,True,96,Role of Long Noncoding RNAs in Cancer and Development,Life Sciences,Cancer Research,Elsevier BV,True,en,"Biochemistry, Genetics and Molecular Biology",
https://openalex.org/W2955564406,Retracted Article: A bio-based piezoelectric nanogenerator for mechanical energy harvesting using nanohybrid of poly(vinylidene fluoride),Nanoscale advances,33,https://doi.org/10.1039/c9na00214f,https://api.labs.crossref.org/works/https://doi.org/10.1039/c9na00214f?mailto=christian.hauschke@tib.eu,2019,article,True,96,Wearable Nanogenerator Technology,Physical Sciences,Biomedical Engineering,Royal Society of Chemistry,True,en,Engineering,
https://openalex.org/W2967213579,"Teacher’s performance management: The role of principal’s leadership, work environment and motivation in Tegal City, Indonesia",Management Science Letters,33,https://doi.org/10.5267/j.msl.2019.7.038,https://api.labs.crossref.org/works/https://doi.org/10.5267/j.msl.2019.7.038?mailto=christian.hauschke@tib.eu,2020,article,True,96,Influence of Educational Leadership on Teacher Performance,Social Sciences,Education,Growing Science,True,en,Social Sciences,
https://openalex.org/W2967571151,&lt;p&gt;HIF1α/PD-L1 axis mediates hypoxia-induced cell apoptosis and tumor progression in follicular thyroid carcinoma&lt;/p&gt;,OncoTargets and Therapy,33,https://doi.org/10.2147/ott.s203724,https://api.labs.crossref.org/works/https://doi.org/10.2147/ott.s203724?mailto=christian.hauschke@tib.eu,2019,article,True,96,Metabolic Reprogramming in Cancer Biology,Life Sciences,Cancer Research,Dove Medical Press,True,en,"Biochemistry, Genetics and Molecular Biology",
https://openalex.org/W2970105043,AttentionBased Deep Feature Fusion for the Scene Classification of HighResolution Remote Sensing Images,Remote Sensing,33,https://doi.org/10.3390/rs11171996,https://api.labs.crossref.org/works/https://doi.org/10.3390/rs11171996?mailto=christian.hauschke@tib.eu,2019,article,True,96,Hyperspectral Image Analysis and Classification,Physical Sciences,Media Technology,Multidisciplinary Digital Publishing Institute,True,en,Engineering,
https://openalex.org/W2972112165,MALAT1 promotes gastric adenocarcinoma through the MALAT1/miR-181a-5p/AKT3 axis,Open Biology,33,https://doi.org/10.1098/rsob.190095,https://api.labs.crossref.org/works/https://doi.org/10.1098/rsob.190095?mailto=christian.hauschke@tib.eu,2019,article,True,96,Role of Long Noncoding RNAs in Cancer and Development,Life Sciences,Cancer Research,Royal Society,True,en,"Biochemistry, Genetics and Molecular Biology",
https://openalex.org/W2972190267,RETRACTED: Two-dimensional GaTe monolayer as a potential gas sensor for SO2 and NO2 with discriminate optical properties,Superlattices and Microstructures,33,https://doi.org/10.1016/j.spmi.2019.106245,https://api.labs.crossref.org/works/https://doi.org/10.1016/j.spmi.2019.106245?mailto=christian.hauschke@tib.eu,2019,article,True,96,Two-Dimensional Materials,Physical Sciences,Materials Chemistry,Elsevier BV,False,en,Materials Science,
https://openalex.org/W2978485158,RETRACTED: lncRNA RMST Enhances DNMT3 Expression through Interaction with HuR,Molecular Therapy,33,https://doi.org/10.1016/j.ymthe.2019.09.024,https://api.labs.crossref.org/works/https://doi.org/10.1016/j.ymthe.2019.09.024?mailto=christian.hauschke@tib.eu,2020,article,True,96,Clustered Regularly Interspaced Short Palindromic Repeats and CRISPR-associated proteins,Life Sciences,Molecular Biology,Elsevier BV,True,en,"Biochemistry, Genetics and Molecular Biology",
https://openalex.org/W2981094569,RETRACTED: 2D magnetic MoS2–Fe3O4 hybrid nanostructures for ultrasensitive exosome detection in GMR sensor,Biosensors and Bioelectronics,33,https://doi.org/10.1016/j.bios.2019.111787,https://api.labs.crossref.org/works/https://doi.org/10.1016/j.bios.2019.111787?mailto=christian.hauschke@tib.eu,2020,article,True,96,Exosome Biology and Function in Intercellular Communication,Life Sciences,Molecular Biology,Elsevier BV,False,en,"Biochemistry, Genetics and Molecular Biology",
https://openalex.org/W2988275663,RETRACTED: Modeling and prioritizing dynamic demand response programs in the electricity markets,Sustainable Cities and Society,33,https://doi.org/10.1016/j.scs.2019.101921,https://api.labs.crossref.org/works/https://doi.org/10.1016/j.scs.2019.101921?mailto=christian.hauschke@tib.eu,2020,article,True,96,Demand Response in Smart Grids,Physical Sciences,Electrical and Electronic Engineering,Elsevier BV,False,en,Engineering,
https://openalex.org/W2997928886,&lt;p&gt;LncRNA FTX Promotes Proliferation and Invasion of Gastric Cancer via miR-144/ZFX Axis&lt;/p&gt;,OncoTargets and Therapy,33,https://doi.org/10.2147/ott.s220998,https://api.labs.crossref.org/works/https://doi.org/10.2147/ott.s220998?mailto=christian.hauschke@tib.eu,2019,article,True,96,Role of Long Noncoding RNAs in Cancer and Development,Life Sciences,Cancer Research,Dove Medical Press,True,en,"Biochemistry, Genetics and Molecular Biology",
https://openalex.org/W3107350757,&lt;p&gt;Green Synthesis of Silver Nanoparticles Using Extract of &lt;em&gt;Jasminum officinal&lt;/em&gt; L. Leaves and Evaluation of Cytotoxic Activity Towards Bladder (5637) and Breast Cancer (MCF-7) Cell Lines&lt;/p&gt;,International Journal of Nanomedicine,33,https://doi.org/10.2147/ijn.s269880,https://api.labs.crossref.org/works/https://doi.org/10.2147/ijn.s269880?mailto=christian.hauschke@tib.eu,2020,article,True,96,Medicinal Plants: Chemical Constituents and Biological Activities,Life Sciences,Plant Science,Dove Medical Press,True,en,Agricultural and Biological Sciences,
https://openalex.org/W3110022460,WITHDRAWN: An approach to minimize the energy consumption during blockchain transaction,Materials Today: Proceedings,33,https://doi.org/10.1016/j.matpr.2020.10.361,https://api.labs.crossref.org/works/https://doi.org/10.1016/j.matpr.2020.10.361?mailto=christian.hauschke@tib.eu,2020,article,True,96,Blockchain and Internet of Things Integration,Physical Sciences,Information Systems,Elsevier BV,False,en,Computer Science,
https://openalex.org/W2911820325,"Liberals lecture, conservatives communicate: Analyzing complexity and ideology in 381,609 political speeches",PLOS ONE,32,https://doi.org/10.1371/journal.pone.0208450,https://api.labs.crossref.org/works/https://doi.org/10.1371/journal.pone.0208450?mailto=christian.hauschke@tib.eu,2019,article,True,96,Discourse Analysis in Academic Writing and Media,Social Sciences,Literature and Literary Theory,Public Library of Science,True,en,Arts and Humanities,
https://openalex.org/W2914676132,"&lt;p&gt;Overexpressed long noncoding RNA &lt;em&gt;TUG1 &lt;/em&gt;affects the cell cycle, proliferation, and apoptosis of pancreatic cancer partly through suppressing RND3 and MT2A&lt;/p&gt;",OncoTargets and Therapy,32,https://doi.org/10.2147/ott.s188396,https://api.labs.crossref.org/works/https://doi.org/10.2147/ott.s188396?mailto=christian.hauschke@tib.eu,2019,article,True,96,Role of Long Noncoding RNAs in Cancer and Development,Life Sciences,Cancer Research,Dove Medical Press,True,en,"Biochemistry, Genetics and Molecular Biology",
https://openalex.org/W2918830045,<i>Retracted:</i> Lnc<scp>RNA </scp><i><scp>THOR</scp></i> increases osteosarcoma cell stemness and migration by enhancing <scp>SOX</scp>9 <scp>mRNA</scp> stability,FEBS Open Bio,32,https://doi.org/10.1002/2211-5463.12620,https://api.labs.crossref.org/works/https://doi.org/10.1002/2211-5463.12620?mailto=christian.hauschke@tib.eu,2019,article,True,96,Role of Long Noncoding RNAs in Cancer and Development,Life Sciences,Cancer Research,Wiley,True,en,"Biochemistry, Genetics and Molecular Biology",
https://openalex.org/W2920753086,<i>Retracted</i>: Downregulation of lncRNA TUG1 contributes to the development of sepsis‐associated acute kidney injury via regulating miR‐142‐3p/sirtuin 1 axis and modulating NF‐κB pathway,Journal of Cellular Biochemistry,32,https://doi.org/10.1002/jcb.28409,https://api.labs.crossref.org/works/https://doi.org/10.1002/jcb.28409?mailto=christian.hauschke@tib.eu,2019,article,True,96,Role of Long Noncoding RNAs in Cancer and Development,Life Sciences,Cancer Research,Wiley,True,en,"Biochemistry, Genetics and Molecular Biology",
https://openalex.org/W2922784654,"UBE2C, Directly Targeted by miR-548e-5p, Increases the Cellular Growth and Invasive Abilities of Cancer Cells Interacting with the EMT Marker Protein Zinc Finger E-box Binding Homeobox 1/2 in NSCLC",Theranostics,32,https://doi.org/10.7150/thno.32738,https://api.labs.crossref.org/works/https://doi.org/10.7150/thno.32738?mailto=christian.hauschke@tib.eu,2019,article,True,96,Biogenesis and Functions of Circular RNAs,Life Sciences,Molecular Biology,Ivyspring International Publisher,True,en,"Biochemistry, Genetics and Molecular Biology",
https://openalex.org/W2925302334,RETRACTED ARTICLE: Combination of sphingosine-1-phosphate receptor 1 (S1PR1) agonist and antiviral drug: a potential therapy against pathogenic influenza virus,Scientific Reports,32,https://doi.org/10.1038/s41598-019-41760-7,https://api.labs.crossref.org/works/https://doi.org/10.1038/s41598-019-41760-7?mailto=christian.hauschke@tib.eu,2019,article,True,96,Sphingolipid Signalling and Metabolism in Health and Disease,Life Sciences,Molecular Biology,Nature Portfolio,True,en,"Biochemistry, Genetics and Molecular Biology",
https://openalex.org/W2937455859,RETRACTED ARTICLE: Circular RNA hsa_circ_0055538 regulates the malignant biological behavior of oral squamous cell carcinoma through the p53/Bcl-2/caspase signaling pathway,Journal of Translational Medicine,32,https://doi.org/10.1186/s12967-019-1830-6,https://api.labs.crossref.org/works/https://doi.org/10.1186/s12967-019-1830-6?mailto=christian.hauschke@tib.eu,2019,article,True,96,Biogenesis and Functions of Circular RNAs,Life Sciences,Molecular Biology,BioMed Central,True,en,"Biochemistry, Genetics and Molecular Biology",
https://openalex.org/W2943740964,"<i>Retracted</i>: Upregulation of microRNA‐140‐3p inhibits epithelial‐mesenchymal transition, invasion, and metastasis of hepatocellular carcinoma through inactivation of the MAPK signaling pathway by targeting GRN",Journal of Cellular Biochemistry,32,https://doi.org/10.1002/jcb.28750,https://api.labs.crossref.org/works/https://doi.org/10.1002/jcb.28750?mailto=christian.hauschke@tib.eu,2019,article,True,96,MicroRNA Regulation in Cancer and Development,Life Sciences,Cancer Research,Wiley,True,en,"Biochemistry, Genetics and Molecular Biology",
