id,display_name,primary_location_display_name,cited_by_count,doi,crossref_call,publication_year,type,is_retracted,cited_by_percentile_year_min,primary_topic_display_name,primary_topic_domain_display_name,primary_topic_subfield_display_name,primary_location_source_host_organization_name,open_access_is_oa,language,primary_topic_field_display_name,update_nature
https://openalex.org/W2885477365,Application of near-infrared spectroscopy in clinical neurology,Annals of clinical neurophysiology,1,https://doi.org/10.14253/acn.2018.20.2.57,https://api.labs.crossref.org/works/https://doi.org/10.14253/acn.2018.20.2.57?mailto=christian.hauschke@tib.eu,2018,article,True,68,Biomedical Optical Imaging and Spectroscopy,Health Sciences,"Radiology, Nuclear Medicine and Imaging",,True,en,Medicine,
https://openalex.org/W2886018642,"RETRACTED ARTICLE: A delicate maneuver on conjugated rod-rod structures composed of poly(3-hexylthiophene) and polyaniline subtending patched-fibrillar, ringed-fibrillar, double-fibrillar and sandwiched configurations",Journal of Polymer Research,1,https://doi.org/10.1007/s10965-018-1574-7,https://api.labs.crossref.org/works/https://doi.org/10.1007/s10965-018-1574-7?mailto=christian.hauschke@tib.eu,2018,article,True,68,Conducting Polymer Research,Physical Sciences,Polymers and Plastics,Springer Science+Business Media,False,en,Materials Science,
https://openalex.org/W2886114857,Retracted: Digest: Disentangled bank: Less diverse urban environments modify the shape and magnitude of natural selection*,Evolution,1,https://doi.org/10.1111/evo.13577,https://api.labs.crossref.org/works/https://doi.org/10.1111/evo.13577?mailto=christian.hauschke@tib.eu,2018,article,True,68,Species Distribution Modeling and Climate Change Impacts,Physical Sciences,Ecological Modeling,Oxford University Press,True,en,Environmental Science,
https://openalex.org/W2886224968,RETRACTED: A new deep representation for large-scale scene classification,Journal of Visual Communication and Image Representation,1,https://doi.org/10.1016/j.jvcir.2018.08.005,https://api.labs.crossref.org/works/https://doi.org/10.1016/j.jvcir.2018.08.005?mailto=christian.hauschke@tib.eu,2018,article,True,68,Visual Object Tracking and Person Re-identification,Physical Sciences,Computer Vision and Pattern Recognition,Elsevier BV,False,en,Computer Science,
https://openalex.org/W2886376651,RETRACTED: Quadratus lumborum block is not effective for anterior cutaneous nerve entrapment syndrome,Journal of Clinical Anesthesia,1,https://doi.org/10.1016/j.jclinane.2018.08.009,https://api.labs.crossref.org/works/https://doi.org/10.1016/j.jclinane.2018.08.009?mailto=christian.hauschke@tib.eu,2018,article,True,68,Botulinum Toxin in Neurology and Medicine,Health Sciences,Neurology,Elsevier BV,False,en,Medicine,
https://openalex.org/W2887710206,Molecular biological tools in concrete biodeterioration – a mini review,Environmental Technology,1,https://doi.org/10.1080/09593330.2018.1513082,https://api.labs.crossref.org/works/https://doi.org/10.1080/09593330.2018.1513082?mailto=christian.hauschke@tib.eu,2019,article,True,68,Geomycology in Cultural Heritage Conservation,Physical Sciences,Earth-Surface Processes,Taylor & Francis,False,en,Earth and Planetary Sciences,
https://openalex.org/W2888334693,RETRACTED ARTICLE: Contrasting Embodied Cognition with Standard Cognitive Science: A Perspective on Mental Representation,Journal of Indian Council of Philosophical Research,1,https://doi.org/10.1007/s40961-018-0159-5,https://api.labs.crossref.org/works/https://doi.org/10.1007/s40961-018-0159-5?mailto=christian.hauschke@tib.eu,2018,article,True,68,Embodied Cognition and Social Interaction,Social Sciences,Social Psychology,Springer Science+Business Media,False,en,Psychology,
https://openalex.org/W2889071799,Treatment of Ligneous Conjunctivitis Using Topical Plasminogen Therapy in an 8-Week-Old Female Infant,Journal of Pediatric Ophthalmology & Strabismus,1,https://doi.org/10.3928/01913913-20180806-01,https://api.labs.crossref.org/works/https://doi.org/10.3928/01913913-20180806-01?mailto=christian.hauschke@tib.eu,2018,article,True,68,Epidemiology and Management of Ocular Inflammatory Diseases,Health Sciences,Ophthalmology,Slack Incorporated (United States),False,en,Medicine,
https://openalex.org/W2889235917,Conditions and possibilities of geothermal energy utilization for economic-touristic development,Zbornik Radova: Geografski institut Jovan Cvijić,1,https://doi.org/10.2298/ijgi1802233m,https://api.labs.crossref.org/works/https://doi.org/10.2298/ijgi1802233m?mailto=christian.hauschke@tib.eu,2018,article,True,68,Geothermal Energy Technology and Applications,Physical Sciences,"Renewable Energy, Sustainability and the Environment","Geographical Institute ""Jovan Cvijić"" SASA",True,en,Energy,
https://openalex.org/W2889351313,"RETRACTED ARTICLE: Four Ln-coordination polymers: synthesis, crystal structure, fluorescent sensing of nitrobenzene and Tb<sup>3+</sup>, and catalytic properties",Journal of Coordination Chemistry,1,https://doi.org/10.1080/00958972.2018.1517257,https://api.labs.crossref.org/works/https://doi.org/10.1080/00958972.2018.1517257?mailto=christian.hauschke@tib.eu,2018,article,True,68,Chemistry and Applications of Metal-Organic Frameworks,Physical Sciences,Inorganic Chemistry,Taylor & Francis,False,en,Chemistry,
https://openalex.org/W2889508548,[ARTÍCULO RETRATADO] Migración y la gobernanza global: el rol de las redes migrantes,Cadernos Metrópole,1,https://doi.org/10.1590/2236-9996.2018-4110,https://api.labs.crossref.org/works/https://doi.org/10.1590/2236-9996.2018-4110?mailto=christian.hauschke@tib.eu,2018,article,True,68,Migration Networks and Impacts on Labor Market,Social Sciences,Sociology and Political Science,Editora da Pontifícia Universidade Católica de São Paulo,True,es,Social Sciences,
https://openalex.org/W2889710409,WASP (Write a Scientific Paper): The role of the pathology department in clinical research,Early Human Development,1,https://doi.org/10.1016/j.earlhumdev.2018.09.010,https://api.labs.crossref.org/works/https://doi.org/10.1016/j.earlhumdev.2018.09.010?mailto=christian.hauschke@tib.eu,2019,article,True,68,Scientific Writing and Publication Practices,Social Sciences,History and Philosophy of Science,Elsevier BV,False,en,Arts and Humanities,
https://openalex.org/W2890824143,RETRACTED: Auditory (dis-)fluency triggers sequential processing adjustments,Acta Psychologica,1,https://doi.org/10.1016/j.actpsy.2018.08.021,https://api.labs.crossref.org/works/https://doi.org/10.1016/j.actpsy.2018.08.021?mailto=christian.hauschke@tib.eu,2018,article,True,68,Impact of Hearing Loss on Cognitive Function,Life Sciences,Cognitive Neuroscience,Elsevier BV,False,en,Neuroscience,
https://openalex.org/W2891142164,Retracted: Magnetic resonance image markers to improve patient‐specific prediction of IMRT‐induced rectal toxicity in prostate cancer patients,Medical Physics,1,https://doi.org/10.1002/mp.13166,https://api.labs.crossref.org/works/https://doi.org/10.1002/mp.13166?mailto=christian.hauschke@tib.eu,2019,article,True,68,Radiomics in Medical Imaging Analysis,Health Sciences,"Radiology, Nuclear Medicine and Imaging",Wiley,False,en,Medicine,
https://openalex.org/W2891165320,RETRACTED: Camera network analysis for visual surveillance in electric industrial context,Journal of Visual Communication and Image Representation,1,https://doi.org/10.1016/j.jvcir.2018.09.014,https://api.labs.crossref.org/works/https://doi.org/10.1016/j.jvcir.2018.09.014?mailto=christian.hauschke@tib.eu,2018,article,True,68,Visual Object Tracking and Person Re-identification,Physical Sciences,Computer Vision and Pattern Recognition,Elsevier BV,False,en,Computer Science,
https://openalex.org/W2891439100,Effect of postoperative ischemia on steroid hormone receptors and c-erbB-2 levels in breast cancer tissue,Turkish journal of surgery,1,https://doi.org/10.5152/turkjsurg.2018.4001,https://api.labs.crossref.org/works/https://doi.org/10.5152/turkjsurg.2018.4001?mailto=christian.hauschke@tib.eu,2018,article,True,68,HER2 Signaling in Breast Cancer Treatment,Health Sciences,Oncology,,True,en,Medicine,
https://openalex.org/W2891442022,Graphical representation of network meta-analysis: an iconographic support to the complexity of multiple data comparisons,European Journal of Clinical Pharmacology,1,https://doi.org/10.1007/s00228-018-2551-0,https://api.labs.crossref.org/works/https://doi.org/10.1007/s00228-018-2551-0?mailto=christian.hauschke@tib.eu,2018,article,True,68,Methods for Evidence Synthesis in Research,Social Sciences,"Statistics, Probability and Uncertainty",Springer Science+Business Media,False,en,Decision Sciences,
https://openalex.org/W2892142367,Retracted Article: ASIC1a involves acidic microenvironment-induced activation and autophagy of pancreatic stellate cells,RSC Advances,1,https://doi.org/10.1039/c8ra03679a,https://api.labs.crossref.org/works/https://doi.org/10.1039/c8ra03679a?mailto=christian.hauschke@tib.eu,2018,article,True,68,Molecular Mechanisms of Aquaporins in Physiology and Disease,Life Sciences,Molecular Biology,Royal Society of Chemistry,True,en,"Biochemistry, Genetics and Molecular Biology",
https://openalex.org/W2892946376,WITHDRAWN: A Comparative Study Between Anterior Controllable Antedisplacement and Fusion Versus Laminoplasty in the Surgical Management of Multilevel Cervical Ossification of the Posterior Longitudinal Ligament,World Neurosurgery,1,https://doi.org/10.1016/j.wneu.2018.09.101,https://api.labs.crossref.org/works/https://doi.org/10.1016/j.wneu.2018.09.101?mailto=christian.hauschke@tib.eu,2018,article,True,68,Surgical Interventions for Cervical Spine Disorders,Health Sciences,Surgery,Elsevier BV,False,en,Medicine,
https://openalex.org/W2893560724,"Epidemiology of Colorectal Cancer in Jordan, From 2003 to 2012",Journal of Global Oncology,1,https://doi.org/10.1200/jgo.18.72500,https://api.labs.crossref.org/works/https://doi.org/10.1200/jgo.18.72500?mailto=christian.hauschke@tib.eu,2018,article,True,68,Global Trends in Colorectal Cancer Research,Health Sciences,Oncology,American Society of Clinical Oncology,True,en,Medicine,
https://openalex.org/W2894628030,RETRACTED: Thermodynamics of the CO2 absorption in BaCeO3 and SrCeO3 using thermogravimetric and differential thermal analyses,Materials Research Bulletin,1,https://doi.org/10.1016/j.materresbull.2018.06.033,https://api.labs.crossref.org/works/https://doi.org/10.1016/j.materresbull.2018.06.033?mailto=christian.hauschke@tib.eu,2019,article,True,68,Solid Oxide Fuel Cells,Physical Sciences,Materials Chemistry,Elsevier BV,False,en,Materials Science,
https://openalex.org/W2894759689,A Population Balance Model for Temperature Cycling-Enhanced Deracemization,Crystal Growth & Design,1,https://doi.org/10.1021/acs.cgd.8b00706,https://api.labs.crossref.org/works/https://doi.org/10.1021/acs.cgd.8b00706?mailto=christian.hauschke@tib.eu,2018,article,True,68,Origin of Life and Prebiotic Chemistry,Physical Sciences,Astronomy and Astrophysics,American Chemical Society,True,en,Physics and Astronomy,
https://openalex.org/W2895612633,Retracted : EMI shielding effectiveness of expanded graphite and reduced graphene oxide,Journal of the Chinese Chemical Society,1,https://doi.org/10.1002/jccs.201800189,https://api.labs.crossref.org/works/https://doi.org/10.1002/jccs.201800189?mailto=christian.hauschke@tib.eu,2018,article,True,68,Electromagnetic Interference Shielding and Materials,Physical Sciences,"Electronic, Optical and Magnetic Materials",Wiley-Blackwell,True,en,Materials Science,
https://openalex.org/W2896421493,RETRACTED CHAPTER: A Method of Balanced Sleep Scheduling in Renewable Wireless Sensor Networks,Springer eBooks,1,https://doi.org/10.1007/978-3-030-00557-3_30,https://api.labs.crossref.org/works/https://doi.org/10.1007/978-3-030-00557-3_30?mailto=christian.hauschke@tib.eu,2018,book-chapter,True,68,Wireless Energy Harvesting and Information Transfer,Physical Sciences,Electrical and Electronic Engineering,Springer Nature,False,en,Engineering,
https://openalex.org/W2897025816,RETRACTED ARTICLE: Feudal Economy and Rural Settlement of Oultrejourdain and Their Impact on Muslim Farmers under the Rule of the Crusaders (1099–1189),Islam and Christian-Muslim Relations,1,https://doi.org/10.1080/09596410.2018.1530886,https://api.labs.crossref.org/works/https://doi.org/10.1080/09596410.2018.1530886?mailto=christian.hauschke@tib.eu,2018,article,True,68,Ancient Near Eastern Archaeology and History,Social Sciences,Archeology,Routledge,False,en,Arts and Humanities,
https://openalex.org/W2897274707,"Retracted Article: MiR-182-5p and miR-96-5p increased hepatocellular carcinoma cell mobility, proliferation and cisplatin resistance partially by targeting RND3",RSC Advances,1,https://doi.org/10.1039/c8ra07055e,https://api.labs.crossref.org/works/https://doi.org/10.1039/c8ra07055e?mailto=christian.hauschke@tib.eu,2018,article,True,68,MicroRNA Regulation in Cancer and Development,Life Sciences,Cancer Research,Royal Society of Chemistry,True,en,"Biochemistry, Genetics and Molecular Biology",
https://openalex.org/W2898450482,RETRACTED ARTICLE: Rhamnolipid biosurfactants: functional properties and potential contributions for bioremediation,Biodegradation,1,https://doi.org/10.1007/s10532-018-9862-9,https://api.labs.crossref.org/works/https://doi.org/10.1007/s10532-018-9862-9?mailto=christian.hauschke@tib.eu,2018,article,True,68,Microbial Bioremediation of Organic Pollutants,Physical Sciences,Pollution,Springer Science+Business Media,True,en,Environmental Science,
https://openalex.org/W2898493265,Insomnia and problematic gaming: a study in 9 low-and middle-incomes countries,bioRxiv (Cold Spring Harbor Laboratory),1,https://doi.org/10.1101/451724,https://api.labs.crossref.org/works/https://doi.org/10.1101/451724?mailto=christian.hauschke@tib.eu,2018,article,True,68,Impact of Social Media on Well-being and Behavior,Social Sciences,Sociology and Political Science,Cold Spring Harbor Laboratory,True,en,Social Sciences,
https://openalex.org/W2898553167,"RETRACTED ARTICLE: Long-term systemic administration with low dose of 3,4-methylenedioxymethamphetamine causes photoreceptor cell damage in CD1 mice",Cutaneous and Ocular Toxicology,1,https://doi.org/10.1080/15569527.2018.1539007,https://api.labs.crossref.org/works/https://doi.org/10.1080/15569527.2018.1539007?mailto=christian.hauschke@tib.eu,2018,article,True,68,Molecular Mechanisms of Synaptic Plasticity and Neurological Disorders,Life Sciences,Cellular and Molecular Neuroscience,Taylor & Francis,False,en,Neuroscience,
https://openalex.org/W2898556103,RETRACTED: Clinical experiences with s combination of thoracolumbar interfascial plane (TLIP) with modified TLIP blocks,Journal of Clinical Anesthesia,1,https://doi.org/10.1016/j.jclinane.2018.10.014,https://api.labs.crossref.org/works/https://doi.org/10.1016/j.jclinane.2018.10.014?mailto=christian.hauschke@tib.eu,2019,article,True,68,Impact of Spinal Deformity on Health and Function,Health Sciences,Surgery,Elsevier BV,False,en,Medicine,
https://openalex.org/W2898965497,Hydrotalcite Anchored Ruthenium Catalyst for CO2 Hydrogenation Reaction,Open Chemistry,1,https://doi.org/10.1515/chem-2018-0094,https://api.labs.crossref.org/works/https://doi.org/10.1515/chem-2018-0094?mailto=christian.hauschke@tib.eu,2018,article,True,68,Layered Double Hydroxide Nanomaterials,Physical Sciences,Materials Chemistry,De Gruyter Open,False,en,Materials Science,
https://openalex.org/W2899925834,RETRACTED ARTICLE: Prediction of viscosity of branched alkanes using gene expression programing,Petroleum Science and Technology,1,https://doi.org/10.1080/10916466.2018.1531029,https://api.labs.crossref.org/works/https://doi.org/10.1080/10916466.2018.1531029?mailto=christian.hauschke@tib.eu,2018,article,True,68,Petroleum Chemistry and Analysis,Physical Sciences,Analytical Chemistry,Taylor & Francis,False,en,Chemistry,Retraction
https://openalex.org/W2899988780,RETRACTED: Study on Agricultural Products Promotion Strategy of Three-party Linkage Model under the Background of Internet Plus,IOP Conference Series: Materials Science and Engineering,1,https://doi.org/10.1088/1757-899x/439/3/032033,https://api.labs.crossref.org/works/https://doi.org/10.1088/1757-899x/439/3/032033?mailto=christian.hauschke@tib.eu,2018,article,True,68,Drivers and Impediments for Cross-Border E-Commerce,Social Sciences,Business and International Management,IOP Publishing,True,en,"Business, Management and Accounting",Retraction
https://openalex.org/W2900316479,"Retracted Article: Long non-coding RNA XIST promotes proliferation, autophagy and inhibits apoptosis by regulating microRNA-30c/ATG5 axis in gastric cancer",RSC Advances,1,https://doi.org/10.1039/c8ra07852a,https://api.labs.crossref.org/works/https://doi.org/10.1039/c8ra07852a?mailto=christian.hauschke@tib.eu,2018,article,True,68,Role of Long Noncoding RNAs in Cancer and Development,Life Sciences,Cancer Research,Royal Society of Chemistry,True,en,"Biochemistry, Genetics and Molecular Biology",Retraction
https://openalex.org/W2900323803,Retracted Article: PVT1 depletion protects cartilage ATDC5 cells against LPS-induced inflammatory injury by regulating the miR-24/ADAMTS5 axis,RSC Advances,1,https://doi.org/10.1039/c8ra06547k,https://api.labs.crossref.org/works/https://doi.org/10.1039/c8ra06547k?mailto=christian.hauschke@tib.eu,2018,article,True,68,Role of Long Noncoding RNAs in Cancer and Development,Life Sciences,Cancer Research,Royal Society of Chemistry,True,en,"Biochemistry, Genetics and Molecular Biology",Retraction
https://openalex.org/W2900753378,RETRACTED: Biomass energy flow between species and species survival in fragmented landscapes,Ecological Complexity,1,https://doi.org/10.1016/j.ecocom.2018.10.002,https://api.labs.crossref.org/works/https://doi.org/10.1016/j.ecocom.2018.10.002?mailto=christian.hauschke@tib.eu,2019,article,True,68,Biodiversity Conservation and Ecosystem Management,Physical Sciences,Nature and Landscape Conservation,Elsevier BV,False,en,Environmental Science,Retraction;Crossmark Retraction
https://openalex.org/W2901056211,ZURÜCKGEZOGEN: Ernährungsmedizinische Betreuung prä- und postoperativ,Springer eBooks,1,https://doi.org/10.1007/978-3-662-57364-8_4,https://api.labs.crossref.org/works/https://doi.org/10.1007/978-3-662-57364-8_4?mailto=christian.hauschke@tib.eu,2018,book-chapter,True,68,Weight Stigma and Obesity Management,Health Sciences,Pharmacy,Springer Nature,False,de,Health Professions,Retraction
https://openalex.org/W2901176646,"Retraction: Honggang Yu, An efficient face recognition algorithm using the improved convolutional neural network",Discrete and Continuous Dynamical Systems - Series S,1,https://doi.org/10.3934/dcdss.2019060,https://api.labs.crossref.org/works/https://doi.org/10.3934/dcdss.2019060?mailto=christian.hauschke@tib.eu,2019,article,True,68,Face Recognition and Analysis Techniques,Physical Sciences,Computer Vision and Pattern Recognition,American Institute of Mathematical Sciences,True,en,Computer Science,Retraction
https://openalex.org/W2901312027,"Retraction: Xiaohong Zhu, Lihe Zhou, Zili Yang and Joyati Debnath, A new text information extraction algorithm of video image under multimedia environment",Discrete and Continuous Dynamical Systems - Series S,1,https://doi.org/10.3934/dcdss.2019087,https://api.labs.crossref.org/works/https://doi.org/10.3934/dcdss.2019087?mailto=christian.hauschke@tib.eu,2019,article,True,68,Artificial Intelligence in Education and Technology,Physical Sciences,Artificial Intelligence,American Institute of Mathematical Sciences,True,en,Computer Science,Retraction
https://openalex.org/W2901358803,The Role of Tomographic Ultrasonography in Conduit Mapping before Coronary Artery Bypass Grafting,Radiology Research and Practice,1,https://doi.org/10.1155/2018/2097305,https://api.labs.crossref.org/works/https://doi.org/10.1155/2018/2097305?mailto=christian.hauschke@tib.eu,2018,article,True,68,Clinical Studies on Coronary Stents and Revascularization,Health Sciences,Surgery,Hindawi Publishing Corporation,True,en,Medicine,Retraction
https://openalex.org/W2901805688,RETRACTED: Superluminal effect in a hybrid nano-electro-optomechanical system,Chinese Journal of Physics,1,https://doi.org/10.1016/j.cjph.2018.08.024,https://api.labs.crossref.org/works/https://doi.org/10.1016/j.cjph.2018.08.024?mailto=christian.hauschke@tib.eu,2019,article,True,68,Cavity Optomechanics and Nanomechanical Systems,Physical Sciences,"Atomic and Molecular Physics, and Optics",Elsevier BV,False,en,Physics and Astronomy,Crossmark Retraction
https://openalex.org/W2901908968,<i>Retracted</i>: Antibiotic resistance properties and genotypic characterization of enterotoxins in the <scp><i>Staphylococcus aureus</i></scp> strains isolated from traditional sweets,Journal of Food Safety,1,https://doi.org/10.1111/jfs.12573,https://api.labs.crossref.org/works/https://doi.org/10.1111/jfs.12573?mailto=christian.hauschke@tib.eu,2018,article,True,68,Methicillin-Resistant Staphylococcus aureus Infections,Health Sciences,Infectious Diseases,Wiley-Blackwell,True,en,Medicine,Retraction
https://openalex.org/W2902735636,Inhibition of KCNQ2/3 channels by HN38 and XE991 depends on the conformation of the outer vestibule,Molecular Pharmacology,1,https://doi.org/10.1124/mol.118.113407,https://api.labs.crossref.org/works/https://doi.org/10.1124/mol.118.113407?mailto=christian.hauschke@tib.eu,2018,article,True,68,Molecular Mechanisms of Ion Channels Regulation,Life Sciences,Molecular Biology,American Society for Pharmacology and Experimental Therapeutics,False,en,"Biochemistry, Genetics and Molecular Biology",Retraction
https://openalex.org/W2903163060,RETRACTED: A graphene oxide-based hairpin probe coupling duplex-specific nuclease signal amplification for detection and imaging of mRNA in living cells,Talanta,1,https://doi.org/10.1016/j.talanta.2018.11.078,https://api.labs.crossref.org/works/https://doi.org/10.1016/j.talanta.2018.11.078?mailto=christian.hauschke@tib.eu,2019,article,True,68,DNA Nanotechnology and Bioanalytical Applications,Life Sciences,Molecular Biology,Elsevier BV,False,en,"Biochemistry, Genetics and Molecular Biology",Retraction
https://openalex.org/W2903270513,Retracted:Vacuolating cytotoxin A (vacA) and cytotoxin‐associated gene A (cagA) genotypes of resistantHelicobacter pyloristrains isolated from raw and pasteurized milk,Journal of Food Safety,1,https://doi.org/10.1111/jfs.12583,https://api.labs.crossref.org/works/https://doi.org/10.1111/jfs.12583?mailto=christian.hauschke@tib.eu,2018,article,True,68,Helicobacter pylori Infection and Gastric Cancer,Health Sciences,Surgery,Wiley-Blackwell,False,en,Medicine,Retraction
https://openalex.org/W2903601377,RETRACTED: Scalp nerves block for surgical clipping of cerebral aneurysms in patients allergic to nonsteroidal anti-inflammatory drugs,Journal of Clinical Anesthesia,1,https://doi.org/10.1016/j.jclinane.2018.12.003,https://api.labs.crossref.org/works/https://doi.org/10.1016/j.jclinane.2018.12.003?mailto=christian.hauschke@tib.eu,2019,article,True,68,Anesthesia and Sedation Management,Health Sciences,Anesthesiology and Pain Medicine,Elsevier BV,False,en,Medicine,Retraction;Crossmark Retraction
https://openalex.org/W2903619949,"Write a Scientific Paper (WASP): Past and anticipated trends in cardiology service requirements at Mater Dei Hospital, Malta",Early Human Development,1,https://doi.org/10.1016/j.earlhumdev.2018.12.010,https://api.labs.crossref.org/works/https://doi.org/10.1016/j.earlhumdev.2018.12.010?mailto=christian.hauschke@tib.eu,2019,article,True,68,Perioperative Cardiac Risk Assessment and Management,Health Sciences,Cardiology and Cardiovascular Medicine,Elsevier BV,False,en,Medicine,Expression of concern
https://openalex.org/W2903626484,"Conference proceedings of the 4th Masterclass Psychiatry: Transcultural Psychiatry – Diagnostics and Treatment, Luleå, Sweden, 22–23 February 2018 (Region Norrbotten in collaboration with the Maudsley Hospital and Tavistock Clinic London)",Nordic Journal of Psychiatry,1,https://doi.org/10.1080/08039488.2018.1481525,https://api.labs.crossref.org/works/https://doi.org/10.1080/08039488.2018.1481525?mailto=christian.hauschke@tib.eu,2018,article,True,68,Philosophical Perspectives on Health and Psychiatry,Social Sciences,Philosophy,Taylor & Francis,True,en,Arts and Humanities,Retraction
https://openalex.org/W2903650768,"Clinical significance and effect of MTDH/AEG-1 in bladder urothelial cancer: a study based on immunohistochemistry, RNA-seq, and in vitro verification",Cancer management and research,1,https://doi.org/10.2147/cmar.s176887,https://api.labs.crossref.org/works/https://doi.org/10.2147/cmar.s176887?mailto=christian.hauschke@tib.eu,2018,article,True,68,Role of Pim Oncogenes in Tumorigenesis,Health Sciences,Pathology and Forensic Medicine,Dove Medical Press,True,en,Medicine,Retraction
https://openalex.org/W2903735929,WITHDRAWN: Designing optimal conservation area networks under climate change in Mexico,Journal for Nature Conservation,1,https://doi.org/10.1016/j.jnc.2018.12.002,https://api.labs.crossref.org/works/https://doi.org/10.1016/j.jnc.2018.12.002?mailto=christian.hauschke@tib.eu,2019,article,True,68,Species Distribution Modeling and Climate Change Impacts,Physical Sciences,Ecological Modeling,Elsevier BV,False,en,Environmental Science,Retraction;Crossmark Retraction
https://openalex.org/W2903751077,Write a Scientific Paper (WASP) - what can I publish (2)? Hierarchies of evidence,Early Human Development,1,https://doi.org/10.1016/j.earlhumdev.2018.12.004,https://api.labs.crossref.org/works/https://doi.org/10.1016/j.earlhumdev.2018.12.004?mailto=christian.hauschke@tib.eu,2019,article,True,68,Methods for Evidence Synthesis in Research,Social Sciences,"Statistics, Probability and Uncertainty",Elsevier BV,False,en,Decision Sciences,Expression of concern
