id,display_name,primary_location_display_name,cited_by_count,doi,crossref_call,publication_year,type,is_retracted,cited_by_percentile_year_min,primary_topic_display_name,primary_topic_domain_display_name,primary_topic_subfield_display_name,primary_location_source_host_organization_name,open_access_is_oa,language,primary_topic_field_display_name,update_nature
https://openalex.org/W3026448702,Caprin1 targeted by circular circ_0000885 in the tumor progression of osteosarcoma.,DOAJ (DOAJ: Directory of Open Access Journals),0,https://doi.org/10.26355/eurrev_202005_21152,https://api.labs.crossref.org/works/https://doi.org/10.26355/eurrev_202005_21152?mailto=christian.hauschke@tib.eu,2020,article,True,0,Biogenesis and Functions of Circular RNAs,Life Sciences,Molecular Biology,,False,en,"Biochemistry, Genetics and Molecular Biology",
https://openalex.org/W3027434609,"RETRACTED ARTICLE: Effects of isoflurane on arterial blood pressure, heart rate, and phrenic nerve discharge in the decerebrate rat",International Journal of Neuroscience,0,https://doi.org/10.1080/00207454.2020.1748623,https://api.labs.crossref.org/works/https://doi.org/10.1080/00207454.2020.1748623?mailto=christian.hauschke@tib.eu,2020,article,True,0,Neural Mechanisms of Respiratory Control and Homeostasis,Life Sciences,Endocrine and Autonomic Systems,Taylor & Francis,False,en,Neuroscience,Retraction
https://openalex.org/W3027680254,"The use of hydrogen peroxide in the treatment of burn wound infection: a systematic review, and survey of current clinical practice in the United Kingdom.",PubMed,0,,https://api.labs.crossref.org/works/null?mailto=christian.hauschke@tib.eu,2020,article,True,0,Wound Healing and Regeneration,Health Sciences,Rehabilitation,National Institutes of Health,False,en,Medicine,
https://openalex.org/W3027744273,Retraction to: S117. DOES ADDING AUTOMATED ANALYSIS OF SPEECH COHESION TO DIMENSIONALIZED R-PAS COGNITIVE CODES IMPROVE OUR ABILITY TO ASSESS DISORGANIZED THINKING?,Schizophrenia Bulletin,0,https://doi.org/10.1093/schbul/sbaa031.183,https://api.labs.crossref.org/works/https://doi.org/10.1093/schbul/sbaa031.183?mailto=christian.hauschke@tib.eu,2020,article,True,0,Innovations in Education Technology and Learning Systems,Physical Sciences,Information Systems,Oxford University Press,True,en,Computer Science,Retraction
https://openalex.org/W3027776466,Types of variables in medical research,Journal of the Practice of Cardiovascular Sciences,0,https://doi.org/10.4103/jpcs.jpcs_14_20,https://api.labs.crossref.org/works/https://doi.org/10.4103/jpcs.jpcs_14_20?mailto=christian.hauschke@tib.eu,2020,article,True,0,Machine Learning in Healthcare and Medicine,Health Sciences,Health Information Management,Medknow,False,en,Health Professions,
https://openalex.org/W3027839033,RETRACTED: Cost estimation through Monte Carlo simulation in architectural early design stage,International Journal of Electrical Engineering Education,0,https://doi.org/10.1177/0020720920923308,https://api.labs.crossref.org/works/https://doi.org/10.1177/0020720920923308?mailto=christian.hauschke@tib.eu,2020,article,True,0,Design for Manufacture and Assembly in Manufacturing,Physical Sciences,Industrial and Manufacturing Engineering,SAGE Publishing,False,en,Engineering,Retraction
https://openalex.org/W3028435425,RETRACTED ARTICLE: Hungarian optimization technique based efficient resource allocation using clustering unbalanced estimated cost matrix,Journal of Ambient Intelligence and Humanized Computing,0,https://doi.org/10.1007/s12652-020-02063-2,https://api.labs.crossref.org/works/https://doi.org/10.1007/s12652-020-02063-2?mailto=christian.hauschke@tib.eu,2020,article,True,0,Cloud Computing and Big Data Technologies,Physical Sciences,Information Systems,Springer Science+Business Media,False,en,Computer Science,Retraction;Crossmark Retraction
https://openalex.org/W3028502665,RETRACTED ARTICLE: Decentralised fractional order pi decontroller tuned using grey wolf optimization for three interacting cylindrical tanks,Journal of Ambient Intelligence and Humanized Computing,0,https://doi.org/10.1007/s12652-020-02068-x,https://api.labs.crossref.org/works/https://doi.org/10.1007/s12652-020-02068-x?mailto=christian.hauschke@tib.eu,2020,article,True,0,Analysis and Design of Fractional Order Control Systems,Physical Sciences,Control and Systems Engineering,Springer Science+Business Media,False,en,Engineering,Retraction;Crossmark Retraction
https://openalex.org/W3029082574,Retracted: Formation and Oxidation Stability of Tea Polyphenols-Loaded W/O Microemulsion with Eucommia Ulmoides Oliver Seed Oil as an Alternative to α-linolenic Acid,Current Developments in Nutrition,0,https://doi.org/10.1093/cdn/nzaa052_063,https://api.labs.crossref.org/works/https://doi.org/10.1093/cdn/nzaa052_063?mailto=christian.hauschke@tib.eu,2020,article,True,0,Biological Activities of Triterpenoids and Saponins,Life Sciences,Molecular Biology,Elsevier BV,True,en,"Biochemistry, Genetics and Molecular Biology",Retraction
https://openalex.org/W3029589484,RETRACTED ARTICLE: Cu(II)-based coordination polymers: structural determination and protective effect on myocardial ischemia-reperfusion injury by reducing inflammatory response,Inorganic and Nano-Metal Chemistry,0,https://doi.org/10.1080/24701556.2020.1769660,https://api.labs.crossref.org/works/https://doi.org/10.1080/24701556.2020.1769660?mailto=christian.hauschke@tib.eu,2020,article,True,0,Chemistry and Applications of Metal-Organic Frameworks,Physical Sciences,Inorganic Chemistry,Taylor & Francis,False,en,Chemistry,
https://openalex.org/W3030403376,RETRACTED ARTICLE: Big healthcare data for Trivial client having Novel Smart Attire (NSA),Soft Computing,0,https://doi.org/10.1007/s00500-020-05044-x,https://api.labs.crossref.org/works/https://doi.org/10.1007/s00500-020-05044-x?mailto=christian.hauschke@tib.eu,2020,article,True,0,Machine Learning in Healthcare and Medicine,Health Sciences,Health Information Management,Springer Science+Business Media,False,en,Health Professions,Retraction
https://openalex.org/W3031099552,RETRACTED ARTICLE: Astrocytes Regulate Differentiation and Glutamate Uptake of Glioma Stem Cells via Formyl Peptide Receptor,Cellular and Molecular Neurobiology,0,https://doi.org/10.1007/s10571-020-00886-3,https://api.labs.crossref.org/works/https://doi.org/10.1007/s10571-020-00886-3?mailto=christian.hauschke@tib.eu,2020,article,True,0,"S100 Proteins: Structure, Function, and Pathology",Life Sciences,Molecular Biology,Springer Science+Business Media,True,en,"Biochemistry, Genetics and Molecular Biology",Retraction;Crossmark Retraction
https://openalex.org/W3031857199,RETRACTED ARTICLE: An investigation of unicyclic graphs in which the isolate bondage number is equal to three in graph network theory,Journal of Ambient Intelligence and Humanized Computing,0,https://doi.org/10.1007/s12652-020-02105-9,https://api.labs.crossref.org/works/https://doi.org/10.1007/s12652-020-02105-9?mailto=christian.hauschke@tib.eu,2020,article,True,0,Networks on Chip in System-on-Chip Design,Physical Sciences,Computer Networks and Communications,Springer Science+Business Media,False,en,Computer Science,Retraction;Crossmark Retraction
https://openalex.org/W3032036833,<i>Retracted:</i> Building a richer understanding of diversity through causally consistent evenness measures,Ecology and Evolution,0,https://doi.org/10.1002/ece3.6353,https://api.labs.crossref.org/works/https://doi.org/10.1002/ece3.6353?mailto=christian.hauschke@tib.eu,2020,article,True,0,Species Distribution Modeling and Climate Change Impacts,Physical Sciences,Ecological Modeling,Wiley,True,en,Environmental Science,Retraction
https://openalex.org/W3032492371,Thoughts and Observations of Punishment in Contemporary Criminal Law,Opinion juridica,0,https://doi.org/10.22395/ojum.v19n38a14,https://api.labs.crossref.org/works/https://doi.org/10.22395/ojum.v19n38a14?mailto=christian.hauschke@tib.eu,2020,article,True,0,European Union Criminal Law and Justice Cooperation,Social Sciences,Political Science and International Relations,"Universidad de Medellín, Sello Editorial",True,en,Social Sciences,Retraction
https://openalex.org/W3032644514,RETRACTED: A compensating total variation image denoising model combining L<sub>1</sub> and L<sub>2</sub> norm,International Journal of Electrical Engineering Education,0,https://doi.org/10.1177/0020720920923305,https://api.labs.crossref.org/works/https://doi.org/10.1177/0020720920923305?mailto=christian.hauschke@tib.eu,2020,article,True,0,Image Denoising Techniques and Algorithms,Physical Sciences,Computer Vision and Pattern Recognition,SAGE Publishing,False,en,Computer Science,Retraction
https://openalex.org/W3032906400,Retracted: P0981ANTIDIABETIC AND RENOPROTECTIVE ROLE OF METFORMIN ON METABOLIC PARAMETERS IN KIDNEY OF DIABETIC AGING RATS,Nephrology Dialysis Transplantation,0,https://doi.org/10.1093/ndt/gfaa142.p0981,https://api.labs.crossref.org/works/https://doi.org/10.1093/ndt/gfaa142.p0981?mailto=christian.hauschke@tib.eu,2020,article,True,0,Intermittent Fasting and Health Effects,Health Sciences,Physiology,Oxford University Press,True,en,Medicine,Retraction
https://openalex.org/W3032984174,Retraction： Photodynamic Diagnosis for Pleural Disseminated Lesions of Lung Cancer Using a Combination of 5-Aminolevulinic Acid and Autofluorescence Observation System,Annals of Thoracic and Cardiovascular Surgery,0,https://doi.org/10.5761/atcs.oa.20-00014,https://api.labs.crossref.org/works/https://doi.org/10.5761/atcs.oa.20-00014?mailto=christian.hauschke@tib.eu,2020,article,True,0,Photodynamic Therapy in Oncology and Microbiology,Health Sciences,Pulmonary and Respiratory Medicine,Editorial Committee of Annals of Thoracic and Cardiovascular Surgery,True,en,Medicine,Retraction
https://openalex.org/W3032999558,Retracted: P0991EFFECTS OF TRIGONELLA FOENUM GRAECUM AND SODIUM ORTHOVANADATE ON ALTERED RENAL MEMBRANE FUNCTIONS IN ALLOXAN DIABETIC RATS,Nephrology Dialysis Transplantation,0,https://doi.org/10.1093/ndt/gfaa142.p0991,https://api.labs.crossref.org/works/https://doi.org/10.1093/ndt/gfaa142.p0991?mailto=christian.hauschke@tib.eu,2020,article,True,0,Pharmacological Effects of Licorice Roots,Life Sciences,Pharmacology,Oxford University Press,True,en,"Pharmacology, Toxicology and Pharmaceutics",Retraction
https://openalex.org/W3033051535,Control strategy and security of small and medium-sized wind power grid-connected inverter,International Journal of Electrical Engineering Education,0,https://doi.org/10.1177/0020720920928548,https://api.labs.crossref.org/works/https://doi.org/10.1177/0020720920928548?mailto=christian.hauschke@tib.eu,2020,article,True,0,Control and Synchronization in Microgrid Systems,Physical Sciences,Control and Systems Engineering,SAGE Publishing,False,en,Engineering,Retraction
https://openalex.org/W3033053783,Leishmania-Specific Promiscuous Membrane Protein Tubulin Folding Cofactor D Divulges Th1/Th2 Polarization in the Host via ERK-1/2 and p38 MAPK Signaling Cascade,Frontiers in Immunology,0,https://doi.org/10.3389/fimmu.2020.00817,https://api.labs.crossref.org/works/https://doi.org/10.3389/fimmu.2020.00817?mailto=christian.hauschke@tib.eu,2020,article,True,0,Global Burden of Leishmaniasis Incidence and Treatment,Health Sciences,"Public Health, Environmental and Occupational Health",Frontiers Media,True,en,Medicine,Correction;Retraction
https://openalex.org/W3033108556,Retracted: P0985EFFECTS OF SILVER NANOPARTICLES ON RENAL FUNCTION IN FAT-FED AND STREPTOZOTOCIN-TREATED RATS,Nephrology Dialysis Transplantation,0,https://doi.org/10.1093/ndt/gfaa142.p0985,https://api.labs.crossref.org/works/https://doi.org/10.1093/ndt/gfaa142.p0985?mailto=christian.hauschke@tib.eu,2020,article,True,0,Therapeutic Applications of Molecular Hydrogen Therapy,Health Sciences,Surgery,Oxford University Press,True,en,Medicine,Retraction
https://openalex.org/W3033192121,Identity Crisis of Lyndall in Schreiner’s The Story of an African Farm,International Journal Online of Humanities,0,https://doi.org/10.24113/ijohmn.v6i3.182,https://api.labs.crossref.org/works/https://doi.org/10.24113/ijohmn.v6i3.182?mailto=christian.hauschke@tib.eu,2020,article,True,0,Postcolonial Literature in Global Context,Social Sciences,Literature and Literary Theory,,True,en,Arts and Humanities,Retraction;Crossmark Retraction
https://openalex.org/W3033200273,WITHDRAWN Intracranial Hemorrhage in COVID-19 Patients on ECMO: Challenges and Future Directions,Journal of Cardiothoracic and Vascular Anesthesia,0,https://doi.org/10.1053/j.jvca.2020.06.010,https://api.labs.crossref.org/works/https://doi.org/10.1053/j.jvca.2020.06.010?mailto=christian.hauschke@tib.eu,2020,article,True,0,Mechanical Circulatory Support Systems,Physical Sciences,Biomedical Engineering,Elsevier BV,True,en,Engineering,Retraction
https://openalex.org/W3033227042,Research and practice on the teaching mode of course project – Take the “credit rating” course as an example,International Journal of Electrical Engineering Education,0,https://doi.org/10.1177/0020720920928546,https://api.labs.crossref.org/works/https://doi.org/10.1177/0020720920928546?mailto=christian.hauschke@tib.eu,2020,article,True,0,Impact of Technology on Education and Training,Physical Sciences,Information Systems,SAGE Publishing,False,en,Computer Science,Retraction
https://openalex.org/W3033325469,RETRACTED: Two Zn(II) coordination complexes: Gas separation property and treatment activity on chronic pulmonary interstitial disease and mechanism exploration,Journal of Molecular Structure,0,https://doi.org/10.1016/j.molstruc.2020.128540,https://api.labs.crossref.org/works/https://doi.org/10.1016/j.molstruc.2020.128540?mailto=christian.hauschke@tib.eu,2020,article,True,0,Chemistry and Applications of Metal-Organic Frameworks,Physical Sciences,Inorganic Chemistry,Elsevier BV,False,en,Chemistry,Retraction;Crossmark Retraction
https://openalex.org/W3033379996,POETuitéame: aproximación teórica de la poesía no creativa mediada por los hashtags de Twitter y análisis de la experiencia lectora,Revista Chilena De Literatura,0,https://doi.org/10.4067/s0718-22952020000100203,https://api.labs.crossref.org/works/https://doi.org/10.4067/s0718-22952020000100203?mailto=christian.hauschke@tib.eu,2020,article,True,0,Reading Habits and Literacy Education,Social Sciences,Education,University of Chile,True,es,Social Sciences,Retraction
https://openalex.org/W3033543970,WITHDRAWN: Performance of cartilage cells in different types of mandibular condylar fractures,Bioscience Reports,0,https://doi.org/10.1042/bsr20193919,https://api.labs.crossref.org/works/https://doi.org/10.1042/bsr20193919?mailto=christian.hauschke@tib.eu,2020,article,True,0,Epidemiology and Management of Maxillofacial Trauma,Health Sciences,Surgery,Portland Press,True,en,Medicine,Retraction
https://openalex.org/W3033648953,RETRACTED ARTICLE: A novel small-molecule inhibitor suppresses colon cancer metastasis through inhibition of metastasis-associated in colon cancer-1 transcription,Investigational New Drugs,0,https://doi.org/10.1007/s10637-020-00957-8,https://api.labs.crossref.org/works/https://doi.org/10.1007/s10637-020-00957-8?mailto=christian.hauschke@tib.eu,2020,article,True,0,Role of Pim Oncogenes in Tumorigenesis,Health Sciences,Pathology and Forensic Medicine,Springer Science+Business Media,True,en,Medicine,Retraction;Crossmark Retraction
https://openalex.org/W3033831657,RETRACTED: Preliminary Study on Credit Risk Management under Internet Finance Based on Big Data Age,Journal of Physics: Conference Series,0,https://doi.org/10.1088/1742-6596/1544/1/012168,https://api.labs.crossref.org/works/https://doi.org/10.1088/1742-6596/1544/1/012168?mailto=christian.hauschke@tib.eu,2020,article,True,0,Dynamics of Crowdfunding and Fintech,Social Sciences,Management Information Systems,IOP Publishing,True,en,"Business, Management and Accounting",Retraction
https://openalex.org/W3033896462,WITHDRAWN: Improvement of mechanical properties of AA5083 in shipbuilding applications by adding nano ceramic powders of silicon dioxide Si2O3 via friction stir processing technique,CIRP Journal of Manufacturing Science and Technology,0,https://doi.org/10.1016/j.cirpj.2020.05.007,https://api.labs.crossref.org/works/https://doi.org/10.1016/j.cirpj.2020.05.007?mailto=christian.hauschke@tib.eu,2020,article,True,0,Metal Matrix Composites: Science and Applications,Physical Sciences,Mechanical Engineering,Elsevier BV,False,en,Engineering,Retraction
https://openalex.org/W3033936578,RETRACTED ARTICLE: Integral points on curves of genus zero over totally real number fields,Periodica Mathematica Hungarica,0,https://doi.org/10.1007/s10998-020-00348-9,https://api.labs.crossref.org/works/https://doi.org/10.1007/s10998-020-00348-9?mailto=christian.hauschke@tib.eu,2020,article,True,0,Algebraic Geometry and Moduli Theory,Physical Sciences,Geometry and Topology,Springer Science+Business Media,True,en,Mathematics,Crossmark Retraction
https://openalex.org/W3034219152,"Holding Together, Coming Together or Putting Together? A [Re]examination on the Formation of Ethiopia’s Federation",Vestnik Rossijskogo universiteta družby narodov,0,https://doi.org/10.22363/2312-8313-2020-7-1-70-82,https://api.labs.crossref.org/works/https://doi.org/10.22363/2312-8313-2020-7-1-70-82?mailto=christian.hauschke@tib.eu,2020,article,True,0,Ethiopia-Eritrea Relations and Society,Social Sciences,Political Science and International Relations,Peoples' Friendship University of Russia,True,en,Social Sciences,Retraction
https://openalex.org/W3034458389,Letter to editor in response to “COVID-19: From bench to bedside” by Singh A et al.,Diabetes & Metabolic Syndrome: Clinical Research and Reviews,0,https://doi.org/10.1016/j.dsx.2020.06.018,https://api.labs.crossref.org/works/https://doi.org/10.1016/j.dsx.2020.06.018?mailto=christian.hauschke@tib.eu,2020,letter,True,0,Coronavirus Disease 2019,Health Sciences,Infectious Diseases,Elsevier BV,True,en,Medicine,Retraction
https://openalex.org/W3034493996,Spatio temporal smoke detection using hybrid deep Q learning classifier for educating engineering students,International Journal of Electrical Engineering Education,0,https://doi.org/10.1177/0020720920931076,https://api.labs.crossref.org/works/https://doi.org/10.1177/0020720920931076?mailto=christian.hauschke@tib.eu,2020,article,True,0,Fire and Smoke Detection Technologies,Physical Sciences,"Safety, Risk, Reliability and Quality",SAGE Publishing,False,en,Engineering,Expression of concern
https://openalex.org/W3034597993,"RETRACTED: Dietary oligosaccharides attenuate DSS-induced colitis in mice, induce PGlyRP3 expression, and inhibit NF-κB and MEK/ERK signaling",Cellular Immunology,0,https://doi.org/10.1016/j.cellimm.2020.104144,https://api.labs.crossref.org/works/https://doi.org/10.1016/j.cellimm.2020.104144?mailto=christian.hauschke@tib.eu,2020,article,True,0,NF-?B Signaling in Inflammation and Cancer,Life Sciences,Cancer Research,Elsevier BV,False,en,"Biochemistry, Genetics and Molecular Biology",Retraction;Crossmark Retraction
https://openalex.org/W3034617480,RETRACTED ARTICLE: The Alchemy of Meth: a decomposition,Social & Cultural Geography,0,https://doi.org/10.1080/14649365.2020.1779499,https://api.labs.crossref.org/works/https://doi.org/10.1080/14649365.2020.1779499?mailto=christian.hauschke@tib.eu,2020,article,True,0,Impact of Homelessness on Health and Well-being,Health Sciences,General Health Professions,Taylor & Francis,False,en,Health Professions,Retraction
https://openalex.org/W3034651873,WITHDRAWN:Does dehydrated human amnion/chorion membrane enhance esophageal anastomotic healing?,The Annals of Thoracic Surgery,0,https://doi.org/10.1016/j.athoracsur.2020.05.022,https://api.labs.crossref.org/works/https://doi.org/10.1016/j.athoracsur.2020.05.022?mailto=christian.hauschke@tib.eu,2020,article,True,0,Tissue Engineering and Regenerative Medicine,Health Sciences,Surgery,Elsevier BV,True,en,Medicine,Retraction
https://openalex.org/W3034717013,RETRACTED: A method for remote sensing image denoising based on structured dictionary learning and cloud computing,International Journal of Electrical Engineering Education,0,https://doi.org/10.1177/0020720920931071,https://api.labs.crossref.org/works/https://doi.org/10.1177/0020720920931071?mailto=christian.hauschke@tib.eu,2020,article,True,0,Image Denoising Techniques and Algorithms,Physical Sciences,Computer Vision and Pattern Recognition,SAGE Publishing,False,en,Computer Science,Retraction;Expression of concern
https://openalex.org/W3034982284,RETRACTED: Bulking instability analysis of the horizontally stratified rock reinforced with bolts based on cusp catastrophe model,International Journal of Electrical Engineering Education,0,https://doi.org/10.1177/0020720920928539,https://api.labs.crossref.org/works/https://doi.org/10.1177/0020720920928539?mailto=christian.hauschke@tib.eu,2020,article,True,0,Progressive Collapse of Structures,Physical Sciences,Civil and Structural Engineering,SAGE Publishing,False,en,Engineering,Retraction
https://openalex.org/W3035225815,WITHDRAWN: Dehydrated Human Amnion/Chorion Membrane (Placenta) Reduces Anastomotic Leaks after Esophagectomy,The Annals of Thoracic Surgery,0,https://doi.org/10.1016/j.athoracsur.2020.04.109,https://api.labs.crossref.org/works/https://doi.org/10.1016/j.athoracsur.2020.04.109?mailto=christian.hauschke@tib.eu,2020,article,True,0,Esophageal Intervention Techniques,Health Sciences,Surgery,Elsevier BV,True,en,Medicine,Retraction
https://openalex.org/W3035401491,Association between polymorphisms in the interleukin-10 gene and susceptibility to HIV-1 infection,AIDS Research and Human Retroviruses,0,https://doi.org/10.1089/aid.2020.0011,https://api.labs.crossref.org/works/https://doi.org/10.1089/aid.2020.0011?mailto=christian.hauschke@tib.eu,2020,article,True,0,Epidemiology and Management of Cytomegalovirus Infection,Health Sciences,Epidemiology,"Mary Ann Liebert, Inc.",False,en,Medicine,Retraction
https://openalex.org/W3035433088,RETRACTED ARTICLE: Trends in endovascular interventions for pediatric ischemic stroke at the national level: data from 2000 to 2009,Childs Nervous System,0,https://doi.org/10.1007/s00381-020-04714-3,https://api.labs.crossref.org/works/https://doi.org/10.1007/s00381-020-04714-3?mailto=christian.hauschke@tib.eu,2020,article,True,0,Epidemiology and Management of Stroke,Health Sciences,Epidemiology,Springer Science+Business Media,False,en,Medicine,Retraction;Crossmark Retraction
https://openalex.org/W3035611350,WITHDRAWN: Psychosis: A Presentation of COVID-19?,Psychosomatics,0,https://doi.org/10.1016/j.psym.2020.06.004,https://api.labs.crossref.org/works/https://doi.org/10.1016/j.psym.2020.06.004?mailto=christian.hauschke@tib.eu,2020,article,True,0,Neurological Manifestations of COVID-19 Infection,Health Sciences,Neurology,Elsevier BV,True,en,Medicine,Retraction
https://openalex.org/W3035738582,"Potential effects of elevated temperature on seasonal movements in slipper lobsters, Scyllarides latus (Latreille, 1803), in the eastern Mediterranean",Mediterranean Marine Science,0,https://doi.org/10.12681/mms.22074,https://api.labs.crossref.org/works/https://doi.org/10.12681/mms.22074?mailto=christian.hauschke@tib.eu,2020,article,True,0,Impacts of Crayfish Invasions on Freshwater Ecosystems,Physical Sciences,Ecology,Hellenic Centre for Marine Research,True,en,Environmental Science,Retraction
https://openalex.org/W3035757268,Determinants of COVID-19 incidence and mortality: A cross-country analysis,medRxiv (Cold Spring Harbor Laboratory),0,https://doi.org/10.1101/2020.06.11.20128561,https://api.labs.crossref.org/works/https://doi.org/10.1101/2020.06.11.20128561?mailto=christian.hauschke@tib.eu,2020,article,True,0,Modeling the Dynamics of COVID-19 Pandemic,Physical Sciences,Modeling and Simulation,Cold Spring Harbor Laboratory,True,en,Mathematics,Retraction
https://openalex.org/W3035760320,WITHDRAWN: Personal respirators for population level control of the COVID19 pandemic,Journal of Infection,0,https://doi.org/10.1016/j.jinf.2020.04.044,https://api.labs.crossref.org/works/https://doi.org/10.1016/j.jinf.2020.04.044?mailto=christian.hauschke@tib.eu,2020,article,True,0,Coronavirus Disease 2019 Research,Health Sciences,Infectious Diseases,Elsevier BV,True,en,Medicine,Retraction
https://openalex.org/W3035813235,RETRACTED: Machine learning algorithm to analyse tipping behaviour based on decision tree model,International Journal of Electrical Engineering Education,0,https://doi.org/10.1177/0020720920930364,https://api.labs.crossref.org/works/https://doi.org/10.1177/0020720920930364?mailto=christian.hauschke@tib.eu,2020,article,True,0,Impact of Social Norms on Behavior and Compliance,Social Sciences,Sociology and Political Science,SAGE Publishing,False,en,Social Sciences,Retraction
https://openalex.org/W3035963530,RETRACTED: Application Research of Electrical Engineering Automation Based on Artificial Intelligence,Journal of Physics: Conference Series,0,https://doi.org/10.1088/1742-6596/1533/3/032021,https://api.labs.crossref.org/works/https://doi.org/10.1088/1742-6596/1533/3/032021?mailto=christian.hauschke@tib.eu,2020,article,True,0,Technological Development in Mineral Resource Sector,Physical Sciences,Mechanical Engineering,IOP Publishing,True,en,Engineering,Retraction
https://openalex.org/W3036130411,Application of Intelligent Cultivation System in Plant Growth,IOP Conference Series: Earth and Environmental Science,0,https://doi.org/10.1088/1755-1315/512/1/012095,https://api.labs.crossref.org/works/https://doi.org/10.1088/1755-1315/512/1/012095?mailto=christian.hauschke@tib.eu,2020,article,True,0,Application of Wireless Sensor Networks,Physical Sciences,Control and Systems Engineering,IOP Publishing,True,en,Engineering,Retraction
