id,display_name,primary_location_display_name,cited_by_count,doi,crossref_call,publication_year,type,is_retracted,cited_by_percentile_year_min,primary_topic_display_name,primary_topic_domain_display_name,primary_topic_subfield_display_name,primary_location_source_host_organization_name,open_access_is_oa,language,primary_topic_field_display_name,update_nature
https://openalex.org/W2262235227,SCSI Disks Considered Harmful,Social Science Research Network,1,https://doi.org/10.2139/ssrn.2287455,https://api.labs.crossref.org/works/https://doi.org/10.2139/ssrn.2287455?mailto=christian.hauschke@tib.eu,2013,article,True,71,DNA-based Computing and Data Storage,Life Sciences,Molecular Biology,RELX Group (Netherlands),False,en,"Biochemistry, Genetics and Molecular Biology",
https://openalex.org/W2268645772,"Notice of Retraction Ownership structure, management culture and risk reporting practices in Malaysia",,1,https://doi.org/10.1109/icimtr.2012.6236470,https://api.labs.crossref.org/works/https://doi.org/10.1109/icimtr.2012.6236470?mailto=christian.hauschke@tib.eu,2012,article,True,70,Financial Reporting and Earnings Management,Social Sciences,Accounting,,False,en,"Business, Management and Accounting",
https://openalex.org/W2269036136,Notice of Retraction Quantifying academic readiness: ESL undergraduates' mastery of English vocabulary,,1,https://doi.org/10.1109/shuser.2012.6268877,https://api.labs.crossref.org/works/https://doi.org/10.1109/shuser.2012.6268877?mailto=christian.hauschke@tib.eu,2012,article,True,70,Vocabulary Acquisition in Second Language Learning,Social Sciences,Developmental and Educational Psychology,,False,en,Psychology,
https://openalex.org/W2274504110,Notice of Retraction: Environmental Hazards and Comprehensive Utilization of Coal Gangue in Sustainable Development,,1,https://doi.org/10.1109/icbbe.2011.5781478,https://api.labs.crossref.org/works/https://doi.org/10.1109/icbbe.2011.5781478?mailto=christian.hauschke@tib.eu,2011,article,True,71,Study on Rock Mechanics in Deep Mining Engineering,Physical Sciences,Mechanics of Materials,,False,en,Engineering,
https://openalex.org/W2275475529,"Notice of Retraction: Features of Eco-Environmental and Ecological Restoration in the Yuanmou Dry-Hot Valley of Yunnan, China",,1,https://doi.org/10.1109/icbbe.2011.5781564,https://api.labs.crossref.org/works/https://doi.org/10.1109/icbbe.2011.5781564?mailto=christian.hauschke@tib.eu,2011,article,True,71,Web-Based Global Education and Sustainability,Social Sciences,Education,,False,en,Social Sciences,
https://openalex.org/W2275721726,"Notice of Retraction: Factor Analysis of Nitrate Contamination on Groundwater in Lakeshore District, Hefei, China",,1,https://doi.org/10.1109/icbbe.2011.5780753,https://api.labs.crossref.org/works/https://doi.org/10.1109/icbbe.2011.5780753?mailto=christian.hauschke@tib.eu,2011,article,True,71,Stable Isotope Analysis of Groundwater and Precipitation,Physical Sciences,Geochemistry and Petrology,,False,en,Earth and Planetary Sciences,
https://openalex.org/W2276149048,Notice of Retraction: Study on Application of Environmental Value in Expressway Construction Project Scheme Choosing,,1,https://doi.org/10.1109/icbbe.2011.5781565,https://api.labs.crossref.org/works/https://doi.org/10.1109/icbbe.2011.5781565?mailto=christian.hauschke@tib.eu,2011,article,True,71,Ecological Effects of Roads on Wildlife and Habitat Connectivity,Physical Sciences,Ecology,,False,en,Environmental Science,
https://openalex.org/W2276294164,Notice of Retraction: Investigation of Treatment of Domestic Sewage by PAC-SBR Process,,1,https://doi.org/10.1109/icbbe.2011.5780971,https://api.labs.crossref.org/works/https://doi.org/10.1109/icbbe.2011.5780971?mailto=christian.hauschke@tib.eu,2011,article,True,71,On-line Monitoring of Wastewater Quality,Physical Sciences,Industrial and Manufacturing Engineering,,False,en,Environmental Science,
https://openalex.org/W2276641747,Notice of Retraction: Study on the Gob-Effect Mines and Its Risk Classification Method,,1,https://doi.org/10.1109/icbbe.2011.5781605,https://api.labs.crossref.org/works/https://doi.org/10.1109/icbbe.2011.5781605?mailto=christian.hauschke@tib.eu,2011,article,True,71,Mining Technology and Safety Measures,Physical Sciences,"Safety, Risk, Reliability and Quality",,True,en,Engineering,
https://openalex.org/W2277219582,Notice of Retraction: Study on Oilfield Wastewater Treatment with Composite Nanoparticles Modified PVDF UF Membrane,,1,https://doi.org/10.1109/icbbe.2011.5780984,https://api.labs.crossref.org/works/https://doi.org/10.1109/icbbe.2011.5780984?mailto=christian.hauschke@tib.eu,2011,article,True,71,Advancements in Water Purification Technologies,Physical Sciences,Water Science and Technology,,False,en,Environmental Science,
https://openalex.org/W2277847161,Notice of Retraction: Application of High Efficiency Inorganic Adsorbent Bentonite on Removal of Ni(II) from Aqueous Solutions,,1,https://doi.org/10.1109/icbbe.2011.5780978,https://api.labs.crossref.org/works/https://doi.org/10.1109/icbbe.2011.5780978?mailto=christian.hauschke@tib.eu,2011,article,True,71,Adsorption of Water Contaminants,Physical Sciences,Water Science and Technology,,False,en,Environmental Science,
https://openalex.org/W2277925051,Notice of Retraction: MF for Treatment of Iron Contaminated Underground Water and Fouling Countermeasures,,1,https://doi.org/10.1109/icbbe.2011.5780861,https://api.labs.crossref.org/works/https://doi.org/10.1109/icbbe.2011.5780861?mailto=christian.hauschke@tib.eu,2011,article,True,71,Occurrence and Health Effects of Drinking Water Disinfection By-Products,Physical Sciences,"Health, Toxicology and Mutagenesis",,False,en,Environmental Science,
https://openalex.org/W2278127845,Notice of Retraction: Defluorination from groundwater in rural China by nanofiltration technology: Performance and multistage arrangement,,1,https://doi.org/10.1109/icbbe.2011.5780931,https://api.labs.crossref.org/works/https://doi.org/10.1109/icbbe.2011.5780931?mailto=christian.hauschke@tib.eu,2011,article,True,71,Fluoride Contamination in Drinking Water and Defluoridation Methods,Physical Sciences,Water Science and Technology,,False,en,Environmental Science,
https://openalex.org/W2278332958,Notice of Retraction: Formation of THMs during Chlorination of Tyrosine in Drinking Water,,1,https://doi.org/10.1109/icbbe.2011.5780933,https://api.labs.crossref.org/works/https://doi.org/10.1109/icbbe.2011.5780933?mailto=christian.hauschke@tib.eu,2011,article,True,71,Occurrence and Health Effects of Drinking Water Disinfection By-Products,Physical Sciences,"Health, Toxicology and Mutagenesis",,False,en,Environmental Science,
https://openalex.org/W2279018272,"Notice of Retraction: The Relationship between Athletic Achievement Motivation, Coping Strategies and Pre-Competition Emotions of Athletes of Aerobics",,1,https://doi.org/10.1109/paccs.2011.5990348,https://api.labs.crossref.org/works/https://doi.org/10.1109/paccs.2011.5990348?mailto=christian.hauschke@tib.eu,2011,article,True,71,Self-Determination Theory in Human Motivation and Well-Being,Social Sciences,Social Psychology,,False,en,Psychology,
https://openalex.org/W2279104285,Notice of Retraction: Study of the relationship between IPO market timing and capital structure of Real Estate companies Econometric evidence from the Panel Data of Hong Kong Main Board Stock Market,,1,https://doi.org/10.1109/icbmei.2011.5918013,https://api.labs.crossref.org/works/https://doi.org/10.1109/icbmei.2011.5918013?mailto=christian.hauschke@tib.eu,2011,article,True,71,Application of Real Options in Investment Strategies,Social Sciences,Finance,,False,en,"Economics, Econometrics and Finance",
https://openalex.org/W2279523597,Notice of Retraction: The Thermodynamic Analysis of SO2 and H2S Emissions from INBA System of Blast Furnace,,1,https://doi.org/10.1109/icbbe.2011.5781295,https://api.labs.crossref.org/works/https://doi.org/10.1109/icbbe.2011.5781295?mailto=christian.hauschke@tib.eu,2011,article,True,71,Thermochemical Software and Databases in Metallurgy,Physical Sciences,Mechanical Engineering,,False,en,Engineering,
https://openalex.org/W2280104533,"Notice of Retraction: Assessment of Surface Water Quality Using Multivariate Statistical Techniques: A Case Study of the Lakes in Wuhan, China",,1,https://doi.org/10.1109/icbbe.2011.5780731,https://api.labs.crossref.org/works/https://doi.org/10.1109/icbbe.2011.5780731?mailto=christian.hauschke@tib.eu,2011,article,True,71,Assessment of Surface Water Quality,Physical Sciences,Water Science and Technology,,False,en,Environmental Science,
https://openalex.org/W2280974004,Notice of Retraction: Inhibition of Ammonium Concentration on the Methanogenic Activity of Anaerobic Granular Sludge from Activated Sludge-Biofilm Anaerobic Hybrid Bio-Reactor,,1,https://doi.org/10.1109/icbbe.2011.5781149,https://api.labs.crossref.org/works/https://doi.org/10.1109/icbbe.2011.5781149?mailto=christian.hauschke@tib.eu,2011,article,True,71,Anaerobic Digestion and Biogas Production,Physical Sciences,Building and Construction,,False,en,Engineering,
https://openalex.org/W2280982311,"Notice of Retraction: Succession and integration, urban design in Tibet under the background of development: A study on the planning and construction of Bayi town in Tibet",,1,https://doi.org/10.1109/icetce.2011.5775750,https://api.labs.crossref.org/works/https://doi.org/10.1109/icetce.2011.5775750?mailto=christian.hauschke@tib.eu,2011,article,True,71,Sustainable Design and Urban Development,Physical Sciences,Building and Construction,,False,en,Engineering,
https://openalex.org/W2281617635,Notice of Retraction: Review of the Pollution Control and Ecological Restoration of Coal Waste Piles with Spontaneous Combustion,,1,https://doi.org/10.1109/icbbe.2011.5781553,https://api.labs.crossref.org/works/https://doi.org/10.1109/icbbe.2011.5781553?mailto=christian.hauschke@tib.eu,2011,article,True,71,Study on Rock Mechanics in Deep Mining Engineering,Physical Sciences,Mechanics of Materials,,False,en,Engineering,
https://openalex.org/W2281630477,Notice of Retraction: Evaluation for Investment Cost Influence Factors of Expressway Project,,1,https://doi.org/10.1109/appeec.2011.5748374,https://api.labs.crossref.org/works/https://doi.org/10.1109/appeec.2011.5748374?mailto=christian.hauschke@tib.eu,2011,article,True,71,Comprehensive Assessment of Safety in Energy and Infrastructure,Physical Sciences,"Safety, Risk, Reliability and Quality",,False,en,Engineering,
https://openalex.org/W2282779132,Notice of Retraction: The Chinese Revised Edition of Wender Utah Rating Scale for Attention Deficit/Hyperactivity Disorder in Adults,,1,https://doi.org/10.1109/icbbe.2011.5780107,https://api.labs.crossref.org/works/https://doi.org/10.1109/icbbe.2011.5780107?mailto=christian.hauschke@tib.eu,2011,article,True,71,Attention-Deficit/Hyperactivity Disorder,Health Sciences,Psychiatry and Mental health,,False,en,Medicine,
https://openalex.org/W2283637614,"Notice of Retraction: Distribution Characteristics of Soil Dissolved Organic Carbon under Different Land Use in Sanjiang Plain, China",,1,https://doi.org/10.1109/icbbe.2011.5781554,https://api.labs.crossref.org/works/https://doi.org/10.1109/icbbe.2011.5781554?mailto=christian.hauschke@tib.eu,2011,article,True,71,Analysis of Land Cover and Ecosystems,Physical Sciences,Ecology,,False,en,Environmental Science,
https://openalex.org/W2284719236,Notice of Retraction: Study on the Degradation of Malachite Green by TiO2-ZnO Nanocomposition,,1,https://doi.org/10.1109/icbbe.2011.5781523,https://api.labs.crossref.org/works/https://doi.org/10.1109/icbbe.2011.5781523?mailto=christian.hauschke@tib.eu,2011,article,True,71,Photocatalysis and Solar Energy Conversion,Physical Sciences,"Renewable Energy, Sustainability and the Environment",,False,en,Energy,
https://openalex.org/W2285145794,"Notice of Retraction: The Effect of Water Level on Microbial Activity and Active Organic Carbon under Calamagrostis angustifolia Marsh in Sanjiang Plain, China",,1,https://doi.org/10.1109/icbbe.2011.5781587,https://api.labs.crossref.org/works/https://doi.org/10.1109/icbbe.2011.5781587?mailto=christian.hauschke@tib.eu,2011,article,True,71,Importance of Mangrove Ecosystems in Coastal Protection,Physical Sciences,Ecology,,False,en,Environmental Science,
https://openalex.org/W2285817764,Notice of Retraction: Polymorphic Analysis of Molecular Marker Based on WRKY Transcription Factor in Eggplant,,1,https://doi.org/10.1109/icbbe.2011.5780114,https://api.labs.crossref.org/works/https://doi.org/10.1109/icbbe.2011.5780114?mailto=christian.hauschke@tib.eu,2011,article,True,71,Genetic Architecture of Quantitative Traits,Life Sciences,Genetics,,False,en,"Biochemistry, Genetics and Molecular Biology",
https://openalex.org/W2286120855,Notice of Retraction: Aquatic Predicted No-Effect Concentration (PNEC) Derivation for Perfluorooctane Sulfonic Acid (PFOA),,1,https://doi.org/10.1109/icbbe.2011.5781369,https://api.labs.crossref.org/works/https://doi.org/10.1109/icbbe.2011.5781369?mailto=christian.hauschke@tib.eu,2011,article,True,71,Perfluoroalkyl and Polyfluoroalkyl Substances in the Environment,Physical Sciences,Environmental Chemistry,,False,en,Environmental Science,
https://openalex.org/W2286514566,Notice of Retraction: Effects of Natural Solid Carbon Source on Advanced Treatment of Secondary Effluent in Subsurface-Flow Constructed Wetland,,1,https://doi.org/10.1109/icbbe.2011.5781179,https://api.labs.crossref.org/works/https://doi.org/10.1109/icbbe.2011.5781179?mailto=christian.hauschke@tib.eu,2011,article,True,71,Application of Constructed Wetlands for Wastewater Treatment,Physical Sciences,Industrial and Manufacturing Engineering,,False,en,Environmental Science,
https://openalex.org/W2287336095,Notice of Retraction: Chemical Optimization in the Co-Precipitation Phosphorus Removal Process,,1,https://doi.org/10.1109/icbbe.2011.5780890,https://api.labs.crossref.org/works/https://doi.org/10.1109/icbbe.2011.5780890?mailto=christian.hauschke@tib.eu,2011,article,True,71,Phosphorus Recovery and Sustainable Management,Physical Sciences,Industrial and Manufacturing Engineering,,False,en,Environmental Science,
https://openalex.org/W2287937650,Notice of Retraction: Characteristics of Produced Water from Coal Mine and Coalbed Methane Well and Impact on Environment in Liulin Mining Area,,1,https://doi.org/10.1109/icbbe.2011.5780846,https://api.labs.crossref.org/works/https://doi.org/10.1109/icbbe.2011.5780846?mailto=christian.hauschke@tib.eu,2011,article,True,71,Anaerobic Methane Oxidation and Gas Hydrates,Physical Sciences,Environmental Chemistry,,False,en,Environmental Science,
https://openalex.org/W2288385085,Notice of Retraction: The Modern Landscape Architecture Education Using Traditional Feng Shui Theory in China,,1,https://doi.org/10.1109/paccs.2011.5990330,https://api.labs.crossref.org/works/https://doi.org/10.1109/paccs.2011.5990330?mailto=christian.hauschke@tib.eu,2011,article,True,71,Feng Shui Influence on Cultural Landscapes,Social Sciences,Archeology,,False,en,Arts and Humanities,
https://openalex.org/W2288476969,Notice of Retraction: Implementation of sliding mode variable structure control for Induction heating power supply based on DSP builder,,1,https://doi.org/10.1109/iceice.2011.5778071,https://api.labs.crossref.org/works/https://doi.org/10.1109/iceice.2011.5778071?mailto=christian.hauschke@tib.eu,2011,article,True,71,Induction Heating Technology and Applications,Physical Sciences,Mechanical Engineering,,False,en,Engineering,
https://openalex.org/W2288599473,Notice of Retraction: Feasibility Study on Solidification/Stabilization of MSWI Fly Ash Using Na3PO4 Combined with Coal Fly Ash Agent,,1,https://doi.org/10.1109/icbbe.2011.5781461,https://api.labs.crossref.org/works/https://doi.org/10.1109/icbbe.2011.5781461?mailto=christian.hauschke@tib.eu,2011,article,True,71,Layered Double Hydroxide Nanomaterials,Physical Sciences,Materials Chemistry,,False,en,Materials Science,
https://openalex.org/W2288630785,Notice of Retraction: Anaerobic Granulation in Expanded Granular Sludge Bed (EGSB) Reactor Seeded with Digestion Sludge for Treatment of Actual Coking Wastewater,,1,https://doi.org/10.1109/icbbe.2011.5781117,https://api.labs.crossref.org/works/https://doi.org/10.1109/icbbe.2011.5781117?mailto=christian.hauschke@tib.eu,2011,article,True,71,Microbial Nitrogen Cycling in Wastewater Treatment Systems,Physical Sciences,Pollution,,False,en,Environmental Science,
https://openalex.org/W2289021414,Notice of Retraction: The Changes of Crude Oil during Evaporation Process in Environment,,1,https://doi.org/10.1109/icbbe.2011.5781616,https://api.labs.crossref.org/works/https://doi.org/10.1109/icbbe.2011.5781616?mailto=christian.hauschke@tib.eu,2011,article,True,71,Petroleum Chemistry and Analysis,Physical Sciences,Analytical Chemistry,,False,en,Chemistry,
https://openalex.org/W2289914317,Notice of Retraction: Effect of Petroleum Contamination on Soil Microbial Community in Oil Storage Pit of Daqing Oilfield in China,,1,https://doi.org/10.1109/icbbe.2011.5781341,https://api.labs.crossref.org/works/https://doi.org/10.1109/icbbe.2011.5781341?mailto=christian.hauschke@tib.eu,2011,article,True,71,Microbial Bioremediation of Organic Pollutants,Physical Sciences,Pollution,,False,en,Environmental Science,
https://openalex.org/W2289982507,Notice of Retraction: Ventilation Air Methane Recovery by Pressure Swing Adsorption,,1,https://doi.org/10.1109/icbbe.2011.5781248,https://api.labs.crossref.org/works/https://doi.org/10.1109/icbbe.2011.5781248?mailto=christian.hauschke@tib.eu,2011,article,True,71,Carbon Dioxide Capture and Storage Technologies,Physical Sciences,Mechanical Engineering,,False,en,Engineering,
https://openalex.org/W2290487726,Notice of Retraction: Effect of the Extract of Fructus tribuli on Growth of Bifidobacterium bifidum,,1,https://doi.org/10.1109/icbbe.2011.5780695,https://api.labs.crossref.org/works/https://doi.org/10.1109/icbbe.2011.5780695?mailto=christian.hauschke@tib.eu,2011,article,True,71,Role of Fructans in Nutrition and Health,Health Sciences,Nutrition and Dietetics,,False,en,Nursing,
https://openalex.org/W2291096641,"Notice of Retraction: Electrocatalytic Hydrodehalogenation of 2,4- Dichlorophenol on Palladium Coated Foam Nickel Cathode",,1,https://doi.org/10.1109/icbbe.2011.5781080,https://api.labs.crossref.org/works/https://doi.org/10.1109/icbbe.2011.5781080?mailto=christian.hauschke@tib.eu,2011,article,True,71,Nanoscale Zero-Valent Iron Applications and Remediation,Physical Sciences,Biomedical Engineering,,False,en,Engineering,
https://openalex.org/W2291240707,Notice of Retraction: The Impact of Water Resource Strategy on the Juyan Lake Restoration of Heihe River Basin,,1,https://doi.org/10.1109/icbbe.2011.5780876,https://api.labs.crossref.org/works/https://doi.org/10.1109/icbbe.2011.5780876?mailto=christian.hauschke@tib.eu,2011,article,True,71,Analysis of Land Cover and Ecosystems,Physical Sciences,Ecology,,False,en,Environmental Science,
https://openalex.org/W2291354899,Notice of Retraction: Accidental Contaminant Detection Method Based on One-Tailed U Test,,1,https://doi.org/10.1109/icbbe.2011.5780269,https://api.labs.crossref.org/works/https://doi.org/10.1109/icbbe.2011.5780269?mailto=christian.hauschke@tib.eu,2011,article,True,71,Risk Analysis and Management,Social Sciences,"Statistics, Probability and Uncertainty",,False,en,Decision Sciences,
https://openalex.org/W2292191424,Notice of Retraction: Photolysis of Acetamiprid in Hydrogen Peroxide under UV Light,,1,https://doi.org/10.1109/icbbe.2011.5781226,https://api.labs.crossref.org/works/https://doi.org/10.1109/icbbe.2011.5781226?mailto=christian.hauschke@tib.eu,2011,article,True,71,Antibiotic Resistance in Aquatic Environments and Wastewater,Physical Sciences,Pollution,,False,en,Environmental Science,
