id,display_name,primary_location_display_name,cited_by_count,doi,crossref_call,publication_year,type,is_retracted,cited_by_percentile_year_min,primary_topic_display_name,primary_topic_domain_display_name,primary_topic_subfield_display_name,primary_location_source_host_organization_name,open_access_is_oa,language,primary_topic_field_display_name,update_nature
https://openalex.org/W3036136110,RETRACTED ARTICLE: Efficient optimal resource allocation for profit maximization in software defined network approach to improve quality of service in cloud environments,Journal of Ambient Intelligence and Humanized Computing,0,https://doi.org/10.1007/s12652-020-02192-8,https://api.labs.crossref.org/works/https://doi.org/10.1007/s12652-020-02192-8?mailto=christian.hauschke@tib.eu,2020,article,True,0,Software-Defined Networking and Network Virtualization,Physical Sciences,Computer Networks and Communications,Springer Science+Business Media,False,en,Computer Science,Retraction;Crossmark Retraction
https://openalex.org/W3036216747,RETRACTED: How to Improve the Ability of Library and Information in the Era of Big Data,Journal of Physics: Conference Series,0,https://doi.org/10.1088/1742-6596/1533/4/042045,https://api.labs.crossref.org/works/https://doi.org/10.1088/1742-6596/1533/4/042045?mailto=christian.hauschke@tib.eu,2020,article,True,0,Webometrics Analysis in Academic Research,Physical Sciences,Information Systems,IOP Publishing,True,en,Computer Science,Retraction
https://openalex.org/W3036304957,Synthesis of the Structure of Technological Processes,Инженерные технологии и системы,0,https://doi.org/10.15507/2658-4123.030.202002.287-299,https://api.labs.crossref.org/works/https://doi.org/10.15507/2658-4123.030.202002.287-299?mailto=christian.hauschke@tib.eu,2020,article,True,0,Computer Numerical Control Systems in Manufacturing,Physical Sciences,Industrial and Manufacturing Engineering,National Research Mordova State University; MRSU,True,en,Engineering,Retraction
https://openalex.org/W3036332235,RETRACTED ARTICLE: Application of cognitive system engineering in development of dragon boat sports,Current Psychology,0,https://doi.org/10.1007/s12144-020-00824-y,https://api.labs.crossref.org/works/https://doi.org/10.1007/s12144-020-00824-y?mailto=christian.hauschke@tib.eu,2020,article,True,0,Personas in User-Centered Design and Development,Physical Sciences,Human-Computer Interaction,Springer Science+Business Media,True,en,Computer Science,Retraction;Crossmark Retraction
https://openalex.org/W3036461518,Neural stem cell conditioned medium alleviates Aβ&lt;sub&gt;25-35&lt;/sub&gt; damage to SH-SY5Y cells through the PCMT1/MST1 pathway,European Journal of Histochemistry,0,https://doi.org/10.4081/ejh.2020.3135,https://api.labs.crossref.org/works/https://doi.org/10.4081/ejh.2020.3135?mailto=christian.hauschke@tib.eu,2020,article,True,0,Epigenetic Modifications and Their Functional Implications,Life Sciences,Molecular Biology,PAGEPress (Italy),True,en,"Biochemistry, Genetics and Molecular Biology",Retraction
https://openalex.org/W3036474700,WITHDRAWN: Burns first aid practices amongst paediatric caregivers following secondary advice,Burns,0,https://doi.org/10.1016/j.burns.2020.06.006,https://api.labs.crossref.org/works/https://doi.org/10.1016/j.burns.2020.06.006?mailto=christian.hauschke@tib.eu,2020,article,True,0,Family-Centered Care in Intensive Care Units,Health Sciences,Radiological and Ultrasound Technology,Elsevier BV,False,en,Health Professions,Retraction
https://openalex.org/W3036497915,Isolation and Elimination of Latent and Productive Herpes Simplex Virus from the Sacral and Trigeminal Ganglions,,0,https://doi.org/10.3390/proceedings2020050092,https://api.labs.crossref.org/works/https://doi.org/10.3390/proceedings2020050092?mailto=christian.hauschke@tib.eu,2020,article,True,0,"Herpesviruses: Epidemiology, Pathogenesis, and Management",Health Sciences,Epidemiology,,True,en,Medicine,Retraction
https://openalex.org/W3036557051,A Complex Case of Dysmenorrhea and Concurrent Acute Appendicitis,Cureus,0,https://doi.org/10.7759/cureus.8734,https://api.labs.crossref.org/works/https://doi.org/10.7759/cureus.8734?mailto=christian.hauschke@tib.eu,2020,article,True,0,Menstrual Health and Disorders,Health Sciences,"Public Health, Environmental and Occupational Health","Cureus, Inc.",True,en,Medicine,Retraction
https://openalex.org/W3036707754,RETRACTED: Transformation of Competitive Sports Based on Artificial Intelligence,Journal of Physics: Conference Series,0,https://doi.org/10.1088/1742-6596/1533/3/032048,https://api.labs.crossref.org/works/https://doi.org/10.1088/1742-6596/1533/3/032048?mailto=christian.hauschke@tib.eu,2020,article,True,0,Evolution and Impacts of Event Tourism,Social Sciences,Sociology and Political Science,IOP Publishing,True,en,Social Sciences,Retraction
https://openalex.org/W3036772010,RETRACTED ARTICLE: Multi linear adaptive sequence transmission based code division multiple access using multicast neighbor data communication in wireless network,Journal of Ambient Intelligence and Humanized Computing,0,https://doi.org/10.1007/s12652-020-02207-4,https://api.labs.crossref.org/works/https://doi.org/10.1007/s12652-020-02207-4?mailto=christian.hauschke@tib.eu,2020,article,True,0,Wireless Communication and Network Optimization,Physical Sciences,Electrical and Electronic Engineering,Springer Science+Business Media,False,en,Engineering,Retraction;Crossmark Retraction
https://openalex.org/W3036878372,RETRACTED: Investigation and Analysis of Current Situation of High School Campus Basketball in Huining City Based on Big Data Analysis,Journal of Physics: Conference Series,0,https://doi.org/10.1088/1742-6596/1533/4/042089,https://api.labs.crossref.org/works/https://doi.org/10.1088/1742-6596/1533/4/042089?mailto=christian.hauschke@tib.eu,2020,article,True,0,Drivers and Impediments for Cross-Border E-Commerce,Social Sciences,Business and International Management,IOP Publishing,True,en,"Business, Management and Accounting",Retraction
https://openalex.org/W3036946131,RETRACTED: A study on the influence of parents’ marital quality on their young children’s goods in career and family,International Journal of Electrical Engineering Education,0,https://doi.org/10.1177/0020720920931438,https://api.labs.crossref.org/works/https://doi.org/10.1177/0020720920931438?mailto=christian.hauschke@tib.eu,2020,article,True,0,Intergenerational Family Relationships and Support,Social Sciences,Sociology and Political Science,SAGE Publishing,False,en,Social Sciences,Retraction;Expression of concern
https://openalex.org/W3036947877,RETRACTED: Environmental data analysis based on fuzzy clustering method,International Journal of Electrical Engineering Education,0,https://doi.org/10.1177/0020720920928542,https://api.labs.crossref.org/works/https://doi.org/10.1177/0020720920928542?mailto=christian.hauschke@tib.eu,2020,article,True,0,Real-time Water Quality Monitoring and Aquaculture Management,Physical Sciences,Water Science and Technology,SAGE Publishing,False,en,Environmental Science,Retraction
https://openalex.org/W3037036691,RETRACTED ARTICLE: Early Pioneers of the Americas: The Role of the Olmecs in Urban Education and Social Studies Curriculum,The Urban Review,0,https://doi.org/10.1007/s11256-020-00584-w,https://api.labs.crossref.org/works/https://doi.org/10.1007/s11256-020-00584-w?mailto=christian.hauschke@tib.eu,2020,article,True,0,Politics of Citizenship Education and Historical Thinking,Social Sciences,Sociology and Political Science,Springer Science+Business Media,True,en,Social Sciences,Retraction;Crossmark Retraction
https://openalex.org/W3037044086,Retracted: Exploring the microbiome and mindfulness connection,Future Science OA,0,https://doi.org/10.2144/fsoa-2020-0006,https://api.labs.crossref.org/works/https://doi.org/10.2144/fsoa-2020-0006?mailto=christian.hauschke@tib.eu,2020,article,True,0,Mindfulness and Psychological Well-being,Social Sciences,Clinical Psychology,Future Science Ltd,True,en,Psychology,Retraction
https://openalex.org/W3037053871,RETRACTED: Antibodies to cellular prion protein and its cognate ligand stress-inducible protein 1 in systemic lupus erythematosus,Lupus,0,https://doi.org/10.1177/0961203320935987,https://api.labs.crossref.org/works/https://doi.org/10.1177/0961203320935987?mailto=christian.hauschke@tib.eu,2020,article,True,0,Prion Diseases: Causes and Molecular Basis,Life Sciences,Molecular Biology,SAGE Publishing,False,en,"Biochemistry, Genetics and Molecular Biology",Retraction
https://openalex.org/W3037205200,Bayesian networks applied to climate conditions inside a naturally ventilated greenhouse,IOP Conference Series: Materials Science and Engineering,0,https://doi.org/10.1088/1757-899x/872/1/012028,https://api.labs.crossref.org/works/https://doi.org/10.1088/1757-899x/872/1/012028?mailto=christian.hauschke@tib.eu,2020,article,True,0,Dynamic Modeling of Plant Form and Growth,Life Sciences,Plant Science,IOP Publishing,True,en,Agricultural and Biological Sciences,Retraction
https://openalex.org/W3037412327,WITHDRAWN: Traditional streets physical and the spatial character materials of Thanjavur,Materials Today: Proceedings,0,https://doi.org/10.1016/j.matpr.2020.05.344,https://api.labs.crossref.org/works/https://doi.org/10.1016/j.matpr.2020.05.344?mailto=christian.hauschke@tib.eu,2020,article,True,0,Analysis and Modeling of Urban Street Networks,Physical Sciences,Building and Construction,Elsevier BV,True,en,Engineering,Crossmark Retraction
https://openalex.org/W3037598605,Thermographic imaging for use in artificial intelligence and vision algorithms,IOP Conference Series: Materials Science and Engineering,0,https://doi.org/10.1088/1757-899x/872/1/012035,https://api.labs.crossref.org/works/https://doi.org/10.1088/1757-899x/872/1/012035?mailto=christian.hauschke@tib.eu,2020,article,True,0,Effects of Heat Stress on Livestock Production,Life Sciences,Animal Science and Zoology,IOP Publishing,True,en,Agricultural and Biological Sciences,Retraction
https://openalex.org/W3037690345,RETRACTED ARTICLE: Fluorescence spectrum–based dual-parameter detection method for pH and DO in cancer cell metabolic fluid,Journal of Nanoparticle Research,0,https://doi.org/10.1007/s11051-020-04900-z,https://api.labs.crossref.org/works/https://doi.org/10.1007/s11051-020-04900-z?mailto=christian.hauschke@tib.eu,2020,article,True,0,Advances in Chemical Sensor Technologies,Physical Sciences,Bioengineering,Springer Science+Business Media,False,en,Chemical Engineering,Retraction
https://openalex.org/W3037690747,Energy Balance in a Greenhouse: Temperature and Humidity Monitoring,IOP Conference Series: Materials Science and Engineering,0,https://doi.org/10.1088/1757-899x/872/1/012031,https://api.labs.crossref.org/works/https://doi.org/10.1088/1757-899x/872/1/012031?mailto=christian.hauschke@tib.eu,2020,article,True,0,Dynamic Modeling of Plant Form and Growth,Life Sciences,Plant Science,IOP Publishing,True,en,Agricultural and Biological Sciences,Retraction
https://openalex.org/W3037832670,Paradox in melanoma: more patients fewer publications.,Melanoma Research,0,,https://api.labs.crossref.org/works/null?mailto=christian.hauschke@tib.eu,2020,article,True,0,Melanoma,Health Sciences,Oncology,Lippincott Williams & Wilkins,True,en,Medicine,
https://openalex.org/W3037901691,"RETRACTED ARTICLE: The platform feature, self-concept congruence and brand experience: A fuzzy set-based qualitative comparative analysis based on WeChat",Current Psychology,0,https://doi.org/10.1007/s12144-020-00788-z,https://api.labs.crossref.org/works/https://doi.org/10.1007/s12144-020-00788-z?mailto=christian.hauschke@tib.eu,2020,article,True,0,Impact of Social Media on Consumer Behavior,Social Sciences,Sociology and Political Science,Springer Science+Business Media,True,en,Social Sciences,Retraction;Crossmark Retraction
https://openalex.org/W3037913874,WITHDRAWN: Évaluation du coût de la transfusion de concentrés de globules rouges dans un établissement de soins français,Transfusion Clinique et Biologique,0,https://doi.org/10.1016/j.tracli.2020.06.006,https://api.labs.crossref.org/works/https://doi.org/10.1016/j.tracli.2020.06.006?mailto=christian.hauschke@tib.eu,2020,article,True,0,Effects of Blood Transfusion in Clinical Practice,Health Sciences,Biochemistry,Elsevier BV,False,fr,Medicine,Retraction
https://openalex.org/W3037988450,Analysis of air quality data in the city of Bogotá through clustering techniques,IOP Conference Series: Materials Science and Engineering,0,https://doi.org/10.1088/1757-899x/872/1/012027,https://api.labs.crossref.org/works/https://doi.org/10.1088/1757-899x/872/1/012027?mailto=christian.hauschke@tib.eu,2020,article,True,0,Public Health and Environmental Management,Physical Sciences,"Health, Toxicology and Mutagenesis",IOP Publishing,True,en,Environmental Science,Retraction
https://openalex.org/W3038130004,"WITHDRAWN: The Changes of ADC Value, DCE-MRI Parameters and Their Influence on Neuropsychology in Prostate Cancer Patients after Endocrine Therapy Based on Magnetic Resonance Imaging",Neuroscience Letters,0,https://doi.org/10.1016/j.neulet.2020.135221,https://api.labs.crossref.org/works/https://doi.org/10.1016/j.neulet.2020.135221?mailto=christian.hauschke@tib.eu,2020,article,True,0,Positron Emission Tomography Imaging in Oncology,Health Sciences,"Radiology, Nuclear Medicine and Imaging",Elsevier BV,False,en,Medicine,Retraction
https://openalex.org/W3038137362,RETRACTED: The Key Problems of Intelligent Quality Control of Green Building are Analyzed Based on Computer Information Data,Journal of Physics: Conference Series,0,https://doi.org/10.1088/1742-6596/1574/1/012006,https://api.labs.crossref.org/works/https://doi.org/10.1088/1742-6596/1574/1/012006?mailto=christian.hauschke@tib.eu,2020,article,True,0,Sustainable Construction and Green Building,Physical Sciences,Building and Construction,IOP Publishing,True,en,Engineering,Retraction
https://openalex.org/W3038139386,Retraction notice to ‘Use of HA-GGE biplot for interpretation of genotype × environment interaction when assessing sources of durable resistance against powdery mildew in mungbean (Vigna radiata)’ [Crop &amp; Pasture Science (2020) doi:10.1071/CP20114],Crop & Pasture Science,0,https://doi.org/10.1071/cp20114,https://api.labs.crossref.org/works/https://doi.org/10.1071/cp20114?mailto=christian.hauschke@tib.eu,2020,article,True,0,Cultivar Evaluation and Mega-Environment Investigation,Life Sciences,Plant Science,CSIRO Publishing,False,en,Agricultural and Biological Sciences,Retraction
https://openalex.org/W3038371250,WITHDRAWN: Analysis on the diagnosis of infection risk factors and the incidence of ureteroscopy holmium laser lithotripsy and vagal excitation under computed tomography image information health technology,Neuroscience Letters,0,https://doi.org/10.1016/j.neulet.2020.135224,https://api.labs.crossref.org/works/https://doi.org/10.1016/j.neulet.2020.135224?mailto=christian.hauschke@tib.eu,2020,article,True,0,Prevalence and Management of Kidney Stones,Health Sciences,Pulmonary and Respiratory Medicine,Elsevier BV,False,en,Medicine,Retraction
https://openalex.org/W3038534182,"RETRACTED ARTICLE: New Co(II)-organic framework for cyanosilylation reactions and treatment effect against esophageal cancer by inhibiting cancer cell viability, migration, and invasion",Journal of Coordination Chemistry,0,https://doi.org/10.1080/00958972.2020.1788001,https://api.labs.crossref.org/works/https://doi.org/10.1080/00958972.2020.1788001?mailto=christian.hauschke@tib.eu,2020,article,True,0,Chemistry and Applications of Metal-Organic Frameworks,Physical Sciences,Inorganic Chemistry,Taylor & Francis,False,en,Chemistry,
https://openalex.org/W3038543850,3D printed cellulose-based high-efficiency oil-water separation mesh,IOP Conference Series: Earth and Environmental Science,0,https://doi.org/10.1088/1755-1315/514/2/022088,https://api.labs.crossref.org/works/https://doi.org/10.1088/1755-1315/514/2/022088?mailto=christian.hauschke@tib.eu,2020,article,True,0,Superhydrophobic Surface Technology,Physical Sciences,"Surfaces, Coatings and Films",IOP Publishing,True,en,Materials Science,Retraction
https://openalex.org/W3038580292,RETRACTED: Brief Discussion on the Time Significance of the Songs of the War of Resistance in the Mudanjiang River Basin During the Fourteen Years’ Anti-Japanese War Based on Computer Multimedia Technology,Journal of Physics: Conference Series,0,https://doi.org/10.1088/1742-6596/1574/1/012047,https://api.labs.crossref.org/works/https://doi.org/10.1088/1742-6596/1574/1/012047?mailto=christian.hauschke@tib.eu,2020,article,True,0,Cultural Diversity and Traditional Practices,Social Sciences,Cultural Studies,IOP Publishing,True,en,Social Sciences,Retraction
https://openalex.org/W3038645770,"RETRACTED ARTICLE: History of heart transplantation, the resurgence of DCD heart donations and outcomes following transplantation; the Royal Papworth Experience",Indian Journal of Thoracic and Cardiovascular Surgery,0,https://doi.org/10.1007/s12055-020-00960-x,https://api.labs.crossref.org/works/https://doi.org/10.1007/s12055-020-00960-x?mailto=christian.hauschke@tib.eu,2020,article,True,0,Organ Transplantation and Rejection,Health Sciences,Surgery,Springer Science+Business Media,True,en,Medicine,Retraction;Crossmark Retraction
https://openalex.org/W3038665853,Perception and Knowledge on Climate Change: A Study of Private University Students in Bangladesh,Environmental and Earth Sciences Research Journal,0,https://doi.org/10.18280/eesrj.070202,https://api.labs.crossref.org/works/https://doi.org/10.18280/eesrj.070202?mailto=christian.hauschke@tib.eu,2020,article,True,0,Factors Influencing Pro-environmental Behavior,Physical Sciences,"Management, Monitoring, Policy and Law",International Information and Engineering Technology Association,False,en,Environmental Science,Retraction
https://openalex.org/W3038691690,RETRACTED: The Interaction of New Media and Social Information Based on Artificial Intelligence,Journal of Physics: Conference Series,0,https://doi.org/10.1088/1742-6596/1574/1/012133,https://api.labs.crossref.org/works/https://doi.org/10.1088/1742-6596/1574/1/012133?mailto=christian.hauschke@tib.eu,2020,article,True,0,Artificial Intelligence and Technology Innovation,Physical Sciences,Artificial Intelligence,IOP Publishing,True,en,Computer Science,Retraction
https://openalex.org/W3038875547,Retracted Article: The prospect of development of robotics in Russia,E3S web of conferences,0,https://doi.org/10.1051/e3sconf/202017505043,https://api.labs.crossref.org/works/https://doi.org/10.1051/e3sconf/202017505043?mailto=christian.hauschke@tib.eu,2020,article,True,0,Interdisciplinary Studies across Humanities and Sciences,Social Sciences,History and Philosophy of Science,EDP Sciences,True,en,Arts and Humanities,Retraction
https://openalex.org/W3039234389,RETRACTED: Wireless Location Algorithm of Digital Broadcast Signals Based on Multi-Convolution Neural Network,Journal of Physics: Conference Series,0,https://doi.org/10.1088/1742-6596/1574/1/012051,https://api.labs.crossref.org/works/https://doi.org/10.1088/1742-6596/1574/1/012051?mailto=christian.hauschke@tib.eu,2020,article,True,0,Speech Enhancement Techniques,Physical Sciences,Signal Processing,IOP Publishing,True,en,Computer Science,Retraction
https://openalex.org/W3039267945,RETRACTED: Development Evaluation System of Psychological Vocational Education Based on Artificial Intelligence,Journal of Physics: Conference Series,0,https://doi.org/10.1088/1742-6596/1574/1/012129,https://api.labs.crossref.org/works/https://doi.org/10.1088/1742-6596/1574/1/012129?mailto=christian.hauschke@tib.eu,2020,article,True,0,Future of Personalized Medicine in Healthcare,Health Sciences,"Public Health, Environmental and Occupational Health",IOP Publishing,True,en,Medicine,Retraction
https://openalex.org/W3039428170,WITHDRAWN: Notes From Cardiology Clinic: The Patients We Dislike,Canadian Journal of Cardiology,0,https://doi.org/10.1016/j.cjca.2019.11.024,https://api.labs.crossref.org/works/https://doi.org/10.1016/j.cjca.2019.11.024?mailto=christian.hauschke@tib.eu,2020,article,True,0,,,,Elsevier BV,True,en,,Retraction
https://openalex.org/W3039518709,WITHDRAWN: Dynamic Observation of Postoperative Infection and Neuron-specific Enolase Levels in Serum in Patients with Non-small Cell Lung Cancer According to Positron Emission Tomography–Computed Tomography,Neuroscience Letters,0,https://doi.org/10.1016/j.neulet.2020.135226,https://api.labs.crossref.org/works/https://doi.org/10.1016/j.neulet.2020.135226?mailto=christian.hauschke@tib.eu,2020,article,True,0,Radiomics in Medical Imaging Analysis,Health Sciences,"Radiology, Nuclear Medicine and Imaging",Elsevier BV,False,en,Medicine,Retraction
https://openalex.org/W3039521377,RETRACTED: Evaluation method of gas well dynamic reserves in low permeability gas reservoir based on big data analysis,Journal of Physics: Conference Series,0,https://doi.org/10.1088/1742-6596/1549/4/042023,https://api.labs.crossref.org/works/https://doi.org/10.1088/1742-6596/1549/4/042023?mailto=christian.hauschke@tib.eu,2020,article,True,0,Advanced Techniques in Reservoir Management,Physical Sciences,Ocean Engineering,IOP Publishing,True,en,Engineering,Retraction
https://openalex.org/W3039617280,RETRACTED ARTICLE: Speech network analysis and anomaly detection based on FSS model,International Journal of Speech Technology,0,https://doi.org/10.1007/s10772-020-09731-w,https://api.labs.crossref.org/works/https://doi.org/10.1007/s10772-020-09731-w?mailto=christian.hauschke@tib.eu,2020,article,True,0,Speech Recognition Technology,Physical Sciences,Artificial Intelligence,Springer Science+Business Media,False,en,Computer Science,Retraction
https://openalex.org/W3039636149,RETRACTED: Legal Issues of Bullying in Minor Campuses under Big Data Environment,Journal of Physics: Conference Series,0,https://doi.org/10.1088/1742-6596/1574/1/012101,https://api.labs.crossref.org/works/https://doi.org/10.1088/1742-6596/1574/1/012101?mailto=christian.hauschke@tib.eu,2020,article,True,0,Constitutional Reform and Legal Modernization in Russia,Social Sciences,Law,IOP Publishing,True,en,Social Sciences,Retraction
https://openalex.org/W3039782593,RETRACTED: The Practical Dilemma and Method of Personal Information Protection in the Era of Big Data,Journal of Physics: Conference Series,0,https://doi.org/10.1088/1742-6596/1574/1/012107,https://api.labs.crossref.org/works/https://doi.org/10.1088/1742-6596/1574/1/012107?mailto=christian.hauschke@tib.eu,2020,article,True,0,Impact of Big Data on Society and Industry,Social Sciences,Information Systems and Management,IOP Publishing,True,en,Decision Sciences,Retraction
https://openalex.org/W3039925398,RETRACTED: Research on Geophysical Logging Lithology Interpretation Method Based on Computer Technology,Journal of Physics: Conference Series,0,https://doi.org/10.1088/1742-6596/1574/1/012067,https://api.labs.crossref.org/works/https://doi.org/10.1088/1742-6596/1574/1/012067?mailto=christian.hauschke@tib.eu,2020,article,True,0,Characterization of Shale Gas Pore Structure,Physical Sciences,Mechanics of Materials,IOP Publishing,True,en,Engineering,Retraction
https://openalex.org/W3039941419,RETRACTED: Quality Correction for Songs of the War of Resistance Based on Computer Audio Technology,Journal of Physics: Conference Series,0,https://doi.org/10.1088/1742-6596/1574/1/012069,https://api.labs.crossref.org/works/https://doi.org/10.1088/1742-6596/1574/1/012069?mailto=christian.hauschke@tib.eu,2020,article,True,0,Adaptive Filtering in Non-Gaussian Signal Processing,Physical Sciences,Computational Mechanics,IOP Publishing,True,en,Engineering,Retraction
https://openalex.org/W3040148504,RETRACTED: Research on the Fusion of Decoration Design and Modern Elements of the Oroqen Nationality Based on Big Data Analysis,Journal of Physics: Conference Series,0,https://doi.org/10.1088/1742-6596/1574/1/012027,https://api.labs.crossref.org/works/https://doi.org/10.1088/1742-6596/1574/1/012027?mailto=christian.hauschke@tib.eu,2020,article,True,0,Slow Cities Movement and Sustainable Urban Development,Social Sciences,Urban Studies,IOP Publishing,True,en,Social Sciences,Retraction
https://openalex.org/W3040255267,RETRACTED ARTICLE: Multi feature drug compound analysis model for efficient success rate prediction using fuzzy rules,Journal of Ambient Intelligence and Humanized Computing,0,https://doi.org/10.1007/s12652-020-02275-6,https://api.labs.crossref.org/works/https://doi.org/10.1007/s12652-020-02275-6?mailto=christian.hauschke@tib.eu,2020,article,True,0,Computational Methods in Drug Discovery,Physical Sciences,Computational Theory and Mathematics,Springer Science+Business Media,False,en,Computer Science,Retraction;Crossmark Retraction
