id,display_name,primary_location_display_name,cited_by_count,doi,crossref_call,publication_year,type,is_retracted,cited_by_percentile_year_min,primary_topic_display_name,primary_topic_domain_display_name,primary_topic_subfield_display_name,primary_location_source_host_organization_name,open_access_is_oa,language,primary_topic_field_display_name,update_nature
https://openalex.org/W3007658571,Doctors in Star Trek: Hugh Culber in Star Trek: Discovery,Early Human Development,0,https://doi.org/10.1016/j.earlhumdev.2020.104995,https://api.labs.crossref.org/works/https://doi.org/10.1016/j.earlhumdev.2020.104995?mailto=christian.hauschke@tib.eu,2020,article,True,0,Civil Rights Movement and Black Studies,Social Sciences,Sociology and Political Science,Elsevier BV,False,en,Social Sciences,
https://openalex.org/W3007783991,Development of computer-based agricultural remote intelligent information monitoring system,International Journal of Computers and Applications,0,https://doi.org/10.1080/1206212x.2020.1730567,https://api.labs.crossref.org/works/https://doi.org/10.1080/1206212x.2020.1730567?mailto=christian.hauschke@tib.eu,2020,article,True,0,Hydrological Effects and Water Resource Management in China,Physical Sciences,Water Science and Technology,Taylor & Francis,False,en,Environmental Science,
https://openalex.org/W3007849381,<i>Retracted:</i> Sparse data inspired depth of urbanization in Zhejiang based on geographic information system and visual system,Concurrency and Computation: Practice and Experience,0,https://doi.org/10.1002/cpe.5704,https://api.labs.crossref.org/works/https://doi.org/10.1002/cpe.5704?mailto=christian.hauschke@tib.eu,2020,article,True,0,Dynamics of Urban Structure through Spatial Network Analysis,Social Sciences,Urban Studies,Wiley-Blackwell,False,en,Social Sciences,
https://openalex.org/W3007882816,Doctors in Star Trek: Dr. Phlox in Star Trek: Enterprise,Early Human Development,0,https://doi.org/10.1016/j.earlhumdev.2020.104994,https://api.labs.crossref.org/works/https://doi.org/10.1016/j.earlhumdev.2020.104994?mailto=christian.hauschke@tib.eu,2020,article,True,0,Search for Extraterrestrial Life and Intelligence,Physical Sciences,Astronomy and Astrophysics,Elsevier BV,False,en,Physics and Astronomy,
https://openalex.org/W3008216715,"Doctors in Star Trek: Drs. Boyce and Piper, the early years",Early Human Development,0,https://doi.org/10.1016/j.earlhumdev.2020.104988,https://api.labs.crossref.org/works/https://doi.org/10.1016/j.earlhumdev.2020.104988?mailto=christian.hauschke@tib.eu,2020,article,True,0,Exploration of Utopian and Dystopian Futures in Science Fiction,Social Sciences,Philosophy,Elsevier BV,False,en,Arts and Humanities,
https://openalex.org/W3008219008,"WITHDRAWN: Synthesis &amp; characterization of graphene oxide, reduced graphene oxide and silica nanoparticles",Materials Today: Proceedings,0,https://doi.org/10.1016/j.matpr.2020.01.393,https://api.labs.crossref.org/works/https://doi.org/10.1016/j.matpr.2020.01.393?mailto=christian.hauschke@tib.eu,2020,article,True,0,Biomedical Applications of Graphene Nanomaterials,Physical Sciences,Biomedical Engineering,Elsevier BV,False,en,Engineering,
https://openalex.org/W3008220065,Over-expression of HDAC8 down-regulate CDKN2A is associated with worse prognosis of esophageal squamous cell carcinoma,Translational cancer research,0,https://doi.org/10.21037/tcr.2020.01.32,https://api.labs.crossref.org/works/https://doi.org/10.21037/tcr.2020.01.32?mailto=christian.hauschke@tib.eu,2020,article,True,0,Epigenetic Modifications and Their Functional Implications,Life Sciences,Molecular Biology,AME Publishing Company,True,en,"Biochemistry, Genetics and Molecular Biology",
https://openalex.org/W3008526278,RETRACTED: Solvability of boundary value problems for the general Schrödinger equation via Schrödinger-type identity methods,Nonlinear Analysis,0,https://doi.org/10.1016/j.na.2020.111828,https://api.labs.crossref.org/works/https://doi.org/10.1016/j.na.2020.111828?mailto=christian.hauschke@tib.eu,2020,article,True,0,Global Well-Posedness of Nonlinear Wave Equations,Physical Sciences,Mathematical Physics,Elsevier BV,True,en,Mathematics,
https://openalex.org/W3008896360,Doctors in Star Trek: Dr. Leonard McCoy in Star Trek: The Next Generation,Early Human Development,0,https://doi.org/10.1016/j.earlhumdev.2020.104989,https://api.labs.crossref.org/works/https://doi.org/10.1016/j.earlhumdev.2020.104989?mailto=christian.hauschke@tib.eu,2020,article,True,0,Intelligence Studies and Analysis in Modern Context,Social Sciences,Political Science and International Relations,Elsevier BV,False,en,Social Sciences,
https://openalex.org/W3008974903,Real-time image recognition algorithm and system design of Android mobile devices,International Journal of Computers and Applications,0,https://doi.org/10.1080/1206212x.2020.1733791,https://api.labs.crossref.org/works/https://doi.org/10.1080/1206212x.2020.1733791?mailto=christian.hauschke@tib.eu,2020,article,True,0,Simultaneous Localization and Mapping,Physical Sciences,Aerospace Engineering,Taylor & Francis,False,en,Engineering,
https://openalex.org/W3009159701,RETRACTED CHAPTER: Health Economic Evaluation of Workplace Health Promotion,Handbook series in occupational health sciences,0,https://doi.org/10.1007/978-3-030-31438-5_24,https://api.labs.crossref.org/works/https://doi.org/10.1007/978-3-030-31438-5_24?mailto=christian.hauschke@tib.eu,2020,book-chapter,True,0,Enhancing Workplace Safety Culture and Practices,Health Sciences,Radiological and Ultrasound Technology,Springer International Publishing,False,en,Health Professions,
https://openalex.org/W3009183568,Retracted article: Analysis of extreme programming,MATEC web of conferences,0,https://doi.org/10.1051/matecconf/202030902016,https://api.labs.crossref.org/works/https://doi.org/10.1051/matecconf/202030902016?mailto=christian.hauschke@tib.eu,2020,article,True,0,Cognitive Radio Networks and Smart Technologies,Physical Sciences,Computer Networks and Communications,EDP Sciences,True,en,Computer Science,
https://openalex.org/W3009430806,Is Refracture a Concern Following Closed Management of Tibia Shaft Fractures in Children?,Cureus,0,https://doi.org/10.7759/cureus.7206,https://api.labs.crossref.org/works/https://doi.org/10.7759/cureus.7206?mailto=christian.hauschke@tib.eu,2020,article,True,0,Epidemiology and Treatment of Bone Fractures,Health Sciences,Epidemiology,"Cureus, Inc.",True,en,Medicine,
https://openalex.org/W3009526442,LINC01093 promotes proliferation and invasion of non-small cell lung cancer cells via targeting akt signaling pathway.,DOAJ (DOAJ: Directory of Open Access Journals),0,https://doi.org/10.26355/eurrev_202001_19914,https://api.labs.crossref.org/works/https://doi.org/10.26355/eurrev_202001_19914?mailto=christian.hauschke@tib.eu,2020,article,True,0,Role of Long Noncoding RNAs in Cancer and Development,Life Sciences,Cancer Research,,False,en,"Biochemistry, Genetics and Molecular Biology",
https://openalex.org/W3009689222,WITHDRAWN: Drought signal in the tree-rings of three conifer species from Northern Pakistan,Dendrochronologia,0,https://doi.org/10.1016/j.dendro.2020.125689,https://api.labs.crossref.org/works/https://doi.org/10.1016/j.dendro.2020.125689?mailto=christian.hauschke@tib.eu,2020,article,True,0,Causes and Impacts of Climate Change Over Millennia,Physical Sciences,Atmospheric Science,Elsevier BV,False,en,Earth and Planetary Sciences,
https://openalex.org/W3009770194,"Withdrawal: Feng, C., Liu, X., Wang, C., Wang, J. and Sun, J. (2020), Characteristics and Changes of Microorganisms in Simulated Pipe Network with Ultraviolet‐Tea Polyphenols Combined Disinfection. Water and Environment Journal. Accepted Author Manuscript. doi:10.1111/wej.12557.",Water and Environment Journal,0,https://doi.org/10.1111/wej.12557,https://api.labs.crossref.org/works/https://doi.org/10.1111/wej.12557?mailto=christian.hauschke@tib.eu,2020,article,True,0,Health Effects of Tea Polyphenols,Health Sciences,Pathology and Forensic Medicine,Wiley-Blackwell,False,en,Medicine,
https://openalex.org/W3010259693,Study on the Waste Information and Statistics Management for Efficient Disposal of Flood Waste,Han-gukbangjaehakoenonmunjip,0,https://doi.org/10.9798/kosham.2020.20.1.93,https://api.labs.crossref.org/works/https://doi.org/10.9798/kosham.2020.20.1.93?mailto=christian.hauschke@tib.eu,2020,article,True,0,Trends in Health Care Research and Practice,Health Sciences,"Public Health, Environmental and Occupational Health",Korean Society of Hazard Mitigation,True,en,Medicine,
https://openalex.org/W3010676584,WITHDRAWN: Cold tolerance in rice plants is partially controlled by root responses,Journal of Plant Physiology,0,https://doi.org/10.1016/j.jplph.2020.153153,https://api.labs.crossref.org/works/https://doi.org/10.1016/j.jplph.2020.153153?mailto=christian.hauschke@tib.eu,2020,article,True,0,Molecular Responses to Abiotic Stress in Plants,Life Sciences,Plant Science,Elsevier BV,True,en,Agricultural and Biological Sciences,
https://openalex.org/W3010751838,Cultural inversion of the concept “social responsibility” on the example of activity of “Saratovneftegaz” branches during the 1950’s – 1980’s,Человек и культура,0,https://doi.org/10.25136/2409-8744.2020.1.31504,https://api.labs.crossref.org/works/https://doi.org/10.25136/2409-8744.2020.1.31504?mailto=christian.hauschke@tib.eu,2020,article,True,0,Arctic Shipping and Governance,Social Sciences,Sociology and Political Science,Aurora Group s.r.o.,True,en,Social Sciences,
https://openalex.org/W3010895816,WITHDRAWN: Doctors in Star Trek: Reflections on the changing faces of future doctors,Early Human Development,0,https://doi.org/10.1016/j.earlhumdev.2020.104987,https://api.labs.crossref.org/works/https://doi.org/10.1016/j.earlhumdev.2020.104987?mailto=christian.hauschke@tib.eu,2020,article,True,0,Psychology of Heroism and Courage,Social Sciences,Social Psychology,Elsevier BV,False,en,Psychology,
https://openalex.org/W3010902240,"Role of microvascular endothelial cells on proliferation, migration and adhesion of hematopoietic stem cells",Bioscience Reports,0,https://doi.org/10.1042/bsr20192104,https://api.labs.crossref.org/works/https://doi.org/10.1042/bsr20192104?mailto=christian.hauschke@tib.eu,2020,article,True,0,Hematopoietic Stem Cell Biology,Health Sciences,Hematology,Portland Press,True,en,Medicine,
https://openalex.org/W3011209969,Modal Analysis and Design of Silicon Nitride Rib Waveguides for Evanescent-wave Bimodal Biosensors : Retraction,Current Optics and Photonics,0,https://doi.org/10.3807/copp.2020.4.1.081,https://api.labs.crossref.org/works/https://doi.org/10.3807/copp.2020.4.1.081?mailto=christian.hauschke@tib.eu,2020,article,True,0,Silicon Photonics Technology,Physical Sciences,Electrical and Electronic Engineering,Optical Society of Korea,False,en,Engineering,
https://openalex.org/W3011231408,shear contribution of basalt fiber reinforced polymers bars(BFRP) reinforced light weight concrete (FRLWC),IOP Conference Series: Materials Science and Engineering,0,https://doi.org/10.1088/1757-899x/740/1/012062,https://api.labs.crossref.org/works/https://doi.org/10.1088/1757-899x/740/1/012062?mailto=christian.hauschke@tib.eu,2020,article,True,0,Fiber Reinforced Concrete in Civil Engineering,Physical Sciences,Civil and Structural Engineering,IOP Publishing,True,en,Engineering,
https://openalex.org/W3011584709,RETRACTED ARTICLE: Crystal structure of a Mn(II)-based complex and application of its nanoparticles for treatment activity on peri-implantitis by reducing inflammatory responses,Inorganic and Nano-Metal Chemistry,0,https://doi.org/10.1080/24701556.2020.1737818,https://api.labs.crossref.org/works/https://doi.org/10.1080/24701556.2020.1737818?mailto=christian.hauschke@tib.eu,2020,article,True,0,Chemistry and Applications of Metal-Organic Frameworks,Physical Sciences,Inorganic Chemistry,Taylor & Francis,False,en,Chemistry,
https://openalex.org/W3011699018,RETRACTED ARTICLE: Frequent mining analysis using pattern mining utility incremental algorithm based on relational query process,Journal of Ambient Intelligence and Humanized Computing,0,https://doi.org/10.1007/s12652-020-01880-9,https://api.labs.crossref.org/works/https://doi.org/10.1007/s12652-020-01880-9?mailto=christian.hauschke@tib.eu,2020,article,True,0,Data Mining Techniques and Applications,Physical Sciences,Information Systems,Springer Science+Business Media,False,en,Computer Science,
https://openalex.org/W3011822933,RETRACTED ARTICLE: Efficient multi-dimensional web information discovery in wireless sensor network,Journal of Ambient Intelligence and Humanized Computing,0,https://doi.org/10.1007/s12652-020-01868-5,https://api.labs.crossref.org/works/https://doi.org/10.1007/s12652-020-01868-5?mailto=christian.hauschke@tib.eu,2020,article,True,0,Trajectory Data Mining and Analysis,Physical Sciences,Signal Processing,Springer Science+Business Media,False,en,Computer Science,
https://openalex.org/W3012240238,RETRACTED ARTICLE: Cu(II)-organic framework for selective CO<sub>2</sub>/N<sub>2</sub> separation and protective effect on hypertensive disorders with pregnancy via reducing the TNF-α and VACM-1 expression in vascular endothelial cells,Journal of Coordination Chemistry,0,https://doi.org/10.1080/00958972.2020.1735002,https://api.labs.crossref.org/works/https://doi.org/10.1080/00958972.2020.1735002?mailto=christian.hauschke@tib.eu,2020,article,True,0,Chemistry and Applications of Metal-Organic Frameworks,Physical Sciences,Inorganic Chemistry,Taylor & Francis,False,en,Chemistry,
https://openalex.org/W3012287218,"Evil doctor, ethical android: Star Trek's instantiation of conscience in subroutines",Early Human Development,0,https://doi.org/10.1016/j.earlhumdev.2020.105018,https://api.labs.crossref.org/works/https://doi.org/10.1016/j.earlhumdev.2020.105018?mailto=christian.hauschke@tib.eu,2020,article,True,0,Ethical Implications of Neuroenhancement Technologies,Life Sciences,Cognitive Neuroscience,Elsevier BV,False,en,Neuroscience,
https://openalex.org/W3012333250,Withdrawn as Duplicate: Competing for Jurisdiction: Practical Legitimation and the Persistence of Informal Recycling in Urban India,Social Cognitive and Affective Neuroscience,0,https://doi.org/10.1093/scan/soz169,https://api.labs.crossref.org/works/https://doi.org/10.1093/scan/soz169?mailto=christian.hauschke@tib.eu,2020,article,True,0,Politics and Poetics of Water Infrastructure,Social Sciences,Political Science and International Relations,University of Oxford,True,en,Social Sciences,
https://openalex.org/W3012353411,Retracted Article: Key technologies of cloud computing-based IoT data mining,International Journal of Computers and Applications,0,https://doi.org/10.1080/1206212x.2020.1738665,https://api.labs.crossref.org/works/https://doi.org/10.1080/1206212x.2020.1738665?mailto=christian.hauschke@tib.eu,2020,article,True,0,Network Intrusion Detection and Defense Mechanisms,Physical Sciences,Computer Networks and Communications,Taylor & Francis,False,en,Computer Science,
https://openalex.org/W3012500409,WITHDRAWN: SKA3 promotes cell growth in breast cancer by inhibiting PLK-1 protein degradation,Acta Histochemica,0,https://doi.org/10.1016/j.acthis.2020.151535,https://api.labs.crossref.org/works/https://doi.org/10.1016/j.acthis.2020.151535?mailto=christian.hauschke@tib.eu,2020,article,True,0,Ubiquitin-Proteasome Proteolytic Pathway,Life Sciences,Molecular Biology,Elsevier BV,False,en,"Biochemistry, Genetics and Molecular Biology",
https://openalex.org/W3012604343,Clinical significance of a new oncogenic factor P5CR1 in gastric cancer.,DOAJ (DOAJ: Directory of Open Access Journals),0,https://doi.org/10.26355/eurrev_202003_20509,https://api.labs.crossref.org/works/https://doi.org/10.26355/eurrev_202003_20509?mailto=christian.hauschke@tib.eu,2020,article,True,0,Engineering Bacteria for Cancer Treatment,Life Sciences,Biotechnology,,False,en,"Biochemistry, Genetics and Molecular Biology",
https://openalex.org/W3012747616,Long non-coding RNA ANCR promotes progression of NSCLC by inhibiting E-Ca expression.,DOAJ (DOAJ: Directory of Open Access Journals),0,https://doi.org/10.26355/eurrev_202002_20178,https://api.labs.crossref.org/works/https://doi.org/10.26355/eurrev_202002_20178?mailto=christian.hauschke@tib.eu,2020,article,True,0,Role of Long Noncoding RNAs in Cancer and Development,Life Sciences,Cancer Research,,False,en,"Biochemistry, Genetics and Molecular Biology",
https://openalex.org/W3012781760,RETRACTED: Contact co-culture of osteoblasts and sympathetic neuronal cells enhances osteoblast differentiation,"Journal of Oral and Maxillofacial Surgery, Medicine, and Pathology",0,https://doi.org/10.1016/j.ajoms.2020.01.004,https://api.labs.crossref.org/works/https://doi.org/10.1016/j.ajoms.2020.01.004?mailto=christian.hauschke@tib.eu,2020,article,True,0,Molecular Mechanisms of Axon Guidance,Life Sciences,Cellular and Molecular Neuroscience,Elsevier BV,False,en,Neuroscience,
https://openalex.org/W3012797207,RETIRADO: Rabdomiólisis tras nefrectomía parcial robótica. Seriede casos y revisión de factores asociados,Actas Urológicas Españolas,0,https://doi.org/10.1016/j.acuro.2020.01.001,https://api.labs.crossref.org/works/https://doi.org/10.1016/j.acuro.2020.01.001?mailto=christian.hauschke@tib.eu,2020,article,True,0,Rhabdomyolysis and Compartment Syndromes,Health Sciences,Surgery,Elsevier BV,False,es,Medicine,
https://openalex.org/W3012963000,RETRACTED: Corrigendum to “Application of the small-angle X-ray scattering technique for structural analysis studies: A review” [J. Mol. Struct. 5 (2018) 391–400],Journal of Molecular Structure,0,https://doi.org/10.1016/j.molstruc.2020.128093,https://api.labs.crossref.org/works/https://doi.org/10.1016/j.molstruc.2020.128093?mailto=christian.hauschke@tib.eu,2020,article,True,0,Powder Diffraction Analysis,Physical Sciences,Materials Chemistry,Elsevier BV,False,en,Materials Science,
https://openalex.org/W3013235017,RETRACTED: Design of Basketball Sports Data Analysis System Based on Cloud Computing,IOP Conference Series: Materials Science and Engineering,0,https://doi.org/10.1088/1757-899x/750/1/012162,https://api.labs.crossref.org/works/https://doi.org/10.1088/1757-899x/750/1/012162?mailto=christian.hauschke@tib.eu,2020,article,True,0,Sports Science and Performance Analysis,Health Sciences,Orthopedics and Sports Medicine,IOP Publishing,True,en,Medicine,
https://openalex.org/W3013468077,Effect of miR-200c on migration and proliferation of breast cancer MDA-MB-231 cells and BT-549 cells and the possible mechanism.,DOAJ (DOAJ: Directory of Open Access Journals),0,https://doi.org/10.26355/eurrev_202001_20053,https://api.labs.crossref.org/works/https://doi.org/10.26355/eurrev_202001_20053?mailto=christian.hauschke@tib.eu,2020,article,True,0,MicroRNA Regulation in Cancer and Development,Life Sciences,Cancer Research,,False,en,"Biochemistry, Genetics and Molecular Biology",
https://openalex.org/W3013479047,RETRACTED: Application of Business Management Based on Computer Technology,IOP Conference Series: Materials Science and Engineering,0,https://doi.org/10.1088/1757-899x/750/1/012016,https://api.labs.crossref.org/works/https://doi.org/10.1088/1757-899x/750/1/012016?mailto=christian.hauschke@tib.eu,2020,article,True,0,Collaborative Networks in Manufacturing and Organizations,Social Sciences,Management of Technology and Innovation,IOP Publishing,True,en,"Business, Management and Accounting",
https://openalex.org/W3013519949,RETRACTED: Song recognition in music library based on cloud computing,IOP Conference Series: Materials Science and Engineering,0,https://doi.org/10.1088/1757-899x/750/1/012167,https://api.labs.crossref.org/works/https://doi.org/10.1088/1757-899x/750/1/012167?mailto=christian.hauschke@tib.eu,2020,article,True,0,Audio Signal Classification and Analysis,Physical Sciences,Signal Processing,IOP Publishing,True,en,Computer Science,
https://openalex.org/W3013753033,RETRACTED: The current situation and development of China’s marketing based on computer network,IOP Conference Series: Materials Science and Engineering,0,https://doi.org/10.1088/1757-899x/750/1/012023,https://api.labs.crossref.org/works/https://doi.org/10.1088/1757-899x/750/1/012023?mailto=christian.hauschke@tib.eu,2020,article,True,0,Drivers and Impediments for Cross-Border E-Commerce,Social Sciences,Business and International Management,IOP Publishing,True,en,"Business, Management and Accounting",
https://openalex.org/W3013812315,RETRACTED CHAPTER: Ethnic Characterization in Amalgamated People for Airport Security Using a Repository of Images and Pigeon-Inspired Optimization (PIO) Algorithm for the Improvement of Their Results,Studies in computational intelligence,0,https://doi.org/10.1007/978-3-030-40977-7_5,https://api.labs.crossref.org/works/https://doi.org/10.1007/978-3-030-40977-7_5?mailto=christian.hauschke@tib.eu,2020,book-chapter,True,0,Face Recognition and Analysis Techniques,Physical Sciences,Computer Vision and Pattern Recognition,Springer Nature,False,en,Computer Science,
https://openalex.org/W3013929619,&lt;p&gt;Medical Students’ Perception of Their Education and Training to Cope with Future Market Trends&lt;/p&gt;,Advances in medical education and practice,0,https://doi.org/10.2147/amep.s233494,https://api.labs.crossref.org/works/https://doi.org/10.2147/amep.s233494?mailto=christian.hauschke@tib.eu,2020,article,True,0,Transformation of Medical Education and Professionalism,Health Sciences,"Public Health, Environmental and Occupational Health",Dove Medical Press,True,en,Medicine,
https://openalex.org/W3014130938,Withdrawn: Dose‐response relationship of <scp> <i>Aloe vera</i> </scp> to cure atopic dermatitis in rats,Dermatologic Therapy,0,https://doi.org/10.1111/dth.13376,https://api.labs.crossref.org/works/https://doi.org/10.1111/dth.13376?mailto=christian.hauschke@tib.eu,2020,article,True,0,Atopic Dermatitis and Skin Microbiome,Health Sciences,Dermatology,Wiley-Blackwell,True,en,Medicine,
https://openalex.org/W3014347717,RETRACTED ARTICLE: Two Co(II) and Ni(II) coordination polymers: crystal structures and inhibitory activity on osteogenic sarcoma cells via inducing apoptosis,Inorganic and Nano-Metal Chemistry,0,https://doi.org/10.1080/24701556.2020.1745833,https://api.labs.crossref.org/works/https://doi.org/10.1080/24701556.2020.1745833?mailto=christian.hauschke@tib.eu,2020,article,True,0,Chemistry and Applications of Metal-Organic Frameworks,Physical Sciences,Inorganic Chemistry,Taylor & Francis,True,en,Chemistry,
https://openalex.org/W3014363494,Shock-absorbing pad protects whales’ jaws when dining,The Journal of Experimental Biology,0,https://doi.org/10.1242/jeb.224642,https://api.labs.crossref.org/works/https://doi.org/10.1242/jeb.224642?mailto=christian.hauschke@tib.eu,2020,article,True,0,Ecology and Conservation of Marine Mammals,Physical Sciences,Ecology,The Company of Biologists,True,en,Environmental Science,
https://openalex.org/W3014610698,RETRACTED ARTICLE: Solvent-directed synthesis of two Cu(II)-based coordination polymers: structural diversity and protective effect on viral myocarditis by reducing inflammatory response in myocardial cells,Inorganic and Nano-Metal Chemistry,0,https://doi.org/10.1080/24701556.2020.1745837,https://api.labs.crossref.org/works/https://doi.org/10.1080/24701556.2020.1745837?mailto=christian.hauschke@tib.eu,2020,article,True,0,Chemistry and Applications of Metal-Organic Frameworks,Physical Sciences,Inorganic Chemistry,Taylor & Francis,False,en,Chemistry,
https://openalex.org/W3014735495,RETRACTED ARTICLE: Attributes of smoking cessation in the Egyptian community: dependence matters,Journal of Public Health,0,https://doi.org/10.1007/s10389-020-01256-5,https://api.labs.crossref.org/works/https://doi.org/10.1007/s10389-020-01256-5?mailto=christian.hauschke@tib.eu,2020,article,True,0,Smoking Cessation and Health Effects of Tobacco,Health Sciences,Physiology,Springer Science+Business Media,False,en,Medicine,
https://openalex.org/W3014780823,WITHDRAWN: Migraine : traitement médicamenteux et non médicamenteux,La Presse Médicale Formation,0,https://doi.org/10.1016/j.lpmfor.2019.12.001,https://api.labs.crossref.org/works/https://doi.org/10.1016/j.lpmfor.2019.12.001?mailto=christian.hauschke@tib.eu,2020,article,True,0,Migraine Pathophysiology and Treatment,Health Sciences,Psychiatry and Mental health,Elsevier BV,False,fr,Medicine,
https://openalex.org/W3014971884,WITHDRAWN: Perspectives thérapeutiques dans la migraine,La Presse Médicale Formation,0,https://doi.org/10.1016/j.lpmfor.2019.12.002,https://api.labs.crossref.org/works/https://doi.org/10.1016/j.lpmfor.2019.12.002?mailto=christian.hauschke@tib.eu,2020,article,True,0,Migraine Pathophysiology and Treatment,Health Sciences,Psychiatry and Mental health,Elsevier BV,False,fr,Medicine,
https://openalex.org/W3015027958,Self-Healing Performance of Protective Coating with Inhibitor Loaded Nanoparticles of Mesoporous Silica on Copper Alloy,IOP Conference Series: Materials Science and Engineering,0,https://doi.org/10.1088/1757-899x/772/1/012024,https://api.labs.crossref.org/works/https://doi.org/10.1088/1757-899x/772/1/012024?mailto=christian.hauschke@tib.eu,2020,article,True,0,Corrosion Inhibitors and Protection Mechanisms,Physical Sciences,Materials Chemistry,IOP Publishing,True,en,Materials Science,
https://openalex.org/W3015217905,RETRACTED ARTICLE: A Study of Otorhinolaryngological Diseases with Ophthalmic Complications: At a Tertiary Care Center,Indian Journal of Otolaryngology and Head & Neck Surgery,0,https://doi.org/10.1007/s12070-020-01849-2,https://api.labs.crossref.org/works/https://doi.org/10.1007/s12070-020-01849-2?mailto=christian.hauschke@tib.eu,2020,article,True,0,Chronic Rhinosinusitis and Nasal Polyps,Health Sciences,Otorhinolaryngology,Springer Nature,True,en,Medicine,
