id,display_name,primary_location_display_name,cited_by_count,doi,crossref_call,publication_year,type,is_retracted,cited_by_percentile_year_min,primary_topic_display_name,primary_topic_domain_display_name,primary_topic_subfield_display_name,primary_location_source_host_organization_name,open_access_is_oa,language,primary_topic_field_display_name,update_nature
https://openalex.org/W1734976794,Notice of Retraction: Research of intranet-based networking and communication systems of the Computer Numerical Control machine tools,,0,https://doi.org/10.1109/icacc.2010.5486902,https://api.labs.crossref.org/works/https://doi.org/10.1109/icacc.2010.5486902?mailto=christian.hauschke@tib.eu,2010,article,True,0,Artificial Intelligence and Expert Systems,Physical Sciences,Artificial Intelligence,,False,en,Computer Science,
https://openalex.org/W1742024949,Notice of Retraction: Design and implementation of traceability information system for agriculture product quality,,0,https://doi.org/10.1109/icacc.2010.5486891,https://api.labs.crossref.org/works/https://doi.org/10.1109/icacc.2010.5486891?mailto=christian.hauschke@tib.eu,2010,article,True,0,Traceability in Food Supply Chain Management,Life Sciences,Food Science,,False,en,Agricultural and Biological Sciences,
https://openalex.org/W1745069408,Notice of Retraction: Combinatorial Optimization Technology Application for the Risk Optimization of Crime Prevention System,,0,https://doi.org/10.1109/etcs.2010.569,https://api.labs.crossref.org/works/https://doi.org/10.1109/etcs.2010.569?mailto=christian.hauschke@tib.eu,2010,article,True,0,Modeling Pedestrian Dynamics and Evacuations,Physical Sciences,Ocean Engineering,,False,en,Engineering,
https://openalex.org/W174729135,The role of signaling pathways in the expansion of corneal epithelial cells in serum-free B27 supplemented medium.,PubMed,0,,https://api.labs.crossref.org/works/null?mailto=christian.hauschke@tib.eu,2010,article,True,0,Corneal Tissue Engineering and Regeneration,Health Sciences,"Radiology, Nuclear Medicine and Imaging",National Institutes of Health,False,en,Medicine,
https://openalex.org/W1748114936,Microstructure of NiTiO3–TiO2 eutectic and its magnetic properties,Research on Chemical Intermediates,0,https://doi.org/10.1007/s11164-010-0190-x,https://api.labs.crossref.org/works/https://doi.org/10.1007/s11164-010-0190-x?mailto=christian.hauschke@tib.eu,2010,article,True,0,Negative Temperature Coefficient Resistance (NTCR) Ceramic Thermistors,Physical Sciences,Electrical and Electronic Engineering,Springer Science+Business Media,True,en,Engineering,
https://openalex.org/W1748291944,Notice of Retraction: Detection of harmonics submerged in heavy and coloured noise based on wavelet packet decomposition,,0,https://doi.org/10.1109/iccsit.2010.5563719,https://api.labs.crossref.org/works/https://doi.org/10.1109/iccsit.2010.5563719?mailto=christian.hauschke@tib.eu,2010,article,True,0,Image Denoising Techniques and Algorithms,Physical Sciences,Computer Vision and Pattern Recognition,,False,en,Computer Science,
https://openalex.org/W1751259641,Notice of Retraction: Study on the hologram forecast of product demand in supply chain,,0,https://doi.org/10.1109/icacc.2010.5487112,https://api.labs.crossref.org/works/https://doi.org/10.1109/icacc.2010.5487112?mailto=christian.hauschke@tib.eu,2010,article,True,0,Models and Dynamics of Technology Diffusion,Social Sciences,Management Science and Operations Research,,False,en,Decision Sciences,
https://openalex.org/W1753953180,Notice of Retraction: Some feelings and ideas about several aspects of the development of computer education in our country,,0,https://doi.org/10.1109/edt.2010.5496358,https://api.labs.crossref.org/works/https://doi.org/10.1109/edt.2010.5496358?mailto=christian.hauschke@tib.eu,2010,article,True,0,Impact of Technology on Education and Training,Physical Sciences,Information Systems,,False,en,Computer Science,
https://openalex.org/W1755034083,Notice of Retraction: Study on the Instructional Process of Cultivating the Undergraduates' Innovative and Practical Ability Instructional Process in E-Commerce English Teaching,,0,https://doi.org/10.1109/etcs.2010.242,https://api.labs.crossref.org/works/https://doi.org/10.1109/etcs.2010.242?mailto=christian.hauschke@tib.eu,2010,article,True,0,Impact of Technology on Education and Training,Physical Sciences,Information Systems,,False,en,Computer Science,
https://openalex.org/W1755665851,Notice of Retraction: Evaluating MBA students satisfaction that using multimedia learning system (MMLS) in the private university Malaysia,,0,https://doi.org/10.1109/iccet.2010.5485914,https://api.labs.crossref.org/works/https://doi.org/10.1109/iccet.2010.5485914?mailto=christian.hauschke@tib.eu,2010,article,True,0,Transformative Potential of Blended Learning in Education,Social Sciences,Education,,False,en,Social Sciences,
https://openalex.org/W1756640974,Notice of Retraction: The Time Effect Research on Heavy Metal Elements Pollution of Urban Industrial Fire Coal,,0,https://doi.org/10.1109/appeec.2010.5448659,https://api.labs.crossref.org/works/https://doi.org/10.1109/appeec.2010.5448659?mailto=christian.hauschke@tib.eu,2010,article,True,0,Geochemistry and Utilization of Coal and Coal Byproducts,Physical Sciences,Geochemistry and Petrology,,False,en,Earth and Planetary Sciences,
https://openalex.org/W1756835109,Notice of Retraction: Evaluation and analysis on competitive power of innovation technology talents in Hebei Province,,0,https://doi.org/10.1109/icmlc.2010.5580869,https://api.labs.crossref.org/works/https://doi.org/10.1109/icmlc.2010.5580869?mailto=christian.hauschke@tib.eu,2010,article,True,0,Knowledge Management and Organizational Innovation,Social Sciences,Strategy and Management,,False,en,"Business, Management and Accounting",
https://openalex.org/W1757305587,Notice of Retraction: Research on Indication System and Appraisal Method of University Sustainable Development,,0,https://doi.org/10.1109/etcs.2010.70,https://api.labs.crossref.org/works/https://doi.org/10.1109/etcs.2010.70?mailto=christian.hauschke@tib.eu,2010,article,True,0,Sustainability Education in Higher Education Institutions,Social Sciences,Education,,False,en,Social Sciences,
https://openalex.org/W1759003066,Notice of Retraction: Improvement Research of Evidence Theory in Mine Water Inrush Prediction,,0,https://doi.org/10.1109/etcs.2010.379,https://api.labs.crossref.org/works/https://doi.org/10.1109/etcs.2010.379?mailto=christian.hauschke@tib.eu,2010,article,True,0,Mining Technology and Safety Measures,Physical Sciences,"Safety, Risk, Reliability and Quality",,False,en,Engineering,
https://openalex.org/W1760259303,Notice of Retraction: The effect of urban residents' income on house prices,,0,https://doi.org/10.1109/iccet.2010.5485562,https://api.labs.crossref.org/works/https://doi.org/10.1109/iccet.2010.5485562?mailto=christian.hauschke@tib.eu,2010,article,True,0,Consequences of Mortgage Credit Expansion and Housing Market Dynamics,Social Sciences,Economics and Econometrics,,False,en,"Economics, Econometrics and Finance",
https://openalex.org/W1764390344,Notice of Retraction: Research on the Methods for Technological Inovation Ability Training of College Students,,0,https://doi.org/10.1109/etcs.2010.278,https://api.labs.crossref.org/works/https://doi.org/10.1109/etcs.2010.278?mailto=christian.hauschke@tib.eu,2010,article,True,0,Meaning and Significance of Work,Social Sciences,Demography,,True,en,Social Sciences,
https://openalex.org/W1764674053,Notice of Retraction: Psychological problems and countermeasures of college students,,0,https://doi.org/10.1109/opee.2010.5508076,https://api.labs.crossref.org/works/https://doi.org/10.1109/opee.2010.5508076?mailto=christian.hauschke@tib.eu,2010,article,True,0,Effects of Emotional Intelligence on Performance and Attitude,Social Sciences,Social Psychology,,False,en,Psychology,
https://openalex.org/W1767608046,Notice of Retraction: Delay-dependent stability criteria for delayed cellular neural networks,,0,https://doi.org/10.1109/cctae.2010.5544350,https://api.labs.crossref.org/works/https://doi.org/10.1109/cctae.2010.5544350?mailto=christian.hauschke@tib.eu,2010,article,True,0,Network Synchronization in Complex Systems,Physical Sciences,Computer Networks and Communications,,False,en,Computer Science,
https://openalex.org/W1769146565,Notice of Retraction: Quantitative analysis of impact of external cost on urban passenger transport structure,,0,https://doi.org/10.1109/icacc.2010.5486663,https://api.labs.crossref.org/works/https://doi.org/10.1109/icacc.2010.5486663?mailto=christian.hauschke@tib.eu,2010,article,True,0,Understanding Attitudes Towards Public Transport and Private Car,Social Sciences,Transportation,,False,en,Social Sciences,
https://openalex.org/W1769693841,Notice of Retraction: Teaching reform of environmental professional-based and research of applied practice,,0,https://doi.org/10.1109/edt.2010.5496397,https://api.labs.crossref.org/works/https://doi.org/10.1109/edt.2010.5496397?mailto=christian.hauschke@tib.eu,2010,article,True,0,Web-Based Global Education and Sustainability,Social Sciences,Education,,False,en,Social Sciences,
https://openalex.org/W1770933012,Notice of Retraction: Analysis of Loss Compensation on Generation Rights Trade by Circuit Theory,,0,https://doi.org/10.1109/appeec.2010.5448295,https://api.labs.crossref.org/works/https://doi.org/10.1109/appeec.2010.5448295?mailto=christian.hauschke@tib.eu,2010,article,True,0,Venture Capital and Start-Up Financing,Social Sciences,Accounting,,False,en,"Business, Management and Accounting",
https://openalex.org/W1771129702,Notice of Retraction: Research on mechanism of capital in the private higher education's development cycle,,0,https://doi.org/10.1109/icetc.2010.5529519,https://api.labs.crossref.org/works/https://doi.org/10.1109/icetc.2010.5529519?mailto=christian.hauschke@tib.eu,2010,article,True,0,Global Trends in Higher Education Internationalization,Social Sciences,Political Science and International Relations,,False,en,Social Sciences,
https://openalex.org/W1774118786,Notice of Retraction: The Effect Of Straw And Coal Combustion On Boiler's Radiative Heat Transfer,,0,https://doi.org/10.1109/appeec.2010.5448415,https://api.labs.crossref.org/works/https://doi.org/10.1109/appeec.2010.5448415?mailto=christian.hauschke@tib.eu,2010,article,True,0,Inverse Radiative Heat Transfer Analysis,Physical Sciences,Computational Mechanics,,False,en,Engineering,
https://openalex.org/W1778459859,Notice of Retraction: The Structure Models and Support Mechanism of Cultivating System for Composite-type Talents in IT Fields,,0,https://doi.org/10.1109/etcs.2010.533,https://api.labs.crossref.org/works/https://doi.org/10.1109/etcs.2010.533?mailto=christian.hauschke@tib.eu,2010,article,True,0,Impact of Technology on Education and Training,Physical Sciences,Information Systems,,False,en,Computer Science,
https://openalex.org/W1779132365,Notice of Retraction: Innovation performance of insurance businesses in China: Theoretical model and empirical analysis,,0,https://doi.org/10.1109/edt.2010.5496525,https://api.labs.crossref.org/works/https://doi.org/10.1109/edt.2010.5496525?mailto=christian.hauschke@tib.eu,2010,article,True,0,Economic Impacts of Insurance Market Dynamics,Social Sciences,Economics and Econometrics,,False,en,"Economics, Econometrics and Finance",
https://openalex.org/W1780232599,Notice of Retraction: The research on parallel rotation transformation algorithm of binary tree based on PRAM model,,0,https://doi.org/10.1109/iccet.2010.5485809,https://api.labs.crossref.org/works/https://doi.org/10.1109/iccet.2010.5485809?mailto=christian.hauschke@tib.eu,2010,article,True,0,Artificial Intelligence and Expert Systems,Physical Sciences,Artificial Intelligence,,False,en,Computer Science,
https://openalex.org/W1785170464,Notice of Retraction: Analysis on the related factors in sports tourism participation of college students,2010 International Conference on Educational and Network Technology,0,https://doi.org/10.1109/icent.2010.5532266,https://api.labs.crossref.org/works/https://doi.org/10.1109/icent.2010.5532266?mailto=christian.hauschke@tib.eu,2010,article,True,0,Evolution and Impacts of Event Tourism,Social Sciences,Sociology and Political Science,,False,en,Social Sciences,
https://openalex.org/W1785798000,Notice of Retraction: Remediation of heavy metals polluted surface water by vermiculite Complex ecosystem filter,,0,https://doi.org/10.1109/esiat.2010.5567225,https://api.labs.crossref.org/works/https://doi.org/10.1109/esiat.2010.5567225?mailto=christian.hauschke@tib.eu,2010,article,True,0,Application of Constructed Wetlands for Wastewater Treatment,Physical Sciences,Industrial and Manufacturing Engineering,,False,en,Environmental Science,
https://openalex.org/W1788428365,Notice of Retraction: Pattern synthesis for antenna arrays using chaotic PSO algorithm,,0,https://doi.org/10.1109/cctae.2010.5543349,https://api.labs.crossref.org/works/https://doi.org/10.1109/cctae.2010.5543349?mailto=christian.hauschke@tib.eu,2010,article,True,0,Optimization Techniques for Antenna Arrays,Physical Sciences,Aerospace Engineering,,False,en,Engineering,
https://openalex.org/W1789968084,Notice of Retraction: The Effects of Formative Evaluation on Students' Self-directed Learning and Language Teaching,,0,https://doi.org/10.1109/etcs.2010.381,https://api.labs.crossref.org/works/https://doi.org/10.1109/etcs.2010.381?mailto=christian.hauschke@tib.eu,2010,article,True,0,Formative Assessment and Feedback in Education,Social Sciences,Education,,False,en,Social Sciences,
https://openalex.org/W1790636789,Notice of Retraction: Study of ideological and political theory teaching based on the cultivation of undergraduate's innovative ability,,0,https://doi.org/10.1109/opee.2010.5508079,https://api.labs.crossref.org/works/https://doi.org/10.1109/opee.2010.5508079?mailto=christian.hauschke@tib.eu,2010,article,True,0,Innovation and Development of Ideological Education,Social Sciences,Education,,False,en,Social Sciences,
https://openalex.org/W1791986866,Notice of Retraction: Pedestrian flow's research of vertical walking facilities in urban rail transit,,0,https://doi.org/10.1109/icams.2010.5552893,https://api.labs.crossref.org/works/https://doi.org/10.1109/icams.2010.5552893?mailto=christian.hauschke@tib.eu,2010,article,True,0,Modeling Pedestrian Dynamics and Evacuations,Physical Sciences,Ocean Engineering,,False,en,Engineering,
https://openalex.org/W1793998284,Notice of Retraction: The Basic Tactics of Constructing the CAFA System,,0,https://doi.org/10.1109/etcs.2010.309,https://api.labs.crossref.org/works/https://doi.org/10.1109/etcs.2010.309?mailto=christian.hauschke@tib.eu,2010,article,True,0,Information Technology Skills and Education,Physical Sciences,Information Systems,,False,en,Computer Science,
https://openalex.org/W1798728411,Notice of Retraction: Spatial difference of industrial land intensive use of Wuhan metropolitan area,,0,https://doi.org/10.1109/esiat.2010.5568376,https://api.labs.crossref.org/works/https://doi.org/10.1109/esiat.2010.5568376?mailto=christian.hauschke@tib.eu,2010,article,True,0,Spatial Shift-Share Analysis in Economic Development,Social Sciences,Economics and Econometrics,,False,en,"Economics, Econometrics and Finance",
https://openalex.org/W1801002057,Notice of Retraction: Simulation heat transmission mechanism of insulation material by finite element method,2010 International Conference on Educational and Network Technology,0,https://doi.org/10.1109/icent.2010.5532192,https://api.labs.crossref.org/works/https://doi.org/10.1109/icent.2010.5532192?mailto=christian.hauschke@tib.eu,2010,article,True,0,Structural Analysis and Design Optimization in Engineering,Physical Sciences,Civil and Structural Engineering,,False,en,Engineering,
https://openalex.org/W1805897150,Notice of Retraction: Research for innovation mechanism of poor college students subsidy management,,0,https://doi.org/10.1109/opee.2010.5507982,https://api.labs.crossref.org/works/https://doi.org/10.1109/opee.2010.5507982?mailto=christian.hauschke@tib.eu,2010,article,True,0,Strategic Management and Innovation in Business,Social Sciences,Strategy and Management,,False,en,"Business, Management and Accounting",
https://openalex.org/W1805917835,Notice of Retraction: The overview On effectiveness evaluation researches,,0,https://doi.org/10.1109/iccet.2010.5485533,https://api.labs.crossref.org/works/https://doi.org/10.1109/iccet.2010.5485533?mailto=christian.hauschke@tib.eu,2010,article,True,0,Knowledge Mapping and Information Architecture,Physical Sciences,Information Systems,,False,en,Computer Science,
https://openalex.org/W1805960721,Notice of Retraction: Study on application of dynamic input-output method in water conservancy project,,0,https://doi.org/10.1109/iccsit.2010.5563821,https://api.labs.crossref.org/works/https://doi.org/10.1109/iccsit.2010.5563821?mailto=christian.hauschke@tib.eu,2010,article,True,0,Ecological Assessment and Urban Development,Physical Sciences,Ecology,,False,en,Environmental Science,
https://openalex.org/W1805971705,Notice of Retraction: The research on the dynamic management mechanisms of product innovation intrapreneurship of SMEs,,0,https://doi.org/10.1109/icams.2010.5553163,https://api.labs.crossref.org/works/https://doi.org/10.1109/icams.2010.5553163?mailto=christian.hauschke@tib.eu,2010,article,True,0,Entrepreneurship and Business Innovation,Social Sciences,Management of Technology and Innovation,,False,en,"Business, Management and Accounting",
https://openalex.org/W1806262275,Notice of Retraction: Analysis of the regional tourism cooperation based on stakeholder theory,,0,https://doi.org/10.1109/edt.2010.5496464,https://api.labs.crossref.org/works/https://doi.org/10.1109/edt.2010.5496464?mailto=christian.hauschke@tib.eu,2010,article,True,0,"Customer Relationships, Behavior, and Loyalty",Social Sciences,Organizational Behavior and Human Resource Management,,False,en,"Business, Management and Accounting",
https://openalex.org/W1806803549,Notice of Retraction: Research on Reform and Practice of Advanced Mathematics Education for Applied University,,0,https://doi.org/10.1109/etcs.2010.632,https://api.labs.crossref.org/works/https://doi.org/10.1109/etcs.2010.632?mailto=christian.hauschke@tib.eu,2010,article,True,0,Impact of Technology on Education and Training,Physical Sciences,Information Systems,,False,en,Computer Science,
https://openalex.org/W1808413244,Notice of Retraction: A measure study on quality improvement of employment of college graduates,,0,https://doi.org/10.1109/opee.2010.5508047,https://api.labs.crossref.org/works/https://doi.org/10.1109/opee.2010.5508047?mailto=christian.hauschke@tib.eu,2010,article,True,0,Meaning and Significance of Work,Social Sciences,Demography,,False,en,Social Sciences,
https://openalex.org/W1809073710,Notice of Retraction: Research on the Course of Computer Networks in Applied Universities,,0,https://doi.org/10.1109/icicci.2010.74,https://api.labs.crossref.org/works/https://doi.org/10.1109/icicci.2010.74?mailto=christian.hauschke@tib.eu,2010,article,True,0,Impact of Technology on Education and Training,Physical Sciences,Information Systems,,False,en,Computer Science,
