id,display_name,primary_location_display_name,cited_by_count,doi,crossref_call,publication_year,type,is_retracted,cited_by_percentile_year_min,primary_topic_display_name,primary_topic_domain_display_name,primary_topic_subfield_display_name,primary_location_source_host_organization_name,open_access_is_oa,language,primary_topic_field_display_name,update_nature
https://openalex.org/W2149707263,"Notice of Retraction: Empirical research on the influence factors of farmers' moral hazard in the production of safe agricultural products — Based on farmers survey from Jiangsu, Jiangxi and Sichuan provinces",,0,https://doi.org/10.1109/icebeg.2011.5882587,https://api.labs.crossref.org/works/https://doi.org/10.1109/icebeg.2011.5882587?mailto=christian.hauschke@tib.eu,2011,article,True,0,Risk Management and Vulnerability in Agriculture,Life Sciences,Soil Science,,False,en,Agricultural and Biological Sciences,Retraction
https://openalex.org/W2149778175,Notice of Retraction: Removing Phosphorus and Nitrogen from Municipal Wastewater Using a Algae Biofilm Reactor,,0,https://doi.org/10.1109/icbbe.2011.5781063,https://api.labs.crossref.org/works/https://doi.org/10.1109/icbbe.2011.5781063?mailto=christian.hauschke@tib.eu,2011,article,True,0,Microbial Nitrogen Cycling in Wastewater Treatment Systems,Physical Sciences,Pollution,,False,en,Environmental Science,Retraction
https://openalex.org/W2150050429,Notice of Retraction: Strategies improving the ability of Informal Learning for Teacher-oriented Students in normal university,,0,https://doi.org/10.1109/icebeg.2011.5887167,https://api.labs.crossref.org/works/https://doi.org/10.1109/icebeg.2011.5887167?mailto=christian.hauschke@tib.eu,2011,article,True,0,Impact of Technology on Education and Training,Physical Sciences,Information Systems,,False,en,Computer Science,Retraction
https://openalex.org/W2150064992,Notice of Retraction: Statistical analysis for waveguide CO<sub>2</sub> laser broadening effect,,0,https://doi.org/10.1109/icsess.2011.5982469,https://api.labs.crossref.org/works/https://doi.org/10.1109/icsess.2011.5982469?mailto=christian.hauschke@tib.eu,2011,article,True,0,Electric Discharge Pumped Lasers,Physical Sciences,Electrical and Electronic Engineering,,False,en,Engineering,Retraction
https://openalex.org/W2150208198,"Notice of Retraction Managers' overconfidence, financing decision-making and company performance",,0,https://doi.org/10.1109/qr2mse.2013.6625972,https://api.labs.crossref.org/works/https://doi.org/10.1109/qr2mse.2013.6625972?mailto=christian.hauschke@tib.eu,2013,article,True,0,Corporate Governance and Financial Performance,Social Sciences,Accounting,,False,en,"Business, Management and Accounting",Retraction
https://openalex.org/W2150668947,Notice of Retraction: The Inhibition of Tupistra chinensis Baker Extracts on Mice H22 Hepatocarcinoma Xenograft,,0,https://doi.org/10.1109/icbbe.2011.5780439,https://api.labs.crossref.org/works/https://doi.org/10.1109/icbbe.2011.5780439?mailto=christian.hauschke@tib.eu,2011,article,True,0,Ethnopharmacological and Phytochemical Properties of Epimedium Genus,Life Sciences,Pharmacology,,False,en,"Pharmacology, Toxicology and Pharmaceutics",Retraction
https://openalex.org/W2150785633,Notice of Retraction: Application of Activated Carbon Fiber in Pulsed Discharge Reactor,,0,https://doi.org/10.1109/icbbe.2011.5781093,https://api.labs.crossref.org/works/https://doi.org/10.1109/icbbe.2011.5781093?mailto=christian.hauschke@tib.eu,2011,article,True,0,Applications of Plasma in Medicine and Biology,Health Sciences,"Radiology, Nuclear Medicine and Imaging",,False,en,Medicine,Retraction
https://openalex.org/W2150874129,RETRACTED,Veterinary Pathology,0,https://doi.org/10.1177/0300985813498782,https://api.labs.crossref.org/works/https://doi.org/10.1177/0300985813498782?mailto=christian.hauschke@tib.eu,2013,article,True,0,Diagnosis and Management of Hyponatremia,Health Sciences,Pulmonary and Respiratory Medicine,SAGE Publishing,False,en,Medicine,Retraction
https://openalex.org/W2151179292,Notice of Retraction: Empirical study on the relationship between financial development and economic growth in China,,0,https://doi.org/10.1109/icebeg.2011.5882353,https://api.labs.crossref.org/works/https://doi.org/10.1109/icebeg.2011.5882353?mailto=christian.hauschke@tib.eu,2011,article,True,0,Importance of Financial Literacy and Retirement Planning,Social Sciences,Accounting,,False,en,"Business, Management and Accounting",Retraction
https://openalex.org/W2151635096,Notice of Retraction: Application of Rexroth hydraulic and pneumatic experiment platform in experiment teaching of hydraulics and pneumatics,,0,https://doi.org/10.1109/icebeg.2011.5881464,https://api.labs.crossref.org/works/https://doi.org/10.1109/icebeg.2011.5881464?mailto=christian.hauschke@tib.eu,2011,article,True,0,Design and Application of Intelligent Monitoring Systems,Physical Sciences,Control and Systems Engineering,,False,en,Engineering,Retraction
https://openalex.org/W2151796963,"Notice of Retraction: Preliminary Studies on Soil Erosion Intensity Grading in Southwest Karst Area, PR China",,0,https://doi.org/10.1109/icbbe.2011.5781455,https://api.labs.crossref.org/works/https://doi.org/10.1109/icbbe.2011.5781455?mailto=christian.hauschke@tib.eu,2011,article,True,0,Hydrological Effects and Water Resource Management in China,Physical Sciences,Water Science and Technology,,False,en,Environmental Science,Retraction
https://openalex.org/W2152439647,Notice of Retraction: Research on the environment of implementing postponement strategy in small and medium enterprises,,0,https://doi.org/10.1109/icebeg.2011.5881582,https://api.labs.crossref.org/works/https://doi.org/10.1109/icebeg.2011.5881582?mailto=christian.hauschke@tib.eu,2011,article,True,0,Mass Customization and Product Modularity,Social Sciences,Management of Technology and Innovation,,False,en,"Business, Management and Accounting",Retraction
https://openalex.org/W2152496149,Notice of Retraction: Evaluation of land use efficiency in Chengdu based on efficacy coefficient method,,0,https://doi.org/10.1109/icebeg.2011.5881325,https://api.labs.crossref.org/works/https://doi.org/10.1109/icebeg.2011.5881325?mailto=christian.hauschke@tib.eu,2011,article,True,0,Applications of Remote Sensing in Geoscience and Agriculture,Physical Sciences,Atmospheric Science,,False,en,Earth and Planetary Sciences,Retraction
https://openalex.org/W2152614641,"Notice of Retraction: Empirical study on relations between capital structure, governance structure and performance of small and medium-sized enterprises: Based on the data from SME board in China",,0,https://doi.org/10.1109/icebeg.2011.5881322,https://api.labs.crossref.org/works/https://doi.org/10.1109/icebeg.2011.5881322?mailto=christian.hauschke@tib.eu,2011,article,True,0,Corporate Governance and Financial Performance,Social Sciences,Accounting,,False,en,"Business, Management and Accounting",Retraction
https://openalex.org/W2152615164,Notice of Retraction The research on the design technology of weapon system of systems,,0,https://doi.org/10.1109/qr2mse.2013.6625794,https://api.labs.crossref.org/works/https://doi.org/10.1109/qr2mse.2013.6625794?mailto=christian.hauschke@tib.eu,2013,article,True,0,Intelligent Control System for Industrial Processes,Physical Sciences,Control and Systems Engineering,,False,en,Engineering,Retraction
https://openalex.org/W2152718575,Notice of Retraction: Design of communication module based on the ARM and VPC3,,0,https://doi.org/10.1109/iceice.2011.5777396,https://api.labs.crossref.org/works/https://doi.org/10.1109/iceice.2011.5777396?mailto=christian.hauschke@tib.eu,2011,article,True,0,Artificial Intelligence and Expert Systems,Physical Sciences,Artificial Intelligence,,False,en,Computer Science,Retraction
https://openalex.org/W2152994100,Notice of Retraction: Analysis on cultural vitality to drive urban landscape theme,,0,https://doi.org/10.1109/icetce.2011.5775223,https://api.labs.crossref.org/works/https://doi.org/10.1109/icetce.2011.5775223?mailto=christian.hauschke@tib.eu,2011,article,True,0,Tourism and its Impact on Communities,Social Sciences,Sociology and Political Science,,False,en,Social Sciences,Retraction
https://openalex.org/W2153270554,"Notice of Retraction: Spatial Distribution and Seasonal Variations of Heavy Metals in Surface Water from Hun River, Northeast China",,0,https://doi.org/10.1109/icbbe.2011.5780855,https://api.labs.crossref.org/works/https://doi.org/10.1109/icbbe.2011.5780855?mailto=christian.hauschke@tib.eu,2011,article,True,0,Toxicology and Environmental Impacts of Mercury Contamination,Physical Sciences,"Health, Toxicology and Mutagenesis",,False,en,Environmental Science,Retraction
https://openalex.org/W2153564848,Notice of Retraction Choosing to defer for coping with emotion-laden decisions,,0,https://doi.org/10.1109/icnc.2011.6022219,https://api.labs.crossref.org/works/https://doi.org/10.1109/icnc.2011.6022219?mailto=christian.hauschke@tib.eu,2011,article,True,0,Behavioral Economics and Decision Making,Social Sciences,General Decision Sciences,,False,en,Decision Sciences,Retraction
https://openalex.org/W2154060048,Notice of Retraction: The general situation of e-government in the tourism industry in China and its development strategy,,0,https://doi.org/10.1109/icebeg.2011.5882050,https://api.labs.crossref.org/works/https://doi.org/10.1109/icebeg.2011.5882050?mailto=christian.hauschke@tib.eu,2011,article,True,0,Impact of Social Media on Consumer Behavior,Social Sciences,Sociology and Political Science,,False,en,Social Sciences,Retraction
https://openalex.org/W2154220437,Notice of Retraction: Factors Affecting Akinete Differentiation in Anabaena flos-aquae,,0,https://doi.org/10.1109/icbbe.2011.5780922,https://api.labs.crossref.org/works/https://doi.org/10.1109/icbbe.2011.5780922?mailto=christian.hauschke@tib.eu,2011,article,True,0,Harmful Algal Blooms and Marine Toxins,Physical Sciences,Environmental Chemistry,,False,en,Environmental Science,Retraction
https://openalex.org/W2154319009,Notice of Retraction: Research on customer knowledge management in network economy,,0,https://doi.org/10.1109/icebeg.2011.5881361,https://api.labs.crossref.org/works/https://doi.org/10.1109/icebeg.2011.5881361?mailto=christian.hauschke@tib.eu,2011,article,True,0,Knowledge Sharing in Virtual Communities,Social Sciences,Communication,,False,en,Social Sciences,Retraction
https://openalex.org/W2154330409,Notice of Retraction: A Growing Model for Biological Networks on Recombination and Divergence Principle,,0,https://doi.org/10.1109/icbbe.2011.5779999,https://api.labs.crossref.org/works/https://doi.org/10.1109/icbbe.2011.5779999?mailto=christian.hauschke@tib.eu,2011,article,True,0,Stochasticity in Gene Regulatory Networks,Life Sciences,Molecular Biology,,False,en,"Biochemistry, Genetics and Molecular Biology",Retraction
https://openalex.org/W2154412661,Notice of Retraction: The stepwise approach in nuclear safety regulation within global sustainable development,,0,https://doi.org/10.1109/icebeg.2011.5881655,https://api.labs.crossref.org/works/https://doi.org/10.1109/icebeg.2011.5881655?mailto=christian.hauschke@tib.eu,2011,article,True,0,Risk Perception and Communication in Society,Social Sciences,Sociology and Political Science,,False,en,Social Sciences,Retraction
https://openalex.org/W2154446456,Notice of Retraction: Computational Modeling of the Antithrombotic Antibody SZ2 in Complex with Glycoprotein Ibalpha,,0,https://doi.org/10.1109/icbbe.2011.5780046,https://api.labs.crossref.org/works/https://doi.org/10.1109/icbbe.2011.5780046?mailto=christian.hauschke@tib.eu,2011,article,True,0,"Therapeutic Antibodies: Development, Engineering, and Applications",Health Sciences,"Radiology, Nuclear Medicine and Imaging",,False,en,Medicine,Retraction
https://openalex.org/W2155108712,Notice of Retraction: The studies on construction of tourism supply chain focusing on network supplier as the core,,0,https://doi.org/10.1109/icebeg.2011.5881887,https://api.labs.crossref.org/works/https://doi.org/10.1109/icebeg.2011.5881887?mailto=christian.hauschke@tib.eu,2011,article,True,0,Developing Evidence-Informed Supply Chain Management Knowledge,Social Sciences,Management Information Systems,,False,en,"Business, Management and Accounting",Retraction
https://openalex.org/W2155766297,Notice of Retraction Clustering analysis on disease severity of wheat stripe rust based on SOM neural network,,0,https://doi.org/10.1109/icnc.2011.6022114,https://api.labs.crossref.org/works/https://doi.org/10.1109/icnc.2011.6022114?mailto=christian.hauschke@tib.eu,2011,article,True,0,Impact and Management of Coastal Reservoir Systems,Physical Sciences,"Management, Monitoring, Policy and Law",,False,en,Environmental Science,Retraction
https://openalex.org/W2156059908,Notice of Retraction: Economic analysis on the coordination development of urbanization,,0,https://doi.org/10.1109/icebeg.2011.5884474,https://api.labs.crossref.org/works/https://doi.org/10.1109/icebeg.2011.5884474?mailto=christian.hauschke@tib.eu,2011,article,True,0,Spatial Shift-Share Analysis in Economic Development,Social Sciences,Economics and Econometrics,,False,en,"Economics, Econometrics and Finance",Retraction
https://openalex.org/W2156096123,"RETRACTED: Ascending aortic diameter and curvature are prognostic for aortic complications after complete supra-aortic vessel transposition and arch endografting: [Interact CardioVasc Thorac Surg 2011 Published on February 7, 2011]",Interactive Cardiovascular and Thoracic Surgery,0,https://doi.org/10.1510/icvts.2010.262329,https://api.labs.crossref.org/works/https://doi.org/10.1510/icvts.2010.262329?mailto=christian.hauschke@tib.eu,2011,article,True,0,Management of Valvular Heart Disease,Health Sciences,Cardiology and Cardiovascular Medicine,Oxford University Press,True,en,Medicine,Retraction
https://openalex.org/W2156797791,Notice of Retraction: Local tax reform: Focusing on division of tax categories,,0,https://doi.org/10.1109/icbmei.2011.5920493,https://api.labs.crossref.org/works/https://doi.org/10.1109/icbmei.2011.5920493?mailto=christian.hauschke@tib.eu,2011,article,True,0,Fiscal Decentralization and Governance in Political Economy,Social Sciences,Political Science and International Relations,,False,en,Social Sciences,Retraction
https://openalex.org/W2156920735,Notice of Retraction: Degradation of Aniline by a Dual-Electrode Oxidation Process in Aqueous Electrolyte,,0,https://doi.org/10.1109/icbbe.2011.5780997,https://api.labs.crossref.org/works/https://doi.org/10.1109/icbbe.2011.5780997?mailto=christian.hauschke@tib.eu,2011,article,True,0,Advanced Oxidation Processes for Water Treatment,Physical Sciences,Water Science and Technology,,False,en,Environmental Science,Retraction
https://openalex.org/W2157042383,Notice of Retraction: An Empirical Analysis on the Determinants' Behavioral Intentions Towards the Recycling of Waste and Used Household Appliances,,0,https://doi.org/10.1109/icbbe.2011.5781492,https://api.labs.crossref.org/works/https://doi.org/10.1109/icbbe.2011.5781492?mailto=christian.hauschke@tib.eu,2011,article,True,0,Solid Waste Management,Physical Sciences,Industrial and Manufacturing Engineering,,False,en,Environmental Science,
https://openalex.org/W2157049730,Notice of Retraction: An empirical study on the impact of listed tourism companies TMT demographic characteristics on institutional investors' stockholding,,0,https://doi.org/10.1109/icsess.2011.5982458,https://api.labs.crossref.org/works/https://doi.org/10.1109/icsess.2011.5982458?mailto=christian.hauschke@tib.eu,2011,article,True,0,Tourism and its Impact on Communities,Social Sciences,Sociology and Political Science,,False,en,Social Sciences,
https://openalex.org/W2157312851,Notice of Retraction: The study of assessment of rural urbanization level in Beijing,,0,https://doi.org/10.1109/icetce.2011.5776402,https://api.labs.crossref.org/works/https://doi.org/10.1109/icetce.2011.5776402?mailto=christian.hauschke@tib.eu,2011,article,True,0,Spatial Shift-Share Analysis in Economic Development,Social Sciences,Economics and Econometrics,,False,en,"Economics, Econometrics and Finance",
https://openalex.org/W2157370266,Notice of Retraction: Identification and Phylogenetic Analysis in Phellinus igniarius and Hypholoma tuberosum Using Internal Transcribed Sequence (ITS) Analysis,,0,https://doi.org/10.1109/icbbe.2011.5780061,https://api.labs.crossref.org/works/https://doi.org/10.1109/icbbe.2011.5780061?mailto=christian.hauschke@tib.eu,2011,article,True,0,Medicinal Mushrooms: Antitumor and Immunomodulating Properties,Health Sciences,Pharmacology,,False,en,Medicine,
https://openalex.org/W2157703299,"Notice of Retraction: Efficiency, Equity and Sustainability of Region Development in China Based on the Water Resources and Water Environment",,0,https://doi.org/10.1109/icbbe.2011.5780880,https://api.labs.crossref.org/works/https://doi.org/10.1109/icbbe.2011.5780880?mailto=christian.hauschke@tib.eu,2011,article,True,0,Hydrological Effects and Water Resource Management in China,Physical Sciences,Water Science and Technology,,False,en,Environmental Science,
https://openalex.org/W2157900924,Efficacy of E-Business ecological chain,,0,https://doi.org/10.1109/aimsec.2011.6010819,https://api.labs.crossref.org/works/https://doi.org/10.1109/aimsec.2011.6010819?mailto=christian.hauschke@tib.eu,2011,article,True,0,Industrial Symbiosis and Eco-Industrial Parks,Physical Sciences,Industrial and Manufacturing Engineering,,False,en,Engineering,
https://openalex.org/W2158031028,Notice of Retraction: Existing condition analysis and strategy research on multimedia courseware making skills of 3-year normal college students,,0,https://doi.org/10.1109/icebeg.2011.5881516,https://api.labs.crossref.org/works/https://doi.org/10.1109/icebeg.2011.5881516?mailto=christian.hauschke@tib.eu,2011,article,True,0,Transformative Potential of Blended Learning in Education,Social Sciences,Education,,False,en,Social Sciences,
https://openalex.org/W2158104681,Notice of Retraction: Effect of Organic Loading on Membrane Fouling in Membrane Bioreactor for Berberine Pharmaceutical Wastewater Treatment,,0,https://doi.org/10.1109/icbbe.2011.5781070,https://api.labs.crossref.org/works/https://doi.org/10.1109/icbbe.2011.5781070?mailto=christian.hauschke@tib.eu,2011,article,True,0,Advancements in Water Purification Technologies,Physical Sciences,Water Science and Technology,,False,en,Environmental Science,
https://openalex.org/W2158136971,<i>Retracted</i>: Correlation of the performance of a PEM fuel cell at different channel geometries,The Canadian Journal of Chemical Engineering,0,https://doi.org/10.1002/cjce.21632,https://api.labs.crossref.org/works/https://doi.org/10.1002/cjce.21632?mailto=christian.hauschke@tib.eu,2011,article,True,0,Fuel Cell Membrane Technology,Physical Sciences,Electrical and Electronic Engineering,Wiley-Blackwell,False,en,Engineering,
https://openalex.org/W2158175597,Notice of Retraction: Assessment of Trace Metal Pollution in Surface Sediments of a Eutrophic Lake,,0,https://doi.org/10.1109/icbbe.2011.5780821,https://api.labs.crossref.org/works/https://doi.org/10.1109/icbbe.2011.5780821?mailto=christian.hauschke@tib.eu,2011,article,True,0,Environmental Impact of Heavy Metal Contamination,Physical Sciences,Pollution,,False,en,Environmental Science,
https://openalex.org/W2159552964,Notice of Retraction: Exploration and Practice of Innovative Education of Experimental Chemistry Teaching in Universities and Colleges,,0,https://doi.org/10.1109/paccs.2011.5990353,https://api.labs.crossref.org/works/https://doi.org/10.1109/paccs.2011.5990353?mailto=christian.hauschke@tib.eu,2011,article,True,0,Meaning and Significance of Work,Social Sciences,Demography,,False,en,Social Sciences,
https://openalex.org/W2159654741,Notice of Retraction: Empirical analysis of China's use of FDI and the relationship between FDI and Foreign Trade,,0,https://doi.org/10.1109/iceice.2011.5777715,https://api.labs.crossref.org/works/https://doi.org/10.1109/iceice.2011.5777715?mailto=christian.hauschke@tib.eu,2011,article,True,0,International Business Strategy in Emerging Economies,Social Sciences,Strategy and Management,,False,en,"Business, Management and Accounting",
https://openalex.org/W2159829621,Notice of Retraction: Two-Compartment SBBR with Alternate Aeration and Fill for Nitrogen Removal,,0,https://doi.org/10.1109/icbbe.2011.5781154,https://api.labs.crossref.org/works/https://doi.org/10.1109/icbbe.2011.5781154?mailto=christian.hauschke@tib.eu,2011,article,True,0,Microbial Nitrogen Cycling in Wastewater Treatment Systems,Physical Sciences,Pollution,,False,en,Environmental Science,
https://openalex.org/W2160280020,Notice of Retraction: Tourism product innovation strategy and protection mechanism,,0,https://doi.org/10.1109/icpim.2011.5983651,https://api.labs.crossref.org/works/https://doi.org/10.1109/icpim.2011.5983651?mailto=christian.hauschke@tib.eu,2011,article,True,0,Motivation and Behavior of Convention Attendees,Social Sciences,Sociology and Political Science,,False,en,Social Sciences,
