id,display_name,primary_location_display_name,cited_by_count,doi,crossref_call,publication_year,type,is_retracted,cited_by_percentile_year_min,primary_topic_display_name,primary_topic_domain_display_name,primary_topic_subfield_display_name,primary_location_source_host_organization_name,open_access_is_oa,language,primary_topic_field_display_name,update_nature
https://openalex.org/W1668528996,Notice of Retraction: Design of Relay Protection Simulation Training System For Hydropower Station,,0,https://doi.org/10.1109/appeec.2010.5448271,https://api.labs.crossref.org/works/https://doi.org/10.1109/appeec.2010.5448271?mailto=christian.hauschke@tib.eu,2010,article,True,0,Ultra High Voltage Transmission Technology in China,Physical Sciences,Electrical and Electronic Engineering,,False,en,Engineering,
https://openalex.org/W1668570042,Notice of Retraction: Prediction of short-term bus routes passage flow based on wavelet analysis,,0,https://doi.org/10.1109/icacc.2010.5487178,https://api.labs.crossref.org/works/https://doi.org/10.1109/icacc.2010.5487178?mailto=christian.hauschke@tib.eu,2010,article,True,0,Traffic Flow Prediction and Forecasting,Physical Sciences,Building and Construction,,False,en,Engineering,
https://openalex.org/W1669913367,Notice of Retraction: Research on difference of logistics cost between China and America based on gray relational analysis,,0,https://doi.org/10.1109/icams.2010.5553288,https://api.labs.crossref.org/works/https://doi.org/10.1109/icams.2010.5553288?mailto=christian.hauschke@tib.eu,2010,article,True,0,Artistic Interpretation and Illusory Representations,Social Sciences,Literature and Literary Theory,,False,en,Arts and Humanities,
https://openalex.org/W1670210489,Notice of Retraction: The study of microcontroller teaching method based on increasing the student's career ability,,0,https://doi.org/10.1109/opee.2010.5508025,https://api.labs.crossref.org/works/https://doi.org/10.1109/opee.2010.5508025?mailto=christian.hauschke@tib.eu,2010,article,True,0,Remote Laboratories in Engineering Education,Physical Sciences,Media Technology,,False,en,Engineering,
https://openalex.org/W1670393512,Notice of Retraction: Effective Using Educational Resource for Improving Teaching,,0,https://doi.org/10.1109/etcs.2010.513,https://api.labs.crossref.org/works/https://doi.org/10.1109/etcs.2010.513?mailto=christian.hauschke@tib.eu,2010,article,True,0,Impact of Technology on Education and Training,Physical Sciences,Information Systems,,False,en,Computer Science,
https://openalex.org/W1670713216,Notice of Retraction: Simulations of suppressive effect of VIV on marine riser with splitter plates,,0,https://doi.org/10.1109/iccsit.2010.5563842,https://api.labs.crossref.org/works/https://doi.org/10.1109/iccsit.2010.5563842?mailto=christian.hauschke@tib.eu,2010,article,True,0,Finite Element Simulation and Experimental Validation of Fretting Wear,Physical Sciences,Mechanics of Materials,,False,en,Engineering,
https://openalex.org/W1672282330,Notice of Retraction: An assessing framework for sustainable development of residential real estate,,0,https://doi.org/10.1109/icams.2010.5553136,https://api.labs.crossref.org/works/https://doi.org/10.1109/icams.2010.5553136?mailto=christian.hauschke@tib.eu,2010,article,True,0,Sustainable Construction and Green Building,Physical Sciences,Building and Construction,,False,en,Engineering,
https://openalex.org/W1673129050,Notice of Retraction: Study on vocational graduate employment measures,,0,https://doi.org/10.1109/opee.2010.5508084,https://api.labs.crossref.org/works/https://doi.org/10.1109/opee.2010.5508084?mailto=christian.hauschke@tib.eu,2010,article,True,0,Impact of Technology on Education and Training,Physical Sciences,Information Systems,,False,en,Computer Science,
https://openalex.org/W1673509169,Notice of Retraction: Preparation of monoclonal antibody against DDA and development of a sensitive ELISA for detection metabolilite of organochlorine pesticide DDT,,0,https://doi.org/10.1109/esiat.2010.5567219,https://api.labs.crossref.org/works/https://doi.org/10.1109/esiat.2010.5567219?mailto=christian.hauschke@tib.eu,2010,article,True,0,Impact of Persistent Organic Pollutants on Environment and Health,Physical Sciences,"Health, Toxicology and Mutagenesis",,False,en,Environmental Science,
https://openalex.org/W1674410808,Notice of Retraction: A improved multi-objective evolutionary algorithm based on Three-way radix quicksort,,0,https://doi.org/10.1109/iccsit.2010.5564021,https://api.labs.crossref.org/works/https://doi.org/10.1109/iccsit.2010.5564021?mailto=christian.hauschke@tib.eu,2010,article,True,0,Multiobjective Optimization in Evolutionary Algorithms,Physical Sciences,Computational Theory and Mathematics,,False,en,Computer Science,
https://openalex.org/W1674585461,Notice of Retraction: The application of multilayer distributed intelligent decision support system to regional economy,,0,https://doi.org/10.1109/iccet.2010.5485727,https://api.labs.crossref.org/works/https://doi.org/10.1109/iccet.2010.5485727?mailto=christian.hauschke@tib.eu,2010,article,True,0,Artificial Intelligence and Expert Systems,Physical Sciences,Artificial Intelligence,,False,en,Computer Science,
https://openalex.org/W1676129204,Notice of Retraction: Analysis of water slowly flowing for improving water quality in landscape water body,,0,https://doi.org/10.1109/esiat.2010.5568392,https://api.labs.crossref.org/works/https://doi.org/10.1109/esiat.2010.5568392?mailto=christian.hauschke@tib.eu,2010,article,True,0,Real-time Water Quality Monitoring and Aquaculture Management,Physical Sciences,Water Science and Technology,,False,en,Environmental Science,
https://openalex.org/W1676283051,Notice of Retraction: On Hilbert's unique and distinctive teaching styles with their implications,,0,https://doi.org/10.1109/opee.2010.5508051,https://api.labs.crossref.org/works/https://doi.org/10.1109/opee.2010.5508051?mailto=christian.hauschke@tib.eu,2010,article,True,0,Learning Styles in Higher Education,Social Sciences,Developmental and Educational Psychology,,False,en,Psychology,
https://openalex.org/W1676422311,Notice of Retraction: Research on building temporal-spatial data warehouse of marine environmental data products,,0,https://doi.org/10.1109/icacc.2010.5487046,https://api.labs.crossref.org/works/https://doi.org/10.1109/icacc.2010.5487046?mailto=christian.hauschke@tib.eu,2010,article,True,0,Artificial Intelligence and Expert Systems,Physical Sciences,Artificial Intelligence,,False,en,Computer Science,
https://openalex.org/W1678674537,Notice of Retraction: Research on consistency of factual theme and organizational strategy based on feature extraction of management text,,0,https://doi.org/10.1109/icams.2010.5553080,https://api.labs.crossref.org/works/https://doi.org/10.1109/icams.2010.5553080?mailto=christian.hauschke@tib.eu,2010,article,True,0,Multi-label Text Classification in Machine Learning,Physical Sciences,Artificial Intelligence,,False,en,Computer Science,
https://openalex.org/W1679434755,Notice of Retraction: Laboratory test for in-depth treatment of leachate by calcium hypochlorite composite chemicals,,0,https://doi.org/10.1109/esiat.2010.5568338,https://api.labs.crossref.org/works/https://doi.org/10.1109/esiat.2010.5568338?mailto=christian.hauschke@tib.eu,2010,article,True,0,Mining Technology and Safety Measures,Physical Sciences,"Safety, Risk, Reliability and Quality",,False,en,Engineering,
https://openalex.org/W1680051641,Notice of Retraction Women-owned SMEs in Malaysia: Problems and challenges,,0,https://doi.org/10.1109/shuser.2012.6268801,https://api.labs.crossref.org/works/https://doi.org/10.1109/shuser.2012.6268801?mailto=christian.hauschke@tib.eu,2012,article,True,0,Entrepreneurship and Business Innovation,Social Sciences,Management of Technology and Innovation,,False,en,"Business, Management and Accounting",
https://openalex.org/W1680424962,Notice of Retraction: The Application of Data Mining in Network Learning,,0,https://doi.org/10.1109/etcs.2010.523,https://api.labs.crossref.org/works/https://doi.org/10.1109/etcs.2010.523?mailto=christian.hauschke@tib.eu,2010,article,True,0,Application of Fuzzy Logic in Educational Assessment,Physical Sciences,Information Systems,,False,en,Computer Science,
https://openalex.org/W1682079411,Notice of Violation of IEEE Publication Principles: The Adaptive MBER Multi-user Detection Algorithm for MIMO MC-CDMA Systems,,0,https://doi.org/10.1109/icece.2010.1381,https://api.labs.crossref.org/works/https://doi.org/10.1109/icece.2010.1381?mailto=christian.hauschke@tib.eu,2010,article,True,0,Multiple-Input Multiple-Output Orthogonal Frequency Division Multiplexing,Physical Sciences,Electrical and Electronic Engineering,,False,en,Engineering,
https://openalex.org/W1682115614,Notice of Retraction: Time-dependent Hurst exponent in financial time series in China financial market,,0,https://doi.org/10.1109/icacc.2010.5486883,https://api.labs.crossref.org/works/https://doi.org/10.1109/icacc.2010.5486883?mailto=christian.hauschke@tib.eu,2010,article,True,0,Econophysics: Complexity in Financial Markets,Social Sciences,Economics and Econometrics,,False,en,"Economics, Econometrics and Finance",
https://openalex.org/W1682486316,Notice of Retraction: The role of free bromine during bromate formation in UV photolysis,,0,https://doi.org/10.1109/esiat.2010.5567467,https://api.labs.crossref.org/works/https://doi.org/10.1109/esiat.2010.5567467?mailto=christian.hauschke@tib.eu,2010,article,True,0,Occurrence and Health Effects of Drinking Water Disinfection By-Products,Physical Sciences,"Health, Toxicology and Mutagenesis",,False,en,Environmental Science,
https://openalex.org/W1683597640,Notice of Retraction: The analysis of diversified teaching methods in fundamental courses in higher education,,0,https://doi.org/10.1109/icetc.2010.5529189,https://api.labs.crossref.org/works/https://doi.org/10.1109/icetc.2010.5529189?mailto=christian.hauschke@tib.eu,2010,article,True,0,Impact of Technology on Education and Training,Physical Sciences,Information Systems,,False,en,Computer Science,
https://openalex.org/W1684087818,Notice of Retraction: Research on a Novel Experimental Teaching and Practice System for the ES Course,,0,https://doi.org/10.1109/etcs.2010.549,https://api.labs.crossref.org/works/https://doi.org/10.1109/etcs.2010.549?mailto=christian.hauschke@tib.eu,2010,article,True,0,Remote Laboratories in Engineering Education,Physical Sciences,Media Technology,,False,en,Engineering,
https://openalex.org/W1684450967,Notice of Retraction: Finite element analysis of foundation pit surport,,0,https://doi.org/10.1109/esiat.2010.5568280,https://api.labs.crossref.org/works/https://doi.org/10.1109/esiat.2010.5568280?mailto=christian.hauschke@tib.eu,2010,article,True,0,Multidisciplinary Engineering Research and Development,Physical Sciences,General Engineering,,False,en,Engineering,
https://openalex.org/W1686830379,Notice of Retraction: An empirical analysis on the factors influencing the issuance scale of Chinese treasure bonds,,0,https://doi.org/10.1109/cctae.2010.5543324,https://api.labs.crossref.org/works/https://doi.org/10.1109/cctae.2010.5543324?mailto=christian.hauschke@tib.eu,2010,article,True,0,Economic Development and Policy Analysis in Emerging Markets,Social Sciences,Economics and Econometrics,,False,en,"Economics, Econometrics and Finance",
https://openalex.org/W1687296086,Notice of Retraction: Problems and solutions on the implementation of HSE management system of construction enterprise,,0,https://doi.org/10.1109/esiat.2010.5568744,https://api.labs.crossref.org/works/https://doi.org/10.1109/esiat.2010.5568744?mailto=christian.hauschke@tib.eu,2010,article,True,0,Enhancing Workplace Safety Culture and Practices,Health Sciences,Radiological and Ultrasound Technology,,False,en,Health Professions,
https://openalex.org/W1688690906,Notice of Retraction: The analysis about environment protection based on environmental economics model,,0,https://doi.org/10.1109/icams.2010.5552864,https://api.labs.crossref.org/works/https://doi.org/10.1109/icams.2010.5552864?mailto=christian.hauschke@tib.eu,2010,article,True,0,Measurement and Evaluation of Sustainable Development,Physical Sciences,"Management, Monitoring, Policy and Law",,False,en,Environmental Science,
https://openalex.org/W1689231295,Notice of Retraction: The working process simulation of human - parachute system,,0,https://doi.org/10.1109/icetc.2010.5529237,https://api.labs.crossref.org/works/https://doi.org/10.1109/icetc.2010.5529237?mailto=christian.hauschke@tib.eu,2010,article,True,0,Airborne Wind Energy Systems and High-Altitude Platforms,Physical Sciences,Aerospace Engineering,,False,en,Engineering,
https://openalex.org/W1690843315,Notice of Retraction: Application research on the evaluation mode of investment risk in highway Bot project,,0,https://doi.org/10.1109/icams.2010.5553034,https://api.labs.crossref.org/works/https://doi.org/10.1109/icams.2010.5553034?mailto=christian.hauschke@tib.eu,2010,article,True,0,Success Factors in Project Management,Social Sciences,Management Science and Operations Research,,False,en,Decision Sciences,
https://openalex.org/W1693866681,Notice of Retraction: The research on assessment and classification of customer value in management consulting firm,,0,https://doi.org/10.1109/cctae.2010.5543422,https://api.labs.crossref.org/works/https://doi.org/10.1109/cctae.2010.5543422?mailto=christian.hauschke@tib.eu,2010,article,True,0,Customer Equity Management and Prediction,Social Sciences,Marketing,,False,en,"Business, Management and Accounting",
https://openalex.org/W1695744085,Notice of Retraction: Practice for training creative ability on graduation project,,0,https://doi.org/10.1109/icetc.2010.5529282,https://api.labs.crossref.org/works/https://doi.org/10.1109/icetc.2010.5529282?mailto=christian.hauschke@tib.eu,2010,article,True,0,Impact of Technology on Education and Training,Physical Sciences,Information Systems,,False,en,Computer Science,
https://openalex.org/W1696490510,Notice of Retraction: CoEditor:An edit system for group cooperative writing,2010 International Conference on Educational and Network Technology,0,https://doi.org/10.1109/icent.2010.5532157,https://api.labs.crossref.org/works/https://doi.org/10.1109/icent.2010.5532157?mailto=christian.hauschke@tib.eu,2010,article,True,0,Usability Evaluation in Human-Computer Interaction,Physical Sciences,Human-Computer Interaction,,False,en,Computer Science,
https://openalex.org/W1697659929,Notice of Retraction: Research on the effect on listening comprehension using Computer Assisted Language Learning,,0,https://doi.org/10.1109/iccet.2010.5485327,https://api.labs.crossref.org/works/https://doi.org/10.1109/iccet.2010.5485327?mailto=christian.hauschke@tib.eu,2010,article,True,0,Language Teaching and Second Language Acquisition,Social Sciences,Language and Linguistics,,False,en,Arts and Humanities,
https://openalex.org/W1697974397,Notice of Retraction: A HPLC with UV detection method for the determination of tetracyclines (TCs) residues in chicken liver,,0,https://doi.org/10.1109/esiat.2010.5568336,https://api.labs.crossref.org/works/https://doi.org/10.1109/esiat.2010.5568336?mailto=christian.hauschke@tib.eu,2010,article,True,0,Green Analytical Chemistry in Pharmaceutical Analysis,Physical Sciences,Analytical Chemistry,,False,en,Chemistry,
https://openalex.org/W1698526591,Notice of Retraction: Research on classification teaching in higher education,,0,https://doi.org/10.1109/opee.2010.5507970,https://api.labs.crossref.org/works/https://doi.org/10.1109/opee.2010.5507970?mailto=christian.hauschke@tib.eu,2010,article,True,0,Application of Fuzzy Logic in Educational Assessment,Physical Sciences,Information Systems,,False,en,Computer Science,
https://openalex.org/W1701907362,Notice of Retraction: Plugging-in disaster and recommendations modeling of energy consumption caused by wasteful recharging modes,,0,https://doi.org/10.1109/iccet.2010.5485640,https://api.labs.crossref.org/works/https://doi.org/10.1109/iccet.2010.5485640?mailto=christian.hauschke@tib.eu,2010,article,True,0,Risk Analysis and Management,Social Sciences,"Statistics, Probability and Uncertainty",,False,en,Decision Sciences,
https://openalex.org/W1706334691,Notice of Retraction: Research on a distributed intelligent framework based on semantics,2010 International Conference on Educational and Network Technology,0,https://doi.org/10.1109/icent.2010.5532275,https://api.labs.crossref.org/works/https://doi.org/10.1109/icent.2010.5532275?mailto=christian.hauschke@tib.eu,2010,article,True,0,Artificial Intelligence and Expert Systems,Physical Sciences,Artificial Intelligence,,False,en,Computer Science,
https://openalex.org/W1706406392,Notice of Retraction: On the k-th mean value of digits summation in base 10,,0,https://doi.org/10.1109/iccsit.2010.5563794,https://api.labs.crossref.org/works/https://doi.org/10.1109/iccsit.2010.5563794?mailto=christian.hauschke@tib.eu,2010,article,True,0,Advancements in Mathematics and Mathematical Physics,Physical Sciences,Mathematical Physics,,False,en,Mathematics,
https://openalex.org/W1710545477,Notice of Retraction: A Study on Management Teaching Model under Network Environment,,0,https://doi.org/10.1109/etcs.2010.327,https://api.labs.crossref.org/works/https://doi.org/10.1109/etcs.2010.327?mailto=christian.hauschke@tib.eu,2010,article,True,0,Transformative Potential of Blended Learning in Education,Social Sciences,Education,,False,en,Social Sciences,
https://openalex.org/W1710647801,Notice of Retraction: Numerical simulation study on the temperature field calculation of solidification process based on cut cell,,0,https://doi.org/10.1109/iccasm.2010.5622662,https://api.labs.crossref.org/works/https://doi.org/10.1109/iccasm.2010.5622662?mailto=christian.hauschke@tib.eu,2010,article,True,0,Lattice Boltzmann Method for Complex Flows,Physical Sciences,Computational Mechanics,,False,en,Engineering,
https://openalex.org/W1714815054,Notice of Retraction: A Fourth Order Iterative Method for Solving Nonlinear Equations,,0,https://doi.org/10.1109/iccsit.2010.5565000,https://api.labs.crossref.org/works/https://doi.org/10.1109/iccsit.2010.5565000?mailto=christian.hauschke@tib.eu,2010,article,True,0,Convergence Analysis of Iterative Methods for Nonlinear Equations,Physical Sciences,Numerical Analysis,,False,en,Mathematics,
https://openalex.org/W1715742207,Notice of Retraction: The Enigma of Howard Gardner's Multiple Intelligences theory in the area of organizational effectiveness,,0,https://doi.org/10.1109/icams.2010.5553304,https://api.labs.crossref.org/works/https://doi.org/10.1109/icams.2010.5553304?mailto=christian.hauschke@tib.eu,2010,article,True,0,Effects of Emotional Intelligence on Performance and Attitude,Social Sciences,Social Psychology,,False,en,Psychology,
https://openalex.org/W1716066038,Notice of Retraction: Application of a new FKG system model in stock market prediction,,0,https://doi.org/10.1109/cctae.2010.5543662,https://api.labs.crossref.org/works/https://doi.org/10.1109/cctae.2010.5543662?mailto=christian.hauschke@tib.eu,2010,article,True,0,Fuzzy Differential Equations and Uncertainty Modeling,Physical Sciences,Statistics and Probability,,False,en,Mathematics,
https://openalex.org/W1716340812,Notice of Retraction: The simulation and forecast of China education-economy system: Econometrics and system dynamics combining model,,0,https://doi.org/10.1109/icetc.2010.5529210,https://api.labs.crossref.org/works/https://doi.org/10.1109/icetc.2010.5529210?mailto=christian.hauschke@tib.eu,2010,article,True,0,Spatial Shift-Share Analysis in Economic Development,Social Sciences,Economics and Econometrics,,False,en,"Economics, Econometrics and Finance",
https://openalex.org/W1716446533,Notice of Retraction: Game theory analysis on collaboration knowledge creation in supply chain,,0,https://doi.org/10.1109/icams.2010.5553066,https://api.labs.crossref.org/works/https://doi.org/10.1109/icams.2010.5553066?mailto=christian.hauschke@tib.eu,2010,article,True,0,Knowledge Management and Organizational Innovation,Social Sciences,Strategy and Management,,False,en,"Business, Management and Accounting",
https://openalex.org/W1718744479,Notice of Retraction: Study on Scientific Research and Teaching Combined Talent Cultivation Mode,,0,https://doi.org/10.1109/etcs.2010.326,https://api.labs.crossref.org/works/https://doi.org/10.1109/etcs.2010.326?mailto=christian.hauschke@tib.eu,2010,article,True,0,Impact of Technology on Education and Training,Physical Sciences,Information Systems,,False,en,Computer Science,
https://openalex.org/W1721953319,Notice of Retraction: A rational discussion on deviated problems between enterprise management teaching and business community in universities,,0,https://doi.org/10.1109/icetc.2010.5529593,https://api.labs.crossref.org/works/https://doi.org/10.1109/icetc.2010.5529593?mailto=christian.hauschke@tib.eu,2010,article,True,0,Innovations in Management Education and Curriculum Development,Social Sciences,Management of Technology and Innovation,,False,en,"Business, Management and Accounting",
https://openalex.org/W1722664370,Notice of Retraction: Maximum likelihood adjustment of the monadic unsymmetrical P-norm distribution,,0,https://doi.org/10.1109/icacc.2010.5487254,https://api.labs.crossref.org/works/https://doi.org/10.1109/icacc.2010.5487254?mailto=christian.hauschke@tib.eu,2010,article,True,0,Detection and Handling of Multicollinearity in Regression Analysis,Physical Sciences,Statistics and Probability,,False,en,Mathematics,
https://openalex.org/W1724132086,Notice of Retraction: University Degree Program Self-evaluation System Design and Implementation,,0,https://doi.org/10.1109/etcs.2010.618,https://api.labs.crossref.org/works/https://doi.org/10.1109/etcs.2010.618?mailto=christian.hauschke@tib.eu,2010,article,True,0,Application of Fuzzy Logic in Educational Assessment,Physical Sciences,Information Systems,,False,en,Computer Science,
https://openalex.org/W1725226231,Notice of Retraction: Study of the Reform on the Subject of Mathematical Software,,0,https://doi.org/10.1109/etcs.2010.490,https://api.labs.crossref.org/works/https://doi.org/10.1109/etcs.2010.490?mailto=christian.hauschke@tib.eu,2010,article,True,0,Spatial Data Mining and Cloud Model Applications,Physical Sciences,Information Systems,,False,en,Computer Science,
https://openalex.org/W1725230809,Notice of Retraction: Pilot-scale research on nitrogen removal by sequencing batch biofilm reactor for the pig slurry,,0,https://doi.org/10.1109/esiat.2010.5568932,https://api.labs.crossref.org/works/https://doi.org/10.1109/esiat.2010.5568932?mailto=christian.hauschke@tib.eu,2010,article,True,0,Microbial Nitrogen Cycling in Wastewater Treatment Systems,Physical Sciences,Pollution,,False,en,Environmental Science,
https://openalex.org/W1729992581,Notice of Retraction: Exploration on management model and operating mechanism of multi-campus university in China,2010 International Conference on Educational and Network Technology,0,https://doi.org/10.1109/icent.2010.5532094,https://api.labs.crossref.org/works/https://doi.org/10.1109/icent.2010.5532094?mailto=christian.hauschke@tib.eu,2010,article,True,0,Impact of Technology on Education and Training,Physical Sciences,Information Systems,,False,en,Computer Science,
https://openalex.org/W1730338308,Notice of Retraction: Teaching Research and Practice of Computer Network,,0,https://doi.org/10.1109/etcs.2010.372,https://api.labs.crossref.org/works/https://doi.org/10.1109/etcs.2010.372?mailto=christian.hauschke@tib.eu,2010,article,True,0,Impact of Technology on Education and Training,Physical Sciences,Information Systems,,False,en,Computer Science,
https://openalex.org/W173091509,RETRACTED ARTICLE: Effect of Short Duration Simulated Microgravity on Effectiveness of Local Anesthesia,Microgravity Science and Technology,0,https://doi.org/10.1007/s12217-013-9347-8,https://api.labs.crossref.org/works/https://doi.org/10.1007/s12217-013-9347-8?mailto=christian.hauschke@tib.eu,2012,article,True,0,Dental Anxiety and Anesthetic Management in Dentistry,Health Sciences,Oral Surgery,Springer Science+Business Media,True,en,Dentistry,
https://openalex.org/W1731683875,Notice of Retraction: Improving adaboost ear detection with skin-color model and multi-template matching,,0,https://doi.org/10.1109/iccsit.2010.5564431,https://api.labs.crossref.org/works/https://doi.org/10.1109/iccsit.2010.5564431?mailto=christian.hauschke@tib.eu,2010,article,True,0,Biometric Recognition and Security Systems,Physical Sciences,Signal Processing,,False,en,Computer Science,
https://openalex.org/W1733654089,Notice of Retraction: The analysis of psychological contract on knowledge collaboration in R&amp;D team,,0,https://doi.org/10.1109/icams.2010.5553065,https://api.labs.crossref.org/works/https://doi.org/10.1109/icams.2010.5553065?mailto=christian.hauschke@tib.eu,2010,article,True,0,Knowledge Management and Organizational Innovation,Social Sciences,Strategy and Management,,False,en,"Business, Management and Accounting",
https://openalex.org/W1734368799,Notice of Retraction: Statistical properties of return and volatility in Chinese metal futures market,,0,https://doi.org/10.1109/icams.2010.5553033,https://api.labs.crossref.org/works/https://doi.org/10.1109/icams.2010.5553033?mailto=christian.hauschke@tib.eu,2010,article,True,0,Econophysics: Complexity in Financial Markets,Social Sciences,Economics and Econometrics,,False,en,"Economics, Econometrics and Finance",
