id,display_name,primary_location_display_name,cited_by_count,doi,crossref_call,publication_year,type,is_retracted,cited_by_percentile_year_min,primary_topic_display_name,primary_topic_domain_display_name,primary_topic_subfield_display_name,primary_location_source_host_organization_name,open_access_is_oa,language,primary_topic_field_display_name,update_nature
https://openalex.org/W2126026928,Activation of hypoxia-inducible factor 1 in human T-cell leukaemia virus type 1-infected cell lines and primary adult T-cell leukaemia cells,Biochemical Journal,42,https://doi.org/10.1042/bj20070286,https://api.labs.crossref.org/works/https://doi.org/10.1042/bj20070286?mailto=christian.hauschke@tib.eu,2007,article,True,93,Human T-cell Leukemia Virus Type 1 Infection,Life Sciences,Immunology,Portland Press,True,en,Immunology and Microbiology,Retraction
https://openalex.org/W4237745087,Diuretics for heart failure,Cochrane Database of Systematic Reviews,42,https://doi.org/10.1002/14651858.cd003838.pub2,https://api.labs.crossref.org/works/https://doi.org/10.1002/14651858.cd003838.pub2?mailto=christian.hauschke@tib.eu,2006,reference-entry,True,93,Diagnosis and Treatment of Heart Failure,Health Sciences,Cardiology and Cardiovascular Medicine,Cochrane,False,en,Medicine,Retraction
https://openalex.org/W4251789729,Immunosuppressant and immunomodulatory treatment for dermatomyositis and polymyositis,Cochrane Database of Systematic Reviews,42,https://doi.org/10.1002/14651858.cd003643.pub2,https://api.labs.crossref.org/works/https://doi.org/10.1002/14651858.cd003643.pub2?mailto=christian.hauschke@tib.eu,2005,reference-entry,True,93,"Epidemiology, Classification, and Clinical Features of Inflammatory Myopathies",Health Sciences,Epidemiology,Cochrane,False,en,Medicine,Retraction
https://openalex.org/W1567444480,"A mos oncogene-containing retrovirus, myeloproliferative sarcoma virus, transforms rat thyroid epithelial cells and irreversibly blocks their differentiation pattern",Journal of Virology,41,https://doi.org/10.1128/jvi.56.1.284-292.1985,https://api.labs.crossref.org/works/https://doi.org/10.1128/jvi.56.1.284-292.1985?mailto=christian.hauschke@tib.eu,1985,article,True,93,Recombinant Protein Production in Mammalian and Insect Cells,Life Sciences,Molecular Biology,American Society for Microbiology,True,en,"Biochemistry, Genetics and Molecular Biology",Retraction
https://openalex.org/W1583827678,RETRACTED: Redox regulation of 7-ketocholesterol-induced apoptosis by β-carotene in human macrophages,Free Radical Biology and Medicine,41,https://doi.org/10.1016/j.freeradbiomed.2007.02.023,https://api.labs.crossref.org/works/https://doi.org/10.1016/j.freeradbiomed.2007.02.023?mailto=christian.hauschke@tib.eu,2007,article,True,93,Cholesterol Metabolism and Atherosclerosis,Health Sciences,Surgery,Elsevier BV,True,en,Medicine,Retraction
https://openalex.org/W1643419429,Suppression of Discoidin Domain Receptor 1 by RNA Interference Attenuates Lung Inflammation,Journal of Immunology,41,https://doi.org/10.4049/jimmunol.176.3.1928,https://api.labs.crossref.org/works/https://doi.org/10.4049/jimmunol.176.3.1928?mailto=christian.hauschke@tib.eu,2006,article,True,93,Integrin Signaling in Inflammation and Cancer,Health Sciences,Immunology and Allergy,American Association of Immunologists,True,en,Medicine,Retraction
https://openalex.org/W1969996841,RETRACTED: Mechanical properties and corrosion resistance of low-alloy steels in atmospheric conditions containing chloride,Materials Science and Engineering: A,41,https://doi.org/10.1016/j.msea.2005.02.064,https://api.labs.crossref.org/works/https://doi.org/10.1016/j.msea.2005.02.064?mailto=christian.hauschke@tib.eu,2005,article,True,93,Corrosion Inhibitors and Protection Mechanisms,Physical Sciences,Materials Chemistry,Elsevier BV,True,en,Materials Science,Retraction
https://openalex.org/W2000674727,Removal of <i>E. coli</i> from Water Using Surface-Modified Activated Carbon Filter Media and Its Performance over an Extended Use,Environmental Science & Technology,41,https://doi.org/10.1021/es060708z,https://api.labs.crossref.org/works/https://doi.org/10.1021/es060708z?mailto=christian.hauschke@tib.eu,2006,article,True,93,Advancements in Water Purification Technologies,Physical Sciences,Water Science and Technology,American Chemical Society,False,en,Environmental Science,Retraction
https://openalex.org/W2043344265,The Biological Basis of Cross-Cultural Differences in Personality: Blood Group Antigens,Psychological Reports,41,https://doi.org/10.2466/pr0.1982.51.2.531,https://api.labs.crossref.org/works/https://doi.org/10.2466/pr0.1982.51.2.531?mailto=christian.hauschke@tib.eu,1982,article,True,93,Effects of Stress on Brain Function and Health,Life Sciences,Behavioral Neuroscience,SAGE Publishing,False,en,Neuroscience,Expression of concern
https://openalex.org/W2079577949,WITHDRAWN: Direct electrochemistry and electrocatalysis of myoglobin on redox-active self-assembling monolayers derived from nitroaniline modified electrode,Biosensors and Bioelectronics,41,https://doi.org/10.1016/j.bios.2007.01.003,https://api.labs.crossref.org/works/https://doi.org/10.1016/j.bios.2007.01.003?mailto=christian.hauschke@tib.eu,2007,article,True,93,Electrochemical Biosensor Technology,Physical Sciences,Electrical and Electronic Engineering,Elsevier BV,True,en,Engineering,Retraction
https://openalex.org/W2082225623,Role of DNA Methyltransferases in Regulation of Human Ribosomal RNA Gene Transcription,Journal of Biological Chemistry,41,https://doi.org/10.1074/jbc.m601155200,https://api.labs.crossref.org/works/https://doi.org/10.1074/jbc.m601155200?mailto=christian.hauschke@tib.eu,2006,article,True,93,Epigenetic Modifications and Their Functional Implications,Life Sciences,Molecular Biology,Elsevier BV,True,en,"Biochemistry, Genetics and Molecular Biology",Retraction
https://openalex.org/W2125019813,Chemotherapy for metastatic carcinoma of the esophagus and gastro-esophageal junction,Cochrane Database of Systematic Reviews,41,https://doi.org/10.1002/14651858.cd004063.pub2,https://api.labs.crossref.org/works/https://doi.org/10.1002/14651858.cd004063.pub2?mailto=christian.hauschke@tib.eu,2006,reference-entry,True,93,Preoperative Chemoradiotherapy for Esophageal Cancer,Health Sciences,Surgery,Cochrane,False,en,Medicine,Retraction
https://openalex.org/W2129571192,"Total Syntheses of Hexacyclinol, 5‐<i>epi</i>‐Hexacyclinol, and Desoxohexacyclinol Unveil an Antimalarial Prodrug Motif",Angewandte Chemie International Edition,41,https://doi.org/10.1002/anie.200504033,https://api.labs.crossref.org/works/https://doi.org/10.1002/anie.200504033?mailto=christian.hauschke@tib.eu,2006,article,True,93,Biochemical Studies of Annonaceae Family Plants,Life Sciences,Biochemistry,Wiley,False,en,"Biochemistry, Genetics and Molecular Biology",Retraction
https://openalex.org/W2132902242,"No pain, no gain: The conditions under which upward comparisons lead to better performance.",Journal of Personality and Social Psychology,41,https://doi.org/10.1037/0022-3514.92.6.1051,https://api.labs.crossref.org/works/https://doi.org/10.1037/0022-3514.92.6.1051?mailto=christian.hauschke@tib.eu,2007,article,True,93,Theories of Behavior Change and Self-Regulation,Social Sciences,Applied Psychology,American Psychological Association,False,en,Psychology,Retraction
https://openalex.org/W2163374595,RETRACTION: Flavopiridol and Histone Deacetylase Inhibitors Promote Mitochondrial Injury and Cell Death in Human Leukemia Cells That Overexpress Bcl-2,Molecular Pharmacology,41,https://doi.org/10.1124/mol.105.016154,https://api.labs.crossref.org/works/https://doi.org/10.1124/mol.105.016154?mailto=christian.hauschke@tib.eu,2005,article,True,93,Role of Histone Deacetylases in Cellular Regulation,Life Sciences,Molecular Biology,American Society for Pharmacology and Experimental Therapeutics,False,en,"Biochemistry, Genetics and Molecular Biology",Retraction
https://openalex.org/W51762177,Interferon-gamma: biologic functions and HCV therapy (type I/II) (1 of 2 parts).,PubMed,41,,https://api.labs.crossref.org/works/null?mailto=christian.hauschke@tib.eu,2006,article,True,93,Systemic Lupus Erythematosus and Antiphospholipid Syndrome,Health Sciences,Rheumatology,National Institutes of Health,False,en,Medicine,
https://openalex.org/W1974099967,Length of Survival and Lymphocyte Percentage in Women with Mammary Cancer as a Function of Psychotherapy,Psychological Reports,40,https://doi.org/10.2466/pr0.1989.65.1.315,https://api.labs.crossref.org/works/https://doi.org/10.2466/pr0.1989.65.1.315?mailto=christian.hauschke@tib.eu,1989,article,True,93,Cancer Survivorship and Quality of Life,Health Sciences,Oncology,SAGE Publishing,False,en,Medicine,Retraction
https://openalex.org/W1990931110,Ischemic Preconditioning Triggers Nuclear Translocation of Thioredoxin and Its Interaction with Ref-1 Potentiating a Survival Signal Through the PI-3-Kinase-Akt Pathway,Antioxidants & Redox Signaling,40,https://doi.org/10.1089/ars.2006.8.2101,https://api.labs.crossref.org/works/https://doi.org/10.1089/ars.2006.8.2101?mailto=christian.hauschke@tib.eu,2006,article,True,93,Redox Signaling and Oxidative Stress,Life Sciences,Molecular Biology,"Mary Ann Liebert, Inc.",False,en,"Biochemistry, Genetics and Molecular Biology",Retraction
https://openalex.org/W2001136427,Nurses’ perceived and actual level of diabetes mellitus knowledge: results of a cluster analysis,Journal of Clinical Nursing,40,https://doi.org/10.1111/j.1365-2702.2006.01761.x,https://api.labs.crossref.org/works/https://doi.org/10.1111/j.1365-2702.2006.01761.x?mailto=christian.hauschke@tib.eu,2007,article,True,93,Self-Management of Diabetes in Adults,Health Sciences,"Endocrinology, Diabetes and Metabolism",Wiley-Blackwell,False,en,Medicine,Correction
https://openalex.org/W2026286254,Androgen activates PEG10 to promote carcinogenesis in hepatic cancer cells,Oncogene,40,https://doi.org/10.1038/sj.onc.1210362,https://api.labs.crossref.org/works/https://doi.org/10.1038/sj.onc.1210362?mailto=christian.hauschke@tib.eu,2007,article,True,93,Ubiquitin-Proteasome Proteolytic Pathway,Life Sciences,Molecular Biology,Springer Nature,False,en,"Biochemistry, Genetics and Molecular Biology",Retraction
https://openalex.org/W2104296618,Conjugate vaccines for preventing Haemophilus influenzae type B infections,Cochrane Database of Systematic Reviews,40,https://doi.org/10.1002/14651858.cd001729.pub2,https://api.labs.crossref.org/works/https://doi.org/10.1002/14651858.cd001729.pub2?mailto=christian.hauschke@tib.eu,2007,reference-entry,True,93,Influenza Virus Research and Epidemiology,Health Sciences,Epidemiology,Cochrane,False,en,Medicine,Retraction
https://openalex.org/W2143381759,RETRACTED: Fractals and superstructures in gadolinia thin film morphology: Influence of process variables on their characteristic parameters,Thin Solid Films,40,https://doi.org/10.1016/j.tsf.2005.11.107,https://api.labs.crossref.org/works/https://doi.org/10.1016/j.tsf.2005.11.107?mailto=christian.hauschke@tib.eu,2006,article,True,93,Characterization of Surface Roughness in Optical Components,Physical Sciences,Computational Mechanics,Elsevier BV,True,en,Engineering,Retraction
https://openalex.org/W2150441292,Orphan Receptor Small Heterodimer Partner Is an Important Mediator of Glucose Homeostasis,Molecular Endocrinology,40,https://doi.org/10.1210/me.2006-0224,https://api.labs.crossref.org/works/https://doi.org/10.1210/me.2006-0224?mailto=christian.hauschke@tib.eu,2006,article,True,93,Pancreatic Islet Dysfunction and Regeneration,Health Sciences,Surgery,Oxford University Press,True,en,Medicine,Retraction
https://openalex.org/W2166078777,Evaluating the Analgesic Efficacy of Administering Celecoxib as a Component of Multimodal Analgesia for Outpatient Anterior Cruciate Ligament Reconstruction Surgery: Retracted,Anesthesia & Analgesia,40,https://doi.org/10.1213/01.ane.0000265440.98491.e2,https://api.labs.crossref.org/works/https://doi.org/10.1213/01.ane.0000265440.98491.e2?mailto=christian.hauschke@tib.eu,2007,article,True,93,Cyclooxygenase-2 Inhibitors in Inflammation and Cancer,Health Sciences,Pharmacology,Lippincott Williams & Wilkins,True,en,Medicine,Retraction
https://openalex.org/W1966347073,Short dysfunctional telomeres impair the repair of arsenite-induced oxidative damage in mouse cells,Journal of Cellular Physiology,39,https://doi.org/10.1002/jcp.21276,https://api.labs.crossref.org/works/https://doi.org/10.1002/jcp.21276?mailto=christian.hauschke@tib.eu,2007,article,True,93,Cellular Senescence and Aging-Related Diseases,Health Sciences,Physiology,Wiley,False,en,Medicine,Correction
https://openalex.org/W1983702935,RETRACTED ARTICLE: Induction of apoptosis by <i>d</i>-limonene is mediated by a caspase-dependent mitochondrial death pathway in human leukemia cells,Leukemia & Lymphoma,39,https://doi.org/10.1080/00268970600909205,https://api.labs.crossref.org/works/https://doi.org/10.1080/00268970600909205?mailto=christian.hauschke@tib.eu,2006,article,True,93,Lipid Metabolism and Storage in Organisms,Life Sciences,Biochemistry,Taylor & Francis,False,en,"Biochemistry, Genetics and Molecular Biology",Retraction
https://openalex.org/W1985485013,THE FUTURE OF THERAPEUTIC MYOCARDIAL ANGIOGENESIS,Shock,39,https://doi.org/10.1097/01.shk.0000225318.08681.a7,https://api.labs.crossref.org/works/https://doi.org/10.1097/01.shk.0000225318.08681.a7?mailto=christian.hauschke@tib.eu,2006,article,True,93,Molecular Mechanisms of Angiogenesis and Vascular Function,Life Sciences,Molecular Biology,Lippincott Williams & Wilkins,True,en,"Biochemistry, Genetics and Molecular Biology",Retraction
https://openalex.org/W1989732481,Origin of the obliquities of the giant planets in mutual interactions in the early Solar System,Nature,39,https://doi.org/10.1038/nature04577,https://api.labs.crossref.org/works/https://doi.org/10.1038/nature04577?mailto=christian.hauschke@tib.eu,2006,article,True,93,Formation and Evolution of the Solar System,Physical Sciences,Astronomy and Astrophysics,Nature Portfolio,False,en,Physics and Astronomy,Retraction
https://openalex.org/W2000382925,"Is Albumin Administration in Hypoalbuminemic Elderly Cardiac Surgery Patients of Benefit with Regard to Inflammation, Endothelial Activation, and Long-Term Kidney Function?: Retracted",Anesthesia & Analgesia,39,https://doi.org/10.1213/ane.0b013e31818370b2,https://api.labs.crossref.org/works/https://doi.org/10.1213/ane.0b013e31818370b2?mailto=christian.hauschke@tib.eu,2008,article,True,93,Fluid Resuscitation in Trauma and Critical Care,Health Sciences,Critical Care and Intensive Care Medicine,Lippincott Williams & Wilkins,True,en,Medicine,Retraction
https://openalex.org/W2028503090,RETRACTED ARTICLE: Targeting EGFR in bladder cancer,World Journal of Urology,39,https://doi.org/10.1007/s00345-007-0202-7,https://api.labs.crossref.org/works/https://doi.org/10.1007/s00345-007-0202-7?mailto=christian.hauschke@tib.eu,2007,article,True,93,Advancements in Lung Cancer Research,Health Sciences,Pulmonary and Respiratory Medicine,Springer Science+Business Media,False,en,Medicine,Retraction
https://openalex.org/W2048000567,Role for NMDA receptors in visceral nociceptive transmission in the anterior cingulate cortex of viscerally hypersensitive rats,American Journal of Physiology-gastrointestinal and Liver Physiology,39,https://doi.org/10.1152/ajpgi.00452.2007,https://api.labs.crossref.org/works/https://doi.org/10.1152/ajpgi.00452.2007?mailto=christian.hauschke@tib.eu,2008,article,True,93,Mechanisms and Management of Neuropathic Pain,Health Sciences,Physiology,American Physiological Society,False,en,Medicine,Retraction
https://openalex.org/W2056128967,RETRACTED: II. The balanced concept of fluid resuscitation,British Journal of Anaesthesia,39,https://doi.org/10.1093/bja/aem219,https://api.labs.crossref.org/works/https://doi.org/10.1093/bja/aem219?mailto=christian.hauschke@tib.eu,2007,article,True,93,Metabolic Acidosis in Chronic Kidney Disease,Health Sciences,Nephrology,Elsevier BV,True,en,Medicine,Retraction
https://openalex.org/W2063119987,Association of Metabolic Syndrome with White Blood Cell Subtype and Red Blood Cells,Endocrine Journal,39,https://doi.org/10.1507/endocrj.53.133,https://api.labs.crossref.org/works/https://doi.org/10.1507/endocrj.53.133?mailto=christian.hauschke@tib.eu,2006,article,True,93,Inflammation and Obesity-Related Metabolic Disorders,Health Sciences,Epidemiology,Japan Endocrine Society,True,en,Medicine,Retraction
https://openalex.org/W2079262558,<i>Retracted:</i>It's all in the timing: measuring emotional reactions to stereotype threat before and after taking a test,European Journal of Social Psychology,39,https://doi.org/10.1002/ejsp.310,https://api.labs.crossref.org/works/https://doi.org/10.1002/ejsp.310?mailto=christian.hauschke@tib.eu,2006,article,True,93,Intergroup Relations and Social Identity Theories,Social Sciences,Sociology and Political Science,Wiley-Blackwell,True,en,Social Sciences,Retraction
https://openalex.org/W2084821079,A precise termination site in the mouse beta major-globin transcription unit.,Proceedings of the National Academy of Sciences of the United States of America,39,https://doi.org/10.1073/pnas.80.15.4694,https://api.labs.crossref.org/works/https://doi.org/10.1073/pnas.80.15.4694?mailto=christian.hauschke@tib.eu,1983,article,True,93,Polyomavirus-Associated Carcinogenesis and Clinical Manifestations,Health Sciences,Oncology,National Academy of Sciences,True,en,Medicine,Retraction
https://openalex.org/W3122188469,Consequences of Belonging to the “Clean Plate Club”,Archives of pediatrics & adolescent medicine,39,https://doi.org/10.1001/archpedi.162.10.994,https://api.labs.crossref.org/works/https://doi.org/10.1001/archpedi.162.10.994?mailto=christian.hauschke@tib.eu,2008,article,True,93,School Absenteeism and Social Withdrawal Behavior,Social Sciences,Education,American Medical Association,False,en,Social Sciences,Retraction;Expression of concern
https://openalex.org/W1926085594,"THIS ARTICLE HAS BEEN RETRACTED: Growth and proximate composition of the Chaetoceros calcitrans f. pumilus under different temperature, salinity and carbon dioxide levels",Aquaculture Research,38,https://doi.org/10.1111/j.1365-2109.2008.01964.x,https://api.labs.crossref.org/works/https://doi.org/10.1111/j.1365-2109.2008.01964.x?mailto=christian.hauschke@tib.eu,2008,article,True,93,Microalgae as a Source for Biofuels Production,Physical Sciences,"Renewable Energy, Sustainability and the Environment",Wiley-Blackwell,False,en,Energy,Retraction
https://openalex.org/W1968083559,REMOVED: False aneurysm of the facial artery as complication of sagittal split osteotomy,Journal of Cranio-Maxillofacial Surgery,38,https://doi.org/10.1016/j.jcms.2007.08.002,https://api.labs.crossref.org/works/https://doi.org/10.1016/j.jcms.2007.08.002?mailto=christian.hauschke@tib.eu,2008,article,True,93,Relapsing Polychondritis and VEXAS Syndrome Research,Health Sciences,Rheumatology,Elsevier BV,True,en,Medicine,Retraction
https://openalex.org/W1976160299,Akt Attenuation of the Serine Protease Activity of HtrA2/Omi through Phosphorylation of Serine 212,Journal of Biological Chemistry,38,https://doi.org/10.1074/jbc.m700445200,https://api.labs.crossref.org/works/https://doi.org/10.1074/jbc.m700445200?mailto=christian.hauschke@tib.eu,2007,article,True,93,Ubiquitin-Proteasome Proteolytic Pathway,Life Sciences,Molecular Biology,Elsevier BV,True,en,"Biochemistry, Genetics and Molecular Biology",Retraction
https://openalex.org/W2005897516,Role of Intergenic Sequences in Newcastle Disease Virus RNA Transcription and Pathogenesis,Journal of Virology,38,https://doi.org/10.1128/jvi.01989-07,https://api.labs.crossref.org/works/https://doi.org/10.1128/jvi.01989-07?mailto=christian.hauschke@tib.eu,2008,article,True,93,Paramyxovirus Infections and Epidemiology,Health Sciences,Epidemiology,American Society for Microbiology,True,en,Medicine,Correction
https://openalex.org/W2012770242,Structural basis for nucleotide exchange on Gα <sub>i</sub> subunits and receptor coupling specificity,Proceedings of the National Academy of Sciences of the United States of America,38,https://doi.org/10.1073/pnas.0608599104,https://api.labs.crossref.org/works/https://doi.org/10.1073/pnas.0608599104?mailto=christian.hauschke@tib.eu,2007,article,True,93,Structure and Function of G Protein-Coupled Receptors,Life Sciences,Molecular Biology,National Academy of Sciences,True,en,"Biochemistry, Genetics and Molecular Biology",Retraction
https://openalex.org/W2018519788,RETRACTED: Induction of ovulation in idiopathic premature ovarian failure: a randomized double-blind trial,Reproductive Biomedicine Online,38,https://doi.org/10.1016/s1472-6483(10)60711-0,https://api.labs.crossref.org/works/https://doi.org/10.1016/s1472-6483(10)60711-0?mailto=christian.hauschke@tib.eu,2007,article,True,93,Developmental Origins of Adult Health and Disease,Health Sciences,"Pediatrics, Perinatology and Child Health",Elsevier BV,False,en,Medicine,Retraction;Crossmark Retraction
https://openalex.org/W2018767655,Leptin Induces CD40 Expression through the Activation of Akt in Murine Dendritic Cells,Journal of Biological Chemistry,38,https://doi.org/10.1074/jbc.m704579200,https://api.labs.crossref.org/works/https://doi.org/10.1074/jbc.m704579200?mailto=christian.hauschke@tib.eu,2007,article,True,93,Neuroendocrine Regulation of Appetite and Body Weight,Life Sciences,Endocrine and Autonomic Systems,Elsevier BV,True,en,Neuroscience,Retraction;Crossmark Retraction
https://openalex.org/W2090820425,Identification of calcium-modulating cyclophilin ligand as a human host restriction to HIV-1 release overcome by Vpu,Nature Medicine,38,https://doi.org/10.1038/nm1778,https://api.labs.crossref.org/works/https://doi.org/10.1038/nm1778?mailto=christian.hauschke@tib.eu,2008,article,True,93,Human Immunodeficiency Virus/Acquired Immunodeficiency Syndrome,Life Sciences,Virology,Nature Portfolio,True,en,Immunology and Microbiology,Retraction
https://openalex.org/W2407644352,Symptomatic Relief Following Carpal Tunnel Decompression With Normal Electroneuromyographic Studies,Orthopedics,38,https://doi.org/10.3928/0147-7447-19870301-06,https://api.labs.crossref.org/works/https://doi.org/10.3928/0147-7447-19870301-06?mailto=christian.hauschke@tib.eu,1987,article,True,93,Diagnosis and Management of Carpal Tunnel Syndrome,Health Sciences,"Radiology, Nuclear Medicine and Imaging",Slack Incorporated (United States),False,en,Medicine,Retraction
https://openalex.org/W4211005281,Psychosocial interventions for recurrent abdominal pain (RAP) and irritable bowel syndrome (IBS) in childhood,Cochrane Database of Systematic Reviews,38,https://doi.org/10.1002/14651858.cd003014.pub2,https://api.labs.crossref.org/works/https://doi.org/10.1002/14651858.cd003014.pub2?mailto=christian.hauschke@tib.eu,2008,reference-entry,True,93,Pediatric Pain Assessment and Management,Health Sciences,"Pediatrics, Perinatology and Child Health",Cochrane,False,en,Medicine,Retraction
https://openalex.org/W1969134630,"RETRACTED ARTICLE: Inhibitory Effects of Arresten on bFGF-Induced Proliferation, Migration, and Matrix Metalloproteinase-2 Activation in Mouse Retinal Endothelial Cells",Current Eye Research,37,https://doi.org/10.3109/02713680903374208,https://api.labs.crossref.org/works/https://doi.org/10.3109/02713680903374208?mailto=christian.hauschke@tib.eu,2009,article,True,93,Role of Matrix Metalloproteinases in Cancer and Physiology,Life Sciences,Cancer Research,Taylor & Francis,True,en,"Biochemistry, Genetics and Molecular Biology",Retraction
https://openalex.org/W1971850234,Prolactin induces release of a factor from membranes capable of stimulating β-casein gene transcription in isolated mammary cell nuclei,Proceedings of the National Academy of Sciences of the United States of America,37,https://doi.org/10.1073/pnas.78.11.6729,https://api.labs.crossref.org/works/https://doi.org/10.1073/pnas.78.11.6729?mailto=christian.hauschke@tib.eu,1981,article,True,93,Protein Metabolism in Exercise and Nutrition,Life Sciences,Cell Biology,National Academy of Sciences,True,en,"Biochemistry, Genetics and Molecular Biology",Retraction
