id,display_name,primary_location_display_name,cited_by_count,doi,crossref_call,publication_year,type,is_retracted,cited_by_percentile_year_min,primary_topic_display_name,primary_topic_domain_display_name,primary_topic_subfield_display_name,primary_location_source_host_organization_name,open_access_is_oa,language,primary_topic_field_display_name,update_nature
https://openalex.org/W2903779477,RETRACTED ARTICLE: Women’s Narratives of Marital and Divorce Issues and Impact on their Health,Journal of Religion & Health,1,https://doi.org/10.1007/s10943-018-00741-2,https://api.labs.crossref.org/works/https://doi.org/10.1007/s10943-018-00741-2?mailto=christian.hauschke@tib.eu,2018,article,True,68,Qualitative Research Methods and Ethics,Social Sciences,Sociology and Political Science,Springer Science+Business Media,True,en,Social Sciences,Retraction;Crossmark Retraction
https://openalex.org/W2903847719,Write a Scientific Paper (WASP) — What can I publish [1]? Types of studies,Early Human Development,1,https://doi.org/10.1016/j.earlhumdev.2018.12.003,https://api.labs.crossref.org/works/https://doi.org/10.1016/j.earlhumdev.2018.12.003?mailto=christian.hauschke@tib.eu,2019,article,True,68,Scientific Writing and Publication Practices,Social Sciences,History and Philosophy of Science,Elsevier BV,False,en,Arts and Humanities,Expression of concern
https://openalex.org/W2903871220,Increasing Students’ Self-Efficacy Through Realistic Mathematics Education in Inclusion Classroom,Journal of Physics: Conference Series,1,https://doi.org/10.1088/1742-6596/1114/1/012111,https://api.labs.crossref.org/works/https://doi.org/10.1088/1742-6596/1114/1/012111?mailto=christian.hauschke@tib.eu,2018,article,True,68,Improving Mathematical Literacy and Problem-Solving Skills,Physical Sciences,Applied Mathematics,IOP Publishing,True,en,Mathematics,Retraction
https://openalex.org/W2904021065,Trainee editorial: psychiatry should be taught from day one in medical school<sup>‡</sup>,Nordic Journal of Psychiatry,1,https://doi.org/10.1080/08039488.2018.1525646,https://api.labs.crossref.org/works/https://doi.org/10.1080/08039488.2018.1525646?mailto=christian.hauschke@tib.eu,2018,article,True,68,Contribution of Primary Care to Health Systems and Health,Health Sciences,General Health Professions,Taylor & Francis,True,en,Health Professions,Retraction
https://openalex.org/W2904205455,Concept of Analysis and Implementation of Burst On Mikrotik Router,Journal of Physics: Conference Series,1,https://doi.org/10.1088/1742-6596/1114/1/012071,https://api.labs.crossref.org/works/https://doi.org/10.1088/1742-6596/1114/1/012071?mailto=christian.hauschke@tib.eu,2018,article,True,68,Low Power Wide Area Network Technologies,Physical Sciences,Electrical and Electronic Engineering,IOP Publishing,True,en,Engineering,Retraction
https://openalex.org/W2904247273,Online Media as a Movie Reference,Journal of Physics: Conference Series,1,https://doi.org/10.1088/1742-6596/1114/1/012087,https://api.labs.crossref.org/works/https://doi.org/10.1088/1742-6596/1114/1/012087?mailto=christian.hauschke@tib.eu,2018,article,True,68,Digital Storytelling in Education and Health Promotion,Health Sciences,Speech and Hearing,IOP Publishing,True,en,Health Professions,Retraction
https://openalex.org/W2904551439,RETRACTED ARTICLE: Vergleich von sublingualer und intravenöser Gabe von Lorazepam bei psychiatrischen Notfällen im Notarztdienst,Anaesthesist,1,https://doi.org/10.1007/s00101-018-0513-7,https://api.labs.crossref.org/works/https://doi.org/10.1007/s00101-018-0513-7?mailto=christian.hauschke@tib.eu,2018,article,True,68,Assessment of Decisional Capacity in Psychiatry,Social Sciences,Clinical Psychology,Springer Science+Business Media,False,en,Psychology,Retraction
https://openalex.org/W2904732483,Efforts to Overcome Cyber Crime Actions in Indonesia,Journal of Physics: Conference Series,1,https://doi.org/10.1088/1742-6596/1114/1/012081,https://api.labs.crossref.org/works/https://doi.org/10.1088/1742-6596/1114/1/012081?mailto=christian.hauschke@tib.eu,2018,article,True,68,Cybercrime and Dark Web Activities,Physical Sciences,Information Systems,IOP Publishing,True,en,Computer Science,Retraction
https://openalex.org/W2904831070,Optimization of ISP Service Maintenance Router Using Dijkstra and Flyod-Warshall Algorithm,Journal of Physics: Conference Series,1,https://doi.org/10.1088/1742-6596/1114/1/012101,https://api.labs.crossref.org/works/https://doi.org/10.1088/1742-6596/1114/1/012101?mailto=christian.hauschke@tib.eu,2018,article,True,68,Design and Control of Warehouse Operations,Physical Sciences,Industrial and Manufacturing Engineering,IOP Publishing,True,en,Engineering,Retraction
https://openalex.org/W2905065778,RETRACTED ARTICLE: Equestrian injuries presenting to a regional trauma centre in Ireland,Irish Journal of Medical Science (1971 -),1,https://doi.org/10.1007/s11845-018-1952-5,https://api.labs.crossref.org/works/https://doi.org/10.1007/s11845-018-1952-5?mailto=christian.hauschke@tib.eu,2018,article,True,68,Management of Rib Fractures in Trauma Patients,Health Sciences,Surgery,Springer Science+Business Media,True,en,Medicine,Retraction;Crossmark Retraction
https://openalex.org/W2905098265,The Position Of Hindu Women In Information Technology Era As A Strategic Issues And Epistemological Equivalents of Cultural Studies,Journal of Physics: Conference Series,1,https://doi.org/10.1088/1742-6596/1114/1/012084,https://api.labs.crossref.org/works/https://doi.org/10.1088/1742-6596/1114/1/012084?mailto=christian.hauschke@tib.eu,2018,article,True,68,Citizenship Education and Social Development,Social Sciences,Education,IOP Publishing,True,en,Social Sciences,Retraction
https://openalex.org/W2905137140,Electronic Model for Election of Governor of Student Executive Board (BEM) with Radio Frequency Identification (RFID) Reading on Student Identity Card,Journal of Physics: Conference Series,1,https://doi.org/10.1088/1742-6596/1114/1/012098,https://api.labs.crossref.org/works/https://doi.org/10.1088/1742-6596/1114/1/012098?mailto=christian.hauschke@tib.eu,2018,article,True,68,Information Retrieval and Data Mining Techniques,Physical Sciences,Information Systems,IOP Publishing,True,en,Computer Science,Retraction
https://openalex.org/W2905139428,Retracted: Transforming Growth Factor Beta‐1 Promotes Smooth Muscle Cell Proliferation and Migration in an Arteriovenous Fistulae: The Role of Wall Shear Stress,Therapeutic Apheresis and Dialysis,1,https://doi.org/10.1111/1744-9987.12781,https://api.labs.crossref.org/works/https://doi.org/10.1111/1744-9987.12781?mailto=christian.hauschke@tib.eu,2019,article,True,68,Management of Vascular Malformations in the Brain,Health Sciences,Neurology,Wiley-Blackwell,False,en,Medicine,Retraction
https://openalex.org/W2905526692,Combination Analytical Hierarchy Process and Multy Factor Evaluation Process For Determining Promotion of Position,Journal of Physics: Conference Series,1,https://doi.org/10.1088/1742-6596/1114/1/012079,https://api.labs.crossref.org/works/https://doi.org/10.1088/1742-6596/1114/1/012079?mailto=christian.hauschke@tib.eu,2018,article,True,68,Principles of Production Management and Operations,Social Sciences,Strategy and Management,IOP Publishing,True,en,"Business, Management and Accounting",Retraction
https://openalex.org/W2905573473,"Retraction: Validated analytical modelling of frequency-based aspects, eccentricity and stress concentration in diesel engines with flexible crankshaft",AIMS energy,1,https://doi.org/10.3934/energy.2018.6.1050,https://api.labs.crossref.org/works/https://doi.org/10.3934/energy.2018.6.1050?mailto=christian.hauschke@tib.eu,2018,article,True,68,Failure Analysis in Mechanical Components,Physical Sciences,Mechanical Engineering,AIMS Press,True,en,Engineering,Retraction
https://openalex.org/W2905632621,RETRACTED: Pyrophosphate modulates plant stress responses via SUMOylation,eLife,1,https://doi.org/10.7554/elife.44213,https://api.labs.crossref.org/works/https://doi.org/10.7554/elife.44213?mailto=christian.hauschke@tib.eu,2019,article,True,68,Role of Lipoic Acid in Metabolism and Health,Life Sciences,Biochemistry,eLife Sciences Publications Ltd,True,en,"Biochemistry, Genetics and Molecular Biology",Retraction
https://openalex.org/W2905691233,Laboratory research of wettability and heterogeneity effect on microscopic residual oil distribution in tight sandstone cores during CO<sub>2</sub> flooding,IOP Conference Series: Earth and Environmental Science,1,https://doi.org/10.1088/1755-1315/208/1/012065,https://api.labs.crossref.org/works/https://doi.org/10.1088/1755-1315/208/1/012065?mailto=christian.hauschke@tib.eu,2018,article,True,68,Carbon Dioxide Sequestration in Geological Formations,Physical Sciences,Environmental Engineering,IOP Publishing,True,en,Environmental Science,Retraction
https://openalex.org/W2905783610,The Palgrave international handbook of women and outdoor learning,Environmental Education Research,1,https://doi.org/10.1080/13504622.2018.1545157,https://api.labs.crossref.org/works/https://doi.org/10.1080/13504622.2018.1545157?mailto=christian.hauschke@tib.eu,2018,article,True,68,Experiential Education and Adventure Therapy,Social Sciences,Social Psychology,Taylor & Francis,False,en,Psychology,Retraction
https://openalex.org/W2906222783,Thomson backscattering in combined uniform magnetic and envelope modulating circularly polarized laser fields,Journal of The Optical Society of America B-optical Physics,1,https://doi.org/10.1364/josab.36.001835,https://api.labs.crossref.org/works/https://doi.org/10.1364/josab.36.001835?mailto=christian.hauschke@tib.eu,2019,article,True,68,Laser-Plasma Interactions and Particle Acceleration,Physical Sciences,Nuclear and High Energy Physics,Optica Publishing Group,True,en,Physics and Astronomy,Retraction
https://openalex.org/W2906267980,Write a Scientific Paper (WASP): Interdisciplinarity as it may become – As visualized in science fiction,Early Human Development,1,https://doi.org/10.1016/j.earlhumdev.2018.12.009,https://api.labs.crossref.org/works/https://doi.org/10.1016/j.earlhumdev.2018.12.009?mailto=christian.hauschke@tib.eu,2019,article,True,68,Interdisciplinary Research and Collaboration,Social Sciences,Information Systems and Management,Elsevier BV,False,en,Decision Sciences,Expression of concern
https://openalex.org/W2906722799,Retraction of “Enhanced Activity for CO Preferential Oxidation via the CeO2–LaCoO3 Interaction”,Industrial & Engineering Chemistry Research,1,https://doi.org/10.1021/acs.iecr.8b05727,https://api.labs.crossref.org/works/https://doi.org/10.1021/acs.iecr.8b05727?mailto=christian.hauschke@tib.eu,2019,article,True,68,Catalytic Nanomaterials,Physical Sciences,Materials Chemistry,American Chemical Society,True,en,Materials Science,Retraction
https://openalex.org/W2907174906,WITHDRAWN: Note on the usage of grad-div stabilization for the penalty-projection algorithm in magnetohydrodynamics,Applied Mathematics and Computation,1,https://doi.org/10.1016/j.amc.2018.12.028,https://api.labs.crossref.org/works/https://doi.org/10.1016/j.amc.2018.12.028?mailto=christian.hauschke@tib.eu,2019,article,True,68,Finite Element Methods for Fluid-Structure Interaction,Physical Sciences,Computational Mechanics,Elsevier BV,False,en,Engineering,Retraction
https://openalex.org/W2907379967,RETRACTED: The effect of commodity promotion strategy based on psychological distance theory on consumer's purchase behavior intention,International Journal of Electrical Engineering Education,1,https://doi.org/10.1177/0020720918813819,https://api.labs.crossref.org/works/https://doi.org/10.1177/0020720918813819?mailto=christian.hauschke@tib.eu,2018,article,True,68,Economic Analysis of Retail and Marketing Strategies,Social Sciences,Marketing,SAGE Publishing,False,en,"Business, Management and Accounting",Retraction
https://openalex.org/W2908360998,RETRACTED ARTICLE: Mode-competition phenomena among longitudinal modes in semiconductor lasers under the effect of external optical feedback,Applied Physics B,1,https://doi.org/10.1007/s00340-018-7088-5,https://api.labs.crossref.org/works/https://doi.org/10.1007/s00340-018-7088-5?mailto=christian.hauschke@tib.eu,2018,article,True,68,Optical Interconnect Technologies,Physical Sciences,Electrical and Electronic Engineering,Springer Science+Business Media,False,en,Engineering,Retraction;Crossmark Retraction
https://openalex.org/W2908705777,RETRACTED ARTICLE: Mine accident prediction and analysis based on multimedia big data,Multimedia Tools and Applications,1,https://doi.org/10.1007/s11042-019-7175-6,https://api.labs.crossref.org/works/https://doi.org/10.1007/s11042-019-7175-6?mailto=christian.hauschke@tib.eu,2019,article,True,68,Internet of Things and Big Data Applications,Physical Sciences,Information Systems,Springer Science+Business Media,False,en,Computer Science,Retraction;Crossmark Retraction
https://openalex.org/W2909359697,RETRACTED: Exendin-4 prevented pancreatic beta cells from apoptosis in (Type I) diabetic mouse via keap1-Nrf2 signaling,Experimental Biology and Medicine,1,https://doi.org/10.1177/1535370218823549,https://api.labs.crossref.org/works/https://doi.org/10.1177/1535370218823549?mailto=christian.hauschke@tib.eu,2019,article,True,68,Role of Nrf2 Signaling in Oxidative Stress Response,Life Sciences,Molecular Biology,SAGE Publishing,True,en,"Biochemistry, Genetics and Molecular Biology",Retraction
https://openalex.org/W2910062622,RETRACTED ARTICLE: Existence of positive weak solutions for a new class of Kirchhoff elliptic systems with multiple parameters,Boletín de la Sociedad Matemática Mexicana,1,https://doi.org/10.1007/s40590-018-00231-1,https://api.labs.crossref.org/works/https://doi.org/10.1007/s40590-018-00231-1?mailto=christian.hauschke@tib.eu,2019,article,True,68,Fractional Laplacian Operators,Physical Sciences,Applied Mathematics,Birkhäuser,False,en,Mathematics,Retraction;Crossmark Retraction
https://openalex.org/W2910099773,"Two new olefin-Cu(I) coordination polymers based on 2,5-dimethyl piperazine: Synthesis, crystal structure and fluorescent property",Inorganic and Nano-Metal Chemistry,1,https://doi.org/10.1080/24701556.2018.1554684,https://api.labs.crossref.org/works/https://doi.org/10.1080/24701556.2018.1554684?mailto=christian.hauschke@tib.eu,2018,article,True,68,Chemistry and Applications of Metal-Organic Frameworks,Physical Sciences,Inorganic Chemistry,Taylor & Francis,False,en,Chemistry,
https://openalex.org/W2910419957,A study on the development of an autonomous electrical safety management service using an IoT-based smart outlet,International Journal of Electrical Engineering Education,1,https://doi.org/10.1177/0020720918822753,https://api.labs.crossref.org/works/https://doi.org/10.1177/0020720918822753?mailto=christian.hauschke@tib.eu,2019,article,True,68,Structural Analysis and Design Optimization in Engineering,Physical Sciences,Civil and Structural Engineering,SAGE Publishing,False,en,Engineering,Retraction
https://openalex.org/W2910426893,RETRACTED: Hydroxyfasudil alleviates demyelination through the inhibition of MOG antibody and microglia activation in cuprizone mouse model,Clinical Immunology,1,https://doi.org/10.1016/j.clim.2019.01.006,https://api.labs.crossref.org/works/https://doi.org/10.1016/j.clim.2019.01.006?mailto=christian.hauschke@tib.eu,2019,article,True,68,Adult Neurogenesis and Brain Development,Life Sciences,Developmental Neuroscience,Elsevier BV,False,en,Neuroscience,Retraction;Crossmark Retraction
https://openalex.org/W2910604841,RETRACTED ARTICLE: Design of an efficient and complete elicitation decision process in contingent valuation method,Cogent mathematics & statistics,1,https://doi.org/10.1080/25742558.2018.1564164,https://api.labs.crossref.org/works/https://doi.org/10.1080/25742558.2018.1564164?mailto=christian.hauschke@tib.eu,2019,article,True,68,Discrete Choice Models in Economics and Health Care,Social Sciences,Economics and Econometrics,Taylor & Francis,True,en,"Economics, Econometrics and Finance",Retraction
https://openalex.org/W2911204118,RETRACTED ARTICLE: Business service network node optimization and resource integration based on the construction of logistics information systems,Information Systems and e-Business Management,1,https://doi.org/10.1007/s10257-018-00393-5,https://api.labs.crossref.org/works/https://doi.org/10.1007/s10257-018-00393-5?mailto=christian.hauschke@tib.eu,2019,article,True,68,Impact of Big Data Analytics on Business Performance,Social Sciences,Management Information Systems,Springer Science+Business Media,False,en,"Business, Management and Accounting",Retraction
https://openalex.org/W2911249037,RETRACTED ARTICLE: Research on organizational information absorption based on the perspective of multimedia knowledge management,Multimedia Tools and Applications,1,https://doi.org/10.1007/s11042-019-7296-y,https://api.labs.crossref.org/works/https://doi.org/10.1007/s11042-019-7296-y?mailto=christian.hauschke@tib.eu,2019,article,True,68,Knowledge Sharing in Virtual Communities,Social Sciences,Communication,Springer Science+Business Media,False,en,Social Sciences,Retraction;Crossmark Retraction
https://openalex.org/W2911327286,A Review of Feature Extraction Technologies for Plankton Images,,1,https://doi.org/10.1145/3292425.3293462,https://api.labs.crossref.org/works/https://doi.org/10.1145/3292425.3293462?mailto=christian.hauschke@tib.eu,2018,article,True,68,Advanced Techniques in Bioimage Analysis and Microscopy,Life Sciences,Biophysics,,False,en,"Biochemistry, Genetics and Molecular Biology",Retraction
https://openalex.org/W2911586882,The Application of Wavelet Analysis in Image Processing,,1,https://doi.org/10.1145/3292425.3292434,https://api.labs.crossref.org/works/https://doi.org/10.1145/3292425.3292434?mailto=christian.hauschke@tib.eu,2018,article,True,68,Image Denoising Techniques and Algorithms,Physical Sciences,Computer Vision and Pattern Recognition,,False,en,Computer Science,Retraction
https://openalex.org/W2911662455,RETRACTED ARTICLE: Research on closed-loop supply chain coordination control model based on difference equation load model,Journal of Difference Equations and Applications,1,https://doi.org/10.1080/10236198.2019.1570172,https://api.labs.crossref.org/works/https://doi.org/10.1080/10236198.2019.1570172?mailto=christian.hauschke@tib.eu,2019,article,True,68,Conceptualizing the Circular Economy and Sustainable Supply Chains,Social Sciences,Strategy and Management,Taylor & Francis,False,en,"Business, Management and Accounting",
https://openalex.org/W2911856826,WITHDRAWN: Frame-Based Stereotactic Brain Biopsy and Symptomatic Intracranial Hemorrhages: Associated Factors in a Series of 407 Patients,World Neurosurgery,1,https://doi.org/10.1016/j.wneu.2019.01.057,https://api.labs.crossref.org/works/https://doi.org/10.1016/j.wneu.2019.01.057?mailto=christian.hauschke@tib.eu,2019,article,True,68,Gliomas,Health Sciences,Genetics,Elsevier BV,False,en,Medicine,Retraction
https://openalex.org/W2911860719,Corrigendum to ‘ESPEN guideline: Clinical nutrition in inflammatory bowel disease’ [Clinical Nutrition 36 (2) (2016) 321–347],Clinical Nutrition,1,https://doi.org/10.1016/j.clnu.2019.03.004,https://api.labs.crossref.org/works/https://doi.org/10.1016/j.clnu.2019.03.004?mailto=christian.hauschke@tib.eu,2019,article,True,68,Provision and Assessment of Nutrition Support Therapy,Health Sciences,Nutrition and Dietetics,Elsevier BV,True,en,Nursing,Retraction
https://openalex.org/W2912287871,Crystal structure and antitumor activity in cardiac myxoma of two novel coordination polymers,Inorganic and Nano-Metal Chemistry,1,https://doi.org/10.1080/24701556.2019.1569056,https://api.labs.crossref.org/works/https://doi.org/10.1080/24701556.2019.1569056?mailto=christian.hauschke@tib.eu,2018,article,True,68,Diagnosis and Management of Cardiac Tumors,Health Sciences,Cardiology and Cardiovascular Medicine,Taylor & Francis,False,en,Medicine,
https://openalex.org/W2912294906,Pharmacists in Critical Care,Innovations in pharmacy,1,https://doi.org/10.24926/iip.v10i1.1640,https://api.labs.crossref.org/works/https://doi.org/10.24926/iip.v10i1.1640?mailto=christian.hauschke@tib.eu,2019,article,True,68,Improving Patient Safety in Healthcare Settings,Health Sciences,Emergency Medical Services,University of Minnesota Libraries Publishing,True,en,Health Professions,Retraction
https://openalex.org/W2912546677,Retracted : Data-Rate Performance Analysis of Massive MIMO in Fading Environment with Imperfect CSI,Internet Technology Letters,1,https://doi.org/10.1002/itl2.89,https://api.labs.crossref.org/works/https://doi.org/10.1002/itl2.89?mailto=christian.hauschke@tib.eu,2019,article,True,68,Next Generation 5G Wireless Networks,Physical Sciences,Electrical and Electronic Engineering,Wiley,True,en,Engineering,Retraction
https://openalex.org/W2912715519,RETRACTED ARTICLE: E-commerce information system data analytics by advanced ACO for asymmetric capacitated vehicle delivery routing,Information Systems and e-Business Management,1,https://doi.org/10.1007/s10257-019-00405-y,https://api.labs.crossref.org/works/https://doi.org/10.1007/s10257-019-00405-y?mailto=christian.hauschke@tib.eu,2019,article,True,68,Design and Control of Warehouse Operations,Physical Sciences,Industrial and Manufacturing Engineering,Springer Science+Business Media,False,en,Engineering,Retraction
https://openalex.org/W2912852851,Retraction of “Strontium-Substituted Nanohydroxyapatite Coatings To Decrease Aseptic Loosening of Femoral Prosthesis: Safety and Efficacy in a Rat Model”,ACS Applied Materials & Interfaces,1,https://doi.org/10.1021/acsami.8b16758,https://api.labs.crossref.org/works/https://doi.org/10.1021/acsami.8b16758?mailto=christian.hauschke@tib.eu,2019,article,True,68,Hip Arthroplasty Techniques and Materials,Health Sciences,Surgery,American Chemical Society,True,en,Medicine,Retraction
https://openalex.org/W2913001865,P043 Secretome modulation of Caco-2 cell line induced by a multi-strain probiotic,Journal of Crohn's and Colitis,1,https://doi.org/10.1093/ecco-jcc/jjy222.167,https://api.labs.crossref.org/works/https://doi.org/10.1093/ecco-jcc/jjy222.167?mailto=christian.hauschke@tib.eu,2019,article,True,68,Probiotics and Prebiotics,Life Sciences,Food Science,Oxford University Press,False,en,Agricultural and Biological Sciences,Expression of concern
https://openalex.org/W2913043587,Video Watermark Algorithm Study of Shot Segmentation Based on Motion Vector,,1,https://doi.org/10.1145/3292425.3292437,https://api.labs.crossref.org/works/https://doi.org/10.1145/3292425.3292437?mailto=christian.hauschke@tib.eu,2018,article,True,68,Digital Image Watermarking Techniques,Physical Sciences,Computer Vision and Pattern Recognition,,False,en,Computer Science,Retraction
https://openalex.org/W2913216369,Digital Design of Enterprise Visual Identity System,,1,https://doi.org/10.1145/3292425.3292443,https://api.labs.crossref.org/works/https://doi.org/10.1145/3292425.3292443?mailto=christian.hauschke@tib.eu,2018,article,True,68,Innovations in Visual Communication Design and Technology,Physical Sciences,Computer Graphics and Computer-Aided Design,,False,en,Computer Science,Retraction
https://openalex.org/W2913383238,RETRACTED ARTICLE: Research on distributed localization algorithm for wireless sensor network nodes in multimedia data transmission process,Multimedia Tools and Applications,1,https://doi.org/10.1007/s11042-019-7198-z,https://api.labs.crossref.org/works/https://doi.org/10.1007/s11042-019-7198-z?mailto=christian.hauschke@tib.eu,2019,article,True,68,Wireless Indoor Localization Techniques and Systems,Physical Sciences,Electrical and Electronic Engineering,Springer Science+Business Media,False,en,Engineering,Retraction;Crossmark Retraction
https://openalex.org/W2913666422,Patient Safety: A Deep Concern to Caregivers,Innovations in pharmacy,1,https://doi.org/10.24926/iip.v10i1.1639,https://api.labs.crossref.org/works/https://doi.org/10.24926/iip.v10i1.1639?mailto=christian.hauschke@tib.eu,2019,article,True,68,Economics of Health Care Systems and Policies,Social Sciences,Economics and Econometrics,University of Minnesota Libraries Publishing,True,en,"Economics, Econometrics and Finance",Retraction
https://openalex.org/W2913814673,RETRACTED ARTICLE: Recycled aggregate concrete performance analysis based on digital image processing,Multimedia Tools and Applications,1,https://doi.org/10.1007/s11042-019-7242-z,https://api.labs.crossref.org/works/https://doi.org/10.1007/s11042-019-7242-z?mailto=christian.hauschke@tib.eu,2019,article,True,68,Fiber Reinforced Concrete in Civil Engineering,Physical Sciences,Civil and Structural Engineering,Springer Science+Business Media,False,en,Engineering,Retraction;Crossmark Retraction
