id,display_name,primary_location_display_name,cited_by_count,doi,crossref_call,publication_year,type,is_retracted,cited_by_percentile_year_min,primary_topic_display_name,primary_topic_domain_display_name,primary_topic_subfield_display_name,primary_location_source_host_organization_name,open_access_is_oa,language,primary_topic_field_display_name,update_nature
https://openalex.org/W2133014732,Notice of Retraction: Effects of MnO2 Nanoparticles on Liver and Kidney Cells of Rats,,1,https://doi.org/10.1109/icbbe.2011.5781408,https://api.labs.crossref.org/works/https://doi.org/10.1109/icbbe.2011.5781408?mailto=christian.hauschke@tib.eu,2011,article,True,71,Nanotoxicology and Antimicrobial Nanoparticles,Physical Sciences,Materials Chemistry,,False,en,Materials Science,
https://openalex.org/W2133139005,Notice of Retraction: An empirical research on the entrepreneurial risks in undergraduate entrepreneurship,,1,https://doi.org/10.1109/icebeg.2011.5881728,https://api.labs.crossref.org/works/https://doi.org/10.1109/icebeg.2011.5881728?mailto=christian.hauschke@tib.eu,2011,article,True,71,Entrepreneurship and Business Innovation,Social Sciences,Management of Technology and Innovation,,False,en,"Business, Management and Accounting",
https://openalex.org/W2134286036,"Notice of Retraction: An empirical study on the relationship between China's output, inflation, and money supply",,1,https://doi.org/10.1109/icebeg.2011.5882529,https://api.labs.crossref.org/works/https://doi.org/10.1109/icebeg.2011.5882529?mailto=christian.hauschke@tib.eu,2011,article,True,71,Macroeconomic Analysis and Policy Implications,Social Sciences,"General Economics, Econometrics and Finance",,False,en,"Economics, Econometrics and Finance",
https://openalex.org/W2134582824,Retracted: Parameter Study of Highway Bridge Fires via Combined Fire Dynamics and Finite Element Modeling,Structures Congress 2013,1,https://doi.org/10.1061/9780784412848.068,https://api.labs.crossref.org/works/https://doi.org/10.1061/9780784412848.068?mailto=christian.hauschke@tib.eu,2013,article,True,71,Fire Safety in Tunnel Fires,Physical Sciences,"Safety, Risk, Reliability and Quality",,False,en,Engineering,
https://openalex.org/W2135520906,Notice of Retraction: Study of Retting Flax Wastewater Treatment by Flotation/Flysoil Percolation Process,,1,https://doi.org/10.1109/icbbe.2011.5781023,https://api.labs.crossref.org/works/https://doi.org/10.1109/icbbe.2011.5781023?mailto=christian.hauschke@tib.eu,2011,article,True,71,,,,,False,en,,
https://openalex.org/W2138961007,‘The Desert and the Dream’: Film in Wales Since 2000,Journal of British Cinema and Television,1,https://doi.org/10.3366/jbctv.2012.0098,https://api.labs.crossref.org/works/https://doi.org/10.3366/jbctv.2012.0098?mailto=christian.hauschke@tib.eu,2012,article,True,71,Scottish History and National Identity,Social Sciences,History,Edinburgh University Press,False,en,Arts and Humanities,
https://openalex.org/W2138984709,Notice of Violation of IEEE Publication Principles: Cooperative Security in Vehicular Communication Systems,,1,https://doi.org/10.1109/aina.2011.111,https://api.labs.crossref.org/works/https://doi.org/10.1109/aina.2011.111?mailto=christian.hauschke@tib.eu,2011,article,True,71,Vehicular Ad Hoc Networks and Communications,Physical Sciences,Electrical and Electronic Engineering,,False,en,Engineering,
https://openalex.org/W2140372372,In silico 3D structure analysis accelerates the solution of a real viral structure and antibodies docking mechanism,Frontiers in Microbiology,1,https://doi.org/10.3389/fmicb.2012.00387,https://api.labs.crossref.org/works/https://doi.org/10.3389/fmicb.2012.00387?mailto=christian.hauschke@tib.eu,2012,article,True,70,Gastrointestinal Viral Infections and Vaccines Development,Health Sciences,Infectious Diseases,Frontiers Media,True,en,Medicine,
https://openalex.org/W2141043247,Notice of Retraction: Preventive measures and subgrade diseases of highway in the region of saline soil in Xinjing,,1,https://doi.org/10.1109/icetce.2011.5774284,https://api.labs.crossref.org/works/https://doi.org/10.1109/icetce.2011.5774284?mailto=christian.hauschke@tib.eu,2011,article,True,71,Multidisciplinary Engineering Research and Development,Physical Sciences,General Engineering,,False,en,Engineering,
https://openalex.org/W2142541894,Notice of Retraction: Research on the performance evaluation of logistic service supply chain based on analytic hierarchy process,,1,https://doi.org/10.1109/icebeg.2011.5881369,https://api.labs.crossref.org/works/https://doi.org/10.1109/icebeg.2011.5881369?mailto=christian.hauschke@tib.eu,2011,article,True,71,Developing Evidence-Informed Supply Chain Management Knowledge,Social Sciences,Management Information Systems,,False,en,"Business, Management and Accounting",
https://openalex.org/W2143068523,What makes a Journal Great?,PubMed,1,,https://api.labs.crossref.org/works/null?mailto=christian.hauschke@tib.eu,2011,article,True,71,Expanding Access to Radiotherapy Globally,Health Sciences,"Radiology, Nuclear Medicine and Imaging",National Institutes of Health,False,en,Medicine,
https://openalex.org/W2145056021,Notice of Retraction: SWOT analysis and strategy research on campus e-commerce,,1,https://doi.org/10.1109/icebeg.2011.5881840,https://api.labs.crossref.org/works/https://doi.org/10.1109/icebeg.2011.5881840?mailto=christian.hauschke@tib.eu,2011,article,True,71,Scalable Peer-to-Peer Network Architectures,Physical Sciences,Computer Networks and Communications,,False,en,Computer Science,
https://openalex.org/W2146851806,Notice of Retraction A new algorithm of the wavelet packet speech denoising based on masking perception model,,1,https://doi.org/10.1109/icnc.2011.6022040,https://api.labs.crossref.org/works/https://doi.org/10.1109/icnc.2011.6022040?mailto=christian.hauschke@tib.eu,2011,article,True,71,Image Denoising Techniques and Algorithms,Physical Sciences,Computer Vision and Pattern Recognition,,False,en,Computer Science,
https://openalex.org/W2148025802,Early Depth Assessment of Local Burns by Dermoscopy,Archives of Dermatology,1,https://doi.org/10.1001/archdermatol.2012.418,https://api.labs.crossref.org/works/https://doi.org/10.1001/archdermatol.2012.418?mailto=christian.hauschke@tib.eu,2012,article,True,70,Wound Healing and Regeneration,Health Sciences,Rehabilitation,American Medical Association,False,en,Medicine,
https://openalex.org/W2148509902,Notice of Retraction: Studies on Degradation of the Pesticide of Chlorpyrifos by Phanerochaete chrysosporium,,1,https://doi.org/10.1109/icbbe.2011.5781515,https://api.labs.crossref.org/works/https://doi.org/10.1109/icbbe.2011.5781515?mailto=christian.hauschke@tib.eu,2011,article,True,71,Lignin Degradation by Enzymes in Bioremediation,Life Sciences,Plant Science,,False,en,Agricultural and Biological Sciences,
https://openalex.org/W2148745556,Notice of Retraction A new neural network algorithm based on conjugate gradient and output weight optimization,,1,https://doi.org/10.1109/icnc.2011.6022056,https://api.labs.crossref.org/works/https://doi.org/10.1109/icnc.2011.6022056?mailto=christian.hauschke@tib.eu,2011,article,True,71,Neural Network Fundamentals and Applications,Physical Sciences,Artificial Intelligence,,False,en,Computer Science,
https://openalex.org/W2149135778,Blockade of receptor for advanced glycation end products in a model of type 1 diabetic leukoencephalopathy. Diabetes. 19 November 2012 [Epub ahead of print],Diabetes,1,https://doi.org/10.2337/db12-0317,https://api.labs.crossref.org/works/https://doi.org/10.2337/db12-0317?mailto=christian.hauschke@tib.eu,2012,article,True,71,Biochemistry of Diabetic Complications,Life Sciences,Clinical Biochemistry,American Diabetes Association,True,en,"Biochemistry, Genetics and Molecular Biology",
https://openalex.org/W2149718344,Electromagnetic radiation (EMR) clashes with honey bees,International Journal of Entomology and Nematology,1,https://doi.org/10.5897/jen11.014,https://api.labs.crossref.org/works/https://doi.org/10.5897/jen11.014?mailto=christian.hauschke@tib.eu,2012,article,True,70,Biological Effects of Electromagnetic Fields,Life Sciences,Biophysics,Academic Journals,False,en,"Biochemistry, Genetics and Molecular Biology",
https://openalex.org/W2150378813,"Stappia aquimarina sp. nov., isolated from seawater",International Journal of Systematic and Evolutionary Microbiology,1,https://doi.org/10.1099/ijs.0.030643-0,https://api.labs.crossref.org/works/https://doi.org/10.1099/ijs.0.030643-0?mailto=christian.hauschke@tib.eu,2011,article,True,71,Microbial Pigments and Their Applications,Life Sciences,Biotechnology,Microbiology Society,False,en,"Biochemistry, Genetics and Molecular Biology",
https://openalex.org/W2150722967,RETRACTED: Endobronchial ultrasound-guided transbronchial needle aspiration for lung cancer diagnosis and staging in 179 patients,Revista Portuguesa de Pneumologia,1,https://doi.org/10.1016/j.rppnen.2013.10.005,https://api.labs.crossref.org/works/https://doi.org/10.1016/j.rppnen.2013.10.005?mailto=christian.hauschke@tib.eu,2013,article,True,71,Diagnosis and Treatment of Lung Cancer,Health Sciences,Pulmonary and Respiratory Medicine,Elsevier BV,True,en,Medicine,
https://openalex.org/W2153465364,Adsorption of a copper (II) complex on calcium phosphate intercalated with 4-aminobenzoic acid: synthesis and electrochemical investigation,Química Nova,1,https://doi.org/10.1590/s0100-40422013000800016,https://api.labs.crossref.org/works/https://doi.org/10.1590/s0100-40422013000800016?mailto=christian.hauschke@tib.eu,2013,article,True,71,Conducting Polymer Research,Physical Sciences,Polymers and Plastics,Brazilian Chemical Society,True,en,Materials Science,
https://openalex.org/W2154447179,Notice of Retraction Research on life calculation method for non-electric products based on life model library,,1,https://doi.org/10.1109/qr2mse.2013.6625728,https://api.labs.crossref.org/works/https://doi.org/10.1109/qr2mse.2013.6625728?mailto=christian.hauschke@tib.eu,2013,article,True,71,Lithium-ion Battery Management in Electric Vehicles,Physical Sciences,Automotive Engineering,,False,en,Engineering,
https://openalex.org/W2155388416,Notice of Retraction: The experimental study on the dynamic behavior of reinforced silty,,1,https://doi.org/10.1109/icetce.2011.5775696,https://api.labs.crossref.org/works/https://doi.org/10.1109/icetce.2011.5775696?mailto=christian.hauschke@tib.eu,2011,article,True,71,Mechanical Behavior of Soil Reinforcement Techniques,Physical Sciences,Civil and Structural Engineering,,False,en,Engineering,
https://openalex.org/W2155818271,Notice of Retraction Study on the influence of topography on mechanics effect of tunnels,,1,https://doi.org/10.1109/iceceng.2011.6058225,https://api.labs.crossref.org/works/https://doi.org/10.1109/iceceng.2011.6058225?mailto=christian.hauschke@tib.eu,2011,article,True,71,Study on Rock Mechanics in Deep Mining Engineering,Physical Sciences,Mechanics of Materials,,False,en,Engineering,
https://openalex.org/W2156182257,Retraction Notice: Novel Control Algorithm for the Foot Placement of a Walking Bipedal Robot,International Journal of Advanced Robotic Systems,1,https://doi.org/10.5772/55909,https://api.labs.crossref.org/works/https://doi.org/10.5772/55909?mailto=christian.hauschke@tib.eu,2013,article,True,71,Biomechanics of Bipedal Locomotion in Robots and Animals,Physical Sciences,Biomedical Engineering,SAGE Publishing,True,en,Engineering,
https://openalex.org/W2156554682,"Play Doctor, Doctor Death: Shaw, Ibsen, and Modern Tragedy",Comparative Drama,1,https://doi.org/10.1353/cdr.2011.0017,https://api.labs.crossref.org/works/https://doi.org/10.1353/cdr.2011.0017?mailto=christian.hauschke@tib.eu,2011,article,True,71,Paediatric Virology Research and Education,Health Sciences,"Pediatrics, Perinatology and Child Health",Western Michigan University,False,en,Medicine,
https://openalex.org/W2156932947,Notice of Retraction: Temperature field change analysis of brake drums based on ANSYS,,1,https://doi.org/10.1109/iceice.2011.5777152,https://api.labs.crossref.org/works/https://doi.org/10.1109/iceice.2011.5777152?mailto=christian.hauschke@tib.eu,2011,article,True,71,Hydraulic Systems Control and Optimization,Physical Sciences,Mechanical Engineering,,False,en,Engineering,
https://openalex.org/W2156942265,Notice of Retraction Data transparent access to heterogeneous database based on XML technology,,1,https://doi.org/10.1109/icnc.2011.6022054,https://api.labs.crossref.org/works/https://doi.org/10.1109/icnc.2011.6022054?mailto=christian.hauschke@tib.eu,2011,article,True,71,Data Stream Management Systems and Techniques,Physical Sciences,Computer Networks and Communications,,False,en,Computer Science,
https://openalex.org/W2157142653,WITHDRAWN: Vascularized bone grafting and mini-acutrak fixation of scaphoid non-unions with avascular proximal pole,Chirurgie De La Main,1,https://doi.org/10.1016/j.main.2011.04.011,https://api.labs.crossref.org/works/https://doi.org/10.1016/j.main.2011.04.011?mailto=christian.hauschke@tib.eu,2011,article,True,71,Treatment and Outcomes of Hand Injuries,Health Sciences,Surgery,Elsevier BV,True,en,Medicine,
https://openalex.org/W2157888673,An efficient covalent coating on glass slides for preparation of optical oligonucleotide microarrays.,PubMed,1,,https://api.labs.crossref.org/works/null?mailto=christian.hauschke@tib.eu,2013,article,True,71,Protein Microarray Technology and Applications,Life Sciences,Molecular Biology,National Institutes of Health,False,en,"Biochemistry, Genetics and Molecular Biology",
https://openalex.org/W2158344732,ON A WEAKLY UNIFORMLY ROTUND DUAL OF A BANACH SPACE,Bulletin of the Australian Mathematical Society,1,https://doi.org/10.1017/s0004972712000597,https://api.labs.crossref.org/works/https://doi.org/10.1017/s0004972712000597?mailto=christian.hauschke@tib.eu,2012,article,True,70,Theory of Banach Spaces and Operators,Physical Sciences,Mathematical Physics,Cambridge University Press,True,en,Mathematics,
https://openalex.org/W2158347082,Notice of Retraction: Charismatic leadership and organizational identification: The mediating role of followers' emotional intelligence,,1,https://doi.org/10.1109/icbmei.2011.5920477,https://api.labs.crossref.org/works/https://doi.org/10.1109/icbmei.2011.5920477?mailto=christian.hauschke@tib.eu,2011,article,True,71,Effects of Emotional Intelligence on Performance and Attitude,Social Sciences,Social Psychology,,False,en,Psychology,
https://openalex.org/W2158565373,Notice of Retraction Analysis on arc-welding robot visual control tracking system,,1,https://doi.org/10.1109/qr2mse.2013.6625997,https://api.labs.crossref.org/works/https://doi.org/10.1109/qr2mse.2013.6625997?mailto=christian.hauschke@tib.eu,2013,article,True,71,Intelligent Control System for Industrial Processes,Physical Sciences,Control and Systems Engineering,,False,en,Engineering,
https://openalex.org/W2161704680,Notice of Retraction: A High Phenyllactic Acid Producing Lactobacillus plantarum Strain Isolated from 'Douchi' - A Traditional Fermented Soybean Food in Yunnan Province of China,,1,https://doi.org/10.1109/icbbe.2011.5781514,https://api.labs.crossref.org/works/https://doi.org/10.1109/icbbe.2011.5781514?mailto=christian.hauschke@tib.eu,2011,article,True,71,Probiotics and Prebiotics,Life Sciences,Food Science,,False,en,Agricultural and Biological Sciences,
https://openalex.org/W2164551986,"Retracted: Impact of polymorphisms in the oestrogen receptors alpha and beta (<scp>ESR</scp>1, <scp>ESR</scp>2) genes on risk of vasculogenic erectile dysfunction",Andrology,1,https://doi.org/10.1111/j.2047-2927.2013.00097.x,https://api.labs.crossref.org/works/https://doi.org/10.1111/j.2047-2927.2013.00097.x?mailto=christian.hauschke@tib.eu,2013,article,True,71,Epidemiology and Management of Sexual Dysfunction,Health Sciences,Psychiatry and Mental health,Wiley-Blackwell,False,en,Medicine,
https://openalex.org/W2165386511,EGFR and P-GP expression in oropharyngeal mucosa in relation to smoking.,PubMed,1,,https://api.labs.crossref.org/works/null?mailto=christian.hauschke@tib.eu,2012,article,True,70,Mechanisms of Multidrug Resistance in Cancer,Health Sciences,Oncology,National Institutes of Health,False,en,Medicine,
https://openalex.org/W2165677673,Notice of Retraction: Research of AHP-based 360-degree feedback for college academic affairs management personnel,,1,https://doi.org/10.1109/icbmei.2011.5916996,https://api.labs.crossref.org/works/https://doi.org/10.1109/icbmei.2011.5916996?mailto=christian.hauschke@tib.eu,2011,article,True,71,Meaning and Significance of Work,Social Sciences,Demography,,False,en,Social Sciences,
https://openalex.org/W2166585897,New Method of Searching for Cosmological Time Variation of the Fine-Structure Constant,Progress of Theoretical and Experimental Physics,1,https://doi.org/10.1143/ptp.126.177,https://api.labs.crossref.org/works/https://doi.org/10.1143/ptp.126.177?mailto=christian.hauschke@tib.eu,2011,article,True,71,Solar Physics and Space Weather,Physical Sciences,Astronomy and Astrophysics,Oxford University Press,True,en,Physics and Astronomy,
https://openalex.org/W2168159750,Performance Analysis of High-Speed Deep/Shallow Recessed Hybrid Bearing,Mathematical Problems in Engineering,1,https://doi.org/10.1155/2013/918767,https://api.labs.crossref.org/works/https://doi.org/10.1155/2013/918767?mailto=christian.hauschke@tib.eu,2013,article,True,71,Surface Texturing for Tribology,Physical Sciences,Mechanical Engineering,Hindawi Publishing Corporation,True,en,Engineering,
https://openalex.org/W2170097029,Intramedullary Chondrosarcoma of Proximal Humerus,Case reports in radiology,1,https://doi.org/10.1155/2012/642062,https://api.labs.crossref.org/works/https://doi.org/10.1155/2012/642062?mailto=christian.hauschke@tib.eu,2012,article,True,70,Bone Tumors and Tumor-like Conditions in Skeletal System,Health Sciences,Rheumatology,Hindawi Publishing Corporation,True,en,Medicine,
https://openalex.org/W2170235808,Notice of Retraction: Callus Induction and In Vitro Plantlet Re-Generation of Dioscorea panthaica,,1,https://doi.org/10.1109/icbbe.2011.5780252,https://api.labs.crossref.org/works/https://doi.org/10.1109/icbbe.2011.5780252?mailto=christian.hauschke@tib.eu,2011,article,True,71,Elicitor Signal Transduction for Metabolite Production,Life Sciences,Molecular Biology,,False,en,"Biochemistry, Genetics and Molecular Biology",
https://openalex.org/W2171405175,Notice of Retraction: Biosoption of Chromium (VI) from Aqueous Solution Using Carya (Juglans mandshurica Maxim.) Shell,,1,https://doi.org/10.1109/icbbe.2011.5781194,https://api.labs.crossref.org/works/https://doi.org/10.1109/icbbe.2011.5781194?mailto=christian.hauschke@tib.eu,2011,article,True,71,Adsorption of Water Contaminants,Physical Sciences,Water Science and Technology,,False,en,Environmental Science,
https://openalex.org/W2171772871,General steps in the production and establishment of transgenic chicken lines carrying a bacterial lacZ gene expressing β-galactosidase,African Journal of Microbiology Research,1,https://doi.org/10.5897/ajmr11.1338,https://api.labs.crossref.org/works/https://doi.org/10.5897/ajmr11.1338?mailto=christian.hauschke@tib.eu,2012,article,True,70,Transgenic Animal Research,Life Sciences,Genetics,Academic Journals,False,en,"Biochemistry, Genetics and Molecular Biology",
https://openalex.org/W2175234038,Can French paradox hypothesis explain the observed different trends of mortality from ischemic heart disease and stroke in Western europe?,PubMed,1,,https://api.labs.crossref.org/works/null?mailto=christian.hauschke@tib.eu,2013,article,True,71,Role of Mediterranean Diet in Health Outcomes,Health Sciences,"Public Health, Environmental and Occupational Health",National Institutes of Health,False,en,Medicine,
https://openalex.org/W2197924763,Notice of Retraction The influence of investment and CEO international experience on corporate social responsibility (CSR) disclosure,,1,https://doi.org/10.1109/icimtr.2012.6236441,https://api.labs.crossref.org/works/https://doi.org/10.1109/icimtr.2012.6236441?mailto=christian.hauschke@tib.eu,2012,article,True,70,Corporate Social Responsibility and Financial Performance,Social Sciences,Strategy and Management,,False,en,"Business, Management and Accounting",
https://openalex.org/W2200780965,[ARTIGO RETRATADO] Adubação nitrogenada e qualidade fisiológica de sementes de trigo,Bragantia,1,https://doi.org/10.1590/s0006-87052012005000009,https://api.labs.crossref.org/works/https://doi.org/10.1590/s0006-87052012005000009?mailto=christian.hauschke@tib.eu,2012,article,True,70,Factors Affecting Maize Yield and Lodging Resistance,Life Sciences,Agronomy and Crop Science,Instituto Agronômico de Campinas,True,pt,Agricultural and Biological Sciences,
https://openalex.org/W2201265957,Notice of Retraction The rationale of international students in choosing the Private Higher Education Institution in Malaysia,,1,https://doi.org/10.1109/icimtr.2012.6236423,https://api.labs.crossref.org/works/https://doi.org/10.1109/icimtr.2012.6236423?mailto=christian.hauschke@tib.eu,2012,article,True,70,Islamic Education and Pedagogy,Social Sciences,Education,,False,en,Social Sciences,
https://openalex.org/W2201401136,Notice of Retraction Knowledge Stock Measurement of Enterprises in Industry Cluster Based on Grey Relational Analysis,,1,https://doi.org/10.1109/fskd.2012.6234293,https://api.labs.crossref.org/works/https://doi.org/10.1109/fskd.2012.6234293?mailto=christian.hauschke@tib.eu,2012,article,True,70,Application of Grey System Theory in Forecasting,Social Sciences,Management Science and Operations Research,,False,en,Decision Sciences,
https://openalex.org/W2207950059,Chair rising time is longer in postmenopausal women with history of nonvertebral fracture.,PubMed,1,,https://api.labs.crossref.org/works/null?mailto=christian.hauschke@tib.eu,2013,article,True,71,Osteoporosis,Health Sciences,Orthopedics and Sports Medicine,National Institutes of Health,False,en,Medicine,
https://openalex.org/W2209846837,[ARTIGO RETRATADO] Exercício e suas interações com vários aspectos da vida do homem e dos animais,Acta Ortopedica Brasileira,1,https://doi.org/10.1590/s1413-78522012000600009,https://api.labs.crossref.org/works/https://doi.org/10.1590/s1413-78522012000600009?mailto=christian.hauschke@tib.eu,2012,article,True,70,Protein Metabolism in Exercise and Nutrition,Life Sciences,Cell Biology,Brazilian Society of Orthopedics and Traumatology,True,en,"Biochemistry, Genetics and Molecular Biology",
https://openalex.org/W2214405946,Summer Meeting 2013. Abstracts of the 7th Joint Meeting of the British Division of the International Academy of Pathology and the Pathological Society of Great Britain &amp; Ireland,The Journal of Pathology,1,https://doi.org/10.1002/path.4254,https://api.labs.crossref.org/works/https://doi.org/10.1002/path.4254?mailto=christian.hauschke@tib.eu,2013,article,True,71,"Diagnosis, Treatment, and Epidemiology of Nontuberculous Mycobacterial Diseases",Health Sciences,Epidemiology,Wiley,True,en,Medicine,
https://openalex.org/W2214595519,RETRACTED ARTICLE: Assessment of insecticidal activity of red pigment produced by the fungus<i>Beauveria bassiana</i>,Archives of Agronomy and Soil Science,1,https://doi.org/10.1080/03650341003587206,https://api.labs.crossref.org/works/https://doi.org/10.1080/03650341003587206?mailto=christian.hauschke@tib.eu,2011,article,True,71,Microbial Pigments and Their Applications,Life Sciences,Biotechnology,Taylor & Francis,False,en,"Biochemistry, Genetics and Molecular Biology",
https://openalex.org/W2215977052,Notice of Retraction Analysis of influence of investor relation documents to stock price,,1,https://doi.org/10.1109/fskd.2012.6234291,https://api.labs.crossref.org/works/https://doi.org/10.1109/fskd.2012.6234291?mailto=christian.hauschke@tib.eu,2012,article,True,70,Predicting Stock Market Trends and Movements,Social Sciences,Management Science and Operations Research,,False,en,Decision Sciences,
https://openalex.org/W2219213981,Notice of Retraction Research on the maintenance task allocation of oil equipments,,1,https://doi.org/10.1109/isra.2012.6219129,https://api.labs.crossref.org/works/https://doi.org/10.1109/isra.2012.6219129?mailto=christian.hauschke@tib.eu,2012,article,True,70,Materials Engineering in Industrial Applications,Physical Sciences,Mechanics of Materials,,False,en,Engineering,
https://openalex.org/W2235182736,Association between T-786C polymorphism of endothelial nitric oxide synthase gene and level of the vessel dilation factor in patients with coronary artery disease,Molecular Biology Research Communications,1,https://doi.org/10.22099/mbrc.2012.198,https://api.labs.crossref.org/works/https://doi.org/10.22099/mbrc.2012.198?mailto=christian.hauschke@tib.eu,2012,article,True,70,Role of Nitric Oxide in Health and Disease,Health Sciences,Physiology,Shiraz University,False,en,Medicine,
https://openalex.org/W2237509750,Statement of Retraction,Immunopharmacology and Immunotoxicology,1,https://doi.org/10.3109/08923973.2011.625033,https://api.labs.crossref.org/works/https://doi.org/10.3109/08923973.2011.625033?mailto=christian.hauschke@tib.eu,2011,article,True,71,Epidemiology and Treatment of Urinary Tract Infections,Health Sciences,Epidemiology,Taylor & Francis,False,en,Medicine,
https://openalex.org/W2256608198,Retraction notice,Journal of Vibration and Control,1,https://doi.org/10.1177/1077546312466687,https://api.labs.crossref.org/works/https://doi.org/10.1177/1077546312466687?mailto=christian.hauschke@tib.eu,2013,article,True,71,Real-time Water Quality Monitoring and Aquaculture Management,Physical Sciences,Water Science and Technology,SAGE Publishing,True,en,Environmental Science,
