id,display_name,primary_location_display_name,cited_by_count,doi,crossref_call,publication_year,type,is_retracted,cited_by_percentile_year_min,primary_topic_display_name,primary_topic_domain_display_name,primary_topic_subfield_display_name,primary_location_source_host_organization_name,open_access_is_oa,language,primary_topic_field_display_name,update_nature
https://openalex.org/W4200427961,Retraction of “Utility of the combined use of 3 serologic markers in the diagnosis and monitoring of chronic enteropathies in dogs”,Journal of Veterinary Internal Medicine,1,https://doi.org/10.1111/jvim.16318,https://api.labs.crossref.org/works/https://doi.org/10.1111/jvim.16318?mailto=christian.hauschke@tib.eu,2021,article,True,65,Compositional and Nutritional Aspects of Camel Milk,Life Sciences,Food Science,Wiley-Blackwell,True,en,Agricultural and Biological Sciences,Crossmark Retraction
https://openalex.org/W4200431052,Giant Traumatic Diaphragmatic Hernia: A Report of Delayed Presentation,Cureus,1,https://doi.org/10.7759/cureus.20315,https://api.labs.crossref.org/works/https://doi.org/10.7759/cureus.20315?mailto=christian.hauschke@tib.eu,2021,article,True,65,Diagnosis and Management of Congenital Diaphragmatic Hernia,Health Sciences,Surgery,"Cureus, Inc.",True,en,Medicine,Retraction;Expression of concern
https://openalex.org/W4200435365,Multimedia Computer-Aided Industrial System Design Based on the Study of Big Data Mining Algorithm,Advances in multimedia,1,https://doi.org/10.1155/2021/8489662,https://api.labs.crossref.org/works/https://doi.org/10.1155/2021/8489662?mailto=christian.hauschke@tib.eu,2021,article,True,65,Smart Technology and Data Analytics Applications,Physical Sciences,Information Systems,Hindawi Publishing Corporation,True,en,Computer Science,Retraction
https://openalex.org/W4200443305,RETRACTED ARTICLE: Upregulation of microRNA-576-5p protects from steroid-induced avascular necrosis of the femoral head by suppressing ANXA2,Cell Cycle,1,https://doi.org/10.1080/15384101.2021.1988377,https://api.labs.crossref.org/works/https://doi.org/10.1080/15384101.2021.1988377?mailto=christian.hauschke@tib.eu,2021,article,True,65,Pathogenesis and Treatment of Osteonecrosis,Health Sciences,Orthopedics and Sports Medicine,Taylor & Francis,True,en,Medicine,
https://openalex.org/W4200446693,A Game Model for Incentive Mechanism of Distributed Nodes in Supply Chains,Computational Intelligence and Neuroscience,1,https://doi.org/10.1155/2021/7502860,https://api.labs.crossref.org/works/https://doi.org/10.1155/2021/7502860?mailto=christian.hauschke@tib.eu,2021,article,True,65,Blockchain and Internet of Things Integration,Physical Sciences,Information Systems,Hindawi Publishing Corporation,True,en,Computer Science,Retraction
https://openalex.org/W4200460565,RETRACTED: Research on 3D reconstruction method of wear particle dynamic image based on multi contour space mapping,IOP Conference Series: Materials Science and Engineering,1,https://doi.org/10.1088/1757-899x/1207/1/012017,https://api.labs.crossref.org/works/https://doi.org/10.1088/1757-899x/1207/1/012017?mailto=christian.hauschke@tib.eu,2021,article,True,65,Fabric Defect Detection in Industrial Applications,Physical Sciences,Industrial and Manufacturing Engineering,IOP Publishing,True,en,Engineering,Retraction
https://openalex.org/W4200492353,Computational Prediction of Intrinsically Disordered Proteins Based on Protein Sequences and Convolutional Neural Networks,Computational Intelligence and Neuroscience,1,https://doi.org/10.1155/2021/4455604,https://api.labs.crossref.org/works/https://doi.org/10.1155/2021/4455604?mailto=christian.hauschke@tib.eu,2021,article,True,65,Protein Structure Prediction and Analysis,Life Sciences,Molecular Biology,Hindawi Publishing Corporation,True,en,"Biochemistry, Genetics and Molecular Biology",Retraction
https://openalex.org/W4200503626,Design and Research of a Foul Detector for Long Jump Stepping on a Jump Line Based on the Wireless Sensor Network,Wireless Communications and Mobile Computing,1,https://doi.org/10.1155/2021/5641284,https://api.labs.crossref.org/works/https://doi.org/10.1155/2021/5641284?mailto=christian.hauschke@tib.eu,2021,article,True,65,Anomaly Detection in High-Dimensional Data,Physical Sciences,Artificial Intelligence,Wiley,True,en,Computer Science,Retraction
https://openalex.org/W4200541473,Design and Construction of Multimedia Smart English Teaching Platform Based on RBF Algorithm,Advances in multimedia,1,https://doi.org/10.1155/2021/7551310,https://api.labs.crossref.org/works/https://doi.org/10.1155/2021/7551310?mailto=christian.hauschke@tib.eu,2021,article,True,65,Impact of Interactive Whiteboards in Education,Social Sciences,Education,Hindawi Publishing Corporation,True,en,Social Sciences,Retraction
https://openalex.org/W4200547327,Epiploic Appendagitis Clinically Masquerading as an Acute Diverticulitis,Cureus,1,https://doi.org/10.7759/cureus.20188,https://api.labs.crossref.org/works/https://doi.org/10.7759/cureus.20188?mailto=christian.hauschke@tib.eu,2021,article,True,65,Omental Pathologies and Mimicking Conditions,Health Sciences,Rheumatology,"Cureus, Inc.",True,en,Medicine,
https://openalex.org/W4200550981,Retracted: Virtual reality-guided aortic valve leaflet reconstruction for type 0 bicuspid aortic stenosis,Interactive Cardiovascular and Thoracic Surgery,1,https://doi.org/10.1093/icvts/ivab353,https://api.labs.crossref.org/works/https://doi.org/10.1093/icvts/ivab353?mailto=christian.hauschke@tib.eu,2021,article,True,65,Diagnosis and Management of Aortic Diseases,Health Sciences,Pulmonary and Respiratory Medicine,Oxford University Press,True,en,Medicine,
https://openalex.org/W4200554137,Application of Multilayer Perceptron Genetic Algorithm Neural Network in Chinese-English Parallel Corpus Noise Processing,Computational Intelligence and Neuroscience,1,https://doi.org/10.1155/2021/7144635,https://api.labs.crossref.org/works/https://doi.org/10.1155/2021/7144635?mailto=christian.hauschke@tib.eu,2021,article,True,65,Medical Equipment Maintenance and Management,Health Sciences,Medical Laboratory Technology,Hindawi Publishing Corporation,True,en,Health Professions,
https://openalex.org/W4200583983,Retracted: Zeptomolar detection of 4-aminothiophenol by SERS using silver nanodendrites decorated with gold nanoparticles,Nanotechnology,1,https://doi.org/10.1088/1361-6528/ac40be,https://api.labs.crossref.org/works/https://doi.org/10.1088/1361-6528/ac40be?mailto=christian.hauschke@tib.eu,2021,article,True,65,"Plasmonic Nanoparticles: Synthesis, Properties, and Applications",Physical Sciences,"Electronic, Optical and Magnetic Materials",IOP Publishing,False,en,Materials Science,
https://openalex.org/W4200592462,Gender Differences in Teaching and Research Performance of University Teachers Based on Discrete Data Analysis,Discrete Dynamics in Nature and Society,1,https://doi.org/10.1155/2021/5066668,https://api.labs.crossref.org/works/https://doi.org/10.1155/2021/5066668?mailto=christian.hauschke@tib.eu,2021,article,True,65,Self-Determination Theory in Human Motivation and Well-Being,Social Sciences,Social Psychology,Hindawi Publishing Corporation,True,en,Psychology,
https://openalex.org/W4200597385,Analysis and Recognition Based on Citrus Color Grading Model considering Computer Vision Technology,Advances in multimedia,1,https://doi.org/10.1155/2021/6426163,https://api.labs.crossref.org/works/https://doi.org/10.1155/2021/6426163?mailto=christian.hauschke@tib.eu,2021,article,True,65,Precision Agriculture Technologies,Life Sciences,Plant Science,Hindawi Publishing Corporation,True,en,Agricultural and Biological Sciences,
https://openalex.org/W4200600603,Optimization of Data Mining and Analysis System for Chinese Language Teaching Based on Convolutional Neural Network,Computational Intelligence and Neuroscience,1,https://doi.org/10.1155/2021/1148954,https://api.labs.crossref.org/works/https://doi.org/10.1155/2021/1148954?mailto=christian.hauschke@tib.eu,2021,article,True,65,Comprehensive Survey of Big Data Mining Approaches,Physical Sciences,Information Systems,Hindawi Publishing Corporation,True,en,Computer Science,
https://openalex.org/W4200603700,RETRACTED ARTICLE: A technology review on treatment of acid mine drainage with bentonite–steel slag composite,SN Applied Sciences,1,https://doi.org/10.1007/s42452-021-04888-8,https://api.labs.crossref.org/works/https://doi.org/10.1007/s42452-021-04888-8?mailto=christian.hauschke@tib.eu,2021,article,True,65,Acid Mine Drainage Remediation and Biogeochemistry,Physical Sciences,Environmental Chemistry,Springer Nature,True,en,Environmental Science,
https://openalex.org/W4200616802,The Levels of Amyloid β-Protein and P181 in Peripheral Blood of Patients with Alzheimer’s Disease Combined with Helicobacter pylori Infection and Their Clinical Significance,Computational and Mathematical Methods in Medicine,1,https://doi.org/10.1155/2021/7135399,https://api.labs.crossref.org/works/https://doi.org/10.1155/2021/7135399?mailto=christian.hauschke@tib.eu,2021,article,True,65,Mechanisms of Alzheimer's Disease,Health Sciences,Physiology,Hindawi Publishing Corporation,True,en,Medicine,
https://openalex.org/W4200623327,Educational philosophies and theoretical perspective for self-cultivation in early childhood education,Aggression and Violent Behavior,1,https://doi.org/10.1016/j.avb.2021.101718,https://api.labs.crossref.org/works/https://doi.org/10.1016/j.avb.2021.101718?mailto=christian.hauschke@tib.eu,2021,article,True,65,Impact of Media on Children's Development,Social Sciences,Education,Elsevier BV,False,en,Social Sciences,
https://openalex.org/W4205120859,"<i>catena</i>-Poly[[tetra-μ-anilinoacetato-bis(1,10-phenanthroline)dilanthanum(III)]-di-μ-anilinoacetato]",Acta Crystallographica Section E-structure Reports Online,1,https://doi.org/10.1107/s1600536807051240,https://api.labs.crossref.org/works/https://doi.org/10.1107/s1600536807051240?mailto=christian.hauschke@tib.eu,2007,article,True,68,Chemical Crystallography,Physical Sciences,Inorganic Chemistry,International Union of Crystallography,False,en,Chemistry,
https://openalex.org/W4205134146,"<i>catena</i>-Poly[[tetra-μ-anilinoacetato-bis(1,10-phenanthroline)dieuropium(III)]-di-μ-anilinoacetato]",Acta Crystallographica Section E-structure Reports Online,1,https://doi.org/10.1107/s1600536807060643,https://api.labs.crossref.org/works/https://doi.org/10.1107/s1600536807060643?mailto=christian.hauschke@tib.eu,2007,article,True,68,Chemical Crystallography,Physical Sciences,Inorganic Chemistry,International Union of Crystallography,False,en,Chemistry,
https://openalex.org/W4205148530,The real experience of patients after liver transplantation in intensive care unit: Retraction,Medicine,1,https://doi.org/10.1097/md.0000000000026759,https://api.labs.crossref.org/works/https://doi.org/10.1097/md.0000000000026759?mailto=christian.hauschke@tib.eu,2021,article,True,65,Neuro-Immune Modulation via Vagus Nerve Stimulation,Life Sciences,Neurology,Wolters Kluwer,True,en,Neuroscience,
https://openalex.org/W4205209016,<i>catena</i>-Poly[[aqua(pyrazine-2-carboxylato)copper(II)]-μ-pyrazine-2-carboxylato],Acta Crystallographica Section E-structure Reports Online,1,https://doi.org/10.1107/s1600536807030528,https://api.labs.crossref.org/works/https://doi.org/10.1107/s1600536807030528?mailto=christian.hauschke@tib.eu,2007,article,True,68,Recent Advances in Triazine Chemistry,Physical Sciences,Organic Chemistry,International Union of Crystallography,False,en,Chemistry,
https://openalex.org/W4205271337,"<i>catena</i>-Poly[[aqua(pyrazine-2-carboxylato-κ<sup>2</sup><i>N</i><sup>1</sup>,<i>O</i>)zinc(II)]-μ-pyrazine-2-carboxylato-κ<sup>2</sup><i>N</i><sup>1</sup>,<i>O</i>:<i>N</i><sup>4</sup>]",Acta Crystallographica Section E-structure Reports Online,1,https://doi.org/10.1107/s1600536807033041,https://api.labs.crossref.org/works/https://doi.org/10.1107/s1600536807033041?mailto=christian.hauschke@tib.eu,2007,article,True,68,Recent Advances in Triazine Chemistry,Physical Sciences,Organic Chemistry,International Union of Crystallography,False,hr,Chemistry,
https://openalex.org/W4205283828,"<i>cyclo</i>-Tetrakis[μ-<i>N</i>-(2-hydroxybenzoyl)-<i>N</i>′-(2-hydroxy-3-methoxybenzylidene)hydrazinate(2–)]tetracobalt(II)<i>N</i>,<i>N</i>-dimethylformamide tetrasolvate",Acta Crystallographica Section E-structure Reports Online,1,https://doi.org/10.1107/s1600536807033338,https://api.labs.crossref.org/works/https://doi.org/10.1107/s1600536807033338?mailto=christian.hauschke@tib.eu,2007,article,True,68,Platinum-Based Cancer Chemotherapy,Health Sciences,Oncology,International Union of Crystallography,False,en,Medicine,
https://openalex.org/W4205306783,RETRACTED NOTICE: Robust optimization based price-taker retailer bidding strategy under pool market price uncertainty,International Journal of Electrical Power & Energy Systems,1,https://doi.org/10.1016/j.ijepes.2020.106482,https://api.labs.crossref.org/works/https://doi.org/10.1016/j.ijepes.2020.106482?mailto=christian.hauschke@tib.eu,2021,article,True,65,Mechanism Design in Auctions and Procurement Contracts,Social Sciences,Management Science and Operations Research,Elsevier BV,False,en,Decision Sciences,
https://openalex.org/W4205328994,"<i>catena</i>-Poly[[(acetato-κ<i>O</i>)(1,10-phenanthroline-κ<sup>2</sup><i>N</i>,<i>N</i>′)copper(II)]-μ-acetato-κ<sup>2</sup><i>O</i>:<i>O</i>′]",Acta Crystallographica Section E-structure Reports Online,1,https://doi.org/10.1107/s160053680705622x,https://api.labs.crossref.org/works/https://doi.org/10.1107/s160053680705622x?mailto=christian.hauschke@tib.eu,2007,article,True,68,Chemical Crystallography,Physical Sciences,Inorganic Chemistry,International Union of Crystallography,False,en,Chemistry,
https://openalex.org/W4205384683,"Tetrakis(μ-2-pyridyloxyacetato)bis[(1,10-phenanthroline)(2-pyridyloxyacetato)praseodymium(III)]",Acta Crystallographica Section E-structure Reports Online,1,https://doi.org/10.1107/s1600536807032679,https://api.labs.crossref.org/works/https://doi.org/10.1107/s1600536807032679?mailto=christian.hauschke@tib.eu,2007,article,True,68,Chemical Crystallography,Physical Sciences,Inorganic Chemistry,International Union of Crystallography,False,en,Chemistry,
https://openalex.org/W4205390413,"{μ-6,6′-Diethoxy-2,2′-[ethane-1,2-diylbis(nitrilomethylidyne)]diphenolato}trinitratocerium(III)zinc(II)",Acta Crystallographica Section E-structure Reports Online,1,https://doi.org/10.1107/s1600536807032564,https://api.labs.crossref.org/works/https://doi.org/10.1107/s1600536807032564?mailto=christian.hauschke@tib.eu,2007,article,True,68,Platinum-Based Cancer Chemotherapy,Health Sciences,Oncology,International Union of Crystallography,False,en,Medicine,
https://openalex.org/W4205419650,Polymeric KNOF<sub>2</sub>,Acta Crystallographica Section E-structure Reports Online,1,https://doi.org/10.1107/s1600536807027195,https://api.labs.crossref.org/works/https://doi.org/10.1107/s1600536807027195?mailto=christian.hauschke@tib.eu,2007,article,True,68,Chemistry and Applications of Metal-Organic Frameworks,Physical Sciences,Inorganic Chemistry,International Union of Crystallography,False,en,Chemistry,
https://openalex.org/W4205421604,"Poly[[aqua(2,2-bipyridine)(μ<sub>3</sub>-pyridine-3,4-dicarboxylato)cobalt(II)] monohydrate]",Acta Crystallographica Section E-structure Reports Online,1,https://doi.org/10.1107/s1600536807040275,https://api.labs.crossref.org/works/https://doi.org/10.1107/s1600536807040275?mailto=christian.hauschke@tib.eu,2007,article,True,68,Chemistry and Applications of Metal-Organic Frameworks,Physical Sciences,Inorganic Chemistry,International Union of Crystallography,False,en,Chemistry,
https://openalex.org/W4205492384,Medium and Large <i>N</i>-Heterocycle Formation via Allene Hydroamination with a Bimetallic Rh(II) Catalyst,Journal of the American Chemical Society,1,https://doi.org/10.1021/jacs.1c10534,https://api.labs.crossref.org/works/https://doi.org/10.1021/jacs.1c10534?mailto=christian.hauschke@tib.eu,2021,article,True,65,Gold Catalysis in Organic Synthesis,Physical Sciences,Organic Chemistry,American Chemical Society,False,en,Chemistry,
https://openalex.org/W4205503770,"<i>catena</i>-Poly[[(nitrato-κ<i>O</i>)(1,10-phenanthroline-κ<sup>2</sup><i>N</i>,<i>N</i>′)cobalt(II)]-μ-acetamidato-κ<sup>2</sup><i>O</i>:<i>N</i>]",Acta Crystallographica Section E-structure Reports Online,1,https://doi.org/10.1107/s1600536807060631,https://api.labs.crossref.org/works/https://doi.org/10.1107/s1600536807060631?mailto=christian.hauschke@tib.eu,2007,article,True,68,Chemistry and Applications of Metal-Organic Frameworks,Physical Sciences,Inorganic Chemistry,International Union of Crystallography,False,en,Chemistry,
https://openalex.org/W4205612789,"{μ-6,6′-Diethoxy-2,2′-[ethane-1,2-diylbis(nitrilomethylidyne)]diphenolato}trinitratopraseodymium(III)zinc(II)",Acta Crystallographica Section E-structure Reports Online,1,https://doi.org/10.1107/s1600536807032540,https://api.labs.crossref.org/works/https://doi.org/10.1107/s1600536807032540?mailto=christian.hauschke@tib.eu,2007,article,True,68,Platinum-Based Cancer Chemotherapy,Health Sciences,Oncology,International Union of Crystallography,False,en,Medicine,
https://openalex.org/W4205772999,"Tetraaquabis(4,4′-bipyridine)manganese(II) pyridine-2,6-dicarboxylate tetrahydrate",Acta Crystallographica Section E-structure Reports Online,1,https://doi.org/10.1107/s160053680703766x,https://api.labs.crossref.org/works/https://doi.org/10.1107/s160053680703766x?mailto=christian.hauschke@tib.eu,2007,article,True,68,Platinum-Based Cancer Chemotherapy,Health Sciences,Oncology,International Union of Crystallography,False,en,Medicine,
https://openalex.org/W4205818469,"{μ-6,6′-Diethoxy-2,2′-[ethane-1,2-diylbis(nitrilomethylidyne)]diphenolato}trinitratopraseodymium(III)nickel(II)",Acta Crystallographica Section E-structure Reports Online,1,https://doi.org/10.1107/s1600536807032618,https://api.labs.crossref.org/works/https://doi.org/10.1107/s1600536807032618?mailto=christian.hauschke@tib.eu,2007,article,True,68,Platinum-Based Cancer Chemotherapy,Health Sciences,Oncology,International Union of Crystallography,False,en,Medicine,
https://openalex.org/W4205823798,μ-Oxido-bis{chlorido[tris(2-pyridylmethyl)amine]iron(III)} bis(hexafluoridophosphate),Acta Crystallographica Section E-structure Reports Online,1,https://doi.org/10.1107/s1600536807049665,https://api.labs.crossref.org/works/https://doi.org/10.1107/s1600536807049665?mailto=christian.hauschke@tib.eu,2007,article,True,68,Molecular Magnetism and Spintronics,Physical Sciences,"Electronic, Optical and Magnetic Materials",International Union of Crystallography,False,en,Materials Science,
https://openalex.org/W4205878261,"Retracted: Factors Influencing Millennials' Adoption on Internet Banking, Propositions Through Refined UTAUT2",Sri Lanka Journal of marketing,1,https://doi.org/10.4038/sljmuok.v7i3.77,https://api.labs.crossref.org/works/https://doi.org/10.4038/sljmuok.v7i3.77?mailto=christian.hauschke@tib.eu,2021,article,True,65,Impact of Social Media on Consumer Behavior,Social Sciences,Sociology and Political Science,,True,en,Social Sciences,
https://openalex.org/W4205888337,Football sports safety and the health risk assessment system,Work-a Journal of Prevention Assessment & Rehabilitation,1,https://doi.org/10.3233/wor-205348,https://api.labs.crossref.org/works/https://doi.org/10.3233/wor-205348?mailto=christian.hauschke@tib.eu,2021,article,True,65,Epidemiology of Sports-Related Musculoskeletal Injuries,Health Sciences,Orthopedics and Sports Medicine,IOS Press,True,en,Medicine,
https://openalex.org/W4205986132,"Fault-Tolerant Secure Routing of <math xmlns=""http://www.w3.org/1998/Math/MathML"" id=""M1""> <mi mathvariant=""normal"">B</mi> <msub> <mrow> <mi mathvariant=""normal"">H</mi> </mrow> <mrow> <mi>n</mi> </mrow> </msub> </math>-Based Data Center Networks",Security and Communication Networks,1,https://doi.org/10.1155/2021/6723914,https://api.labs.crossref.org/works/https://doi.org/10.1155/2021/6723914?mailto=christian.hauschke@tib.eu,2021,article,True,65,Software-Defined Networking and Network Virtualization,Physical Sciences,Computer Networks and Communications,Hindawi Publishing Corporation,True,en,Computer Science,
https://openalex.org/W4206044425,"(Dihydroxyglyoxime-κ<sup>2</sup><i>N</i>,<i>N</i>′)bis(1,10-phenanthroline-κ<sup>2</sup><i>N</i>,<i>N</i>′)manganese(II) dinitrate dihydrate",Acta Crystallographica Section E-structure Reports Online,1,https://doi.org/10.1107/s1600536807035076,https://api.labs.crossref.org/works/https://doi.org/10.1107/s1600536807035076?mailto=christian.hauschke@tib.eu,2007,article,True,68,Chemical Crystallography,Physical Sciences,Inorganic Chemistry,International Union of Crystallography,False,en,Chemistry,
https://openalex.org/W4206056246,"<i>catena</i>-Poly[[(acetato-κ<i>O</i>)(1,10-phenanthroline-κ<sup>2</sup><i>N</i>,<i>N</i>′)cobalt(II)]-μ-acetato-κ<sup>2</sup><i>O</i>:<i>O</i>′]",Acta Crystallographica Section E-structure Reports Online,1,https://doi.org/10.1107/s1600536807053494,https://api.labs.crossref.org/works/https://doi.org/10.1107/s1600536807053494?mailto=christian.hauschke@tib.eu,2007,article,True,68,Chemical Crystallography,Physical Sciences,Inorganic Chemistry,International Union of Crystallography,False,en,Chemistry,
https://openalex.org/W4206058018,"{6,6′-Dimethoxy-2,2′-[ethane-1,2-diylbis(nitrilomethylidyne)]diphenolato}methanol-μ-nitrato-dinitratopraseodymium(III)zinc(II)",Acta Crystallographica Section E-structure Reports Online,1,https://doi.org/10.1107/s1600536807037488,https://api.labs.crossref.org/works/https://doi.org/10.1107/s1600536807037488?mailto=christian.hauschke@tib.eu,2007,article,True,68,Chemical Crystallography,Physical Sciences,Inorganic Chemistry,International Union of Crystallography,False,en,Chemistry,
https://openalex.org/W4206224296,RETRACTED ARTICLE: On the illuminationist approach to imaginal power: outline of a perspective,Topoi-an International Review of Philosophy,1,https://doi.org/10.1007/s11245-007-9015-y,https://api.labs.crossref.org/works/https://doi.org/10.1007/s11245-007-9015-y?mailto=christian.hauschke@tib.eu,2007,article,True,68,,,,Springer Science+Business Media,False,en,,
https://openalex.org/W4206431732,Mental health risk assessment and intervention of vocational college students with the assistance of mental health education,Work-a Journal of Prevention Assessment & Rehabilitation,1,https://doi.org/10.3233/wor-205354,https://api.labs.crossref.org/works/https://doi.org/10.3233/wor-205354?mailto=christian.hauschke@tib.eu,2021,article,True,65,Emotion Regulation and Psychopathology in Children and Adolescents,Social Sciences,Clinical Psychology,IOS Press,True,en,Psychology,
https://openalex.org/W4206498825,Neural Function Recovery and Safety of Mild Hypothermia Therapy Combined with Monosialotetrahexosylganglioside on Neonatal Asphyxia Complicated by Hypoxic Ischemic Encephalopathy,Computational and Mathematical Methods in Medicine,1,https://doi.org/10.1155/2021/6186011,https://api.labs.crossref.org/works/https://doi.org/10.1155/2021/6186011?mailto=christian.hauschke@tib.eu,2021,article,True,65,Neonatal Brain Injury and Developmental Consequences,Health Sciences,"Pediatrics, Perinatology and Child Health",Hindawi Publishing Corporation,True,en,Medicine,
https://openalex.org/W4206574149,"(Dihydroxyglyoxime-κ<sup>2</sup><i>N</i>,<i>N</i>′)bis(1,10-phenanthroline-κ<sup>2</sup><i>N</i>,<i>N</i>′)cobalt(II) dinitrate dihydrate",Acta Crystallographica Section E-structure Reports Online,1,https://doi.org/10.1107/s1600536807031224,https://api.labs.crossref.org/works/https://doi.org/10.1107/s1600536807031224?mailto=christian.hauschke@tib.eu,2007,article,True,68,Chemical Crystallography,Physical Sciences,Inorganic Chemistry,International Union of Crystallography,False,en,Chemistry,
https://openalex.org/W4206609898,"<i>catena</i>-Poly[[(nitrato-κ<i>O</i>)(1,10-phenanthroline-κ<sup>2</sup><i>N</i>,<i>N</i>′)copper(II)]-μ-acetamido-κ<sup>2</sup><i>O</i>:<i>N</i>]",Acta Crystallographica Section E-structure Reports Online,1,https://doi.org/10.1107/s1600536807059077,https://api.labs.crossref.org/works/https://doi.org/10.1107/s1600536807059077?mailto=christian.hauschke@tib.eu,2007,article,True,68,Chemistry and Applications of Metal-Organic Frameworks,Physical Sciences,Inorganic Chemistry,International Union of Crystallography,False,en,Chemistry,
https://openalex.org/W4206611984,"<i>cyclo</i>-Tetrakis[μ-<i>N</i>-(2-hydroxybenzoyl)-<i>N</i>′-(2-hydroxy-3-methoxybenzylidene)hydrazine(2–)]tetrazinc(II)<i>N</i>,<i>N</i>-dimethylformamide tetrasolvate",Acta Crystallographica Section E-structure Reports Online,1,https://doi.org/10.1107/s1600536807034514,https://api.labs.crossref.org/works/https://doi.org/10.1107/s1600536807034514?mailto=christian.hauschke@tib.eu,2007,article,True,68,Chemical Crystallography,Physical Sciences,Inorganic Chemistry,International Union of Crystallography,False,en,Chemistry,
