id,display_name,primary_location_display_name,cited_by_count,doi,crossref_call,publication_year,type,is_retracted,cited_by_percentile_year_min,primary_topic_display_name,primary_topic_domain_display_name,primary_topic_subfield_display_name,primary_location_source_host_organization_name,open_access_is_oa,language,primary_topic_field_display_name,update_nature
https://openalex.org/W2950129692,RETRACTED ARTICLE: Up-regulated microRNA-199b-3p represses the apoptosis of cerebral microvascular endothelial cells in ischemic stroke through down-regulation of MAPK/ERK/EGR1 axis,Cell Cycle,32,https://doi.org/10.1080/15384101.2019.1632133,https://api.labs.crossref.org/works/https://doi.org/10.1080/15384101.2019.1632133?mailto=christian.hauschke@tib.eu,2019,article,True,96,MicroRNA Regulation in Cancer and Development,Life Sciences,Cancer Research,Taylor & Francis,True,en,"Biochemistry, Genetics and Molecular Biology",
https://openalex.org/W2955540013,Image Super-Resolution Algorithm Based on Dual-Channel Convolutional Neural Networks,Applied sciences,32,https://doi.org/10.3390/app9112316,https://api.labs.crossref.org/works/https://doi.org/10.3390/app9112316?mailto=christian.hauschke@tib.eu,2019,article,True,96,Single Image Super-Resolution Techniques,Physical Sciences,Computer Vision and Pattern Recognition,Multidisciplinary Digital Publishing Institute,True,en,Computer Science,
https://openalex.org/W2955731184,RETRACTED ARTICLE: Visual communication design elements of Internet of Things based on cloud computing applied in graffiti art schema,Soft Computing,32,https://doi.org/10.1007/s00500-019-04171-4,https://api.labs.crossref.org/works/https://doi.org/10.1007/s00500-019-04171-4?mailto=christian.hauschke@tib.eu,2019,article,True,96,Innovations in Visual Communication Design and Technology,Physical Sciences,Computer Graphics and Computer-Aided Design,Springer Science+Business Media,False,en,Computer Science,
https://openalex.org/W2962765881,Arbutin protects HK-2 cells against high glucose-induced apoptosis and autophagy by up-regulating microRNA-27a,Artificial Cells Nanomedicine and Biotechnology,32,https://doi.org/10.1080/21691401.2019.1640231,https://api.labs.crossref.org/works/https://doi.org/10.1080/21691401.2019.1640231?mailto=christian.hauschke@tib.eu,2019,article,True,96,Role of Autophagy in Disease and Health,Health Sciences,Epidemiology,Informa,True,en,Medicine,
https://openalex.org/W2968561553,&lt;p&gt;Impact of postoperative dexmedetomidine infusion on incidence of delirium in elderly patients undergoing major elective noncardiac surgery: a randomized clinical trial&lt;/p&gt;,Drug Design Development and Therapy,32,https://doi.org/10.2147/dddt.s208703,https://api.labs.crossref.org/works/https://doi.org/10.2147/dddt.s208703?mailto=christian.hauschke@tib.eu,2019,article,True,96,Management of Delirium in Critical Care Patients,Health Sciences,Critical Care and Intensive Care Medicine,Dove Medical Press,True,en,Medicine,
https://openalex.org/W2978743343,Cell membrane based biomimetic nanocomposites for targeted therapy of drug resistant EGFR-mutated lung cancer,Nanoscale,32,https://doi.org/10.1039/c9nr05791a,https://api.labs.crossref.org/works/https://doi.org/10.1039/c9nr05791a?mailto=christian.hauschke@tib.eu,2019,article,True,96,Nanoparticle-Based Drug Delivery Systems,Physical Sciences,Biomaterials,Royal Society of Chemistry,False,en,Materials Science,
https://openalex.org/W2991449580,RETRACTED: LNCRNA CDKN2B-AS1 regulates mesangial cell proliferation and extracellular matrix accumulation via miR-424-5p/HMGA2 axis,Biomedicine & Pharmacotherapy,32,https://doi.org/10.1016/j.biopha.2019.109622,https://api.labs.crossref.org/works/https://doi.org/10.1016/j.biopha.2019.109622?mailto=christian.hauschke@tib.eu,2020,article,True,96,Role of Long Noncoding RNAs in Cancer and Development,Life Sciences,Cancer Research,Elsevier BV,True,en,"Biochemistry, Genetics and Molecular Biology",
https://openalex.org/W2992722165,RETRACTED ARTICLE: Dickkopf-1 contributes to hepatocellular carcinoma tumorigenesis by activating the Wnt/β-catenin signaling pathway,Signal Transduction and Targeted Therapy,32,https://doi.org/10.1038/s41392-019-0082-5,https://api.labs.crossref.org/works/https://doi.org/10.1038/s41392-019-0082-5?mailto=christian.hauschke@tib.eu,2019,article,True,96,Wnt Signaling in Development and Disease,Life Sciences,Molecular Biology,Springer Nature,True,en,"Biochemistry, Genetics and Molecular Biology",
https://openalex.org/W2997078190,RETRACTED: Strength and dynamic elasticity modulus of rubberized concrete designed with ANFIS modeling and ultrasonic technique,Construction and Building Materials,32,https://doi.org/10.1016/j.conbuildmat.2019.117920,https://api.labs.crossref.org/works/https://doi.org/10.1016/j.conbuildmat.2019.117920?mailto=christian.hauschke@tib.eu,2020,article,True,96,Fiber Reinforced Concrete in Civil Engineering,Physical Sciences,Civil and Structural Engineering,Elsevier BV,False,en,Engineering,
https://openalex.org/W3000371577,"&lt;p&gt;&lt;em&gt;LINC00963&lt;/em&gt; Promotes Ovarian Cancer Proliferation, Migration and EMT via the miR-378g /&lt;em&gt;CHI3L1&lt;/em&gt; Axis&lt;/p&gt;",Cancer management and research,32,https://doi.org/10.2147/cmar.s229083,https://api.labs.crossref.org/works/https://doi.org/10.2147/cmar.s229083?mailto=christian.hauschke@tib.eu,2020,article,True,96,Role of Long Noncoding RNAs in Cancer and Development,Life Sciences,Cancer Research,Dove Medical Press,True,en,"Biochemistry, Genetics and Molecular Biology",
https://openalex.org/W3006257402,RETRACTED ARTICLE: Quality of service (QoS) and priority aware models for energy efficient and demand routing procedure in mobile ad hoc networks,Journal of Ambient Intelligence and Humanized Computing,32,https://doi.org/10.1007/s12652-020-01769-7,https://api.labs.crossref.org/works/https://doi.org/10.1007/s12652-020-01769-7?mailto=christian.hauschke@tib.eu,2020,article,True,96,Ad Hoc Wireless Networks Research,Physical Sciences,Computer Networks and Communications,Springer Science+Business Media,False,en,Computer Science,
https://openalex.org/W3015710131,RETRACTED ARTICLE: Blockchain-based intelligent contract for factoring business in supply chains,Annals of Operations Research,32,https://doi.org/10.1007/s10479-020-03601-z,https://api.labs.crossref.org/works/https://doi.org/10.1007/s10479-020-03601-z?mailto=christian.hauschke@tib.eu,2020,article,True,96,Blockchain and Internet of Things Integration,Physical Sciences,Information Systems,Springer Science+Business Media,False,en,Computer Science,
https://openalex.org/W3017164310,RETRACTED: MicroRNA-381 facilitates autophagy and apoptosis in prostate cancer cells via inhibiting the RELN-mediated PI3K/AKT/mTOR signaling pathway,Life Sciences,32,https://doi.org/10.1016/j.lfs.2020.117672,https://api.labs.crossref.org/works/https://doi.org/10.1016/j.lfs.2020.117672?mailto=christian.hauschke@tib.eu,2020,article,True,96,MicroRNA Regulation in Cancer and Development,Life Sciences,Cancer Research,Elsevier BV,False,en,"Biochemistry, Genetics and Molecular Biology",
https://openalex.org/W3022327801,RETRACTED ARTICLE: Analysis on the construction of ideological and political education system for college students based on mobile artificial intelligence terminal,Soft Computing,32,https://doi.org/10.1007/s00500-020-04932-6,https://api.labs.crossref.org/works/https://doi.org/10.1007/s00500-020-04932-6?mailto=christian.hauschke@tib.eu,2020,article,True,96,Innovation and Development of Ideological Education,Social Sciences,Education,Springer Science+Business Media,False,en,Social Sciences,
https://openalex.org/W3034166735,Gut Microbiome Dysbiosis and Depression: a Comprehensive Review,Current Pain and Headache Reports,32,https://doi.org/10.1007/s11916-020-00871-x,https://api.labs.crossref.org/works/https://doi.org/10.1007/s11916-020-00871-x?mailto=christian.hauschke@tib.eu,2020,article,True,96,Diversity and Function of Gut Microbiome,Life Sciences,Molecular Biology,Springer Science+Business Media,False,en,"Biochemistry, Genetics and Molecular Biology",
https://openalex.org/W3044695687,A tumor-microenvironment fully responsive nano-platform for MRI-guided photodynamic and photothermal synergistic therapy,Journal of Materials Chemistry B,32,https://doi.org/10.1039/d0tb01373k,https://api.labs.crossref.org/works/https://doi.org/10.1039/d0tb01373k?mailto=christian.hauschke@tib.eu,2020,article,True,96,Nanotechnology and Imaging for Cancer Therapy and Diagnosis,Physical Sciences,Biomedical Engineering,Royal Society of Chemistry,False,en,Engineering,
https://openalex.org/W3045256631,RETRACTED: Sustained delivery of epalrestat to the retina using PEGylated solid lipid nanoparticles laden contact lens,International Journal of Pharmaceutics,32,https://doi.org/10.1016/j.ijpharm.2020.119688,https://api.labs.crossref.org/works/https://doi.org/10.1016/j.ijpharm.2020.119688?mailto=christian.hauschke@tib.eu,2020,article,True,96,Diagnosis and Management of Dry Eye Disease,Health Sciences,"Public Health, Environmental and Occupational Health",Elsevier BV,False,en,Medicine,
https://openalex.org/W3047812111,Withdrawn: How perceived threat of Covid‐19 causes turnover intention among Pakistani nurses: A moderation and mediation analysis,International Journal of Mental Health Nursing,32,https://doi.org/10.1111/inm.12775,https://api.labs.crossref.org/works/https://doi.org/10.1111/inm.12775?mailto=christian.hauschke@tib.eu,2020,article,True,96,Psychological Resilience and Well-being,Social Sciences,Clinical Psychology,Wiley-Blackwell,True,en,Psychology,
https://openalex.org/W3048343582,RETRACTED ARTICLE: Acute necrotizing myelitis and acute motor axonal neuropathy in a COVID-19 patient,Journal of Neurology,32,https://doi.org/10.1007/s00415-020-10145-6,https://api.labs.crossref.org/works/https://doi.org/10.1007/s00415-020-10145-6?mailto=christian.hauschke@tib.eu,2020,article,True,96,Neurological Manifestations of COVID-19 Infection,Health Sciences,Neurology,Springer Science+Business Media,True,en,Medicine,
https://openalex.org/W3073352144,RETRACTED ARTICLE: Deep CNN framework for retinal disease diagnosis using optical coherence tomography images,Journal of Ambient Intelligence and Humanized Computing,32,https://doi.org/10.1007/s12652-020-02460-7,https://api.labs.crossref.org/works/https://doi.org/10.1007/s12652-020-02460-7?mailto=christian.hauschke@tib.eu,2020,article,True,96,Detection and Management of Retinal Diseases,Health Sciences,"Radiology, Nuclear Medicine and Imaging",Springer Science+Business Media,False,en,Medicine,
https://openalex.org/W2911455057,RETRACTED ARTICLE: Endoplasmic reticulum stress triggers Xanthoangelol-induced protective autophagy via activation of JNK/c-Jun Axis in hepatocellular carcinoma,Journal of Experimental & Clinical Cancer Research,31,https://doi.org/10.1186/s13046-018-1012-z,https://api.labs.crossref.org/works/https://doi.org/10.1186/s13046-018-1012-z?mailto=christian.hauschke@tib.eu,2019,article,True,96,Role of Autophagy in Disease and Health,Health Sciences,Epidemiology,BioMed Central,True,en,Medicine,
https://openalex.org/W2912114867,Φ memristor: Real memristor found,Journal of Applied Physics,31,https://doi.org/10.1063/1.5042281,https://api.labs.crossref.org/works/https://doi.org/10.1063/1.5042281?mailto=christian.hauschke@tib.eu,2019,article,True,96,Memristive Devices for Neuromorphic Computing,Physical Sciences,Electrical and Electronic Engineering,American Institute of Physics,True,en,Engineering,
https://openalex.org/W2913712917,"RETRACTED: ANRIL acts as onco-lncRNA by regulation of microRNA-24/c-Myc, MEK/ERK and Wnt/β-catenin pathway in retinoblastoma",International Journal of Biological Macromolecules,31,https://doi.org/10.1016/j.ijbiomac.2019.01.157,https://api.labs.crossref.org/works/https://doi.org/10.1016/j.ijbiomac.2019.01.157?mailto=christian.hauschke@tib.eu,2019,article,True,96,Role of Long Noncoding RNAs in Cancer and Development,Life Sciences,Cancer Research,Elsevier BV,False,en,"Biochemistry, Genetics and Molecular Biology",
https://openalex.org/W2914927502,Modulation of miR-10a-mediated TGF-β1/Smads signaling affects atrial fibrillation-induced cardiac fibrosis and cardiac fibroblast proliferation,Bioscience Reports,31,https://doi.org/10.1042/bsr20181931,https://api.labs.crossref.org/works/https://doi.org/10.1042/bsr20181931?mailto=christian.hauschke@tib.eu,2019,article,True,96,Molecular Mechanisms of Cardiac Remodeling and Repair,Health Sciences,Cardiology and Cardiovascular Medicine,Portland Press,True,en,Medicine,
https://openalex.org/W2916989671,"RETRACTED: On the conditional dependence structure between oil, gold and USD exchange rates: Nested copula based GJR-GARCH model",Energy Economics,31,https://doi.org/10.1016/j.eneco.2019.02.002,https://api.labs.crossref.org/works/https://doi.org/10.1016/j.eneco.2019.02.002?mailto=christian.hauschke@tib.eu,2019,article,True,96,Impact of Oil Price Shocks on Economy,Social Sciences,Economics and Econometrics,Elsevier BV,True,en,"Economics, Econometrics and Finance",
https://openalex.org/W2921075432,RETRACTED: Ginsenoside Rh2 inhibits proliferation but promotes apoptosis and autophagy by down-regulating microRNA-638 in human retinoblastoma cells,Experimental and Molecular Pathology,31,https://doi.org/10.1016/j.yexmp.2019.03.004,https://api.labs.crossref.org/works/https://doi.org/10.1016/j.yexmp.2019.03.004?mailto=christian.hauschke@tib.eu,2019,article,True,96,Molecular Mechanisms and Medical Applications of Ginseng,Life Sciences,Molecular Biology,Elsevier BV,False,en,"Biochemistry, Genetics and Molecular Biology",
https://openalex.org/W2921936025,Prevalence of microplastic pollution in the Northwestern Pacific Ocean,Chemosphere,31,https://doi.org/10.1016/j.chemosphere.2019.03.076,https://api.labs.crossref.org/works/https://doi.org/10.1016/j.chemosphere.2019.03.076?mailto=christian.hauschke@tib.eu,2019,article,True,96,Microplastic Pollution in Marine and Terrestrial Environments,Physical Sciences,Pollution,Elsevier BV,False,en,Environmental Science,
https://openalex.org/W2927991437,"RETRACTED: lncRNA PEG10 promotes cell survival, invasion and migration by sponging miR-134 in human bladder cancer",Biomedicine & Pharmacotherapy,31,https://doi.org/10.1016/j.biopha.2019.108814,https://api.labs.crossref.org/works/https://doi.org/10.1016/j.biopha.2019.108814?mailto=christian.hauschke@tib.eu,2019,article,True,96,Role of Long Noncoding RNAs in Cancer and Development,Life Sciences,Cancer Research,Elsevier BV,True,en,"Biochemistry, Genetics and Molecular Biology",
https://openalex.org/W2954315756,<i>Retracted:</i> Long noncoding RNA NORAD is upregulated in epithelial ovarian cancer and its downregulation suppressed cancer cell functions by competing with miR‐155‐5p,Cancer Medicine,31,https://doi.org/10.1002/cam4.2350,https://api.labs.crossref.org/works/https://doi.org/10.1002/cam4.2350?mailto=christian.hauschke@tib.eu,2019,article,True,96,Role of Long Noncoding RNAs in Cancer and Development,Life Sciences,Cancer Research,Wiley,True,en,"Biochemistry, Genetics and Molecular Biology",
https://openalex.org/W2959762903,RETRACTED ARTICLE: Loss of exosomal MALAT1 from ox-LDL-treated vascular endothelial cells induces maturation of dendritic cells in atherosclerosis development,Cell Cycle,31,https://doi.org/10.1080/15384101.2019.1642068,https://api.labs.crossref.org/works/https://doi.org/10.1080/15384101.2019.1642068?mailto=christian.hauschke@tib.eu,2019,article,True,96,Role of Long Noncoding RNAs in Cancer and Development,Life Sciences,Cancer Research,Taylor & Francis,True,en,"Biochemistry, Genetics and Molecular Biology",
https://openalex.org/W2971992186,Strengthening public health surveillance through blockchain technology,AIMS public health,31,https://doi.org/10.3934/publichealth.2019.3.326,https://api.labs.crossref.org/works/https://doi.org/10.3934/publichealth.2019.3.326?mailto=christian.hauschke@tib.eu,2019,article,True,96,Blockchain and Internet of Things Integration,Physical Sciences,Information Systems,AIMS Press,True,en,Computer Science,
https://openalex.org/W2972738266,RETRACTED: HBV-encoded miR-2 functions as an oncogene by downregulating TRIM35 but upregulating RAN in liver cancer cells,EBioMedicine,31,https://doi.org/10.1016/j.ebiom.2019.09.012,https://api.labs.crossref.org/works/https://doi.org/10.1016/j.ebiom.2019.09.012?mailto=christian.hauschke@tib.eu,2019,article,True,96,Mechanisms and Applications of RNA Interference,Life Sciences,Molecular Biology,Elsevier BV,True,en,"Biochemistry, Genetics and Molecular Biology",
https://openalex.org/W2987967772,&lt;p&gt;MicroRNA-139-3p Inhibits The Growth And Metastasis Of Ovarian Cancer By Inhibiting ELAVL1&lt;/p&gt;,OncoTargets and Therapy,31,https://doi.org/10.2147/ott.s210739,https://api.labs.crossref.org/works/https://doi.org/10.2147/ott.s210739?mailto=christian.hauschke@tib.eu,2019,article,True,96,Role of Long Noncoding RNAs in Cancer and Development,Life Sciences,Cancer Research,Dove Medical Press,True,en,"Biochemistry, Genetics and Molecular Biology",
https://openalex.org/W2996860690,Long non-coding RNA HOXA11-AS accelerates the progression of keloid formation via miR-124-3p/TGFβR1 axis,Cell Cycle,31,https://doi.org/10.1080/15384101.2019.1706921,https://api.labs.crossref.org/works/https://doi.org/10.1080/15384101.2019.1706921?mailto=christian.hauschke@tib.eu,2019,article,True,96,Skin Scarring and Remodeling Mechanisms,Health Sciences,Dermatology,Taylor & Francis,True,en,Medicine,
https://openalex.org/W3004859286,RETRACTED: An efficient control strategy for optimal power flow management from a renewable energy source to a generalized three-phase microgrid system: A hybrid squirrel search algorithm with whale optimization algorithm approach,Transactions of the Institute of Measurement and Control,31,https://doi.org/10.1177/0142331220901628,https://api.labs.crossref.org/works/https://doi.org/10.1177/0142331220901628?mailto=christian.hauschke@tib.eu,2020,article,True,96,Control and Synchronization in Microgrid Systems,Physical Sciences,Control and Systems Engineering,SAGE Publishing,False,en,Engineering,
https://openalex.org/W3008716721,RETRACTED ARTICLE: Localization and segmentation of metal cracks using deep learning,Journal of Ambient Intelligence and Humanized Computing,31,https://doi.org/10.1007/s12652-020-01803-8,https://api.labs.crossref.org/works/https://doi.org/10.1007/s12652-020-01803-8?mailto=christian.hauschke@tib.eu,2020,article,True,96,Fabric Defect Detection in Industrial Applications,Physical Sciences,Industrial and Manufacturing Engineering,Springer Science+Business Media,False,en,Engineering,
https://openalex.org/W3011658185,RETRACTED ARTICLE: HBx/ERα complex-mediated LINC01352 downregulation promotes HBV-related hepatocellular carcinoma via the miR-135b-APC axis,Oncogene,31,https://doi.org/10.1038/s41388-020-1254-z,https://api.labs.crossref.org/works/https://doi.org/10.1038/s41388-020-1254-z?mailto=christian.hauschke@tib.eu,2020,article,True,96,Role of Long Noncoding RNAs in Cancer and Development,Life Sciences,Cancer Research,Springer Nature,False,en,"Biochemistry, Genetics and Molecular Biology",
https://openalex.org/W3030276127,RETRACTED ARTICLE: Classification of lung cancer stages with machine learning over big data healthcare framework,Journal of Ambient Intelligence and Humanized Computing,31,https://doi.org/10.1007/s12652-020-02071-2,https://api.labs.crossref.org/works/https://doi.org/10.1007/s12652-020-02071-2?mailto=christian.hauschke@tib.eu,2020,article,True,96,Radiomics in Medical Imaging Analysis,Health Sciences,"Radiology, Nuclear Medicine and Imaging",Springer Science+Business Media,False,en,Medicine,
https://openalex.org/W3036883674,<i>Retracted</i>: lncRNA PVT1 promotes the migration of gastric cancer by functioning as ceRNA of miR‐30a and regulating Snail,Journal of Cellular Physiology,31,https://doi.org/10.1002/jcp.29881,https://api.labs.crossref.org/works/https://doi.org/10.1002/jcp.29881?mailto=christian.hauschke@tib.eu,2020,article,True,96,Role of Long Noncoding RNAs in Cancer and Development,Life Sciences,Cancer Research,Wiley,False,en,"Biochemistry, Genetics and Molecular Biology",
https://openalex.org/W3041272031,Chitosan-Based Microparticles Enhance Ellagic Acid’s Colon Targeting and Proapoptotic Activity,Pharmaceutics,31,https://doi.org/10.3390/pharmaceutics12070652,https://api.labs.crossref.org/works/https://doi.org/10.3390/pharmaceutics12070652?mailto=christian.hauschke@tib.eu,2020,article,True,96,Health Benefits of Pomegranate Consumption,Health Sciences,Nutrition and Dietetics,Multidisciplinary Digital Publishing Institute,True,en,Nursing,
https://openalex.org/W3044937183,Using a deep recurrent neural network with EEG signal to detect Parkinson’s disease,Annals of Translational Medicine,31,https://doi.org/10.21037/atm-20-5100,https://api.labs.crossref.org/works/https://doi.org/10.21037/atm-20-5100?mailto=christian.hauschke@tib.eu,2020,article,True,96,Pathophysiology of Parkinson's Disease,Health Sciences,Neurology,AME Publishing Company,True,en,Medicine,
https://openalex.org/W3045040368,RETRACTED: Macroporous photothermal bilayer evaporator for highly efficient and self-cleaning solar desalination,Nano Energy,31,https://doi.org/10.1016/j.nanoen.2020.105130,https://api.labs.crossref.org/works/https://doi.org/10.1016/j.nanoen.2020.105130?mailto=christian.hauschke@tib.eu,2020,article,True,96,Solar-Powered Water Desalination Technologies,Physical Sciences,"Renewable Energy, Sustainability and the Environment",Elsevier BV,False,en,Energy,
https://openalex.org/W3112496205,WITHDRAWN: Machine learning models for covid-19 future forecasting,Materials Today: Proceedings,31,https://doi.org/10.1016/j.matpr.2020.10.962,https://api.labs.crossref.org/works/https://doi.org/10.1016/j.matpr.2020.10.962?mailto=christian.hauschke@tib.eu,2020,article,True,96,Applications of Deep Learning in Medical Imaging,Health Sciences,"Radiology, Nuclear Medicine and Imaging",Elsevier BV,True,en,Medicine,
https://openalex.org/W3116377134,Regulation of Mitochondrial Quality Control by Natural Drugs in the Treatment of Cardiovascular Diseases: Potential and Advantages,Frontiers in Cell and Developmental Biology,31,https://doi.org/10.3389/fcell.2020.616139,https://api.labs.crossref.org/works/https://doi.org/10.3389/fcell.2020.616139?mailto=christian.hauschke@tib.eu,2020,article,True,96,Mitochondrial Dynamics and Reactive Oxygen Species Regulation,Life Sciences,Molecular Biology,Frontiers Media,True,en,"Biochemistry, Genetics and Molecular Biology",
https://openalex.org/W2997579509,RETRACTED: LncRNA DANCR silence inhibits SOX5-medicated progression and autophagy in osteosarcoma via regulating miR-216a-5p,Biomedicine & Pharmacotherapy,30,https://doi.org/10.1016/j.biopha.2019.109707,https://api.labs.crossref.org/works/https://doi.org/10.1016/j.biopha.2019.109707?mailto=christian.hauschke@tib.eu,2020,article,True,96,Role of Long Noncoding RNAs in Cancer and Development,Life Sciences,Cancer Research,Elsevier BV,True,en,"Biochemistry, Genetics and Molecular Biology",
https://openalex.org/W2999089109,RETRACTED: circRASSF2 Acts as ceRNA and Promotes Papillary Thyroid Carcinoma Progression through miR-1178/TLR4 Signaling Pathway,Molecular Therapy - Nucleic Acids,30,https://doi.org/10.1016/j.omtn.2019.11.037,https://api.labs.crossref.org/works/https://doi.org/10.1016/j.omtn.2019.11.037?mailto=christian.hauschke@tib.eu,2020,article,True,96,Biogenesis and Functions of Circular RNAs,Life Sciences,Molecular Biology,Cell Press,True,en,"Biochemistry, Genetics and Molecular Biology",
https://openalex.org/W3000475305,RETRACTED ARTICLE: Bimatoprost Imprinted Silicone Contact Lens to Treat Glaucoma,AAPS PharmSciTech,30,https://doi.org/10.1208/s12249-020-1622-6,https://api.labs.crossref.org/works/https://doi.org/10.1208/s12249-020-1622-6?mailto=christian.hauschke@tib.eu,2020,article,True,96,Diagnosis and Management of Dry Eye Disease,Health Sciences,"Public Health, Environmental and Occupational Health",Springer Science+Business Media,False,en,Medicine,
https://openalex.org/W3000704961,Retracted: Design and fabrication of electrospun SBA-15-incorporated PVA with curcumin: a biomimetic nanoscaffold for skin tissue engineering,Biomedical Materials,30,https://doi.org/10.1088/1748-605x/ab6b2f,https://api.labs.crossref.org/works/https://doi.org/10.1088/1748-605x/ab6b2f?mailto=christian.hauschke@tib.eu,2020,article,True,96,Electrospun Nanofibers in Biomedical Applications,Physical Sciences,Biomaterials,IOP Publishing,False,en,Materials Science,
https://openalex.org/W3011770981,"RETRACTION NOTICE: Mechanical, microstructural properties and cell adhesion of Sr/Se-hydroxyapatite/graphene/polycaprolactone nanofibers",Journal of Thermoplastic Composite Materials,30,https://doi.org/10.1177/0892705720912781,https://api.labs.crossref.org/works/https://doi.org/10.1177/0892705720912781?mailto=christian.hauschke@tib.eu,2020,article,True,96,Bone Tissue Engineering and Biomaterials,Physical Sciences,Biomedical Engineering,SAGE Publishing,False,en,Engineering,
https://openalex.org/W3015696786,CDK4/6 inhibition suppresses tumour growth and enhances the effect of temozolomide in glioma cells,Journal of Cellular and Molecular Medicine,30,https://doi.org/10.1111/jcmm.15156,https://api.labs.crossref.org/works/https://doi.org/10.1111/jcmm.15156?mailto=christian.hauschke@tib.eu,2020,article,True,96,Gliomas,Health Sciences,Genetics,Wiley-Blackwell,True,en,Medicine,
