id,display_name,primary_location_display_name,cited_by_count,doi,crossref_call,publication_year,type,is_retracted,cited_by_percentile_year_min,primary_topic_display_name,primary_topic_domain_display_name,primary_topic_subfield_display_name,primary_location_source_host_organization_name,open_access_is_oa,language,primary_topic_field_display_name,update_nature
https://openalex.org/W3217612771,The Analysis about Compressed Sensing Reconstruction Algorithm Based on Machine Learning Applied in Interference Multispectral Images,Advances in multimedia,1,https://doi.org/10.1155/2021/8020473,https://api.labs.crossref.org/works/https://doi.org/10.1155/2021/8020473?mailto=christian.hauschke@tib.eu,2021,article,True,65,Image Denoising Techniques and Algorithms,Physical Sciences,Computer Vision and Pattern Recognition,Hindawi Publishing Corporation,True,en,Computer Science,Retraction
https://openalex.org/W3217613253,Data Mining-Based Stability and Prescription Analysis of Neonatal Parenteral Nutrition Solution,Journal of Healthcare Engineering,1,https://doi.org/10.1155/2021/5744656,https://api.labs.crossref.org/works/https://doi.org/10.1155/2021/5744656?mailto=christian.hauschke@tib.eu,2021,article,True,65,Provision and Assessment of Nutrition Support Therapy,Health Sciences,Nutrition and Dietetics,Hindawi Publishing Corporation,True,en,Nursing,Retraction
https://openalex.org/W3217710462,Detection and Analysis of Man-Machine Interactive Software Vulnerabilities Based on Ultrasonic Data Acquisition and Signal Processing Algorithms,Advances in multimedia,1,https://doi.org/10.1155/2021/7684146,https://api.labs.crossref.org/works/https://doi.org/10.1155/2021/7684146?mailto=christian.hauschke@tib.eu,2021,article,True,65,Characterization and Detection of Android Malware,Physical Sciences,Signal Processing,Hindawi Publishing Corporation,True,en,Computer Science,Retraction
https://openalex.org/W3217729425,Safety Risk Evaluation of Construction Site Based on Unascertained Measure and Analytic Hierarchy Process,Discrete Dynamics in Nature and Society,1,https://doi.org/10.1155/2021/7172938,https://api.labs.crossref.org/works/https://doi.org/10.1155/2021/7172938?mailto=christian.hauschke@tib.eu,2021,article,True,65,Enhancing Workplace Safety Culture and Practices,Health Sciences,Radiological and Ultrasound Technology,Hindawi Publishing Corporation,True,en,Health Professions,Retraction
https://openalex.org/W3217757673,RETRACTED ARTICLE: Evaluation of air pollution and business English vocabulary translation in coastal cities based on distributed storage,Arabian Journal of Geosciences,1,https://doi.org/10.1007/s12517-021-08062-7,https://api.labs.crossref.org/works/https://doi.org/10.1007/s12517-021-08062-7?mailto=christian.hauschke@tib.eu,2021,article,True,65,Knowledge Base Graph Embedding for Visual Question Answering,Physical Sciences,Artificial Intelligence,Springer Science+Business Media,True,en,Computer Science,Expression of concern;Retraction;Crossmark Retraction
https://openalex.org/W3217807013,Design and Research on the Foul Detector of a Long Jump Jumping Line Based on a Vision Sensor,Journal of Sensors,1,https://doi.org/10.1155/2021/8364194,https://api.labs.crossref.org/works/https://doi.org/10.1155/2021/8364194?mailto=christian.hauschke@tib.eu,2021,article,True,65,Dynamics of Urban Structure through Spatial Network Analysis,Social Sciences,Urban Studies,Hindawi Publishing Corporation,True,en,Social Sciences,Retraction
https://openalex.org/W331450270,"Bis(2,2′-bipyridyl-κ<sup>2</sup><i>N</i>,<i>N</i>′)bis(isothiocyanato-κ<i>N</i>)copper(II)",Acta Crystallographica Section E-structure Reports Online,1,https://doi.org/10.1107/s1600536807033181,https://api.labs.crossref.org/works/https://doi.org/10.1107/s1600536807033181?mailto=christian.hauschke@tib.eu,2007,article,True,68,Chemical Crystallography,Physical Sciences,Inorganic Chemistry,International Union of Crystallography,False,en,Chemistry,Retraction
https://openalex.org/W4200003247,Congenital Cataract Surgery: A Retrospective Analysis of 62 Patients in a Developing Country,Computational and Mathematical Methods in Medicine,1,https://doi.org/10.1155/2021/6431276,https://api.labs.crossref.org/works/https://doi.org/10.1155/2021/6431276?mailto=christian.hauschke@tib.eu,2021,article,True,65,Cataract Surgery Techniques and Complications,Health Sciences,Ophthalmology,Hindawi Publishing Corporation,True,en,Medicine,Retraction
https://openalex.org/W4200030520,Evaluation of the Effect of Intensive Nursing Intervention Based on Process Analysis,Computational and Mathematical Methods in Medicine,1,https://doi.org/10.1155/2021/8769780,https://api.labs.crossref.org/works/https://doi.org/10.1155/2021/8769780?mailto=christian.hauschke@tib.eu,2021,article,True,65,Smart Refrigerators and IoT Applications,Physical Sciences,Media Technology,Hindawi Publishing Corporation,True,en,Engineering,Retraction
https://openalex.org/W4200042988,Digital Image Automatic Recognition and Tracking Based on Electronic Derotation Algorithm,Advances in multimedia,1,https://doi.org/10.1155/2021/6111812,https://api.labs.crossref.org/works/https://doi.org/10.1155/2021/6111812?mailto=christian.hauschke@tib.eu,2021,article,True,65,Automatic License Plate Recognition System,Physical Sciences,Media Technology,Hindawi Publishing Corporation,True,en,Engineering,Retraction
https://openalex.org/W4200056383,RETRACTED: Research progress in the estimation of postmortem interval (PMI) using non-coding RNA (ncRNA) markers,"Medicine, Science and the Law",1,https://doi.org/10.1177/00258024211064404,https://api.labs.crossref.org/works/https://doi.org/10.1177/00258024211064404?mailto=christian.hauschke@tib.eu,2021,article,True,65,Real-Time Polymerase Chain Reaction,Life Sciences,Molecular Biology,SAGE Publishing,False,en,"Biochemistry, Genetics and Molecular Biology",Retraction
https://openalex.org/W4200069015,Hysteretic Energy Demand under Superposition of Bidirectional Ground Motions,Discrete Dynamics in Nature and Society,1,https://doi.org/10.1155/2021/4623414,https://api.labs.crossref.org/works/https://doi.org/10.1155/2021/4623414?mailto=christian.hauschke@tib.eu,2021,article,True,65,Seismic Engineering and Ground Motion Analysis,Physical Sciences,Civil and Structural Engineering,Hindawi Publishing Corporation,True,en,Engineering,Retraction
https://openalex.org/W4200074484,Influence of Diversity Nursing on Patients’ Rehabilitation in Cardiology Treatment,Journal of Healthcare Engineering,1,https://doi.org/10.1155/2021/5606660,https://api.labs.crossref.org/works/https://doi.org/10.1155/2021/5606660?mailto=christian.hauschke@tib.eu,2021,article,True,65,Epidemiology and Prevention of Cardiovascular Diseases in Russia,Health Sciences,Epidemiology,Hindawi Publishing Corporation,True,en,Medicine,Retraction
https://openalex.org/W4200077034,Diagnostic Value of Prenatal Ultrasound Parameters and Esophageal Signs in Pouch and Lower Thoracic Segment in Fetuses with Esophageal Atresia,Computational and Mathematical Methods in Medicine,1,https://doi.org/10.1155/2021/8107461,https://api.labs.crossref.org/works/https://doi.org/10.1155/2021/8107461?mailto=christian.hauschke@tib.eu,2021,article,True,65,Esophageal Intervention Techniques,Health Sciences,Surgery,Hindawi Publishing Corporation,True,en,Medicine,Retraction
https://openalex.org/W4200084970,Fast and Accurate Position Determination of Multimodal Couplings of Steel Rolling Machinery and Equipment Combined with Multimedia Optimized Particle Filters,Advances in multimedia,1,https://doi.org/10.1155/2021/3693503,https://api.labs.crossref.org/works/https://doi.org/10.1155/2021/3693503?mailto=christian.hauschke@tib.eu,2021,article,True,65,Optoelectronic Systems for Measurement and Detection,Physical Sciences,Electrical and Electronic Engineering,Hindawi Publishing Corporation,True,en,Engineering,Retraction
https://openalex.org/W4200101786,Research on Automobile Assembly Line Optimization Based on Industrial Engineering Technology and Machine Learning Algorithm,Wireless Communications and Mobile Computing,1,https://doi.org/10.1155/2021/2658090,https://api.labs.crossref.org/works/https://doi.org/10.1155/2021/2658090?mailto=christian.hauschke@tib.eu,2021,article,True,65,Optimization of Assembly Line Balancing Problems,Physical Sciences,Industrial and Manufacturing Engineering,Wiley,True,en,Engineering,Retraction
https://openalex.org/W4200106015,Research on Design and Application of National Fitness System,Journal of Mathematics,1,https://doi.org/10.1155/2021/5178550,https://api.labs.crossref.org/works/https://doi.org/10.1155/2021/5178550?mailto=christian.hauschke@tib.eu,2021,article,True,65,Drivers and Impediments for Cross-Border E-Commerce,Social Sciences,Business and International Management,Hindawi Publishing Corporation,True,en,"Business, Management and Accounting",Retraction
https://openalex.org/W4200107665,RETRACTED: The Application of Innovation Visual Animation Media (VAM) at Electrical in Automotive Vocational Education,Journal of Physics: Conference Series,1,https://doi.org/10.1088/1742-6596/2111/1/012007,https://api.labs.crossref.org/works/https://doi.org/10.1088/1742-6596/2111/1/012007?mailto=christian.hauschke@tib.eu,2021,article,True,65,Gamification in Education and Learning,Social Sciences,Developmental and Educational Psychology,IOP Publishing,True,en,Psychology,Retraction
https://openalex.org/W4200111749,Virtual Simulation Management of Data Traffic Optimization of Big Data Cloud Platform considering Multipoint Mapping Algorithm,Advances in multimedia,1,https://doi.org/10.1155/2021/4893145,https://api.labs.crossref.org/works/https://doi.org/10.1155/2021/4893145?mailto=christian.hauschke@tib.eu,2021,article,True,65,Wireless Communication Technologies,Physical Sciences,Electrical and Electronic Engineering,Hindawi Publishing Corporation,True,en,Engineering,Retraction
https://openalex.org/W4200112674,RETRACTED: Financial Instruments to Improve the Competitiveness of Enterprises,Global Business Review,1,https://doi.org/10.1177/09721509211060638,https://api.labs.crossref.org/works/https://doi.org/10.1177/09721509211060638?mailto=christian.hauschke@tib.eu,2021,article,True,65,Concept and Measurement of Regional Competitiveness,Social Sciences,Strategy and Management,SAGE Publishing,False,en,"Business, Management and Accounting",Crossmark Retraction
https://openalex.org/W4200128606,Wireless Radio Frequency Automation of Intelligent Optical Fiber Transmission System Based on the Differential Evolution Method,Advances in multimedia,1,https://doi.org/10.1155/2021/1802001,https://api.labs.crossref.org/works/https://doi.org/10.1155/2021/1802001?mailto=christian.hauschke@tib.eu,2021,article,True,65,Non-contact Physiological Monitoring Technology,Physical Sciences,Biomedical Engineering,Hindawi Publishing Corporation,True,en,Engineering,Retraction
https://openalex.org/W4200131734,Micromedia News Dissemination Impact Assessment Integrated with Personalized Recommendation Algorithm,Advances in multimedia,1,https://doi.org/10.1155/2021/5621864,https://api.labs.crossref.org/works/https://doi.org/10.1155/2021/5621864?mailto=christian.hauschke@tib.eu,2021,article,True,65,Recommender System Technologies,Physical Sciences,Information Systems,Hindawi Publishing Corporation,True,en,Computer Science,Retraction
https://openalex.org/W4200137845,A Basketball Technique Balance Control Technology Based on Ant Colony Algorithm,Security and Communication Networks,1,https://doi.org/10.1155/2021/6559098,https://api.labs.crossref.org/works/https://doi.org/10.1155/2021/6559098?mailto=christian.hauschke@tib.eu,2021,article,True,65,Sports Science and Performance Analysis,Health Sciences,Orthopedics and Sports Medicine,Hindawi Publishing Corporation,True,en,Medicine,Retraction
https://openalex.org/W4200147559,Comparison of the Meta-Active Machine Learning Model Applied to Biological Data-Driven Experiments with Other Models,Journal of Healthcare Engineering,1,https://doi.org/10.1155/2021/8014850,https://api.labs.crossref.org/works/https://doi.org/10.1155/2021/8014850?mailto=christian.hauschke@tib.eu,2021,article,True,65,Active Learning in Machine Learning Research,Physical Sciences,Artificial Intelligence,Hindawi Publishing Corporation,True,en,Computer Science,Retraction
https://openalex.org/W4200167641,Colonic Angiolipoma: An Extremely Rare Tumor Clinically Masquerading as Acute Appendicitis,Cureus,1,https://doi.org/10.7759/cureus.20659,https://api.labs.crossref.org/works/https://doi.org/10.7759/cureus.20659?mailto=christian.hauschke@tib.eu,2021,article,True,65,Omental Pathologies and Mimicking Conditions,Health Sciences,Rheumatology,"Cureus, Inc.",True,en,Medicine,Retraction;Expression of concern
https://openalex.org/W4200188870,Controlled Hypotension Combined with Femoral Nerve Block for Knee Replacement without Tourniquet,Journal of Healthcare Engineering,1,https://doi.org/10.1155/2021/3219337,https://api.labs.crossref.org/works/https://doi.org/10.1155/2021/3219337?mailto=christian.hauschke@tib.eu,2021,article,True,65,Effects of Blood Transfusion in Clinical Practice,Health Sciences,Biochemistry,Hindawi Publishing Corporation,True,en,Medicine,Retraction
https://openalex.org/W4200213433,The Value of Iterative Reconstruction of Algorithm-Based Coronary Artery Computed Tomography Imaging in the Diagnosis of Old Myocardial Infarction,Journal of Healthcare Engineering,1,https://doi.org/10.1155/2021/4383963,https://api.labs.crossref.org/works/https://doi.org/10.1155/2021/4383963?mailto=christian.hauschke@tib.eu,2021,article,True,65,Dual-Energy Computed Tomography,Physical Sciences,Biomedical Engineering,Hindawi Publishing Corporation,True,en,Engineering,Retraction
https://openalex.org/W4200214931,"Some Study of Semigroups of<math xmlns=""http://www.w3.org/1998/Math/MathML"" id=""M1""><mi mathvariant=""bold"">h</mi></math>-Bi-Ideals of Semirings",Computational and Mathematical Methods in Medicine,1,https://doi.org/10.1155/2021/9908175,https://api.labs.crossref.org/works/https://doi.org/10.1155/2021/9908175?mailto=christian.hauschke@tib.eu,2021,article,True,65,Application of Soft Set Theory in Decision Making,Social Sciences,Management Science and Operations Research,Hindawi Publishing Corporation,True,en,Decision Sciences,Retraction
https://openalex.org/W4200241053,Abdominal Cocoon: A Rare Complication of Peritoneal Dialysis in Chronic Kidney Disease,Cureus,1,https://doi.org/10.7759/cureus.20341,https://api.labs.crossref.org/works/https://doi.org/10.7759/cureus.20341?mailto=christian.hauschke@tib.eu,2021,article,True,65,Chronic Kidney Disease and Dialysis Treatment,Health Sciences,Nephrology,"Cureus, Inc.",True,en,Medicine,Retraction;Expression of concern
https://openalex.org/W4200246232,The Mechanism of α2-macroglobulin Against Oxidative Stress and Promoting Cell Proliferation in Intervertebral Disc Degeneration,Bioengineered,1,https://doi.org/10.1080/21655979.2021.2011638,https://api.labs.crossref.org/works/https://doi.org/10.1080/21655979.2021.2011638?mailto=christian.hauschke@tib.eu,2021,article,True,65,Pathophysiology of Lumbar Disc Degeneration and Treatment,Health Sciences,Pathology and Forensic Medicine,Taylor & Francis,True,en,Medicine,Reinstatement;Retraction
https://openalex.org/W4200262789,Relieving the Incompatibility of Network Representation and Classification for Long-Tailed Data Distribution,Computational Intelligence and Neuroscience,1,https://doi.org/10.1155/2021/6702625,https://api.labs.crossref.org/works/https://doi.org/10.1155/2021/6702625?mailto=christian.hauschke@tib.eu,2021,article,True,65,Advances in Transfer Learning and Domain Adaptation,Physical Sciences,Artificial Intelligence,Hindawi Publishing Corporation,True,en,Computer Science,Retraction
https://openalex.org/W4200268908,Rapid Classification and Analysis for E-Commerce Goods Based on Multitask Learning,Security and Communication Networks,1,https://doi.org/10.1155/2021/1725544,https://api.labs.crossref.org/works/https://doi.org/10.1155/2021/1725544?mailto=christian.hauschke@tib.eu,2021,article,True,65,Innovation and Development of Ideological Education,Social Sciences,Education,Hindawi Publishing Corporation,True,en,Social Sciences,Retraction
https://openalex.org/W4200273493,RETRACTED: Design of Double-effect Propulsion System for News Broadcast Based on Artificial Intelligence and Virtual Host Technology,Journal of Physics: Conference Series,1,https://doi.org/10.1088/1742-6596/2074/1/012096,https://api.labs.crossref.org/works/https://doi.org/10.1088/1742-6596/2074/1/012096?mailto=christian.hauschke@tib.eu,2021,article,True,65,Knowledge Base Graph Embedding for Visual Question Answering,Physical Sciences,Artificial Intelligence,IOP Publishing,True,en,Computer Science,Retraction
https://openalex.org/W4200273708,RETRACTED: Application of Keras neural network in the era of big data,Journal of Physics: Conference Series,1,https://doi.org/10.1088/1742-6596/2083/4/042090,https://api.labs.crossref.org/works/https://doi.org/10.1088/1742-6596/2083/4/042090?mailto=christian.hauschke@tib.eu,2021,article,True,65,Optimization of Belt Conveyor Systems,Physical Sciences,Mechanical Engineering,IOP Publishing,True,en,Engineering,Retraction
https://openalex.org/W4200284393,Retraction—Hidden harm,The Lancet,1,https://doi.org/10.1016/s0140-6736(21)02185-1,https://api.labs.crossref.org/works/https://doi.org/10.1016/s0140-6736(21)02185-1?mailto=christian.hauschke@tib.eu,2021,article,True,65,Pheochromocytoma and Paraganglioma,Health Sciences,Surgery,Elsevier BV,True,en,Medicine,
https://openalex.org/W4200289702,"Detection and Genotyping of Francisella tularensis in Animal Hosts and Vectors from Six Different Natural Landscape Areas, Gansu Province, China",Computational and Mathematical Methods in Medicine,1,https://doi.org/10.1155/2021/6820864,https://api.labs.crossref.org/works/https://doi.org/10.1155/2021/6820864?mailto=christian.hauschke@tib.eu,2021,article,True,65,Biological Agents for Bioterrorism,Life Sciences,Molecular Biology,Hindawi Publishing Corporation,True,en,"Biochemistry, Genetics and Molecular Biology",Retraction
https://openalex.org/W4200289904,Computer Multimedia Art Pattern Creation Based on P-Filling Algorithm,Advances in multimedia,1,https://doi.org/10.1155/2021/8143000,https://api.labs.crossref.org/works/https://doi.org/10.1155/2021/8143000?mailto=christian.hauschke@tib.eu,2021,article,True,65,Shape Matching and Object Recognition,Physical Sciences,Computer Vision and Pattern Recognition,Hindawi Publishing Corporation,True,en,Computer Science,Retraction
https://openalex.org/W4200292326,LncRNA FOXD3-AS1 Promotes Tumorigenesis of Glioma via Targeting miR-128-3p/SZRD1 Axis,Cancer management and research,1,https://doi.org/10.2147/cmar.s324920,https://api.labs.crossref.org/works/https://doi.org/10.2147/cmar.s324920?mailto=christian.hauschke@tib.eu,2021,article,True,65,Role of Long Noncoding RNAs in Cancer and Development,Life Sciences,Cancer Research,Dove Medical Press,True,en,"Biochemistry, Genetics and Molecular Biology",Retraction
https://openalex.org/W4200295511,Research on High Robust Multimedia Image Encryption Based on Gyrator Transform Domain Model,Advances in multimedia,1,https://doi.org/10.1155/2021/2225114,https://api.labs.crossref.org/works/https://doi.org/10.1155/2021/2225114?mailto=christian.hauschke@tib.eu,2021,article,True,65,Chaos-based Image Encryption Techniques,Physical Sciences,Computer Vision and Pattern Recognition,Hindawi Publishing Corporation,True,en,Computer Science,Retraction
https://openalex.org/W4200296034,Research on the Path of Network Opinion Expression in AI Environment for College Students,Computational and Mathematical Methods in Medicine,1,https://doi.org/10.1155/2021/4360792,https://api.labs.crossref.org/works/https://doi.org/10.1155/2021/4360792?mailto=christian.hauschke@tib.eu,2021,article,True,65,Sentiment Analysis and Opinion Mining,Physical Sciences,Artificial Intelligence,Hindawi Publishing Corporation,True,en,Computer Science,Retraction
https://openalex.org/W4200306488,Multiweight Cross-Multimedia Logistics Optimal Path Exploration by Integrating High-Dimensional Deep Learning,Advances in multimedia,1,https://doi.org/10.1155/2021/1474341,https://api.labs.crossref.org/works/https://doi.org/10.1155/2021/1474341?mailto=christian.hauschke@tib.eu,2021,article,True,65,Innovations in Visual Communication Design and Technology,Physical Sciences,Computer Graphics and Computer-Aided Design,Hindawi Publishing Corporation,True,en,Computer Science,Retraction
https://openalex.org/W4200321325,Research on Precision Cultivation of Digital Multimedia Crop Based on Predictive Computational Intelligence Technology,Advances in multimedia,1,https://doi.org/10.1155/2021/2864009,https://api.labs.crossref.org/works/https://doi.org/10.1155/2021/2864009?mailto=christian.hauschke@tib.eu,2021,article,True,65,Precision Agriculture Technologies,Life Sciences,Plant Science,Hindawi Publishing Corporation,True,en,Agricultural and Biological Sciences,Retraction
https://openalex.org/W4200321834,RETRACTION NOTICE: Reconceptualising a Quandamooka Storyweave of language reclamation,International Journal of Cultural Studies,1,https://doi.org/10.1177/13678779211061069,https://api.labs.crossref.org/works/https://doi.org/10.1177/13678779211061069?mailto=christian.hauschke@tib.eu,2021,article,True,65,Translanguaging Pedagogy in Multilingual Education,Social Sciences,Linguistics and Language,SAGE Publishing,False,en,Social Sciences,Crossmark Retraction
https://openalex.org/W4200332429,Research on Application Adaptability of Big Data and IoT in Discipline Construction of Mechanical Engineering Specialty in Universities,Security and Communication Networks,1,https://doi.org/10.1155/2021/3130841,https://api.labs.crossref.org/works/https://doi.org/10.1155/2021/3130841?mailto=christian.hauschke@tib.eu,2021,article,True,65,Innovation and Development of Ideological Education,Social Sciences,Education,Hindawi Publishing Corporation,True,en,Social Sciences,Retraction
https://openalex.org/W4200341939,Optimal Fitting Method of Nonlinear Simultaneous Equations Considering Structural Tensor Image Modeling,Advances in multimedia,1,https://doi.org/10.1155/2021/6356899,https://api.labs.crossref.org/works/https://doi.org/10.1155/2021/6356899?mailto=christian.hauschke@tib.eu,2021,article,True,65,End-to-End Congestion Control in Networks,Physical Sciences,Computer Networks and Communications,Hindawi Publishing Corporation,True,en,Computer Science,Retraction
https://openalex.org/W4200343638,Lemierre’s Syndrome: A Case of Life-Threatening Infection From Family Medicine Practice,Cureus,1,https://doi.org/10.7759/cureus.20684,https://api.labs.crossref.org/works/https://doi.org/10.7759/cureus.20684?mailto=christian.hauschke@tib.eu,2021,article,True,65,Clinical Characteristics of Deep Neck Infections,Health Sciences,Infectious Diseases,"Cureus, Inc.",True,en,Medicine,Retraction;Expression of concern
https://openalex.org/W4200359405,Analysis and Study on the Quality of Life of Patients Undergoing Transcatheter Aortic Valve Replacement,Computational and Mathematical Methods in Medicine,1,https://doi.org/10.1155/2021/3147382,https://api.labs.crossref.org/works/https://doi.org/10.1155/2021/3147382?mailto=christian.hauschke@tib.eu,2021,article,True,65,Management of Valvular Heart Disease,Health Sciences,Cardiology and Cardiovascular Medicine,Hindawi Publishing Corporation,True,en,Medicine,Retraction
https://openalex.org/W4200360294,RETRACTED: Development of Nusselt number correlation in natural convection over the walls of a blast furnace: A CFD approach,"Proceedings of the Institution of Mechanical Engineers, Part E: Journal of Process Mechanical Engineering",1,https://doi.org/10.1177/09544089211063734,https://api.labs.crossref.org/works/https://doi.org/10.1177/09544089211063734?mailto=christian.hauschke@tib.eu,2021,article,True,65,Inverse Radiative Heat Transfer Analysis,Physical Sciences,Computational Mechanics,SAGE Publishing,False,en,Engineering,Retraction
https://openalex.org/W4200380333,Research on Modeling and Dynamic Characteristics of Complex Biological Neural Network Model considering BP Neural Network Method,Advances in multimedia,1,https://doi.org/10.1155/2021/7646121,https://api.labs.crossref.org/works/https://doi.org/10.1155/2021/7646121?mailto=christian.hauschke@tib.eu,2021,article,True,65,Neural Network Fundamentals and Applications,Physical Sciences,Artificial Intelligence,Hindawi Publishing Corporation,True,en,Computer Science,Retraction
https://openalex.org/W4200406459,RETRACTED: Construction of E-commerce Personalized Information Recommendation System in the Era of Big Data,Journal of Physics: Conference Series,1,https://doi.org/10.1088/1742-6596/2074/1/012085,https://api.labs.crossref.org/works/https://doi.org/10.1088/1742-6596/2074/1/012085?mailto=christian.hauschke@tib.eu,2021,article,True,65,Drivers and Impediments for Cross-Border E-Commerce,Social Sciences,Business and International Management,IOP Publishing,True,en,"Business, Management and Accounting",Retraction
https://openalex.org/W4200413955,Prediction of College Students’ Employment Rate Based on Gray System,Scientific Programming,1,https://doi.org/10.1155/2021/4182011,https://api.labs.crossref.org/works/https://doi.org/10.1155/2021/4182011?mailto=christian.hauschke@tib.eu,2021,article,True,65,Innovation and Development of Ideological Education,Social Sciences,Education,Hindawi Publishing Corporation,True,en,Social Sciences,Retraction
