id,display_name,primary_location_display_name,cited_by_count,doi,crossref_call,publication_year,type,is_retracted,cited_by_percentile_year_min,primary_topic_display_name,primary_topic_domain_display_name,primary_topic_subfield_display_name,primary_location_source_host_organization_name,open_access_is_oa,language,primary_topic_field_display_name,update_nature
https://openalex.org/W3015553419,СИНТЕЗ МАКРОЦИКЛИЧЕСКИХ ДЕПСИПЕПТИДОВ НА ОСНОВЕ ПАССЕРИНИ - «СLICK» СТРАТЕГИИ,Журнал органической химии,0,https://doi.org/10.31857/s0514749220040011,https://api.labs.crossref.org/works/https://doi.org/10.31857/s0514749220040011?mailto=christian.hauschke@tib.eu,2020,article,True,0,,,,Springer Science+Business Media,False,ru,,
https://openalex.org/W3015963341,Citrate stabilized Fe3O4/DMG modified carbon paste electrode for determination of octamethylcyclotetrasiloxane in blood plasma and urine samples of cement factory workers,BMC Chemistry,0,https://doi.org/10.1186/s13065-020-00681-7,https://api.labs.crossref.org/works/https://doi.org/10.1186/s13065-020-00681-7?mailto=christian.hauschke@tib.eu,2020,article,True,0,On-line Monitoring of Wastewater Quality,Physical Sciences,Industrial and Manufacturing Engineering,BioMed Central,True,en,Environmental Science,
https://openalex.org/W3016276571,RETRACTED: Microstructure Observation and Mechanism Analysis of High Carbon Steel Decarburization at High Temperature under Electric Field,IOP Conference Series: Materials Science and Engineering,0,https://doi.org/10.1088/1757-899x/782/2/022103,https://api.labs.crossref.org/works/https://doi.org/10.1088/1757-899x/782/2/022103?mailto=christian.hauschke@tib.eu,2020,article,True,0,High-Strength Steel Materials,Physical Sciences,Mechanical Engineering,IOP Publishing,True,en,Engineering,
https://openalex.org/W3016429407,RETRACTED ARTICLE: β adrenergic receptor modulated signaling in glioma models: promoting β adrenergic receptor-β arrestin scaffold-mediated activation of extracellular-regulated kinase 1/2 may prove to be a panacea in the treatment of intracranial and spinal malignancy and extra-neuraxial carcinoma,Molecular Biology Reports,0,https://doi.org/10.1007/s11033-020-05427-1,https://api.labs.crossref.org/works/https://doi.org/10.1007/s11033-020-05427-1?mailto=christian.hauschke@tib.eu,2020,article,True,0,Impact of Chronic Stress on Cancer Progression,Health Sciences,Psychiatry and Mental health,Springer Nature,True,en,Medicine,
https://openalex.org/W3016771391,"RETRACTED ARTICLE: Kwaito’s Busiswa Gqulu, ‘Among men’: Female perspectives on black women’s bodies in club spaces of South Africa",Agenda,0,https://doi.org/10.1080/10130950.2020.1738724,https://api.labs.crossref.org/works/https://doi.org/10.1080/10130950.2020.1738724?mailto=christian.hauschke@tib.eu,2020,article,True,0,Service Delivery Protests in South Africa,Social Sciences,Sociology and Political Science,Taylor & Francis,False,en,Social Sciences,
https://openalex.org/W3016892800,RETRACTED: Study on Microstructure and Mechanical Properties of Nitrided and Titanized Carbon Steel,IOP Conference Series: Materials Science and Engineering,0,https://doi.org/10.1088/1757-899x/782/2/022045,https://api.labs.crossref.org/works/https://doi.org/10.1088/1757-899x/782/2/022045?mailto=christian.hauschke@tib.eu,2020,article,True,0,Mechanical Properties of Thin Film Coatings,Physical Sciences,Mechanics of Materials,IOP Publishing,True,en,Engineering,
https://openalex.org/W3017219962,RETRACTED ARTICLE: An efficient human face verification system based on ELBP: a high precision feature,Journal of Ambient Intelligence and Humanized Computing,0,https://doi.org/10.1007/s12652-020-01965-5,https://api.labs.crossref.org/works/https://doi.org/10.1007/s12652-020-01965-5?mailto=christian.hauschke@tib.eu,2020,article,True,0,Face Recognition and Dimensionality Reduction Techniques,Physical Sciences,Computer Vision and Pattern Recognition,Springer Science+Business Media,False,en,Computer Science,
https://openalex.org/W3017221425,"Dominant Flood‐Generating Mechanisms Controlling Variability and Trend of Floods in Unregulated Catchments Across Australia, by Xihui Gu, Qiang Zhang, Jianfeng Li, Jianyu Liu, and Vijay P. Singh",Journal of Geophysical Research: Atmospheres,0,https://doi.org/10.1029/2019jd031703,https://api.labs.crossref.org/works/https://doi.org/10.1029/2019jd031703?mailto=christian.hauschke@tib.eu,2020,article,True,0,Global Flood Risk Assessment and Management,Physical Sciences,Global and Planetary Change,Wiley-Blackwell,False,en,Environmental Science,
https://openalex.org/W3017260660,Insights into solute carriers as targets for cellular transport and drug development,Bio design,0,https://doi.org/10.34184/kssb.2020.8.1.1,https://api.labs.crossref.org/works/https://doi.org/10.34184/kssb.2020.8.1.1?mailto=christian.hauschke@tib.eu,2020,article,True,0,Fluorescent Chemosensors for Ion Detection and Bioimaging,Physical Sciences,Spectroscopy,,False,en,Chemistry,
https://openalex.org/W3017353204,RETRACTED: Personal Information Security Crisis in the Era of Big Data,Journal of Physics: Conference Series,0,https://doi.org/10.1088/1742-6596/1486/5/052002,https://api.labs.crossref.org/works/https://doi.org/10.1088/1742-6596/1486/5/052002?mailto=christian.hauschke@tib.eu,2020,article,True,0,Impact of Digitalization on Economy and Society,Social Sciences,"General Economics, Econometrics and Finance",IOP Publishing,True,en,"Economics, Econometrics and Finance",
https://openalex.org/W3017852083,Retraction of “GPR40 Agonist GW9508 Ameliorates Oxidized LDL-Induced Endothelial Dysfunction via the AMPK/CREB/PGC-1α Pathway”,Chemical Research in Toxicology,0,https://doi.org/10.1021/acs.chemrestox.0c00043,https://api.labs.crossref.org/works/https://doi.org/10.1021/acs.chemrestox.0c00043?mailto=christian.hauschke@tib.eu,2020,article,True,0,Structure and Function of G Protein-Coupled Receptors,Life Sciences,Molecular Biology,American Chemical Society,True,en,"Biochemistry, Genetics and Molecular Biology",
https://openalex.org/W3018224034,Notice of Violation of IEEE Publication Principles: A Single-Phase Switched-Boost Inverter for Photovoltaic System,,0,https://doi.org/10.1109/icimia48430.2020.9074945,https://api.labs.crossref.org/works/https://doi.org/10.1109/icimia48430.2020.9074945?mailto=christian.hauschke@tib.eu,2020,article,True,0,Multilevel Converters in Power Electronics,Physical Sciences,Electrical and Electronic Engineering,,False,en,Engineering,
https://openalex.org/W3018914162,WITHDRAWN: Tungten Copper Composite Machinability by Electrical Discharge Machining,Procedia Manufacturing,0,https://doi.org/10.1016/j.promfg.2020.04.248,https://api.labs.crossref.org/works/https://doi.org/10.1016/j.promfg.2020.04.248?mailto=christian.hauschke@tib.eu,2020,article,True,0,Electrical Discharge Machining Processes,Physical Sciences,Electrical and Electronic Engineering,Elsevier BV,True,en,Engineering,
https://openalex.org/W3019328980,Notice of Violation of IEEE Publication Principles: Channel Equalization and Data Detection of OVFDM Under Fading Channel,IEEE Access,0,https://doi.org/10.1109/access.2020.2989801,https://api.labs.crossref.org/works/https://doi.org/10.1109/access.2020.2989801?mailto=christian.hauschke@tib.eu,2020,article,True,0,Peak-to-Average Power Ratio Reduction Techniques,Physical Sciences,Electrical and Electronic Engineering,Institute of Electrical and Electronics Engineers,True,en,Engineering,
https://openalex.org/W3019523563,Retracted: COVID-19 admissions calculators - Revisited,Early Human Development,0,https://doi.org/10.1016/j.earlhumdev.2020.105053,https://api.labs.crossref.org/works/https://doi.org/10.1016/j.earlhumdev.2020.105053?mailto=christian.hauschke@tib.eu,2020,article,True,0,Modeling the Dynamics of COVID-19 Pandemic,Physical Sciences,Modeling and Simulation,Elsevier BV,True,en,Mathematics,
https://openalex.org/W3020236312,RETRACTED: Volar locking plate removal following distal radius fractures: indications and outcomes for 71 fractures,Journal of Hand Surgery (European Volume),0,https://doi.org/10.1177/1753193420919028,https://api.labs.crossref.org/works/https://doi.org/10.1177/1753193420919028?mailto=christian.hauschke@tib.eu,2020,article,True,0,Treatment and Outcomes of Hand Injuries,Health Sciences,Surgery,SAGE Publishing,False,en,Medicine,
https://openalex.org/W3021194949,Preparation of Decellularized Bovine Tendon Scaffold and Evaluation of Its Interaction with Adipose Tissue-Derived Mesenchymal Stem Cells,"Gene, cell and tissue",0,https://doi.org/10.5812/gct.101735,https://api.labs.crossref.org/works/https://doi.org/10.5812/gct.101735?mailto=christian.hauschke@tib.eu,2020,article,True,0,Tissue Engineering and Regenerative Medicine,Health Sciences,Surgery,,True,en,Medicine,
https://openalex.org/W3021277865,Notice of Violation of IEEE Publication Principles: Channel Decoding Based on Complex-valued Convolutional Neural Networks,,0,https://doi.org/10.1109/6gsummit49458.2020.9083899,https://api.labs.crossref.org/works/https://doi.org/10.1109/6gsummit49458.2020.9083899?mailto=christian.hauschke@tib.eu,2020,article,True,0,Deep Learning for Wireless Signal Classification,Physical Sciences,Artificial Intelligence,,False,en,Computer Science,Retraction
https://openalex.org/W3021363221,RETRACTED ARTICLE: Application of structural equation based on big data in Korean automobile industry,Evolutionary Intelligence,0,https://doi.org/10.1007/s12065-020-00414-8,https://api.labs.crossref.org/works/https://doi.org/10.1007/s12065-020-00414-8?mailto=christian.hauschke@tib.eu,2020,article,True,0,Big Data Analysis in Various Industries,Physical Sciences,Information Systems,Springer Science+Business Media,False,en,Computer Science,Retraction;Crossmark Retraction
https://openalex.org/W3021510989,WITHDRAWN: A proposito de un caso con artritis gotosa,Atención Primaria Práctica,0,https://doi.org/10.1016/j.appr.2020.100052,https://api.labs.crossref.org/works/https://doi.org/10.1016/j.appr.2020.100052?mailto=christian.hauschke@tib.eu,2020,article,True,0,Uric Acid in Cardiovascular and Renal Health,Health Sciences,Nephrology,Elsevier BV,True,en,Medicine,Retraction
https://openalex.org/W3021598831,RETRACTED CHAPTER: Usage of COTS/EEE Parts in Space Applications—An Overview,Lecture notes in mechanical engineering,0,https://doi.org/10.1007/978-981-15-1724-2_33,https://api.labs.crossref.org/works/https://doi.org/10.1007/978-981-15-1724-2_33?mailto=christian.hauschke@tib.eu,2020,book-chapter,True,0,Technology Readiness Assessment and Evaluation,Physical Sciences,"Safety, Risk, Reliability and Quality",Springer Nature,False,en,Engineering,Retraction
https://openalex.org/W3021616286,RETRACTED CHAPTER: Classification of Authors for a Recommendation Process Integrated to a Scientific Meta-Search Engine,"Smart innovation, systems and technologies",0,https://doi.org/10.1007/978-981-15-4875-8_14,https://api.labs.crossref.org/works/https://doi.org/10.1007/978-981-15-4875-8_14?mailto=christian.hauschke@tib.eu,2020,book-chapter,True,0,Recommender System Technologies,Physical Sciences,Information Systems,Springer Nature,True,en,Computer Science,Retraction
https://openalex.org/W3021766527,RETRACTED ARTICLE: Ontology-based prediction of cochlear implantation outcome using cross-modal plasticity analysis,Journal of Ambient Intelligence and Humanized Computing,0,https://doi.org/10.1007/s12652-020-02011-0,https://api.labs.crossref.org/works/https://doi.org/10.1007/s12652-020-02011-0?mailto=christian.hauschke@tib.eu,2020,article,True,0,Impact of Hearing Loss on Cognitive Function,Life Sciences,Cognitive Neuroscience,Springer Science+Business Media,False,en,Neuroscience,Retraction;Crossmark Retraction
https://openalex.org/W3021769117,Educational resource online evaluation system based on neural network dynamic feedback algorithm,Journal of Intelligent and Fuzzy Systems,0,https://doi.org/10.3233/jifs-179801,https://api.labs.crossref.org/works/https://doi.org/10.3233/jifs-179801?mailto=christian.hauschke@tib.eu,2020,article,True,0,Application of Fuzzy Logic in Educational Assessment,Physical Sciences,Information Systems,IOS Press,False,en,Computer Science,Retraction
https://openalex.org/W3021821814,"RETRACTED: Recalibrating scale, rupturing coloniality: On relational ethnography and its postcolonial reckonings",Ethnography,0,https://doi.org/10.1177/1466138120923378,https://api.labs.crossref.org/works/https://doi.org/10.1177/1466138120923378?mailto=christian.hauschke@tib.eu,2020,article,True,0,The Role of Sociology in Public Discourse and Policy,Social Sciences,Sociology and Political Science,SAGE Publishing,False,en,Social Sciences,Retraction
https://openalex.org/W3021852276,RETRACTED CHAPTER: Ocean Policy of the UNCLOS in Ecuador Based on New Geodynamic and Geochronological Evidences,"Smart innovation, systems and technologies",0,https://doi.org/10.1007/978-981-15-4875-8_42,https://api.labs.crossref.org/works/https://doi.org/10.1007/978-981-15-4875-8_42?mailto=christian.hauschke@tib.eu,2020,book-chapter,True,0,Geodynamics of the Northern Andes and Caribbean Region,Physical Sciences,Geophysics,Springer Nature,False,en,Earth and Planetary Sciences,Retraction
https://openalex.org/W3021989934,RETRACTED: Studies of the Electrodynamic Parameters of a Powdered Material Depending on the Fractional Composition in the Frequency Range of 8-12 Ghz,Materials Science Forum,0,https://doi.org/10.4028/www.scientific.net/msf.989.359,https://api.labs.crossref.org/works/https://doi.org/10.4028/www.scientific.net/msf.989.359?mailto=christian.hauschke@tib.eu,2020,article,True,0,Microwave Sensors for Material Characterization and Sensing,Physical Sciences,Electrical and Electronic Engineering,Trans Tech Publications,True,en,Engineering,Retraction
https://openalex.org/W3022233523,RETRACTION: VIRTUAL COMMUNITY (From Historical and Sociological Reality to Virtuality of the Digital Age: Virtualization of the Community),Ağrı İbrahim Çeçen Üniversitesi Sosyal Bilimler Enstitüsü dergisi,0,https://doi.org/10.31463/aicusbed.674956,https://api.labs.crossref.org/works/https://doi.org/10.31463/aicusbed.674956?mailto=christian.hauschke@tib.eu,2020,article,True,0,Media Discourse and Social Movements Analysis,Social Sciences,Sociology and Political Science,,True,tr,Social Sciences,Retraction
https://openalex.org/W3022279685,Retracted: Research on image sharpening algorithm in weak illumination environment,Iet Image Processing,0,https://doi.org/10.1049/iet-ipr.2019.1588,https://api.labs.crossref.org/works/https://doi.org/10.1049/iet-ipr.2019.1588?mailto=christian.hauschke@tib.eu,2020,article,True,0,Image Enhancement Techniques,Physical Sciences,Computer Vision and Pattern Recognition,Institution of Engineering and Technology,True,en,Computer Science,Retraction
https://openalex.org/W3022748885,Retracted: Innovative approach for multimodal fusion recognition based feature extraction using band‐limited phase‐only correlation and discrete orthonormal Stockwell transform,Iet Image Processing,0,https://doi.org/10.1049/iet-ipr.2020.0145,https://api.labs.crossref.org/works/https://doi.org/10.1049/iet-ipr.2020.0145?mailto=christian.hauschke@tib.eu,2020,article,True,0,Biometric Recognition and Security Systems,Physical Sciences,Signal Processing,Institution of Engineering and Technology,True,en,Computer Science,Retraction
https://openalex.org/W3022925254,<i>Retracted</i>: Influence of organic montmorillonite nanoparticles on the microstructures and thermal and tribological properties of polyethersulfone and polytetrafluoroethylene composites,Polymer International,0,https://doi.org/10.1002/pi.6035,https://api.labs.crossref.org/works/https://doi.org/10.1002/pi.6035?mailto=christian.hauschke@tib.eu,2020,article,True,0,Tribology of Polymers and Composites,Physical Sciences,Mechanics of Materials,Wiley-Blackwell,False,en,Engineering,Retraction
https://openalex.org/W3022957528,RETRACTED ARTICLE: Evolutionary generation of orthomorphisms in the Galois field F28,Evolutionary Intelligence,0,https://doi.org/10.1007/s12065-020-00411-x,https://api.labs.crossref.org/works/https://doi.org/10.1007/s12065-020-00411-x?mailto=christian.hauschke@tib.eu,2020,article,True,0,Swarm Intelligence Optimization Algorithms,Physical Sciences,Artificial Intelligence,Springer Science+Business Media,False,en,Computer Science,Retraction;Crossmark Retraction
https://openalex.org/W3023048274,"The Prevalence of Self-Perceived Sensitive Facial Skin Among Female Students at King Abdulaziz University, Jeddah, Saudi Arabia, 2018-2019",Australasian Medical Journal,0,https://doi.org/10.35841/1836-1935.13.4.114-135,https://api.labs.crossref.org/works/https://doi.org/10.35841/1836-1935.13.4.114-135?mailto=christian.hauschke@tib.eu,2020,article,True,0,Airborne Transmission of Respiratory Viruses,Health Sciences,Pulmonary and Respiratory Medicine,Australasian Medical Journal pty ltd.,False,en,Medicine,Retraction
https://openalex.org/W3023053972,[RETRACTED] Mutual Cooperation and Criminal Efficiency under Regulation (EU) 2018/1805 for the Mutual Recognition of Freezing and Confiscation Measures,International Criminal Law Review,0,https://doi.org/10.1163/15718123-01905001,https://api.labs.crossref.org/works/https://doi.org/10.1163/15718123-01905001?mailto=christian.hauschke@tib.eu,2020,article,True,0,European Union Criminal Law and Justice Cooperation,Social Sciences,Political Science and International Relations,Brill,False,en,Social Sciences,Retraction
https://openalex.org/W3023264897,"The Principle of Good Faith in the Judicial Practice of the Review of Disputes Related to the Transportation of Cargo, Passengers and Baggage",Российский судья,0,https://doi.org/10.18572/1812-3791-2020-3-8-15,https://api.labs.crossref.org/works/https://doi.org/10.18572/1812-3791-2020-3-8-15?mailto=christian.hauschke@tib.eu,2020,article,True,0,Legal Aspects of International Trade and Shipping,Social Sciences,Accounting,,True,en,"Business, Management and Accounting",Retraction
https://openalex.org/W3023445414,Data Mining and Association Rules to Determine Twitter Trends,"Smart innovation, systems and technologies",0,https://doi.org/10.1007/978-981-15-4875-8_23,https://api.labs.crossref.org/works/https://doi.org/10.1007/978-981-15-4875-8_23?mailto=christian.hauschke@tib.eu,2020,book-chapter,True,0,Sentiment Analysis and Opinion Mining,Physical Sciences,Artificial Intelligence,Springer Nature,True,en,Computer Science,Retraction
https://openalex.org/W3023464530,RETRACTED ARTICLE: A probabilistic logic approach to outcome prediction in team games using historical data and domain knowledge,Journal of Ambient Intelligence and Humanized Computing,0,https://doi.org/10.1007/s12652-020-01989-x,https://api.labs.crossref.org/works/https://doi.org/10.1007/s12652-020-01989-x?mailto=christian.hauschke@tib.eu,2020,article,True,0,Economics of Professional Sports and Prediction Markets,Social Sciences,Economics and Econometrics,Springer Science+Business Media,False,en,"Economics, Econometrics and Finance",Retraction;Crossmark Retraction
https://openalex.org/W3023883488,ON THE HISTORY OF EDUCATION DEVELOPMENT AMONG THE NOGAIS OF THE NORTH CAUCASUS (XVII–XX CENTURIES),"Istoriâ, arheologiâ i ètnografiâ Kavkaza",0,https://doi.org/10.32653/ch161145-156,https://api.labs.crossref.org/works/https://doi.org/10.32653/ch161145-156?mailto=christian.hauschke@tib.eu,2020,article,True,0,Multidisciplinary Studies in Social Sciences and Humanities,Social Sciences,General Social Sciences,,True,en,Social Sciences,Retraction
https://openalex.org/W3023905586,RETRACTED: Temperament gene inheritance,Meta Gene,0,https://doi.org/10.1016/j.mgene.2020.100728,https://api.labs.crossref.org/works/https://doi.org/10.1016/j.mgene.2020.100728?mailto=christian.hauschke@tib.eu,2020,article,True,0,Sex Determination and Differentiation in Organisms,Life Sciences,Genetics,Elsevier BV,True,en,"Biochemistry, Genetics and Molecular Biology",Retraction;Crossmark Retraction
https://openalex.org/W3024232513,RETRACTED ARTICLE: A Co(II)-mediated coordination polymer: treatment capability on post-traumatic osteoarthritis via reducing inflammatory response,Inorganic and Nano-Metal Chemistry,0,https://doi.org/10.1080/24701556.2020.1762216,https://api.labs.crossref.org/works/https://doi.org/10.1080/24701556.2020.1762216?mailto=christian.hauschke@tib.eu,2020,article,True,0,Cyclooxygenase-2 Inhibitors in Inflammation and Cancer,Health Sciences,Pharmacology,Taylor & Francis,False,en,Medicine,
https://openalex.org/W3024267056,RETRACTED ARTICLE: Feature reduced blind steganalysis using DCT and spatial transform on JPEG images with and without cross validation using ensemble classifiers,Journal of Ambient Intelligence and Humanized Computing,0,https://doi.org/10.1007/s12652-020-02001-2,https://api.labs.crossref.org/works/https://doi.org/10.1007/s12652-020-02001-2?mailto=christian.hauschke@tib.eu,2020,article,True,0,Digital Image Watermarking Techniques,Physical Sciences,Computer Vision and Pattern Recognition,Springer Science+Business Media,False,en,Computer Science,Retraction;Crossmark Retraction
https://openalex.org/W3024563192,Application of deep learning and artificial intelligence in the psychological mechanism of language activity,Journal of Intelligent and Fuzzy Systems,0,https://doi.org/10.3233/jifs-179806,https://api.labs.crossref.org/works/https://doi.org/10.3233/jifs-179806?mailto=christian.hauschke@tib.eu,2020,article,True,0,Future of Personalized Medicine in Healthcare,Health Sciences,"Public Health, Environmental and Occupational Health",IOS Press,False,en,Medicine,Retraction
https://openalex.org/W3024764852,Retracted: Silencing of Exosomal miR‐296‐5p Derived from Endothelial Progenitor Cells Enhances Thrombolysis and Recanalization in Deep Vein Thrombosis,Clinical and Translational Science,0,https://doi.org/10.1111/cts.12799,https://api.labs.crossref.org/works/https://doi.org/10.1111/cts.12799?mailto=christian.hauschke@tib.eu,2020,article,True,0,Prevention and Treatment of Venous Thromboembolism,Health Sciences,Internal Medicine,Wiley-Blackwell,True,en,Medicine,Retraction
https://openalex.org/W3024837828,WITHDRAWN: When lying is more than deceiving: A pragmatic study of lying based on the Relevance-Adaptation Model,Journal of Pragmatics,0,https://doi.org/10.1016/j.pragma.2020.04.003,https://api.labs.crossref.org/works/https://doi.org/10.1016/j.pragma.2020.04.003?mailto=christian.hauschke@tib.eu,2020,article,True,0,Detection of Deception in Communication and Interrogation,Social Sciences,Social Psychology,Elsevier BV,True,en,Psychology,Retraction
https://openalex.org/W3025164078,Retracted Article: Transformation of Non/Revolutionary Themes in Iranian Cinema: 1980s–2000s,Quarterly Review of Film and Video,0,https://doi.org/10.1080/10509208.2020.1762474,https://api.labs.crossref.org/works/https://doi.org/10.1080/10509208.2020.1762474?mailto=christian.hauschke@tib.eu,2020,article,True,0,Transformation of Political Landscape in Turkey,Social Sciences,Political Science and International Relations,Taylor & Francis,False,en,Social Sciences,Retraction
https://openalex.org/W3025268292,Retracted Article: Documentary Method at Featuring Films of Kazakhstan: Systemizing and Analysis on the Selected Films Example within 1945 and 2018,Quarterly Review of Film and Video,0,https://doi.org/10.1080/10509208.2020.1766309,https://api.labs.crossref.org/works/https://doi.org/10.1080/10509208.2020.1766309?mailto=christian.hauschke@tib.eu,2020,article,True,0,History and International Relations,Social Sciences,Political Science and International Relations,Taylor & Francis,False,en,Social Sciences,Retraction
https://openalex.org/W3025522998,RETRACTED: Growth of center-oriented filamentous microstructures on the surface of ZnO–Co3O4 targets under pulsed laser radiation,Materials Science in Semiconductor Processing,0,https://doi.org/10.1016/j.mssp.2020.105175,https://api.labs.crossref.org/works/https://doi.org/10.1016/j.mssp.2020.105175?mailto=christian.hauschke@tib.eu,2020,article,True,0,Zinc Oxide Nanostructures,Physical Sciences,Materials Chemistry,Elsevier BV,False,en,Materials Science,Crossmark Retraction
https://openalex.org/W3026095058,RETRACTED ARTICLE: Preclinical diagnosis of asthma with GMR sensor and RADWT algorithm,Journal of Ambient Intelligence and Humanized Computing,0,https://doi.org/10.1007/s12652-020-01966-4,https://api.labs.crossref.org/works/https://doi.org/10.1007/s12652-020-01966-4?mailto=christian.hauschke@tib.eu,2020,article,True,0,Analysis of Cardiac and Respiratory Sounds,Health Sciences,Pulmonary and Respiratory Medicine,Springer Science+Business Media,False,en,Medicine,Retraction;Crossmark Retraction
https://openalex.org/W3026200085,Combinatorial approach of in silico and in vitro evaluation of MLH1 variant associated with Lynch syndrome like metastatic colorectal cancer,Bioscience Reports,0,https://doi.org/10.1042/bsr20200225,https://api.labs.crossref.org/works/https://doi.org/10.1042/bsr20200225?mailto=christian.hauschke@tib.eu,2020,article,True,0,Molecular Characterization of Colorectal Cancer,Health Sciences,Pathology and Forensic Medicine,Portland Press,True,en,Medicine,Expression of concern;Retraction
https://openalex.org/W3026367339,RETRACTED: Oleanane-Type Saponins From the Aerial Parts of <i>Panax bipinnatifidus</i>,Natural Product Communications,0,https://doi.org/10.1177/1934578x20926278,https://api.labs.crossref.org/works/https://doi.org/10.1177/1934578x20926278?mailto=christian.hauschke@tib.eu,2020,article,True,0,Molecular Mechanisms and Medical Applications of Ginseng,Life Sciences,Molecular Biology,SAGE Publishing,True,en,"Biochemistry, Genetics and Molecular Biology",Retraction
