id,display_name,primary_location_display_name,cited_by_count,doi,crossref_call,publication_year,type,is_retracted,cited_by_percentile_year_min,primary_topic_display_name,primary_topic_domain_display_name,primary_topic_subfield_display_name,primary_location_source_host_organization_name,open_access_is_oa,language,primary_topic_field_display_name,update_nature
https://openalex.org/W1786082519,Influence of 2-(diisopropylamino)ethyl methacrylate on acid-triggered hydrolysis of cyclic benzylidene acetals and their importance in efficient drug delivery,Polymer Chemistry,12,https://doi.org/10.1039/c5py00734h,https://api.labs.crossref.org/works/https://doi.org/10.1039/c5py00734h?mailto=christian.hauschke@tib.eu,2015,article,True,89,Living Radical Polymerization,Physical Sciences,Organic Chemistry,Royal Society of Chemistry,False,en,Chemistry,
https://openalex.org/W1847788194,Long Noncoding RNA KIAA0125 Potentiates Cell Migration and Invasion in Gallbladder Cancer,BioMed Research International,12,https://doi.org/10.1155/2015/108458,https://api.labs.crossref.org/works/https://doi.org/10.1155/2015/108458?mailto=christian.hauschke@tib.eu,2015,article,True,89,Role of Long Noncoding RNAs in Cancer and Development,Life Sciences,Cancer Research,Hindawi Publishing Corporation,True,en,"Biochemistry, Genetics and Molecular Biology",
https://openalex.org/W1850186016,Glyphosate Use Predicts ADHD Hospital Discharges in the Healthcare Cost and Utilization Project Net (HCUPnet): A Two-Way Fixed-Effects Analysis,PLOS ONE,12,https://doi.org/10.1371/journal.pone.0133525,https://api.labs.crossref.org/works/https://doi.org/10.1371/journal.pone.0133525?mailto=christian.hauschke@tib.eu,2015,article,True,89,Attention-Deficit/Hyperactivity Disorder,Health Sciences,Psychiatry and Mental health,Public Library of Science,True,en,Medicine,
https://openalex.org/W1867839857,The Reasearch on the Anti-Fatigue Effect of Whey Protein Powder in Basketball Training,The Open Biomedical Engineering Journal,12,https://doi.org/10.2174/1874120701509010330,https://api.labs.crossref.org/works/https://doi.org/10.2174/1874120701509010330?mailto=christian.hauschke@tib.eu,2015,article,True,89,Protein Metabolism in Exercise and Nutrition,Life Sciences,Cell Biology,Bentham Science Publishers,True,en,"Biochemistry, Genetics and Molecular Biology",
https://openalex.org/W1965576527,Blackbody friction force on a relativistic small neutral particle,Physical Review A,12,https://doi.org/10.1103/physreva.91.032505,https://api.labs.crossref.org/works/https://doi.org/10.1103/physreva.91.032505?mailto=christian.hauschke@tib.eu,2015,article,True,89,Casimir Effect Research,Physical Sciences,"Atomic and Molecular Physics, and Optics",American Physical Society,True,en,Physics and Astronomy,
https://openalex.org/W1966407148,Genetic Polymorphism of Interferon Regulatory Factor 5 (IRF5) Correlates with Allograft Acute Rejection of Liver Transplantation,PLOS ONE,12,https://doi.org/10.1371/journal.pone.0094426,https://api.labs.crossref.org/works/https://doi.org/10.1371/journal.pone.0094426?mailto=christian.hauschke@tib.eu,2014,article,True,89,Hepatitis C Infection and Treatment,Health Sciences,Hepatology,Public Library of Science,True,en,Medicine,
https://openalex.org/W1969277559,RETRACTED: A novel concept to derive iodine status of human populations from frequency distribution properties of a hair iodine concentration,Journal of Trace Elements in Medicine and Biology,12,https://doi.org/10.1016/j.jtemb.2014.02.001,https://api.labs.crossref.org/works/https://doi.org/10.1016/j.jtemb.2014.02.001?mailto=christian.hauschke@tib.eu,2014,article,True,89,Thyroid Disease and Hormone Regulation,Health Sciences,"Endocrinology, Diabetes and Metabolism",Elsevier BV,True,en,Medicine,
https://openalex.org/W1976255739,RETRACTED: Influence of electropulsing globularization on the microstructure and mechanical properties of Ti–6Al–4V alloy strip with lamellar microstructure,Materials Science and Engineering: A,12,https://doi.org/10.1016/j.msea.2014.11.003,https://api.labs.crossref.org/works/https://doi.org/10.1016/j.msea.2014.11.003?mailto=christian.hauschke@tib.eu,2015,article,True,89,Effects of Electrically-Assisted Deformation in Metals and Ceramics,Physical Sciences,Electrical and Electronic Engineering,Elsevier BV,True,en,Engineering,
https://openalex.org/W1977613035,"Preconditioning with pitavastatin, an HMG-CoA reductase inhibitor, attenuates C-Jun N-terminal kinase activation in experimental subarachnoid hemorrhage-induced apoptosis",Acta Neurochirurgica,12,https://doi.org/10.1007/s00701-015-2399-3,https://api.labs.crossref.org/works/https://doi.org/10.1007/s00701-015-2399-3?mailto=christian.hauschke@tib.eu,2015,article,True,89,Metabolic Reprogramming in Cancer Biology,Life Sciences,Cancer Research,Springer Science+Business Media,False,en,"Biochemistry, Genetics and Molecular Biology",
https://openalex.org/W1995191336,"Optimization, Composition, and Antioxidant Activities of Exo- and Intracellular Polysaccharides in Submerged Culture of<i>Cordyceps gracilis</i>(Grev.) Durieu &amp; Mont.",Evidence-based Complementary and Alternative Medicine,12,https://doi.org/10.1155/2015/462864,https://api.labs.crossref.org/works/https://doi.org/10.1155/2015/462864?mailto=christian.hauschke@tib.eu,2015,article,True,89,Medicinal Mushrooms: Antitumor and Immunomodulating Properties,Health Sciences,Pharmacology,Hindawi Publishing Corporation,True,en,Medicine,
https://openalex.org/W1997123701,Endocytosis and Vacuolar Degradation of the Yeast Cell Surface Glucose Sensors Rgt2 and Snf3,Journal of Biological Chemistry,12,https://doi.org/10.1074/jbc.m113.539411,https://api.labs.crossref.org/works/https://doi.org/10.1074/jbc.m113.539411?mailto=christian.hauschke@tib.eu,2014,article,True,89,Genomic Expression and Function in Yeast Organism,Life Sciences,Molecular Biology,Elsevier BV,True,en,"Biochemistry, Genetics and Molecular Biology",
https://openalex.org/W1998552454,RETRACTED ARTICLE: Methylation and Expression Patterns of Tropomyosin-Related Kinase Genes in Different Grades of Glioma,Neuromolecular Medicine,12,https://doi.org/10.1007/s12017-014-8303-0,https://api.labs.crossref.org/works/https://doi.org/10.1007/s12017-014-8303-0?mailto=christian.hauschke@tib.eu,2014,article,True,89,Epigenetic Modifications and Their Functional Implications,Life Sciences,Molecular Biology,Springer Science+Business Media,False,en,"Biochemistry, Genetics and Molecular Biology",
https://openalex.org/W2020093655,Interplay between Oral Hypoglycemic Medication Adherence and Quality of Life among Elderly Type 2 Diabetes Mellitus Patients,Journal of Clinical and Diagnostic Research,12,https://doi.org/10.7860/jcdr/2014/10481.5309,https://api.labs.crossref.org/works/https://doi.org/10.7860/jcdr/2014/10481.5309?mailto=christian.hauschke@tib.eu,2014,article,True,89,Improving Patient Adherence to Medication Regimens,Health Sciences,Family Practice,JCDR Research and Publications Private Limited,True,en,Medicine,
https://openalex.org/W2020773017,RETRACTED: Preparation of CN-dots/F-NiO nanocomposite for enhanced photocatalytic degradation of selected organic pollutants,Applied Surface Science,12,https://doi.org/10.1016/j.apsusc.2014.11.042,https://api.labs.crossref.org/works/https://doi.org/10.1016/j.apsusc.2014.11.042?mailto=christian.hauschke@tib.eu,2015,article,True,89,Photocatalytic Materials for Solar Energy Conversion,Physical Sciences,"Renewable Energy, Sustainability and the Environment",Elsevier BV,True,en,Energy,
https://openalex.org/W2024131662,Retracted: E-Learning Recommender Systems Based on Goal-Based Hybrid Filtering,International Journal of Distributed Sensor Networks,12,https://doi.org/10.1155/2014/912130,https://api.labs.crossref.org/works/https://doi.org/10.1155/2014/912130?mailto=christian.hauschke@tib.eu,2014,article,True,89,Recommender System Technologies,Physical Sciences,Information Systems,Hindawi Publishing Corporation,False,en,Computer Science,
https://openalex.org/W2025440630,Retracted: Antecedents and Consequences of Gender Swapping in Online Games,Journal of Computer-Mediated Communication,12,https://doi.org/10.1111/jcc4.12119,https://api.labs.crossref.org/works/https://doi.org/10.1111/jcc4.12119?mailto=christian.hauschke@tib.eu,2015,article,True,89,Social and Psychological Aspects of Online Gaming,Social Sciences,Sociology and Political Science,Wiley-Blackwell,True,en,Social Sciences,
https://openalex.org/W2042136048,Retracted: Glabridin attenuates the migratory and invasive capacity of breast cancer cells by activating micro<scp>RNA</scp>‐200c,Cancer Science,12,https://doi.org/10.1111/cas.12426,https://api.labs.crossref.org/works/https://doi.org/10.1111/cas.12426?mailto=christian.hauschke@tib.eu,2014,article,True,89,Pharmacological Effects of Licorice Roots,Life Sciences,Pharmacology,Wiley-Blackwell,True,en,"Pharmacology, Toxicology and Pharmaceutics",
https://openalex.org/W2044221879,RETRACTION: Angiotensin II and Canonical Transient Receptor Potential-6 Activation Stimulate Release of a Signal Transducer and Activator of Transcription 3–Activating Factor from Mouse Podocytes,Molecular Pharmacology,12,https://doi.org/10.1124/mol.114.092536,https://api.labs.crossref.org/works/https://doi.org/10.1124/mol.114.092536?mailto=christian.hauschke@tib.eu,2014,article,True,89,Pathophysiology of Glomerular Diseases and Nephrotic Syndromes,Health Sciences,Nephrology,American Society for Pharmacology and Experimental Therapeutics,False,en,Medicine,
https://openalex.org/W2046563128,Trust Building in Online Peer-to-Peer Lending,Journal of Global Information Technology Management,12,https://doi.org/10.1080/1097198x.2014.978624,https://api.labs.crossref.org/works/https://doi.org/10.1080/1097198x.2014.978624?mailto=christian.hauschke@tib.eu,2014,article,True,89,Dynamics of Crowdfunding and Fintech,Social Sciences,Management Information Systems,Taylor & Francis,False,en,"Business, Management and Accounting",
https://openalex.org/W2048451330,Silencing NOB1 enhances doxorubicin antitumor activity of the papillary thyroid carcinoma in vitro and in vivo,Oncology Reports,12,https://doi.org/10.3892/or.2015.3730,https://api.labs.crossref.org/works/https://doi.org/10.3892/or.2015.3730?mailto=christian.hauschke@tib.eu,2015,article,True,89,RNA Methylation and Modification in Gene Expression,Life Sciences,Molecular Biology,Elsevier BV,True,en,"Biochemistry, Genetics and Molecular Biology",
https://openalex.org/W2048477819,Novel Approach to Activity Evaluation for Release-Active Forms of Anti-Interferon-Gamma Antibodies Based on Enzyme-Linked Immunoassay,PLOS ONE,12,https://doi.org/10.1371/journal.pone.0097017,https://api.labs.crossref.org/works/https://doi.org/10.1371/journal.pone.0097017?mailto=christian.hauschke@tib.eu,2014,article,True,89,"Therapeutic Antibodies: Development, Engineering, and Applications",Health Sciences,"Radiology, Nuclear Medicine and Imaging",Public Library of Science,True,en,Medicine,
https://openalex.org/W2052815580,RETRACTED: Trend detection of wind speed probability distribution by adaptive neuro-fuzzy methodology,Flow Measurement and Instrumentation,12,https://doi.org/10.1016/j.flowmeasinst.2015.04.007,https://api.labs.crossref.org/works/https://doi.org/10.1016/j.flowmeasinst.2015.04.007?mailto=christian.hauschke@tib.eu,2015,article,True,89,Electricity Price and Load Forecasting Methods,Physical Sciences,Electrical and Electronic Engineering,Elsevier BV,True,en,Engineering,
https://openalex.org/W2057007787,The Immunoregulation Effect of Alpha 1-Antitrypsin Prolong β-Cell Survival after Transplantation,PLOS ONE,12,https://doi.org/10.1371/journal.pone.0094548,https://api.labs.crossref.org/works/https://doi.org/10.1371/journal.pone.0094548?mailto=christian.hauschke@tib.eu,2014,article,True,89,Pancreatic Islet Dysfunction and Regeneration,Health Sciences,Surgery,Public Library of Science,True,en,Medicine,
https://openalex.org/W2068394021,"RETRACTED: Isolation, purification, characterization and mass spectroscopic analysis of carbonic anhydrase from Serratia sp. for sequestration of carbon dioxide and formation of calcite",Journal of Environmental Chemical Engineering,12,https://doi.org/10.1016/j.jece.2013.11.018,https://api.labs.crossref.org/works/https://doi.org/10.1016/j.jece.2013.11.018?mailto=christian.hauschke@tib.eu,2014,article,True,89,Role of Carbonic Anhydrases in Medicine and Biotechnology,Life Sciences,Molecular Biology,Elsevier BV,False,en,"Biochemistry, Genetics and Molecular Biology",
https://openalex.org/W2069606939,Interaction between Nbp35 and Cfd1 Proteins of Cytosolic Fe-S Cluster Assembly Reveals a Stable Complex Formation in Entamoeba histolytica,PLOS ONE,12,https://doi.org/10.1371/journal.pone.0108971,https://api.labs.crossref.org/works/https://doi.org/10.1371/journal.pone.0108971?mailto=christian.hauschke@tib.eu,2014,article,True,89,Biological and Synthetic Hydrogenases: Mechanisms and Applications,Physical Sciences,"Renewable Energy, Sustainability and the Environment",Public Library of Science,True,en,Energy,
https://openalex.org/W2074011261,"RETRACTED ARTICLE: Adsorptive removal of cadmium from aqueous media using Posidonia oceanica biomass: equilibrium, dynamic and thermodynamic studies",International Journal of Environmental Science and Technology,12,https://doi.org/10.1007/s13762-013-0483-x,https://api.labs.crossref.org/works/https://doi.org/10.1007/s13762-013-0483-x?mailto=christian.hauschke@tib.eu,2014,article,True,89,Adsorption of Water Contaminants,Physical Sciences,Water Science and Technology,Springer Science+Business Media,False,en,Environmental Science,
https://openalex.org/W2091980080,Insulin-like growth factor 1 promotes growth of gastric cancer by inhibiting foxo1 nuclear retention,Tumor Biology,12,https://doi.org/10.1007/s13277-015-3096-9,https://api.labs.crossref.org/works/https://doi.org/10.1007/s13277-015-3096-9?mailto=christian.hauschke@tib.eu,2015,article,True,89,Regulation and Functions of FoxO Transcription Factors,Life Sciences,Molecular Biology,SAGE Publishing,False,en,"Biochemistry, Genetics and Molecular Biology",
https://openalex.org/W2094276930,Xenotransplantation of human adipose derived mesenchymal stem cells in a rodent model of Huntington’s disease: motor and non-motor outcomes,Neurological Research,12,https://doi.org/10.1179/1743132814y.0000000456,https://api.labs.crossref.org/works/https://doi.org/10.1179/1743132814y.0000000456?mailto=christian.hauschke@tib.eu,2014,article,True,89,Molecular Mechanisms of Muscle Regeneration and Atrophy,Life Sciences,Molecular Biology,Taylor & Francis,False,en,"Biochemistry, Genetics and Molecular Biology",
https://openalex.org/W2095476652,De novo Cancers Following Liver Transplantation: A Single Center Experience in China,PLOS ONE,12,https://doi.org/10.1371/journal.pone.0085651,https://api.labs.crossref.org/works/https://doi.org/10.1371/journal.pone.0085651?mailto=christian.hauschke@tib.eu,2014,article,True,89,Viral-Related Cancers in Immunocompromised Patients,Health Sciences,Oncology,Public Library of Science,True,en,Medicine,
https://openalex.org/W2095573356,Aberrant CCR4 Expression Is Involved in Tumor Invasion of Lymph Node-Negative Human Gastric Cancer,PLOS ONE,12,https://doi.org/10.1371/journal.pone.0120059,https://api.labs.crossref.org/works/https://doi.org/10.1371/journal.pone.0120059?mailto=christian.hauschke@tib.eu,2015,article,True,89,Role of Chemokine Receptors in Cancer Metastasis,Health Sciences,Oncology,Public Library of Science,True,en,Medicine,
https://openalex.org/W2101591942,Decreased microRNA-132 and its function in human non-small cell lung cancer,Molecular Medicine Reports,12,https://doi.org/10.3892/mmr.2015.3222,https://api.labs.crossref.org/works/https://doi.org/10.3892/mmr.2015.3222?mailto=christian.hauschke@tib.eu,2015,article,True,89,MicroRNA Regulation in Cancer and Development,Life Sciences,Cancer Research,Spandidos Publishing,True,en,"Biochemistry, Genetics and Molecular Biology",
https://openalex.org/W2101792126,Treatment of Acute Pulmonary Embolism: Update on Newer Pharmacologic and Interventional Strategies,BioMed Research International,12,https://doi.org/10.1155/2014/410341,https://api.labs.crossref.org/works/https://doi.org/10.1155/2014/410341?mailto=christian.hauschke@tib.eu,2014,article,True,89,Prevention and Treatment of Venous Thromboembolism,Health Sciences,Internal Medicine,Hindawi Publishing Corporation,True,en,Medicine,
https://openalex.org/W2103253076,The Candida albicans Exocyst Subunit Sec6 Contributes to Cell Wall Integrity and Is a Determinant of Hyphal Branching,Eukaryotic Cell,12,https://doi.org/10.1128/ec.00028-15,https://api.labs.crossref.org/works/https://doi.org/10.1128/ec.00028-15?mailto=christian.hauschke@tib.eu,2015,article,True,89,Diagnosis and Management of Fungal Infections,Health Sciences,Infectious Diseases,American Society for Microbiology,True,en,Medicine,
https://openalex.org/W2110219264,Slope Stability Analysis Using Limit Equilibrium Method in Nonlinear Criterion,The Scientific World Journal,12,https://doi.org/10.1155/2014/206062,https://api.labs.crossref.org/works/https://doi.org/10.1155/2014/206062?mailto=christian.hauschke@tib.eu,2014,article,True,89,Factors of Safety and Reliability in Geotechnical Engineering,Physical Sciences,"Safety, Risk, Reliability and Quality",Hindawi Publishing Corporation,True,en,Engineering,
https://openalex.org/W2119117682,GPX3 hypermethylation serves as an independent prognostic biomarker in non-M3 acute myeloid leukemia.,PubMed,12,,https://api.labs.crossref.org/works/null?mailto=christian.hauschke@tib.eu,2015,article,True,89,Acute Myeloid Leukemia,Health Sciences,Hematology,National Institutes of Health,False,en,Medicine,
https://openalex.org/W2123019392,"A Phase III, Randomized, Double-Blind, Matched-Pairs, Active-Controlled Clinical Trial and Preclinical Animal Study to Compare the Durability, Efficacy and Safety between Polynucleotide Filler and Hyaluronic Acid Filler in the Correction of Crow's Feet: A New Concept of Regenerative Filler",Journal of Korean Medical Science,12,https://doi.org/10.3346/jkms.2014.29.s3.s201,https://api.labs.crossref.org/works/https://doi.org/10.3346/jkms.2014.29.s3.s201?mailto=christian.hauschke@tib.eu,2014,article,True,89,Wound Healing and Regeneration,Health Sciences,Rehabilitation,Korean Academy of Medical Sciences,True,en,Medicine,
https://openalex.org/W2128353062,An immobilised Co(<scp>ii</scp>) and Ni(<scp>ii</scp>) Schiff base magnetic nanocatalyst via a click reaction: a greener approach for alcohol oxidation,New Journal of Chemistry,12,https://doi.org/10.1039/c5nj00218d,https://api.labs.crossref.org/works/https://doi.org/10.1039/c5nj00218d?mailto=christian.hauschke@tib.eu,2015,article,True,89,Click Chemistry in Chemical Biology and Drug Development,Physical Sciences,Organic Chemistry,Royal Society of Chemistry,False,en,Chemistry,
https://openalex.org/W2130819612,RETRACTED ARTICLE: A meta-analysis of external fixator versus intramedullary nails for open tibial fracture fixation,Journal of Orthopaedic Surgery and Research,12,https://doi.org/10.1186/s13018-014-0075-6,https://api.labs.crossref.org/works/https://doi.org/10.1186/s13018-014-0075-6?mailto=christian.hauschke@tib.eu,2014,article,True,89,Epidemiology and Treatment of Bone Fractures,Health Sciences,Epidemiology,BioMed Central,True,en,Medicine,
https://openalex.org/W2141516058,Knockdown of cancerous inhibitor of protein phosphatase 2A may sensitize metastatic castration-resistant prostate cancer cells to cabazitaxel chemotherapy,Tumor Biology,12,https://doi.org/10.1007/s13277-014-2748-5,https://api.labs.crossref.org/works/https://doi.org/10.1007/s13277-014-2748-5?mailto=christian.hauschke@tib.eu,2014,article,True,89,Advancements in Prostate Cancer Research,Health Sciences,Pulmonary and Respiratory Medicine,SAGE Publishing,False,en,Medicine,
https://openalex.org/W2156722874,MicroRNA-214 promotes proliferation and inhibits apoptosis via targeting Bax in nasopharyngeal carcinoma cells,Molecular Medicine Reports,12,https://doi.org/10.3892/mmr.2015.4168,https://api.labs.crossref.org/works/https://doi.org/10.3892/mmr.2015.4168?mailto=christian.hauschke@tib.eu,2015,article,True,89,MicroRNA Regulation in Cancer and Development,Life Sciences,Cancer Research,Spandidos Publishing,True,en,"Biochemistry, Genetics and Molecular Biology",
https://openalex.org/W2163116932,<i>Retracted:</i> Third‐trimester uterine artery Doppler measurement and maternal postpartum outcome among patients with severe pre‐eclampsia,International Journal of Gynecology & Obstetrics,12,https://doi.org/10.1016/j.ijgo.2015.03.045,https://api.labs.crossref.org/works/https://doi.org/10.1016/j.ijgo.2015.03.045?mailto=christian.hauschke@tib.eu,2015,article,True,89,Pathophysiology and Management of Preeclampsia,Health Sciences,Obstetrics and Gynecology,Elsevier BV,False,en,Medicine,
https://openalex.org/W2168087091,Direct Interaction between the WD40 Repeat Protein WDR-23 and SKN-1/Nrf Inhibits Binding to Target DNA,Molecular and Cellular Biology,12,https://doi.org/10.1128/mcb.00114-14,https://api.labs.crossref.org/works/https://doi.org/10.1128/mcb.00114-14?mailto=christian.hauschke@tib.eu,2014,article,True,89,Molecular Mechanisms of Aging and Longevity,Life Sciences,Aging,Taylor & Francis,True,en,"Biochemistry, Genetics and Molecular Biology",
https://openalex.org/W2168979291,No more pain upon <scp>G</scp><sub>q</sub>‐protein‐coupled receptor activation: role of endocannabinoids,European Journal of Neuroscience,12,https://doi.org/10.1111/ejn.12475,https://api.labs.crossref.org/works/https://doi.org/10.1111/ejn.12475?mailto=christian.hauschke@tib.eu,2014,article,True,89,Endocannabinoid System and Its Effects on Health,Health Sciences,Pharmacology,Wiley-Blackwell,False,en,Medicine,
https://openalex.org/W2172861231,RETRACTED ARTICLE: Impact of maternal fasting on fetal well-being parameters and fetal–neonatal outcome: a case–control study,Journal of Maternal-fetal & Neonatal Medicine,12,https://doi.org/10.3109/14767058.2015.1105955,https://api.labs.crossref.org/works/https://doi.org/10.3109/14767058.2015.1105955?mailto=christian.hauschke@tib.eu,2015,article,True,89,Intermittent Fasting and Health Effects,Health Sciences,Physiology,Informa,False,en,Medicine,
https://openalex.org/W2182476747,Interleukin-1 Receptor Antagonist Has a Novel Function in the Regulation of Matrix Metalloproteinase-13 Expression,PLOS ONE,12,https://doi.org/10.1371/journal.pone.0140942,https://api.labs.crossref.org/works/https://doi.org/10.1371/journal.pone.0140942?mailto=christian.hauschke@tib.eu,2015,article,True,89,Role of Matrix Metalloproteinases in Cancer and Physiology,Life Sciences,Cancer Research,Public Library of Science,True,en,"Biochemistry, Genetics and Molecular Biology",
https://openalex.org/W2201387342,Ac2PIM-responsive miR-150 and miR-143 Target Receptor-interacting Protein Kinase 2 and Transforming Growth Factor Beta-activated Kinase 1 to Suppress NOD2-induced Immunomodulators,Journal of Biological Chemistry,12,https://doi.org/10.1074/jbc.m115.662817,https://api.labs.crossref.org/works/https://doi.org/10.1074/jbc.m115.662817?mailto=christian.hauschke@tib.eu,2015,article,True,89,Role of Macrophage Migration Inhibitory Factor,Life Sciences,Immunology,Elsevier BV,True,en,Immunology and Microbiology,
https://openalex.org/W2232721598,RETRACTED ARTICLE: Application of avian cytokines as immuno-modulating agents,Worlds Poultry Science Journal,12,https://doi.org/10.1017/s004393391500238x,https://api.labs.crossref.org/works/https://doi.org/10.1017/s004393391500238x?mailto=christian.hauschke@tib.eu,2015,article,True,89,Viral Diseases in Livestock and Poultry,Life Sciences,Animal Science and Zoology,Taylor & Francis,False,en,Agricultural and Biological Sciences,
https://openalex.org/W2236620027,New insight into the rheumatoid vasculitis,Revue roumaine de médecine interne,12,https://doi.org/10.1515/rjim-2015-0017,https://api.labs.crossref.org/works/https://doi.org/10.1515/rjim-2015-0017?mailto=christian.hauschke@tib.eu,2015,article,True,89,Systemic Lupus Erythematosus and Antiphospholipid Syndrome,Health Sciences,Rheumatology,De Gruyter Open,True,en,Medicine,
https://openalex.org/W2256197588,Serological and Entomological Study of Dengue in Dang and Chitwan Districts of Nepal,PLOS ONE,12,https://doi.org/10.1371/journal.pone.0147953,https://api.labs.crossref.org/works/https://doi.org/10.1371/journal.pone.0147953?mailto=christian.hauschke@tib.eu,2016,article,True,89,Global Impact of Arboviral Diseases,Health Sciences,"Public Health, Environmental and Occupational Health",Public Library of Science,True,en,Medicine,
