id,display_name,primary_location_display_name,cited_by_count,doi,crossref_call,publication_year,type,is_retracted,cited_by_percentile_year_min,primary_topic_display_name,primary_topic_domain_display_name,primary_topic_subfield_display_name,primary_location_source_host_organization_name,open_access_is_oa,language,primary_topic_field_display_name,update_nature
https://openalex.org/W2331022739,RETRACTED ARTICLE: A randomized phase II study of everolimus for advanced pancreatic neuroendocrine tumors in Chinese patients,Medical Oncology,13,https://doi.org/10.1007/s12032-014-0251-x,https://api.labs.crossref.org/works/https://doi.org/10.1007/s12032-014-0251-x?mailto=christian.hauschke@tib.eu,2014,article,True,89,Epidemiology and Management of Neuroendocrine Tumors,Health Sciences,Epidemiology,Springer Science+Business Media,False,en,Medicine,
https://openalex.org/W2408827871,Nucleostemin regulates proliferation and migration of gastric cancer and correlates with its malignancy.,PubMed,13,,https://api.labs.crossref.org/works/null?mailto=christian.hauschke@tib.eu,2015,article,True,89,RNA Methylation and Modification in Gene Expression,Life Sciences,Molecular Biology,National Institutes of Health,False,en,"Biochemistry, Genetics and Molecular Biology",
https://openalex.org/W2462084719,"The bonding, charge distribution, spin ordering, optical, and elastic properties of four MAX phases Cr2AX (A = Al or Ge, X = C or N): From density functional theory study",Journal of Applied Physics,13,https://doi.org/10.1063/1.4829485,https://api.labs.crossref.org/works/https://doi.org/10.1063/1.4829485?mailto=christian.hauschke@tib.eu,2013,article,True,89,Two-Dimensional Transition Metal Carbides and Nitrides (MXenes),Physical Sciences,Materials Chemistry,American Institute of Physics,False,en,Materials Science,
https://openalex.org/W2533121952,RETRACTED: The effectiveness of group-based behavioral activation in the treatment of depression: An updated meta-analysis of randomized controlled trial,Journal of Affective Disorders,13,https://doi.org/10.1016/j.jad.2016.08.026,https://api.labs.crossref.org/works/https://doi.org/10.1016/j.jad.2016.08.026?mailto=christian.hauschke@tib.eu,2017,article,True,89,Digital Mental Health Interventions and Efficacy,Social Sciences,Applied Psychology,Elsevier BV,False,en,Psychology,
https://openalex.org/W2581553159,Identification of CD4<sup>+</sup> T-cell-derived CD161<sup>+</sup> CD39<sup>+</sup> and CD39<sup>+</sup>CD73<sup>+</sup> microparticles as new biomarkers for rheumatoid arthritis,Biomarkers in Medicine,13,https://doi.org/10.2217/bmm-2016-0261,https://api.labs.crossref.org/works/https://doi.org/10.2217/bmm-2016-0261?mailto=christian.hauschke@tib.eu,2017,article,True,89,Natural Killer Cells in Immunity,Life Sciences,Immunology,Future Medicine,False,en,Immunology and Microbiology,
https://openalex.org/W2583778897,Identification of Peptidoglycan Hydrolase Constructs with Synergistic Staphylolytic Activity in Cow's Milk,Applied and Environmental Microbiology,13,https://doi.org/10.1128/aem.03445-16,https://api.labs.crossref.org/works/https://doi.org/10.1128/aem.03445-16?mailto=christian.hauschke@tib.eu,2017,article,True,89,Bovine Mastitis and Milk Quality,Life Sciences,Agronomy and Crop Science,American Society for Microbiology,True,en,Agricultural and Biological Sciences,
https://openalex.org/W2588040342,Mycobacterium tuberculosis EsxL inhibits MHC-II expression by promoting hypermethylation in class-II transactivator loci in macrophages,Journal of Biological Chemistry,13,https://doi.org/10.1074/jbc.m117.775205,https://api.labs.crossref.org/works/https://doi.org/10.1074/jbc.m117.775205?mailto=christian.hauschke@tib.eu,2017,article,True,89,Macrophage Activation and Polarization,Life Sciences,Immunology,Elsevier BV,True,en,Immunology and Microbiology,
https://openalex.org/W2588936345,Correlations of microvascular blood flow of contrast-enhanced ultrasound and HGF/c-Met signaling pathway with clinicopathological features and prognosis of patients with hepatocellular carcinoma,OncoTargets and Therapy,13,https://doi.org/10.2147/ott.s113353,https://api.labs.crossref.org/works/https://doi.org/10.2147/ott.s113353?mailto=christian.hauschke@tib.eu,2017,article,True,89,Hepatocellular Carcinoma,Health Sciences,Hepatology,Dove Medical Press,True,en,Medicine,
https://openalex.org/W2593873668,RETRACTED ARTICLE: Relationships between PTEN gene mutations and prognosis in glioma: a meta-analysis,Tumor Biology,13,https://doi.org/10.1007/s13277-014-1885-1,https://api.labs.crossref.org/works/https://doi.org/10.1007/s13277-014-1885-1?mailto=christian.hauschke@tib.eu,2014,article,True,89,mTOR Signaling in Growth and Disease,Life Sciences,Molecular Biology,SAGE Publishing,False,en,"Biochemistry, Genetics and Molecular Biology",
https://openalex.org/W2600106170,RETRACTED ARTICLE: Sex and age differences in phenylephrine mechanisms and outcomes after piglet brain injury,Pediatric Research,13,https://doi.org/10.1038/pr.2017.83,https://api.labs.crossref.org/works/https://doi.org/10.1038/pr.2017.83?mailto=christian.hauschke@tib.eu,2017,article,True,89,Management and Pathophysiology of Traumatic Brain Injury,Health Sciences,Neurology,Springer Nature,True,en,Medicine,
https://openalex.org/W2603888834,RETRACTED ARTICLE: Structural features and seismotectonic implications of coseismic surface ruptures produced by the 2016 Mw 7.1 Kumamoto earthquake,Journal of Seismology,13,https://doi.org/10.1007/s10950-017-9653-5,https://api.labs.crossref.org/works/https://doi.org/10.1007/s10950-017-9653-5?mailto=christian.hauschke@tib.eu,2017,article,True,89,Seismicity and Tectonic Plate Interactions,Physical Sciences,Geophysics,Springer Science+Business Media,True,en,Earth and Planetary Sciences,
https://openalex.org/W2604935909,Chemical inhibition reveals differential requirements of signaling pathways in krasV12- and Myc-induced liver tumors in transgenic zebrafish,Scientific Reports,13,https://doi.org/10.1038/srep45796,https://api.labs.crossref.org/works/https://doi.org/10.1038/srep45796?mailto=christian.hauschke@tib.eu,2017,article,True,89,Hedgehog Signaling in Development and Cancer,Life Sciences,Molecular Biology,Nature Portfolio,True,en,"Biochemistry, Genetics and Molecular Biology",
https://openalex.org/W2609647980,REMOVED: Exercise as antidepressant treatment: Time for the transition from trials to clinic?,General Hospital Psychiatry,13,https://doi.org/10.1016/j.genhosppsych.2017.04.008,https://api.labs.crossref.org/works/https://doi.org/10.1016/j.genhosppsych.2017.04.008?mailto=christian.hauschke@tib.eu,2017,article,True,89,Molecular Mechanisms of Depression Treatment Strategies,Health Sciences,Pharmacology,Elsevier BV,False,en,Medicine,
https://openalex.org/W2611215089,RETRACTED ARTICLE: Different analgesics prior to intrauterine device insertion: is there any evidence of efficacy?,The European Journal of Contraception & Reproductive Health Care,13,https://doi.org/10.1080/13625187.2017.1317340,https://api.labs.crossref.org/works/https://doi.org/10.1080/13625187.2017.1317340?mailto=christian.hauschke@tib.eu,2017,article,True,89,Contraception and Unintended Pregnancy Prevention,Health Sciences,"Public Health, Environmental and Occupational Health",Taylor & Francis,False,en,Medicine,
https://openalex.org/W2621500851,Notice of Retraction: Inverse Matrix Auto-Search Technique for the RTS MIMO OTA Test—Part 1: Theory,IEEE Transactions on Electromagnetic Compatibility,13,https://doi.org/10.1109/temc.2017.2708729,https://api.labs.crossref.org/works/https://doi.org/10.1109/temc.2017.2708729?mailto=christian.hauschke@tib.eu,2017,article,True,89,Fabric Defect Detection in Industrial Applications,Physical Sciences,Industrial and Manufacturing Engineering,Institute of Electrical and Electronics Engineers,False,en,Engineering,
https://openalex.org/W2622432095,RETRACTED: Anisotropic (spherical/hexagon/cube) silver nanoparticle embedded magnetic carbon nanosphere as platform for designing of tramadol imprinted polymer,Biosensors and Bioelectronics,13,https://doi.org/10.1016/j.bios.2017.06.003,https://api.labs.crossref.org/works/https://doi.org/10.1016/j.bios.2017.06.003?mailto=christian.hauschke@tib.eu,2017,article,True,89,Analytical Chemistry Techniques,Physical Sciences,Analytical Chemistry,Elsevier BV,False,en,Chemistry,
https://openalex.org/W2674731409,RETRACTED: An event detection method for social networks based on link prediction,Information Systems,13,https://doi.org/10.1016/j.is.2017.06.003,https://api.labs.crossref.org/works/https://doi.org/10.1016/j.is.2017.06.003?mailto=christian.hauschke@tib.eu,2017,article,True,89,Statistical Mechanics of Complex Networks,Physical Sciences,Statistical and Nonlinear Physics,Elsevier BV,False,en,Physics and Astronomy,
https://openalex.org/W2697980504,RETRACTED ARTICLE: A novel technique applied to the economic investigation of recommender system,Multimedia Tools and Applications,13,https://doi.org/10.1007/s11042-017-4752-4,https://api.labs.crossref.org/works/https://doi.org/10.1007/s11042-017-4752-4?mailto=christian.hauschke@tib.eu,2017,article,True,89,Predicting Stock Market Trends and Movements,Social Sciences,Management Science and Operations Research,Springer Science+Business Media,False,en,Decision Sciences,
https://openalex.org/W2708852203,<i>Retracted:</i> miR‐188 promotes senescence of lineage‐negative bone marrow cells by targeting <scp>MAP</scp>3K3 expression,FEBS Letters,13,https://doi.org/10.1002/1873-3468.12720,https://api.labs.crossref.org/works/https://doi.org/10.1002/1873-3468.12720?mailto=christian.hauschke@tib.eu,2017,article,True,89,MicroRNA Regulation in Cancer and Development,Life Sciences,Cancer Research,Wiley-Blackwell,True,en,"Biochemistry, Genetics and Molecular Biology",
https://openalex.org/W2734343586,"RETRACTED ARTICLE: Rhodozepinone, a new antitrypanosomal azepino-diindole alkaloid from the marine sponge-derived bacterium Rhodococcus sp. UA13",Medicinal Chemistry Research,13,https://doi.org/10.1007/s00044-017-1974-y,https://api.labs.crossref.org/works/https://doi.org/10.1007/s00044-017-1974-y?mailto=christian.hauschke@tib.eu,2017,article,True,89,Sponge-Associated Microorganisms and Biotechnological Potential,Life Sciences,Biotechnology,Springer Science+Business Media,False,en,"Biochemistry, Genetics and Molecular Biology",
https://openalex.org/W2735602390,Removal and Recycling of Precious Rare Earth Element from Wastewater Samples Using Imprinted Magnetic Ordered Mesoporous Carbon,ACS Sustainable Chemistry & Engineering,13,https://doi.org/10.1021/acssuschemeng.7b01124,https://api.labs.crossref.org/works/https://doi.org/10.1021/acssuschemeng.7b01124?mailto=christian.hauschke@tib.eu,2017,article,True,89,Battery Recycling and Rare Earth Recovery,Physical Sciences,Mechanical Engineering,American Chemical Society,True,en,Engineering,
https://openalex.org/W2737865105,The greatwall kinase is dominant over PKA in controlling the antagonistic function of ARPP19 in<i>Xenopus</i>oocytes,Cell Cycle,13,https://doi.org/10.1080/15384101.2017.1338985,https://api.labs.crossref.org/works/https://doi.org/10.1080/15384101.2017.1338985?mailto=christian.hauschke@tib.eu,2017,article,True,89,Molecular Mechanisms of Aging and Longevity,Life Sciences,Aging,Taylor & Francis,True,en,"Biochemistry, Genetics and Molecular Biology",
https://openalex.org/W2739584568,RETRACTED ARTICLE: Increased Aβ42-α7-like nicotinic acetylcholine receptor complex level in lymphocytes is associated with apolipoprotein E4-driven Alzheimer’s disease pathogenesis,Alzheimer's Research & Therapy,13,https://doi.org/10.1186/s13195-017-0280-8,https://api.labs.crossref.org/works/https://doi.org/10.1186/s13195-017-0280-8?mailto=christian.hauschke@tib.eu,2017,article,True,89,Mechanisms of Alzheimer's Disease,Health Sciences,Physiology,BioMed Central,True,en,Medicine,
https://openalex.org/W2741551907,"Upregulation of microRNA-25-3p inhibits proliferation, migration and invasion of osteosarcoma cells in vitro by directly targeting SOX4",Molecular Medicine Reports,13,https://doi.org/10.3892/mmr.2017.7103,https://api.labs.crossref.org/works/https://doi.org/10.3892/mmr.2017.7103?mailto=christian.hauschke@tib.eu,2017,article,True,89,MicroRNA Regulation in Cancer and Development,Life Sciences,Cancer Research,Spandidos Publishing,True,en,"Biochemistry, Genetics and Molecular Biology",
https://openalex.org/W2745705496,MicroRNA-138 directly targets TNFAIP8 and acts as a tumor suppressor in osteosarcoma,Experimental and Therapeutic Medicine,13,https://doi.org/10.3892/etm.2017.4947,https://api.labs.crossref.org/works/https://doi.org/10.3892/etm.2017.4947?mailto=christian.hauschke@tib.eu,2017,article,True,89,MicroRNA Regulation in Cancer and Development,Life Sciences,Cancer Research,Spandidos Publishing,True,en,"Biochemistry, Genetics and Molecular Biology",
https://openalex.org/W2755981740,RETRACTED ARTICLE: The melanocortin signaling cAMP axis accelerates repair and reduces mutagenesis of platinum-induced DNA damage,Scientific Reports,13,https://doi.org/10.1038/s41598-017-12056-5,https://api.labs.crossref.org/works/https://doi.org/10.1038/s41598-017-12056-5?mailto=christian.hauschke@tib.eu,2017,article,True,89,Melanin Pigmentation in Mammalian Skin,Life Sciences,Cell Biology,Nature Portfolio,True,en,"Biochemistry, Genetics and Molecular Biology",
https://openalex.org/W2756698938,Bmi-1-targeting suppresses osteosarcoma aggressiveness through the NF-κB signaling pathway,Molecular Medicine Reports,13,https://doi.org/10.3892/mmr.2017.7660,https://api.labs.crossref.org/works/https://doi.org/10.3892/mmr.2017.7660?mailto=christian.hauschke@tib.eu,2017,article,True,89,Regulation of RNA Processing and Function,Life Sciences,Molecular Biology,Spandidos Publishing,True,en,"Biochemistry, Genetics and Molecular Biology",
https://openalex.org/W2758336317,Tumor necrosis factor-inducible gene 6 protein ameliorates chronic liver damage by promoting autophagy formation in mice,Experimental & Molecular Medicine,13,https://doi.org/10.1038/emm.2017.140,https://api.labs.crossref.org/works/https://doi.org/10.1038/emm.2017.140?mailto=christian.hauschke@tib.eu,2017,article,True,89,Role of Autophagy in Disease and Health,Health Sciences,Epidemiology,Springer Nature,True,en,Medicine,
https://openalex.org/W2759314651,"MicroRNA‑34a directly targets high‑mobility group box 1 and inhibits the cancer cell proliferation, migration and invasion in cutaneous squamous cell carcinoma",Experimental and Therapeutic Medicine,13,https://doi.org/10.3892/etm.2017.5245,https://api.labs.crossref.org/works/https://doi.org/10.3892/etm.2017.5245?mailto=christian.hauschke@tib.eu,2017,article,True,89,MicroRNA Regulation in Cancer and Development,Life Sciences,Cancer Research,Spandidos Publishing,True,en,"Biochemistry, Genetics and Molecular Biology",
https://openalex.org/W2767487661,Spectroscopic and electrochemical properties of PVP based polymer electrolyte films,Polymer Bulletin,13,https://doi.org/10.1007/s00289-017-2229-2,https://api.labs.crossref.org/works/https://doi.org/10.1007/s00289-017-2229-2?mailto=christian.hauschke@tib.eu,2017,article,True,89,Lithium Battery Technologies,Physical Sciences,Electrical and Electronic Engineering,Springer Science+Business Media,False,en,Engineering,
https://openalex.org/W2768059677,RETRACTED ARTICLE: Overexpression of 5-Lipoxygenase Worsens the Phenotype of a Mouse Model of Tauopathy,Molecular Neurobiology,13,https://doi.org/10.1007/s12035-017-0817-7,https://api.labs.crossref.org/works/https://doi.org/10.1007/s12035-017-0817-7?mailto=christian.hauschke@tib.eu,2017,article,True,89,Mechanisms of Alzheimer's Disease,Health Sciences,Physiology,Springer Science+Business Media,False,en,Medicine,
https://openalex.org/W2770433091,"Effects of microRNA-708 on Epithelial-Mesenchymal Transition, Cell Proliferation and Apoptosis in Melanoma Cells by Targeting LEF1 through the Wnt Signaling Pathway",Pathology & Oncology Research,13,https://doi.org/10.1007/s12253-017-0334-z,https://api.labs.crossref.org/works/https://doi.org/10.1007/s12253-017-0334-z?mailto=christian.hauschke@tib.eu,2017,article,True,89,MicroRNA Regulation in Cancer and Development,Life Sciences,Cancer Research,Springer Science+Business Media,False,en,"Biochemistry, Genetics and Molecular Biology",
https://openalex.org/W2771230502,<i>Retracted</i>: Effects of microrna‐93 on mouse cardiac microvascular endothelial cells injury and inflammatory response by mediating SPP1 through the NF‐ΚB pathway,Journal of Cellular Biochemistry,13,https://doi.org/10.1002/jcb.26567,https://api.labs.crossref.org/works/https://doi.org/10.1002/jcb.26567?mailto=christian.hauschke@tib.eu,2017,article,True,89,"Aetiology, Diagnosis, and Management of Myocarditis",Health Sciences,Cardiology and Cardiovascular Medicine,Wiley,True,en,Medicine,
https://openalex.org/W2777699429,Creativity from Start to Finish: A “Straight‐A” Model of Creative Process and Its Relation to Intelligence,The Journal of Creative Behavior,13,https://doi.org/10.1002/jocb.223,https://api.labs.crossref.org/works/https://doi.org/10.1002/jocb.223?mailto=christian.hauschke@tib.eu,2017,article,True,89,The Study of Creativity and Innovation,Social Sciences,Experimental and Cognitive Psychology,Wiley-Blackwell,False,en,Psychology,
https://openalex.org/W2788125042,Retracted: Witnessing Moral Violations Increases Conformity in Consumption,Journal of Consumer Research,13,https://doi.org/10.1093/jcr/ucx061,https://api.labs.crossref.org/works/https://doi.org/10.1093/jcr/ucx061?mailto=christian.hauschke@tib.eu,2017,article,True,89,Neuroscience of Moral Judgment and Disgust,Life Sciences,Cognitive Neuroscience,Oxford University Press,False,en,Neuroscience,
https://openalex.org/W2890394950,RETRACTED: Superior techniques for disposal of highly radioactive waste (HLW),Progress in Nuclear Energy,13,https://doi.org/10.1016/j.pnucene.2012.01.005,https://api.labs.crossref.org/works/https://doi.org/10.1016/j.pnucene.2012.01.005?mailto=christian.hauschke@tib.eu,2012,article,True,89,Safety and Management of Nuclear Fuel Transportation,Physical Sciences,"Safety, Risk, Reliability and Quality",Elsevier BV,True,en,Engineering,
https://openalex.org/W2932075515,RETRACTED ARTICLE: Aging decreases rate of docosahexaenoic acid synthesis-secretion from circulating unesterified α-linolenic acid by rat liver,Age,13,https://doi.org/10.1007/s11357-012-9390-1,https://api.labs.crossref.org/works/https://doi.org/10.1007/s11357-012-9390-1?mailto=christian.hauschke@tib.eu,2012,article,True,89,Role of Omega-3 Fatty Acids in Health,Health Sciences,Nutrition and Dietetics,Springer Science+Business Media,True,en,Nursing,
https://openalex.org/W2955524227,RETRACTED ARTICLE: Meloxicam Taste-Masked Oral Disintegrating Tablet with Dissolution Enhanced by Ion Exchange Resins and Cyclodextrin,AAPS PharmSciTech,13,https://doi.org/10.1208/s12249-013-0001-y,https://api.labs.crossref.org/works/https://doi.org/10.1208/s12249-013-0001-y?mailto=christian.hauschke@tib.eu,2013,article,True,89,Drug Delivery Systems,Life Sciences,Pharmaceutical Science,Springer Science+Business Media,True,en,"Pharmacology, Toxicology and Pharmaceutics",
https://openalex.org/W2963648890,"At which magnetic field, exactly, does the Kondo resonance begin to split? A Fermi liquid description of the low-energy properties of the Anderson model",Physical review,13,https://doi.org/10.1103/physrevb.95.165404,https://api.labs.crossref.org/works/https://doi.org/10.1103/physrevb.95.165404?mailto=christian.hauschke@tib.eu,2017,article,True,89,Semiconductor Spintronics and Quantum Computing,Physical Sciences,"Atomic and Molecular Physics, and Optics",American Physical Society,True,en,Physics and Astronomy,
https://openalex.org/W3154088065,MicroRNA differential expression spectrum and microRNA-125a-5p inhibition of laryngeal cancer cell proliferation,Experimental and Therapeutic Medicine,13,https://doi.org/10.3892/etm.2017.4685,https://api.labs.crossref.org/works/https://doi.org/10.3892/etm.2017.4685?mailto=christian.hauschke@tib.eu,2017,article,True,89,MicroRNA Regulation in Cancer and Development,Life Sciences,Cancer Research,Spandidos Publishing,True,en,"Biochemistry, Genetics and Molecular Biology",
https://openalex.org/W3196298357,"Semáforo nutricional de alimentos procesados: estudio cualitativo sobre conocimientos, comprensión, actitudes y prácticas en el Ecuador",Revista Peruana de Medicina Experimental y Salud Pública,13,https://doi.org/10.17843/rpmesp.2017.341.2762,https://api.labs.crossref.org/works/https://doi.org/10.17843/rpmesp.2017.341.2762?mailto=christian.hauschke@tib.eu,2017,article,True,89,Impact of Ultra-Processed Foods on Health,Health Sciences,"Public Health, Environmental and Occupational Health",National Institute of Health of Peru,True,en,Medicine,
https://openalex.org/W330434132,Diagnostic Performance of Serum Macrophage Inhibitory Cytokine-1 in Pancreatic Cancer: A Meta-Analysis and Meta-Regression Analysis,DNA and Cell Biology,13,https://doi.org/10.1089/dna.2013.2237,https://api.labs.crossref.org/works/https://doi.org/10.1089/dna.2013.2237?mailto=christian.hauschke@tib.eu,2014,article,True,89,Role of Growth Factors in Health and Disease,Health Sciences,Rheumatology,"Mary Ann Liebert, Inc.",False,en,Medicine,
https://openalex.org/W4232912712,"Transurethral Resection of Prostate and Bleeding: A Prospective, Randomized, Double-Blind Placebo-Controlled Trial to See the Efficacy of Short-Term Use of Finasteride and Dutasteride on Operative Blood Loss and Prostatic Microvessel Density",Journal of Endourology,13,https://doi.org/10.1089/end.2016.0696,https://api.labs.crossref.org/works/https://doi.org/10.1089/end.2016.0696?mailto=christian.hauschke@tib.eu,2017,article,True,89,Standardisation of Lower Urinary Tract Function,Health Sciences,Urology,"Mary Ann Liebert, Inc.",False,en,Medicine,
https://openalex.org/W759322286,Adaptation of ANFIS model to assess thermal comfort of an urban square in moderate and dry climate,Stochastic Environmental Research and Risk Assessment,13,https://doi.org/10.1007/s00477-015-1116-3,https://api.labs.crossref.org/works/https://doi.org/10.1007/s00477-015-1116-3?mailto=christian.hauschke@tib.eu,2015,article,True,89,Urban Heat Islands and Mitigation Strategies,Physical Sciences,Environmental Engineering,Springer Science+Business Media,False,en,Environmental Science,
https://openalex.org/W787901476,"RETRACTED: Structural, electronic, optical, elastic and thermal properties of CdSnP2 with the application in solar cell devices",Superlattices and Microstructures,13,https://doi.org/10.1016/j.spmi.2015.07.014,https://api.labs.crossref.org/works/https://doi.org/10.1016/j.spmi.2015.07.014?mailto=christian.hauschke@tib.eu,2015,article,True,89,Thin-Film Solar Cell Technology,Physical Sciences,Electrical and Electronic Engineering,Elsevier BV,True,en,Engineering,
https://openalex.org/W810089043,RETRACTED ARTICLE: Day of the year-based prediction of horizontal global solar radiation by a neural network auto-regressive model,Theoretical and Applied Climatology,13,https://doi.org/10.1007/s00704-015-1533-8,https://api.labs.crossref.org/works/https://doi.org/10.1007/s00704-015-1533-8?mailto=christian.hauschke@tib.eu,2015,article,True,89,Machine Learning Methods for Solar Radiation Forecasting,Physical Sciences,Artificial Intelligence,Springer Science+Business Media,False,en,Computer Science,
https://openalex.org/W841173951,RETRACTED: Annexin A7 modulates BAG4 and BAG4-binding proteins in mitochondrial apoptosis,Biomedicine & Pharmacotherapy,13,https://doi.org/10.1016/j.biopha.2015.06.005,https://api.labs.crossref.org/works/https://doi.org/10.1016/j.biopha.2015.06.005?mailto=christian.hauschke@tib.eu,2015,article,True,89,Molecular Chaperones in Protein Folding and Disease,Life Sciences,Molecular Biology,Elsevier BV,False,en,"Biochemistry, Genetics and Molecular Biology",
https://openalex.org/W948677531,SUMO-specific protease 6 promotes gastric cancer cell growth via deSUMOylation of FoxM1,Tumor Biology,13,https://doi.org/10.1007/s13277-015-3737-z,https://api.labs.crossref.org/works/https://doi.org/10.1007/s13277-015-3737-z?mailto=christian.hauschke@tib.eu,2015,article,True,89,Ubiquitin-Proteasome Proteolytic Pathway,Life Sciences,Molecular Biology,SAGE Publishing,False,en,"Biochemistry, Genetics and Molecular Biology",
https://openalex.org/W981412307,"RETRACTED ARTICLE: Downregulation of microRNA-217 and microRNA-646 acts as potential predictor biomarkers in progression, metastasis, and unfavorable prognosis of human osteosarcoma",Tumor Biology,13,https://doi.org/10.1007/s13277-015-3821-4,https://api.labs.crossref.org/works/https://doi.org/10.1007/s13277-015-3821-4?mailto=christian.hauschke@tib.eu,2015,article,True,89,MicroRNA Regulation in Cancer and Development,Life Sciences,Cancer Research,SAGE Publishing,False,en,"Biochemistry, Genetics and Molecular Biology",
https://openalex.org/W1539978227,Retracted: Promoter Methylation of the<i>RASSF1A</i>Gene may Contribute to Colorectal Cancer Susceptibility: A Meta-Analysis of Cohort Studies,Annals of Human Genetics,12,https://doi.org/10.1111/ahg.12059,https://api.labs.crossref.org/works/https://doi.org/10.1111/ahg.12059?mailto=christian.hauschke@tib.eu,2014,article,True,89,Epigenetic Modifications and Their Functional Implications,Life Sciences,Molecular Biology,Wiley,False,en,"Biochemistry, Genetics and Molecular Biology",
https://openalex.org/W1552947579,Retracted: Genome‐wide association study identifies common genetic variants associated with salivary gland carcinoma and its subtypes,Cancer,12,https://doi.org/10.1002/cncr.29381,https://api.labs.crossref.org/works/https://doi.org/10.1002/cncr.29381?mailto=christian.hauschke@tib.eu,2015,article,True,89,Salivary Gland Tumors and Carcinomas,Health Sciences,Surgery,Wiley-Blackwell,True,en,Medicine,
