id,display_name,primary_location_display_name,cited_by_count,doi,crossref_call,publication_year,type,is_retracted,cited_by_percentile_year_min,primary_topic_display_name,primary_topic_domain_display_name,primary_topic_subfield_display_name,primary_location_source_host_organization_name,open_access_is_oa,language,primary_topic_field_display_name,update_nature
https://openalex.org/W2137417716,RETRACTED: Bone mineral density of lumbar spine and femur in patients with gynecologic cancer,Climacteric,0,https://doi.org/10.3109/13697137.2013.861815,https://api.labs.crossref.org/works/https://doi.org/10.3109/13697137.2013.861815?mailto=christian.hauschke@tib.eu,2013,article,True,0,Osteoporosis,Health Sciences,Orthopedics and Sports Medicine,Taylor & Francis,False,en,Medicine,
https://openalex.org/W2137923165,Notice of Retraction: The performance evaluation of junior county-level civil servants: Problems and countermeasures: Based on the investigation of 11 counties in Jiangxi Province,,0,https://doi.org/10.1109/icebeg.2011.5881873,https://api.labs.crossref.org/works/https://doi.org/10.1109/icebeg.2011.5881873?mailto=christian.hauschke@tib.eu,2011,article,True,0,"Customer Relationships, Behavior, and Loyalty",Social Sciences,Organizational Behavior and Human Resource Management,,False,en,"Business, Management and Accounting",
https://openalex.org/W2138145020,Notice of Retraction: The discussion on the economic cooperation of Yunnan in Pan pearl river delta,,0,https://doi.org/10.1109/icebeg.2011.5887201,https://api.labs.crossref.org/works/https://doi.org/10.1109/icebeg.2011.5887201?mailto=christian.hauschke@tib.eu,2011,article,True,0,Spatial Shift-Share Analysis in Economic Development,Social Sciences,Economics and Econometrics,,False,en,"Economics, Econometrics and Finance",
https://openalex.org/W2139094982,Notice of Retraction: A research on the basic issues of the Vehicle Quality Chain Management,,0,https://doi.org/10.1109/icpim.2011.5983603,https://api.labs.crossref.org/works/https://doi.org/10.1109/icpim.2011.5983603?mailto=christian.hauschke@tib.eu,2011,article,True,0,Comprehensive Assessment of Safety in Energy and Infrastructure,Physical Sciences,"Safety, Risk, Reliability and Quality",,False,en,Engineering,
https://openalex.org/W2139298929,Notice of Retraction: An analysis on the supply and demand of timber in China,,0,https://doi.org/10.1109/icebeg.2011.5881726,https://api.labs.crossref.org/works/https://doi.org/10.1109/icebeg.2011.5881726?mailto=christian.hauschke@tib.eu,2011,article,True,0,Climate Change Impacts on Forest Carbon Sequestration,Physical Sciences,Global and Planetary Change,,False,en,Environmental Science,
https://openalex.org/W2139310072,A novel deployment of multicast applications,,0,https://doi.org/10.1109/iceoe.2011.6013320,https://api.labs.crossref.org/works/https://doi.org/10.1109/iceoe.2011.6013320?mailto=christian.hauschke@tib.eu,2011,article,True,0,Scalable Peer-to-Peer Network Architectures,Physical Sciences,Computer Networks and Communications,,False,en,Computer Science,
https://openalex.org/W2139422881,Notice of Retraction: A Novel Method for Rat Osteoarthritis Induced by Sustained Releasing Papain,,0,https://doi.org/10.1109/icbbe.2011.5780413,https://api.labs.crossref.org/works/https://doi.org/10.1109/icbbe.2011.5780413?mailto=christian.hauschke@tib.eu,2011,article,True,0,Osteoarthritis and Cartilage Repair,Health Sciences,Rheumatology,,False,en,Medicine,
https://openalex.org/W2139696939,Notice of Retraction: Transformation of industrial heritage based on the concept of ecology — Case study of Guibei industrial land in Wuhan,,0,https://doi.org/10.1109/icetce.2011.5775714,https://api.labs.crossref.org/works/https://doi.org/10.1109/icetce.2011.5775714?mailto=christian.hauschke@tib.eu,2011,article,True,0,"Temporal, Spatial, and Social Aspects of Cultural Heritage Studies",Social Sciences,Archeology,,False,en,Arts and Humanities,Retraction
https://openalex.org/W2139944046,Notice of Retraction: An analysis of double moral hazard in venture capital under equity contract,,0,https://doi.org/10.1109/icebeg.2011.5881272,https://api.labs.crossref.org/works/https://doi.org/10.1109/icebeg.2011.5881272?mailto=christian.hauschke@tib.eu,2011,article,True,0,Venture Capital and Start-Up Financing,Social Sciences,Accounting,,False,en,"Business, Management and Accounting",Retraction
https://openalex.org/W2140090702,Notice of Retraction: The analysis of current status and course design of business ethics: A survey of E-commerce students in Zhejiang province,,0,https://doi.org/10.1109/icebeg.2011.5886955,https://api.labs.crossref.org/works/https://doi.org/10.1109/icebeg.2011.5886955?mailto=christian.hauschke@tib.eu,2011,article,True,0,Ethical Decision Making in Organizations,Social Sciences,Information Systems and Management,,False,en,Decision Sciences,Retraction
https://openalex.org/W2140368588,Notice of Retraction: Assessment system of public resources for disaster reduction in community,,0,https://doi.org/10.1109/icebeg.2011.5881983,https://api.labs.crossref.org/works/https://doi.org/10.1109/icebeg.2011.5881983?mailto=christian.hauschke@tib.eu,2011,article,True,0,Emergency Management in Various Industries,Social Sciences,Organizational Behavior and Human Resource Management,,False,en,"Business, Management and Accounting",Retraction
https://openalex.org/W2140421051,Notice of Retraction: Research about college students' life cognitive dimensions in dormitory,,0,https://doi.org/10.1109/iceoe.2011.6013391,https://api.labs.crossref.org/works/https://doi.org/10.1109/iceoe.2011.6013391?mailto=christian.hauschke@tib.eu,2011,article,True,0,Neuroscience and Education: Bridging Research and Practice,Life Sciences,Cognitive Neuroscience,,False,en,Neuroscience,Retraction
https://openalex.org/W2140496239,Notice of Retraction: An evaluation on land intensive use in urbanized region a case of Chengdu Xindu,,0,https://doi.org/10.1109/icebeg.2011.5881959,https://api.labs.crossref.org/works/https://doi.org/10.1109/icebeg.2011.5881959?mailto=christian.hauschke@tib.eu,2011,article,True,0,Applications of Remote Sensing in Geoscience and Agriculture,Physical Sciences,Atmospheric Science,,False,en,Earth and Planetary Sciences,Retraction
https://openalex.org/W2140620025,Surfactant lavage therapy for respiratory deterioration in extremely premature infants,Pediatrics International,0,https://doi.org/10.1111/ped.12003,https://api.labs.crossref.org/works/https://doi.org/10.1111/ped.12003?mailto=christian.hauschke@tib.eu,2013,article,True,0,Neonatal Lung Development and Respiratory Morbidity,Health Sciences,Pulmonary and Respiratory Medicine,Wiley-Blackwell,False,en,Medicine,Retraction
https://openalex.org/W2140656501,Notice of Retraction: On the selection of the civil economy road in China,,0,https://doi.org/10.1109/icebeg.2011.5882174,https://api.labs.crossref.org/works/https://doi.org/10.1109/icebeg.2011.5882174?mailto=christian.hauschke@tib.eu,2011,article,True,0,Artistic Interpretation and Illusory Representations,Social Sciences,Literature and Literary Theory,,False,en,Arts and Humanities,Retraction
https://openalex.org/W2140996833,Notice of Retraction: Optimization of Tryptophan Enantiomers Separation by Capillary Electrophoresis with Cyclodextrins,,0,https://doi.org/10.1109/icbbe.2011.5779994,https://api.labs.crossref.org/works/https://doi.org/10.1109/icbbe.2011.5779994?mailto=christian.hauschke@tib.eu,2011,article,True,0,Origins and Future of Microfluidics,Physical Sciences,Biomedical Engineering,,False,en,Engineering,Retraction
https://openalex.org/W2141066518,Notice of Retraction: Effect of Several Oxidants on the Growth of Microcystis aerugrinosa,,0,https://doi.org/10.1109/icbbe.2011.5780967,https://api.labs.crossref.org/works/https://doi.org/10.1109/icbbe.2011.5780967?mailto=christian.hauschke@tib.eu,2011,article,True,0,Eutrophication and Harmful Algal Blooms,Physical Sciences,Environmental Chemistry,,False,en,Environmental Science,Retraction
https://openalex.org/W2141294972,Notice of Retraction A design of fault diagnose system for array infrared sensor based on data fusion technology,,0,https://doi.org/10.1109/icnc.2011.6022085,https://api.labs.crossref.org/works/https://doi.org/10.1109/icnc.2011.6022085?mailto=christian.hauschke@tib.eu,2011,article,True,0,Optoelectronic Systems for Measurement and Detection,Physical Sciences,Electrical and Electronic Engineering,,False,en,Engineering,Retraction
https://openalex.org/W2141557991,Notice of Retraction: Building conversion mechanism: The primary important issue of institutional units pay-for-performance,,0,https://doi.org/10.1109/icebeg.2011.5886800,https://api.labs.crossref.org/works/https://doi.org/10.1109/icebeg.2011.5886800?mailto=christian.hauschke@tib.eu,2011,article,True,0,Value Management in Construction Industry,Social Sciences,Strategy and Management,,False,en,"Business, Management and Accounting",Retraction
https://openalex.org/W2141559058,The evaluation of fish farming impact by nutrient content and chlorophyll A in Mala Lamljana bay,Archives of Biological Sciences,0,https://doi.org/10.2298/abs1302567j,https://api.labs.crossref.org/works/https://doi.org/10.2298/abs1302567j?mailto=christian.hauschke@tib.eu,2013,article,True,0,Metabolism and Nutrition in Aquaculture Feeds,Life Sciences,Aquatic Science,"University of Belgrade, University of Novi Sad",True,en,Agricultural and Biological Sciences,Retraction
https://openalex.org/W2141857047,Notice of Retraction: The effects of work-family conflict on work and family satisfaction and subjective well-being,,0,https://doi.org/10.1109/icebeg.2011.5882479,https://api.labs.crossref.org/works/https://doi.org/10.1109/icebeg.2011.5882479?mailto=christian.hauschke@tib.eu,2011,article,True,0,The Dynamics of Work and Family Interactions,Social Sciences,Sociology and Political Science,,False,en,Social Sciences,Retraction
https://openalex.org/W2141958889,RETRACTED ARTICLE: Transcranial Magnetic Stimulation: Recent Advancement and Neuroethical Issues,Neuroethics,0,https://doi.org/10.1007/s12152-011-9099-3,https://api.labs.crossref.org/works/https://doi.org/10.1007/s12152-011-9099-3?mailto=christian.hauschke@tib.eu,2011,article,True,0,Effects of Brain Stimulation on Motor Cortex,Life Sciences,Neurology,Springer Science+Business Media,True,en,Neuroscience,Retraction
https://openalex.org/W2142105621,"Retracted: Reconstruction of 3D Faces Using Face Space Coefficient, Texture Space and Shape Space",Lecture Notes in Computer Science,0,https://doi.org/10.1007/978-3-642-25200-6_12,https://api.labs.crossref.org/works/https://doi.org/10.1007/978-3-642-25200-6_12?mailto=christian.hauschke@tib.eu,2011,book-chapter,True,0,Face Recognition and Analysis Techniques,Physical Sciences,Computer Vision and Pattern Recognition,Springer Science+Business Media,False,en,Computer Science,Retraction
https://openalex.org/W2142250305,Notice of Retraction: Dynamic Display Design of Large Jewelry Products,,0,https://doi.org/10.1109/paccs.2011.5990126,https://api.labs.crossref.org/works/https://doi.org/10.1109/paccs.2011.5990126?mailto=christian.hauschke@tib.eu,2011,article,True,0,Simulation and Optimization of Industrial Processes,Physical Sciences,Control and Systems Engineering,,False,en,Engineering,Retraction
https://openalex.org/W2142402428,Does Sonographer Knowledge of Bioeffects Improve Safety Practices?,Journal of Diagnostic Medical Sonography,0,https://doi.org/10.1177/8756479310389611,https://api.labs.crossref.org/works/https://doi.org/10.1177/8756479310389611?mailto=christian.hauschke@tib.eu,2011,article,True,0,Enhancing Workplace Safety Culture and Practices,Health Sciences,Radiological and Ultrasound Technology,SAGE Publishing,False,en,Health Professions,Retraction
https://openalex.org/W2142468171,Notice of Retraction: Study on economics evaluation methodology of agricultural environmental effect,,0,https://doi.org/10.1109/icebeg.2011.5882453,https://api.labs.crossref.org/works/https://doi.org/10.1109/icebeg.2011.5882453?mailto=christian.hauschke@tib.eu,2011,article,True,0,Discrete Choice Models in Economics and Health Care,Social Sciences,Economics and Econometrics,,False,en,"Economics, Econometrics and Finance",Retraction
https://openalex.org/W2142797956,Notice of Retraction: Study of the relationship between voluntary assurance of internal control and quality of information disclosure — An empirical analysis of a-share companies listed in main board of Shenzhen stock exchange from 2008 to 2009,,0,https://doi.org/10.1109/icebeg.2011.5882451,https://api.labs.crossref.org/works/https://doi.org/10.1109/icebeg.2011.5882451?mailto=christian.hauschke@tib.eu,2011,article,True,0,Financial Reporting and Earnings Management,Social Sciences,Accounting,,False,en,"Business, Management and Accounting",Retraction
https://openalex.org/W2142858463,Notice of Retraction: A research on regional diversities in urban event tourism driving factor,,0,https://doi.org/10.1109/icebeg.2011.5881262,https://api.labs.crossref.org/works/https://doi.org/10.1109/icebeg.2011.5881262?mailto=christian.hauschke@tib.eu,2011,article,True,0,Fuzzy Class Membership Modeling in Environmental Sciences,Physical Sciences,Ecological Modeling,,False,en,Environmental Science,Retraction
https://openalex.org/W2143109994,Notice of Retraction: Design of sensor modules of active &amp; intelligent energy-saving system,,0,https://doi.org/10.1109/iceice.2011.5778070,https://api.labs.crossref.org/works/https://doi.org/10.1109/iceice.2011.5778070?mailto=christian.hauschke@tib.eu,2011,article,True,0,Wireless Sensor Networks: Survey and Applications,Physical Sciences,Computer Networks and Communications,,False,en,Computer Science,Retraction
https://openalex.org/W2144051960,Retraction notice,Journal of Vibration and Control,0,https://doi.org/10.1177/1077546312470481,https://api.labs.crossref.org/works/https://doi.org/10.1177/1077546312470481?mailto=christian.hauschke@tib.eu,2013,article,True,0,Hydrological Modeling using Machine Learning Methods,Physical Sciences,Environmental Engineering,SAGE Publishing,True,en,Environmental Science,Retraction
https://openalex.org/W2144235946,Notice of Retraction: Estimating potential output in Inner Mongolia,,0,https://doi.org/10.1109/icebeg.2011.5881323,https://api.labs.crossref.org/works/https://doi.org/10.1109/icebeg.2011.5881323?mailto=christian.hauschke@tib.eu,2011,article,True,0,Interdisciplinary Research across Science and Technology,Social Sciences,Management Science and Operations Research,,False,en,Decision Sciences,Retraction
https://openalex.org/W2144242962,Notice of Retraction: Strategies research of Xiangyang City's new energy automotive industry development,,0,https://doi.org/10.1109/icpim.2011.5983595,https://api.labs.crossref.org/works/https://doi.org/10.1109/icpim.2011.5983595?mailto=christian.hauschke@tib.eu,2011,article,True,0,Energy Storage in Power Systems,Physical Sciences,Energy Engineering and Power Technology,,False,en,Energy,Retraction
https://openalex.org/W2144312656,Notice of Retraction: Employee's public service motivation in China: Comparasion between sectors,,0,https://doi.org/10.1109/aimsec.2011.6010891,https://api.labs.crossref.org/works/https://doi.org/10.1109/aimsec.2011.6010891?mailto=christian.hauschke@tib.eu,2011,article,True,0,Collaborative Governance in Public Administration and Management,Social Sciences,Public Administration,,False,en,Social Sciences,Retraction
https://openalex.org/W2144355592,Notice of Retraction: Changes of the Biomass and Aluminum Accumulation of Phragmites australis Seedlings under the Aluminium Stress,,0,https://doi.org/10.1109/icbbe.2011.5781556,https://api.labs.crossref.org/works/https://doi.org/10.1109/icbbe.2011.5781556?mailto=christian.hauschke@tib.eu,2011,article,True,0,Mechanisms of Aluminum Toxicity and Tolerance in Plants,Life Sciences,Plant Science,,False,en,Agricultural and Biological Sciences,Retraction
https://openalex.org/W2144808663,Notice of Retraction: An empirical study on features and the preventive strategies of tourism crime in China's small and medium-sized cities,International Conference on Information Science and Technology,0,https://doi.org/10.1109/icist.2011.5765286,https://api.labs.crossref.org/works/https://doi.org/10.1109/icist.2011.5765286?mailto=christian.hauschke@tib.eu,2011,article,True,0,Fuzzy Class Membership Modeling in Environmental Sciences,Physical Sciences,Ecological Modeling,,False,en,Environmental Science,Retraction
https://openalex.org/W2145041218,Notice of Retraction Least-square solutions of the linear matrix equation over symmetric orthogonal symmetric matrices,,0,https://doi.org/10.1109/icmlc.2011.6016823,https://api.labs.crossref.org/works/https://doi.org/10.1109/icmlc.2011.6016823?mailto=christian.hauschke@tib.eu,2011,article,True,0,Matrix Algorithms and Iterative Methods,Physical Sciences,Computational Theory and Mathematics,,False,en,Computer Science,Retraction
https://openalex.org/W2145385238,Notice of Retraction: An economics analysis on non-sustainability of trade activity and environmental protection,,0,https://doi.org/10.1109/icebeg.2011.5876669,https://api.labs.crossref.org/works/https://doi.org/10.1109/icebeg.2011.5876669?mailto=christian.hauschke@tib.eu,2011,article,True,0,Impact of International Trade on Productivity and Growth,Social Sciences,"General Economics, Econometrics and Finance",,False,en,"Economics, Econometrics and Finance",Retraction
https://openalex.org/W2145403099,Notice of Retraction: Restrictive mechanism improvement of accounting professional judgment,,0,https://doi.org/10.1109/icbmei.2011.5920363,https://api.labs.crossref.org/works/https://doi.org/10.1109/icbmei.2011.5920363?mailto=christian.hauschke@tib.eu,2011,article,True,0,Financial Reporting and Earnings Management,Social Sciences,Accounting,,False,en,"Business, Management and Accounting",Retraction
https://openalex.org/W2145597703,Notice of Retraction: An empirical study on the innovation performance of national hi-tech zones in Central China,,0,https://doi.org/10.1109/icpim.2011.5983589,https://api.labs.crossref.org/works/https://doi.org/10.1109/icpim.2011.5983589?mailto=christian.hauschke@tib.eu,2011,article,True,0,Knowledge Management and Organizational Innovation,Social Sciences,Strategy and Management,,False,en,"Business, Management and Accounting",Retraction
https://openalex.org/W2145863358,"Notice of Retraction: FDI, education, urbanization and urban-rural income GAP in central China",,0,https://doi.org/10.1109/icbmei.2011.5917850,https://api.labs.crossref.org/works/https://doi.org/10.1109/icbmei.2011.5917850?mailto=christian.hauschke@tib.eu,2011,article,True,0,Immigrant Entrepreneurship in Advanced Economies,Social Sciences,Sociology and Political Science,,False,en,Social Sciences,Retraction
https://openalex.org/W2146137926,Therapeutic potential of genes in cardiac repair,Expert Review of Cardiovascular Therapy,0,https://doi.org/10.1586/14779072.2013.814867,https://api.labs.crossref.org/works/https://doi.org/10.1586/14779072.2013.814867?mailto=christian.hauschke@tib.eu,2013,article,True,0,Clustered Regularly Interspaced Short Palindromic Repeats and CRISPR-associated proteins,Life Sciences,Molecular Biology,Taylor & Francis,False,en,"Biochemistry, Genetics and Molecular Biology",Retraction
https://openalex.org/W2146265441,Notice of Retraction: Comprehensive assessment on biodiversity conservation efficiency to Horse Mountain Village Natural Reserve based on “Agreement Protection” mode,,0,https://doi.org/10.1109/icebeg.2011.5882109,https://api.labs.crossref.org/works/https://doi.org/10.1109/icebeg.2011.5882109?mailto=christian.hauschke@tib.eu,2011,article,True,0,Wildlife Ecology and Conservation Biology,Physical Sciences,Ecology,,False,en,Environmental Science,Retraction
https://openalex.org/W2146271117,Notice of Retraction: Evaluation of Rn-Safe around a Uranium Company in Southern China,,0,https://doi.org/10.1109/icbbe.2011.5781643,https://api.labs.crossref.org/works/https://doi.org/10.1109/icbbe.2011.5781643?mailto=christian.hauschke@tib.eu,2011,article,True,0,Sources and Effects of Ionizing Radiation on Human Health,Health Sciences,Radiological and Ultrasound Technology,,False,en,Health Professions,Retraction
https://openalex.org/W2146523184,Notice of Retraction: Temporomandibular Disorders Treatment by Relaxation Splint and Removable Partial Denture: A Case Report,,0,https://doi.org/10.1109/icbbe.2011.5780364,https://api.labs.crossref.org/works/https://doi.org/10.1109/icbbe.2011.5780364?mailto=christian.hauschke@tib.eu,2011,article,True,0,Diagnosis and Management of Temporomandibular Disorders,Health Sciences,Complementary and Manual Therapy,,False,en,Health Professions,Retraction
https://openalex.org/W2146615784,"Retracted: Internal Migration, Mobility, and Exclusion in Urban India: An Examination",Poverty & Public Policy,0,https://doi.org/10.1002/pop4.48,https://api.labs.crossref.org/works/https://doi.org/10.1002/pop4.48?mailto=christian.hauschke@tib.eu,2013,article,True,0,Challenges of Urban Poverty and Development,Social Sciences,Urban Studies,Wiley-Blackwell,False,en,Social Sciences,Retraction
https://openalex.org/W2146835263,Notice of Retraction: An application of theory of constraints and total quality management to investigate technical problems of knowledge sharing of virtual communities,,0,https://doi.org/10.1109/icebeg.2011.5881274,https://api.labs.crossref.org/works/https://doi.org/10.1109/icebeg.2011.5881274?mailto=christian.hauschke@tib.eu,2011,article,True,0,Collaborative Networks in Manufacturing and Organizations,Social Sciences,Management of Technology and Innovation,,False,en,"Business, Management and Accounting",Retraction
https://openalex.org/W2147257578,Notice of Retraction: The study on the China's ability of undertaking the international transfer of the service,,0,https://doi.org/10.1109/icebeg.2011.5882266,https://api.labs.crossref.org/works/https://doi.org/10.1109/icebeg.2011.5882266?mailto=christian.hauschke@tib.eu,2011,article,True,0,Drivers and Impediments for Cross-Border E-Commerce,Social Sciences,Business and International Management,,False,en,"Business, Management and Accounting",Retraction
https://openalex.org/W2147574759,Notice of Retraction: Teaching and Practice Based on Three-Dimensional Modeling Technology of Autodesk Inventor,,0,https://doi.org/10.1109/paccs.2011.5990097,https://api.labs.crossref.org/works/https://doi.org/10.1109/paccs.2011.5990097?mailto=christian.hauschke@tib.eu,2011,article,True,0,Design for Manufacture and Assembly in Manufacturing,Physical Sciences,Industrial and Manufacturing Engineering,,False,en,Engineering,Retraction
https://openalex.org/W2147582505,Notice of Retraction: Study on the comprehensive assessment index system of urban logistics system,,0,https://doi.org/10.1109/icebeg.2011.5882455,https://api.labs.crossref.org/works/https://doi.org/10.1109/icebeg.2011.5882455?mailto=christian.hauschke@tib.eu,2011,article,True,0,Comprehensive Assessment of Safety in Energy and Infrastructure,Physical Sciences,"Safety, Risk, Reliability and Quality",,False,en,Engineering,Retraction
https://openalex.org/W2147759723,Notice of Retraction: The risk control of public works contract compliance in Taiwan — The thought construction industry should be considered,,0,https://doi.org/10.1109/cecnet.2011.5769335,https://api.labs.crossref.org/works/https://doi.org/10.1109/cecnet.2011.5769335?mailto=christian.hauschke@tib.eu,2011,article,True,0,Success Factors in Project Management,Social Sciences,Management Science and Operations Research,,False,en,Decision Sciences,Retraction
https://openalex.org/W2148069763,Notice of Retraction: Rural Community health service organization capability evaluation and analysis,,0,https://doi.org/10.1109/icebeg.2011.5882007,https://api.labs.crossref.org/works/https://doi.org/10.1109/icebeg.2011.5882007?mailto=christian.hauschke@tib.eu,2011,article,True,0,Challenges and Solutions in Rural Health Workforce,Health Sciences,Emergency Medical Services,,False,en,Health Professions,Retraction
https://openalex.org/W2148140050,RETRACTED CHAPTER: The Entrepreneurship and the Role of Indigenous Communities,Springer eBooks,0,https://doi.org/10.1007/978-94-007-1113-6_2,https://api.labs.crossref.org/works/https://doi.org/10.1007/978-94-007-1113-6_2?mailto=christian.hauschke@tib.eu,2011,book-chapter,True,0,Frugal Innovation in Emerging Markets,Social Sciences,Business and International Management,Springer Nature,False,en,"Business, Management and Accounting",Retraction
https://openalex.org/W2148148898,Notice of Retraction Study on building GIS for civil air defense database based on ArcSDE,,0,https://doi.org/10.1109/iceceng.2011.6057559,https://api.labs.crossref.org/works/https://doi.org/10.1109/iceceng.2011.6057559?mailto=christian.hauschke@tib.eu,2011,article,True,0,Simulation and Optimization of Industrial Processes,Physical Sciences,Control and Systems Engineering,,False,en,Engineering,Retraction
https://openalex.org/W2148582810,RETRACTED ARTICLE: Mikroneurovaskuläre Gesichtsreanimation über den N. massetericus,Der Nervenarzt,0,https://doi.org/10.1007/s00115-011-3300-0,https://api.labs.crossref.org/works/https://doi.org/10.1007/s00115-011-3300-0?mailto=christian.hauschke@tib.eu,2011,article,True,0,Diagnosis and Management of Facial Paralysis,Health Sciences,Neurology,Springer Science+Business Media,False,de,Medicine,Retraction
https://openalex.org/W2149018345,Notice of Retraction: The study of saltwater pearls industry's development strategies in the context of the global value chains extension,,0,https://doi.org/10.1109/icsess.2011.5982323,https://api.labs.crossref.org/works/https://doi.org/10.1109/icsess.2011.5982323?mailto=christian.hauschke@tib.eu,2011,article,True,0,Concept and Measurement of Regional Competitiveness,Social Sciences,Strategy and Management,,False,en,"Business, Management and Accounting",Retraction
